,url,title,location,price,post date,category,manufacturer,caliber,action,firearm type,postcontent
523,http://www.armslist.com/posts/6221523,"For Sale:  FOR SALE...Glock 17 Gen 3 with factory nite sights, NIB","Henderson, Las Vegas, Nevada",$ 550,"Listed On: Thursday, December 15, 2016",Handguns,Glock                                                                                ,9mm Luger (9x19)                                                                                ,Striker Fire                                                                                ,Pistol,"For sale only, no trades wanted.  This is a brand new Glock 17 Gen 3 in 9mm that has the factory installed Glock nite sights.  It comes in the factory box complete with all paperwork, mag loader, cleaning rod & brush, factory test fire casing, gun lock, and will come with (2) Glock factory hi cap 17 round mags (I forgot to include them in the pics).  This was only test fired at the factory and was never fired by me.I can meet for a face-to-face sale in Henderson near the 215 and Eastern Ave.  Cash onlyI will only sell to a legal Nevada resident over 21.  I must see that you have a valid Nevada ID and are over 21.  We must both sign a bill of sale and each will keep a copy."
525,http://www.armslist.com/posts/6221525,For Sale/Trade:  Beretta 92FS,"Vass, Fayetteville, North Carolina",$ 450,"Listed On: Thursday, February 16, 2017",Handguns,Beretta USA                                                                                ,9mm Luger (9x19)                                                                                ,Double / Single Action                                                                                ,Pistol,"Straight frame 92FS. This was my 3-Gun pistol, but no time to play these days. Bought used, and I put 5k rounds through it. Has wear on edges, rails, and on barrel. Not a safe queen. Replaced springs recently, and still accurate as day one. Added D spring, Elite 2 hammer, TCU trigger spring, steel trigger, and Hogue panels. Always have used grease on rails.Comes with Beretta hard case and 4 magazines. Located near Southern Pines. Buyer will need valid NCDL and either copy of valid NC CCH or original pistol permit for me to retain. NO EXCEPTIONS"
526,http://www.armslist.com/posts/6221526,For Sale:  HK p30 sk v1 lite lem,"Boca Raton, Palm Beach, South Florida",FREE,"Listed On: Thursday, December 15, 2016",Handguns,Heckler & Koch                                                                                ,9mm Luger (9x19)                                                                                ,Double Action                                                                                ,Pistol,"have an hk p30sk v1 lite lem trigger.  gun is like new.  comes with. - box, manual, lock etc. - 3 magazines - iwb kydex holster $600 cash may trade for other hks mostly usp. Call or text Jon at REDACTED.  thanks. H&k, sig Sauer, Glock, s&w M&P, fns, fnx, colt, spikes, rock river, magpul, springfield, 1911, kimber, walther, dpms, Glock, cz, arsenal, century arms, ruger, Anderson"
527,http://www.armslist.com/posts/6221527,For Sale:  Taurus OSS 24/7 Longslide .40,"Niceville, Okaloosa County, Florida",$ 500,"Listed On: Thursday, December 15, 2016",Handguns,Taurus                                                                                ,40 cal                                                                                ,Double / Single Action                                                                                ,Pistol,"Picked up two of these, one in .40 and one in .45. Prefer the 45 simply because of ammo standardization so selling the .40. I put just under 400 rounds through it. Comes with orginal case, warranty card, manual, lock, and two magazines. At 60' groups under 2"" in my hands. Only had a few boxes through it, but in that time no issues. IE FTF, FTE, Jams. I am not sure where market is on these, but gunbroker has these usually going around $550, so asking $500. If you have any questions feel free to ask."
528,http://www.armslist.com/posts/6221528,For Sale/Trade:  Bcm ar15 m4,"Arnold, St. Louis, Missouri","$ 1,000","Listed On: Thursday, December 15, 2016",Rifles,Taurus                                                                                ,40 cal                                                                                ,Double / Single Action                                                                                ,Rifle,Ar 15 m4 bcm complete upper mid length with mid west quad rail battle born milit lower come with everthing in pic flip up bcm rear sight utg 3-9x40 scope and quick release mount one 30 rd mag
531,http://www.armslist.com/posts/6221531,For Sale/Trade:  Custom AR Pistol,"Boca Raton, Palm Beach, South Florida",$ 0,"Listed On: Friday, December 23, 2016",Handguns,no type,223/5.56 NATO                                                                                ,no type,Pistol,"Have a very nice AR pistol build up for sale.  shoots great and very accurate. Chambered 556/223 Anderson lower Rainer upper spikes lower parts kit keymod rail anti walk hammer and trigger pins palmetto barrel 1-7 twisst (very accurate) HK flip sights Red dot sight strike industry extended charging handle. PSA bcg 3 prong flash hider avg magpul grip Troy magazine Have alot invested in it.  Asking $850.  may trade for hk pistols or other pistols plus cash but cash is king. Call or text Jon at REDACTED.  Thanks. H&k, sig Sauer, Glock, s&w M&P, fns, fnx, colt, spikes, rock river, magpul, springfield, 1911, kimber, walther, dpms, Glock, cz, arsenal, century arms, ruger, Anderson"
532,http://www.armslist.com/posts/6221532,Want To Buy:  Sig p320 9mm Sub-compact/Compact,"Maryville/Knoxville, Knoxville, Tennessee",$ 500,"Listed On: Thursday, December 15, 2016",Handguns,Sig Sauer                                                                                ,9mm Luger (9x19)                                                                                ,no type,Pistol,Looking for a sub compact or compact Sig p320 in 9mm. Have cash in hand
533,http://www.armslist.com/posts/6221533,For Sale:  Kriss Vector SDP Gen 2 45acp,"Riverside, Inland Empire, California","$ 3,000","Listed On: Thursday, December 15, 2016",Handguns,KRISS/Sphinx                                                                                ,45 ACP                                                                                ,Striker Fire                                                                                ,Pistol,"This is a never fired,in original case with paperwork, Raddlock bullet button cover installed (so PPT eligible) Kriss Vector SDP chambered in 45acp with collapsible pistol brace. The Raddlock magazine release tool and one 10 round mag is included. $3000 or best offer. After December 21st you cannot buy these, even via PPT. No trade offers please."
534,http://www.armslist.com/posts/6221534,For Sale:  Beretta Neos,"38652, North East Mississippi, Mississippi",$ 200,"Listed On: Thursday, December 15, 2016",Handguns,Beretta USA                                                                                ,22 Long Rifle                                                                                ,Striker Fire                                                                                ,Pistol,"This is a one owner pistol and has had around 500 rounds through it - 22 LR  Beretta Neos with case, spare mag,  and 2 boxes of ammo - Price is $200 and you may email me."
536,http://www.armslist.com/posts/6221536,For Sale:  Sig Sauer P232 .380,"Wichita, East side, Wichita, Kansas",$ 900,"Listed On: Tuesday, January 24, 2017",Handguns,Sig Sauer                                                                                ,380 ACP                                                                                ,Double Action                                                                                ,Pistol,"Sig Sauer P232 380 Used but less than 50 rnds down the pipePerfect conceal and carry pistol This is NOT a cheap gun and asking price will reflect that.Pistol is in perfect shape and comes with a crimson trace laser grip.Grip alone was around $300You get the pistol , box wth manual, 2 mags and around 400 rounds of .380 fmj ammoText 316/644/8626 will get back with you as soon as possibleMore pictures upon request via phone Around $1200 invested asking $900NO CHECKS. FTF PICK UP. CASH ONLY"
537,http://www.armslist.com/posts/6221537,For Sale:  Sig Sauer oem Siglite night sights,"NW, Houston, Texas",$ 40,"Listed On: Thursday, December 15, 2016",Optics,Sig Sauer                                                                                ,380 ACP                                                                                ,Double Action                                                                                ,Pistol,Professionally removed Sig Suaer Sig lite night sights from new firearms (2015/2016 models). I have (2) sets of 6/8 and (1) set of 8/8. $40 each. Thanks.Fred817-714-398 two
538,http://www.armslist.com/posts/6221538,For Sale:  223/556 ammo for sale,"Potterville, Lansing, Michigan",$ 900,"Listed On: Thursday, December 15, 2016",Ammo,Sig Sauer                                                                                ,380 ACP                                                                                ,Double Action                                                                                ,Pistol,"500 rds 223 Rem 62g SS109Freedom Munitions reman (brass)875 rds 223 Rem 55g PSPFiocchi new (brass)117 rds 556 XM193 55g FMJAmerican Eagle new (brass)886 rds 556 XM855 62g green tipAmerican Eagle new (brass)66 rds 223 Rem 55g FMJTracer orange tip new (brass)45 rds 223 Rem 69g HPBTFreedom Munitions new (brass)44 rds 223 Rem 60g V-MaxFreedom Munitions new (brass)13 rds 223 Win 70g HPBTFreedom Munitions new (nickel)Overall total = 2,546 roundsI sold my AR-15 so I have no need for this ammo. I'm asking $900 for all of it but I will sell them separately If needed. Let me know if you want seperate pricing for anything specific."
540,http://www.armslist.com/posts/6221540,For Sale:  Sig Sauer oem Siglite night sights,"NE, Houston, Texas",$ 40,"Listed On: Thursday, December 15, 2016",Optics,no type,no type,no type,no type,Professionally removed Sig Suaer Sig lite night sights from new firearms (2015/2016 models). I have (2) sets of 6/8 and (1) set of 8/8. $40 each. Thanks.
542,http://www.armslist.com/posts/6221542,For Sale:  Taurus PT92 9MM,"Medford, Medford, Oregon",$ 450,"Listed On: Thursday, December 15, 2016",Handguns,Taurus                                                                                ,9mm Luger (9x19),no type,no type,"Taurus PT 92 CS 9mm for sale, including case & two 12 round magazines. Only used twice since I bought it, still new condition just needs to be cleaned."
543,http://www.armslist.com/posts/6221543,For Sale:  PREBAN AR15 MAGAZINES 20rds and 30rds CHEAPER THEN ANYONE ON HERE OR GUN SHOPS!!,"Ludlow, Massachusetts, United States",$ 15,"Listed On: Thursday, June 22, 2017",Magazines,Taurus                                                                                ,9mm Luger (9x19),no type,no type,"I have 20rd and 30rd magazines for cheap! $15 for the 20rd magazines, $20 for the 30rd magazines (mixture of non dated and internal dated).  If you want to pick out certain ones it will be $25ea instead.  You can have the magazines shipped to you (reasonable shipping fee or free shipping if you buy 10 or more)or you can meet me in ludlow, MA. I aceept, paypal, money orders and also cash.  I DO NOT DO BULK DEALS,  THIS IS ALREADY A GREAT DEAL AND PROBABLY THE BEST YOU WILL FIND IN MASS.  I HAVE COLT 20RD MAGS UP FOR SALE FOR 20EA.  All of the magazines are in pretty good condition, some have a little more wear then others BUT I WONT PICK AND CHOOSE."
544,http://www.armslist.com/posts/6221544,For Sale:  Wanted to buy Colt Frontier Scout,"rural rochester, mn, Rochester, MN, Minnesota",FREE,"Listed On: Saturday, March 11, 2017",Handguns,Colt                                                                                ,22 Long Rifle                                                                                ,Single Action                                                                                ,Revolver,Looking to purchase a Colt Frontier Scout 22 cal. revolver. Will pay CASH and have a valid Minnesota Permit to Purchase and a picture ID
545,http://www.armslist.com/posts/6221545,For Sale:  Heritage Rough Rider .22lr *Like New* $100,"Columbus, Columbus, Ohio",$ 100,"Listed On: Thursday, December 15, 2016",Handguns,Heritage Manufacturer                                                                                ,22 Long Rifle                                                                                ,Single Action                                                                                ,Revolver,"I've got a rough rider revolver I bought earlier this fall that I've only shot about 20 times. Great shooter, and a tack driver. Don't want to let it go but I need money for the holidays.  $100 FIRMText Ed at six-one-four 738 six-2-six-4"
546,http://www.armslist.com/posts/6221546,For Sale/Trade:  LG G5 $549 SMARTPHONE FOR XDS,"st matthews, Louisville, Kentucky",$ 400,"Listed On: Thursday, December 15, 2016",Handguns,Heritage Manufacturer                                                                                ,22 Long Rifle                                                                                ,Single Action                                                                                ,Revolver,"HELLO id like to trade my 3 month old smartphone for an xds any caliber. can add some cash as well. the phone is paid off and only really used for a month, retails now for 499 everywhere. great device just sitting and collecting dust. you can google photos of the phone i will post some when i get the chance. my cell is REDACTED Thanks and happy Hollidays. i am local (louisvlle) can travel as far as lexington"
547,http://www.armslist.com/posts/6221547,Want To Buy:  WANT TO BUY MOST FIREARMS,"SOUTH, Myrtle Beach, South Carolina",$ 555,"Listed On: Thursday, December 15, 2016",Handguns,Heritage Manufacturer                                                                                ,22 Long Rifle                                                                                ,Single Action                                                                                ,Revolver,"WANT TO BUY MOST FIREARMS,PRICE DEPENDS ON CONDITION AND MODEL"
550,http://www.armslist.com/posts/6221550,For Sale:  AR-15,"Anderson, Cincinnati, Ohio","$ 1,200","Listed On: Thursday, December 15, 2016",Rifles,Smith & Wesson                                                                                ,5.56×45mm NATO                                                                                ,Semi-automatic                                                                                ,Rifle,"AR-15 smith&Wesson with scope, green dot laser , nice railand 800 rounds of ammo. Went to range twice and fired maybe 200 rounds. Bought in July 2016 practically new"
551,http://www.armslist.com/posts/6221551,For Sale:  Kel-Tec PF9,"Oklahoma City, Oklahoma City, Oklahoma",$ 300,"Listed On: Wednesday, March 29, 2017",Handguns,Kel-Tec                                                                                ,9mm Luger (9x19)                                                                                ,Striker Fire                                                                                ,Pistol,"Kel-Tec pf9 Desert Tan. Hard to find color.  Not the lighter tan.9mm holds 7+1..2mags, one with grip extension and one new in package. Original box, manual & tools.405/403/7655 txt please"
552,http://www.armslist.com/posts/6221552,For Sale:  ATI 1911 - 22lr,"NE Grand Rapids, Grand Rapids, Michigan",$ 250,"Listed On: Thursday, December 15, 2016",Handguns,American Tactical Imports                                                                                ,22 Long Rifle                                                                                ,Single Action                                                                                ,Pistol,"ATI 1911 - 22lr : GSG/Sig SauerGreat shape, less than 500 rounds through it.  Includes a hard case, fobus paddle holster and one 10 round magazine.  Must have CPL, or purchase permit."
553,http://www.armslist.com/posts/6221553,For Sale:  .22 mag CCI mini mag 200 round,"redmond, Bend, Oregon",$ 13,"Listed On: Thursday, December 15, 2016",Ammo,American Tactical Imports                                                                                ,22 Long Rifle                                                                                ,Single Action                                                                                ,Pistol,"I have 200 rounds of 30 gr  CCI maximag 22 mag ammo. I bought a Marlin 22 mag never shot it then bought a salvage 17 hmr for $125 on black Friday. Think I will keep it instead of 22 mag 5 .22 cal seems excessive lolI bought ammo at bimart recently for 12.97 a box impossible to find will sell for $13 a box or $50 for all four. Will also consider selling Marlin 22 mag bolt action for $200 neighbor is an ffl. Gun has never been shot, box paperwork 4 and 7 round mags included."
554,http://www.armslist.com/posts/6221554,For Sale:  ATI Mosin Nagant,"Evansville, Evansville, Indiana",$ 300,"Listed On: Thursday, December 29, 2016",Rifles,American Tactical Imports                                                                                ,7.62x54R                                                                                ,Bolt Action                                                                                ,Rifle,"This is a very nice Mosin nagant sporter. The barrel has been modified and crowned, it has a bent bolt, sling, scope mount with scope. It was built from a Izzy and has a very smooth action. It would make a great deer gun. I am only asking $300 which is far less then what it would cost to build. If you have any questions, want more pics or would like to make an offer please contact me at REDACTED. Trades I would be interested are any working mosin nagant stocks, all parts mainly complete bolts, also a m91 full stock and hardware.  My name is Zac, Thanks!"
555,http://www.armslist.com/posts/6221555,For Sale:  H&K USP .40 V1 Decocker & Safety Night Sights,"SE Harmony Rd, Fort Collins, Colorado",$ 650,"Listed On: Saturday, March 11, 2017",Handguns,Heckler & Koch                                                                                ,40 S&W                                                                                ,Double / Single Action                                                                                ,Pistol,"For some reason, my text wont work.So im keeping this short.USP V1.40Night sights 3/4 or so1 13 Round Mag (Extras $20 OEM Mags)200-300 Rounds ?? Maybe not more than that thoughWe both need a new GF for the new year, you want an USP and I want a .308 rifle.Possabile trades I might consider, high caliber long guns AR10, .223 & .308 Rifles and etc!!"
556,http://www.armslist.com/posts/6221556,For Sale:  Russian Tiger Dragunov SVD,"Columbus, Ohio, United States","$ 5,750","Listed On: Thursday, December 15, 2016",Rifles,Heckler & Koch                                                                                ,7.62x54R                                                                                ,Semi-automatic                                                                                ,Rifle,"Manufacturer Izhmash Model Dragunov Tiger SVD Caliber 7.62x54R Barrel Length 21 inch Capacity10 new in box.The stock has been upgraded to the original Russian SVD Wood Stock set. Comes with all of the original factory accessories,10 round magazine plus 5 round and SVD flash suppressor. Must ship to FFL if not local."
558,http://www.armslist.com/posts/6221558,For Sale:  .38 Special Ammo For Sale,"Sequim/Port Angeles, Olympic Peninsula, Washington",$ 125,"Listed On: Thursday, December 15, 2016",Ammo,no type,no type,no type,no type,"Got some boxes of .38 Special for sale2 boxes of 50 Magtech 158gr. FMC Flat  2 boxes of 50 Remington 110gr. SJHP2 boxes of 50 Blazer 158gr. LRN1 box of 50 Winchester 38SBLP blanks1 box of 20 Federal Personal Defense 110gr. Hydro Shok JHPAbout $200.00 worth of ammo, will sell for $125.00 cash, adult, face to face deal, we can meet in Sequim/Port Angeles. Thanks, and Merry Christmas!"
560,http://www.armslist.com/posts/6221560,For Sale:  QuarterCircle10 GLOCK AR Pistol Lower!!!!!!,"Rosedale, Bakersfield, California","$ 1,000","Listed On: Thursday, December 15, 2016",Handguns,Glock                                                                                ,9mm Luger (9x19),no type,no type,"I have a QuarterCircle10 AR PISTOL lower that takes glock magazines. It can be configured in 9mm, 40SW, or .357 SIG!!! The lower was DROSed as a PISTOL don't miss out on this before th AW ban!!! Will not travel! Transfer will be done at FFL of my choice, buyer must pay transfer fees. Last day of transfer will be the 21st to make it by the AW deadline. No trades!! Buyer must be able to pass background check!!!"
561,http://www.armslist.com/posts/6221561,For Sale:  1998 Honda Shadow ACE,"University City, St. Louis, Missouri","$ 2,100","Listed On: Tuesday, May 9, 2017",Vehicles,Glock                                                                                ,9mm Luger (9x19),no type,no type,"1998 Honda Shadow ACE VT750CDC Clean Title in hand. Bought the bike at the beginning of summer 2016. Rode the bike a handful of times. Was well kept up on maintenance and cleaning.750 cc, 5 Speed Green and white paint job, Saddle bags.New battery as of Aug 2016I have a manual, windscreen and sissy bar, not installed. OBO. All reasonable offers consideredFace to face. Call, text, or message me if you're interested. My phone number is REDACTED. I will remove this ad once sold."
562,http://www.armslist.com/posts/6221562,"For Sale:  Custom AR-15, Tons of Accessories OBO!","San Diego, San Diego, California",$ 900,"Listed On: Saturday, April 8, 2017",Rifles,LWRC International                                                                                ,223/5.56 NATO                                                                                ,Semi-automatic                                                                                ,Rifle,"Working on paying some student loans, so I'm selling a custom AR-15 I had made for me last year. Only had about 200 - 300 rounds put into it, but fires like a dream. 18"" barrel, a VLTOR moduler upper, fantastic L.A.R. AR15 lower. In phenomenal condition, and is 100% CA compliant and registered to me. Also comes with:- Folding bipod- Magpul STR adjustable stock with storage compartments- Two (2) 10-round CA compliant magazines (one is a modified 30-round)- Magpul MBUS flip-up front and rear sights- Barrel lock with key- Tool for magazine release (CA compliant)- 2-point adjustable sling- (8) snapcapsPlease email me with any questions, for more pictures or for payment information. Might consider trades. Originally bought for $1400, put about $300 of custom gear into it. Asking $900 OBO. Buyer pays transfer fees."
563,http://www.armslist.com/posts/6221563,For Sale/Trade:  S&w m&p shield 9 w/extras,"Boca raton, Palm Beach, South Florida",$ 0,"Listed On: Thursday, December 15, 2016",Handguns,Smith & Wesson                                                                                ,9mm Luger (9x19)                                                                                ,Striker Fire                                                                                ,Pistol,"Have a like new sheild w/ thumb safety. Great ccw piece and shooter but I prefer double stacks and full size guns so I want to trade. comes with Original box etc 2 8rd magazines, 1 7rd magazine (only comes with 2 from factory) sticky holster ankle holster open to various handgun trades. Glocks, 1911 like springfield GI or rock island etc, cz, Hk vp9, Hk usp any caliber, hk p2000sk 40 or 9, fns, fnx, sig p320, other sig hammer fired guns (no p250), etc etc. check my other listings also if you want to work out a deal. call or text Jon at REDACTED. Thanks. H&k, sig Sauer, Glock, s&w M&P, fns, fnx, colt, spikes, rock river, magpul, springfield, 1911, kimber, walther, dpms, Glock, cz, arsenal, century arms, ruger, Anderson"
565,http://www.armslist.com/posts/6221565,For Sale:  Surefire flashlight,"SW OKC, Oklahoma City, Oklahoma",$ 290,"Listed On: Thursday, December 15, 2016",Tactical,no type,no type,no type,no type,Surefire M3LT LED Flashlight Ultra High Dual output                                     New in Box $290.00                                Call REDACTED
566,http://www.armslist.com/posts/6221566,Want To Buy:  WTB Ruger 10/22,"western burbs, Chicago, Illinois",Offer,"Listed On: Monday, January 16, 2017",Rifles,Ruger                                                                                ,22 Long Rifle                                                                                ,Semi-automatic,no type,i'm looking for a cheap 10/22 or a 10/22 receiver set. let me know what you have!
