,url,title,location,price,post date,category,manufacturer,caliber,action,firearm type,postcontent
715,http://www.armslist.com/posts/6205715,For Sale/Trade:  Glock 29,"Littleton, Denver, Colorado",$ 475,"Listed On: Saturday, December 10, 2016",Handguns,Glock                                                                                ,223/5.56 NATO                                                                                ,Striker Fire                                                                                ,Pistol,"Glock 29 with two 10 round mags.  Shows some slight signs of carry on the slide, but is otherwise in good shape. Has night sights but they are old and getting dim, although still bright enough to easily be seen.  $475, must meet at FFL for transfer, buyer pays fees."
716,http://www.armslist.com/posts/6205716,For Sale:  Bullpup Norinco SKS Shernic Gunworks,"Federal Way, Seattle, Washington",$ 700,"Listed On: Thursday, December 15, 2016",Rifles,Norinco                                                                                ,7.62x39                                                                                ,Semi-automatic                                                                                ,Rifle,"I am selling my Norinco SKS that i have converted into the Shernic Gunworks Bullpup design. I have personally owned this rifle since day 1, over 20 years now. The orginal stock was plastic and not doing so well and I converted the rifle over. I still have all of the original accesories, internal 10rd mag and stock. The bullpup rifle comes with M4 carry handle, mapgul front sight and front grip, laser and 2 tapco 20rd mags, couple hundred rds of ammo too. email with questions. Thanks"
717,http://www.armslist.com/posts/6205717,For Sale:  I/O AK-47,"West Columbia, Columbia, South Carolina",$ 525,"Listed On: Saturday, December 10, 2016",Rifles,IO Inc                                                                                ,7.62x39                                                                                ,Semi-automatic                                                                                ,Rifle,"This is an Inter Ordenance AKM 247 model AK-47 chambered in the iconic 7.62x39.  This is an all American made AK from their plant in Florida.  It has fired less than 200 rds and still looks like it did out of the box! I have added a hogue grip and for end, which has a rail on it.  This is one smooth shooting AK, and makes for a fun day at the range. I still have the original box and what came in it. It is pictured with a Bushnell trs-25 red dot, which can be had for an additional $50. I got the Optic for this rifle specifically and it is in the same condition as the rifle, near perfect.  Asking $525 for the rifle. Not really looking for trades, as I am trying to clear out some room in my safe. If interested just respond the this add and I'll get back to you as soon as I can.  Thanks for looking!"
719,http://www.armslist.com/posts/6205719,For Sale/Trade:  AA TACTICAL:  TAC-L 5.56 MFT MINIMALIST AR15,"Milton, FL, Pensacola, Florida",$ 900,"Listed On: Saturday, December 10, 2016",Rifles,no type,300 Blackout (7.62x35mm)                                                                                ,Semi-automatic                                                                                ,Rifle,"For Sale or possible trade is an AA Tactical Ar-15-MFT Minimalist, 300AAC.  I got this in trade a while ago and just don't have use for the caliber.  I don't know a whole lot about the manufacturer but all of the specs can be found at aatacticalffl.com, the title of the post is exactly the model being offered in this sale.  The rifle MSRPs at $1,269.99 currently and is box stock plus Magpul flip-up sites, Magpul BAD lever and Lucid HD-7 digital site.  This is a very lightweight and well balanced firearm, it has a very nice and clean trigger and appears to have been fired very little.  It has zero flaws cosmetically, in the bore or action and the bolt appears brand new visually.  It includes everything pictuered as well as a hard case, 2 boxes of Winchester ammo and 1 Pmag.  This is a very nice AR platform and would make a very nice addition to most anyone's collection for Christmas.Price:     With Site..........$1,050     Without Site........$900"
720,http://www.armslist.com/posts/6205720,For Sale:  50 Beowulf with trigger job,"Colorado springs, Colorado Springs, Colorado",FREE,"Listed On: Friday, January 6, 2017",Rifles,no type,50 Beowulf                                                                                ,Semi-automatic                                                                                ,Rifle,"50 Beowulf up for trade frontier lower and radical arms upper. This is a nice unit to have to break into the 59 class with. Looking for trade offers, ar's sig mpx cz scorpion or whatever you have.  Not into ak's. long range optics also. Takes at mags but you have to trim the feed on the mag due to the size of round. Text for quicker response REDACTED"
721,http://www.armslist.com/posts/6205721,For Sale:  Parker Trojan SxS 12ga,"Huntsville, Huntsville, Alabama","$ 2,250","Listed On: Monday, February 27, 2017",Antique,no type,50 Beowulf                                                                                ,Semi-automatic                                                                                ,Rifle,Parker Trojan shotgun. SN 217xxx. Manufacture year 1926. 12 ga gun. Frame size 2. All matching serial numbers. All original. Stock has been retouched by a professional. Shotgun features extractors. Trojan steel barrel. One of the best looking Trojans around but it's not too much to take into the field or shoot trap. Hands down one of the smoothest best handing shotguns ever made. Happy to answer questions or send more pictures.
722,http://www.armslist.com/posts/6205722,For Sale:  Smith and Wesson .22LR,"Reno, Reno, Nevada",$ 375,"Listed On: Saturday, December 10, 2016",Handguns,Smith & Wesson                                                                                ,22 Long Rifle                                                                                ,Striker Fire                                                                                ,Pistol,"smith and Wesson M&p 22 full size handgun. Talon grips, ,comes with 5 12 round magazines. Shoots great with all kinds of ammo. Call me at REDACTED no trades $375"
723,http://www.armslist.com/posts/6205723,For Sale/Trade:  PSA M4 complete upper,"Cleveland, Chattanooga, Tennessee",$ 380,"Listed On: Saturday, December 10, 2016",Rifles,Palmetto State Armory                                                                                ,223/5.56 NATO                                                                                ,Semi-automatic                                                                                ,Rifle,"Palmetto State Armory M4 Premium complete upper with 16"" 5.56 NATO 1/7 CL barrel with full auto BCG and Charging Handle. Has a standard A2 muzzle break. Comes with 6.5"" XTS hand guard. Removable carry handle with rear sight and flat top for optics. Low round count. Asking $380 or $280 without BCG and CH or possible trades on .22 pistols or will add extras for Glock 43"
724,http://www.armslist.com/posts/6205724,For Sale:  Vintage Sears Roebuck Laurona Eibar SXS Side by Side Shotgun,"Grosse Pointe Park, Detroit, Michigan",$ 200,"Listed On: Thursday, December 15, 2016",Shotguns,Palmetto State Armory                                                                                ,12 Gauge                                                                                ,Side by Side                                                                                ,Shotgun,"Vintage Sears Roebuck Shotgun made by Laurona Eibar.The Gun is in very decent shape and it points well and shoots well.The barrel is 28 inches long.The gun shoots 2 3/4 shells.Price is $200 or best offer.I will bot ship the gun anywhere.  Only face to face transaction in Grosse Pointe area to buyers who are legally allowed to own firearms.If the ad is still up, it is still available for sale.Text or call REDACTED"
725,http://www.armslist.com/posts/6205725,For Sale:  Sig Sauer 556 carbine,"Humboldt, Jackson, Tennessee",$ 999,"Listed On: Saturday, December 17, 2016",Rifles,Sig Sauer                                                                                ,5.56×45mm NATO                                                                                ,Semi-automatic                                                                                ,Rifle,"Sig Sauer 556 piston AR with folding stock, SigSauer quad rail and Wilson combat folding sight. Includes original hard case. $999."
728,http://www.armslist.com/posts/6205728,For Sale/Trade:  Anderson AR-15 in 300 Blackout,"Ozark, Springfield, Missouri",$ 490,"Listed On: Tuesday, December 20, 2016",Rifles,CMMG                                                                                ,300 Blackout (7.62x35mm)                                                                                ,Semi-automatic                                                                                ,Rifle,"This Anderson 300 Blackout rifle is in excellent condition!  The rifle without the optic is $490, and it has a great free-float quadrail and a unique flash hider.  It is about 1 year old.The optic the picture has been sold, so only the rifle is for sale."
729,http://www.armslist.com/posts/6205729,For Sale:  Glock 30s,"Pascagoula, Mobile, Alabama",$ 475,"Listed On: Saturday, December 10, 2016",Handguns,Glock                                                                                ,45 ACP                                                                                ,Semi-automatic                                                                                ,Pistol,Glock 30s .45cal-trijicon night sites-2 10rd mags-1 30rd extended mag-speed loader-Blackhawk holster-cleaning suppliesNo trades. No shipping. REDACTED
730,http://www.armslist.com/posts/6205730,For Sale:  Stevens 12 gauge,"Manch, Manchester, New Hampshire",$ 450,"Listed On: Saturday, December 10, 2016",Shotguns,Savage Arms                                                                                ,12 Gauge                                                                                ,Over and Under                                                                                ,Shotgun,"stevens model 555 12 gauge over under with selector, bought it for my son and still loves his 20 gauge"
731,http://www.armslist.com/posts/6205731,For Sale/Trade:  Troy Defense Optics Ready Carbine,"Detroit, Detroit, Michigan",$ 750,"Listed On: Saturday, December 10, 2016",Rifles,Savage Arms                                                                                ,223/5.56 NATO                                                                                ,Semi-automatic                                                                                ,Rifle,basically new have 5 rounds thru it
732,http://www.armslist.com/posts/6205732,For Sale/Trade:  Leupold VX-2 3-9x40 w/ Leupold scope rings,"Falls Church, Northern Virginia, Virginia",$ 250,"Listed On: Saturday, December 10, 2016",Optics,Savage Arms                                                                                ,223/5.56 NATO                                                                                ,Semi-automatic                                                                                ,Rifle,For sale or trade is my Leupold VX2 scope with Leupold scope mounts. Bought new in September for an AR project that I scrapped. Excellent scope but I have no use for it currently. Open to trade offers. Thanks!Scope was $300 newRings were  $40 newAsking $250 cash or trade. Negotiable.
733,http://www.armslist.com/posts/6205733,For Sale/Trade:  BCM upper,"holly ridge, Jacksonville, North Carolina",$ 800,"Listed On: Saturday, December 10, 2016",Rifles,Bravo Company USA                                                                                ,223/5.56 NATO                                                                                ,Semi-automatic                                                                                ,Rifle,"I have a brand new 11.5 BCM upper with KMR Alpha handguard. Never fired. Looking to sell or trade. Will sell for $950 with everything, $800 without optic, or $630 with just upper without charging handle or BCG.11.5"" BCM upper w/ KMR Alpha HandguardBCM Ambi Charging handleMil-Spec BCGBlack Spider (Spikes Tactical) Red Dot Only trades I will consider are 14.5"" Pinned upper or 16"". Only looking for BCM upper or something of equal quality"
734,http://www.armslist.com/posts/6205734,For Sale:  Hand guard and accessories,"Houston, Houston, Texas",$ 150,"Listed On: Saturday, December 10, 2016",Gun,Bravo Company USA                                                                                ,223/5.56 NATO                                                                                ,Semi-automatic                                                                                ,Rifle,"selling one good condition hand guard along with the components to install, also one rail mount bipod and one strike industries red in color charging handleand one Nikon 223 scope, all in very good condition$150.00"
736,http://www.armslist.com/posts/6205736,For Sale/Trade:  eastern arms company 16 gauge double,"mountvernon,il, Southern Illinois, Illinois",$ 200,"Listed On: Saturday, December 10, 2016",Shotguns,no type,16 Gauge                                                                                ,Side by Side                                                                                ,Shotgun,eastern arms company 16 gauge double barrel double trigger shotgun. over six boxes of shells. 18.5 inch barrels
737,http://www.armslist.com/posts/6205737,For Sale/Trade:  Mini 14 ranch,"Auburn, Nebraska, United States",$ 600,"Listed On: Thursday, December 15, 2016",Rifles,Ruger                                                                                ,223/5.56 NATO                                                                                ,Semi-automatic                                                                                ,Rifle,"For sale is a mini 14 ranch rifle from the late 1980's. Wood, blued, very nice shape, comes with 1 ruger 20 round mag and 6 aftermarket 20 round mags. No scope rings. Please text 402 four one 4 eighteen 80 if interested."
738,http://www.armslist.com/posts/6205738,For Sale/Trade:  Kimber Custom II,"Tro, Charlottesville, Virginia",$ 0,"Listed On: Saturday, December 10, 2016",Handguns,Kimber                                                                                ,45 ACP                                                                                ,Single Action                                                                                ,Pistol,"I have a brand new still in the box with factory Kimber Custom II in .45 ACP with 7 round Kimber mag and Rose wood grips also purchased with the pistol was a hogue grip an extra 8 Rd mag a matching brown leather Banchi pancake holster a black Wilson Combat three port compensator. Of course being new cash is king no reasonable offer will be ignored. I am also interested in multiple gun trades, Sigs or carry size Glocks in 9 or .45 with cash. Let me know what you have. I can drive up to an hour for the right trade."
740,http://www.armslist.com/posts/6205740,For Sale/Trade:  Sig 226 elite enhanced,"Middlesex, Raleigh / Durham / CH, North Carolina","$ 1,200","Listed On: Friday, December 16, 2016",Handguns,Sig Sauer                                                                                ,9mm Luger (9x19)                                                                                ,no type,Pistol,"Sig 226r elite enhanced, night sights, srt trigger, black flag custom holster, 3-15 1-20 3-30 round mags  cash price is $1200 for everything cash price is pretty firm may be open to some trades if it's in my favor or maybe teade plus cash but only on nice guns no junk please all laws shall be followed cc/pp & license with signed bill of sale is a must"
741,http://www.armslist.com/posts/6205741,For Sale/Trade:  Browning Buckmark .22 LR,"South, Greensboro, North Carolina",$ 280,"Listed On: Saturday, July 1, 2017",Handguns,Browning                                                                                ,22 Long Rifle                                                                                ,Single Action                                                                                ,Pistol,"Browning Buckmark .22 LR Semi-auto pistol5.5"" bull barrel with adjustable target sightsOne 10-round factory magOriginal neoprene gripsGood condition.  Great trail or plinking gun.Price is $280 firm.  See trades.Pistol permit or active ccw required."
743,http://www.armslist.com/posts/6205743,For Sale:  AMT Automag II Stainless 22 Magnum Semi Automatic Pistol,"West Side, Indianapolis, Indiana",$ 650,"Listed On: Sunday, May 7, 2017",Handguns,Arcadia Machine and Tool                                                                                ,no type,no type,Pistol,"AMT Automag II Stainless 22 Magnum Semi Automatic PistolStainless Steel. 6"" barrell. Original box. Purchased new by my father. Stored in safe for many years. Unfired. .22 Magnum. Excellent condition. No trades please.Thanks,Joe"
744,http://www.armslist.com/posts/6205744,For Sale:  Slr 104fr,"Edmond, Oklahoma City, Oklahoma","$ 1,100","Listed On: Saturday, December 10, 2016",Rifles,Arcadia Machine and Tool                                                                                ,no type,no type,Rifle,"LNIB  Arsenal SLR 104FR.I got this from the original owner and who said it had never been fired. By the looks of the  bolt that appears to be the case. The rifle is in perfect condition. This rifle is straight, no  Canting  issues to worry about.  The rifle will come with 570 rounds of wolf classic  military ammo and everything that was included from the factory ,including the box. A low no haggle price of $1100.  Sorry No trades or offers. More pictures upon request ."
745,http://www.armslist.com/posts/6205745,For Trade:  Lnib Sig p290rs  whit sig laser 9mm,"Brandon, Tampa/St. Pete, Florida",Offer,"Listed On: Saturday, December 10, 2016",Handguns,Sig Sauer                                                                                ,9mm Luger (9x19)                                                                                ,no type,Pistol,"Only 50rd fired have sig night sight 2 mags one flush one extended,sig laser stainless steel guide rod and the factory plastic too ,and everything from factory .if you search for price make sure you put the laser and night sight this set is not the 400 dollar one .buds gunshop sale it for 725 the black one"
746,http://www.armslist.com/posts/6205746,For Sale/Trade:  Walter PPQ - 5 Magazines,"north burbs, Chicago, Illinois",$ 550,"Listed On: Saturday, December 17, 2016",Handguns,Walther                                                                                ,9mm Luger (9x19)                                                                                ,Striker Fire                                                                                ,Pistol,"I've got a Walther PPQ M2 with 5 mags.  Good shape, shoots great.  Has talon grips on it now, easy to remove if you don't want them.Mags run about 40 a piece, so 120 just in those extra.Just to help you, they are $530 on buds, so figure taxes and transfer - and your at $600looking for the following:P320 Compact, Glock 19 Gen 4, HK VP9, Commander size 1911, CZ Scorpion Carbine... and that's about it, but try me"
749,http://www.armslist.com/posts/6205749,For Sale/Trade:  HK P30S V3,"Kelso, Cape Girardeau, Missouri",$ 700,"Listed On: Saturday, December 10, 2016",Handguns,Heckler & Koch                                                                                ,40 S&W                                                                                ,Double / Single Action                                                                                ,Pistol,"I have a like new HK P30S in .40 S&W. has 50 rounds through it. Looks brand new. Comes with original hard case, 2 mags, and all the grip inserts."
750,http://www.armslist.com/posts/6205750,For Trade:  Sig sauer and Anderson arms AR 2 for 1,"Greenville, Grand Rapids, Michigan",Offer,"Listed On: Saturday, December 10, 2016",Rifles,Sig Sauer                                                                                ,223/5.56 NATO                                                                                ,Semi-automatic                                                                                ,Rifle,I have 2 like new AR's. a sig sauer m400 with od green magpul furniture and iron sights. And an Anderson Arms AR both mil spec 1:7 chrome moly Anderson has free float and upgraded stock along with a Barska tactical 4x32. Wanting to trade both rifles for a Daniel defense AR or?
751,http://www.armslist.com/posts/6205751,For Sale/Trade:  Bear skin rug,"Fort gratiot, Port Huron, Michigan",$ 600,"Listed On: Friday, December 16, 2016",Miscellaneous,Sig Sauer                                                                                ,223/5.56 NATO                                                                                ,Semi-automatic                                                                                ,Rifle,I have a very nice taxidermy bear skin rug for sale/trade-   It has black felt backing - really good condition -
752,http://www.armslist.com/posts/6205752,For Sale:  FNS 9,"South, Tulsa, Oklahoma",$ 450,"Listed On: Saturday, December 10, 2016",Handguns,FN Herstal S.A.                                                                                ,9mm Luger (9x19)                                                                                ,Striker Fire                                                                                ,Pistol,I've got a very gently used stainless FNS 9 for sale.  Comes in its original box w/ 3 mags.
754,http://www.armslist.com/posts/6205754,For Sale/Trade:  7 Glock .40 mags,"Littleton, Denver, Colorado",$ 70,"Listed On: Monday, January 9, 2017",Magazines,no type,no type,no type,no type,"I have a few Glock .40 mags I no longer need.3 x 15 round mags3 x 9 rounds mags1 x 10 round magsWould like to sell as a lot, $70 for all."
755,http://www.armslist.com/posts/6205755,For Trade:  ATI Omni Maxx AR-15,"Thomasville, Valdosta, Georgia",Offer,"Listed On: Saturday, December 10, 2016",Rifles,no type,no type,Semi-automatic                                                                                ,Rifle,•ATI Omni Maxx AR-15 chambered in 5.56/223 - in like new condition•Bushnell AR Optics with BDC reticle- 3-9x40mm•Nikon M-223 mount•Magpul CTR stock (original stock included as well)•3 30rd polymer magazines (2 black and 1 FDE)
756,http://www.armslist.com/posts/6205756,For Sale:  Armalite upper receiver,"Houston, Houston, Texas",$ 65,"Listed On: Saturday, December 10, 2016",Gun,no type,no type,Semi-automatic                                                                                ,Rifle,"One used armalite upper receiver in perfect working condition , selling 65.00"
757,http://www.armslist.com/posts/6205757,For Sale:  Brand new Kel Tec P11,"Bowling Green, Bowling Green, Kentucky",$ 225,"Listed On: Saturday, December 10, 2016",Handguns,Kel-Tec                                                                                ,9mm Luger (9x19)                                                                                ,Double Action                                                                                ,Pistol,"Selling my Kel tec p11 with 2 mags and holster for $225.Selling my Ruger p89 with 3 mags, hogue grip, and holster for $300"
759,http://www.armslist.com/posts/6205759,For Sale/Trade:  Kimber,"Louisa, Richmond, Virginia",$ 0,"Listed On: Saturday, December 10, 2016",Handguns,Kimber                                                                                ,45 ACP                                                                                ,Single Action                                                                                ,Pistol,"I have a brand new still in the box Kimber Custom II in .45 ACP with 7 round Kimber mag and Rose wood grips also purchased with the pistol was a hogue grip an extra 8 Rd mag a matching brown leather Banchi pancake holster a black Wilson Combat three port compensator. Of course being new cash is king no reasonable offer will be ignored. I am also interested in multiple gun trades, Sigs or carry size Glocks in 9 or .45 with cash. Let me know what you have. I can drive up to an hour for the right trade."
760,http://www.armslist.com/posts/6205760,"For Sale/Trade:  Kahr P9 - great condition, two mags","WORCESTER, Massachusetts, United States",$ 600,"Listed On: Saturday, December 10, 2016",Handguns,Kahr                                                                                ,9mm Luger (9x19)                                                                                ,Double Action                                                                                ,Pistol,"Title pretty much says it all. Text or call with trade offers, I'm interested in Glocks, 9mm concealable pistols, maybe the right revolver. I can add cash for the right trade. Will definitely consider a .22lr rifle and cash."
