,url,title,location,price,post date,category,manufacturer,caliber,action,firearm type,postcontent
498,http://www.armslist.com/posts/6205498,For Sale:  M92PAP pistol  w/ Factory SBR Parts,"South Metro/DTC, Denver, Colorado",$ 500,"Listed On: Friday, December 16, 2016",Handguns,Century International Arms                                                                                ,7.62x39                                                                                ,Single Action                                                                                ,Pistol,"*********Lowered the price to move it, just looking for a quick sale********Century imported PAP M92 pistol, Have difficult to source underfolder from the same manufacturer (Zastava) as well as muzzle device and detent from Zastava to make a fully Serbian build. Pistol has had 43 rounds of Red Army Standard through it (cut it short of the 60 as it is a rude little sucker for those shooting near me). Fully functional pistol as it comes, some milling by a gunsmith or machinist on the rear trunnion and the appropriate ATF filing and tax stamp and you can build what is about as near a factory M92 from Zastava as you are going to get. While the factory muzzle boosters where brought in en masse by Century Arms (~$20), finding a new production Zastava underfolder was not easy or cheap. This came off of an imported NPAP DF that was parted out, these stocks as surplus tend to go for over 3 digits. I know I am loosing value on it as there are polish, hungarian, bulgy, and romy stocks abound for less, but this is the parts correct variant for the build and worth noting. Willing to look at trades, but not looking for much in particular. As a side note, I have 10- surplus polish & 1- 40 rd Circle 10 magazine repair kits and >2,900 rounds available if your wanting to take hte whole package all or nothing. toying with getting out of the round all together as this is the only thing I have left in it and I guess I am not going to finish the project. looking for $1,400. feel free to as questions"
499,http://www.armslist.com/posts/6205499,"For Sale:  New ESCORT MODEL 87 YOUTH 20G 22"" 5RD PUMP ACTION","Levant, Maine, United States",$ 290,"Listed On: Saturday, January 14, 2017",Shotguns,Century International Arms                                                                                ,20 Gauge                                                                                ,Pump Action                                                                                ,Shotgun,"New ESCORT MODEL 87 YOUTH 20G 22"" 5RD PUMP ACTION. 12.5"" Lenght of pull (LOP)•Black metal finish •3/8"" Dovetail rail on top of receiver, Turkish Walnut Stock with black rubber recoil pad •Raised, ventilated rib •Fiber optic front sight •Turkish Walnut stock •Includes (3) chokes (IC/M/F)•Short-throw slide-action for quick 2nd shots •Enlarged slide release button •Aircraft grade aluminum alloy receiver •Chrome-moly lined barrel, proofed for steel shot •Sling swivel studs.Dealer owned."
503,http://www.armslist.com/posts/6205503,For Sale/Trade:   Nice Savage 110 7mm,"Dora birmingham, Birmingham, Alabama",$ 450,"Listed On: Saturday, December 17, 2016",Rifles,Savage Arms                                                                                ,no type,Bolt Action                                                                                ,Rifle,Savage 110 7mm in great shape with curly maple custom stock and a Bushnell elite scope
506,http://www.armslist.com/posts/6205506,For Sale:  Truglo scope,"Manchester, Manchester, New Hampshire",$ 75,"Listed On: Saturday, December 10, 2016",Optics,no type,no type,no type,no type,this is a truglo red blue and green dot scope.  I was gifted three of these in one year.  I only need one.call Nate if interested REDACTED
508,http://www.armslist.com/posts/6205508,For Sale:  Sig 2022 40 Cal Like New,"Henrietta, Rochester, New York",$ 325,"Listed On: Thursday, December 22, 2016",Handguns,Sig Sauer                                                                                ,40 S&W                                                                                ,Double / Single Action                                                                                ,Pistol,"Sig 2022 40 cal.  One box (50 rounds) have been fired through this gun.  Includes one 10 round magazine and a cheapie Blackhawk IWB holster (not pictured but included).Just picked this up last week, but have since found another pistol I would like, and since this really doesn't fill a particular use for me at this point it would be nice to sell one to finance the other. Cheapest price I can find for this online would be north of $450. NYS pistol permit holders only.  We will need to do a background check on this in accordance with the SAFE act, I know a few dealers in the Rochester area that can facilitate this.  Buyer will cover transfer fees."
509,http://www.armslist.com/posts/6205509,For Sale:  SAIGA  .308 hard to find,"southeast, Rock Hill, South Carolina","$ 1,100","Listed On: Thursday, December 22, 2016",Rifles,Saiga                                                                                ,308/7.62 NATO                                                                                ,Semi-automatic                                                                                ,Rifle,"I have for sale or possible trade a 16"" barrell Saiga .308. These are almost impossible to find nowadays. It currently has a tapco m4 style stock on it and will come with one 8rnd factory mag as well as 3 20rnd Uinta mags. I can add some .308 ammo for the right deal. I'm asking $1100 or best resonable offer. I would be open to trades plus cash on other guns. I'm mainly interested in bolt actions in .308, .30-06, or 6.5 swedish but would consider other trades. Can send pics if requested. Must be S.C. resident over 18."
511,http://www.armslist.com/posts/6205511,"For Sale:  Ammo 4 sale .22, .45 ACP, 5.56 nato in mags, 9mm","north, Lincoln, Nebraska",$ 1,"Listed On: Saturday, December 10, 2016",Ammo,no type,no type,no type,no type,"Have a lot of different ammo, .22 Armscor 40gr standard vel round nose 50 rd $3.00 ea, .22 armscor 36 gr high vel 50 rd plated HP $4.00 ea, Winchester 555 rd box 36 gr plated HP 1280 FPS $40.00, Remington 525 golden bullet value pack 36 gr plated HP high vel $40.00 *SOLD* Remington 40 gr plated round nose $4.00, Perfecta .45 ACP and 9MM FMJ 50 rd boxes $17 ea for .45 and $15 for 9mm. Many more, also have pre-loaded P-mags and aluminum GI style mags with 5.56 NATO spec 62 gr FMJ and green tip penetrator ammo for sale- make offer.   Local pickup preferred for cash, or will ship if buyer makes a large purchase and covers UPS cost.  E-mail to buy or request specific item photos or info."
512,http://www.armslist.com/posts/6205512,For Sale:  Savage 111 Long Range Hunter + Extras,"Greenwood, Indianapolis, Indiana",$ 800,"Listed On: Saturday, December 10, 2016",Rifles,Savage Arms                                                                                ,300 Winchester Magnum                                                                                ,Bolt Action                                                                                ,Rifle,"Looking to sell an almost like new Savage 111 Long Range Hunter in 300 Win Mag. Gun only has 20rds down the barrel. Has a very small peel in the stock finish on the bottom of the forend. The rifle has an adjustable comb and an adjustable muzzle brake from the factory. Also included will be Bushnell Banner 6-18X50 scope, Weaver one piece base, and Weaver heavy duty rings. Also included is a Harris Bipod, and 40 rounds of Winchester Super X 180gr ammo, and 20 once fired cases. Looking to get $800 out of it. Gun alone retails for $1,100. I can email more pictures. Just ask."
513,http://www.armslist.com/posts/6205513,For Sale:  De Santis Die Hard Ankle Holster,"Springdale, Fayetteville, Arkansas",$ 20,"Listed On: Monday, December 26, 2016",Holsters,Savage Arms                                                                                ,300 Winchester Magnum                                                                                ,Bolt Action                                                                                ,Rifle,"De Santis (leather) Die Hard ankle holster for SIG P938. Has seen light use, excellent condition. Retails new for $88.00. Kevin 200-5135."
515,http://www.armslist.com/posts/6205515,For Trade:  RIA 1911 45ACP,"Cleveland/Chattanooga, Chattanooga, Tennessee",Offer,"Listed On: Saturday, December 10, 2016",Handguns,Rock Island Armory                                                                                ,45 ACP                                                                                ,no type,Pistol,"Looking to trade a full size Rock Island 1911 chambered in 45acp. 2 magazines.Looking for a full size 9mm pistol, preferably not polymer frame but will entertain all offers. 423-4seven5-4704. Please text, will answer emails but do not check them as often."
516,http://www.armslist.com/posts/6205516,For Sale:  BNIB: Bersa Thunder 380 CC,"Elyria, Cleveland, Ohio",FREE,"Listed On: Saturday, December 10, 2016",Handguns,Bersa-Eagle                                                                                ,380 ACP                                                                                ,Double Action                                                                                ,Pistol,"BRAND NEW still in the sealed case, 2 of these were purchased at F.F.F. ($350 + Tax about a month ago)  and she wanted a pink or purple one.Comes with all factory items still sealed in the case, plus 1 additional Brand New 8rd Mag ($35 + Tax) .I am open to realistic cash offers ($375) , all Low ball offers will be ignored. Maybe interested in a trade, but NO rifles, shotguns, revolvers, 40cals or 380'sMust be 21 +, CCW/CHl holder is preferred and a Bill of Sale will be signed. Back up for Sale due to Out of state license."
519,http://www.armslist.com/posts/6205519,For Sale/Trade:  Sks stock and mag,"Boyceville, Eau Claire, Wisconsin",$ 1,"Listed On: Sunday, May 14, 2017",Gun,no type,no type,no type,no type,"for sale or tarde. complete sks stock, mag sling and stiper clips . Mike at seven one five 5561520,  will ship for extra  $$$"
520,http://www.armslist.com/posts/6205520,For Sale:  870 and 500 barrels,"brownsburg, Indianapolis, Indiana",$ 1,"Listed On: Saturday, December 10, 2016",Shotguns,Remington                                                                                ,12 Gauge                                                                                ,Pump Action                                                                                ,Shotgun,Safe clean out sale. one 30 in smooth bore 870 barrel $75 one 20 in smooth bore 870 barrel $50 and a rifled mossburg 500 barrel with scope and ported $ 150
521,http://www.armslist.com/posts/6205521,For Sale:  Nikon 8x32 HG DCF binoculars,"Eastern Washington, Washington, United States",$ 700,"Listed On: Saturday, December 10, 2016",Optics,Remington                                                                                ,12 Gauge                                                                                ,Pump Action                                                                                ,Shotgun,Like new. Only tested in the house. Email me if interested.
523,http://www.armslist.com/posts/6205523,For Sale:  Wts-Glock 19 Gen3 9mm,"Phoenix, Phoenix, Arizona",$ 485,"Listed On: Saturday, December 10, 2016",Handguns,Glock                                                                                ,9mm Luger (9x19)                                                                                ,Striker Fire                                                                                ,Pistol,"Hello everyone i have here a glock 19 gen3 9mm i've had for a few months i would like to sell, it will come with 1-mag, 1-guncase, 1-blackhawk nylon IWB holster, 1-gunlock,15rnds of Hornady critical duty 9mm ammo, i do not have photos on hand but gun condition is 9/10.Private Sale $485 FirmMust have a AZ state ID and be a Resident of arizona, will not accept california ID's or anyone not from Arizona.buyer must come pick up please."
524,http://www.armslist.com/posts/6205524,"For Sale:  24"" Remington 700 5r 308","Pierre, South Dakota, United States",$ 750,"Listed On: Saturday, December 10, 2016",Rifles,Remington                                                                                ,308/7.62 NATO                                                                                ,Bolt Action                                                                                ,Rifle,"Selling my rem 700 5r 308 either as a complete package or rifle only. Exactly 121 rounds of 175gr federal gold match down the tube. No crazy ""barrel break in"" performed and it was only ever cleaned with a bore guide. Very very accurate with 175gr ammo. The package would include the rifle, 4.5-18 falcon menace scope, 30mm steel TPS rings and a one piece steel 20 moa TPS base. Everything was bought new when the rifle was purchased and in perfect working condition. $750 for rifle only and $1000 for the package.    If you were to buy everything brand new today it would cost roughly $1510. 24"" 308 5r's go for $1000, scope $320, rings $105, base $85. Save over $500 for a very well taken care of long range package!  Price firm no trades"
525,http://www.armslist.com/posts/6205525,For Sale:  Mosin nagant,"Jenison, Grand Rapids, Michigan",$ 195,"Listed On: Friday, December 16, 2016",Rifles,Remington                                                                                ,7.62x54R                                                                                ,Bolt Action                                                                                ,Rifle,"Good shape model 91/30 Mosin Nagant rifle 1937.bayonet and sling, ammo pouch. purchased from Grander mountain years ago. Functions as should, great shooting rifle Have a 20 round Winchester white box of ammo to go with it"
526,http://www.armslist.com/posts/6205526,"For Sale:  1,000 Processed Federal 223 Brass **FREE SHIPPING**","East, Columbus, Ohio",$ 99,"Listed On: Friday, January 12, 2018",Reloading,Remington                                                                                ,7.62x54R                                                                                ,Bolt Action                                                                                ,Rifle,**Free shipping** www.rockeybrass.comSelling 223/5.56 Brass Cases. These are once fired 223/5.56 cases. All brass is cleaned in stainless steel tumbler.Prices:Fully Processed and Cleaned: $54.99/500 or $89.99/1000 - price includes shipping!See our website for more details or for shipping: www.rockeybrass.comOur brass is fully processed. We also use complete case gauging to ensure the brass meets SAAMI specs.We also offer 9mm and 300 blackout brass.Thanks for looking!
527,http://www.armslist.com/posts/6205527,For Sale:  Glock 19 gen4,"Smyrna, Murfreesboro, Tennessee",$ 550,"Listed On: Saturday, December 10, 2016",Handguns,Glock                                                                                ,9mm Luger (9x19)                                                                                ,Double Action                                                                                ,Pistol,Has aftermarket grip. 25 rds Hornady hp. About 200 rds shot through it.
529,http://www.armslist.com/posts/6205529,For Sale:  S&W M&P 10 308,"Sandpoint, Coeur D' Alene, Idaho","$ 1,250","Listed On: Saturday, December 10, 2016",Rifles,Smith & Wesson                                                                                ,308/7.62 NATO                                                                                ,Semi-automatic                                                                                ,Rifle,S&W M&P AR-10 308 like New only 3 months old very accurate shoots Flawlessy Very Nice Gun comes with case and paper work included. 1250.00 for fastest results call or text me at REDACTED
530,http://www.armslist.com/posts/6205530,For Trade:  Glock 30s for a Gen3 or 4 19 ns,"Fort Payne, Gadsden, Alabama",Offer,"Listed On: Saturday, December 10, 2016",Handguns,Glock                                                                                ,45 ACP                                                                                ,Striker Fire                                                                                ,Pistol,"Glock 30s, polished barrel, tfo tru-glo sights, extended mag release, extended take down bar, 3.5lb Ghost trigger, iwb keyhole holster, 2 mags, box/factory stuff. Looking to trade for a Gen 3 or 4 19 with night sights"
535,http://www.armslist.com/posts/6205535,"For Sale:  SALE! ZENITH MKE Z-43P 5.56 12"" 30RD BLK","Renton, Seattle, Washington","$ 1,563","Listed On: Saturday, June 3, 2017",Rifles,no type,223/5.56 NATO                                                                                ,Semi-automatic                                                                                ,Rifle,"Zenith Firearms, MKE Z-43 P, Semi-automatic Pistol, 556NATO, 12.08"" Barrel, Steel Frame, Black Finish, 30Rd, Roller-Lock, Delayed Blowback, Includes Plastic Carry Case, Three (3) 30-Round Magazines, Factory Cleaning Kit, Two (2) Extra Take-Down Pins, Picatinny Optics Mount, Factory Sling, Muzzle Brake*This is a pistol however Armslist doesn't allow this listing with the correct caliber unless listed as a rifle.*"
536,http://www.armslist.com/posts/6205536,"For Sale:  New ESCORT MARINE GUARD HOME DEFENSE 12GAUGE/18"" PUMP With Nickel Finish","Levant, Maine, United States",$ 199,"Listed On: Thursday, December 21, 2017",Shotguns,no type,12 Gauge                                                                                ,Pump Action                                                                                ,Shotgun,"New ESCORT MARINE GUARD HOME DEFENSE 12GAUGE/18"" PUMP With Nickel Finish. Cross-Bolt Safety. •Waterr-resistant nickel metal finish •3/8"" Dovetail rail on top of receiver for accessory sights •Cylinder bore barrel •Rifle-style front sight •Tough black synthetic stock •Low density recoil pad •LOP: 14"" •OAL: 38"" •Wt.: 6.25 lbs.•Short-throw slide-action for quick 2nd shots •Enlarged slide release button •Aircraft grade aluminum alloy receiver •Chrome-moly lined barrel, proofed for steel shot •Sling swivel studs.  Dealer Owned Price reflects a 3% cash discount"
538,http://www.armslist.com/posts/6205538,For Sale/Trade:  Remington 7400,"FLORISSANT, St. Louis, Missouri",$ 475,"Listed On: Saturday, December 17, 2016",Rifles,Remington                                                                                ,270 Winchester                                                                                ,Semi-automatic                                                                                ,Rifle,"Remington 7400 BDL Semi Auto 270 Win/Bushnell Scope/Iron Sights Very Good Condition MAY TRADE for a GLOCK 17,19 9mm  EMAIL IF INTERESTED! NO LOWBALL OFFERS!"
540,http://www.armslist.com/posts/6205540,For Sale:  Sig Sauer Tango 4  Optic,"Daytona, Orlando, Florida",$ 600,"Listed On: Sunday, January 15, 2017",Optics,no type,no type,no type,no type,"3-12x42mm First Focal Plane. Mil turrets, mil reticle. PEPR mount. Very very good condition. Comes with box for scope and mount, as well as picatinny rail tops for mounting optics, lights, whatever you want. Awesome scope and built like a tank."
541,http://www.armslist.com/posts/6205541,"For Sale:  SALE! Arsenal SLR106-58 556 NATO 8.5""","Renton, Seattle, Washington","$ 1,038","Listed On: Saturday, June 3, 2017",Rifles,no type,223/5.56 NATO                                                                                ,Semi-automatic                                                                                ,Rifle,"Description: SLR-106UR - Import, 5.56 NATO caliber, stamped receiver. New style Muzzle Brake/Compensator designed to reduce recoil, 8 1/2 in. chrome lined hammer forged threaded barrel, Scope rail,  black polymer furniture. Comes with one each 5-round and 20-round magazines, sling, oil bottle, and cleaning kit.       *This is a pistol. Armslist doesn't allow the correct caliber unless listed as a rifle.*"
542,http://www.armslist.com/posts/6205542,For Sale:  Springfield XD .40 Mod 1,"Dayton, Dayton, Ohio",$ 450,"Listed On: Saturday, December 10, 2016",Handguns,Springfield                                                                                ,40 cal                                                                                ,Semi-automatic                                                                                ,Pistol,"I have a Springfield XD .40 for trade mainly. Cash offers will be entertained as well. It comes with 1 Blackhawk Kydex holster and an Uncle Mikes iwb holster. Also has 6 magazines. 4 12 round, and 2 9 round magazines. Comes with a box of ammo as well. Original case and paperwork too. I am am mostly looking for AR style rifles. Any high powered rifles would be great as well. Or Semi Auto Shotguns. I would possibly trade for another handgun as well if it is right. I will look at any offer though. Contact me me by text or phone call. REDACTEDI have reduced the price. Asking 450 but we can negotiate. Please be up front and serious though. Too many want to talk and not make a deal."
543,http://www.armslist.com/posts/6205543,For Sale:  H&k USP 9mm,"Edmond, Oklahoma City, Oklahoma",$ 700,"Listed On: Monday, January 2, 2017",Handguns,Heckler & Koch                                                                                ,9mm Luger (9x19)                                                                                ,Semi-automatic                                                                                ,Pistol,"Gently used, low round count, H&K USP 9mm in excellent condition.  Comes with case, 2 mags, and 500 rounds."
544,http://www.armslist.com/posts/6205544,Want To Buy:  Polish Tantal,"Bethany, Oklahoma City, Oklahoma",Offer,"Listed On: Saturday, December 17, 2016",Rifles,Century International Arms                                                                                ,5.45x39mm                                                                                ,Semi-automatic                                                                                ,Rifle,Want to buy a Polish tantal. Would prefer a newer one with the correct barrel that does not keyhole. Would prefer to trade but will consider cash if right price.
547,http://www.armslist.com/posts/6205547,For Sale:  Fal L1A1 Sporter,"N, Portland, Oregon",$ 750,"Listed On: Tuesday, January 10, 2017",Rifles,Century International Arms                                                                                ,308/7.62 NATO                                                                                ,Semi-automatic                                                                                ,Rifle,"Century International Arms L1A1 Sporter 20"" Barrel .308 4 mags . it's on an Imbel reciever. Fun and a reliable gun. $750"
548,http://www.armslist.com/posts/6205548,For Sale:  Colt LE6920 Carbine M4,"Sandpoint, Coeur D' Alene, Idaho",$ 950,"Listed On: Saturday, December 10, 2016",Rifles,Colt                                                                                ,5.56×45mm NATO                                                                                ,Semi-automatic                                                                                ,Rifle,Colt 556/223 LE6920 M4 Carbine Magpual edition 30 round Magpul mag Magpul back up sight New condition 950.00 for fastest response call or text REDACTED
549,http://www.armslist.com/posts/6205549,For Sale:  Glock 17,"Rogersville, Huntsville, Alabama",$ 550,"Listed On: Thursday, December 15, 2016",Handguns,Glock                                                                                ,9mm Luger (9x19)                                                                                ,Striker Fire                                                                                ,Pistol,brand new gen 4 Glock 17 with factory FDE. message for more info or pictures. $550 - no trades at this time.
550,http://www.armslist.com/posts/6205550,For Sale/Trade:  NIB Walther P99C w Extras,"North, Indianapolis, Indiana",$ 535,"Listed On: Monday, December 26, 2016",Handguns,Walther                                                                                ,9mm Luger (9x19)                                                                                ,Double / Single Action                                                                                ,Pistol,"Up for consideration is a brand new, unfired Walther P99C AS DA/SA in 9mm handgun. This will come with two extras, both brand new in package-- A Walther magazine and a Walther magazine and grip extension , allowing the owner to carry more rounds in the weapon. This will bring the total number of magazines to three total which will come with the gun. Extras worth $65. I deal fairly and honestly, expect same in return. Walther is known for making superior weapons and this particular model consisently ranks at the top of many lists for conceal carry handguns. On top of that, its just a sharp looking firearm. If interested please text, -no calls-or email-- 3 one 7 two 5 zero 0 nine 5 nine."
