,url,title,location,price,post date,category,manufacturer,caliber,action,firearm type,postcontent
0,http://www.armslist.com/posts/6205000,For Sale:  Beretta 21A Bobcat .22LR,"Banks, OR, Portland, Oregon",$ 275,"Listed On: Saturday, December 17, 2016",Handguns,Beretta USA                                                                                ,22 Long Rifle                                                                                ,Double / Single Action                                                                                ,Pistol,"Blowback operated DA/SA .22LR, so it likes the hot stuff. Frame mounted thumb safety can be engaged with the hammer down, or cocked. Hammer has a half cock notch. Seven round magazine. Desantis pocket holster fits it well, and will go with it. Wear shown as best I can capture it in the photos, but lots of life left in it. $275, FFL fees are my treat, as well as the OSP $10 fee. Gun is located in Banks, OR. No trades."
1,http://www.armslist.com/posts/6205001,For Sale/Trade:  Level 3+ AR550 Spartan Armor 10x12 Triple Curve NIJ 0101.06,"Puyallup, Tacoma, Washington",$ 220,"Listed On: Saturday, December 10, 2016",Tactical,Beretta USA                                                                                ,22 Long Rifle                                                                                ,Double / Single Action                                                                                ,Pistol,"I have a like new set of plates for your plate carrier. These don't have any dings, dents, scratches of any kind. They're made my Spartan Armor, and they are rated for level 3+ threats which includes M195. These plates are 10x12"" and have the factory frag coating on them as well. They are triple curve plates, and are extremely comfortable. I had them in a Banshee and they fit really well. I'm asking $250 shipped to your door. Remember, these plates are like new!"
2,http://www.armslist.com/posts/6205002,For Sale/Trade:  New Mossberg Maverick 88,"Miami, Miami-Dade, South Florida",$ 0,"Listed On: Saturday, December 10, 2016",Shotguns,Mossberg                                                                                ,12 Gauge                                                                                ,Pump Action                                                                                ,Shotgun,"I have for trade is a brand new never fired Mossberg Maverick 88, I bought the shotgun brand-new from Stoneharts gun club comes with original stock and also a shockwave technologies handle and I will also throw in a box of shells. I'm looking to trade for a small handgun like a ruger lcp or a snub nose .38 or something along those lines doesn't have to be anything fancy. I paid 280 for this shotgun so I would like to get something close to that I could add cash let me know what you have thanks."
4,http://www.armslist.com/posts/6205004,For Sale:  8mm ammo,"Evansville, Evansville, Indiana",$ 450,"Listed On: Monday, December 26, 2016",Ammo,no type,no type,no type,no type,8mm Mauser romanian1100 rounds$450
5,http://www.armslist.com/posts/6205005,For Sale/Trade:  Glock 43,"Colorado Springs, Colorado Springs, Colorado",$ 450,"Listed On: Thursday, December 15, 2016",Handguns,Glock                                                                                ,9mm Luger (9x19)                                                                                ,Striker Fire                                                                                ,Pistol,"Glock 43 comes with 1 mag, hogue grip, Q series holster, box and original paperwork.  This gun has only had 50 rounds through it and no scratches or wear of any sort.  Buyer is responsible for transfer fee at ffl.REDACTED"
6,http://www.armslist.com/posts/6205006,"For Sale:  Bush Boar A1 5.56 chest rig, Multicam","Tacoma, Tacoma, Washington",$ 125,"Listed On: Wednesday, February 15, 2017",Tactical,Glock                                                                                ,9mm Luger (9x19)                                                                                ,Striker Fire                                                                                ,Pistol,"Brand new, never used Bush Boar A1 5.56 split front chest rig from Esstac. 5.56 verision, has split front panel. Multicam pattern, has padded harness ($60 upgrade). Has Kywi kydex retention inserts. Cost $220 new, never used!"
7,http://www.armslist.com/posts/6205007,For Sale:  Walther SP22 M3,"Overland park, Kansas City, Kansas",$ 350,"Listed On: Saturday, December 10, 2016",Handguns,Walther                                                                                ,22 Long Rifle                                                                                ,Striker Fire                                                                                ,Pistol,Walther sp22 m3 Pistol is a 22lr. Very fun pistol for blinking and is very accurate even with some cheaper ammo. Also I have two factor magazines and the original case. $350obo
8,http://www.armslist.com/posts/6205008,For Sale:  Remington model 700 BDL,"Mercersburg, Cumberland Valley, Pennsylvania",FREE,"Listed On: Saturday, December 10, 2016",Rifles,Remington                                                                                ,308/7.62 NATO                                                                                ,Bolt Action                                                                                ,Rifle,"Remington 700 BDL in the  hard to find 308 Win.  This is a really rare BDL. It's a European version of the  700 BDL , and came with  a factory oil finished stock.  Only made for 2 yrs  93-94.  This one has a gorgeous stock on it with loads  and loads of figure to boot .  Bushnell 3x9  scope  in Redfield mounts.  Looking for $850.00.    This is going to auction, but i thought i'd offer it here  this evening for a quick sale"
9,http://www.armslist.com/posts/6205009,For Sale:  Para 18.9 lda limited  9mm,"Oak Ridge, Knoxville, Tennessee",$ 700,"Listed On: Saturday, December 10, 2016",Handguns,Remington                                                                                ,308/7.62 NATO                                                                                ,Bolt Action                                                                                ,Rifle,very nice para LDA limited 9mm.. has a very very crisp trigger very light.. also comes with 6 10 mags and a Blackhawk holster.. has Dawson precision sights on it.. great competition gun.. they do make 18 round mags for it but I don't have any
10,http://www.armslist.com/posts/6205010,For Sale:  Springfield XDM-9,"Moore, Oklahoma City, Oklahoma",$ 500,"Listed On: Saturday, January 14, 2017",Handguns,Springfield                                                                                ,9mm Luger (9x19)                                                                                ,Bolt Action                                                                                ,Pistol,Used Springfield XDM 9mmComes with gear set in box with 2 magazines.$499.99 OBO
11,http://www.armslist.com/posts/6205011,For Sale:  Sig p238 Rosewood,"Banks, OR, Portland, Oregon",$ 475,"Listed On: Saturday, December 10, 2016",Handguns,Sig Sauer                                                                                ,380 ACP                                                                                ,Single Action                                                                                ,Pistol,"Sig p238 Rosewood. Lightly used/carried by me, and unfired by the original owner, about 50 rounds total. I've just never been able to go all in on a .380 gun. Comes with the original box, paperwork, kydex holster, four magazines, IWB, and AIWB holsters. Priced for a quick sale, and transfer/background fees INCLUDED in the price. $475 total gets you this smooth shooting, pocketable 1911 type pistol. Gun is located in Banks, OR."
13,http://www.armslist.com/posts/6205013,For Sale:  PWS MK 107 Mod 1-P,"Madison, Huntsville, Alabama","$ 1,100","Listed On: Sunday, December 11, 2016",Rifles,no type,223/5.56 NATO                                                                                ,Semi-automatic                                                                                ,Rifle,"For sale: One factory brand new upper with all items in box. This is the MK 107 Mod 1-P  patrol upper. Primary Weapons Systems MK107 MOD1-P upper features 7.75"" isonited barrel 1:8 twist, Triad flash suppressor, long-stroke piston system, 3-position adjustable gas block, isonited bolt carrier group, BCM charging handle and 7"" KeyMod handguard."
14,http://www.armslist.com/posts/6205014,For Sale:  Winchester Youth Model,"NW Columbia/Irmo, Columbia, South Carolina",$ 150,"Listed On: Saturday, December 10, 2016",Antique,no type,223/5.56 NATO                                                                                ,Semi-automatic                                                                                ,Rifle,"This is a very old Winchester Youth Model (based on measure,ments) and appears to be a Model 56 or 58-2 (barrel stamping is hard to read).  The barrel measures around 18"" and the overall rifle length is approximately 33"".  This is a single shot 22 caliber rifle with a bolt action and hand cocked firing mechanism.  Based on the barrel info, it can accept 22 shorts, longs, and long rifle.  I have not fired this rifle myself but it appears to be functional with respect to all components.  The stock has seen a lot of use and the stock is not really pretty.  However, there are no visible cracks in the stock.  The barrel/bolt mechanism does not have significant rust or pitting but there is not a lot of finish visible.  I do not know if a non bluing finish was initially used or something else.  This rifle does not appear to have been restored in any way and certainly has an old patina.Additional photos are available if needed."
16,http://www.armslist.com/posts/6205016,For Sale:  M and P 9 full size,"Columbus, Columbus, Ohio",$ 375,"Listed On: Saturday, December 10, 2016",Handguns,Smith & Wesson                                                                                ,9mm Luger (9x19)                                                                                ,Striker Fire                                                                                ,Pistol,M and P 9mm basically brand new still have everything that came with it
18,http://www.armslist.com/posts/6205018,For Sale/Trade:  Winchester 70,"Conway, Myrtle Beach, South Carolina",$ 500,"Listed On: Wednesday, December 21, 2016",Rifles,Winchester                                                                                ,no type,Bolt Action                                                                                ,Rifle,Winchester Ranger model 70. 270 cal. Leupold 3x9x50 vx2. Sale or trade. What you got?
19,http://www.armslist.com/posts/6205019,For Sale:  Daniel Defense M4 V11,"Renton, Seattle, Washington","$ 1,599","Listed On: Saturday, June 3, 2017",Rifles,Daniel Defense                                                                                ,223/5.56 NATO                                                                                ,Semi-automatic                                                                                ,Rifle,"Daniel Defense, M4 Carbine Semi-automatic Rifle, 556NATO, 32Rd, 16"" Barrel, Carbine Chamber, Black Finish, Pistol Grip, 1-32Rd Daniel Defense Magazine"
21,http://www.armslist.com/posts/6205021,For Sale:  Sig Sauer Gen 2 MPX Pistol 9mm GET THEM WHILE YOU STILL CAN!!!!,"Chatsworth/SFV/Los Angeles, Los Angeles, California","$ 3,300","Listed On: Saturday, December 10, 2016",Handguns,Sig Sauer                                                                                ,9mm Luger (9x19)                                                                                ,Single Action                                                                                ,Pistol,"*Thursday 12-15-16 Special*  $3300 firm today only Just got off work early.  I can meet at my FFL Azusa before 4 today, SFV or Simi.   Text me ASAP REDACTED Price goes back up tomorrowI have 2 New in box Sig Gen 2 MPX pistols for sale $3800 each oboIncludesfactory boxflip up sightsslingssling mountlocksREDACTED texting is bestNo shippingCash in handBuyer pays all feesWilling to travel within reason distanceI have a FFL in Azusa that has no lines and quick May have a FFL in Simi Valley as wellIf the ad is up, the pistol is still availableNot a fire sale.  I'm more than happy to keep it if it doesn't sell.  I'm just thinning the heard, so lowballers save your breath."
23,http://www.armslist.com/posts/6205023,For Sale:  Midwest Industries Railed Gas Tube,"SE mn, Rochester, MN, Minnesota",$ 80,"Listed On: Tuesday, January 17, 2017",Gun,no type,no type,no type,no type,I have for sale a standard gas tube length MI railed ak gas block in like new condition willing to ship upon payment via USPS money ordertext:REDACTED
24,http://www.armslist.com/posts/6205024,For Sale:  Taurus 380 TCP PINK,"MANSFIELD, Dallas, Texas",$ 200,"Listed On: Saturday, December 10, 2016",Handguns,Taurus                                                                                ,380 ACP                                                                                ,Double / Single Action                                                                                ,Pistol,"Brand New, never fired Pink 380 PT738has box, key, extra long clip and hand extension. 200 OBO"
25,http://www.armslist.com/posts/6205025,For Sale:  Ruger 10/22 - Collector's 2nd Edition,"SE Greensboro, Greensboro, North Carolina",$ 250,"Listed On: Saturday, December 17, 2016",Rifles,Ruger                                                                                ,22 Long Rifle                                                                                ,Semi-automatic                                                                                ,Rifle,Second generation Ruger 10/22 Collector's Edition. Rifle is bone-stock with all Collector's material in the original box. Includes original 10-round rotary mag. Has not been fired and is as new as you can get being pre-owned. Will include Nikon Prostaff Rimfire 3-9x40 BDC scope and rings for additional $125 and/or BX-25 mags NIB for $25 each.Please feel free to contact me at (336) 706 - 1735 with any questions.
26,http://www.armslist.com/posts/6205026,For Sale:  2 rifles for sale,"Chehalis, Olympia, Washington","$ 1,400","Listed On: Saturday, December 10, 2016",Rifles,Mossberg                                                                                ,270 Winchester                                                                                ,Bolt Action                                                                                ,Rifle,Mossberg patriot .270 camo 400 obo  No scope.  Olympic arms .40 s&w Ar-15 1000 obo  With reflex sight and 5 magazines
28,http://www.armslist.com/posts/6205028,For Sale:  Special Ruger 9e,"Nappanee, South Bend, Indiana",$ 425,"Listed On: Sunday, December 18, 2016",Handguns,Ruger                                                                                ,9mm Luger (9x19)                                                                                ,no type,Pistol,"Brand new Ruger 9e red digital camo! I bought this gun because it's rare and planned on keeping it in my safe however I've decided to sell it to fund another gun I want. Never been fired and has been in my safe since I bought it! Comes with the box, paperwork, one magazine, and lock."
31,http://www.armslist.com/posts/6205031,For Sale/Trade:  G2 research RIP Ammo,"SE, Oklahoma City, Oklahoma",$ 30,"Listed On: Sunday, March 12, 2017",Ammo,no type,no type,no type,no type,40 cal $47.00357 sig $30.0045 acp $52.00 SOLD1 box per cal.
33,http://www.armslist.com/posts/6205033,For Sale:  Romanian AK-47 Wasr 10/63,"Kalamazoo, Kalamazoo, Michigan",$ 575,"Listed On: Saturday, December 10, 2016",Rifles,Century International Arms                                                                                ,7.62x39                                                                                ,Semi-automatic                                                                                ,Rifle,"For Sale: Wasr 10/63 Rifle. 7.62x39 . Never Fired. UTG Pro Quad Rail. Made in USA. Scope Mount. Sling. Adjustable Stock.Numbers All Match. Comes with 2- Magazines. 20 rd. & 30 rd. Bayonet Mount.See Pictures, Email for More Pictures. Price is $ 575.00 Cash .  Firm .No Trades. No Shipping. Pick up in Kalamazoo  131 & D ave. Area.Text for More Pictures 1-269-532-40sixteen."
34,http://www.armslist.com/posts/6205034,For Sale:  Sig Sauer P290rs Orb 9mm,"Colorado Springs, Colorado Springs, Colorado",$ 450,"Listed On: Thursday, December 15, 2016",Handguns,Sig Sauer                                                                                ,9mm Luger (9x19)                                                                                ,Double / Single Action                                                                                ,Pistol,Beautiful p290rs Orb 9mm Slide is oil rubbed Sig bronze finish (factory) - very nice. Siglite night sights. 2 mags- 6rd and 8 rdExcellent like new condition. One owner.
35,http://www.armslist.com/posts/6205035,For Sale/Trade:  Sub 2000 9mm,"Cullman, Huntsville, Alabama",$ 550,"Listed On: Saturday, December 10, 2016",Rifles,Kel-Tec                                                                                ,9mm Luger (9x19)                                                                                ,Semi-automatic                                                                                ,Rifle,"Like New Kel-Tec Sub2000 Gen2 Takes Glock 17 MagsComes With What You See Gun, Magpul AFG, and Factory Glock 17 Mag. 550.00 Cash or Trade For Other Guns. NO SHOTGUNS OR HUNTING RIFLES. Fastest Response Text REDACTED thx MAIN INTEREST RIGHT NOW IS A RUGER 10/22 TAKE DOWN WITH THREADED BARREL CAMO PINK WOULD BE A PLUS FOR DAUGHTER PLUS BOOT"
36,http://www.armslist.com/posts/6205036,For Sale/Trade:  Taurus pt101 40 cal,"El dorado, Wichita, Kansas",$ 500,"Listed On: Saturday, December 10, 2016",Handguns,Taurus                                                                                ,40 cal                                                                                ,Semi-automatic                                                                                ,Pistol,Good condition 3 mags and case
38,http://www.armslist.com/posts/6205038,For Sale:  AR15 Daniel Defense barrel CHF 14.5 CL FDE M-Lok Smith & Wesson Receivers,"Hope Mills, Fayetteville, North Carolina",$ 800,"Listed On: Saturday, December 10, 2016",Rifles,Smith & Wesson                                                                                ,223/5.56 NATO                                                                                ,Semi-automatic                                                                                ,Rifle,"- S&W koted receivers- Daniel Defense 14.5"" Lightweight CHF CL barrel 1:7 Twist unpinned- PSA full auto BCG- Extended latch charging handle- Guntec 12"" M-Lok FF rail- Midwest Industries 2-chamber Muzzle Brake- Magpul Hand Stop- M-Lok slot covers- Magpul MBUS front and rear sights- Noveske QD endplate- Magpul CTR stock- Magpul MOE grip- Milspec PSA Trigger/Selector/pins installed now.$800 cashBarrel/Muzzle are not pinned yet."
39,http://www.armslist.com/posts/6205039,For Sale/Trade:  Smith and Wesson M&P Shield 40,"Dublin, Columbus, Ohio",$ 340,"Listed On: Friday, December 16, 2016",Handguns,Smith & Wesson                                                                                ,40 S&W                                                                                ,Semi-automatic                                                                                ,Pistol,"for sale or trade. Smith and Wesson M&P Sheild 40 with thumb safety. Only has about 250 rounds through it. I'm looking to get $340 O.B.O. Or good trade. Gun is in spectacular shape. I bought it with the intention of carrying it for my CCW but have changed my mind on the caliber. Call or text REDACTED. My name is Kyle.  Thanks for looking! Also, I will include an alien gear holster and hollow points for it! I will include cash on my end if the trade is right!"
40,http://www.armslist.com/posts/6205040,For Sale/Trade:  S&W Shield 40,"Roanoke, Roanoke, Virginia",$ 400,"Listed On: Thursday, December 15, 2016",Handguns,Smith & Wesson                                                                                ,40 S&W                                                                                ,Striker Fire                                                                                ,Pistol,"Traded for this and the more I held it the more I realized it didn't fit comfortably in my hand. I haven't shot it but everything seems to work as it should. Actually the apex trigger is very nice. Either way I think I'll stick with my Glock 43. Shield 40s&w, night sights, with duty apex trigger installed, 4 magazines (1 flush, 3 extended). No box or paperwork. I'll throw in the ammo I got in my deal, 100 range and all magazines full of HP. Like I said I just traded for this but no reason to sit around a see if it grows on me. Pictures upon request but I'll have to take some later today. Prefer this deal to go in or near Roanoke. Travel can get expensive but I'll work with you."
41,http://www.armslist.com/posts/6205041,For Sale:  Ak 47,"Akron, Akron, Ohio",$ 600,"Listed On: Saturday, December 10, 2016",Rifles,Smith & Wesson                                                                                ,7.62x39                                                                                ,Semi-automatic                                                                                ,Rifle,Ak47 wasr 10/62 romanian 7.62x39Gun and 1 mag$600
42,http://www.armslist.com/posts/6205042,For Sale:  Sig Sauer P226 MK25,"SE Greensboro, Greensboro, North Carolina","$ 1,050","Listed On: Thursday, December 29, 2016",Handguns,Sig Sauer                                                                                ,9mm Luger (9x19)                                                                                ,Double / Single Action                                                                                ,Pistol,"Recently installed Short Reset Trigger Kit (sear and safety bar) and Short Reach Trigger as well as 18lb hammer spring. 98% pistol. No imperfections other than slight normal wear on barrel. Manufacture date of 11/30/2015 and has seen roughly 200 rounds through it. Comes with all original accessories and hard case as well as original trigger, seat, safety bar and springs.Please understand that the trigger upgrade is a $200 option from Sig directly.Would be interested in a 226 Legion in 9mm.Please contact Kyle at (336) 706 - 1735 with any questions."
43,http://www.armslist.com/posts/6205043,For Sale/Trade:  Winchester 20ga,"Conway, Myrtle Beach, South Carolina",$ 275,"Listed On: Sunday, January 8, 2017",Shotguns,Winchester                                                                                ,20 Gauge                                                                                ,Pump Action                                                                                ,Shotgun,Winchester Ranger model 1300 shotgun. 20 gauge. Pump action. Few scuffs but shoots good. VR barell. Sale or trade. Shoots 2 3/4 or 3 inch. What u got?
44,http://www.armslist.com/posts/6205044,For Sale:  9mm xds 4 in,"Chehalis, Olympia, Washington",$ 450,"Listed On: Saturday, December 10, 2016",Handguns,Springfield                                                                                ,9mm Luger (9x19)                                                                                ,Pump Action                                                                                ,Pistol,Springfield xds 4 in 9mm  450 obo
45,http://www.armslist.com/posts/6205045,For Sale:  Reloading powder,"White city, Medford, Oregon",$ 35,"Listed On: Saturday, December 17, 2016",Reloading,Springfield                                                                                ,9mm Luger (9x19)                                                                                ,Pump Action                                                                                ,Pistol,"I have BullseyeTitegroupUniqueReloader 10x ,15,17Imr 4198$35 a pound.text REDACTED"
46,http://www.armslist.com/posts/6205046,"For Sale/Trade:  Taurus model 65, used","80111, Denver, Colorado",$ 300,"Listed On: Saturday, December 10, 2016",Handguns,Taurus                                                                                ,357 Magnum                                                                                ,Single Action                                                                                ,Revolver,"title says it all, folks. I've put 600 rounds through this revolver, internal mechanics are still golden and has been taken care of very well in terms of cleaning and maintenance (I've scratched it some).  300 or best offer. Let's hear you haggle."
