,url,title,location,price,post date,category,manufacturer,caliber,action,firearm type,postcontent
245,http://www.armslist.com/posts/6205245,For Sale:  Carcano 8mm,"903, East Texas, Texas",$ 250,"Listed On: Sunday, December 11, 2016",Antique,Ruger                                                                                ,357 Magnum                                                                                ,Single Action                                                                                ,Revolver,"Selling an Italian Carcano 7.92 Model S  bolt action rifle in excellent condition.  This is not a rechamber, but original bore rifle.  It does not come with bayonet.  I am not looking for trades because I am finishing off selling my collection."
246,http://www.armslist.com/posts/6205246,For Sale:  Molot VEPR 12,"Dyer, Crown Point, Indiana","$ 1,000","Listed On: Friday, January 27, 2017",Shotguns,Universal Firearms                                                                                ,12 Gauge                                                                                ,Semi-automatic                                                                                ,Shotgun,"Selling my VEPR 12 (spot welded Russian folder) $1000.00 obo.  No trades.  Less than 50 rounds through it.  Like new comes with manual, a 5 round factory magazine, a 12 round after market magazine, laser and handguard grip (sorry no box).  Shotgun has the railed handguard and ambi. safety lever all factory components.  Stock is the Russian welded side folder.  Will travel to meet in the general Dyer, St. John, Crown Point, Cedar Lake, Schererville Indiana area.  Prefer CCW license, Driver License for FTF.  Can ship.  Buyer would pay any shipping to Lower 48 U.S. only and any FFL transfer fees that may be required.  Text any questions to REDACTED or email."
247,http://www.armslist.com/posts/6205247,For Sale/Trade:  Smith&Wesson 9 MM,"Knoxville/Maryville, Knoxville, Tennessee",$ 325,"Listed On: Saturday, December 10, 2016",Handguns,Smith & Wesson                                                                                ,9mm Luger (9x19)                                                                                ,Double Action                                                                                ,Pistol,"I have a Smith &Wesson SD9VE like new condition. It comes with two mags.  16 rounds each, and the box it came in.  Asking $325  or  maybe trade , I can send pictures on request.   Text  /  Call   REDACTED"
248,http://www.armslist.com/posts/6205248,For Sale:  Remington 700 SA Hogue stock,"outside, Columbia, Missouri",$ 100,"Listed On: Saturday, December 10, 2016",Gun,Smith & Wesson                                                                                ,9mm Luger (9x19)                                                                                ,Double Action                                                                                ,Pistol,I have a new take off of a SPS Tactical Hogue stock for a short action BDL in black.  Can email you a pic if your interested here's the link to the stock at Midway https://www.midwayusa.com/product/514408/hogue-rubber-overmolded-rifle-stock-remington-700-bdl-short-action-factory-barrel-channel-pillar-bed-synthetic-black
250,http://www.armslist.com/posts/6205250,For Sale:  20 gauge,"Virginia beach, Hampton Roads, Virginia",$ 500,"Listed On: Friday, December 16, 2016",Shotguns,Remington                                                                                ,20 Gauge                                                                                ,Semi-automatic                                                                                ,Shotgun,"Remington 11-87,  2 3/4 & 3 inch shells. 25 1/2"" barrel, 3 choke tubes, black composite stock, vent rib barrel, as new, shot less than 10 times. Price firm, will not respond to lower offers."
251,http://www.armslist.com/posts/6205251,For Sale:  3 guns,"Scottsville, Bowling Green, Kentucky",$ 1,"Listed On: Saturday, December 10, 2016",Handguns,Bersa-Eagle                                                                                ,380 ACP                                                                                ,Double Action                                                                                ,Pistol,Stevens 200 22 250 with bushnell banner 6x18 pretty decent shape 350 Bersa 380 like new 300Browning lightning blr 7mm08 with browning case and box of shells 775May trade text REDACTED
252,http://www.armslist.com/posts/6205252,For Sale:  Upgraded AR-15,"Redding, Redding, California",$ 850,"Listed On: Saturday, December 10, 2016",Rifles,Spikes Tactical                                                                                ,223/5.56 NATO                                                                                ,Semi-automatic                                                                                ,Rifle,"Great Shooting AR-15 w/ many extras. Gun was started using only the Vietnam Era Olympia Upper, all parts have been replaces except for that perfectly working upper, bolt, and barrel. Gun has been had around 500 rounds through it with no jams or misfires. Gun has been thoroughly cleaned and stored properly in my safe after every outing.-Olympia upper receiver, bolt, and 20"" 1-7 Barrel-Spikes Tactical Lower Receiver (Zombie Edition)-Olympia Gas Tube-DPMS Spring Kit & Trigger-Magpul MOE Rifle Stock-Magpul M-Lok Handguard-Bullet Button installed-Magpul Trigger Guard-Spikes Charging Handle (Zombie Edition)-Dust Cover (Zombie Edition)-Trinity Force Green Laser light mounted on rail-Magpul Sling Kit-UTD Sling Loop-Trinity Force Single Point Sling-Magpul Foregrip-Folding Bipod-New Castle Nut-New Buffer Springs- (4) Magpul 10 Round Mags- (1) Original Metal Colt 5 Round MagazineIf Wanted:4x ACOG sightA1 StockVietnam Era Metal HandguardsOriginal Charging HandleParts kit w/ extra Sears, springs, and cleaning supplies*** DOES NOT INCLUDE OPTICS SHOWN OR SCOPE RISERS"
253,http://www.armslist.com/posts/6205253,For Sale:  Glock 23,"Middle TN, Tennessee, United States",$ 475,"Listed On: Friday, December 30, 2016",Handguns,Glock                                                                                ,40 S&W                                                                                ,Striker Fire                                                                                ,Pistol,"Gen 3 with night sights, 2 mags and box and acces.  Excellent condition.REDACTED"
254,http://www.armslist.com/posts/6205254,Want To Buy:  Ruger american,"Sumter, Columbia, South Carolina",Offer,"Listed On: Saturday, December 17, 2016",Rifles,Glock                                                                                ,40 S&W                                                                                ,Striker Fire                                                                                ,Rifle,Looking to buy or trade for a ruger american in any caliber. Let me know what you got.
255,http://www.armslist.com/posts/6205255,For Sale/Trade:  Radical firearms .300 BLK upper,"New river., Jacksonville, North Carolina",$ 325,"Listed On: Saturday, January 21, 2017",Rifles,Glock                                                                                ,300 Blackout (7.62x35mm)                                                                                ,Semi-automatic                                                                                ,Rifle,Like new Radical Firearms upper receiver with a weaver Kaspa 3-9x40 scope and weaver scope mount. Has had 20 rounds fired through it and comes with one box of Remington ammo. No BCG or charging handle included. Text REDACTED with offers. .300 BLK wasn't for me.
256,http://www.armslist.com/posts/6205256,For Sale:  Colt Python 'Double Diamond' .357 magnum 6inch STS with original box,"Multnomah county, Portland, Oregon","$ 2,900","Listed On: Saturday, December 10, 2016",Handguns,Colt                                                                                ,357 Magnum                                                                                ,Double Action                                                                                ,Revolver,"THIS IS NOT A SET. I have it in mint condition, with original matching serial numbered box. I have shot 500 rounds through it and then kept it. The front side is a red ramp pinned to the barrel, the rear sight is a target style adjustable for windage and elevation, bright stainless steel finish, smooth grips with Colt medallions... All Original. The bore is bright, with sharp rifling. Flawless condition, No scratch, crack and no blesmishes. Only 1000 was made, these python 'Double Diamonds' are extremely collectible and also for shooters. WILL SHIP TO YOUR FFL"
257,http://www.armslist.com/posts/6205257,For Sale:  Ruger sp101,"Charleston, Fort Smith, Arkansas",$ 500,"Listed On: Saturday, December 10, 2016",Handguns,Ruger                                                                                ,357 Magnum                                                                                ,Double / Single Action                                                                                ,Revolver,Excellent shape with box 479nine65four456
258,http://www.armslist.com/posts/6205258,For Sale/Trade:  Gen 2 glock 19,"Cape Coral, South West Florida, Florida",$ 475,"Listed On: Saturday, December 10, 2016",Handguns,Glock                                                                                ,9mm Luger (9x19)                                                                                ,Striker Fire                                                                                ,Pistol,Received in trade gen 2 glock 19 . Has light stipple job can be redone but works well as is. Comes with 4 mags. Two 15rnd  two with plus two extension.  Adjustable rear sight. No box it did not come with one. Barrel nicely polished as well as internals. Looking for other 9mm Xds 4.0. FNX 9 compact beretta or Taurus 92 . Or sig 9mm Just putting feelers out there.CASH PRICE $475 OBO would like to sell in next two days to cover unexpected bill in NE CAPE CORAL OR N FORT MYERS
259,http://www.armslist.com/posts/6205259,For Sale/Trade:  S&W 1911 Performance Center,"VB, Hampton Roads, Virginia","$ 1,200","Listed On: Monday, January 2, 2017",Handguns,Smith & Wesson                                                                                ,45 ACP                                                                                ,Single Action                                                                                ,Pistol,"Like new Performance center 1911 chambered in .45 ACP. Comes with everything shown in the picture. Do do your homework before contacting with offers, I'm not big on wasting time with stupid people."
260,http://www.armslist.com/posts/6205260,For Sale:  Remington 870 Furniture & Breacher Choke...,"Southern Pines/Fayetteville, Fayetteville, North Carolina",$ 110,"Listed On: Friday, January 13, 2017",Gun,Smith & Wesson                                                                                ,45 ACP                                                                                ,Single Action                                                                                ,Pistol,"I only put about 15 rounds through my 12 gauge Rem 870 Magnum Tactical before I took these off to change things up. This would be a great way to spruce up an 870 that just needs some love. This is almost $160 worth of parts through Remington, yours for $110 OBO. Includes everything pictured:SPS Express Synthetic Stock with Remington SuperCell recoil pad and the stock attachment boltSpeedfeed Synthetic Fore EndRemington Tactical Ported Breacher Choke (Cylinder choke)Respond to this email or call/text 352 - 219 - 7590."
262,http://www.armslist.com/posts/6205262,Want To Buy:  Glock 43,"Fresno, Fresno, California",Offer,"Listed On: Saturday, December 10, 2016",Handguns,no type,no type,no type,no type,Looking for a Glock 43
264,http://www.armslist.com/posts/6205264,For Sale:  ghillie up,"Janesville, Janesville, Wisconsin",$ 25,"Listed On: Saturday, December 10, 2016",Miscellaneous,no type,no type,no type,no type,ghillie
268,http://www.armslist.com/posts/6205268,For Sale:  WINCHESTER 101 12 GUAGE SHOTGUN,"MIDCITIES, Dallas, Texas",$ 995,"Listed On: Tuesday, February 28, 2017",Shotguns,Winchester                                                                                ,12 Gauge                                                                                ,Over and Under                                                                                ,Shotgun,"WINCHESTER MODEL 101 OVER / UNDER 12 GUAGE SHOTGUN. THIS GUN FEATURES A FINE CHECKERBOARD WALNUT STOCK AND FOREND. AN ENGRAVED RECEIVER WITH SINGLE SELECTIVE TRIGGER AND TANG SAFETY WITH BARREL SELECTOR. 26"" BARRELS IMP. / MOD. WITH A WIDE VENT RIB. 2 3/4"" CHAMBERS. COMES WITH WINCHESTER TAKE DOWN HARD CASE."
269,http://www.armslist.com/posts/6205269,For Sale:  Black Rain Ordnance  Spec 15,"Knoxville, Knoxville, Tennessee","$ 1,000","Listed On: Monday, January 9, 2017",Rifles,Winchester                                                                                ,223/5.56 NATO                                                                                ,Semi-automatic                                                                                ,Rifle,"I have a like new black rain ordnance spec 15 for sale, it has only had 10 rounds shot through it. Includes a Simmons red dot. 1000.00 firm and no trades, serious inquires only,  must be legal to own a gun."
270,http://www.armslist.com/posts/6205270,For Sale:  Glock 30S,"Fruita, Western Slope, Colorado",$ 700,"Listed On: Saturday, December 10, 2016",Handguns,Glock                                                                                ,45 ACP                                                                                ,Striker Fire                                                                                ,Pistol,"Glock 30S 45 acp Gen 3 on SF frame. Novak sights, 5 10rd mags (4 with Pearce grip extension), 2 13 rd, 1 Kriss 30rd kit. Excellent condition."
271,http://www.armslist.com/posts/6205271,For Sale:  Wts lmt mk18 upper with kac rail,"Terre haute, Terre Haute, Indiana",$ 800,"Listed On: Saturday, December 10, 2016",Gun,Glock                                                                                ,45 ACP                                                                                ,Striker Fire                                                                                ,Pistol,Lmt mk18 upper. Has Knights armament rail and kit. Also has lmt rear sight and nickel boron bcg and ch. will sell the upper complete for $800 or $700 without the bcg. Only trades I'm really interested in would be a Glock 34 plus cash. May also be interested in bulk 9mm or 223 if it's not some ridiculous price. Also willing to ship on buyers dime. Call or text REDACTED
272,http://www.armslist.com/posts/6205272,For Sale:  M&P 9 +3 17 rd mags,"Medford, Medford, Oregon",$ 325,"Listed On: Saturday, December 10, 2016",Handguns,Smith & Wesson                                                                                ,9mm Luger (9x19)                                                                                ,Striker Fire                                                                                ,Pistol,"About 1000 rounds through it absolutely no issues comes with 3 17 round mags, no box no papers no extras 325.00 firm."
274,http://www.armslist.com/posts/6205274,For Sale:  Bushnell DMR 3.5-21x50 G2,"Kansas City, Kansas City, Kansas","$ 1,000","Listed On: Thursday, December 15, 2016",Optics,no type,no type,no type,no type,I am selling my lightly used Bushnell.
275,http://www.armslist.com/posts/6205275,For Sale:  paintball rifles,"Janesville, Janesville, Wisconsin",$ 30,"Listed On: Saturday, December 10, 2016",Paintball/Airsoft,no type,no type,no type,no type,3 paintball rifles
277,http://www.armslist.com/posts/6205277,For Sale:  LNIB CZ 75 Compact,"Oxford/Wichita, Kansas, United States",$ 500,"Listed On: Saturday, December 10, 2016",Handguns,CZ USA                                                                                ,9mm Luger (9x19)                                                                                ,Double / Single Action                                                                                ,Pistol,"Looking to sell my CZ. It's a 75 compact model in 9mm. Comes with the original case, literature, 2 14rd mags, and the pictured holster. It was purchased new by me last month and has exactly 100 rds through it at this time. I'm primarily looking to sell at this time. I'm asking $500, my price is firm at this time so please refrain from the obligatory ""what's your bottom dollar?"" messages. The only trades I would consider at this time would be working something out for a Sig P220 or Desert Eagle 1911. FTF in the Winfield/Wellington area preferred but can potentially meet in the Wichita area for the right deal. Best way to reach me is by text to REDACTED. Have my CCL and can sign bill of sale if desired. If the listing is still up, it's still available. No shipping."
278,http://www.armslist.com/posts/6205278,For Sale:  Steyr Tactical Scout 308 Bolt Action with Leupold,"Washington, Washington, United States","$ 1,200","Listed On: Saturday, December 10, 2016",Rifles,Steyr                                                                                ,308 Marlin Express                                                                                ,Bolt Action                                                                                ,Rifle,"This Steyr Tactical Scout is in good condition. The fluted barrel's length is 19"". This rifle is chambered in .308. The butt-stock has a magazine well to hold a secondary magazine. The 3.8Lb trigger is very crisp and smooth. There is a Picatinny from the top of the action to the front of the stock. Flip-up backup sights are located in the Picatinny rails. Comes with a Leupold Vari-X III 1.5-5X 20 with Warne rings. There is an integral flip-out bipod. Comes with a Vero Vellini rifle sling. The rifle has had around 200 rounds fired through it"
279,http://www.armslist.com/posts/6205279,For Sale:  Near Mint Benjamin Model 247,"Valley, Medford, Oregon",$ 95,"Listed On: Monday, December 19, 2016",Air,Steyr                                                                                ,308 Marlin Express                                                                                ,Bolt Action                                                                                ,Rifle,"This is a near mint Benjamin Model 247.  Shoots .177 caliber Pellets or Darts.  Made in Racine, Wisconsin.  Original owner, purchased in the 80's.  Pistol is like new save for a small nick on the trigger guard shown in the pic.  I can truthfully say I don't think its even had a 1/4 can of pellets through it, if that!  See pics.  Still holds air like new.  Always properly stored.  One of the rare ones for sure and you'd be hard pressed to find another in this condition!  No box.  If interested, please include a Phone# with your email.  No Phone# = No Reply.  Sorry, just trying to avoid spam.  I Don't Text either but I'll call you back asap.  Local sale only.  Will not ship.  If ad is up, it's still for sale.  Thanks for looking!"
280,http://www.armslist.com/posts/6205280,For Sale:  Stevens 12 gauge model 9478 single shot,"Elizabethton, Tri-cities, Tennessee",$ 125,"Listed On: Saturday, December 10, 2016",Shotguns,Savage Arms                                                                                ,12 Gauge                                                                                ,Break Open                                                                                ,Shotgun,"single shot 12 gauge. shots and looks great. shots 3"" and 2 3/4"" shells. comes with 108 rounds (remington, Winchester, and federal)
and 10 super x rifled slugs."
282,http://www.armslist.com/posts/6205282,"For Sale/Trade:  Smith & Wesson 500 4"" sell/trade for longer barrel","North, Pittsburgh, Pennsylvania",$ 1,"Listed On: Saturday, December 10, 2016",Handguns,Smith & Wesson                                                                                ,500 S&W                                                                                ,Double / Single Action                                                                                ,Revolver,"Looking to sell or trade my 4"" barrel S&W 500 for a longer barrel version. 8"" or longer. . I will include a holster,  the hard case,  all original parts,  tools and manuals. If trading,  I'm looking to go even up or close to it. If selling, everything listed above and the ammo below is included:16-  500 gr Hornaday FP XTP 35-  350 gr Hornaday HP XTP 5-  Prograde 350 gr HP XTP 16-  Underwood 700 gr LFN GC 4-  empty casesI also will include a brand new brass brush (. 50 cal) Well over $200 dollars of ammo here.... Cash price for everything is $1150 obo"
284,http://www.armslist.com/posts/6205284,For Sale:  Ruger AR-556 FDE,"Renton, Seattle, Washington",$ 660,"Listed On: Sunday, January 1, 2017",Rifles,Ruger                                                                                ,223/5.56 NATO                                                                                ,Semi-automatic                                                                                ,Rifle,"Ruger, AR-556 FDE Color, Semi-Automatic Rifle, 5.56NATO/223Rem, 16.1"" Barrel, 1/2"" x 28 Thread Pitch, Anodized Finish, Collapsible Stock, Adjustable Flip-Up Rear & Adjustable Post Front Sight, 30Rd, 1 Magazine"
285,http://www.armslist.com/posts/6205285,For Sale:  Ruger 10/22,"west, Tulsa, Oklahoma",$ 175,"Listed On: Saturday, December 10, 2016",Rifles,Ruger                                                                                ,22 Long Rifle                                                                                ,Semi-automatic                                                                                ,Rifle,I have a used Ruger 10/22 in good condition. I have owned it for roughly three years and have fired somewhere around a thousand rounds through it.. I have cleaned it every time I have fired it and stored it in the gun safe.. Fun little rifle.. contact me at REDACTED..
287,http://www.armslist.com/posts/6205287,For Trade:  Custom AR15 for AR pistol.,"Melbourne, Orlando, Florida",Offer,"Listed On: Saturday, December 10, 2016",Rifles,no type,223/5.56 NATO                                                                                ,no type,Rifle,Text me what you got. Worst ill say is no. REDACTED
290,http://www.armslist.com/posts/6205290,For Sale:  Kahr PM9,"Frisco, Dallas, Texas",$ 500,"Listed On: Saturday, December 10, 2016",Handguns,Kahr                                                                                ,9mm Luger (9x19)                                                                                ,Double Action                                                                                ,Pistol,"For sale is a Kahr PM9. I have owned this gun for approx 3 years. It has been flawless. Used mainly as a gun to keep in a vehicle and pocket carried at times. Will come with the Gun, 1 6 rnd mag,  1 extended 7 rng mag, and Desantis Pocket Holster.  I frequent Frisco Gun Club and if you would like to shoot the gun you are more than welcome to meet me there. No trades. Questions or specific pictures text me at 918-Eight five five-five 7 four 9"
291,http://www.armslist.com/posts/6205291,For Sale/Trade:  H&K VP9 LE,"Brownsville, Pittsburgh, Pennsylvania",$ 525,"Listed On: Sunday, January 1, 2017",Handguns,Heckler & Koch                                                                                ,9mm Luger (9x19)                                                                                ,Striker Fire                                                                                ,Pistol,"Mint condition, like new. Less than 50 rds through it. The LE model comes with factory installed Meprolight night sights and 3 15rd magazines.  Awesome gun!  I just bought the threaded barrel version so I don't need this one any more.  $525 cash or trade for something worth around $650.Due to Armslist spam and it's just annoying, I will not respond to ""Is it still for sale"".  If the ad is still up, it's still for sale. Thanks"
292,http://www.armslist.com/posts/6205292,For Sale/Trade:  Century CETME 308,"GRAHAM, Greensboro, North Carolina",$ 575,"Listed On: Tuesday, December 27, 2016",Rifles,Century International Arms                                                                                ,308/7.62 NATO                                                                                ,Semi-automatic                                                                                ,Rifle,"Century CETME 308 with OD green furniture, leather sling, one mag. Located in Graham NC.Please do not send phone numbers, I'm bot calling, texting, or giving my number out unless we work out a deal.$575 is the price, and I'm firm on it, please don't ask what my best price is, I will not reply."
