,url,title,location,price,post date,category,manufacturer,caliber,action,firearm type,postcontent
718,http://www.armslist.com/posts/6913718,For Sale:  Mosin M44 Chinese T-53,"Owatanna, Minneapolis / St. Paul, Minnesota",$ 275,"Listed On: Monday, June 19, 2017",Rifles,no type,7.62x54R                                                                                ,Bolt Action                                                                                ,Rifle,"up for sale is a MATCHING T53, great bore and good stock, every part # matches, most don't. Only about 30rds put through it.Must sign bill of sale. Would prefer ptp or ptcThanks for looking!"
720,http://www.armslist.com/posts/6913720,For Sale:  Ruger American Pistol - 9mm Pistol,"Canton, Ohio, United States",$ 400,"Listed On: Sunday, June 4, 2017",Handguns,Ruger                                                                                ,9mm Luger (9x19)                                                                                ,Double Action                                                                                ,Pistol,"*Excellent Condition (95%) - Little to no blemishes on the firearm, hardly appears to have been fired. *Includes original case w/ two magazines (one extended), extra grips and paperwork"
722,http://www.armslist.com/posts/6913722,For Sale:  24in precision ar upper ( all the best components),"Hickory, Hickory / Lenoir, North Carolina","$ 1,000","Listed On: Tuesday, June 20, 2017",Rifles,no type,223/5.56 NATO                                                                                ,Semi-automatic                                                                                ,Rifle,i have a brand new 24in precision ar upper build I just got done with but things have changed so on to something different. Here is the build list lantac side charging upper reciver with smooth cam pin 24in rainer arms shilen match barrel with deep fluting the whole barrel with 11 degree target crown suleralitive arms 936 adjustable gas block with adjust tool lantac nitrite rifle length gas tube seekings sp3r v3 15in handguard aim surplus lightweight nib bcg (was going to have it modified for a bolt handle by gunsmith) standard charging handle this is thing should be a very nice shooter. Asking 1000 shipped
723,http://www.armslist.com/posts/6913723,For Sale:  AK - WASR - 10,"Belgrade, Bozeman, Montana",$ 700,"Listed On: Friday, June 30, 2017",Rifles,Century International Arms                                                                                ,7.62x39                                                                                ,Semi-automatic                                                                                ,Rifle,WASR-10. Original with 30 rounds through it. Comes with two AK Pmags. Includes original box from Century arms.  This was an Atlantic Firearms purchase and is a QC inspected rifle.$700
725,http://www.armslist.com/posts/6913725,For Sale:  Smith & Wesson M&P AR-15,"Kalamazoo, Kalamazoo, Michigan",$ 750,"Listed On: Sunday, June 4, 2017",Rifles,Smith & Wesson                                                                                ,5.56×45mm NATO                                                                                ,Semi-automatic                                                                                ,Rifle,"Smith & Wesson M&P AR-15, with 10 magazines, tactical Cary bag, and 320 rounds. I bought it brand new and have only ever fired 5 shots from it."
727,http://www.armslist.com/posts/6913727,For Sale:  Bushmaster AR15 factory gun,"South, Rock Hill, South Carolina",$ 625,"Listed On: Saturday, June 10, 2017",Rifles,Bushmaster                                                                                ,223/5.56 NATO                                                                                ,Semi-automatic                                                                                ,Rifle,Here's a factory bushmaster gun. Not a home built gun. It has a cheap rail on it and has been fired very little. It will come with 2 mags. Not looking for trades at all. Buying a new vette and can't give them your junk guns for it. Mine either. I tried. Hahaha 625.00
732,http://www.armslist.com/posts/6913732,For Sale:  Sig 2022 full FDE w/ night sights 9mm,"Sea World, San Antonio, Texas",FREE,"Listed On: Wednesday, June 14, 2017",Handguns,Sig Sauer                                                                                ,9mm Luger (9x19)                                                                                ,Double / Single Action                                                                                ,Pistol,"Gun comes with night sights, 2 mags, grip extension, and case. It's in like new condition. $520. Text anytime 210-248-708four. No trades at this time. Thank you."
734,http://www.armslist.com/posts/6913734,For Sale/Trade:  Remington 700 AAC-SD .308,"Austinburg, Ashtabula, Ohio",$ 700,"Listed On: Wednesday, June 14, 2017",Rifles,Remington                                                                                ,308/7.62 NATO                                                                                ,Bolt Action                                                                                ,Rifle,"For sale: New in Box, unfired Remington® Model 700™ SPS™ Tactical AAC®-SD™ with Threaded Muzzle, with Bushnell Scope $700. See below for details
Model: Remington 700 SPS Tactical AAC-SD
Caliber: 308 Win
Mag. Capacity: 4+1
BBL Length: 20 inches
Twist Rate: 1 turn in 10 inches
Barrel Material: Carbon Steel
Barrel Type: Heavy Contour 5/8-24 Threaded Muzzle
Sights: None
Barrel Finish: Black Oxide
Overall Length: 39 5/8 inches
Stock Material: Hogue Overmolded
Stock Color: Ghillie Green
Length of Pull: 13 3/8 inches
Avg. Weight: 7 1/2 lbs
MSRP: $756.57 (Remington)
 
Scope: Bushnell Trophy XLT DOA 600 Reticle Riflescope, 3-9x40
Quality optics with stunning HD clarity
100% quality materials used and tested extensively
Beautiful design and durability built to last
Hunting riflescope with 3-9x magnification and 40mm objective lens
Class-leading 91 percent light transmission and durable 1-piece tube
Fully multicoated optics; Butler Creek flip-up caps protect against moisture
Dead On Accurate (DOA) 600 reticle dramatically extends effective range
Fast-focus eyepiece; measures 11.9 inches; weighs 13.8 ounces
MSPR: $97.85 (Amazon)"
735,http://www.armslist.com/posts/6913735,Want To Buy:  Winchester 100 Carbine,"Weare, Concord, New Hampshire",Offer,"Listed On: Saturday, June 10, 2017",Rifles,Remington                                                                                ,308/7.62 NATO                                                                                ,Bolt Action                                                                                ,Rifle,im looking for a Winchester Model 100 Carbine in either 243 or 308.
739,http://www.armslist.com/posts/6913739,For Trade:  REDACTED,"REDACTED, Ohio, United States",Offer,"Listed On: Sunday, June 4, 2017",Miscellaneous,no type,no type,no type,no type,REDACTED
740,http://www.armslist.com/posts/6913740,For Sale/Trade:  Colt Model 2000 All American 9mm; Excellent Condition In Box; RARE!,"Westerville, Columbus, Ohio",$ 550,"Listed On: Sunday, June 4, 2017",Handguns,Colt                                                                                ,9mm Luger (9x19)                                                                                ,Double Action                                                                                ,Pistol,"SALE PENDING:  I have for sale a rare and excellent condition Colt Model 2000 All American double action, full size semi-auto 9mm pistol.  It was made in the early 1990's, and difficult to find in this condition with the box.   It comes with the factory box and everything that comes with it new. Buyer must be at least 21 years of age, legal to own a firearm, and show a valid Ohio ID. No shipping. I will look at handgun trades only.  Pickup in Westerville."
741,http://www.armslist.com/posts/6913741,For Sale:  Kimber custom 2,"Norman, Oklahoma City, Oklahoma",$ 600,"Listed On: Sunday, June 4, 2017",Handguns,Kimber                                                                                ,45 ACP                                                                                ,Single Action                                                                                ,Pistol,used Kimber custom iiwith night sightscall Wayne REDACTED
742,http://www.armslist.com/posts/6913742,For Sale:  FN FNS 9 with holsters,"west, Cleveland, Ohio",$ 450,"Listed On: Sunday, June 4, 2017",Handguns,FN Herstal S.A.                                                                                ,9mm Luger (9x19)                                                                                ,Striker Fire                                                                                ,Pistol,Excellent condition FNS 9. 3 x 17 rounds mags2 holstersCrossbread OWB Leather/kydexOsborn IWB leather/kydexBoth holsters we used very little and in great shapeBox and all paper work included$450 or best reasonable offer
743,http://www.armslist.com/posts/6913743,For Sale:  ar15 upper,"mebane, Greensboro, North Carolina",$ 175,"Listed On: Sunday, June 4, 2017",Rifles,Palmetto State Armory                                                                                ,223/5.56 NATO                                                                                ,Semi-automatic                                                                                ,Rifle,"by far the best price on armslist.new psa 16'' upper.4150 chrome moly vanadium,1/7 twist,forward assist,dust cover.''f'' marked front sight post,5.56 nato/.223.no bcg.will include flip-up rear sight for another $25.located in mebane near I-85/40"
744,http://www.armslist.com/posts/6913744,For Trade:  Kahr k9  9mm,"South county, St. Louis, Missouri",Offer,"Listed On: Sunday, June 4, 2017",Handguns,Kahr                                                                                ,9mm Luger (9x19)                                                                                ,Semi-automatic                                                                                ,Pistol,Karhr k9 9 mm two mags night sights n box papers
747,http://www.armslist.com/posts/6913747,For Sale:  RUGER MARK II .22 TARGET- MKII,"Anderson County, Greenville, South Carolina",$ 300,"Listed On: Sunday, June 4, 2017",Handguns,Ruger                                                                                ,22 Long Rifle                                                                                ,Single Action                                                                                ,Pistol,"For Sale: Excellent Condition, 98% +, Ruger Mark II Target Pistol.  5 1/2"" Heavy Barrel with Adjustable Sights.  Reliable, Accurate Pistol that has been well taken care of.  It has always been properly lubicated and been cleaned from the breech to protect the rifling at the muzzle.  This pistol was manufactured in 2000 and does not have the cheap plastic loaded chamber indicator, interlock, or magazine disconnect of the Mark III Series, and is a bargain compared to the new Mark IV Series that also have a magazine disconnect and have an Aluminum Frame in the Blue Versions.  This is a solid, all steel pistol (with the exception of the grip panels) ready for years of reliable service.Private Sale to Qualified SC Residents$300 Cash Sale Picked up in Anderson County"
748,http://www.armslist.com/posts/6913748,"For Sale:  7.62/51 ,enfield","northern, Louisville, Kentucky",$ 750,"Listed On: Sunday, June 4, 2017",Rifles,Century International Arms                                                                                ,7.62x51mm NATO                                                                                ,Bolt Action                                                                                ,Rifle,"enfield /7.62 x 51   7.62mm 2A1 RIFLE   MFG 1965.    308 WINCHESTER,  HAS 2 HOLES FOR A SCOPE MOUNT , GOOD CONDITION. MAG FEED . /   WITH 1000 ROUNDS OF GERMAN TRAING AMMO  40 GRAIN PLASTIC BULLET PENTERATE 2X4 AT 200 YARDS ."
752,http://www.armslist.com/posts/6913752,For Sale:  **SCAM ALERT** USMC 1911,"St. Charles, St. Louis, Missouri",FREE,"Listed On: Saturday, July 1, 2017",Handguns,no type,no type,no type,no type,"These were from an auction, and I'm almost be certain he bought it for a LOT less that $4000.  He's already come down $500. Buying a weapon to resell for a profit isn't lawful for a non-dealer, from what I understand.  Flag it as a scam and let's keep this site on the up-and-up."
753,http://www.armslist.com/posts/6913753,For Sale:  Glock 37  with 1050 rounds ammo,"Carollwood, Tampa/St. Pete, Florida",$ 700,"Listed On: Thursday, February 8, 2018",Handguns,Glock                                                                                ,45 GAP                                                                                ,Striker Fire                                                                                ,Pistol,For sale is a used Glock 37. Gen 3. This is the full-size 45 GAP.  Comes with four Glock factory magazines. In addition to the gun you will get 1050 rounds of ammunition. MAsking $700Gun sale requires CWP and gun transfer form. No exceptions Will need to pick up in the Carrollwood area.  I do not travel. I have a regular job Monday through Friday so pick up will have to be after 6 o'clock during the week.if you see the ad I still have the gun available.
756,http://www.armslist.com/posts/6913756,Want To Buy:  Mosin Barrel,"Maryland Heights, St. Louis, Missouri",$ 1,"Listed On: Sunday, June 4, 2017",Rifles,no type,no type,no type,Rifle,Looking to buy a 91/30 Mosin barrel.
757,http://www.armslist.com/posts/6913757,For Sale/Trade:  Glock 21 gen 4,"Hertford, North Carolina, United States",$ 0,"Listed On: Thursday, June 15, 2017",Handguns,Glock                                                                                ,45 ACP                                                                                ,Striker Fire                                                                                ,Pistol,Brand new with factory night sights
758,http://www.armslist.com/posts/6913758,For Sale/Trade:  LoneWolf g19 barrel,"Mt. Sterling, Lexington, Kentucky",$ 100,"Listed On: Sunday, June 4, 2017",Gun,Glock                                                                                ,45 ACP                                                                                ,Striker Fire                                                                                ,Pistol,Great condition in original box Will come with one g19 mag if you want to have this as a 9mm conversion barrel for your 23Can be used with a g19 or g23 I used it with my gen4 19 and my gen3 g23 both cycled and shot very accurately Mainly looking to sell for some extra cash but would listen to trade offers Can add boot or my aimpoint for another pistol Text or call for fastest response REDACTED
759,http://www.armslist.com/posts/6913759,For Sale:  VEPR 12 SEMI AUTO SHOTGUN,"Albuquerque, Santa Fe, New Mexico",$ 925,"Listed On: Sunday, June 4, 2017",Shotguns,Glock                                                                                ,12 Gauge                                                                                ,Semi-automatic                                                                                ,Shotgun,Hi I have a 2012 Russian molot VEPR 12 semi automatic shotgun for sale only 30 rounds put through it it has the original wooden ak style removable stock comes in nice hard plastic case comes with one 5 round and one 12 round magazine and some ammo also have original book it came with asking $925 FIRM cash only I live in Albuquerque NM must show ID and sign bill of sale seriously inquiries only please Picture are exactly what shotgun looks like  Only selling because I am moving and It is not legal to have in the state Im moving tooEmail if interested :)
760,http://www.armslist.com/posts/6913760,For Trade:  Daniel Defense DDM4 V11 Kryptek Typhoon *New Un fired*,"North/West, Knoxville, Tennessee",Offer,"Listed On: Saturday, June 10, 2017",Rifles,Daniel Defense                                                                                ,223/5.56 NATO                                                                                ,Semi-automatic                                                                                ,Rifle,"Daniel Defense DDM4V11 Kryptek TyphoonNew, Un fired, Factory new, Hard Case, 1 Mag,  Flip up sights MBUSTrade for IWI Tavor"
761,http://www.armslist.com/posts/6913761,For Sale:  32 cal revolver,"st pete, Tampa/St. Pete, Florida",$ 50,"Listed On: Saturday, July 22, 2017",Handguns,Daniel Defense                                                                                ,223/5.56 NATO                                                                                ,Semi-automatic                                                                                ,Revolver,"I have a Hopkins & Allen xl double action , part revolver or a small project.  The trigger doesn't return back after fire. If you pull trigger forward after fire with your finger it works good."
763,http://www.armslist.com/posts/6913763,For Sale:  XDs,"Tinley Park, Chicago, Illinois",$ 375,"Listed On: Sunday, June 4, 2017",Handguns,Springfield                                                                                ,9mm Luger (9x19)                                                                                ,Striker Fire                                                                                ,Pistol,"I have a Springfield Armory XDs range kit: 9mm, 3.3"" barrel. 3 mags, 3 holsters replaced rear slide plate but I do have the original plate (100 rounds fired) $375.00Pictures upon request. Text (7O8)-491-5O41local sale, FtF. Isp rules followed."
764,http://www.armslist.com/posts/6913764,For Sale:  Beretta 92FS,"Severy, Wichita, Kansas",$ 550,"Listed On: Sunday, June 4, 2017",Handguns,Beretta USA                                                                                ,9mm Luger (9x19)                                                                                ,Double / Single Action                                                                                ,Pistol,Beretta 92FS 3 17 round mags. Paddle holster and shoulder holster. Low round count less then 200. No trades at this time. 550$ cash . Email or text is best REDACTED.
765,http://www.armslist.com/posts/6913765,For Sale/Trade:  Real Zenitco AK Handguard,"Gastonia/Charlotte, Charlotte, North Carolina",$ 0,"Listed On: Tuesday, June 13, 2017",Gun,Beretta USA                                                                                ,9mm Luger (9x19)                                                                                ,Double / Single Action                                                                                ,Pistol,"I have near new Zenitco (short ) AKM Handguard imported by Rob with AK Operator . These you can no longer find due to USA import bans ! They cost me over $200 to purchase from Rob , any reasonable offer will not be refused !! 98zero-42nine-013two text me"
766,http://www.armslist.com/posts/6913766,For Sale:  Delton Ar-15,"Roseville, Detroit, Michigan",$ 525,"Listed On: Friday, July 21, 2017",Rifles,Del-ton Inc                                                                                ,223/5.56 NATO                                                                                ,Semi-automatic                                                                                ,Rifle,I have a delton AR-15 with upgrades such as anti walk pins spikes tactical buffer phase 5 trigger guard strike industry take down pins magpul rubber grips magpul moe stock magpul moe handguard. Text me at REDACTED text only may be interested in other guns but cash is king. Comes with hardcase
767,http://www.armslist.com/posts/6913767,For Sale:  Hi-point JHP .45,"Beach Lake, Wilkes-Barre/Scranton, Pennsylvania",$ 150,"Listed On: Wednesday, July 19, 2017",Handguns,Hi Point                                                                                ,45 ACP                                                                                ,Single Action                                                                                ,Pistol,Like new with all original packaging! Put 200 rounds through it without one flaw! Suprisinly accurate and reliable for such an inexpensive handgun. Comes with two 10 round magazines. Only looking to sell because I've recently received my carriers permit and looking for something I can conceal. Maybe be open to trades.
768,http://www.armslist.com/posts/6913768,For Sale:  Canik TP9 SF,"Dover, Tampa/St. Pete, Florida",$ 345,"Listed On: Saturday, July 15, 2017",Handguns,Century International Arms                                                                                ,9mm Luger (9x19)                                                                                ,Striker Fire                                                                                ,Pistol,"Canik 9mm very accurate.  Selling because have too many 9mm hand guns. Comes with holster, 2 mags, 2 back plates, speed loader, gun cleaner & lock.  Price is FIRM."
769,http://www.armslist.com/posts/6913769,For Sale:  9mm dies and bullets,"All, Cheyenne, Wyoming",$ 50,"Listed On: Sunday, June 4, 2017",Reloading,Century International Arms                                                                                ,9mm Luger (9x19)                                                                                ,Striker Fire                                                                                ,Pistol,I have a set of 9mm dies for sale. In addition I need to sell some 9mm and 22 cal bullets. Asking 50 bucks but make an offer. Thanks.
770,http://www.armslist.com/posts/6913770,For Sale:  MAGPUL milspec ACS Stock,"South, Roanoke, Virginia",$ 75,"Listed On: Sunday, June 4, 2017",Gun,Century International Arms                                                                                ,9mm Luger (9x19)                                                                                ,Striker Fire                                                                                ,Pistol,BRAND NEW IN THE BOX - never installed black ACS stock AR-15 compatible
771,http://www.armslist.com/posts/6913771,For Sale/Trade:  Mossberg 715T,"Knoxville, Knoxville, Tennessee",$ 225,"Listed On: Sunday, June 4, 2017",Rifles,Mossberg                                                                                ,22 Long Rifle                                                                                ,Semi-automatic                                                                                ,Rifle,Mossberg 715T AR style 22LR like new with 2 25 round nvm magazines
772,http://www.armslist.com/posts/6913772,For Sale:  Stag Arms complete lower,"Sea World, San Antonio, Texas",FREE,"Listed On: Sunday, June 4, 2017",Rifles,Stag Arms                                                                                ,223/5.56 NATO                                                                                ,Semi-automatic                                                                                ,Rifle,Complete lower comes with FDE Magpul furniture and also the new black Hexmag and black grip. $350 obo. No trades at this time. Text anytime at 210-248-708four.
774,http://www.armslist.com/posts/6913774,For Sale:  Bulk 22LR Winchester-Great deal!!,"St.Louis, St. Louis, Missouri",FREE,"Listed On: Sunday, June 4, 2017",Ammo,no type,no type,no type,no type,"I have for sale 1700 rds of Winchester 22LR- 1000rds of Winchester White Box, and 700rds of Wincester Super X. First come, first serve. Will not split up. Asking only $120. Thanks!!"
775,http://www.armslist.com/posts/6913775,For Sale:  Swiss Schmidt Rubin,"Chattanooga, Chattanooga, Tennessee",$ 325,"Listed On: Sunday, June 4, 2017",Rifles,no type,no type,no type,Rifle,"Selling my Schmidt Rubin model 1889 straight pull bolt action rifle, caliber 7.5 x 53.5 mm. As you can see from the pictures the rifle is in very good condition with an excellent bore. No rust or pitting. It has the 12 round magazine which is often found missing on some of these rifles. The workmanship on these rifles is superb. Asking $325 OBO.Can email, or  call or text  423-Five44-1672. If you call be sure to leave a voicemail if no immediate answer."
776,http://www.armslist.com/posts/6913776,For Trade:  Glock 17 Gen 4,"Hudson, Nashua, New Hampshire",Offer,"Listed On: Sunday, June 4, 2017",Handguns,Glock                                                                                ,9mm Luger (9x19)                                                                                ,Striker Fire                                                                                ,Pistol,Good condition Glock 17 Gen 4 with Trijicon night sights. Comes with all factory swag. Has 400 rounds through the barrel. All FMJ.
