,url,title,location,price,post date,category,manufacturer,caliber,action,firearm type,postcontent
725,http://www.armslist.com/posts/6221725,For Sale/Trade:  ** KAHR CW380 TUNGSTEN - LIMITED EDITION **,"Palm Beach, Palm Beach, South Florida",$ 375,"Listed On: Thursday, December 15, 2016",Handguns,Kahr                                                                                ,380 ACP                                                                                ,Striker Fire                                                                                ,Pistol,"Selling my limited 500 piece run of the CW380 in Tungsten. Absolutely mint condition. 3 mags through. Don't shoot .380 but got this in a trade. looking for other 9mm compact handguns or sell for cash. This comes in Kahrs ""high end"" plastic box, not cardboard, also comes with the two mags instead of one. Kahr CW380 will come with : - Pistol - 2 mags case, paperwork..etc- Box of ammo - JHP and FMJ - New Holster* Price is fair especially since these are limited run of 500, plus Ammo and holster! CONTACT REDACTED"
728,http://www.armslist.com/posts/6221728,For Sale/Trade:  Stoeger 8040f Cougar .40,"Montgomery, Montgomery, Alabama",$ 275,"Listed On: Tuesday, December 20, 2016",Handguns,Beretta USA                                                                                ,40 S&W                                                                                ,Double / Single Action                                                                                ,Pistol,"Stoeger is made in Turkey at the Beretta plant. Looks, feels, and shoots like Beretta at a fraction of the cost. Comes in box with holster. This is a 90 percent gun. Shot very little.Trade offers welcome."
729,http://www.armslist.com/posts/6221729,For Sale:  Kel-Tec Pmr-30 Nib,"275 loop, Cincinnati, Ohio",$ 450,"Listed On: Thursday, December 15, 2016",Handguns,Kel-Tec                                                                                ,22 WMR                                                                                ,Double / Single Action                                                                                ,Pistol,New in box Kel-Tec pmr-30. Comes with everything from factory.
731,http://www.armslist.com/posts/6221731,For Trade:  sd40ve for any revolver,"manchester, Manchester, New Hampshire",Offer,"Listed On: Thursday, December 15, 2016",Handguns,no type,no type,no type,no type,Looking to trade ly sw sd40ve 17rnd w 2 mags fora revolver perferably a 357
732,http://www.armslist.com/posts/6221732,For Sale/Trade:  Yugo PAP M85,"Loveland, Cincinnati, Ohio",$ 950,"Listed On: Thursday, December 15, 2016",Rifles,Century International Arms                                                                                ,223/5.56 NATO                                                                                ,Semi-automatic                                                                                ,Rifle,"Like new M85 converted to a rifle for sale or possibly trade. The rifle has the USMG fake suppressor barrel ext and fixed triangle stock attached. The stock is held on by the pistol grip so the rear trunion is still undrilled. The rifle can be converted back to a pistol if you want and I do have the krink muzzle break the pistol comes with. I will not separate the stock and barrel extension though, it all comes as one. This takes STANAG mags so the same as any AR but with the reliability of an AK. 5 mags total and the gun has had less than 100 rounds through it. Selling mostly because I don't want to deal with 41f in converting it into an SBR."
733,http://www.armslist.com/posts/6221733,For Sale:  Five-Seven 5.7x28 Flat Dark Earth FDE,"Charleston, Charleston, West Virginia","$ 1,000","Listed On: Thursday, January 5, 2017",Handguns,FN Herstal S.A.                                                                                ,223/5.56 NATO                                                                                ,Semi-automatic                                                                                ,Pistol,Five Seven MKII Pistol. with adjustable sights. 5.7x28 by FNH Three 20 round magazines. original box and paper work. no marks or wear. looks new. about 60 rounds fired thru. No trades but will ship if needed.
735,http://www.armslist.com/posts/6221735,For Sale:  sig sauer p229 SRT,"kalamazoo, Kalamazoo, Michigan",$ 550,"Listed On: Monday, July 17, 2017",Handguns,Sig Sauer                                                                                ,40 cal                                                                                ,Double / Single Action                                                                                ,Pistol,"sig sauer p229 in .40 cal. west German frame, short reset trigger, sig lights sights, and sig sauer extreme grip with one magazine. good clean pistolcomes with case, one magazine, and leather IWB holsterpossible trade for a trailer"
736,http://www.armslist.com/posts/6221736,For Sale:  Aero Precisions M5 AR-10 .308,"Kearny Mesa, San Diego, California","$ 1,750","Listed On: Thursday, December 15, 2016",Rifles,Sig Sauer                                                                                ,308/7.62 NATO                                                                                ,Semi-automatic                                                                                ,Rifle,"Complete Aero Precisions AR-10 18"" barrel in 7.62x51 .308.Package includes: 2-10 round Pmag Gen31-20 round Pmag disassembledMagpul Gen 2 Mbus front and rear set sightsLuth-AR buffer kit and stockAero Precisions NiB BCGBCM Mod3 charging handle with extended latch15"" keymod handguard M5E1 with 18"" barrel 1/10 twistAres Armor Effin-A MKII .308Ergo gripAero Precisions M5 .308 LPKBullet button180 rounds of quality ammo"
738,http://www.armslist.com/posts/6221738,For Sale:  kimber pro cdp 2 1911,"kalamazoo, Kalamazoo, Michigan",$ 750,"Listed On: Monday, July 17, 2017",Handguns,Kimber                                                                                ,45 ACP                                                                                ,Double / Single Action                                                                                ,Pistol,"kimber pro cdp 2 very nice gun .45 caliber. kimbers custom shop gun 1911.comes with case, one magazine, and leather IWB holsterpossible trade for a trailer"
740,http://www.armslist.com/posts/6221740,For Sale:  Bulgarian AK-47,"Tennessee, Tennessee, United States","$ 1,200","Listed On: Thursday, December 15, 2016",Rifles,no type,7.62x39                                                                                ,Semi-automatic                                                                                ,Rifle,"Arsenal's semi-automatic modern sporting rifle in 7.62x39mm caliber with a forged and milled receiver, a hot-die hammer-forged bolt, bolt carrier group, and trigger group. The 16.25"" chrome-lined, hammer-forged barrel has a removable 4-port muzzle brake with a 14x1mm left-hand thread. It has a reinforced black polymer stock set with a stainless steel heat shield inside the lower handguard and a fixed, intermediate-length buttstock (13.4"" LOP) with a trap door for the cleaning kit.Specifications Action: Semi-Automatic Caliber: 7.62x39mm Barrel Length: 16.3"" Capacity: 10+1 OAL: 36.5"" Weight: 8 lbs Stock Description: Fixed Synthetic Black Metal Finish: Black Muzzle: Muzzle Brake Receiver Material: Steel Sights: Adjustable 800m Rear Barrel."
741,http://www.armslist.com/posts/6221741,For Sale/Trade:  VARIOUS AMMO,"Davison, Flint, Michigan",$ 0,"Listed On: Tuesday, December 20, 2016",Ammo,no type,7.62x39                                                                                ,Semi-automatic                                                                                ,Rifle,"For trade (or sale if i cant find trades) is a bunch of different kinds of ammo.  Ive got600+ rounds of 44 special600+rounds of 44 magnum100 rounds of 7.92x54200+ rounds of M2 30-06 steel core AP. 100 rounds of 44 Russian 300+rounds of 357 magnum/38 special1000+ rounds of .308/7.62 NATO ----a little bit of this is soft tip                  hunting ammo, but most of it is FMJ nato stuff, even have about        700 rounds of 7.62 nato that is belted 100 rounds of 270??? Hundreds of rounds of random stuff like 12 ga, 20 ga, wierd rifle and pistol cartidges."
742,http://www.armslist.com/posts/6221742,For Sale:  Ruger P89DC,"Bay City, Michigan, United States",$ 300,"Listed On: Thursday, December 15, 2016",Handguns,Ruger                                                                                ,9mm Luger (9x19)                                                                                ,Semi-automatic                                                                                ,Pistol,Ruger P89DC with 2 30rd mags
745,http://www.armslist.com/posts/6221745,For Sale:  brand new ruger lcp 2 with extras and ammo,"springfield, Eugene, Oregon",$ 480,"Listed On: Saturday, January 14, 2017",Handguns,Ruger                                                                                ,380 ACP                                                                                ,Double / Single Action                                                                                ,Pistol,"for sale is a new ruger lcp 2 comes with box, paperwork, 3 magazines, thats 2 extra mags, pocket holster, and a bunch of .380 ammo, new in boxes. buyer pays background check/transfer fee."
746,http://www.armslist.com/posts/6221746,For Sale/Trade:  HM Defense w/ extras. Trade for CZ Scorpion Carbine + cash.,"Miamisburg, Dayton, Ohio","$ 1,500","Listed On: Monday, March 27, 2017",Rifles,Daniel Defense                                                                                ,5.56×45mm NATO                                                                                ,Semi-automatic                                                                                ,Rifle,"I have a custom built, from the factory, HM Defense AR-15. I had this gun built for 3gun matches but just don't have the money or time for 3gun. Just focusing on pistol competition right now. Has a mid-length gas system, nickel boron BCG, 15"" rail, Vortex Crossfire II 1-4x, Vortex mount. MFT Minimalist stock, Lantac Dragon brake, Billet lower, 3 mags, and a Drago soft case. Text me if interested REDACTEDI am am looking for cash mainly. The ONLY trades I would consider is a CZ Scorpion carbine + cash, a competition ready double stack 1911 in .40 with mags or a CZ Tactical Sport in .40 with mags."
747,http://www.armslist.com/posts/6221747,For Sale:  850 rounds 45 acp,"Lilburn, Atlanta, Georgia",$ 220,"Listed On: Thursday, December 15, 2016",Ammo,Daniel Defense                                                                                ,5.56×45mm NATO                                                                                ,Semi-automatic                                                                                ,Rifle,850 rounds sellior and belliot 45 ACP $220 Firm
750,http://www.armslist.com/posts/6221750,For Sale/Trade:  AR15 DMR / coyote rifle  custom,"New Albany, New Albany, Indiana",$ 900,"Listed On: Thursday, January 19, 2017",Rifles,no type,223/5.56 NATO                                                                                ,no type,Rifle,"DMR / Coyote rifle 223 Wylde chamber AERO PRECISION ENHANCED M4E UPPER Aero precision gen 2 lower 18"" barrel stainless steel 1/7"" twist Palmetto state Vg6 epsilon muzzle break recoils like A 22lr lolRRA A2 buttstock and spring Magpul K2+ grip Geissele SSA-E 2-stage trigger 3.5 lbs Clamp on gas block which is better for accuracy Rifle length gas system Nitride BCG very quality stuff NO SCOPE OR MOUNT !!$900 OBO ****can save you $150 off this price if I take the Geissele trigger out and replace it with a milspec trigger I have !!****Elizabeth ,IN is location CALL OR TXT REDACTED"
751,http://www.armslist.com/posts/6221751,For Sale:  RUGER 9CL -PLUS LOTS OF EXTRAS,"Branson, Springfield, Missouri",$ 695,"Listed On: Wednesday, December 21, 2016",Handguns,Ruger                                                                                ,9mm Luger (9x19)                                                                                ,no type,Pistol,"Ruger 9CL , five magazines, two holsters, One holster is a custom-made alligator, gun carrying pouch, Ruger bag has eight magazine slots, two large pockets in the back will carry 100 rounds each, A lulu cartridge loader, 230 rounds of 9 mm  Winchester regular ammo,  Winchester  20 rounds 9 mm hollowpoint , Only approximately 70 rounds ran through. Like brand-new, also included new cleaning kit never used"
752,http://www.armslist.com/posts/6221752,For Sale/Trade:  LC9,"Fredericksburg, Northern Virginia, Virginia",$ 300,"Listed On: Thursday, December 15, 2016",Handguns,Ruger                                                                                ,9mm Luger (9x19)                                                                                ,Double Action                                                                                ,Pistol,LC9 like new2 magsboxlock
753,http://www.armslist.com/posts/6221753,For Trade:  FNS9,"NE Wichita, Wichita, Kansas",Offer,"Listed On: Thursday, December 15, 2016",Handguns,FN Herstal S.A.                                                                                ,9mm Luger (9x19)                                                                                ,Striker Fire                                                                                ,Pistol,"I have an FNS9 I'd like to trade.Gun is in pretty good condition.  In between a G17 and G19 in size, and very light weight. Will come in its case with three 17 round magazines, and it has night sights.Have several full sized handguns, so I'd like to trade it for something smaller.  Looking for a single stack 9mm, particularly a G43, Walther PPS (prefer M2), or XDs, but open to others.  Would also like a similar single stack 45 like an XDs or Shield 45.  No Taurus or Kel Tec.  The only 380 Id consider would be a G42.  Cash either way depending on what you have, I'm looking at a trade value of 550 for the FNS.  If interested feel free to call/text three 16 six 19 nine 853, texts are best as I may not be able to respond until this afternoon.Thanks!"
754,http://www.armslist.com/posts/6221754,For Sale:  Sightron S-TAC 4-20x50 MOA /MOA SCOPE,"Louisville, Louisville, Kentucky",$ 350,"Listed On: Saturday, January 7, 2017",Optics,FN Herstal S.A.                                                                                ,9mm Luger (9x19)                                                                                ,Striker Fire                                                                                ,Pistol,"I have a 1 sightron s-tac 4x20x50 MOA /MOA scopes for sale $350 each Includes butler creek caps but not the bubble level Elizabeth,IN is the location Call or text REDACTED"
755,http://www.armslist.com/posts/6221755,For Sale:  kahr cm9,"knoxville/farragut, Knoxville, Tennessee",$ 350,"Listed On: Tuesday, December 27, 2016",Handguns,Kahr                                                                                ,9mm Luger (9x19)                                                                                ,Double Action                                                                                ,Pistol,"excellent and reliable Kahr CM9, with talon grips, 1 6 round and 1 7 round mag and pocket holster.   this one will eat any 124gr and higher self defense ammo reliably.  asking 350"
756,http://www.armslist.com/posts/6221756,For Sale:  New in Box HK,"Gilbertsville, Southeastern, PA, Pennsylvania","$ 1,125","Listed On: Saturday, February 11, 2017",Handguns,Heckler & Koch                                                                                ,40 S&W                                                                                ,Double / Single Action                                                                                ,Pistol,"Brand new, never fired HK USP Tactical V1 pistol in .40SW.  DA/SA with 13rd magazine.  Nice HK hardcase.  Great pistol for military/veterans, LEO, former operators. Retails for $1050. Transfer/background fees included in price.  Stock photo attached.  My FFL can ship to any FFL in the country.  All fees included."
757,http://www.armslist.com/posts/6221757,For Sale/Trade:  Nib 308 win,"Warner, Concord, New Hampshire",$ 44,"Listed On: Wednesday, December 21, 2016",Ammo,Heckler & Koch                                                                                ,40 S&W                                                                                ,Double / Single Action                                                                                ,Pistol,"I mistakenly picked 2 boxes up at Dick's for $21.99 a piece.  Looking to sell or preferably trade for 9, 22 lr, 556, 357.  I am happy to add cash if you have more than I'm offering"
758,http://www.armslist.com/posts/6221758,For Sale:  New ruger ar 15,"Marion, Hickory / Lenoir, North Carolina",$ 750,"Listed On: Monday, January 2, 2017",Rifles,Heckler & Koch                                                                                ,40 S&W                                                                                ,Double / Single Action                                                                                ,Rifle,New 2 mags
759,http://www.armslist.com/posts/6221759,For Sale:  9mm/45&22LR,"Lilburn, Atlanta, Georgia",$ 500,"Listed On: Thursday, December 15, 2016",Ammo,Heckler & Koch                                                                                ,40 S&W                                                                                ,Double / Single Action                                                                                ,Rifle,"I'll have a thousand rounds of 9-millimeter 850 rounds of 45 ACP and 1,000 rounds of 22 long rifle high velocity for sale, will sell as a package for 500 or we'll split up for around 20 cents a round for 9&45, 22 ammo is gonna stay at 10.00 a box of 100. Text is fastest four zero four eight five three nine eight five four"
760,http://www.armslist.com/posts/6221760,For Sale:  taurus 66 357 mag,"knoxville/farragut, Knoxville, Tennessee",$ 425,"Listed On: Thursday, December 15, 2016",Handguns,Taurus                                                                                ,357 Magnum                                                                                ,Double / Single Action                                                                                ,Revolver,this is an excllent Taurus model 66 357 magnum revolver in stainless steel with 4 inch barrel.  This is a great shooter and very light recoil with 357 mag loads and will include 50 rounds of 357 mag target loads425.00
764,http://www.armslist.com/posts/6221764,For Sale:  Sightron S-TAC 4-20x50 MOA/MOA SCOPE,"New Albany, New Albany, Indiana",$ 350,"Listed On: Thursday, December 15, 2016",Optics,no type,no type,no type,no type,"I have a 1 sightron s-tac 4x20x50 MOA /MOA scopes for sale $350 each Includes butler creek caps but not the bubble level Elizabeth,IN is the location Call or text 502-379-0490"
765,http://www.armslist.com/posts/6221765,For Sale:  AR15 LOWER RECEIVER,"SAN FRANCISCO PENINSULA, San Francisco, California",$ 250,"Listed On: Thursday, December 15, 2016",Rifles,no type,223/5.56 NATO                                                                                ,Semi-automatic                                                                                ,Rifle,New Anderson lower receiver with Bravo Company B5 stock.
766,http://www.armslist.com/posts/6221766,For Sale/Trade:  AR15 dmr /coyote rifle custom,"Louisville, Louisville, Kentucky",$ 900,"Listed On: Thursday, January 19, 2017",Rifles,no type,223/5.56 NATO                                                                                ,Semi-automatic                                                                                ,Rifle,"DMR / Coyote rifle 223 Wylde chamber AERO PRECISION ENHANCED M4E UPPER Aero precision gen 2 lower 18"" barrel stainless steel 1/7"" twist Palmetto state Vg6 epsilon muzzle break recoils like A 22lr lolRRA A2 buttstock and spring Magpul K2+ grip Geissele SSA-E 2-stage trigger 3.5 lbs Clamp on gas block which is better for accuracy Rifle length gas system Nitride BCG very quality stuff NO SCOPE OR MOUNT !!$900 OBO ****can save you $150 off this price if I take the Geissele trigger out and replace it with a milspec trigger I have !!****Elizabeth ,IN is location CALL OR TXT REDACTED"
767,http://www.armslist.com/posts/6221767,For Sale:  10/22 Takedown threaded,"Hickory, Hickory / Lenoir, North Carolina",$ 350,"Listed On: Thursday, December 15, 2016",Rifles,no type,223/5.56 NATO                                                                                ,Semi-automatic                                                                                ,Rifle,"16.5"" threaded barrel, has a thread protector but also comes with the flash hider.  Comes with the bushnell trs25 (bushnell has been removed from side) one 10 round mag and the tan carry case. $325 Around Hickory"
768,http://www.armslist.com/posts/6221768,For Trade:  BNIB PSA AR w/FDE Magpul Furniture,"Lithia/Valrico, Tampa/St. Pete, Florida",Offer,"Listed On: Saturday, December 31, 2016",Rifles,Palmetto State Armory                                                                                ,5.56×45mm NATO                                                                                ,Semi-automatic                                                                                ,Rifle,"Hey guys, I have up for trade a BRAND NEW NEVER FIRED PSA with all FDE Magpul Furniture.  K2 + grip, SL handgaurds, MOE stock.  Looking for GLOCKS in 9mm, Sig P938 any variation.  Would consider AK trades as well.  NO LOWBALLERS or JUNK please.  No taurus', kel-tecs, wheel guns, hunting rifles, shotguns etc etc.  Thanks for looking!  Contact Justin @ REDACTED if interested.  This is not a pieced together upper & lower, it came as the complete rifle."
769,http://www.armslist.com/posts/6221769,For Sale:  taurus 617 snub nose 7 shot 357 mag  stainless steel,"st pete, Tampa/St. Pete, Florida",$ 625,"Listed On: Thursday, December 15, 2016",Handguns,Taurus                                                                                ,357 Magnum                                                                                ,Double / Single Action                                                                                ,Revolver,"NEW NEVER SHOT  THIS IS A WEAPON NOT A GUN taurus 617 snub nose 7 shot 357 mag  stainless steel
  new IN BOX never fired
  new stickey holster
  2 SETS OF GRIPS
  3 boxes od ammo 2 hornandy custom rounds 1 gold dot defence
  3 speed loaders all newYOU CAN CALL 845-590-4297 OR TEXT  OR REPLY THIS ADD"
770,http://www.armslist.com/posts/6221770,For Sale:  Taurus 62 sac,"Dublin, Macon, Georgia",$ 475,"Listed On: Monday, January 2, 2017",Rifles,Taurus                                                                                ,22 Long Rifle                                                                                ,Pump Action                                                                                ,Rifle,I have a Taurus 62 sac 22 lr pump action 12 shot. Excellent condition.
771,http://www.armslist.com/posts/6221771,For Sale:  LNIB Glock 26 Gen 4 w/ night sights,"Wadsworth, Akron, Ohio",$ 550,"Listed On: Thursday, December 15, 2016",Handguns,Glock,22 Long Rifle                                                                                ,Pump Action                                                                                ,Rifle,"i have a brand new glock 26 gen 4, has brand new tru glo tfx night sights on it. I am looking to trade for a full sized pistol. Gun was $550 brand new night sights were $115 looking for:glock 17 or 19 gen 4 with night sights ( or I can remove my sights and reinstall the stock glock sights. Maybe some other double stack full size or compact handgun( no xd's please.)"
772,http://www.armslist.com/posts/6221772,For Sale:  BERSA THUNDER CC; .380 CAL;  NICE,"MANATEE RIVER ;RT 41 s. Ruskin, Tampa/St. Pete, Florida",$ 259,"Listed On: Thursday, December 15, 2016",Handguns,Bersa-Eagle                                                                                ,380 ACP                                                                                ,Double Action                                                                                ,Pistol,"EXCELLANT SHAPE. 380 CAL. SHOOTS GREAT AND SHOT VERY LITTLE. ALL BLACK. GREAT CONCEALED CARRY.,THIS GUN IS AN EXACT CLONE OF THE WALTHER PPK. RELIABLE AND  AFFORABLE. CASH, NO MAILING. MUST BE AT LEAST 21, HAVE A FLORIDA DRIVERS LICENSE. PREFER FLORIDA CCL PERMIT.AND NOT BE A FELON AND SIGN A PAPER STATING THAT. WILL CONSIDER PARTIAL TRADE FOR A KEL TEC P32."
