,url,title,location,price,post date,category,manufacturer,caliber,action,firearm type,postcontent
537,http://www.armslist.com/posts/6913537,For Sale:  Sig rcs 1911,"Northbrook, Chicago, Illinois",$ 700,"Listed On: Sunday, June 18, 2017",Handguns,Sig Sauer                                                                                ,45 ACP                                                                                ,Single Action                                                                                ,Pistol,Sig rcs 1911  compact. Super clean pistol. It had nighsights$700 obo
538,http://www.armslist.com/posts/6913538,For Sale:  Glock 17 Gen 2 Pistol (9mm),"Georgia, Georgia, United States",$ 350,"Listed On: Sunday, June 4, 2017",Handguns,Sig Sauer                                                                                ,9mm Luger (9x19),Single Action                                                                                ,Pistol,"This new Glock 19 gen 4 has a 4"" barrel and is chambered in 9mm. It has an overall black finish and front night sights. It comes with three 15 round mags, mag loader, 4 back straps, lock, bore brush, hard case and manual"
539,http://www.armslist.com/posts/6913539,For Sale:  Mini ak trade for mini dirt bike,"Burnsville, Minneapolis / St. Paul, Minnesota",$ 20,"Listed On: Sunday, June 4, 2017",Handguns,Sig Sauer                                                                                ,9mm Luger (9x19),Single Action                                                                                ,Pistol,"I have a c39 pistol AK it comes with 6 30 round mags and 4 10 round mags. Only 100 rounds has been through it. Comes with bag and original box that was purchased brand new. Trade for a mini dirt bike, or price 700 for everything."
541,http://www.armslist.com/posts/6913541,For Sale:  Phoenix Technology AK Stock with Storage,"Mukilteo, Everett, Washington",$ 30,"Listed On: Monday, October 9, 2017",Gun,no type,no type,no type,no type,For sale is a like new Phoenix Technology AK stock with a hinged rear storage compartment.
544,http://www.armslist.com/posts/6913544,For Sale:  Sig Sauer P229 Legion,"AURORA, Denver, Colorado",$ 999,"Listed On: Monday, August 28, 2017",Handguns,Sig Sauer                                                                                ,9mm Luger (9x19)                                                                                ,Double / Single Action                                                                                ,Pistol,Brand new Sig legionDa/sa
545,http://www.armslist.com/posts/6913545,For Trade:  Ruger SR9 for trade,"Manitowoc, Sheboygan, Wisconsin",Offer,"Listed On: Sunday, June 4, 2017",Handguns,Ruger                                                                                ,9mm Luger (9x19)                                                                                ,Double / Single Action                                                                                ,Pistol,near new Ruger SR9 full frame model 9mm. come with 3 ruger magazines and a paddle holster.
547,http://www.armslist.com/posts/6913547,For Sale/Trade:  FNS 40,"Western blvd, Jacksonville, North Carolina",$ 400,"Listed On: Sunday, June 4, 2017",Handguns,FN Herstal S.A.                                                                                ,40 S&W                                                                                ,Striker Fire                                                                                ,Pistol,"Brand new never been shot would like to trade for a 92fs but I'm interested in other handguns and rifles as well, worst I can say is no. 400$ obo"
548,http://www.armslist.com/posts/6913548,For Sale:  Belted 308 F4 Ball 1990 ADI Ammo/Izzy Links/Ammo Can,"Lansing, Lansing, Michigan",$ 205,"Listed On: Saturday, September 30, 2017",Ammo,FN Herstal S.A.                                                                                ,40 S&W                                                                                ,Striker Fire                                                                                ,Pistol,"WTS: 308-7.62mm F4 Ball ADI Ammo, June 1990
Australian Defense Industries - 4PF, 5 CBD CTN, UN 0012
Copper jacketed bullet with brass cartridge
220 rounds belted in new Izzy links in 30 cal ammo can
This is some of the best 308 surplus ammo ever
$205 per can plus actual UPS shipping from 48909"
549,http://www.armslist.com/posts/6913549,For Sale:  Leupold VX3 2.5x8x32 Handgun Scope,"North of Town, Birmingham, Alabama",$ 400,"Listed On: Sunday, June 4, 2017",Optics,FN Herstal S.A.                                                                                ,40 S&W                                                                                ,Striker Fire                                                                                ,Pistol,Nice slightly used Leupold VX3 Handgun Scope Scope is in great condition with only small ring marks. This is a primo long range handgun scope. The variable power 2.5x8 makes this scope useful in many varied circumstances. This scope list's for a fortune and the bargain price new is about $550.00. I will ship the scope for $12.50 to US mainland only. This is restricted to US by law.
551,http://www.armslist.com/posts/6913551,For Sale:  Burris FastFire II with ADM mount,"North, Evansville, Indiana",$ 175,"Listed On: Saturday, June 10, 2017",Optics,no type,no type,no type,no type,"Excellent condition, no issues. The ADM AD-22 mount is top of the line!You will need about a 3/4"" riser to cowitness if you want to use it on an AR15."
553,http://www.armslist.com/posts/6913553,For Sale:  kennel runs,"New Cumberland, Harrisburg, Pennsylvania",$ 250,"Listed On: Sunday, June 4, 2017",Miscellaneous,no type,no type,no type,no type,"I have 3 kennel runs 4 by 6 ft. designed to hook to a building, 3 lockable gates, also have 3 boxes designed to hook inside the building with hinged lids for easy gleaning. I used it for beagles runs are chain link....6 foot high."
554,http://www.armslist.com/posts/6913554,For Sale:  S&W M&P 9C,"South shore, Massachusetts, United States",$ 450,"Listed On: Sunday, June 4, 2017",Handguns,Smith & Wesson                                                                                ,9mm Luger (9x19)                                                                                ,no type,Pistol,selling my 9c. Dont shoot or carry it anymore and it just sits in the safe. Come with a kydex holster and three mags. It has a wrap on it that can easily be removed. Asking $450 obo for everything.
555,http://www.armslist.com/posts/6913555,For Sale:  Aimpoint Pro,"Goshen, Cincinnati, Ohio",$ 400,"Listed On: Sunday, June 4, 2017",Optics,Smith & Wesson                                                                                ,9mm Luger (9x19)                                                                                ,no type,Pistol,Aimpoint Pro Gen 2(improved o rings and turrets) new in the box still have receipt. I purchased it wanting to use it with a magnifier but decided to go a different route. It is literally brand new still. But you're getting it cheaper because it is considered used although it hasn't been used. In new condition.
556,http://www.armslist.com/posts/6913556,"For Sale:  StealthGear USA, FLEX OWB Holster - Glock 19","Eastside, Seattle, Washington",$ 130,"Listed On: Sunday, June 4, 2017",Holsters,Smith & Wesson                                                                                ,9mm Luger (9x19)                                                                                ,no type,Pistol,"I purchased this new for my Glock 19 direct from the company. I have used their holsters for years and love their design and build quality. I'm having to move over to a more IWB approach for work so will be ordering their IWB version.It is a great holster and has been 'carried' less than half a dozen times. It is in 'as-new' condition and a shame to be kept in it's box.Comes complete with all original box and hardware, the pictures shows it with the optional fast clips but it comes with the standard belt loops too.Please message me with any questions.$130 (retails for $169 plus shipping)No Shipping"
557,http://www.armslist.com/posts/6913557,For Sale:  9mm browning,"Rio grande city, McAllen, Texas","$ 1,200","Listed On: Sunday, June 4, 2017",Handguns,Browning                                                                                ,9mm Luger (9x19),no type,Pistol,Have a browning 9mm made in belguin veri nice and a good gun
558,http://www.armslist.com/posts/6913558,"For Sale:  Rossi Ranch Hand .45 Colt Lever Action 12"" Hand Gun","Goodlettsville, Nashville, Tennessee",$ 700,"Listed On: Saturday, June 17, 2017",Handguns,Rossi-Braztech                                                                                ,45 Colt                                                                                ,Lever Action                                                                                ,Pistol,I will accept Best Offer on this Rossi Ranch Hand (Lever Action) hand gun. I bought this gun at a gun show and it has never been fired. I will also consider trade for a Judge or Governor. Let's Make a Deal!
559,http://www.armslist.com/posts/6913559,For Sale:  NIB sig P320 compact,"Brandon, Tampa/St. Pete, Florida",$ 530,"Listed On: Sunday, June 4, 2017",Handguns,Sig Sauer                                                                                ,9mm Luger (9x19)                                                                                ,Striker Fire                                                                                ,Pistol,"NIB Sig P 320 compact, night sights, otw holster and an iwb holster. (2 ) 15 round magazines"
560,http://www.armslist.com/posts/6913560,For Sale:  New. Never fired. Beretta a300 outlander,"temple, Austin, Texas",$ 600,"Listed On: Sunday, June 4, 2017",Shotguns,Beretta USA                                                                                ,12 Gauge                                                                                ,Semi-automatic                                                                                ,Shotgun,"Brand new Beretta a300 Outlander Turkey 12 gauge. Gas operated, 24 inch ribbed barrel, fiber optic sights, gas operated, and with Mossy Oak finish. Comes with multiple choke tubes, choke tube removal tool, buttstock spacers for LOP adjustability and owners manual. Never fired this gun. Great shotgun in brand new condition. $600. Email or text REDACTED"
561,http://www.armslist.com/posts/6913561,For Sale:  Kimber Micro 9 CSE,"Lenexa, Kansas City, Kansas",$ 560,"Listed On: Wednesday, June 14, 2017",Handguns,Kimber                                                                                ,12 Gauge                                                                                ,Semi-automatic                                                                                ,Pistol,"Like new, never fired, no nicks or scratches.Kimber Micro 9 Conceal Special Edition 9mm w/ Gray/Black G10 grip, Matte Black with brush polished flats.comes with original box, soft case, 3 magazines.No trades....."
565,http://www.armslist.com/posts/6913565,For Sale:  357 s&w model 19,"West palm, Palm Beach, South Florida",$ 500,"Listed On: Sunday, June 4, 2017",Antique,no type,no type,no type,no type,Clean REDACTED
566,http://www.armslist.com/posts/6913566,"For Sale:  WTB Ruger 357 Mag 3"" barrel","Mauston, Wisconsin, United States",$ 1,"Listed On: Sunday, June 4, 2017",Handguns,Ruger                                                                                ,357 Magnum                                                                                ,Double / Single Action                                                                                ,Revolver,"Hello, Interested in buying a Ruger 357 Mag with a 3"" barrel in LNIB / USED condition. Please e mail me with what you have and looking to get. I am retired and looking for a affordable item. I have a valid WI. DL and cash to complete a person to person transfer.Thank yo."
567,http://www.armslist.com/posts/6913567,For Sale:  RCBS reloading dies and assorted bullets,"sw bend, Bend, Oregon",$ 20,"Listed On: Wednesday, August 16, 2017",Reloading,Ruger                                                                                ,357 Magnum                                                                                ,Double / Single Action                                                                                ,Revolver,"RCBS reloading dies all like new condition in boxes, $20.00 ea. calibers:          6.5x55         7mm T/CU         .30 carbine         7.62x39 - 308/311         .260 Rem.                                                                                                                                                                                                                                    Assorted bullets for reloading:                                                                                                                             129 ea.  Sierra .375 cal.  250gr. boat tail  $40.00          20 ea.    Sierra .375 cal.  300gr. boat tail  $5.00          50 ea.    Barnes .375 cal.  300gr.  $20.oo          22 ea.    Hornady .338 cal. 225gr. sp. pt.  $10.00          60 ea.    Hornady 6.5mm cal.  140gr. A MAX Match  $25.00          51ea.     Hornady .17 cal.  25gr sp.pt.  $5.00          48ea.     Speer .45 cal.  350gr. fn. sp.  $15.00          100ea.   .44 cal.   240gr. wade cutters  $10.00   Package deal for everything $175.00.  REDACTED"
568,http://www.armslist.com/posts/6913568,For Sale:  Panther Oracle AR10,"East side, Columbus, Ohio",$ 700,"Listed On: Thursday, June 15, 2017",Rifles,DPMS                                                                                ,308/7.62 NATO                                                                                ,Semi-automatic                                                                                ,Rifle,This rifle is 762x51 nato /308 it is like new with only 12 rds fired. I am asking $700 Firm. No trades and no shipping. Will remove once it is sold.
570,http://www.armslist.com/posts/6913570,For Sale:  Kimber Tactical Custom II 45ACP,"Broken Arrow, Tulsa, Oklahoma",$ 785,"Listed On: Saturday, December 9, 2017",Handguns,Kimber                                                                                ,45 ACP                                                                                ,Striker Fire                                                                                ,Pistol,New arrival- Kimber Tactical Custom II in 45.  Pristine condition and Penrose priced at only $799+ tax.  We offer a FREE 90 day layaway on everything we sell.  We only sell to Oklahoma residents.Penrose Pawn Shop909 S Aspen AveBroken Arrow OK 74012REDACTED
571,http://www.armslist.com/posts/6913571,For Sale:  Looking for Glock compact,"Largo, Tampa/St. Pete, Florida",$ 250,"Listed On: Sunday, June 4, 2017",Handguns,Kimber                                                                                ,45 ACP                                                                                ,Striker Fire                                                                                ,Pistol,I have a m24/47 mauser rifle with bayonet and sling that im looking to sell or mainly trade for a glock 26 or other glock compact. Im willing to add cash of course.
572,http://www.armslist.com/posts/6913572,For Sale:  M44 Mosin Nagant,"Lakewood, Denver, Colorado",$ 150,"Listed On: Sunday, June 4, 2017",Rifles,Kimber                                                                                ,7.62x54R                                                                                ,Bolt Action                                                                                ,Rifle,"Mosin Nagant with synthetic stockwill come with ammo that i have for it, about 30 rounds i think"
574,http://www.armslist.com/posts/6913574,For Sale:  ELITE TACTICAL SYSTEMS TRANSLUCENT GLOCK MAGAINZES,"Phx, Phoenix, Arizona",$ 10,"Listed On: Sunday, June 4, 2017",Magazines,no type,no type,no type,no type,I have two Glock 17 & two Glock 19 ETS Magazines for sale. They are slightly used and in excellent condition. Selling them for $10 each or $35 for all four Magazines. NO SHIPPING
576,http://www.armslist.com/posts/6913576,For Sale:  Sig Sauer P220,"Circleville, Ohio, United States",$ 600,"Listed On: Sunday, June 4, 2017",Handguns,Sig Sauer                                                                                ,45 ACP                                                                                ,Double / Single Action                                                                                ,Pistol,Sig Sauer P220 Stainless 45 Cal. With Night sites. I have original box 1 Mag. This gun has some wear from being carried. $600  No Trades Cash Only.  REDACTED
577,http://www.armslist.com/posts/6913577,For Sale:  Hogue Overmolded AK Handguards,"Mukilteo, Everett, Washington",$ 20,"Listed On: Sunday, June 4, 2017",Gun,Sig Sauer                                                                                ,45 ACP                                                                                ,Double / Single Action                                                                                ,Pistol,This is a very good condition set of Hogue overmolded AK handguards.
578,http://www.armslist.com/posts/6913578,Want To Buy:  *,"*, Olympia, Washington",$ 1,"Listed On: Sunday, June 4, 2017",Handguns,Sig Sauer                                                                                ,45 ACP                                                                                ,Double / Single Action                                                                                ,Pistol,*
579,http://www.armslist.com/posts/6913579,For Sale:  Sig P250/ P320 13rd .40-.357,"west, Wichita, Kansas",$ 10,"Listed On: Tuesday, August 1, 2017",Magazines,Sig Sauer                                                                                ,45 ACP                                                                                ,Double / Single Action                                                                                ,Pistol,"Sig P250/P320 13rd .40-.357 magazinetext me at 31six21eight8286, if the add is still up its still available"
581,http://www.armslist.com/posts/6913581,For Sale:  S&W,"kewaskum, Milwaukee, Wisconsin",$ 675,"Listed On: Sunday, June 4, 2017",Handguns,Smith & Wesson                                                                                ,no type,Double / Single Action                                                                                ,Revolver,model 10 38 special. pinned barrel 2 inch as new with box $675   model 15 combat master piece 38 special target sights mint with box $675 model 19 357 mag pinned barrel. recesed cyl. target triger hammer grips white out line sight mint in box $1000 0b0 MODEL 10 IS SOLD
583,http://www.armslist.com/posts/6913583,For Sale:  HK 45c,"East ridge, Chattanooga, Tennessee",$ 800,"Listed On: Saturday, July 1, 2017",Handguns,Heckler & Koch                                                                                ,45 ACP                                                                                ,Striker Fire                                                                                ,Pistol,i have for sale a like new HK45c. This is a well desired and hard to find firearm. It is in perfect shape with a very low round count. Always stored in a safe. It has trijicon night sights. A thumb safety. Single mag that is 8+1. a soft holster. The going rate on these guns is over $1000 and they are getting hard to find. No trades at this time. Unless you have a Ruger Red Hawk 44 mag. Or maybe a nice Kimbe your looking to trade. Call or text Kris. Price is firm REDACTED
584,http://www.armslist.com/posts/6913584,For Sale:  Smith & Wesson M&P 2.0 9mm,"Albuquerque, Albuquerque, New Mexico",$ 500,"Listed On: Sunday, June 4, 2017",Handguns,Smith & Wesson                                                                                ,9mm Luger (9x19)                                                                                ,Striker Fire                                                                                ,Pistol,"Just bought this thing a week ago from some guy on here, but i ran into some financial burdens and need to get my money back. Guy i bought it from said it had never been fired and i haven't shot it, but it does appear that its had rounds chambered and emptied a few times. I have the reciepts from the original purchaser, which i bought it from. Have the case and all the stuff that comes with it. Comes with 3 mags. Gold color filling is easy to take off if you don't like it. Price is obo, 5-o-5 80four 2447. Serious inquiries only, will only meet inside of a gun store to sell."
585,http://www.armslist.com/posts/6913585,For Sale:  Mpa30t defender Mac 11,"Raleigh, Raleigh / Durham / CH, North Carolina",$ 400,"Listed On: Sunday, June 4, 2017",Handguns,Smith & Wesson                                                                                ,9mm Luger (9x19)                                                                                ,Striker Fire                                                                                ,Pistol,"brand new mpa30t defender.  9mmcomes with case, 30 round magazine, speed loader and very cool fake suppressor barrel extension that threads on. THIS IS THE BRAND NEW DEFENDER SERIES ALL MILLED GUN, not the old crappy versionGun retails for 499 plus tax. ALL LAWS APPLY. REDACTED"
586,http://www.armslist.com/posts/6913586,For Sale:  CZ 75 B 9MM,"Broken Arrow, Tulsa, Oklahoma",$ 499,"Listed On: Wednesday, August 23, 2017",Handguns,CZ USA                                                                                ,9mm Luger (9x19)                                                                                ,Striker Fire                                                                                ,Pistol,"New arrival- CZ 75 B in a 9MM.  Has slight holster wear on right side of pistol, but still in excellent condition overall.  Hard to find pistol and priced at only $499 + tax.  We have a free 90 day layaway on everything we sell.  We only sell to Oklahoma residents.Penrose Pawn Shop909 S Aspen AveBroken Arrow OK 74012REDACTED"
587,http://www.armslist.com/posts/6913587,For Sale:  USGI 556 Mags and USGI 556 otis Cleaning Kits,"Huber Heights, Dayton, Ohio",$ 1,"Listed On: Friday, June 30, 2017",Tactical,CZ USA                                                                                ,9mm Luger (9x19)                                                                                ,Striker Fire                                                                                ,Pistol,USGI 556 30 RD MAGS $10eabrand new otis 556 cleaning kits with Gerber multitool and flashlight as well as goggle and optic cleaning supplies. Come with molle zipper pouch. More pics available. Also have some with gen 2 multitool with front sight adjuster. $70 ea
588,http://www.armslist.com/posts/6913588,For Sale:  Mossin-Nagant Arch Angel,"Frederick, Frederick, Maryland",$ 599,"Listed On: Sunday, June 4, 2017",Rifles,CZ USA                                                                                ,7.62x54R                                                                                ,Bolt Action                                                                                ,Rifle,"Mossin Nagant M38 Carbine, upgraded with Archangel stock and duracoat blued finish, side mount scope. Comes with sealed spam can with 440 rounds 7.62x54R Ammo."
589,http://www.armslist.com/posts/6913589,For Sale:  Savage gen 1  22-250,"Springfield, Springfield, Missouri",$ 1,"Listed On: Sunday, June 4, 2017",Rifles,Savage Arms                                                                                ,22-250 Remington                                                                                ,Bolt Action                                                                                ,Rifle,Up for sale is a Savage gen 1 22 250 with bipod and sling. I personally have only  a shoot this 20  or 30 times. Maybe let scope go as well if you're interested send me an offer thanks. Text4 for faster response on questions.
590,http://www.armslist.com/posts/6913590,For Sale:  Arsenal US Made AK Handguards,"Mukilteo, Everett, Washington",$ 30,"Listed On: Monday, October 9, 2017",Gun,Savage Arms                                                                                ,22-250 Remington                                                                                ,Bolt Action                                                                                ,Rifle,Up for sale is a like new set of Arsenal US made AK handguards.
