,url,title,location,price,post date,category,manufacturer,caliber,action,firearm type,postcontent
0,http://www.armslist.com/posts/6913000,For Sale:  Sig Sauer p320F 9mm w/SIGLITE night sights,"South East Grand Rapids, Grand Rapids, Michigan",$ 475,"Listed On: Tuesday, June 27, 2017",Handguns,Sig Sauer                                                                                ,9mm Luger (9x19)                                                                                ,Striker Fire                                                                                ,Pistol,Never fired Sif Sauer P320F with SIGLITE night sights-comes with 2 magazines that are 17 round-SIGLITE night sights-Sig Sauer kydex holsterI am not looking for a trade. must have a CPL license to purchase.
2,http://www.armslist.com/posts/6913002,For Sale:  5.7x28 AR Platform,"Bristol, Southeastern, PA, Pennsylvania",$ 999,"Listed On: Sunday, June 4, 2017",Rifles,no type,5.7x28mm                                                                                ,Semi-automatic                                                                                ,Rifle,"Can't afford a PS90 but what the fire power of the 5.7x28 round well we have it with the 5.7X28 AR platform. All the looks of a PS90 without the price tag. With our Omni 3 Lower combined with the 5.7X28 upper you have the best of both worlds.AR57 16” Complete SLC Rifle. AR57 MFG. Factory New. Comes with 16” Lightweight Barrel, Lightweight Flash Hider,Semi Auto Bolt, Carbine Buffer, Ambidextrous Mag Release & Charging Handle, M-Lok Rails, AR 15 Multi Cal. Slc Receiver, Bolt Catch, Bolt Catch Plunger, Bolt Catch Roll Pin, Bolt Catch Spring, Buffer Retainer, Buffer Retainer Spring,  Disconnector,  Disconnector Spring, Hammer, Hammer Pin, Magazine Catch, Magazine Catch Button, Magazine Catch Spring, Pistol Grip, Pistol Grip Lock Washer, Pistol Grip Screw,  Pivot Pin, Pivot Pin Detent, Pivot Pin Detent, Pivot Pin Detent Spring, Selector,  Selector Detent, Selector Detent Spring, Takedown Pin, Takedown Pin Detent, Takedown Pin Detent Spring, Trigger, Trigger Guard, Trigger Guard Roll Pin, Trigger Spring, 6 Position Forged Butt Stock , (2) 50 Round Magazines."
6,http://www.armslist.com/posts/6913006,For Sale:  Ruger Super Red Hawk 45 Long Colt,"Albany, Parkersburg, West Virginia","$ 1,250","Listed On: Saturday, June 17, 2017",Handguns,Ruger                                                                                ,45 Long Colt                                                                                ,Double Action                                                                                ,Revolver,"7 1/2"" Barrell Stainless, Wood Grips with 2-6x32 Bushnell trophy silver scope. Package deal inculdes: 400 rounds of ammo, 500 reloading bullets and Hornady reloading dies, extra grips and factory boxes for the gun and scope.  Excellent condition."
7,http://www.armslist.com/posts/6913007,For Sale:  Walther Creed 9mm/LNIB/3 Mags/Talon grips/$315,"Eagle River-Minocqua-Rhinelander, Northern WI, Wisconsin",$ 315,"Listed On: Thursday, July 13, 2017",Handguns,Walther                                                                                ,9mm Luger (9x19)                                                                                ,Double Action                                                                                ,Pistol,"I have a Walther Creed in 9mm, 4-inch barrel, fired less than 100 rounds, in hard case with all original accessories. I installed a $20 Talon grip and will throw in an extra 16-round mag that cost me $35. Hammer-fired, smooth shooting top-quality pistol.If this ad is posted the gun is still available for sale.Watch Hickok 45's Creed review on YouTube. I have $425 in this package and have cut my price three times to a firm $315. . NO SHIPPING, FACE TO FACE ONLY.Can meet in Northwoods. Must be WI resident and legal to own."
8,http://www.armslist.com/posts/6913008,"For Sale/Trade:  Springfield xdm 9mm 4.5""","Lakes region, New Hampshire, United States",$ 0,"Listed On: Thursday, June 22, 2017",Handguns,Springfield                                                                                ,9mm Luger (9x19)                                                                                ,Striker Fire                                                                                ,Pistol,Great condition all factory items plus a leather owb holster. Looking for full size glock 9mm or ruger mkiii mkiv 22lr bull barrel versions or lite plus cash as needed if needed or sell 500 cash maybe a 45 acp glock
9,http://www.armslist.com/posts/6913009,For Sale:  Crickett Target Rifle,"Johnstown/Millken, Fort Collins, Colorado",$ 350,"Listed On: Tuesday, June 6, 2017",Rifles,Springfield                                                                                ,22 Long Rifle                                                                                ,Bolt Action                                                                                ,Rifle,"Great first safe single shot gun for the younger shooter. Equiped with a gray laminated thumb hole stock, stainless steel barrel and receiver and Simmons scope."
10,http://www.armslist.com/posts/6913010,For Trade:  12g mossberg maverick tactical,"Kalamazoo, Kalamazoo, Michigan",Offer,"Listed On: Friday, June 9, 2017",Shotguns,Mossberg                                                                                ,12 Gauge                                                                                ,Pump Action                                                                                ,Shotgun,"For trade is a like new 12g Mossberg maverick tactical. This gun has less than 60rds through it. This has the 7+1 capacity, pretty much the best home defense option out there. Comes with hard case and around 50rds of mixed ammo, some buck, some slugs, some target loads. I can include an ATI 6 position stock with pistol grip as well for the right trade. I've got around 275 in the (350 with the ATI stock). I'm looking for an AR upper in .223/556 or pistol upper of equal value. Would also consider a 22 auto pistol or revolver of equal value. Text REDACTED thanks for looking no scams no shipping"
11,http://www.armslist.com/posts/6913011,For Sale:  Tikka T3 .30-06,"Glendale, Phoenix, Arizona",$ 500,"Listed On: Saturday, June 17, 2017",Rifles,Tikka                                                                                ,30-06 Springfield                                                                                ,Bolt Action                                                                                ,Rifle,"Didn't get drawn for elk this year so I have no plans for this rifle.Never fired, just been sitting in safe. Have box and all of its contents."
12,http://www.armslist.com/posts/6913012,For Sale:  Super Clean Beretta 92s,"Mayville, Wisconsin, United States",$ 450,"Listed On: Sunday, June 4, 2017",Handguns,Tikka                                                                                ,30-06 Springfield                                                                                ,Bolt Action                                                                                ,Rifle,Up for sale or trade is my beretta 92s.  It's in excellent condition... comes with factory mag and two pro mag magazines...run your trade by me...
13,http://www.armslist.com/posts/6913013,For Sale:  Aguila Rifle Match .22lr,"Wichita, Wichita, Kansas",$ 45,"Listed On: Sunday, July 2, 2017",Ammo,Tikka                                                                                ,30-06 Springfield                                                                                ,Bolt Action                                                                                ,Rifle,2 bricks available of Aguila Rifle Match competition .22LR ammo. 40gr lead bullet eley primed.Price is per brick and is firm.
17,http://www.armslist.com/posts/6913017,For Sale/Trade:  Sig Sauer P229,"Exit 95 South 75, Lexington, Kentucky",$ 650,"Listed On: Saturday, June 10, 2017",Handguns,Sig Sauer                                                                                ,40 cal                                                                                ,Double / Single Action                                                                                ,Pistol,"Awesome sig sauer P229,40 cal,2 -12 round mags,night sights, Decocker,Hogue grips,Box,Extremely accurate,In A-1 condition Call or Text 859-585-7344"
19,http://www.armslist.com/posts/6913019,For Sale:  1,"Prattville, Montgomery, Alabama",$ 1,"Listed On: Sunday, July 16, 2017",Gun,no type,no type,no type,no type,.
20,http://www.armslist.com/posts/6913020,For Sale/Trade:  Ruger New Vaquero.45 Colt,"East Norman, Oklahoma City, Oklahoma",$ 450,"Listed On: Sunday, June 4, 2017",Handguns,Ruger                                                                                ,no type,Single Action                                                                                ,Revolver,"51/2"" blue two sets of grips beautiful gun   FTF only 405 seven nine five 4800 I would rather sell but might take a trade.  No shotguns .22's .   Text is best"
21,http://www.armslist.com/posts/6913021,For Sale/Trade:  1960 Browning A5 Light Twelve,"Henderson, Owensboro, Kentucky","$ 1,300","Listed On: Monday, June 12, 2017",Shotguns,Browning                                                                                ,12 Gauge                                                                                ,Semi-automatic                                                                                ,Shotgun,This is your chance to own a piece of shotgun history. This browning a5 is in excellent condition and would be perfect for a collector. The price on this beauty is 1300 dollars. Please ask any questions via email. Thanks for looking.
22,http://www.armslist.com/posts/6913022,For Sale/Trade:  Nice AR-15 5.56/.223,"tulsa, Tulsa, Oklahoma",$ 550,"Listed On: Sunday, June 4, 2017",Rifles,Browning                                                                                ,223/5.56 NATO                                                                                ,Semi-automatic                                                                                ,Rifle,"Anderson aluminum lower, 1:8 twist .223 Wylde barrel shoots 5.56 and .223., heavy profile BCG, UTG Pro slim handguard ($140), Magpul CTR stock ($50), mini red dot sight, 30 and 20 round mags. Like new condition."
23,http://www.armslist.com/posts/6913023,For Sale:  Glock 30 9 round mag,"South Burlington, Vermont, United States",$ 20,"Listed On: Sunday, June 4, 2017",Magazines,Browning                                                                                ,223/5.56 NATO                                                                                ,Semi-automatic                                                                                ,Rifle,"glock 30 9 round ""flush"" magazine in good condition"
26,http://www.armslist.com/posts/6913026,For Sale/Trade:  High End AR-15,"Kingsport, Tri-cities, Tennessee","$ 1,800","Listed On: Friday, June 9, 2017",Rifles,Spikes Tactical                                                                                ,5.56×45mm NATO                                                                                ,Semi-automatic                                                                                ,Rifle,"high end built ar 15. I have almost all boxes for the parts and almost all receipts for the parts as well. Part list is as follows: SAA Troy Alpha Series Upper:16"" HBAR nitride barrel, 1:8 twistChambered in 5.56 NATO Troy 13"" Alpha RailComplete Nickel Boron BCGYankee Hill Phantom Flash HiderSpikes Tactical Spider Lower multi-calStrike Industries Forward Assist button, redCMC drop in trigger, 3.5 lb pull weight, flat triggerERGO dual tactical gripMission First Tactical BULS stockAero Precision Buffer Tube KitNoveske Take down/pivot pin set Strike Industries ARCH-EL-Red charging handleEnhanced trigger guard with USA flag (3) 30 round Magpul magazines(2) hexmag 30 round magazines(1) mission first Tactical 30 rd magazine(1) 40 round magpul magazineNikon P223 3-9x40 Matte BDC scopeNikon P Series scope ringsThis is not a budget build. I have 1800 in this gun and I don't NEED to sell this gun. I will NOT listen to lowball offers. Willing to trade for a rwd car, motorcycle, or other high end guns. Gun shoots flawlessly, and have ammo to go with it depending on trade. Please no lowballs and don't offer guns that are junk, mines not junk. Reply to this add or text 423-913-43O7"
27,http://www.armslist.com/posts/6913027,For Sale/Trade:  Smoke Composites Carbon fiber stock,"Bettsville, Toledo, Ohio",$ 125,"Listed On: Sunday, June 4, 2017",Gun,Spikes Tactical                                                                                ,5.56×45mm NATO                                                                                ,Semi-automatic                                                                                ,Rifle,Used A2 closed shoulder rifle length carbon fiber stock. Was only mounted to test fit then removed.
30,http://www.armslist.com/posts/6913030,For Sale:  Aguila Pistol Match .22LR,"Wichita, Wichita, Kansas",$ 45,"Listed On: Sunday, July 2, 2017",Ammo,no type,no type,no type,no type,1 brick of Aguila Pistol Match competition .22LR 40gr lead bullet eley primed. Price is firm
32,http://www.armslist.com/posts/6913032,For Sale:  Remington 597 .22,"Eureka, St. Louis, Missouri",$ 125,"Listed On: Sunday, June 4, 2017",Rifles,Remington                                                                                ,22 Long Rifle                                                                                ,Semi-automatic                                                                                ,Rifle,Clean gun call or text REDACTED
33,http://www.armslist.com/posts/6913033,For Sale:   Walther PPS  .40,"Carrollwood, Tampa/St. Pete, Florida",$ 350,"Listed On: Sunday, January 21, 2018",Handguns,Walther                                                                                ,40 S&W                                                                                ,Semi-automatic                                                                                ,Pistol,"For sale is a Walther PPS .40S&W.  I purchased this gun brand-new and have never shot it.  Comes in original case with two magazines.  I will also throw in holster for free. Asking $350 No tradesLooking to sell off a few guns so check out my other listings.Please read:Although Florida law does not require, for my protection sale of gun requires CWP and gun transfer form. No exceptions.The sale will be in the Carrollwood area. I do not travel. Please text to me to set up a time to meet. I do have a regular job Monday through Friday so will have to meet after 6 PM on weekdays.if you see the ad the gun is still available"
34,http://www.armslist.com/posts/6913034,For Sale:  Interarms Mauser Luger 9mm,"Hillsboro Jefferson County, St. Louis, Missouri",$ 950,"Listed On: Friday, June 9, 2017",Handguns,Mauser                                                                                ,9mm Luger (9x19)                                                                                ,Single Action                                                                                ,Pistol,I have for sale a 1970's made Mauser Luger in 9mm with the 4in. barrel this is the swiss model with grip safety in it's original box. It has the manual and test target the box is not in good shape that is the way I received it. (No Trades No shipping)FTF only MO residents only must show ID for proof.(NO OFFERS BELOW ASKING PRICE WILL NOT RECEIVE REPLY)
37,http://www.armslist.com/posts/6913037,For Sale:  Sig Sauer 1911 10 mm Tacops,"West, Knoxville, Tennessee",$ 950,"Listed On: Sunday, June 4, 2017",Handguns,Sig Sauer                                                                                ,10mm,no type,no type,"For sale, I bought this gun new, it's unfired or carried. Comes with all factory contents, night sights, 4 mags 2 box of target ammo. To learn more about the weapon look it up on the web. I am working on restoring a truck and rather have the cash Call or text REDACTED"
38,http://www.armslist.com/posts/6913038,For Sale:  9mm Bullets - 1000 flat tip,"St. Peters, St. Louis, Missouri",$ 60,"Listed On: Tuesday, June 20, 2017",Reloading,Sig Sauer                                                                                ,10mm,no type,no type,Title says it all. Must meet in the Harvester/ 94 area.
40,http://www.armslist.com/posts/6913040,For Sale/Trade:  H&K USP COMPACT-9mm,"Charlston, Charleston, South Carolina",$ 750,"Listed On: Sunday, June 4, 2017",Handguns,Heckler & Koch                                                                                ,9mm Luger (9x19)                                                                                ,Double / Single Action,no type,"A very nice, clean, well taken care of pistol. Double action, single action. Comes with two 13 round mags, one 28 round mag, night sights, case and papers. Would trade for a Ruger MK IV plus cash on your end. Sell outright for $750. IF AD IS STILL UP, WILL NOT ANSWER THAT QUESTION. Thanks."
41,http://www.armslist.com/posts/6913041,For Sale:  Pvs 7 package.,"Clarksville, Clarksville, Tennessee","$ 2,500","Listed On: Sunday, June 4, 2017",Optics,Heckler & Koch                                                                                ,9mm Luger (9x19)                                                                                ,Double / Single Action,no type,"Pvs 7 auto gated, paq 4 and surefire with km3 visable/ir. With all attachments and gear. Bought Used for hog hunts in GA. No time or use for low hours clear tube. Everything works. No I'm not into low grade guns or gear, 1911s, shotguns or high end custom builds and or vehicles."
44,http://www.armslist.com/posts/6913044,For Sale:  Benelli Nova 12 Pump,"South, Crown Point, Indiana",$ 320,"Listed On: Sunday, June 4, 2017",Shotguns,Benelli                                                                                ,12 Gauge                                                                                ,Pump Action                                                                                ,Shotgun,"Black stock, nice gun. $320."
45,http://www.armslist.com/posts/6913045,For Sale:  Crickett Target Rifle,"Johnstown/Milliken, Fort Collins, Colorado",$ 350,"Listed On: Sunday, June 4, 2017",Rifles,Benelli                                                                                ,22 Long Rifle                                                                                ,Bolt Action                                                                                ,Rifle,"Great safe single shot for the younger sharpshooter. Gray laminated thumbhole stock, stainless steel and has a Simmons 4x scope. Call or text REDACTED"
46,http://www.armslist.com/posts/6913046,For Sale:  M1903 Remington variant.,"Carson city, Reno, Nevada",$ 350,"Listed On: Sunday, June 4, 2017",Rifles,Remington                                                                                ,30-06 Springfield                                                                                ,Bolt Action                                                                                ,Rifle,"I traced the serial number to the early 40s it's in good shape, sportized stock, no rear sight. Bore and bolt in good shape."
47,http://www.armslist.com/posts/6913047,For Sale:  Aguila Interceptor .22LR,"Wichita, Wichita, Kansas",$ 45,"Listed On: Sunday, July 2, 2017",Ammo,Remington                                                                                ,30-06 Springfield                                                                                ,Bolt Action                                                                                ,Rifle,1 brick of Aguila Interceptor .22LR ammo 40gr copper plated eley primed. Price is firm
48,http://www.armslist.com/posts/6913048,For Sale/Trade:  Preppers look!!!!,"Midland, Charlotte, North Carolina",$ 600,"Listed On: Sunday, July 30, 2017",Handguns,Remington                                                                                ,7.62x39,Bolt Action                                                                                ,Rifle,I have a rarity of 1100 rounds of armor piercing 7.62x39 in original wooden crate. Chinese which is the good stuff.
49,http://www.armslist.com/posts/6913049,"Want To Buy:  I am looking for a good 9mm,40,45 or something similar.  Savannah","Savannah, Savannah, Georgia",Offer,"Listed On: Friday, April 27, 2018",Handguns,Remington                                                                                ,7.62x39,Bolt Action                                                                                ,Pistol,"Phone: 912 657 6648 I'm looking for a handgun in the Savannah and surrounding area, send pictures. 9,40,45 or similar. Along the lines of medium price would be preferable. (Less than 600)Phone 912-657-6648.  I will sign bill of sale and show id."
50,http://www.armslist.com/posts/6913050,"Want To Buy:  Ruger SP101 22lr 4.2"" barrel","Stoughton, Madison, Wisconsin",Offer,"Listed On: Sunday, June 4, 2017",Handguns,Ruger                                                                                ,22 Long Rifle                                                                                ,Double / Single Action                                                                                ,Revolver,"Want to buy a used Ruger SP101 22lr 4.2"" barrel.
I have cash or guns to trade.Thanks for looking!"
51,http://www.armslist.com/posts/6913051,For Sale:  1978 Ruger 10/22,"Se ks, Southeast, KS, Kansas",$ 280,"Listed On: Sunday, June 4, 2017",Rifles,Ruger                                                                                ,22 Long Rifle                                                                                ,Semi-automatic                                                                                ,Rifle,"Excellent condition 1978 Ruger 10/22 with walnut stock and no plastic. Metal trigger, barrel band and butt plate."
53,http://www.armslist.com/posts/6913053,For Sale:  Remington 1100 Magnum,"Western MA, Massachusetts, United States",$ 600,"Listed On: Tuesday, June 20, 2017",Shotguns,Remington                                                                                ,12 Gauge                                                                                ,Semi-automatic                                                                                ,Shotgun,"For sale Remington model 1100 Magnum 30"" rib vent barrel with 3 inch chamber and a 22"" smooth bore rifle sight barrel with 2 3/4 inch chamber. Shotgun is a shooter, but we'll taken care of."
55,http://www.armslist.com/posts/6913055,For Sale:  USP 9 COMPACT WITH NS+EXTRAS,"IONIA, Lansing, Michigan",$ 790,"Listed On: Sunday, June 4, 2017",Handguns,Heckler & Koch                                                                                ,9mm Luger (9x19)                                                                                ,Double / Single Action                                                                                ,Pistol,"Low round count original ownerBE date code-Comes with-original box/papers-2 factory 13rd mags each with flat and extended base plates-meprolight night sights (factory brand)-kydex iwb holster-kydex pocketStandard double/single action V1 with saftey/decockerlocal sale only no shippingmust have cpl or purchase permitCost Me over $1200 new for everything, MY LOSS IS YOUR GAINCASH ONLY - NO TRADES PLZMy number is REDACTED (text preferred)"
56,http://www.armslist.com/posts/6913056,For Sale:  AR-15 M4 5.56 with ammo tac sling,"Crestview, Okaloosa County, Florida",$ 550,"Listed On: Sunday, June 4, 2017",Rifles,Anderson Manufacturing                                                                                ,223/5.56 NATO                                                                                ,Semi-automatic                                                                                ,Rifle,"Anderson lower, chambered in 5.56. Shoots like a champ. Comes with all shown. I also have an ammo can and the original handguard.550. Will entertain trades with cash, I am looking for a ww2 jap arisaka t99."
57,http://www.armslist.com/posts/6913057,"For Sale:  Vortex Diamondback 4-12x40mm, Like New with Rings","Grand Rapids, Grand Rapids, Michigan",$ 175,"Listed On: Sunday, June 4, 2017",Optics,Anderson Manufacturing                                                                                ,223/5.56 NATO                                                                                ,Semi-automatic                                                                                ,Rifle,"Vortex Diamondback Scope: 4-12x, 40mm, near new condition. Mounted on 22M, shot a few times then sold the gun. Will include the Vortex rings. They were mounted at the appropriate pounds of torque. Open to trades for other scopes...less magnification."
