,url,title,location,price,post date,category,manufacturer,caliber,action,firearm type,postcontent
299,http://www.armslist.com/posts/6221299,For Sale:  Marlin 1894FG .41,"Cookeville, Cookeville, Tennessee","$ 2,000","Listed On: Wednesday, December 14, 2016",Rifles,Marlin                                                                                ,41 Magnum                                                                                ,Lever Action                                                                                ,Rifle,"NIB never fired Marlin 1894FG in .41 magnum. Every paper that came with the gun is still in the box and the gun has spent its whole life in the safe. Will sell for $2,000 or for trade. Interested in the following. Weatherby Accumark in several calibers...257 Wby, .338 Lapua, 30-378, 338 -378Marlin XLR in .338, .35, .444, .410Marlin 1895SBL or any of the Davidson exclusives especially stainless and grey laminated.Ruger No.1 stainless, stainless RSI in .308rifles in .338 lapua, 6.5 Creedmoor, 6.5x284Colt AnacondaM1Amay be interested in others, just send me an offer"
300,http://www.armslist.com/posts/6221300,For Sale:  Mossburg double barrel shotgun,"South, Lexington, Kentucky",$ 500,"Listed On: Saturday, January 21, 2017",Shotguns,Mossberg                                                                                ,12 Gauge                                                                                ,Over and Under                                                                                ,Shotgun,Silver pigeon double barrel NIB. $500.00
301,http://www.armslist.com/posts/6221301,For Sale:  Sig Sauer P320 RX Full Size Night Sights Romeo 1 optic Very Rare,"Spring lake, Fayetteville, North Carolina",$ 900,"Listed On: Monday, December 19, 2016",Handguns,Sig Sauer                                                                                ,9mm Luger (9x19)                                                                                ,Striker Fire                                                                                ,Pistol,I am selling my new in box never fired Sig Sauer P320 RX full size. This is the model with night sights. Will come with everything it did new as well as (2) 21rd Tacops mags. This gun is new in box. They made less then 1000 this year. The serial number for this pistol is one of the first 300. If you need any additional information or have any questions please contact me. Text is best due to work hours REDACTED
303,http://www.armslist.com/posts/6221303,For Sale:  Browning  XT Trap,"Olathe, Kansas City, Kansas","$ 1,800","Listed On: Monday, January 23, 2017",Shotguns,Browning                                                                                ,12 Gauge                                                                                ,Over and Under                                                                                ,Shotgun,"Very nice Browning XT Trap over/under 12ga shotgun. I bought this to shoot sporting clays, trap and skeet. It has performed flawlessly! The previous owner spent a considerable amount of money on having the fully adjustable comb and butt plate. It has the ported 30' barrels with extended Muller chokes. I tried six different Muller chokes and several Briley chokes and found the combination of U3 competition and U Passing to be the best for trap shooting. These chokes also worked well with sporting clays. The chokes were purchased new from Muller around May of this year.The case is the authentic Browning case made for this gun (not cheap) and is less than 6 months old. As you can see in the photos (sorry, I am not a great photographer) the locking lever is well to the right of center, which is a positive when judging the wear on O/U guns. This is the, in my opinion, best steel barrel the Brownings came with- the Japanese Miroku 'special steel'. I ran the s/n through Browning before purchasing it and found that it had been complete checked out by Browning along with the latest ejectors available. It fits like a glove and a solid shooter! Will consider selling without the Muller chokes at a reduced price."
304,http://www.armslist.com/posts/6221304,"For Sale:  ""Sharp Shooter"" Night scope, LE ,308","Cape Coral, South West Florida, Florida","$ 1,376","Listed On: Sunday, May 6, 2018",Rifles,Savage Arms                                                                                ,308/7.62 NATO                                                                                ,Bolt Action                                                                                ,Rifle,"WE HAVE PUT TOGETHER A SUPPER SNIPPER/VARMIT/SHARP SHOOTER PACKAGE! DAY OR OWN THE NIGHT! High DEF HAVE TWO PAVKAGES. THIS IS A LARGE SAVING PACKAGE STICKER PRICE FOR EVERYTHING WOULD BE OVER $1,600.00 BUT YOUR COST IS $1,376.00. Any Questions e mail George at westenfarms@aol.comSAVAGE 10FCP-SR .LE 308 24"" FLUT HB THREAD ACU-TRIGER /STK MAT/BLACK ACCU-TRIGGER,BLACK SYNTHETIC ACCUSTOCK,OVER-SIZED BOLT HANDLE,10 ROUND DETACHABLE BOX MAGAZINE,24"" FLUTED HEAVY BARREL,FREE FLOAT$675.00 on its ownATN X-SIGHT HD II 5-20X RIFLE SCOPE DAY/NIGHT SMART SCOPE RECOIL ACTIVATED VIDEO, PROFILE MANAGER, SMART RANGEFINDER, VIDEO RECORDING, SMOOTH ZOOM, OTHER FEATURES2: E-BAROMETER, GYROSCOPE, E-COMPASS, BLUETOOTH AND WIFI,INFA RED INTA,TAKES PICTURES,VIDEO's and more MIDWEST INDUSTRIES, 30 CALIBER MUZZLE BRAKE 308 5/8X24 FOR .308 AR RIFLES WITH 5/8-24 THREAD, REDUCES MUZZLE RISE, INCLUDES CRUSH WASHER TRUGLO TAC-POD 9-13"" PIVOTING WITH PICATINNY RAIL ADAPTER LIGHTWEIGHT ALL-METAL CONSTRUCTION WITH RUBBER FEET, PIVOTING BASE Also custom AR's as well"
305,http://www.armslist.com/posts/6221305,For Sale:  DP12 Double Barrel Shotgun,"Athens/huntsville, Huntsville, Alabama","$ 1,100","Listed On: Wednesday, December 14, 2016",Shotguns,Savage Arms                                                                                ,12 Gauge                                                                                ,Bolt Action                                                                                ,Shotgun,Flat Dark Earth DP12 Double barrel Shotgun. Bought new 3 months ago for $1380. Asking $1100 can meet in Athens/Huntsville area. Have all original box and paperwork. Fired 12 times. Call or text for pics and questions REDACTED thanks
306,http://www.armslist.com/posts/6221306,For Sale/Trade:  KSG 12ga with extras,"Plainfield, Indianapolis, Indiana",$ 800,"Listed On: Tuesday, December 20, 2016",Shotguns,Kel-Tec                                                                                ,12 Gauge                                                                                ,Pump Action                                                                                ,Shotgun,"KSG 12ga with extended muzzle break, Magpul AFG, Ozark Armament BUIS, Bushnell TRS25 red dot. Roughly 30 rds through it. Awesome home defense gun. Holds 12+1 of 2 3/4 rds or 14+1 in the 12ga shorty rds. Can include a couple boxes of shorty buck shot. Cash price is FIRM"
307,http://www.armslist.com/posts/6221307,For Sale:  Winchester Model 94,"Richmond, Port Huron, Michigan",$ 750,"Listed On: Wednesday, December 14, 2016",Rifles,Winchester                                                                                ,30-30 Winchester                                                                                ,Lever Action                                                                                ,Rifle,Pre 1964 Winchester model 1894. Has redfield peep sight. Is in great condition. Serial number 248****. Will come with a box of silver tip rounds and soft case. Not looking to trade but will consider a bolt action rifle in .300 win mag.
308,http://www.armslist.com/posts/6221308,For Sale:  Glock 43,"Buford, Atlanta, Georgia",$ 400,"Listed On: Wednesday, December 14, 2016",Handguns,Glock                                                                                ,9mm Luger (9x19)                                                                                ,Double Action                                                                                ,Pistol,Selling my glock 43 with about 60 rounds through it. Included are two magazines and case.
309,http://www.armslist.com/posts/6221309,For Sale:  HK SP5K pistol,"Riverside, Inland Empire, California","$ 5,500","Listed On: Wednesday, December 14, 2016",Handguns,Heckler & Koch                                                                                ,9mm Luger (9x19)                                                                                ,Double Action                                                                                ,Pistol,selling my NIB HK SP5K. Comes with two mags but law enforcement only. So if your not it will not come with mags.
310,http://www.armslist.com/posts/6221310,"For Sale/Trade:  Ruger GP100 Wiley Clapp Matte Stainless 357 Mag 3""","Dunkirk, Muncie, Indiana",$ 700,"Listed On: Wednesday, December 14, 2016",Handguns,Ruger                                                                                ,357 Magnum                                                                                ,Double / Single Action                                                                                ,Revolver,"SOLD!Like new in box Ruger Model # 1752. Talo Distributor only limited production Wiley Clapp. Matte Stainless Steel 357 Magnum/38 special/+P3"" Barrel6 ShotDouble/Single actionNovak Front Fiber Optic Front SightNovak LoProfile Rear Sight36 oz.No handling marks, less than 100 rounds through it. Excellent gun only carried a handful of times in the leather Joe's Holster that is included.Asking $700 OBO or trade for a Ruger Match Champion in like new condition.Call or text (765) 7four4-zero64zero"
311,http://www.armslist.com/posts/6221311,For Sale/Trade:  Sks 7.62x39,"Santa Rosa, San Francisco, California",$ 700,"Listed On: Tuesday, December 20, 2016",Rifles,Norinco                                                                                ,7.62x39                                                                                ,Semi-automatic                                                                                ,Rifle,sks long distance open sights custom folding stock in excellent shape REDACTED
312,http://www.armslist.com/posts/6221312,For Sale:  M&P Pro Core 9mm,"Westside, Cincinnati, Ohio",$ 700,"Listed On: Wednesday, December 14, 2016",Handguns,Norinco                                                                                ,7.62x39                                                                                ,Semi-automatic                                                                                ,Rifle,M&P Pro Core 9mm 5in. Burris fast fire 2 and Apex trigger. 2 mags and original case.
313,http://www.armslist.com/posts/6221313,For Sale:  Anderson stripped upper,"Ofallon, St. Louis, Missouri",$ 50,"Listed On: Wednesday, December 14, 2016",Gun,Norinco                                                                                ,7.62x39                                                                                ,Semi-automatic                                                                                ,Rifle,Anderson stripped upper
314,http://www.armslist.com/posts/6221314,For Sale:  Daniel Defense Mk18 pistol for sale,"El Cajon, San Diego, California","$ 2,100","Listed On: Wednesday, December 14, 2016",Rifles,Daniel Defense                                                                                ,223/5.56 NATO                                                                                ,Semi-automatic                                                                                ,Rifle,"DD Mk18 pistol for sale. No longer available in CA. $2,100 firm. If credit card is needed, add 4%. Will not ship. San Diego County only. Will transfer at mutually agreeable FFL. All DOJ/FFL requirements will be followed as they apply to private sale. Has less than 50 rounds through it, and in like new condition. Original box and paperwork available. Please contact Mike at REDACTED with serious inquiries only. No trades."
315,http://www.armslist.com/posts/6221315,For Sale:  Beretta Storm PX4 Compact,"North Little Rock, Little Rock, Arkansas",$ 500,"Listed On: Thursday, January 12, 2017",Handguns,Beretta USA                                                                                ,40 S&W                                                                                ,Double / Single Action                                                                                ,Pistol,"This is an awesome 40 cal. Beretta PX4 Storm Compact. This was bought new at Fort Thompsom. It has had less than 100 rounds put through it. It is in new condition. I really like this pistol. It is very accurate and sweet to shoot. The only reason I'm selling is because it is the only 40 caliber pistol I have left. I've gone to all 9MM and 45 ACP to keep from having to stock SO many different types of ammo. Has all factory supplied manuals mags and Etc. $500.00 Would possible trade for same gun in 9MM in same Condition. No tire kickers please, must be 21 or older. I don't need help selling. Call or text at REDACTED. Thanks for looking."
316,http://www.armslist.com/posts/6221316,For Sale:  Ruger P95DC 9mm,"South, Tulsa, Oklahoma",$ 300,"Listed On: Wednesday, December 14, 2016",Handguns,Ruger                                                                                ,9mm Luger (9x19)                                                                                ,Striker Fire                                                                                ,Pistol,P95DC 9mm. 9x19.  Some rub wear on external. Text at REDACTED. Price firm
317,http://www.armslist.com/posts/6221317,For Sale/Trade:  Glock 17 threaded barrel,"east end, Louisville, Kentucky",$ 575,"Listed On: Monday, December 19, 2016",Handguns,Glock                                                                                ,9mm Luger (9x19)                                                                                ,Striker Fire                                                                                ,Pistol,"Gen 3 Glock 17 with lone wolf threaded barrel that has been ceracoated black. 3 magsGlock boxWarren Tactical fiber optic sightsfactory sights2 thread protectorsfull stippling, double undercut trigger and finger groove removalExtended controlsStainless guide rodGhost connector All parts have Packaging, I do not have the factory Barrel.$575.00 trade value"
318,http://www.armslist.com/posts/6221318,For Sale/Trade:  Ruger mark iii hunter stainless fluted 7.5,"Lowell, Fayetteville, Arkansas",$ 850,"Listed On: Wednesday, December 14, 2016",Handguns,Ruger                                                                                ,22 Long Rifle                                                                                ,Single Action                                                                                ,Pistol,I've got a ruger mark iii stainless fluted that has volquartsen hammer and trigger control group installed. Will come with 2 mags and leather ruger holster. Open to trades. Thanks
323,http://www.armslist.com/posts/6221323,For Sale/Trade:  Walther p22,"Marlow, Oklahoma City, Oklahoma",$ 300,"Listed On: Wednesday, December 14, 2016",Handguns,Walther                                                                                ,22 Long Rifle                                                                                ,Double / Single Action                                                                                ,Pistol,Walther p22 with about 200 rounds thru it. Consider trade for Henry lever action 22 or ruger 10/22 with bull barrel. Call or text 580-six95-four579
326,http://www.armslist.com/posts/6221326,For Sale:  Bersa .380 acp,"Whittier, Los Angeles, California",$ 250,"Listed On: Monday, December 19, 2016",Handguns,Bersa-Eagle                                                                                ,380 ACP                                                                                ,Double / Single Action                                                                                ,Pistol,"Very reliable shooter. Comes with original case, 2 mags, and 50 rounds for $250. Extra magazine and 100 rounds total for $275. Price is firm, won't respond to low-ball offers. Buyer pays all fees. I use Ffl in Whittier but willing to drive a bit. NO cash and carry."
328,http://www.armslist.com/posts/6221328,For Sale:  XDS 45 3.3,"Madison heights, Detroit, Michigan",$ 400,"Listed On: Wednesday, December 14, 2016",Handguns,Springfield                                                                                ,45 ACP                                                                                ,Double Action                                                                                ,Pistol,"Gun, 3- magazines, original packaging $400 or trade for GLOCK 19 GEN 4"
329,http://www.armslist.com/posts/6221329,For Sale:  Pk380,"Jefferson city, Columbia, Missouri",$ 350,"Listed On: Wednesday, December 14, 2016",Handguns,Walther                                                                                ,380 ACP                                                                                ,Double Action                                                                                ,Pistol,I have a Walther PK380 with case and 2 magazines with it.
331,http://www.armslist.com/posts/6221331,For Sale/Trade:  PSA AR Pistol with Optics,"East Side, Evansville, Indiana",$ 800,"Listed On: Tuesday, December 20, 2016",Rifles,Palmetto State Armory                                                                                ,5.56×45mm NATO                                                                                ,Semi-automatic                                                                                ,Rifle,Unfired PSA AR pistol with Vortex Sparc red dot with 3x magnifier.  Local deals only...will not ship.  812-7four6-1546
332,http://www.armslist.com/posts/6221332,For Sale/Trade:  Fabarm heckler and Koch,"Niota, Knoxville, Tennessee","$ 1,000","Listed On: Wednesday, December 14, 2016",Shotguns,H&R                                                                                ,12 Gauge                                                                                ,Semi-automatic                                                                                ,Shotgun,Heckler and Koch made in Italy 12 gauge auto ducks unlimited with 4 chokes and remover will trade something of equal value 1000 obo
333,http://www.armslist.com/posts/6221333,For Sale:  HK USP 40 cal. Compact,"South, Lexington, Kentucky",$ 725,"Listed On: Wednesday, December 14, 2016",Handguns,Heckler & Koch                                                                                ,40 S&W                                                                                ,Double / Single Action                                                                                ,Pistol,Like new HK USP 40 cal. Compact. 725.00
334,http://www.armslist.com/posts/6221334,For Sale:  Remington Real M24 Sniper Weapons System SWS,"Crestview, Okaloosa County, Florida","$ 3,500","Listed On: Friday, December 23, 2016",Rifles,Remington                                                                                ,308/7.62 NATO                                                                                ,Bolt Action                                                                                ,Rifle,"BNIB unfired, with pedigree & upgrades:McCann MARS rail system, Leupold Mark 4 LR/T variable 3.5-10X scope, etc.  Basic models sell for $3,500, this has over $1,500-$2,000 in upgrades txt REDACTED"
335,http://www.armslist.com/posts/6221335,For Sale:  Vector V93 223 ( not hk93 c93 ),"North Everett, Everett, Washington","$ 1,050","Listed On: Wednesday, December 21, 2016",Rifles,Heckler & Koch                                                                                ,223/5.56 NATO                                                                                ,Semi-automatic                                                                                ,Rifle,"For sale is a Vector Arms built V93, clone of the HK93.The Vector rifles are said to be of higher build quality than the Century Arms clones.This rifle has fitted a genuine HK93 lower which is a big improvment.The overall condition is good, but it does have some scratches etc.All extra parts in photos are include.I got this rifle recently in trade and I'm looking to fund other projects, so cash only please."
336,http://www.armslist.com/posts/6221336,For Sale:  Glock 43,"piedmont, Oklahoma City, Oklahoma",$ 1,"Listed On: Wednesday, December 14, 2016",Handguns,Glock                                                                                ,9mm Luger (9x19),Semi-automatic                                                                                ,Rifle,Glock 43 with extras text for more info or offers REDACTED
337,http://www.armslist.com/posts/6221337,"For Sale:  JM MArlin 30AW, Keltec SU16","CWE, St. Louis, Missouri",$ 450,"Listed On: Wednesday, December 14, 2016",Rifles,Kel-Tec                                                                                ,9mm Luger (9x19),Semi-automatic                                                                                ,Rifle,"Keltec SU-16, $450 with two mags. You know what it is, barrel not threaded. Folds for a nice lightweigh, compact rifle. 
 
JM MArlin 30AW, all factory and in good condition with Weaver rail installed on the reciever. With a small red dot, this is a fantastic 150yd  rifle, quick as sin and twice as fun. Asking $425Pics on request."
339,http://www.armslist.com/posts/6221339,For Sale/Trade:  Smith M&P 9mm,"Plainfield, Indianapolis, Indiana",$ 450,"Listed On: Tuesday, December 20, 2016",Handguns,Smith & Wesson                                                                                ,9mm Luger (9x19)                                                                                ,Striker Fire                                                                                ,Pistol,"Smith and Wesson M&P 9mm full size. Comes with 2 mags, back straps, case and paperwork. No external safety. Roughly 100 rds through it. Back straps have been nicely stippled. Cash price is FIRM"
341,http://www.armslist.com/posts/6221341,For Sale:  Springfield Armory M1A with McMillan Stock,"Western Suburbs, Illinois, United States","$ 1,250","Listed On: Tuesday, December 27, 2016",Rifles,Springfield                                                                                ,308/7.62 NATO                                                                                ,Semi-automatic                                                                                ,Rifle,"Springfield Armory M1A, camo McMillan stock. Less than 100 rounds through it. Beautiful condition. Comes with soft case and one 20 round mag. Western Suburbs, no Cook County. FOID and Bill of Sale required of course. No lowballing please. Interesting trades considered."
342,http://www.armslist.com/posts/6221342,Want To Buy:  Looking for single shot .410,"Cullman, Huntsville, Alabama",Offer,"Listed On: Friday, December 30, 2016",Shotguns,H&R                                                                                ,410                                                                                ,Break Open                                                                                ,Shotgun,"Would like to buy a good condition single shot .410   Prefer wood furniture over synthetic   Can be off brand, just need it to work, doesn't have to be a beauty queen"
344,http://www.armslist.com/posts/6221344,For Sale:  Beretta ARX 160 Pistol,"Colerain, Cincinnati, Ohio",$ 350,"Listed On: Wednesday, December 14, 2016",Handguns,Beretta USA                                                                                ,22 Long Rifle                                                                                ,no type,Pistol,"New never shot , 22 LR  with everything it came with in hard case and box it came in. Pop up sights and rails.Would be great Christmas gift for younger kid or someone to go plinking cheap. With some ammo. 350.00"
345,http://www.armslist.com/posts/6221345,For Sale:  P80 lower and Lone Wolf Slide,"Sioux Falls, South Dakota, United States",$ 400,"Listed On: Wednesday, December 14, 2016",Handguns,Glock                                                                                ,40 S&W                                                                                ,Double / Single Action                                                                                ,Pistol,PF940 80% Pistol Frame and jig kit.Incudes:PF940 Pistol Frame and JigDrill Bits and EndmillsLocking Block and SliderailsLone Wolf slide 40/357
346,http://www.armslist.com/posts/6221346,For Sale:  Smith and Wesson 44 magnum  29-2,"Shawnee, Oklahoma City, Oklahoma",$ 600,"Listed On: Thursday, December 29, 2016",Handguns,Smith & Wesson                                                                                ,40 S&W                                                                                ,Single Action                                                                                ,Pistol,Smith  and Wesson 44 Magnum   29-2.  This gun is the same exact gun Clint Eastwood used in Dirty Harry . This gun is in great condition.  Feel free to message or call me with any questions 405- 534-6010
