,url,title,location,price,post date,category,manufacturer,caliber,action,firearm type,postcontent
1,http://www.armslist.com/posts/6221001,For Sale/Trade:  IWB/OWB Belt slide,"Lakewood, Denver, Colorado",$ 20,"Listed On: Wednesday, December 14, 2016",Holsters,no type,no type,no type,no type,"For sale is a Tagua Gunleather belt slide holster that can be worn either inside the waist band with a clip or outside the waist band using belt slots. This is a very versatile holster and fits large frame guns such as Glocks, Sig Sauer and HK Pistols. The leather is in nice condition and will fit belts up to 1.25 inches. The holster can be worn left or right handed.Asking $20 or will trade for ammo"
2,http://www.armslist.com/posts/6221002,For Sale/Trade:  Ruger Redhawk 44 Magnum,"Bixby, Tulsa, Oklahoma",$ 850,"Listed On: Wednesday, January 4, 2017",Handguns,Ruger                                                                                ,no type,Double / Single Action                                                                                ,Revolver,"1980's Ruger Redhawk 44 MAG 7.5"" barrel. It comes with a handmade Bianchi Holster and a Bianchi Ammunition Belt. I have put about 30 rounds through it since I've had it. It is in great condition for its age. Please contact me about info, pics, etc... I would be interested in a 10/22 with 600 cash or a mini 14 with 450 cash. Or anything with cash just let me know what you have. Thanks"
4,http://www.armslist.com/posts/6221004,For Sale:  Cz Scorpion,"Manchester, Manchester, New Hampshire",$ 850,"Listed On: Wednesday, December 14, 2016",Handguns,CZ USA                                                                                ,9mm Luger (9x19)                                                                                ,no type,Pistol,"CZ Scorpion. Very little use. Lost interest in it. 2 20 round mags and 2 30 round mags. Buffer tube adapter, pistol buffer tube and shockwave brace. 850$ Manchester area. NH ID and PRL."
6,http://www.armslist.com/posts/6221006,For Sale:  Sig Sauer - Gen 2 - 556r,"Yukon, Oklahoma, United States","$ 1,250","Listed On: Tuesday, June 27, 2017",Rifles,Sig Sauer                                                                                ,7.62x39                                                                                ,Semi-automatic                                                                                ,Rifle,"I'm selling my Sig Sauer 556r, Gen 2. I bought this rifle brand new in 2013. I clean it quarterly and it is safe kept. I have nine 30 round magazines and four 40 round magazines.Amazing rifle with this muzzle brake. Way less recoil than a standard AK 47, and much more accurate. I am including the Samson Sig Sauer 556 iron sights. I have a factory installed Sig Sauer quad rail.Cash only, must have ID."
7,http://www.armslist.com/posts/6221007,For Sale:  BUSHMASTER AR15,"Liberty, Greenville, South Carolina",$ 800,"Listed On: Wednesday, December 14, 2016",Rifles,Bushmaster                                                                                ,223/5.56 NATO                                                                                ,Semi-automatic                                                                                ,Rifle,"Ok first the ar is an older bushmaster ar that was made in the Windham factory. It's a 223-556 with ammo can with 420+ rounds of 556 and a handful of 223. Also has bsa red dot and a riser to get it above the front sight. The furniture is brand new Magpul. 2 mags. One 30 and one 42. Also rifle bag pictured. I'm asking 800. The m&p is a pro series with dovetail night sights and 4.5lb trigger and stainless guide rod. Front laser, inside wastebasket safari land holster. 3 mags. Factory box. One mag has an arendondo extention and one has a Taylor Freelance extention. Also comes with 50rnds of JHP. I'm looking to get serious offers on it. PLEASE DON'T OFFER ME 4-500 OR A 300$ GUN the m&p is >$600 new and the AR has around $200 in extras."
8,http://www.armslist.com/posts/6221008,For Sale:  Looking to trade or sell crossbow,"Fort Drum, Watertown, New York",FREE,"Listed On: Friday, January 13, 2017",Archery,Bushmaster                                                                                ,223/5.56 NATO                                                                                ,Semi-automatic                                                                                ,Rifle,I have a Horton Zombie Rip crossbow I am looking to sell or trade for a firearm. It's in nice condition and shoots really well just don't have time to use it. It's powerful enough to use on a deer which is what I intended to use it for. Comes with a scope but no bolts. Would trade for a pump shotgun or a rifle depending what it is. I have a range card taped on the side of the stock. Make me a offer if you wanna buy it outright. I am in the springville area for the next 2 weeks if you are interested
10,http://www.armslist.com/posts/6221010,Want To Buy:  Rifle and/or handgun  in .22lr,"Maury/Lawrence County, Nashville, Tennessee",Offer,"Listed On: Wednesday, December 14, 2016",Rifles,Henry Repeating Arms                                                                                ,22 Long Rifle                                                                                ,Lever Action                                                                                ,Rifle,Looking for a .22lr rifle and/or handgun.  Prefer a lever action but will also consider a semi-auto.  Interested in anything in .22lr.I'm located in the Maury/Lawrence County area and as far north as I'll be able to travel anytime soon will be the Spring Hill area.If you have something text me pics and details (including your location) to 931-215-685zero.
12,http://www.armslist.com/posts/6221012,For Sale:  Springfield M1 Garand 1955,"Marsing, Idaho, United States","$ 1,390","Listed On: Wednesday, December 14, 2016",Rifles,Springfield                                                                                ,no type,Semi-automatic                                                                                ,Rifle,"M1 Garand Springfield, serial number 5,855,xxx, from approx May 1955. Barrel is marked SA 4-55. MW -1 ½. TE -1 ½. Bore is bright and shiny. Chamber is still in the white. Nice even dark green finish on receiver. 65 SA bolt, 65 SA op rod, 65 SA trigger housing, D55 SA hammer, SA-11 safety , DRC windage knob, DRC elevation knob, unnumbered follower, notched bullet guide, high hump gas lock, gas plug is stamped “P” with an “o”, front sight measures . For More Info email REDACTED"
13,http://www.armslist.com/posts/6221013,For Sale/Trade:  Smith 45,"Tulsa, Tulsa, Oklahoma",$ 400,"Listed On: Wednesday, December 14, 2016",Handguns,Smith & Wesson                                                                                ,45 ACP                                                                                ,Single Action                                                                                ,Pistol,S & w military and police full size 45acpLike new with box and 3 mags400 cash 500 trade
14,http://www.armslist.com/posts/6221014,For Sale:  Daniel defense  DDM4V5,"Decatur, Huntsville, Alabama","$ 1,300","Listed On: Thursday, January 5, 2017",Rifles,Smith & Wesson                                                                                ,45 ACP                                                                                ,Single Action                                                                                ,Rifle,"Daniel defense DDM4V5 16"" around 500 rounds fired. This rifle will come as pictures if purchased. It has always been cleaned after shot extensively. I shot sub MOA with black hills 77gr with this rifle at 100 yds. I bought it from the original owner. Very nice and clean, been kept in a humidity/temperature controlled environment. Decatur al, $1300$ FIRM cash only. I have a magpul ctr stock I can swap out if you'd rather have that one. I will not travel outside of Morgan county for this deal. REDACTED"
15,http://www.armslist.com/posts/6221015,For Sale:  SAPI 7x8 hard armor,"Macon, GA, Macon, Georgia",$ 200,"Listed On: Friday, April 7, 2017",Tactical,Smith & Wesson                                                                                ,45 ACP                                                                                ,Single Action                                                                                ,Rifle,Looking to sell a set of 8x7 level IV plates. Asking $200 obo and will include the soft armor inserts.
17,http://www.armslist.com/posts/6221017,For Sale:  Taurus Pt145 300 OBO,"Indep Mo, Kansas City, Missouri",$ 300,"Listed On: Wednesday, December 14, 2016",Handguns,Taurus                                                                                ,45 ACP                                                                                ,Double / Single Action                                                                                ,Pistol,Selling my Taurus PT145 it is in great condition and has had a maximum of 60 rounds threw her. No holster marks or scratches it is in good condition. Email or text at REDACTED for more info and better pics. Must be 21 with a valid MO ID and willing to sign a bill of sale no acceptions. No felons no minors no thugs. Thank you have a blessed day.
19,http://www.armslist.com/posts/6221019,For Sale/Trade:  Winchester SX3 12 Gauge Semi Auto Shotgun. Cantilevered Fully Rifled Barrel with a Nikon BDC Scope.,"Fishers, Indianapolis, Indiana",$ 800,"Listed On: Wednesday, December 28, 2016",Shotguns,Winchester                                                                                ,12 Gauge                                                                                ,Semi-automatic                                                                                ,Shotgun,Winchester SX3 12 Gauge Semi Auto Shotgun. Cantilevered Fully Rifled Barrel with a Nikon BDC Scope. It's a good shooting gun I'm looking to get a 450 Bushmaster $800 OBO text or call REDACTED thanks
20,http://www.armslist.com/posts/6221020,For Trade:  Sig Sauer p320 Fde compact,"Johnson City, Tri-cities, Tennessee",Offer,"Listed On: Wednesday, December 14, 2016",Handguns,Sig Sauer                                                                                ,40 S&W                                                                                ,Semi-automatic                                                                                ,Pistol,"I have a Sig Sauer p320 Fde .40 compact I am trading. Wanted to try a different caliber but going to stick with 9mm. This is a great firearm with the Sig night sights and Sig holster.  The gun is like new condition very well taken care of. I have the Gun, Mag, holster, 100 rds ammo and comes with the night sights. I can add boot for the right trade or toward an AR.Looking to trade for quality 9mm only. REDACTED more pictures available upon request."
21,http://www.armslist.com/posts/6221021,For Sale/Trade:  Taurus tracker 44 mag,"East Knox, Knoxville, Tennessee",$ 500,"Listed On: Wednesday, December 14, 2016",Handguns,Taurus                                                                                ,40 S&W                                                                                ,Double / Single Action                                                                                ,Revolver,Taurus tracker 44mag raging bull grips and a box of ammo
24,http://www.armslist.com/posts/6221024,For Sale:  DDM4 V5 Tornado Grey + Extras,"Madison County, St. Louis, Illinois","$ 1,200","Listed On: Wednesday, December 14, 2016",Rifles,Daniel Defense                                                                                ,223/5.56 NATO                                                                                ,Semi-automatic                                                                                ,Rifle,"I am looking to sell my DDM4 due to financial reasons. I have fired around 700 rounds through this rifle, but spread out between three BCG's. The original bolt(sprinco springs installed) and the BCM bolt (sprinco springs installed) I will be including both have about 200 rounds each on them and the rest are on another BCG that I am keeping for when I can afford another rifle. I have literally had no malfunctions in this gun. Even with three different BCG's. I did not go over 200 rounds without reapplying oil, which could probably contribute to that. I have a good amount of after market parts on here which I will list below this description. This rifle is in excellent condition functionality wise and cosmetically.After market parts list:BCM Mod 4 Charging HandleCustom Muzzle Brakes Low Concussion BrakeSprinco Ehanced Buffer SpringBCM FDE Ion Bond BCG-with sprinco springs installedHogue Soft Overmolded Grip (feels amazing)Magpul STR StockMagpul MBUSMagpul Enhanced Aluminum Trigger GuardI will include the stock DD furniture and the DD case."
25,http://www.armslist.com/posts/6221025,For Sale:  Firefield tactical scope,"Monticello, Minneapolis / St. Paul, Minnesota",$ 50,"Listed On: Wednesday, December 14, 2016",Optics,Daniel Defense                                                                                ,223/5.56 NATO                                                                                ,Semi-automatic                                                                                ,Rifle,"2.5-10 x 40mm tactical scope... Bdc reticle calibrated for 223/556.. illuminated reticle, and red Lazer dot.. integrated sun shade... Works, glass is clear.. over 125$new.."
26,http://www.armslist.com/posts/6221026,For Sale/Trade:  Winchester Super X3 12GA Gray Shadow,"Oshkosh, Appleton, Wisconsin",$ 800,"Listed On: Wednesday, December 14, 2016",Shotguns,Winchester                                                                                ,12 Gauge                                                                                ,Semi-automatic                                                                                ,Shotgun,"Winchester SX3 Gray Shadow 12GA 3"" with 28"" barrel. The Gray Shadow model has a Gray perma coat finish and dura touch finish on the stock set. Comes with box, owners manual, shims, spacers choke tubes and wrench. Gun is used but in very nice shape. $800.00 obo."
28,http://www.armslist.com/posts/6221028,For Sale:  Burris Fullfield II 6.5-20x50mm Mil-Dot,"SE, Wichita, Kansas",$ 300,"Listed On: Thursday, March 9, 2017",Optics,no type,no type,no type,no type,"I have a Burris fullfield II 6.5-20x50mm mil-dot scope in excellent condition for sale. Had it on a 700 .243 to sight in, but it's just too much magnification for my hunting needs. Comes with all of the original pamphlets, original box, and butler creek scope covers (scope rings no longer available). Asking $300 and willing to ship. No trades please."
29,http://www.armslist.com/posts/6221029,For Sale/Trade:  S&W 66-1,"Natchez, South West Mississippi, Mississippi",$ 575,"Listed On: Saturday, December 24, 2016",Handguns,Smith & Wesson                                                                                ,357 Magnum                                                                                ,Double Action                                                                                ,Revolver,S&W 66-1 357mag up for sale or trade. Interested in magnum rifles mainly but will look at anything. Text REDACTED$575 cash $675 trade
30,http://www.armslist.com/posts/6221030,For Sale:  N82 Professional,"Darboy, Appleton, Wisconsin",$ 40,"Listed On: Sunday, January 1, 2017",Holsters,Smith & Wesson                                                                                ,357 Magnum                                                                                ,Double Action                                                                                ,Revolver,"I have a N82 Professional model holster for a full size XD/XDM.  This is an IWB holster with positive retention.  This holster retails for around $70.00, I am asking for $40.00"
31,http://www.armslist.com/posts/6221031,For Sale/Trade:  HK P30 V3 9mm,"North Ridgeville, Cleveland, Ohio",$ 750,"Listed On: Monday, January 9, 2017",Handguns,Heckler & Koch                                                                                ,9mm Luger (9x19)                                                                                ,Double / Single Action                                                                                ,Pistol,"Up for sale or trade is an HK P30 V3 in 9mm. Comes with factory case, grip panels, lock, pistol and 2-15 round mags."
32,http://www.armslist.com/posts/6221032,For Sale/Trade:  Glock 34 - Gen 3 Package,"South Okc, Oklahoma City, Oklahoma",$ 575,"Listed On: Wednesday, December 14, 2016",Handguns,Glock                                                                                ,9mm Luger (9x19)                                                                                ,Striker Fire                                                                                ,Pistol,Glock 34 - Gen 3Dawson Fiber Optic Sights1 Mag$575 without the Surefire X300 or Trades WelcomeWill also Sell the Surefire X300 by itself for $175
33,http://www.armslist.com/posts/6221033,For Sale:  KEL RFB Carbine 7.62 NATO/.308 Winchester 18 Inch Chrome-Lined Blued Barrel Cerakote OD Green Stock Birdcage Flash Hider 10 Round,"PLAISTOW, New Hampshire, United States","$ 1,499","Listed On: Tuesday, December 20, 2016",Rifles,Kel-Tec                                                                                ,9mm Luger (9x19)                                                                                ,Striker Fire                                                                                ,Rifle,http://vizardsgunsandammo.com/kel-rfb-carbine-7-62-nato-308-winchester-18-inch-chrome-lined-blued-barrel-cerakote-od-green-stock-birdcage-flash-hider-10-round/KEL RFB Carbine 7.62 NATO/.308 Winchester 18 Inch Chrome-Lined Blued Barrel Cerakote OD Green Stock Birdcage Flash Hider 10 Round RFB Carbine Rifle Forward-ejecting Bullpup. Fully ambidextrous operations. Chrome lined blued barrel with 5/8-24 threads. A2 style compensator. Front ejection of cases. Top Picatinny rail for mounting sights (no sights included). Gunsmith replaceable barrel with adjustable headspace. Click adjustable gas system for various power ammo or suppressor use. Accepts FAL metric magazines with straight-in/drop-free magazine well (one magazine included). Nylon sling and hardware included. In-grip storage capability.  Cerakote OD Green Stock   Caliber-Gauge .308 WIN.Specific Caliber 7.62 NATOBarrel Length 18Capacity 10Threaded Barrels Threaded BarrelMade in the USA Made in the USALong Gun Web Model Model RFBTactical Tactical
34,http://www.armslist.com/posts/6221034,For Sale:  Dpms AR15 5.56-.223,"Fostoria, Flint, Michigan",$ 800,"Listed On: Wednesday, December 14, 2016",Rifles,DPMS                                                                                ,223/5.56 NATO                                                                                ,Semi-automatic                                                                                ,Rifle,Nice rifle shoots great chrome lined barrel with flip up sights one 30 round mag. call or text REDACTED for info
35,http://www.armslist.com/posts/6221035,For Sale/Trade:  Benelli SuperNova,"Charleston, Charleston, South Carolina",$ 475,"Listed On: Tuesday, December 20, 2016",Shotguns,Benelli                                                                                ,12 Gauge                                                                                ,Pump Action                                                                                ,Shotgun,"Brand new in box, never fired, Benelli SuperNova 12ga, Max5 camo, 26"" barrel. Comes with 3 chokes, choke wrench, and all paperwork."
36,http://www.armslist.com/posts/6221036,For Sale:  Glock 23 Gen 4,"Ooltewah, Chattanooga, Tennessee",$ 475,"Listed On: Friday, January 13, 2017",Handguns,Glock                                                                                ,40 S&W                                                                                ,Striker Fire                                                                                ,Pistol,Like New Gen 4 Glock 23.  Only trade interest would be Sig P320 9mm or Glock 19 in similar condition
37,http://www.armslist.com/posts/6221037,For Sale:  Smith and Wesson 45 Long Colt Revolvers 625 pre locks,"Tempe, Phoenix, Arizona","$ 1,500","Listed On: Wednesday, December 14, 2016",Handguns,Smith & Wesson                                                                                ,45 Long Colt                                                                                ,Double Action                                                                                ,Revolver,"Very nice condition. Like new. Both have been upgraded by Magnum Mike. 625-6 mountain gun 4""625-7 Lew Horton 3""1500.00 each"
38,http://www.armslist.com/posts/6221038,For Sale/Trade:  Glock 30 GEN 2.S MASS COMPLIANT,"CAPE COD, Massachusetts, United States",$ 600,"Listed On: Friday, January 6, 2017",Handguns,Glock                                                                                ,45 ACP                                                                                ,Striker Fire                                                                                ,Pistol,GLOCK 30 GEN 2.5 ORIGINAL OWNER 99% CONDITION ORIGINAL BOX ETC  SAFE QUEEN MASS COMPLIANT
39,http://www.armslist.com/posts/6221039,For Sale/Trade:  M1 carbine,"East Louisville, Louisville, Kentucky",$ 600,"Listed On: Friday, December 30, 2016",Rifles,Glock                                                                                ,30 Carbine                                                                                ,Semi-automatic                                                                                ,Rifle,Nickle plated Inland M1 carbine two magazines one 15 round and one 30 roundslingmagazine pouch $600.00text if you would more pics502 seven nine seven 9975
40,http://www.armslist.com/posts/6221040,For Sale/Trade:  SIG 1911T RTSS,"Mesquite, Dallas, Texas",$ 800,"Listed On: Saturday, December 24, 2016",Handguns,Sig Sauer                                                                                ,45 ACP                                                                                ,Single Action                                                                                ,Pistol,"Like new SIG 1911 45acp two tone full size, adjustable night sights, 3 factory mags, and the box. Nice 45."
41,http://www.armslist.com/posts/6221041,For Sale:  S&W E Series 1911 w/rail,"Farmington Hills, Michigan, United States","$ 1,050","Listed On: Tuesday, March 14, 2017",Handguns,Smith & Wesson                                                                                ,45 ACP                                                                                ,Single Action                                                                                ,Pistol,"Used S&W E Series SW1911TA stainless steel enhanced 1911 with ambidexterous safety, tactical rail, and Trijicon night sights.  Includes Blackhawk LH holster and magazine pouch and six miscellaneous magazines.  Original box and paperwork included.  Also includes 500 rounds of Remington UMC 230gr FMJ.  Great bundle that'll get you on the range immediately.CPL or purchase permit required.  I'm willing to travel up to a half hour to make a transaction.Not interested in trades at this time."
42,http://www.armslist.com/posts/6221042,For Sale:  Glock 23 gen 3,"North, Cheyenne, Wyoming",$ 375,"Listed On: Wednesday, December 14, 2016",Handguns,Glock                                                                                ,40 S&W                                                                                ,Striker Fire                                                                                ,Pistol,"Looking to sell a Glock 23 gen 3. It has night sights, comes with 3 magazines, and box (with all the stuff it came with). Gun has about 4-500rds. Looking to get 375.00 for it. Face to face in Cheyenne. I can email pictures upon request."
45,http://www.armslist.com/posts/6221045,"For Sale:  Springfield's  ""SAINT"" is coming","Cape Coral, South West Florida, Florida",$ 795,"Listed On: Sunday, May 6, 2018",Rifles,Springfield                                                                                ,223/5.56 NATO                                                                                ,Semi-automatic                                                                                ,Rifle,"In stock limited  new to the market and we have ordered a bunch of them. $795.00George at westenfarms@aol.comThere are many more fine AR's in stock as well plus full partSpringfield, SAINT 5.56, Semi-automatic Rifle, 223 Rem/556NATO, 16"" Barrel, 1:8 Twist, Mid-Length Gas System, Type III Hard Coat Anodized Finish, Bravo Company Mod 3 Grip, Bravo Company 6 Position Stock, Bravo Company Keymod Hardguard, Bravo Company Trigger Guard, A2 Front and Low Profile Flip-Up Rear Sights, 1 Magpul PMAG M3, 30Rd"
