,url,title,location,price,post date,category,manufacturer,caliber,action,firearm type,postcontent
278,http://www.armslist.com/posts/6913278,Want To Buy:  Glock buyer,"kansas City, Kansas City, Missouri",$ 450,"Listed On: Sunday, June 4, 2017",Handguns,Glock                                                                                ,5.56×45mm NATO                                                                                ,no type,Pistol,looking to buy glocks 9 or 40 mm
279,http://www.armslist.com/posts/6913279,For Sale:  Savage Axis XP Youth,"South County, St. Louis, Missouri",$ 275,"Listed On: Sunday, June 4, 2017",Rifles,Savage Arms                                                                                ,243 Winchester                                                                                ,Bolt Action                                                                                ,Rifle,"Savage XP Youth, .243, 20"" barrel, Bushnell Sharpshooter 3x9, standard trigger (pre accu-trigger), detachable box magazine, box of ammo +, box & papers."
281,http://www.armslist.com/posts/6913281,For Sale:  QFI .25 auto,"North Reading, Massachusetts, United States",$ 260,"Listed On: Sunday, August 13, 2017",Handguns,Tanfoglio                                                                                ,25 ACP                                                                                ,Single Action                                                                                ,Pistol,Pocket pistol. Impulse bought it and I rarely carry. A little picky with ammo. Have a box of .25 hollow points and a pocket holster
284,http://www.armslist.com/posts/6913284,For Sale:  Trade Chris Craft for Colt/FN/Sig etc,"Lake CDA, Spokane, Washington","$ 9,000","Listed On: Sunday, June 4, 2017",Vehicles,no type,no type,no type,no type,"1954 Chris Craft Riviera 20' for sale or trade... straight across trades welcome... cash offers entertained... lowball offers will get a courteous response.This boat is rare as it was only made for 5 years and only 288 hulls built. Engine alone (MBL 158 hp) sells at midwestern classic boat builders shop for $7000 plus core. This one has been completely restored and has the transmission too. Hardware and restored seats and other panels will save a bunch of time and money as you restore this craft. Do an internet search for images and details of this scarce craft and you'll see that they bring big money when finished. I don't have the room or the ambition to finish. You can get a helluva deal if you make an offer! Will trade for Colt , Ithaca, Remington Rand M1911a1 pistols, Colt Commercial, or other interesting vintage hand guns. May also consider USA manufactured long guns and quality SigSauer, FN, LWRC, AR type rifles in 223 or 308. Meet at the Spokane show this weekend to make offers.Call REDACTED for details and offers"
285,http://www.armslist.com/posts/6913285,For Sale:  CMC 3.5lbs flat trigger,"Lugoff, Columbia, South Carolina",$ 100,"Listed On: Friday, June 9, 2017",Gun,no type,no type,no type,no type,CMC 3.5lbs flat trigger Drop in. AR-15   $REDACTED028
286,http://www.armslist.com/posts/6913286,For Sale/Trade:  S & W 6906 9mm,"Leon Valley NW SATX, San Antonio, Texas",$ 440,"Listed On: Sunday, July 2, 2017",Handguns,Smith & Wesson                                                                                ,9mm Luger (9x19)                                                                                ,Double / Single Action                                                                                ,Pistol,"Looking to sell or trade.S&W 3rd gen 9mm model 6906. Include 1-12 rnd magazine. $440.00 cash FTF with your TDL. Offers considered.If you see this,  it's available."
287,http://www.armslist.com/posts/6913287,For Sale:  M203,"SHORELINE, Seattle, Washington",$ 110,"Listed On: Sunday, June 4, 2017",Gun,Smith & Wesson                                                                                ,9mm Luger (9x19)                                                                                ,Double / Single Action                                                                                ,Pistol,DBoys m203 gas powered 40mm grenade launcher SHORT. brian call REDACTED
290,http://www.armslist.com/posts/6913290,For Sale:  S&W 4566,"Walton County, Okaloosa County, Florida",$ 525,"Listed On: Sunday, June 4, 2017",Handguns,Smith & Wesson                                                                                ,45 ACP                                                                                ,Double / Single Action                                                                                ,Pistol,"Smith & Wesson 4566 with 4 1/4 barrel on full-size steel frame. Has night sights, but they are dim. Comes with two 8 round mags. Gun is in excellent shape!"
294,http://www.armslist.com/posts/6913294,For Sale:  CZ75 P-01 9MM,"Reston, Virginia, United States",$ 540,"Listed On: Sunday, June 4, 2017",Handguns,CZ USA                                                                                ,9mm Luger (9x19)                                                                                ,Double / Single Action                                                                                ,Pistol,"The CZ75 P01 9MM is in like-new condition in the box with two 14-round mags and all of the papers it came with.  It weighs 3 ounces more than the Glock 19, has 3-dot fixed sights and factory rubber grips. Pistol is double/single action with a decocker.  Pistol is quite accurate and a nice looking pistol."
295,http://www.armslist.com/posts/6913295,For Sale:  RUGER LCP 380 TALO - NEW,"West Des Moines, Des Moines, Iowa",$ 249,"Listed On: Sunday, June 4, 2017",Handguns,Ruger                                                                                ,380 ACP                                                                                ,Double Action                                                                                ,Pistol,"Brand:  Ruger   Model:  LCP Contractor Yellow TALO Special Edition   Type:  Pistol: Semi-Auto   Caliber:  380   Finish:  Blue   Action:  Double Action Only   Stock:  Ruger Contractor Yellow Cerakote Grip Frame   Sight:  Fixed   Barrel Length:  2.75    Overall Length:  5.16   Weight:  9.6 oz   Capacity:  6+1   # of Mags:  1   Packaging:  Soft Case Included   Features:  TALO Special Edition    Credit Cards Accepted via PayPal or Square Point of Sale.  No extra charge.  IOWA RESIDENTS HAVE TO PAY 6% SALES TAX          BUY IT NOW WITH PAYPALWe offer $25 Transfer Fees on all Firearms. There is no transfer fee if you purchase directly from 3C Firearms.We can ship to an FFL of your choice for $20.00 or we will make arrangements for you to pick it up after payment has been received.  If you want me to ship to your FFL, please have them send me a copy of there FFL.  Email: REDACTEDPhone: REDACTEDwww.3cfirearms.com ** Inventory kept offsite, allow 2-3 days for pickup or shipping**"
297,http://www.armslist.com/posts/6913297,For Sale:  .30 Carbine,"Exit 11, Clarksville, Tennessee",$ 525,"Listed On: Sunday, June 4, 2017",Rifles,Universal Firearms                                                                                ,30 Carbine                                                                                ,Semi-automatic                                                                                ,Rifle,Universal .30 Carbine in great shape. Comes with 3 mags and reloading RCBS dies. Appraised at $550 - $600. Price is firm.
298,http://www.armslist.com/posts/6913298,For Sale:   Ithaca double barrel 12 guage Shot gun grade 4,"Arizona, Arizona, United States",$ 700,"Listed On: Sunday, June 4, 2017",Antique,Universal Firearms                                                                                ,30 Carbine                                                                                ,Semi-automatic                                                                                ,Rifle,"12 guage ithaca flues model grade 4 double barrel shot gun manufactured in 1913 serial number 240383 highly decorated 28"" barrels choked full/modified. Even though the gun is marked grade 4 from factory it has more engraving than the standard grade4."
299,http://www.armslist.com/posts/6913299,For Sale:  SPIKES TACTICAL,"SHORELINE, Seattle, Washington",$ 300,"Listed On: Tuesday, July 18, 2017",Gun,Universal Firearms                                                                                ,30 Carbine                                                                                ,Semi-automatic                                                                                ,Rifle,SPIKESTACTICAL 37 MM  GRENADE LAUNCHER NEW . brian  call. REDACTED
300,http://www.armslist.com/posts/6913300,"For Sale:  INFICON, VORTEX, AC, REFIGERANT RECOVERY MACHINE","OKLAHOMA CITY, Oklahoma City, Oklahoma",$ 400,"Listed On: Monday, November 27, 2017",Miscellaneous,Universal Firearms                                                                                ,30 Carbine                                                                                ,Semi-automatic                                                                                ,Rifle,1 HP dual piston compressor provides industry-leading recovery rates Micro-channel condenser provides exceptional heat exchange allowing Vortex Dual to maintain recovery rates throughout the entire recovery cycle Oversize fan provides exceptional cooling Self-purge without the need to change hoses Filter/dryer included  L95832A
301,http://www.armslist.com/posts/6913301,For Sale/Trade:  M&P .40 FFL ONLY,"Kansas City, Kansas City, Kansas",$ 0,"Listed On: Monday, June 19, 2017",Handguns,Smith & Wesson                                                                                ,40 cal                                                                                ,Striker Fire                                                                                ,Pistol,Pistol has 1 single cosmetic flaw; the trigger guard has a hairline crack. Apex trigger upgradeTrigicon night sights511 holster3 magsCarrying bag
302,http://www.armslist.com/posts/6913302,For Sale:  Springfield XD 40,"Westside, Albuquerque, New Mexico",$ 425,"Listed On: Sunday, June 4, 2017",Handguns,Springfield                                                                                ,40 S&W                                                                                ,Striker Fire                                                                                ,Pistol,"Great condition. 3 factory 12-round mags, 1 20-round extended mag, factory holster, Blackhawk holster, lock, box, and paperwork. Asking $425 OBO."
303,http://www.armslist.com/posts/6913303,For Sale:  Ruger SR22,"Thomasville, Greensboro, North Carolina",$ 280,"Listed On: Wednesday, June 14, 2017",Handguns,Ruger                                                                                ,22 Long Rifle                                                                                ,Striker Fire                                                                                ,Pistol,Only been shot 20 times. Just not what I want. $280 with 100 rounds ammo with it.
304,http://www.armslist.com/posts/6913304,For Sale:  Glock 26 / Gen 4,"Elyria / 44035, Cleveland, Ohio",FREE,"Listed On: Sunday, June 4, 2017",Handguns,Glock                                                                                ,9mm Luger (9x19)                                                                                ,Striker Fire                                                                                ,Pistol,"Both are spotless & LNIB, under 50 rds fired, Never carried. #1) Glock 19 / Gen 4 - Urban Gray with All facotry items, 3 mags, paper work, Extras include: Stainless steel pin set, Stainless end plate, Lone Wolf stainless barrell ($775 invested) #2) Glock 26 / Gen 4- All Facotry items, 3 mags, paper work, (receipt 2/17 for $575 new) , Extras include: 2 x HYVE mags ($112), New - OWB Leather Holster ($30) ($715 invested)Asking $625 each or Best Cash Offer, I will not reply to Low ball offers, Only trade I would conisder is a Gen 4 Glock in .357 sgi with extras or a CZ P07 P09 in Urban Gray & threaded barrell)"
305,http://www.armslist.com/posts/6913305,For Sale:  Benelli Supernova Tactical,"Central, New Jersey, United States",$ 450,"Listed On: Sunday, June 4, 2017",Shotguns,Benelli                                                                                ,12 Gauge                                                                                ,Pump Action                                                                                ,Shotgun,"Brand new Benelli Supernova Tactical with pistol grip. I have never fired this, comes with its box, plastic wrapping, manual, and sight adjust tool. This is all that was in the box. There are no scratches or marks on it. The gun is less than a week old, I didn't even oil it yet. Asking 450 or best offer."
307,http://www.armslist.com/posts/6913307,For Sale/Trade:  IWI Tavor FDE with Upgrades and 6 mags,"Loudoun, Northern Virginia, Virginia","$ 1,325","Listed On: Thursday, June 29, 2017",Rifles,Israel Weapon Industries                                                                                ,5.56×45mm NATO                                                                                ,Semi-automatic                                                                                ,Rifle,"IWI Tavor in FDE with lots of upgrades, ready for fun at the range or a serious HD setup! Low round count!Midwest Industries Handguard Rail with Primary Arms Light and pressure switchMidwest Industries Ejection Port CoverBCM Angled Foregrip6 Magpul P-Mags FDE with Window$1325 Cash, Price is FIRM, Trade value HigherOptional:Aimpoint T-1 4 MOA with Scalaworks Low Drag Mount $575Aimpoint 3XMagnifier with LaRue Tactical Mount $450 Package deal, $2250 Cash, Price is FIRM, Trade value HigherFace to Face in NOVA with good guy papers and sign Bill of Sale"
308,http://www.armslist.com/posts/6913308,For Sale/Trade:  Glock 27 rmr cut milled slide,"Decatur, Huntsville, Alabama",$ 450,"Listed On: Sunday, June 4, 2017",Handguns,Israel Weapon Industries                                                                                ,5.56×45mm NATO                                                                                ,Semi-automatic                                                                                ,Rifle,"i have a glock 27 with some work done to it milled slide rmr cut cerakoted grey slidehyve extension text REDACTEDtrades toward glock competition size (34,40,etc)canik competion M&p cz can add boot"
309,http://www.armslist.com/posts/6913309,For Sale/Trade:  PRICE DROP-BNIB Radical AR/ Vortex Sparc COMBO,"North, Columbus, GA, Georgia",$ 625,"Listed On: Monday, June 26, 2017",Rifles,Israel Weapon Industries                                                                                ,5.56×45mm NATO                                                                                ,Semi-automatic                                                                                ,Rifle,Brand new in box Radical Firearms AR/ Brand new Vortex Sparc/ 10 new PMags. Also has new magpul backup sights. Includes everything in the picture brand new canvas case and hard case.
311,http://www.armslist.com/posts/6913311,For Sale:  Armasight Vampire 3x night vision riflescope,"westland, Detroit, Michigan",$ 500,"Listed On: Wednesday, June 28, 2017",Optics,no type,no type,no type,no type,for sale or trade is a brand new Armasight Vampire 3x night vision riflescope this retails at 795. im looking for 500 or even trade value.
312,http://www.armslist.com/posts/6913312,For Sale/Trade:  Remington 700 .308 in HS Precision,"Valdosta-Tifton, Valdosta, Georgia","$ 1,400","Listed On: Sunday, June 4, 2017",Rifles,Remington                                                                                ,308/7.62 NATO                                                                                ,Bolt Action                                                                                ,Rifle,"Brand new Remington 700 .308 in a HS Precision stock. The rifle has a hinge floor plate, steel Leupold Mark 4 15 MOA base, Vortex Viper 4-16x44 scope. Everything on this rifle is new and has never been fired once. The barrel is a stainless fluted and threaded 26"" heavy contour.  I will sell the rifle witbout the scope for $1000. i will accept trades."
313,http://www.armslist.com/posts/6913313,For Sale:  1911 9mm Hand Fit,"prescott valley, Prescott Valley, Arizona","$ 2,600","Listed On: Thursday, August 24, 2017",Handguns,Remington                                                                                ,9mm Luger (9x19)                                                                                ,Single Action                                                                                ,Pistol,Here is a Hand Fit 1911 9mm built with Fusion Firearms parts. Sights are rear adjustable bomar night sights comes with three mags.
315,http://www.armslist.com/posts/6913315,For Sale:  5.56 green tip,"Portsmouth, Hampton Roads, Virginia",$ 40,"Listed On: Saturday, June 10, 2017",Ammo,no type,no type,no type,no type,100 rounds of 5.56 green tip ammo.
316,http://www.armslist.com/posts/6913316,For Sale/Trade:  Sig Saur C3 .45 Auto,"Redfield, Little Rock, Arkansas",$ 875,"Listed On: Sunday, June 4, 2017",Handguns,no type,no type,no type,no type,"I have a Sig C3 1911 .45 Auto in Duotone. Has 4.25"" match barrel stainless steel, bright nite sights. Comes with case, all paper work, lock, and 3- 7 round stainless steel mags. This gun has only been shot 8 times and is very accurate. As with any gun I get, I have to shoot at least 1 mag thru it to make sure that it doesnt have any issues. This is a great handling gun, and easy to carry. However, I'm asking 875.00 for it. Or, am interested in trading for a Ruger SR1911 SS Cmdr with extra mags in .45 Auto, and a Ruger AR 5.56/.223  When I bought this C3 I paid over 1100.00 for it. If you might be interested, or have any questions, please call, text, or email me. My cell is REDACTED. Thank you."
317,http://www.armslist.com/posts/6913317,For Sale:  Mossburg 500 Tactical,"Bakersfield, Vermont, United States",$ 300,"Listed On: Sunday, June 4, 2017",Shotguns,Mossberg                                                                                ,12 Gauge                                                                                ,Pump Action                                                                                ,Shotgun,Brand new Mossburg 500 Tactical never shot. Was bought as a birthday gift but is nothing I have any use for. Asking $300.00
318,http://www.armslist.com/posts/6913318,For Sale:  S&W M&P 9c,"Augusta, Augusta, Georgia",$ 370,"Listed On: Sunday, June 4, 2017",Handguns,Smith & Wesson                                                                                ,9mm Luger (9x19)                                                                                ,Striker Fire                                                                                ,Pistol,"S&W M&P 9 compact for sale with 4 magazines. $370 obo Sale only, no trades. Must have GA CWP."
320,http://www.armslist.com/posts/6913320,For Sale:  Sig Sauer 556xi NJ Complaint,"Central, New Jersey, United States","$ 1,300","Listed On: Monday, July 24, 2017",Rifles,Sig Sauer                                                                                ,223/5.56 NATO                                                                                ,Semi-automatic                                                                                ,Rifle,"I'm selling my Sig Sauer 556xi, chambered in 556 it is NJ Complaint, all the work was done by a gun smith. I've owned this rife for about 2 and half years, I bought it new and only shot it on 3 occasions, putting about 300 rounds through it. I moved from NJ to Delaware about a year ago so I no longer have to comply with NJ gun laws so I no longer need an NJ complaint rifle. I should have sold it a year ago but never got around to listing it. I come back to NJ weekly for family and friends so I can bring with me, so you don't have to travel. The rifle is in mint condition, extremely accurate and it comes with its original box and everything that came in that box. I have always cleaned it right away after every shooting session as well. You can get conversation kits for this rifle making it a 762, 762 pistol, and AR pistol. The rifle gives you a lot of options. I will also include 2 Magpul gen 3 30 round pmags which are plugged and pinned to 15 rounds to comply with NJ law. The flash hider was replaced with a VG6 GAMA 556 muzzle device to comply with NJ law. This muzzle device eliminates recoil, and makes the gun more fun to shoot. The rifle comes with flip up sights from the factory, they're the HK style ones and they are extremely accurate and hold a zero well. It has the Swiss folding stock which has been pinned to comply with NJ law. I'm asking 1400 or best offer Note: This rifle isn't made by Sig anymore."
321,http://www.armslist.com/posts/6913321,For Sale/Trade:  Nice 1911 with extras,"Panama City, Panama City, Florida",$ 650,"Listed On: Sunday, June 4, 2017",Handguns,Remington                                                                                ,45 ACP                                                                                ,Single Action                                                                                ,Pistol,"I have an excellent condition  Remington R1 commander 1911 available for sale/trade. It will come with everything from the factory, aftermarket grips,  and a total of 6 mags. Asking $650. Nothing set in my mind for trades but I love 45's, let me know what you got."
322,http://www.armslist.com/posts/6913322,For Sale:  sig 2022,"tr, Greenville, South Carolina",$ 400,"Listed On: Tuesday, July 4, 2017",Handguns,Remington                                                                                ,40 cal,Single Action                                                                                ,Pistol,Sig 2022  in great condition in box with 2 mags has upgraded stainless steel guide rod and original $400. REDACTED
323,http://www.armslist.com/posts/6913323,For Sale/Trade:  1994 grand prix,"somerset, Eau Claire, Wisconsin",$ 375,"Listed On: Sunday, June 4, 2017",Vehicles,Remington                                                                                ,40 cal,Single Action                                                                                ,Pistol,"i have an old rusty grand prix id like to trade for a firearm. it has alot of miles and its missing 4 gear but it runs and drives fine.  i drove it 25 miles each way to work.  if you do alot of city driving or have minimal freeway time this car would work great.  My sister recently invested 1100 into it getting new heads and gaskets installed not knowing the tranny was messed up.  so id hate to junk it.Its been sitting for 6 months and it has its cosmetic issues but it should last a couple winters.  Good tires, drive it home. bring a battery.trade for 3-400 dollar gun"
324,http://www.armslist.com/posts/6913324,For Sale/Trade:  Ruger .45LC,"Fincastle, Roanoke, Virginia",$ 425,"Listed On: Thursday, July 13, 2017",Handguns,Ruger                                                                                ,45 Long Colt                                                                                ,Single Action                                                                                ,Revolver,"Ruger New Model Blackhawk in .45 long Colt with 7.5"" barrel in excellent condition. Has everything that came with it from the factory."
325,http://www.armslist.com/posts/6913325,For Sale:  M&P15 tactical ar15,"Metro east, St. Louis, Missouri",$ 950,"Listed On: Sunday, June 4, 2017",Rifles,Smith & Wesson                                                                                ,5.56×45mm NATO                                                                                ,Semi-automatic                                                                                ,Rifle,"Looking to trade or sell an Smith and Wesson m&p15 tactical. This is the earlier, more expensive version with the chrome lined barrel, Midwest industries modular rail, magpul furniture etc. This is more comparable to the performance center guns now.  Gun is in excellent condition with a very low round count. Open to trades for quality firearms only. Can add cash for the right gun or guns. Text or call prefered.618 6o6 0nine52"
326,http://www.armslist.com/posts/6913326,For Sale:  Remington 870 express magnum,"Akron, Akron, Ohio",$ 180,"Listed On: Sunday, June 4, 2017",Shotguns,Remington                                                                                ,12 Gauge                                                                                ,Pump Action                                                                                ,Shotgun,870 express magnum slug gun smooth bore call or text REDACTED. Price is firm
