,url,title,location,price,post date,category,manufacturer,caliber,action,firearm type,postcontent
287,http://www.armslist.com/posts/2982287,"For Sale:  .380 auto reloading bundle, factory ammo + RCBS carbide dies, JHP bullets","Keene, New Hampshire, United States",$ 300,"Listed On: Wednesday, April 23, 2014",Ammo,no type,no type,no type,no type,"Moving out of state, no longer own the ppk all this was stored for. 2 ammo cans full of .380 auto (aka 9mm Kurtz, or short) reloading components, some factory ammo, a few primers. See pictures. Included: 2 ammo cans, 200 factory JHP rounds, 150 Win Silvertips and 50 Federal Hydra Shocks. 900 rounds of brass, half of it primed already, ready to load. Most of all the brass comes in 100 round plastic ammo containers. Almost full box of 90gr Remington Golden Sabre hollow point bullets, box was 1000 so at least 950+ remain. Another 200+ Remington JHP 90gr bullets and one box of 100 Hornandy 88gr JHP bullets. Close to 1300 hollow point bullets total. Also one set of RCBS Carbide .380 auto reloading dies, with shell holder. All is super clean, most brass is new.
call or text Steven at REDACTED"
288,http://www.armslist.com/posts/2982288,For Sale:  stevens 30/520 pump shotgun 150.00,"tolono, Champaign / Urbana, Illinois",$ 150,"Listed On: Wednesday, April 23, 2014",Shotguns,Savage Arms                                                                                ,12 Gauge                                                                                ,Pump Action                                                                                ,Shotgun,I have for sale a stevens model 30/520 double hump pump shotgun not much finish left but mechanicaly great shape nice old shotgun 150.00
289,http://www.armslist.com/posts/2982289,For Sale:  Remington 870 Express Magnum,"Clark County, Indiana, United States",$ 450,"Listed On: Wednesday, April 23, 2014",Shotguns,Remington                                                                                ,12 Gauge                                                                                ,Pump Action                                                                                ,Shotgun,"Early 2000's model 870 Express Magnum with a 20"" improved cylinder deer barrel with rifle sights.  Round count through this gun is in the single digits.  It was bought for home defense and hasn't seen hardly any use.

Also includes original 26"" ventilated rib barrel with modified choke."
293,http://www.armslist.com/posts/2982293,For Sale:  XD9 Subcompact Bi-Tone 9mm.,"Stroudsburg, Pennsylvania, United States",$ 450,"Listed On: Wednesday, April 23, 2014",Handguns,Springfield                                                                                ,9mm Luger (9x19)                                                                                ,Striker Fire                                                                                ,Pistol,"Nice conceal carry piece.  Very clean & well taken care of.  Comes with all the original gear including Hard Case, 13, 16, & Pro Mag 33 Round Mags, XD Holster, Double Mag Pouch, Lock and Speed Loader, plus all original paperwork. $450 neg.  Stroudsburg. 

FTF meet only no shipping.  Willing to travel about an hour from Stroudsburg, Pa."
294,http://www.armslist.com/posts/2982294,For Sale:  Crimson Trace Laser Grip for Glock,"Reno, Reno, Nevada",$ 150,"Listed On: Thursday, May 1, 2014",Tactical,no type,no type,no type,no type,"Crimson trace laser grip for Glock, asking 150 Obo, item retails at 199 plus tax,  comes with everything included in the original packaging.  Call or txt me at REDACTED"
295,http://www.armslist.com/posts/2982295,"For Sale:  AR15 Pistol - Rainier Arms 10.5"", VLTOR, Troy, BCM, Arm Brace + More - $900","Vancouver, Southwest Washington, Washington",$ 900,"Listed On: Thursday, May 8, 2014",Rifles,no type,223/5.56 NATO                                                                                ,no type,Rifle,"Hey all!

So i'm putting up my recent build for sale simply because bills and other projects. I've put roughly 150 rounds through it, 40 rounds today, Armscore 55gr, shot great.

Spec's:
Anderson Gen 2 (Integrated trigger guard) Lower receiver
Blackhawk LPK + Ergo slim grip
VLTOR MUR Upper with Forward assist (slight bend near front magazine well - see photos - functions fine, see below)
Troy Ambidextrous charging handle
Rainier Arms Select Series Stainless Steel in Black Oxide 10.5"" Barrel, 5.56 1/8 Twist (see here https://www.rainierarms.com/?page=shop/detail&product_id=3427)
Voodoo Industries gas tube
BCM Gas block
Troy Medieval flash hider
Fortis Shorty AFG (Amazing)
UTG 11.5"" Freefloat handguard
A1 Buffer tube with A2 adapter (Wrapped with 550 cord so stock cannot be put on) Carbine spring + Buffer
Mil-Spec BCG

Just recently installed a SigTac Stabilizing Brace (Arm Brace)

This thing is sweet. In general 10.5"" barrels are tricky to find, and this is a very nice barrel to boot. Overall build is great, I picked up the stripped upper receiver from a gentleman who took it to someone to get the barrel removed, and they bent it slightly near the front end of the magazine well. Pistol functions fine, as the tracks the BCG sits on are unaffected.

I'm looking to get $900, comparing it to other ar pistol prices i've seen, also considering what this has in the build this is a reasonable price.

Very little kick, awesome to shoot. Wish I could keep and not in a hurry to sell, but would prefer to have cash to work on other projects.

Call / Text / Email
Cole
REDACTED

Thanks!"
296,http://www.armslist.com/posts/2982296,For Sale/Trade:  Taurus PT 24/7 G2 .45 ACP +extras,"west/ speedway, Indianapolis, Indiana",$ 450,"Listed On: Wednesday, April 23, 2014",Handguns,Taurus                                                                                ,45 ACP                                                                                ,Double / Single Action                                                                                ,Pistol,"Looking to sell or trade my Taurus. Great gun however being a smaller guy I want to find something not so large and hard to conceal. Has had less then 75 rounds through it. Militarily maintained. I have original case for it. The extras are two full magazine's, 2 open carry holsters (one has extra mag holder other is just for weapon), one right handed inside pant/ waist holster, speedloader, extra mag belt clip, drop-leg (tactical) holster, and lazer (not on it just included).  Will only sell/ trade to those of legal age ID is absolute must will.
only meet at local firearms store and LTCH is preferred just not required. 
Contact Tim @:    REDACTED or REDACTED"
297,http://www.armslist.com/posts/2982297,For Trade:  mini 14 +,"cleveland, Chattanooga, Tennessee",Offer,"Listed On: Wednesday, April 23, 2014",Rifles,Ruger                                                                                ,223/5.56 NATO                                                                                ,Semi-automatic                                                                                ,Rifle,ruger mini 14 new unfired with 6 mags. 4 30 rnd mags and 1 20 rnd. and 1 10 rnd.  and custom ruger 10/22 with black hawk stock. shaw heavy barrel. BSA  red dot sight.  bi pod. and it is a 582 mini
299,http://www.armslist.com/posts/2982299,For Sale:  browning A bolt medallion II NIB 30-06 with 26inch barrel,"East Helena, Helena, Montana",$ 700,"Listed On: Wednesday, April 23, 2014",Rifles,Browning                                                                                ,30-06 Springfield                                                                                ,Bolt Action                                                                                ,Rifle,I have a NIB browning a bolt medallion II in a 30-06 with the 26 inch barrel. I have to many 30-06s so this one has to go. Bought it brand new and paid $800 for it. First $700 gets it. Text or call  me 7am to 10pm thanks Travis 202-37eight4
300,http://www.armslist.com/posts/2982300,For Sale:  Hi Stanadard R107,"surrouding area, Charlotte, North Carolina",$ 350,"Listed On: Thursday, May 1, 2014",Handguns,High Standard                                                                                ,22 Long Rifle                                                                                ,Double / Single Action                                                                                ,Revolver,"4in barrel , 9 shot recessed cylinder, all pined steel and alum contsruction, weights around 1.5lbs loaded with 9 22lg,modeled on a j-fram size butt,nickel is in great shape ( a couple spots ) the revolver is nice. all laws apply(this an excellant trainer gun for new shooter)"
301,http://www.armslist.com/posts/2982301,For Sale/Trade:  Archangel Nomad Ruger 10/22 MAKE A OFFER,"Lakewood, Seattle, Washington",$ 0,"Listed On: Wednesday, April 23, 2014",Rifles,Ruger                                                                                ,22 Long Rifle                                                                                ,no type,Rifle,"Ruger 10/22 with ProMag Archangel Nomad Ruger 10/22 Folding Stock Conversion Kit
 Stock is LNIB, 10/22 has been used but over all In good shape
 comes with 1 magazine and NcStar Dual Illumination Multi Reticle Sight Red and Green Illumination 
 Make a reasonable offer or Trade"
302,http://www.armslist.com/posts/2982302,For Sale/Trade:  Converted Saiga 12,"east of tulsa, Tulsa, Oklahoma","$ 1,200","Listed On: Wednesday, April 23, 2014",Shotguns,Saiga                                                                                ,12 Gauge                                                                                ,Semi-automatic                                                                                ,Shotgun,"Converted Saiga 12. Quadrail buttstock new. Have 5,10 & 20 mags/drum. Will be keeping the surefire light unless you want to deal for it. Fun gun to shoot. I do appreciate all offers but I will not budge off the price. This gun was proffesionally converted and ported.I don't need to get rid of this gun I love this gun and don't mind keeping it. I'm just giving someone the opportunity to own this and I will go get another unique gun. I will entertain all offers but I will give an idea of what I'm looking for. More than likely I will be selling your trade to go get what I'm after."
303,http://www.armslist.com/posts/2982303,For Sale:  Colt 1911 .45 ACP -- 1961 Great Condition + Ammo,"Downtown, Palm Beach, South Florida",$ 950,"Listed On: Wednesday, April 23, 2014",Handguns,Colt                                                                                ,45 ACP                                                                                ,Single Action                                                                                ,Pistol,"1961 Colt 1911.  Comes with original grips, wood grips, and Pearlite grips that I purchased separately.  Just as in the picture.   Original magazine and one extra after market magazine.

Comes with 50 round box of target ammo.

Text me REDACTED - Will also consider trades.  And I'm very responsive."
304,http://www.armslist.com/posts/2982304,For Sale:  WTS GLOCK 26,"Ft.Worth, Dallas, Texas",$ 650,"Listed On: Wednesday, April 23, 2014",Handguns,Glock                                                                                ,9mm Luger (9x19)                                                                                ,Striker Fire                                                                                ,Pistol,"I have a gen 3 glock 26 with around $750 invested. Night sights,polished barrel,ghost trigger,springs,pins,plunger,striker,stainless guide rod and spring,extended slide release,extended takedown lever. I'm sure im forgetting something. Comes with the orginal box,2 mags and I'm the original owner. Ft.Worth. Asking $650obo"
305,http://www.armslist.com/posts/2982305,For Sale:  MP5 9mm Build Parts- Complete ready to build,"NW, Tucson, Arizona","$ 1,500","Listed On: Wednesday, April 23, 2014",Gun,no type,no type,no type,no type,"Don't have the time to finish building this and could use the money. Includes all parts to complete with the exception of the mag catch and mag paddle. All high quality US and German parts.

Special Weapons SP89 Receiver- Actually an MP5 but they stamp it SP89 for pistol reasons, can be built either way.
RCM Threaded 3-Lug Navy Barrel-9mm
HK German Trunnion
HK German Cocking tube, Support, and end cap
US Made cocking tube hanger, handle, pin
HK German Barrel Pin
RCM Billet Front Sight
HK German Push Pins
US Recoil Rod
US mag pad bushing pin, magazine catch spring, push button with pin
HK German rear sight
Choate Pistol End cap
Tri-rail Handguard
MKE semi bolt carrier
HK German SEF Trigger pack

Receiver has been double in jig and fitted for end cap/stock and lower. Receiver, cocking tube support, and trunnion have all been sandblasted and prepped for welding. Barrel is pressed into trunniion and bolt gap is perfect. Bolt slides smoothly through receiver. I spent almost a year tracking down all the pieces and making sure that I got the best parts that I could find. If you were to do this yourself you would have countless hours finding and fitting everything.

I have close to $1750 into all of the parts. Would like to get $1500. Less than $100 in parts is needed to finish this besides some labor. Perfect for the garage builder. Not willing to separate.

Message me with any questions."
306,http://www.armslist.com/posts/2982306,For Sale:  9mm ammo,"Yorba Linda, Orange County, California",$ 200,"Listed On: Wednesday, April 23, 2014",Ammo,no type,no type,no type,no type,I have 500 rounds of new in the box Winchester 9mm luger 115 gr. JHP for sale. You pick up. Cash only
307,http://www.armslist.com/posts/2982307,For Sale:  World War 2 Japanese Weapons,"southeast Fresno, Fresno, California",$ 475,"Listed On: Wednesday, April 23, 2014",Antique,no type,no type,no type,no type,"Japanese Type 38 rifle in 6.5x50 Arisaka with chrysanthemum and bolt cover intact. Nice cartouche on stock. Very good condition.
Japanese Type 30 bayonet (15.25 inches) with scabbard. Good condition.
Japanese Type 14 Nambu pistol. Poor condition- pitting, rough bore, a few parts missing.
Face-to-face transaction in Fresno/Clovis area preferred. No insulting lowball offers or suspicious requests to ship out of my local area will be considered or responded to."
308,http://www.armslist.com/posts/2982308,Want To Buy:  Want To Buy: $*$*$ FACTORY ORIGINAL 10RD GLOCK MAGAZINES *$*$*$,"South Lamar, Austin, Texas",$ 15,"Listed On: Saturday, January 3, 2015",Ammo,no type,no type,no type,no type,"This admnistration has been trying to ram the U.N. Small Arms treaty on the american people, already banned Saiga firearms from importation, blocked thousands of Iconic M1 rifles from importation to the U.S. and now trying to ban M855 ammo in another misinformation and propaganda campaign. Stock up now and sign these internet petitions - Copy and paste these links to your browser ( http://www.nagr.org/UNgunban_RP.aspx?pid=10a and http://nagr.org/ObamaUNgunban.aspx?pid=web1 )


CALL TOM REDACTED AND WE WILL MEET NEAR THE PLUCKERS ON SOUTH LAMAR NEXT TO THE WELLS FARGO

I’M ALSO INTERESTED IN GLOCK LONE WORF BARRELS, RAIL ACCESSORIES, RAIL MOUNT  BAYONET / BLADE AND BACKSTRAPS

Looking to buy used 10rd Glock factory magazines for Glock 17, Glock 19, Glock 21 and Glock 36. Not too interested in 10mm, but let me know what you got, I'll make an offer. I'm interested in Gen3 and Gen4 mags. Local Gun shops pay about $6 for used 10rd mags, lets help each other out.

- I’M ONLY BUYING USED MAGS. IF YOU WANT THE SAME PRICE THAT  NEW MAGAZINES SELL FOR, THEN I’LL JUST BUY NEW ONES

Gen4 G17 “full size” & G19 “compact” 9mm mags:
- $20 for Gen4 mags in good condition
- $15 for working mags with normal wear and tear
- $10 if they work, but are chewed up

Gen3 G17 “full size” & G19 “compact” 9mm mags:
- $15 for Gen3 magazines in good condition (I know there old so I expect some cosmetic scuffs)
- $10 for working mags more than normal wear and tear 
- $5 if they are chewed up, maybe I can use for parts, I'll buy them if your selling other mags

Glock .40 S&W and .357 Sig Full size and compact mags:
- $15 for in good condition
- $10 for working mags more than normal wear and tear 
- $5 if they are chewed up, maybe I can use for parts, I'll buy them if your selling other mags

G21 “full size” and ""sub Compact"" .45 cal mags:
- $20 for Gen4 mags in good condition
- $15 for working mags with normal wear and tear
- $10 if they work, but are chewed up

- NOT interested in ""Sub Compact"" (Except G36 mags) magazines or NON Glock Factory mags


Keywords: 9mm, 9 mm, 9MM, 9 MM, luger, 9x19, 9 x 19, 10mm 10 MM, .40 Cal, 40 cal, 40 S&W, .40 S&W, .357 sig, 357 sig, 357sig, .357sig, .45 auto, 45 cal, .45 ACP, 10rd, 10 rd, 10 round, magazine, magazines, mag, clip, G17, G 17, Glock 17, factory, OEM, Austria, polymer, Gen3, Gen4, Gen 3, Gen 4, Gen-3, Gen-4"
309,http://www.armslist.com/posts/2982309,For Trade:  ruger blackhawk 357,"caledonia, Racine, Wisconsin",Offer,"Listed On: Wednesday, April 23, 2014",Handguns,Ruger,no type,no type,no type,I have a ruger blackhawk bisley 357 7.5 inch barrel with uncle mikes camp holster I'm looking at trading. NOT SELLING TRADING ONLY. Low ball trade offers will be ignored.
310,http://www.armslist.com/posts/2982310,For Sale/Trade:  Ivy bride gaming PC,"West Saint Paul, Minneapolis / St. Paul, Minnesota",$ 500,"Listed On: Wednesday, April 23, 2014",Miscellaneous,no type,no type,no type,no type,"GIGABYTE GA-H61M-USB3H
Intel Core i5-3350P Ivy Bridge 3.1GHz (3.3GHz Turbo) quad core
XFX Core Edition FX-785A-ZNL4 Radeon HD 7850 1GB 256-Bit GDDR5 PCI Express 3.0
RAIDMAX ATX-321WB case
2x Crucial Ballistix Sport 8GB 240-Pin DDR3 SDRAM DDR3 1600 (PC3 12800)
Seagate 1tb and 2tb drives
LG Black 12X BD-ROM 16X DVD-ROM
750 watt PSU

Price is picked up, will come with windows 7 installed but no key will be entered. Can add a 480gb agility 3 SSD for $200. 

Pc was built in January, I haven't had any time to really game on it. I don't see myself having much free time in the foreseeable future."
311,http://www.armslist.com/posts/2982311,"For Sale:  AR15 DOUBLE STAR 24"" STAINLESS BULL BARREL","arcanum, Dayton, Ohio",$ 950,"Listed On: Wednesday, April 23, 2014",Rifles,Doublestar                                                                                ,223/5.56 NATO                                                                                ,Semi-automatic                                                                                ,Rifle,"Ar 15 223 5.56 24"" stainless steel heavy bull barrel....had yhm rifle length free float quad rail on an anderson lower!  Shoots awesome comes with one 30rnd mag as shown! Only looking for cash no trades  Text or call anytime REDACTED thanks"
312,http://www.armslist.com/posts/2982312,For Sale:  GLOCK 19 GEN 4 9MM & NIB-X™ COATING - NICKEL BORON,"West Des Moines, Des Moines, Iowa",$ 575,"Listed On: Friday, January 23, 2015",Handguns,Glock                                                                                ,9mm Luger (9x19)                                                                                ,Double Action                                                                                ,Pistol,"Factory New in Box

Features
4"" Barrel length
Fixed sights
21 oz. Unloaded weight, 33 oz. loaded weight
NiBx coating on barrel & slide
15 Round capacity 

The GLOCK 19 Gen4, in 9x19mm, introduces revolutionary design changes to the pistol that has found worldwide acclaim with security services both private and public. The Modular Back Strap design lets you instantly customize its grip to adapt to an individual shooter's hand size. The surface of the frame employs the new scientifically designed, real-world-tested, Gen4 rough textured technology. Internally, the new GLOCK dual recoil spring assembly substantially increases the life of the system. A reversible enlarged magazine catch, changeable in seconds, accommodates left or right-handed operators. The G19 Gen4 9x19mm retains the GLOCK accessory rail for your attachments.

The NiB-X™ coating takes the GLOCK weapons platform to the next level of performance and reliability. No-Fail, zero lubrication needed Nickel Boron coating enhances lubricity on the slide and barrel for maximum performance. The NiB-X™ coating also makes cleaning easier and is completely corrosion resistant.

Comes with:Pistol, 3 magazines, 4 backstrap modules (2 beaver-tail, 2 normal), safety information, cleaning brush, magazine loading tool, fired cases & owner's manual"
313,http://www.armslist.com/posts/2982313,For Trade:  AK47 for AK/AR PISTOL?,"Gig Harbor/ Tacoma, Seattle, Washington",Offer,"Listed On: Monday, May 19, 2014",Rifles,no type,7.62x39                                                                                ,Semi-automatic                                                                                ,Rifle,"I looking to trade my Romy AK for an AK/AR pistol or rifle. My rifle has the ATI strike force folding stock set and Original Stock with lower hand guard. Depending on what yours has will dictate what my rifle will come with. I would love to trade for a pistol with an arm brace.  please send me info and photos of your offer.
Trade only not for sale"
314,http://www.armslist.com/posts/2982314,For Sale/Trade:  Russian 5.45x39 2700rds,"Bedford, Dallas, Texas",$ 1,"Listed On: Friday, May 23, 2014",Ammo,no type,no type,no type,no type,"Russian 5.45x39 - looking for cah or trade on Glock 19 or 23 - OBO

2 x sealed cans 2160 rds $450 or $225 per 1080 can

1 x 1/2 open can 540 rd for $115


Pick up only, no shipping anywhere. Will consider full or partial trades on nice pistols, or rifles."
315,http://www.armslist.com/posts/2982315,For Sale:  Mossberg 500® 12 pump shotgun,"Dinuba, Fresno, California",$ 350,"Listed On: Wednesday, April 23, 2014",Shotguns,Mossberg                                                                                ,12 Gauge                                                                                ,Pump Action                                                                                ,Shotgun,I have a Mossberg 500 12 ga with two barrels u can covert it for long shooting range or for short shooting range... I would trade for AR-15 or M16 with cash in hands let me know what u got thanks..my phone number 559-623-379nine
316,http://www.armslist.com/posts/2982316,"For Sale:  AR15 Pistol - Rainier Arms 10.5"", VLTOR, Troy, BCM + More - $1250 OBO","Vancouver, Southwest Washington, Washington","$ 1,250","Listed On: Wednesday, April 23, 2014",Handguns,no type,223/5.56 NATO                                                                                ,no type,Pistol,"Hey all!

So i'm putting up my recent build for sale simply because bills and other projects. I've put roughly 150 rounds through it, 40 rounds today, Armscore 55gr, shot great.

Spec's:
Anderson Gen 2 (Integrated trigger guard) Lower receiver
Blackhawk LPK + Ergo slim grip
VLTOR MUR Upper with Forward assist (slight bend near front magazine well - see photos - functions fine, see below)
Troy Ambidextrous charging handle
Rainier Arms Select Series Stainless Steel in Black Oxide 10.5"" Barrel, 5.56 1/8 Twist (see here https://www.rainierarms.com/?page=shop/detail&product_id=3427)
Voodoo Industries gas tube
BCM Gas block
Troy Medieval flash hider
Fortis Shorty AFG (Amazing)
UTG 11.5"" Freefloat handguard
A1 Buffer tube with A2 adapter (Wrapped with 550 cord so stock cannot be put on) Carbine spring + Buffer
Mil-Spec BCG
Cheap red-dot (~80) with four reticles

This thing is sweet. In general 10.5"" barrels are tricky to find, and this is a very nice barrel to boot. Overall build is great, I picked up the stripped upper receiver from a gentleman who took it to someone to get the barrel removed, and they bent it slightly near the front end of the magazine well. Pistol functions fine, as the tracks the BCG sits on are unaffected.

I'm looking to get $1250, comparing it to other ar pistol prices i've seen, also considering what this has in the build.

Very little kick, awesome to shoot. Wish I could keep and not in a hurry to sell, but would prefer to have cash to work on other projects.

Call / Text / Email
Cole
(360)936-5802

Thanks!"
318,http://www.armslist.com/posts/2982318,Want To Buy:  x,"x, Jacksonville, Florida",$ 1,"Listed On: Wednesday, April 23, 2014",Rifles,no type,no type,no type,Rifle,x
319,http://www.armslist.com/posts/2982319,For Sale:  Smith & Wesson M/P 9mmC,"North Charleston, Charleston, South Carolina",$ 475,"Listed On: Tuesday, July 29, 2014",Handguns,Smith & Wesson                                                                                ,9mm Luger (9x19)                                                                                ,Double Action                                                                                ,Pistol,"I have a slightly used SW M/P 9mmC for sale. Its go about 100 rounds through it, kept in a safe when not in use. Includes gun case, two magazines.  Will trade for CAMO 11-87"
