,url,title,location,price,post date,category,manufacturer,caliber,action,firearm type,postcontent
731,http://www.armslist.com/posts/2280731,Want To Buy:  Itahca Deerslayer,"Moore, Oklahoma City, Oklahoma",$ 600,"Listed On: Wednesday, October 30, 2013",Shotguns,Ithaca                                                                                ,12 Gauge                                                                                ,Pump Action                                                                                ,Shotgun,"Hey Guys, Looking to buy a Model 37 Deerslayer. Would like it to have the 20"" deer barrel with rifle sights. Also need it to be a older one in good condition and not one of the new ones they just started making again. No Deerslayer II or III please. I have a ttached a picture of one that I am looking for. I am more than willing to do a 4473 or a bill of sale. Dig in your safes and see if you got what I'm looking for and want some cash. ΜΟΛΩΝ ΛΑΒΕ"
733,http://www.armslist.com/posts/2280733,For Sale/Trade:  GLOCK 19 GEN 3,"amelia, Cincinnati, Ohio",$ 550,"Listed On: Wednesday, October 30, 2013",Handguns,Glock                                                                                ,9mm Luger (9x19)                                                                                ,Striker Fire                                                                                ,Pistol,GLOCK 19 GEN THREE WITH HOLSTER EXTRA MAG. LIKE NEW. MAYBE 200 RDS OUT OF HER. TEXT REDACTED
734,http://www.armslist.com/posts/2280734,For Sale/Trade:  Parker Phoenix bow awsome condition,"Kzoo, Kalamazoo, Michigan",$ 500,"Listed On: Wednesday, October 30, 2013",Archery,no type,no type,no type,no type,Bow comes with apex four pin.octane stabilizer. And true flight release. Worth 500 all together. Looking for carry gun or shotguns txt REDACTED
735,http://www.armslist.com/posts/2280735,For Trade:  Decked out G21SF with TLR-2s,"Fayetteville, Fayetteville, North Carolina",Offer,"Listed On: Wednesday, October 30, 2013",Handguns,Glock                                                                                ,45 ACP                                                                                ,Striker Fire                                                                                ,Pistol,"Glock 21sf with upgraded titanium rod, trigger, springs, extended slide stop, trijicon green fiber optic night sights, tlr-2s, holster, 33 rd mag and two other mags. Looking to trade for a concealed carry pistol. Will keep the tlr if your gun is equal quality. Please text REDACTED"
737,http://www.armslist.com/posts/2280737,For Sale:  1400 rounds 22lr hollow points,"Mobile, Mobile, Alabama",$ 125,"Listed On: Wednesday, October 30, 2013",Ammo,no type,no type,no type,no type,New bucket of Remington hollow points
738,http://www.armslist.com/posts/2280738,For Sale:  2 DAY SALE! AK-47 Zastava O-PAP AK47,"Florida, Florida, United States",$ 500,"Listed On: Wednesday, October 30, 2013",Rifles,no type,7.62x39                                                                                ,no type,Rifle,"NIB Zastava O-PAP, 7.62x39, Side Scope Rail, 1 30 round steel mag, 3 30 round Tapco polymer mags slant brake, factory papers"
739,http://www.armslist.com/posts/2280739,For Sale:  Sig sauer p938,"Bremerton, Washington, United States",$ 650,"Listed On: Wednesday, October 30, 2013",Handguns,Sig Sauer                                                                                ,9mm Luger (9x19)                                                                                ,Single Action                                                                                ,Pistol,New in box never fired p938 model with night sights and rubber grips . I will throw in 100 rounds of 9mm ammo also ...$650 firm  pending sale
740,http://www.armslist.com/posts/2280740,For Sale/Trade:  Armor shield Med level 3a tactical vest CAV-TAC,"Maumee, Toledo, Ohio",$ 350,"Listed On: Wednesday, November 27, 2013",Tactical,no type,no type,no type,no type,Armor Shield model CAV-TAC level 3a tactical vest. Asking $350
741,http://www.armslist.com/posts/2280741,For Trade:  Glock 21 G21 Gen 3 trade  for Springfield 1911,"Muncie, Indiana, United States",Offer,"Listed On: Wednesday, October 30, 2013",Handguns,Springfield                                                                                ,45 ACP                                                                                ,Striker Fire                                                                                ,Pistol,"Glock 21 G21 Gen 3. 
2-13 rd mags
1-27 rd mag
Speed loader
Lock & key
Test round (Feb 2013)
Original box  & it's paper work"
747,http://www.armslist.com/posts/2280747,"For Sale:  DTi, DEL-TON AR-15 W. Mapul Accessories and AMMO. NEVER FIRED!","Munster, Gary, Indiana",$ 750,"Listed On: Wednesday, October 30, 2013",Rifles,Del-ton Inc                                                                                ,223/5.56 NATO                                                                                ,Semi-automatic                                                                                ,Rifle,"Up for sale is a new, never fired Del-Ton Ar-15 in .223/5.56 cal.  It features full dark earth mapgul accessories along with remove-able carry handle and picatanny rail.  It also includes 2 magpul 30rd magazines with American Eagle tactical .223 ammunition as well.  Comes with all manuals and locks, Serious Buyers only, CASH only, Call Andy at REDACTED, Thank you Asking 750$"
748,http://www.armslist.com/posts/2280748,Want To Buy:  Colt Lightweight Commander 9mm,"Hudson, Bloomington, Illinois",Offer,"Listed On: Wednesday, October 30, 2013",Handguns,Colt                                                                                ,9mm Luger (9x19)                                                                                ,Single Action                                                                                ,Pistol,"Looking for a Colt Lightweight Commander in 9mm, serial number should have LW in it.

I prefer it to be non modified, but it can be well used, it will be a project 9mm 1911.

If you have one or know of one for sale, please let me know.

Thanks!"
749,http://www.armslist.com/posts/2280749,For Sale:  $350,"Lebanon, Nashville, Tennessee",FREE,"Listed On: Wednesday, October 30, 2013",Handguns,no type,no type,no type,no type,357 Magnum Taurus 5 shot chrome black handle cover. Like new. $350. 615_886_0076
750,http://www.armslist.com/posts/2280750,For Sale/Trade:  Sig Sauer P938 - 2 mags - extra grips - holsters,"Spartanburg, Greenville, South Carolina",$ 650,"Listed On: Wednesday, October 30, 2013",Handguns,Sig Sauer                                                                                ,9mm Luger (9x19)                                                                                ,Single Action                                                                                ,Pistol,"For sale - Sig P938 - round count 100. No problems, feeds perfectly. One flush magazine, one extended, fresh night sights, pocket holster, paddle holster from sig. Original case and paperwork included. $650 firm

Only trades are for a FDE 9mm Glock or a very nice Glock or M&P package, 9mm only"
751,http://www.armslist.com/posts/2280751,For Sale/Trade:  WTT: FNS-9 for Unfired or Mint Condition Glock 19 or 26.,"Wichita, Wichita, Kansas",$ 575,"Listed On: Friday, November 29, 2013",Handguns,FN Herstal S.A.                                                                                ,9mm Luger (9x19)                                                                                ,Striker Fire                                                                                ,Pistol,"New in the box FNS-9, Two Tone with Night Sights.
The FNS-9 won the 2013 Golden Bullet Handgun of the year."
752,http://www.armslist.com/posts/2280752,For Sale/Trade:  Sig 1911 C3,"Anderson, Indianapolis, Indiana",$ 850,"Listed On: Wednesday, October 30, 2013",Handguns,Sig Sauer                                                                                ,45 ACP                                                                                ,Single Action                                                                                ,Pistol,Sig 1911 C3 for sale or trade. Trade value must be at least 900 or 850 cash firm in the Anderson area only. Will not travel far. Gun includes everything from factory plus 2 extra magazines and an extra set of grips.
753,http://www.armslist.com/posts/2280753,For Sale:  Taurus Millenium Pro PT-140 w/extras,"Atlantic Beach, Jacksonville, Florida",$ 400,"Listed On: Wednesday, October 30, 2013",Handguns,Taurus                                                                                ,40 S&W                                                                                ,Double Action                                                                                ,Pistol,"Like new .40cal Taurus Millennium Pro. Includes approximately 200 rounds of target ammo, extra mag, iwb holster and galco belt holster. Was girlfriends, went to the range once."
754,http://www.armslist.com/posts/2280754,For Sale:  Ruger 10/22 Takedown,"all, New Mexico, United States",$ 375,"Listed On: Monday, December 2, 2013",Rifles,Ruger                                                                                ,22 Long Rifle                                                                                ,Semi-automatic                                                                                ,Rifle,"New Ruger 10/22 takedown. 10 round mag and pack.
REDACTED Located in Las Cruces"
755,http://www.armslist.com/posts/2280755,For Sale:  High Country Lida Bow,"metro detroit, Detroit, Michigan",$ 200,"Listed On: Wednesday, October 30, 2013",Archery,no type,no type,no type,no type,"i have a High country lida bow for sale or trade. it has a true glow sight, trigger release, and lots of extra. its a 31in draw, im asking $200 or would want to trade for a crossbow and will pay cash on top. serious buyers plz. call or text REDACTED, this is a new York number i transferred it when moved to Michigan so this is not a scam."
757,http://www.armslist.com/posts/2280757,For Sale/Trade:  Helwan 9mm,"Lawson mo, Kansas City, Missouri",$ 170,"Listed On: Wednesday, October 30, 2013",Handguns,Beretta USA                                                                                ,9mm Luger (9x19)                                                                                ,Single Action                                                                                ,Pistol,"Hi I have for sale a helwan 9mm it is a copy of the berretta 1951 model.the bluing is in good shape with slight holster wear but no rust or pitting on it the black plastic grips are in great shape they are crack free,the gun is very tight with no slide to frame wobble or play in it,the bore has great rifling an looks like a chrome liner,the gun has safety and half cock,the gun shoots and functions great,gun comes with one ten round mag with pinky extension,i am asking 170 cash call or text 816-217-9591  will trade for a Jennings or Lorcin raven something like that"
758,http://www.armslist.com/posts/2280758,For Sale:  500 rds Brick 22 / .22 LR Ruag Ammotec Geco (Newly imported-Germany) made for Semi Automatics 40 Gr.,"SW, Oklahoma City, Oklahoma",$ 80,"Listed On: Sunday, November 10, 2013",Ammo,no type,no type,no type,no type,"500 rds Brick 22 / .22 LR  Ruag Ammotec Geco (Newly imported-Germany) optimized for Semi Automatics 40 Gr.

Design and optimized for use in semi-auto (self-loading) rifles and handguns, the Geco .22 LR Semi Auto is produced under exacting standards and the highest quality control. The 40 Grain lead round nose feeds properly in semi-auto rimfire handguns and rifles. Produced in Germany for precision accuracy and unbeatable quality. Why risk your day at the range to ammunition that may or may not feed into your weapon. Count on Geco .22LR Semi-Auto and know for sure your ammo will function as it should.

Bullet Type: Lead Round Nose
Bullet Weight: 40 Grain Projectile
Muzzle Velocity: 1083 fps
Qty Per Box: 500 Rounds

$80 per 500 round box.  NO EMAIL & NO TEXT. Call  REDACTED 8am-8pm"
759,http://www.armslist.com/posts/2280759,Want To Buy:  Wtb colt pocket lite 380 stainless or satin,"Marysville, Seattle, Washington",Offer,"Listed On: Friday, November 29, 2013",Handguns,Colt                                                                                ,380 ACP                                                                                ,no type,Pistol,That easy. Used to have one and want one again.
760,http://www.armslist.com/posts/2280760,For Sale:  Ar15 remington vtr R15 with nikkon scope camo possible trade,"orlando, Orlando, Florida","$ 1,250","Listed On: Wednesday, October 30, 2013",Rifles,Remington                                                                                ,223/5.56 NATO                                                                                ,Semi-automatic                                                                                ,Rifle,I have an almost new Remington Vtr R15 with Nikon buckmaster scope. Less than 300 rounds fired. Looking to trade for a keltec PSG or lower and cash
761,http://www.armslist.com/posts/2280761,For Sale:  Fiber optic adjustable sights sig 229/ springfield xd all,"Manhattan, Kansas, United States",$ 45,"Listed On: Monday, November 11, 2013",Gun,no type,no type,no type,no type,Brand new in box adjustable fiber optic sights for the sig 229 or all springfield xd models
762,http://www.armslist.com/posts/2280762,For Sale:  Colt Commander Model 1911 .45ACP Stainless,"Homestead, Miami-Dade, South Florida",$ 775,"Listed On: Tuesday, November 5, 2013",Handguns,Colt                                                                                ,45 ACP                                                                                ,Single Action                                                                                ,Pistol,"Near mint condition Colt .45 Commander, 2 magazines and original box and owners manual.

$775 firm for a quick sale."
763,http://www.armslist.com/posts/2280763,For Sale/Trade:  Smith and Wesson 357V    357SIG,"Delta, Mississippi, United States",$ 650,"Listed On: Wednesday, October 30, 2013",Handguns,Smith & Wesson                                                                                ,357 SIG                                                                                ,no type,Pistol,Very rare SW357V.  This gun comes with hard case 3 clips and factory paperwork.  This design was only made for about 2 years and then was discontinued due to copyright claims from Glock.
764,http://www.armslist.com/posts/2280764,"For Sale:  DS Arms SA58 FAL .308/7.62 NATO Rifle, with extras","South Columbus, Columbus, Ohio","$ 1,500","Listed On: Wednesday, October 30, 2013",Rifles,DS Arms                                                                                ,308/7.62 NATO                                                                                ,Semi-automatic                                                                                ,Rifle,"This is a DSA custom machined SA58 FAL rifle chambered in .308/7.62 NATO. Also called THE RIGHT ARM OF THE FREE WORLD, this rifle is an extremely top of the line and reliable piston operated rifle with a 14 setting gas regulator to tame some of the heavier loads and can be fired thousands of times without cleaning. Rifle has 18"" chrome lined barrel. Comes with S.A.W. style pistol grip,

Comes with (2) 20 round steel mags, quad rail hand guard with Magpul XT textured rail covers, aftermarket picatinny DSA flat top sight rail (which is a $90 addition on DSA's website, butt stock mag pouch, Harris brand folding & telescoping rail mounted bipods, a Knights Armaments vertical rail grip and as you can see, it has been camo painted with Duracoat firearm finish. This rifle is AWESOME. Very lightly used and has had less than 500 rounds through it. Asking price is firm as the rifle has lots of extras and brand new they run around $1700, as you can see here at DS Arms website:

http://www.dsarms.com/p-12582-fal-sa58-carbine-rifle-18-premium-bipod-cut-barrel.aspx"
765,http://www.armslist.com/posts/2280765,For Sale:  835 Ultimag (camo) with ported barrel and sling,"Greensboro, Reidsville, Eden, Madison, Greensboro, North Carolina",$ 300,"Listed On: Wednesday, October 30, 2013",Rifles,Mossberg                                                                                ,30-30 Winchester                                                                                ,Lever Action                                                                                ,Rifle,"I have a like new (shot 6 times) Mossberg Camo 835 ulti-mag with ported barrel, sling and tru-glo sights to sell. Will sell for $300. No talking me down from this price. Shotgun Like new. Worth well over $300. Only reason that I'm letting it go this cheap is to buy a rifle that I have my eye on. It has a FULL choke tube in it. Shoots Great. REDACTED  e-mail, call or text."
766,http://www.armslist.com/posts/2280766,Want To Buy:  want to buy a pistol for $100 - $300,"kansas city, Kansas City, Kansas",Offer,"Listed On: Wednesday, October 30, 2013",Handguns,no type,no type,no type,no type,I need a decent pistol for self defense im wanting it for my sister. I will pay cash or I can trade a crossbow or a compound bow. Call REDACTED
768,http://www.armslist.com/posts/2280768,For Sale:  Glock 36,"Hilliard, Columbus, Ohio",$ 525,"Listed On: Wednesday, October 30, 2013",Handguns,Glock                                                                                ,45 ACP                                                                                ,Striker Fire                                                                                ,Pistol,"have a very nice Glock 36 in excellent condition. Box, paperwork, 2-6 round mags, cleaning brush and some ammo.
$525 obo"
769,http://www.armslist.com/posts/2280769,For Sale:  Windham Arms AR-15,"Rock Hill, SC, Rock Hill, South Carolina",$ 850,"Listed On: Wednesday, October 30, 2013",Rifles,Windham Weaponry                                                                                ,223/5.56 NATO                                                                                ,Semi-automatic                                                                                ,Rifle,"Brand new in the box, never opened other than inspection. Never had a round through it. I bought it and never used it. 

Now it can be yours."
770,http://www.armslist.com/posts/2280770,For Sale:  12 ga. mossberg 500  w/24 in rifled barrel,"sellersburg, Indiana, Louisville, Kentucky",$ 275,"Listed On: Wednesday, October 30, 2013",Shotguns,Mossberg                                                                                ,12 Gauge                                                                                ,Pump Action                                                                                ,Shotgun,"Mossberg 500 pump
24 in rifled barrel
Chambered for 2 3/4. And. 3 in shells
Bushnell sportview scope
Nice sling
No rust 
Fired fewer than 20 rnds
Price is firm
Great gun bought for son who has lost interest in hunting"
771,http://www.armslist.com/posts/2280771,For Sale/Trade:  7mm Remington Mag Ammunition,"Augusta, Wichita, Kansas",$ 20,"Listed On: Wednesday, January 22, 2014",Ammo,no type,no type,no type,no type,"I have 73 rounds of factory loaded 7mm remington mag ammunition for sale
the price is $70 for all of it
That is cheaper than walmart
Local FTF only
call .3.1.6.-.6.5.1.-.7.2.3.6."
772,http://www.armslist.com/posts/2280772,"For Sale:  5.56 nato /.223 rem 16"" complete upper receiver ar15 magpul FREE GRIP BI-POD SYSTEM","south las vegas, Las Vegas, Nevada",$ 325,"Listed On: Friday, November 15, 2013",Gun,no type,no type,no type,no type,"I have a 5.56 upper fully assembled 16"" chrome lined 1-9 twist(ARD)ard barrel with mid lenght magpul handguard gas block and gas tube. Also comes with moe rail section attached to grip bipod system. Fully assembled receiver. Does not come with bolt carrier group or charging handle.  Sev oh two 439 nine two zero three. Txt preffered."
773,http://www.armslist.com/posts/2280773,For Sale:  Bucket .22LR Remington,"Burlington, Greensboro, North Carolina",$ 135,"Listed On: Wednesday, October 30, 2013",Ammo,no type,no type,no type,no type,I have one bucket of .22LR by Remington.
776,http://www.armslist.com/posts/2280776,For Sale:  Taurus PT 22 rosewood,"Cedar Park, Austin, Texas",$ 200,"Listed On: Wednesday, October 30, 2013",Handguns,Taurus                                                                                ,22 Long Rifle                                                                                ,Double Action                                                                                ,Pistol,Selling my Rosewood handled Taurus PT22. Bought this for the wife to learn to shoot and couldn't believe she preferred my .40 caliber S&W. So I don't need another safe queen. The pistol has about 100 rounds through it with no problems. The trick to these little pistols is to keep them clean and oiled. I'm looking for $200 cash.  Must have valid Texas ID/CHL and willing to meet locally..
777,http://www.armslist.com/posts/2280777,Want To Buy:  WTB - USED Rossi Ranch Hand  (not new),"Austin metro, Austin, Texas",$ 1,"Listed On: Thursday, November 28, 2013",Handguns,Rossi-Braztech                                                                                ,38 Super                                                                                ,Double / Single Action                                                                                ,Pistol,"Looking for a Used Rossi Ranch Hand. Any Caliber. 

Outright purchase or trade for Longbow/Recurve or High Dollar Damascus Knives. Or .380 Semi Auto. Or whatever."
778,http://www.armslist.com/posts/2280778,For Sale:  Beretta Px4 Storm Compact 9mm,"Las Vegas, Las Vegas, Nevada",$ 400,"Listed On: Wednesday, October 30, 2013",Handguns,Beretta USA                                                                                ,9mm Luger (9x19)                                                                                ,Double / Single Action                                                                                ,Pistol,"Never fired PX4 storm Compact.   Comes with case, 2 15 rnd magazines.  Excellent condition.


Jason REDACTED"
779,http://www.armslist.com/posts/2280779,For Sale:  masterpiece arms mac 10,"east troy, Milwaukee, Wisconsin",$ 500,"Listed On: Wednesday, November 13, 2013",Handguns,MasterPiece Arms                                                                                ,45 ACP                                                                                ,Double Action                                                                                ,Pistol,This gun is brand new never been fired. Its about  a month old. Its a pretty heavy firearm it also is a .45acp I will give ammo with purchase for a little extra. It has a 30 round mag and comes with a hard case. I bought it for $480. I may take trades for other smaller handguns or other things depending on what they are. Shoot me a text with offers  REDACTED.
781,http://www.armslist.com/posts/2280781,For Sale:  RRA,"simpson, Greenville, North Carolina","$ 1,200","Listed On: Wednesday, October 30, 2013",Rifles,Rock River Arms                                                                                ,223/5.56 NATO                                                                                ,Semi-automatic                                                                                ,Rifle,"Rock River Arms ar15, 223-55.6 rifle comes with carry handle and flip up sights also 5,30 round mags and 270 rounds of ammo. Call or text for more info REDACTED no trades please."
783,http://www.armslist.com/posts/2280783,Want To Buy:  H&R handi rifle in .44 mag,"Kokomo, Indiana, United States",Offer,"Listed On: Wednesday, October 30, 2013",Rifles,H&R                                                                                ,44 Magnum                                                                                ,Break Open                                                                                ,Rifle,"Looking for a .44 mag in good shape and decent price. In kokomo but can travel for right deal. Contact by email, or text/leave voicemail at REDACTED"
784,http://www.armslist.com/posts/2280784,Want To Buy:  looking to buy a hi point .40 pistol,"somerset, Lexington, Kentucky","$ 100,000","Listed On: Wednesday, October 30, 2013",Handguns,Hi Point                                                                                ,40 S&W                                                                                ,Striker Fire                                                                                ,Pistol,"just as the ad says , ive got cash let me know what you have , thanks"
