,url,title,location,price,post date,category,manufacturer,caliber,action,firearm type,postcontent
0,http://www.armslist.com/posts/2982000,For Sale:  Core 15 Tactical,"Boca Raton, South West Florida, Florida","$ 1,565","Listed On: Wednesday, April 23, 2014",Rifles,no type,no type,no type,Rifle,"For sale is a Core 15 Tactical
- rifle has FDE Midwest Industries SS Gen 2 floating rail installed professionally -$375
- rifle has all matching Magpul FDE furniture -$95
- rifle comes with 820 Rounds of brass cases premium 5.56 ammo- $492
- rifle comes with 3 30 round PMag magazines (loaded with 5.56) and 1 '40 round PMag magazine(loaded with 5.56)  and 1 FDE PMag magazine $40 
- Rifle comes with Bushnell Trs-25 Red Dot- $100

* Core 15 offered a unlimited lifetime warranty on their rifles regardless or rounds, owners or conditions
* Rifle comes with a tactical rifle bag -$45

I am not in need of $ price is more than fair and is Firm

Required to be a FL resident with valid ID legal to own a firearm"
1,http://www.armslist.com/posts/2982001,For Sale/Trade:  NC star 6-24X50,"Midwest city, Oklahoma City, Oklahoma",$ 80,"Listed On: Monday, July 7, 2014",Optics,no type,no type,no type,no type,"NC Star 6-24X50 AOE lighted reticle

REDACTED"
3,http://www.armslist.com/posts/2982003,For Sale/Trade:  DPMS Oracle AR-15 with lots of Magpul gear,"North Arlington, Dallas, Texas",$ 950,"Listed On: Wednesday, April 23, 2014",Rifles,DPMS                                                                                ,223/5.56 NATO                                                                                ,Semi-automatic                                                                                ,Rifle,"I have only put 150 rounds through this rifle. Comes with 5 Magpul 30rd mags, soft case, and around 200rds of ammo. Check out the pics, any questions feel free to ask. 

Also have a TLR-4 I can throw in for an extra $100
http://www.armslist.com/posts/2875590/dallas-texas-optics-for-sale--streamlight-tlr-4-rail-mount-led-flashlight-w--laser

May be open to some trades. S&W M&P, Sigs, 9mm or .45 + cash difference."
4,http://www.armslist.com/posts/2982004,For Sale:  Smith&Wesson M&P 15-22 w/acc.,"Hudsonville, Grand Rapids, Michigan",$ 410,"Listed On: Wednesday, April 30, 2014",Rifles,Smith & Wesson                                                                                ,22 Long Rifle                                                                                ,Semi-automatic                                                                                ,Rifle,"I have a smith and wesson m&p15-22 I am looking to sell. I don't really use it anymore, shoots like a dream. I have a barska contour illuminated mildot scope, foregrip, flashlight, and its got rail covers on it. Has the adjustable stock, comes with the original iron sights. Has the muzzlebreak. Has 1 25 round magazine. Like new condition, barrel has tiny rust spots.. must have collected moisture.. but its very minimal. I have some rust removal to throw in that i havent gotten around to doing. Asking 410 OBO. Thanks"
5,http://www.armslist.com/posts/2982005,For Sale:  Colt Railgun w/ Threaded Barrel (.22lr),"Evansville, Evansville, Indiana",$ 400,"Listed On: Wednesday, April 23, 2014",Handguns,Colt                                                                                ,22 Long Rifle                                                                                ,Single Action                                                                                ,Pistol,"NIB never fired Colt Railgun semi-auto pistol. It is the threaded barrel version, so you could attach a suppressor. It is a .22lr. I got it for my son but he doesn't want it. It feels exactly like a .45 cal 1911, but is much cheaper to shoot. Must sign bill of sale. 1REDACTED. Willing to ship for $25. $400 obo. Comes with original box, gun, a 10 round magazine, and all the papers."
6,http://www.armslist.com/posts/2982006,For Sale/Trade:  nightforce c464,"near castle hills, San Antonio, Texas","$ 1,550","Listed On: Monday, May 12, 2014",Optics,no type,no type,no type,no type,"never used scope with rings looking to sell or trade
scope is nightforce c464
rings are Werne Ultra High matte finish 30mm
open to negotiation or trade
on ebay right now this scope is going for over 1500 without the rings that cost me 140....."
7,http://www.armslist.com/posts/2982007,For Trade:  kahr cw9,"Decatur hartselle, Huntsville, Alabama",Offer,"Listed On: Wednesday, April 23, 2014",Handguns,Kahr                                                                                ,9mm Luger (9x19)                                                                                ,Striker Fire                                                                                ,Pistol,"Kahr cw9 like new condition in box with 2 mags, will trade for a 44 mag, or fnx 45, will pay boot your way text me your number and pictures. And I will send you pictures"
8,http://www.armslist.com/posts/2982008,For Sale:   40 S&W Ammo 165 grain,"Tulsa, Tulsa, Oklahoma",FREE,"Listed On: Friday, May 16, 2014",Ammo,no type,no type,no type,no type,"I have 170 rds. of 40 S&W for $15 a box they are 3 boxes with 50 rounds , 1 box of 25 hydra shock, send e-mail Thanks for looking."
9,http://www.armslist.com/posts/2982009,For Sale/Trade:  Taurus PT100,"North Mobile, Mobile, Alabama",$ 480,"Listed On: Wednesday, April 23, 2014",Handguns,Taurus                                                                                ,40 S&W                                                                                ,Double / Single Action                                                                                ,Pistol,Taurus PT100 Nickel Plated with original box and two mags. Interested in cash or trades.  Pictures on request
10,http://www.armslist.com/posts/2982010,For Sale:  Im looking to TRADE or SELL 3 guns  (all are .22 LR),"Royal Oak, Detroit, Michigan",$ 1,"Listed On: Monday, May 12, 2014",Handguns,no type,22 Long Rifle                                                                                ,Single Action                                                                                ,Pistol,"Im looking to TRADE or SELL 3 guns. ---- OBO

22 LONG RIFLE - PISTOLS

***I take Extremely good care of my guns,  i bought these brand new, still have everything that came with them***

1  Smith and Wesson .22A - LR -$230
2  Browning BuckMark Bullseye Target URX SE MS .22 LR (9 3/4"" BARREL)- $440
3  Ruger MK III Target .22LR (5 1/2"" barrel)  - $320
___________________  O.B.O  ______________________
All these guns are like NEW and barely been shot - Not a Scratch on them ﻿

TRADES: (WILLING TO TRADE ALL 3 for a 1911)  
- SIG SAUER - 1911 Stainless 
- Springfield Armory
- Kimber"
11,http://www.armslist.com/posts/2982011,For Sale:  KIMBER TLE/RL II Stainless Steel,"jerry.e.baker2.civ@mail.mil, Birmingham, Alabama","$ 1,500","Listed On: Sunday, May 18, 2014",Rifles,Kimber                                                                                ,45 ACP                                                                                ,Semi-automatic                                                                                ,Rifle,"This is a like new Kimber Stainless Steel TLE/RL II pistol. Stainless TLE/RL II. A stainless steel version of the duty pistol carried by LAPD® SWAT, plus the integral Kimber Tactical Rail™. Specifications Caliber: .45 ACP Height (inches) 90° to barrel: 5.25 Weight (ounces) with empty magazine: 39 Length (inches): 8.7 Magazine capacity: 7 Recoil spring (pounds): 16.0 Full-length guide rod Frame Material: Stainless steel Finish: Satin silver Width (inches): 1.28 Front strap checkering 1913 Picatinny Rail Slide Material: Stainless steel Finish: Satin silver Front serrations Barrel Length (inches): 5 Material: Steel, match grade Stainless steel match grade bushing Twist rate (left hand): 16 Sights Meprolight Tritium 3-dot night sight, fixed Radius (inches): 6.8 Grips Black synthetic Double diamond Trigger Aluminum, match grade Factory setting (approximate pounds): 4.0 - 5.0 Also included in this sale is a new Streamlight TLR 2 HL light. The TLR-2 HL with red laser provides a 630 lumen blast of light for maximum illumination while clearing a room or searching an alley. Its wide beam pattern lights up large areas so you can identify who or what is nearby. C4® LED technology, impervious to shock with a 50,000 hour lifetime; 640-660nm red laser 12,000 candela peak beam intensity and up to 630 lumens. TIR optic produces a concentrated beam with optimum peripheral illumination Run Time: 1.25 hours regulated run time. Solid-state current regulation for consistent illumination level; Laser only function runs 45 hours Powered by two 3-volt CR123 lithium batteries with 10-year storage life Rail grip clamp system securely attaches/detaches quickly and safely with no tools and without putting your hands in front of muzzle Mounts directly to handguns with Glock-style rails and to all MIL-STD-1913 (Picatinny) rails. Includes keys for Glock-style, Picatinny, Beretta 90two, S&W 99 and S&W TSW Machined aluminum sealed construction with black anodized finish Ambidextrous momentary/steady on/off switch User programmable strobe can be enabled/disabled Fits existing light bearing holsters 3.39” (8.61 cm); 4.78 oz (135.5 grams) with batteries Operating temperature: -40°F to +120°F. IPX4 water-resistant Lithium Battery Notice under TECH DOCS Remote switches are available as optional accessories and must be used in conjunction with 69130 remote door switch. All switches and door switch are sold separately. Reference TLR Accessories Brochure in DOCS/INFO tab for more information. Limited lifetime warranty Assembled in USA This gun is immaculate and the light is brand new. Included also are three Kimber magazines. If out of state must be shipped to a FFL."
12,http://www.armslist.com/posts/2982012,For Sale:  Ruger 22/45,"Lenexa, Kansas City, Kansas",$ 350,"Listed On: Wednesday, April 30, 2014",Handguns,Ruger                                                                                ,22 Long Rifle                                                                                ,Single Action                                                                                ,Pistol,"Ruger 22/45 with box, 2 mags. Threaded barrel, with OD green lower. The grips on it were custom ordered so the lower does not have the 1911 grip mod. The grips are rubbery like hogues. $350"
13,http://www.armslist.com/posts/2982013,For Sale:  Drago Quick Draw Tactical Vest,"Stroudsburg, Pennsylvania, United States",$ 45,"Listed On: Wednesday, April 23, 2014",Tactical,no type,no type,no type,no type,"Cross-draw holster, 3 large, 4 pistol and 1 utility pouch.  M-XL Adjustable sides and belt.  CTD has it for $44+16 shipping.  Asking $45 shipped to you or $40 FTF meet in Stroudsburg area."
14,http://www.armslist.com/posts/2982014,For Sale:  30 rd Center Industries mags.,"Hattiesburg, Hattiesburg, Mississippi",$ 12,"Listed On: Wednesday, April 23, 2014",Magazines,no type,no type,no type,no type,"Brand new, out of the packaging.  Never loaded or inserted into a weapon.  Tan followers.  I accept paypal or certified funds if not local and I have to ship."
15,http://www.armslist.com/posts/2982015,For Trade:  mossberg 715t,"rocksprings, Wisconsin, United States",Offer,"Listed On: Wednesday, April 23, 2014",Rifles,Mossberg                                                                                ,22 Long Rifle                                                                                ,Semi-automatic                                                                                ,Rifle,like new a2 carrying handle style tactical .22 with adjustable stock and quad rail.has new truglo red dot scope/foregrip/tactical light and laser sight.comes with tactical carrying case/1 25 rd mag/ammo/bore snake.very nice and accurate rifle just want another pistol.
16,http://www.armslist.com/posts/2982016,Want To Buy:  broken revolvers or semi autos,"loudon/blount, Knoxville, Tennessee",$ 100,"Listed On: Wednesday, April 23, 2014",Handguns,no type,no type,no type,no type,As the title says I am looking for broken guns 100 dollars or less wanting them to learn to gunsmith and engraving text anytime I work thirds so can't accept calls but can text REDACTED
17,http://www.armslist.com/posts/2982017,For Sale:  Remington 597 *SOLD*,"Mankato, Mankato, Minnesota",$ 175,"Listed On: Wednesday, April 23, 2014",Rifles,Remington                                                                                ,22 Long Rifle                                                                                ,Semi-automatic                                                                                ,Rifle,"A like-new Remington 597 chambered in .22LR. It comes with one mag and variable scope (Remington made scope that came with the rifle). The rifle has seen ONE trip to the range, during which time I fired approximately 30 rds to sight in the scope. It was cleaned after the trip to the range and has been a safe queen ever since. Buyer must be a MN resident, be 18 years of age, and complete Bill of Sale.

IF AD IS STILL UP, RIFLE IS STILL AVAILABLE"
21,http://www.armslist.com/posts/2982021,For Sale:  Glock 30 gen 3 Night Sights Extras,"Mboro, Nashville, Tennessee",$ 555,"Listed On: Wednesday, April 23, 2014",Handguns,Glock,no type,no type,no type,"I have a used glock 30 gen 3 with talon grips, beaver tail grip installed, 2 ten round mag and one 13 round mag and some 45 ammo."
23,http://www.armslist.com/posts/2982023,For Sale:  Taurus 941 22 mag.  SS,"Winchester, Lexington, Kentucky",$ 340,"Listed On: Wednesday, April 23, 2014",Handguns,Taurus                                                                                ,no type,Double Action                                                                                ,Revolver,Taurus 941. Polished stainless.  22 magnum.  8 shot.  Nice shape.  $340 FIRM.  No trades. Call or text REDACTED.  Can be picked up in Winchester.
25,http://www.armslist.com/posts/2982025,For Sale:  Ruger SR556 E PISTON,"California, California, United States",$ 950,"Listed On: Saturday, May 10, 2014",Rifles,Ruger                                                                                ,no type,Semi-automatic                                                                                ,Rifle,"This rifle comes with 4 PMAGs, ruger soft gun case, and flip up sights. This is a great piston driven rifle selling this out to serious buyer only.. if you are not serious don't bother to contact me."
26,http://www.armslist.com/posts/2982026,For Sale:  German Shepherd,"Sq. Hill, Pittsburgh, Pennsylvania",$ 100,"Listed On: Wednesday, April 23, 2014",Miscellaneous,no type,no type,no type,no type,"Hi all
       I'm helping my brother in law sell his male German Shepherd dog. He is 3 years old, fit, healthy and a big boy. Weight wise he clocks in at 90 pounds.
       He is living with a family that has many young children and is fiercely loyal to them. If he has a firm handler who continues his obedience training he will continue to do well as a family dog, watch dog, and guard dog.

Will post pics soon...
Shepard"
28,http://www.armslist.com/posts/2982028,For Sale:  Palmetto Armory AR-15,"Theodore, Mobile, Alabama","$ 1,000","Listed On: Thursday, April 24, 2014",Rifles,Palmetto State Armory                                                                                ,223/5.56 NATO                                                                                ,Semi-automatic                                                                                ,Rifle,"I am selling a palmetto armory AR -15 with quad rail, bi-pod fore grip, ATN ultra sight 5 retical sight, mag pul flip up rear sight, and last but not least Surefire rail mounted flashlight. I also have 10 30rd mags I will sell with it. I need to get 1000 obo out of tthis gun to help pay for a marriage. You can email me or txt me at REDACTED"
29,http://www.armslist.com/posts/2982029,For Sale:  SKS,"Mankato, Mankato, Minnesota",$ 315,"Listed On: Wednesday, April 23, 2014",Rifles,Norinco                                                                                ,7.62x39                                                                                ,Semi-automatic                                                                                ,Rifle,"I have a 922R compliant Norinco SKS available for sale.The rifle has a synthetic folding stock and bayonet with a new 20-rd Tapco mag. As with any new mag, it may need some ""break-in"" period. Obviously since it is new, I cannot attest to its performance. Rifle also has a brand new Tapco piston and new US made guide rod. I have not fired the rifle with the new piston but will include the old piston with the sale as it is functional. Buyer MUST have MN permit to purchase or permit to carry, must be a MN resident, be 21 years of age, and complete Bill of Sale. 

IF AD IS STILL UP, RIFLE IS STILL AVAILABLE"
30,http://www.armslist.com/posts/2982030,Want To Buy:  NAA Black Widow,"South Central KY, Kentucky, United States",Offer,"Listed On: Wednesday, April 23, 2014",Handguns,North American Arms                                                                                ,22 WMR                                                                                ,Single Action                                                                                ,Revolver,"Looking to buy a clean used NAA Black Widow.  22 mag or 22 convertible, with fixed sights.  Cash in hand, ready to buy.  Can meet around Russell/Adair/Casey county.  Email or text only REDACTED."
31,http://www.armslist.com/posts/2982031,"Want To Buy:  Looking for a S&W 44 magnum  2 1/2"" to 4""","Philadelphia, Southeastern, PA, Pennsylvania",Offer,"Listed On: Wednesday, April 23, 2014",Handguns,Smith & Wesson                                                                                ,44 Magnum                                                                                ,Double / Single Action                                                                                ,Revolver,"I am looking to buy a 2 1/2"" to 4 S&W 44 magnum. Face to face only"
32,http://www.armslist.com/posts/2982032,For Sale:  1942 91/30 Mosin Nagant,"Oak Harbor, Seattle, Washington",$ 180,"Listed On: Saturday, May 10, 2014",Rifles,no type,7.62x54R                                                                                ,Bolt Action                                                                                ,Rifle,"Mosin Nagant 91/30. 1942, Round receiver. Very clean, nice stock, good rifling, smooth bolt. All matching numbers. Asking $180 firm. 

Ammo not included. 

Located in Oak Harbor. Not really looking to drive off the island, but will drive a SHORT distance to meet if need be. Not looking to trade."
34,http://www.armslist.com/posts/2982034,For Sale:  Microtech MSAR STG 556 S/A with Schmidt & Bender Short Dot Scope,"jerry.e.baker2.civ@mail.mil, Birmingham, Alabama","$ 2,000","Listed On: Wednesday, June 18, 2014",Rifles,Microtech                                                                                ,223/5.56 NATO                                                                                ,Semi-automatic                                                                                ,Rifle,This MSAR STG 556 has been upgraded with the RAT WORX trigger pack and has a Schmidt and Bender Short Dot scope mounted. I will replace or take off the scope with a different optic  for $1100. The barrel was re-threaded to accept a standard Flash hider and a Knights Armament (KAC) flash hider has been installed. The light is an Insight Technology light and has the wired remote pad for on and off. The RAT WORX trigger changed the trigger pull from what feels like a longer double action heavy pull to a crisp 4.5 lb pull much like a standard AR. The Short Dot is exceptional in clarity for CQB or long distance and has a light up reticle. Because of the Bull Pup stock this guns overall length is about an inch shorter than most AR Pistols. It is very accurate and a good shooting gun. Call or text REDACTED for quickest reply.
35,http://www.armslist.com/posts/2982035,Want To Buy:  Taurus PT22 or Ruger .22,"Greenwood, Indianapolis, Indiana",$ 200,"Listed On: Wednesday, April 23, 2014",Handguns,Taurus                                                                                ,22 Long Rifle                                                                                ,Double / Single Action                                                                                ,Pistol,Looking for a PT22 or Ruger .22.  Please send me pictures and prices..  Thanks..
36,http://www.armslist.com/posts/2982036,For Sale:  Beretta CX4 in 9mm,"CS/Denver, Denver, Colorado",$ 825,"Listed On: Wednesday, April 23, 2014",Rifles,Beretta USA                                                                                ,9mm Luger (9x19)                                                                                ,Semi-automatic                                                                                ,Rifle,"Beretta CX4 in 9mm. Fantastic shape, fired on exactly 2 occasions, less than a year old. Will include $100 Sierra Papa steel guide rod, along with original plastic guide rod. I'll send you some pictures if you are really interested."
37,http://www.armslist.com/posts/2982037,For Sale:  Badger Rosewood Boot Grip for sp101,"st. louis, St. Louis, Missouri",$ 60,"Listed On: Wednesday, April 23, 2014",Gun,no type,no type,no type,no type,Brand new grip for 60 normally 90
39,http://www.armslist.com/posts/2982039,For Sale/Trade:  Glock 30 gen 4 with Fiber Optic night sights,"Cincinnati, Cincinnati, Ohio",$ 680,"Listed On: Tuesday, April 29, 2014",Handguns,Glock,no type,no type,no type,"I have a Glock 30 gen 4 with TruGlo TFO night sights, it has 1 ten round mag and 1 thirteen round mag with xgrip,  also has a nice waterproof hard case which is nicer than factory case.

Does not have backstraps or factory case.

Perfect condition."
40,http://www.armslist.com/posts/2982040,For Sale/Trade:  Must Go!! Remington 870 (clone),"Va Beach, Hampton Roads, Virginia",$ 0,"Listed On: Monday, May 19, 2014",Shotguns,H&R                                                                                ,12 Gauge                                                                                ,Pump Action                                                                                ,Shotgun,"This is a Remington 870 replica all parts are interchangeable it is solid steel with a vented 28"" barrel tapped for scope and ammo.  Fired once but it was too big for my wife make an offer"
42,http://www.armslist.com/posts/2982042,For Sale:  22LR AMMO 8 boxes  Centurion,"fridley, Minneapolis / St. Paul, Minnesota",$ 20,"Listed On: Wednesday, April 23, 2014",Ammo,no type,no type,no type,no type,"I don't need this ammo I'll take $20.00 for 400 rounds

Please let me know why you are flagging my listing.
This is not a scam. and this is a fair price."
43,http://www.armslist.com/posts/2982043,For Sale:  Pair Ruger Bisley Vaquero--Custom Stainless .357,"NWOKC, Oklahoma City, Oklahoma","$ 1,250","Listed On: Wednesday, April 23, 2014",Handguns,Ruger                                                                                ,357 Magnum                                                                                ,Single Action                                                                                ,Revolver,"A pair of Ruger Bisley Vaquero (larger frame, not the New Vaquero)

Description: Cal. 357 Mag. S# 58-35153. Bbl. 5 1/2"". Ruger model KRBNV-35. Mfg. 2001. Cyl. frame & ejector housing have a sand blast matte finish. Balance highly polished & additionally bbl. is without Ruger marks. Hammer & trigger are jeweled, lightened action with free spin pawl & simulated ivory scrimshaw grips with Japanese style border & fan with blind grip screw on left. CONDITION: near excellent bore & grips (fit to frame is proud & with sm. gap at front). Near excellent polish finishes. Sand blast finish very good with some peppery stained spots. Light firing residue.

Description: Cal. 357 Mag. S# 57-96031. Bbl. 5 1/2"". Ruger model KRBNV-35. Mfg. 2001. Cyl. frame & ejector housing have a sand blast matte finish. Balance highly polished & additionally bbl. is without Ruger marks. Hammer & trigger are jeweled, lightened action with free spin pawl & simulated ivory scrimshaw grips with Japanese style border & fan with blind grip screw on left. CONDITION: near excellent bore & grips (fit to frame is proud & with sm. gap at front). Near excellent polish finishes. Sand blast finish very good with some peppery stained spots. Light firing residue.

Would prefer to sell together for $1250, but will consider selling separately.  $625 for one, your choice.

Thanks,

Bill"
44,http://www.armslist.com/posts/2982044,For Sale:  22lr,"Jacksonville, Medford, Oregon",FREE,"Listed On: Wednesday, April 23, 2014",Ammo,no type,no type,no type,no type,"2 bricks of 500rnds remington thunderbolts, make offer"
45,http://www.armslist.com/posts/2982045,For Sale:   MAKE OFFERS 556 MOSSBERGAR-15 FREE FLOAT RAIL NIB THIS IS 556,"North, Columbus, Ohio",FREE,"Listed On: Wednesday, April 23, 2014",Rifles,no type,no type,no type,Rifle,".556 free float!!! Make offers

Thanks
Looking to go a different route!"
