,url,title,location,price,post date,category,manufacturer,caliber,action,firearm type,postcontent
482,http://www.armslist.com/posts/2280482,For Sale:  New Never Fired Ruger LCP 380,"west of grand rapids, Grand Rapids, Michigan",$ 300,"Listed On: Wednesday, November 6, 2013",Handguns,Ruger                                                                                ,380 ACP                                                                                ,no type,Pistol,"Comes with orignal box and box of self defense ammo,"
484,http://www.armslist.com/posts/2280484,For Sale/Trade:  Remington 887 Nitro mag bone collector edition,"Lucedale, Mobile, Alabama",$ 1,"Listed On: Wednesday, October 30, 2013",Shotguns,Remington                                                                                ,12 Gauge                                                                                ,Pump Action                                                                                ,Shotgun,Sheets 2 3/4 to 3 1/2 inch Shells it's a pump and it's camouflage shoots great and looks great asking 450 obo wanting to trade for another 12 gauge preferably semi auto call or text REDACTED
487,http://www.armslist.com/posts/2280487,For Sale:  BARRETT REC7 6.8SPC LNIB,"Maywood, Illinois, United States","$ 1,500","Listed On: Wednesday, October 30, 2013",Rifles,Barrett                                                                                ,6.8mm SPCII                                                                                ,Semi-automatic                                                                                ,Rifle,"This like new Barrett REC7 is a semi-auto rifle which fires the 6.8 spc round. It has a 16"" barrel and black finish. It is new and comes with 2 magazines, adjustable stock, quad rail, rail covers, zippercase, box, and manual."
488,http://www.armslist.com/posts/2280488,For Sale:  A2 FRONT SIGHT GAS BLOCK,"ROCKFORD, Rockford, Illinois",$ 20,"Listed On: Wednesday, October 30, 2013",Optics,no type,no type,no type,no type,"REDACTED 
Like title says"
489,http://www.armslist.com/posts/2280489,For Sale:  RAVEN .25 AUTO,"DALEVILLE, Indianapolis, Indiana",$ 150,"Listed On: Wednesday, October 30, 2013",Handguns,Raven Arms                                                                                ,25 ACP                                                                                ,Double Action                                                                                ,Pistol,EXCELLENT CONDITION
490,http://www.armslist.com/posts/2280490,"For Sale:  Colt. M16 ,9mm SMG","kentucky, Kentucky, United States","$ 2,500","Listed On: Wednesday, October 30, 2013",Rifles,Colt                                                                                ,no type,Semi-automatic                                                                                ,Rifle,"Offered by Franks Gun - ATFmachinegun.com - You are bidding on an original Colt 9mm smg. This gun is nice and works perfect, comes with one mag. This is a post 86 dealer sample so if you are not a dealer dont bid. This will NOT require a LE demo letter if you are a C2 (type 07 with SOT) or a licensed importer. Class 3 dealers who are not manufacturers will still need a LE demo letter to purchase the gun
thanks"
491,http://www.armslist.com/posts/2280491,For Sale:  Surefire 100 100rd Magazines AR15 5.56 - Ship OK,"Palm Beach Gardens, Palm Beach, South Florida",$ 150,"Listed On: Thursday, November 14, 2013",Magazines,no type,no type,no type,no type,"Up for grabs are some BNIB Surefire 100rd mags. Only 5 left. FTF in Palm Beach Gardens/Jupiter $150. Can take Credit Cards or Paypal and ship. Please contact me for a quote.
Thanks"
492,http://www.armslist.com/posts/2280492,"Want To Buy:  Varget, Benchmark, 223 etc.","Helena, Birmingham, Alabama",Offer,"Listed On: Wednesday, October 30, 2013",Ammo,no type,no type,no type,no type,"Looking to buy Varget, Benchmark, BL-C2, etc. for .223 in the Birmingham area.  Please let me know what you have, looking for unopened containers only.  Thanks"
493,http://www.armslist.com/posts/2280493,For Sale/Trade:  Ruger P95 for a 22LR semi auto,"Cohoes, Albany, New York",$ 450,"Listed On: Wednesday, October 30, 2013",Handguns,Ruger                                                                                ,9mm Luger (9x19)                                                                                ,Double / Single Action                                                                                ,Pistol,"I have a Ruger P95 in almost new condition. It was my first gun purchase, and I have decided to turn it in for another 22. Comes with 2 mags, range bag, 40+ rounds, attachable green laser, bore snake. Honestly, its in great shape! 150+ rounds ran through it, cleaned after every range outing."
494,http://www.armslist.com/posts/2280494,For Sale:  .22LR- 600rds of Aguila and Remington Subsonic and High Velocity,"Nashville, Nashville, Tennessee",$ 100,"Listed On: Monday, November 4, 2013",Ammo,no type,no type,no type,no type,"200rds of Remington Subsonic Hollow Point
200rds of Remington Thunderbolt Round Nose
100rds of Aguila SuperExtra Subsonic Hollow Point
100rds of Aguila SuperExtra Subsonic Solid Point

$125/obo"
495,http://www.armslist.com/posts/2280495,For Sale/Trade:  Smith and Wesson sw40ve excellent condition 2 mags and original box,"Brandenburg, Kentucky, United States",$ 300,"Listed On: Wednesday, October 30, 2013",Handguns,Smith & Wesson                                                                                ,40 S&W,no type,no type,Smith and Wesson sw40ve excellent condition 2 mags and original box
498,http://www.armslist.com/posts/2280498,For Sale:  Smith & Wesson MP 40 3 mags+Case,"Asian Dist., Oklahoma City, Oklahoma",$ 450,"Listed On: Wednesday, October 30, 2013",Handguns,Smith & Wesson                                                                                ,40 S&W                                                                                ,Striker Fire                                                                                ,Pistol,Low round count Smith & Wesson MP 40 purchased from H&H. Includes 50 rounds of Remington UMC JHP ammo. Includes 3 magazines and range case. Will throw in extra ammo for prompt sale. $450 No trades at this time.
499,http://www.armslist.com/posts/2280499,For Sale/Trade:  Walther ppk/s nickel .22lr BNIB,"Johnstown, Fort Collins, Colorado",$ 415,"Listed On: Wednesday, October 30, 2013",Handguns,Walther                                                                                ,22 Long Rifle                                                                                ,Double / Single Action                                                                                ,Pistol,"It's brand new in box with 1 10rd magazine.  Made in Germany!  Has a threaded barrel, double action/single action with safety and decocker.  Also comes a de santis leather holster for right hand and 50 rounds of winchester sub sonic .22lr ammo.  Will trade for a Glock 17/19/26 gen 4 in FDE or OD with cash on my end.  415$ cash 450$ trade which is what I have in it.  No shipping"
500,http://www.armslist.com/posts/2280500,For Sale:  500 Pieces of Once Fired 9mm Brass,"Bloomington, Indiana, United States",$ 40,"Listed On: Wednesday, October 30, 2013",Ammo,no type,no type,no type,no type,500 Pieces of Once Fired 9mm Brass - $40
503,http://www.armslist.com/posts/2280503,For Trade:  FN FS2000 Bullpup w/TAC30 and Fastfire III NIB,"Hazel Green, Huntsville, Alabama",Offer,"Listed On: Monday, November 11, 2013",Rifles,FN Herstal S.A.                                                                                ,223/5.56 NATO                                                                                ,Semi-automatic                                                                                ,Rifle,"I've decided to go with something more traditional than a bullpup. I'm looking to trade, but will sell this new gun and optics for $2400. You can buy one from Impact Guns (without optics) for $2460 plus shipping. I'm mostly interested in 7.62 autoloaders like the new Ruger SR-762, but it does not hurt to listen to other offers. I would take (or give) $ in addition to a trade, but I prefer multiple guns if your firearm is not the same value as this black tactical FS2000. I've added a Burris TAC30 w/Fastfire III and PEPR QD mount. The gun has NOT been fired and the sights, scope, and red dot have not been zeroed."
504,http://www.armslist.com/posts/2280504,For Trade:  Ruger 9mm,"Richmond, Richmond, Virginia",Offer,"Listed On: Monday, December 9, 2013",Handguns,Ruger                                                                                ,9mm Luger (9x19)                                                                                ,Double / Single Action                                                                                ,Pistol,I am wanting to trade my ruger p95 new condition maybe shot 50 times comes with a protect light that's mounted on rail two 15 round mags and a 10 round mag 350 rounds of ammo two blackhawk holsters box and paper work first round shot and two speed loaders. It in awesome shape I took to range one time and it's just been sitting since it's very accurate and smooth shooting gun no problems what so ever with it just would like something different. I'm interested in all guns but mostly wanting to trade for another hand gun if you have something you like to trade let me know what you have if I need to add cash to make the trade even I can do that also
506,http://www.armslist.com/posts/2280506,Want To Buy:  GSG 522 SD,"Roanoke, Roanoke, Virginia",$ 1,"Listed On: Wednesday, November 27, 2013",Rifles,German Sport Guns                                                                                ,22 Long Rifle                                                                                ,Semi-automatic                                                                                ,Rifle,"Looking for GSG 522 SD.
Ready to make a cash offer."
507,http://www.armslist.com/posts/2280507,For Sale:  Browning A-Bolt Stainless Stalker in 338 Win. Mag. w/ Burris 3x9,"Oregon City, Portland, Oregon",$ 675,"Listed On: Wednesday, October 30, 2013",Rifles,Browning                                                                                ,338 Winchester Magnum                                                                                ,Bolt Action                                                                                ,Rifle,"Browning A-Bolt, stainless with composite stalk (aka stainless stalker) in 338 Win Mag. Includes a Burris 3x9 scope. In very good condition, ready for elk hunting. Gun without scope available for $550 firm. Call Ray with any questions."
508,http://www.armslist.com/posts/2280508,Want To Buy:  Vintage Antique Arms & Armor,"Toledo, Ohio, United States","$ 5,000","Listed On: Wednesday, October 30, 2013",Antique,no type,no type,no type,no type,Looking for vintage antique arms Pre-1890 I'm looking for mostly Militaria Flintlock and percussion Rifles.
510,http://www.armslist.com/posts/2280510,For Sale/Trade:  Wood grain Mossberg .270 bolt action w/scope and adj. bipod (case?),"Junction city, KS, Kansas, United States",$ 350,"Listed On: Wednesday, October 30, 2013",Rifles,Mossberg                                                                                ,270 Winchester                                                                                ,Bolt Action                                                                                ,Rifle,"Wood grain mossberg .270 bolt action w/adjustable bipod and scope. Never used before. Has 5 rd mag and accu-trigger.  Depending on the deal, I could include the hard case it's in. 
I'm looking to see what I can get out of it for trade. I.e: similar rifle, pistol...let me know. If you want to buy it I'm asking $300. I'm open to most deals...just no shotguns. Seriously, I'm good there. Call/text REDACTED thanks"
511,http://www.armslist.com/posts/2280511,For Sale:  hi point 9mm carbine,"Dickson, Nashville, Tennessee",$ 300,"Listed On: Wednesday, October 30, 2013",Rifles,Hi Point                                                                                ,9mm Luger (9x19)                                                                                ,Semi-automatic                                                                                ,Rifle,Very nice hi point 9mm carbine. comes with 3 15 round mags and 2 10 round mags.  gun is in great shape and functions perfectly.
512,http://www.armslist.com/posts/2280512,For Sale:  savage 220a 28ga very rare.,"ashtabula, Cleveland, Ohio",FREE,"Listed On: Wednesday, October 30, 2013",Shotguns,Savage Arms                                                                                ,28 Gauge                                                                                ,Break Open                                                                                ,Shotgun,very clean rare model 220. every thing works as it should. I don't think you will find a cleaner one. sorry I cant do pictures. no disappointments. 500 or best offer.
514,http://www.armslist.com/posts/2280514,For Sale:  Glock 27!!,"South Bend, South Bend, Indiana",$ 440,"Listed On: Sunday, November 10, 2013",Handguns,Glock                                                                                ,40 S&W                                                                                ,no type,Pistol,"Glock 27 in 40 caliber. Comes with two mags. Pinky extension, magazine extension for one additional round. Case and original papers. 100 rds down pipe."
518,http://www.armslist.com/posts/2280518,For Sale/Trade:  WTT Youth Deer Rifle for 22 target pistol or LCP,"bristol, Tri-cities, Tennessee",$ 0,"Listed On: Wednesday, November 6, 2013",Rifles,H&R                                                                                ,7mm-08 Remington                                                                                ,Break Open                                                                                ,Rifle,"I have a like new in box youth/compact handi rifle in 7mm-08. It has camo stock set, lock, scope rail, and 20"" barrel. I will also include 22 rounds of Hornady Lite and 33 rounds of Remington Corelokts, which is about $80.00 worth. It would make a great gun for opening day or Christmas. Will sell for $300.00

Call or text 423 3six1 o112. No calls after 9:00 PM"
520,http://www.armslist.com/posts/2280520,For Sale:  kahr cm40,"newton, Des Moines, Iowa",$ 385,"Listed On: Wednesday, October 30, 2013",Handguns,Kahr                                                                                ,40 S&W                                                                                ,Striker Fire,no type,never fired inbox  kahr cm40 I bought this gun and then my friend made me a deal on his glock 36 so the kahr is for sale. I paid $425 sealing for $385 call-REDACTED
521,http://www.armslist.com/posts/2280521,For Sale:  Steyr Aug A3 VLTOR .223 5.56 bull pup ar 15,"Wyoming, Wyoming, United States","$ 1,650","Listed On: Wednesday, October 30, 2013",Rifles,Steyr                                                                                ,223/5.56 NATO                                                                                ,Semi-automatic                                                                                ,Rifle,"Steyr AUG/A3 SA New unfired direct from the factory,this rifle has the highly sought after new VLTOR receiver. Rifle comes with (1) 30 round magazines, (2) 42 round magazines and one Steyr Arms soft gun case."
522,http://www.armslist.com/posts/2280522,For Sale/Trade:  bunch of random gun parts and holsters,"west Indianapolis, Indianapolis, Indiana",$ 200,"Listed On: Friday, November 22, 2013",Gun,no type,no type,no type,no type,"Magpul moe black milspec with box&papers 30, ace 8"" stock with side folder 60, 24mm to standard 17l ak threads 762x39 25, cnc warrior krink break for papm92 26mm 762x39 40, Blackhawk m&p or sigma holster and double mag pouch  sold, bianchi black leather k frame 4"" holster 20, K 6 1/2"" chest holster velvet lining 80,"
523,http://www.armslist.com/posts/2280523,For Sale:  marlin model 60 .22 lr,"sw ft wane, Fort Wayne, Indiana",$ 100,"Listed On: Wednesday, October 30, 2013",Rifles,no type,no type,no type,Rifle,I have a marlin model 60 well maintained very good condition. I have kept it clean and lubricated has a scope and is sighted in . Call text REDACTED
524,http://www.armslist.com/posts/2280524,For Sale/Trade:  FNH FNX-9 BNIB with ammo,"Johnstown, Fort Collins, Colorado",$ 515,"Listed On: Wednesday, October 30, 2013",Handguns,FN Herstal S.A.                                                                                ,9mm Luger (9x19)                                                                                ,Double / Single Action                                                                                ,Pistol,Comes with everything from the factory and also throwing in 50rds of ammo.  515$ cash or 575$ trade.  Trade for Glock 17 gen 4 in FDE or OD.  No shipping.  Thanks for looking
525,http://www.armslist.com/posts/2280525,For Sale/Trade:  M1903 Turkish Mauser 8mm made 1935,"Stafford County, Northern Virginia, Virginia",$ 200,"Listed On: Friday, January 3, 2014",Antique,no type,no type,no type,no type,Call or text me @ REDACTED.
526,http://www.armslist.com/posts/2280526,For Sale/Trade:  Remington 7600 grey ghost laminate 270 rare,"Conneautville, Meadville / Grove City, Pennsylvania",$ 675,"Listed On: Monday, November 4, 2013",Rifles,Remington                                                                                ,270 Winchester                                                                                ,no type,Rifle,Up for sale is yet another safe queen. I have had this gun for a very long time. I can't even remember if I have ever shot it. So that's why I'm listing it lnib. There is not a mark on it. It was bought new by me and I have never hunted with it. It came in a had green Remington case. I don't remember what I paid for it but I have never seen any since the day I bought this one. At least 10 years probably more like 15 or 20 years ago. I am open to trades but be real. I am NOT going to trade down. It comes with Simmons 3x9x50 scope. Shoot me a txt 412 nine-seven-four-6970.
527,http://www.armslist.com/posts/2280527,For Sale:  6 1/2 x 12 utility landscape atv trailer with rear ramp. Brand new! used once 2013,"between Athens and Jefferson, Athens, Georgia","$ 1,150","Listed On: Wednesday, October 30, 2013",Miscellaneous,no type,no type,no type,no type,"I have a brand new (used 1 time) 6 1/2 x 12 trailer. 15 inch tires, 2600 lb axle, spare tire, boxed in tail lights, flip up tounge jack. Trailer was built in april. 2013. Trailer costs $1250 and the spare tire was just over $100. I am asking $1150 cash or $1400 trade value. Would consider trades for fn five seven, ak 47 ar10, kimber, px4 storm, s&w 500, or other firearms. Call or text REDACTED No calls after 9:30pm please"
528,http://www.armslist.com/posts/2280528,For Sale:  COLT 70 series 1911 custom 45acp,"Phoenix, Phoenix, Arizona","$ 1,000","Listed On: Wednesday, October 30, 2013",Handguns,Colt                                                                                ,45 ACP                                                                                ,Single Action                                                                                ,Pistol,"I am selling a colt 1911 70 series 45acp blued finish.all work was preformed buy gunsmith for previus owner I have had it 3 years and its time to down size.round count is less than 200 since work was preformed.this colt has wilson grips,ambi-safty,grip safty,commander hammer,main spring housing,barrel bushing,trigger job and trijicon night sight."
529,http://www.armslist.com/posts/2280529,"For Sale:  5 boxes (125 rounds) 12 gauge 3"" steel #2 Hevi-Steel Shotshells","West Lafayette, Lafayette, Indiana",$ 90,"Listed On: Monday, November 25, 2013",Ammo,no type,no type,no type,no type,All 5 for $90
531,http://www.armslist.com/posts/2280531,For Sale:  Mathews Legacy Compound Bow,"Clarkston, Detroit, Michigan",$ 500,"Listed On: Thursday, November 14, 2013",Archery,no type,no type,no type,no type,"28"" draw length cam - 60 lb limbs, adjustable down to 50lbs, new string and cable last year
10 BuffTuff Carbon Arrows with field points 
Cordoza Quick Release Stabilizer
4 pin Cobra sight and additional 2 pin Extreme sight
TruFire Caliper Release

I bought the bow used a while back and now have 650 into it. Unfortunately, it's time to clear some space in the man cave.

Cash is king but ...
Will consider silver eagles in trade at $2 over spot. Also will consider silver bullion at spot."
532,http://www.armslist.com/posts/2280532,For Sale/Trade:  Remington model 11 with ammo,"Brazil area, Terre Haute, Indiana",$ 350,"Listed On: Monday, November 4, 2013",Shotguns,Remington                                                                                ,12 Gauge                                                                                ,Semi-automatic                                                                                ,Shotgun,"12 gauge semi auto has aftermarket stock this is the oldest style has the safety in front of trigger only thing wrong is it is missing the bead but I will prolly put one on it this thing shoots awesome and it real old and the,bluing is in great original shape comes with 14 boxes of deer slugs Wtt or sell   REDACTED"
533,http://www.armslist.com/posts/2280533,For Sale:  marlin model 336,"Dickson, Nashville, Tennessee",$ 400,"Listed On: Wednesday, October 30, 2013",Rifles,Marlin                                                                                ,35 Remington                                                                                ,Lever Action                                                                                ,Rifle,Very nice lever action marlin chambered in 35 remington.  gun is a 76 model so its a good older marlin made rifle. shoots great with great wood and typical brush wear for a gun of its age.
534,http://www.armslist.com/posts/2280534,For Sale:  XD 40 LE Service,"Near fair grounds, Raleigh / Durham / CH, North Carolina",$ 450,"Listed On: Wednesday, October 30, 2013",Handguns,Springfield                                                                                ,40 S&W                                                                                ,Striker Fire                                                                                ,Pistol,"Has 3 LE mags case black hawk CQC holster and black hauk CQC mag holster and 183 rounds of target ammo
Nick
REDACTED text or call"
536,http://www.armslist.com/posts/2280536,"For Sale/Trade:  H&R Model 999 ""Sportsman"" 22 LR","Conway/LR, Little Rock, Arkansas",$ 450,"Listed On: Wednesday, October 30, 2013",Handguns,H&R                                                                                ,22 Long Rifle                                                                                ,Double / Single Action                                                                                ,Pistol,"Serial # indicates 1981. Excellent condition with slight wear a the muzzle and small discoloration on right side. No box, just the pistol."
537,http://www.armslist.com/posts/2280537,For Sale:  KAHR CW 40,"Lomira, Wisconsin, United States",$ 375,"Listed On: Wednesday, October 30, 2013",Handguns,Kahr                                                                                ,40 S&W                                                                                ,Single Action                                                                                ,Pistol,I have a Kahr CW 40 for sale. I purchased it for my wife but it seems to be more than she can handle so the story goes. The gun is damn near new with less than a hundred rounds thru it. It has a 6 rd clip. If intrested or any questions call 920 nine zero four 42seven five.  Thanks
538,http://www.armslist.com/posts/2280538,For Trade:  armscor 1600 22lr(m-16)edition,"mcleansville, Greensboro, North Carolina",Offer,"Listed On: Wednesday, October 30, 2013",Rifles,no type,22 Long Rifle                                                                                ,Semi-automatic                                                                                ,Rifle,"wood stock,solid black,pistol grip.full upper sitesvery light gun,15 round mag.dead accurate
can be reached at REDACTED-chad or text REDACTED"
539,http://www.armslist.com/posts/2280539,Want To Buy:  S&W 442(No Lock) / S&W 640(No Lock,"West Michigan, Michigan, United States",$ 1,"Listed On: Wednesday, October 30, 2013",Handguns,Smith & Wesson                                                                                ,no type,no type,Revolver,"I'm looking for the following revolvers in excellent condition.

S&W 442(No Lock) .38 Special +P
S&W 640(No Lock) .357 Magnum / .38 Special 

Have cash and CPL.

Willing To Drive A Reasonable Distance For FTF Meeting."
