,url,title,location,price,post date,category,manufacturer,caliber,action,firearm type,postcontent
727,http://www.armslist.com/posts/2757727,"For Sale/Trade:  NEW S&W Governor 410, .45 acp & .45 LC plus new Hogue Wood Grips","Sumner, Washington, United States",$ 725,"Listed On: Saturday, March 1, 2014",Handguns,Smith & Wesson                                                                                ,45 ACP                                                                                ,Double / Single Action                                                                                ,Revolver,"I am selling my BNIB never fired Smith and Wesson Governor with Night Sight. I bought this a week ago and just found out that these are not legal in LA and I'm moving there in a month.  I bought new Hogue Wood Square bottom converted grips and paid $100 for them. 
Comes with everything it did when I bought, plus the new and original grips and a box of 410 handgun ammo."
728,http://www.armslist.com/posts/2757728,Want To Buy:  delete,"Rock Hill, Rock Hill, South Carolina",Offer,"Listed On: Saturday, March 1, 2014",Handguns,High Standard                                                                                ,22 Long Rifle                                                                                ,Single Action                                                                                ,Pistol,delete
729,http://www.armslist.com/posts/2757729,For Sale:  Type 53 Carbine (7.62x54),"Wauwatosa, Milwaukee, Wisconsin",$ 130,"Listed On: Friday, May 23, 2014",Rifles,Century International Arms                                                                                ,7.62x54R                                                                                ,Bolt Action                                                                                ,Rifle,"Up for sale is my Carbine style Type 53 MosinNagant. 

These are shooter guns. This one is priced as so. There is some corrosion on the outside parts of metal, but there was no chance for the internals to rust since it was caked in preservative. I completely cleaned out the cosmoline from the metal and the wood and re-stained it.

Like I said, this is a shooter. If you want something that slings 7.62 this is the gun for you. 

I bought this gun from BUDS and had to replace the firing pin on it and re-blued the finish when I got it. It shoots well and functions correctly. Its a cheap gun, not a safe queen. 

I also don't need an educational history on the gun and why you think my asking price is astronomical so don't bother emailing me.


Face to face only, please provide proof that you can legally purchase a firearm. 

I can email pictures as well."
730,http://www.armslist.com/posts/2757730,For Trade:  want to trade for thompson center r55,"se ks, Southeast, KS, Kansas",Offer,"Listed On: Saturday, March 1, 2014",Rifles,Remington                                                                                ,no type,no type,Rifle,I have a remington 552 speedmaster deluxe I would like to trade for a thompson center r55.
732,http://www.armslist.com/posts/2757732,For Sale:  600 rounds Magtech .308 150gr. FMJBT,"SE Loveland, Cheyenne, Wyoming",$ 360,"Listed On: Friday, March 7, 2014",Ammo,no type,no type,no type,no type,"Up for sale is 600 rounds of loose 150gr. Magtech .308 Win. ammo. Looking for local sale around Loveland, Fort Collins, Cheyenne WY area. Contact me at REDACTED if interested."
733,http://www.armslist.com/posts/2757733,For Sale/Trade:  Xdm 40,"Seattle Tacoma, Seattle, Washington",$ 480,"Listed On: Saturday, March 1, 2014",Handguns,Springfield                                                                                ,40 S&W                                                                                ,no type,Pistol,Xdm Springfield 40 cal with extras excellent shape low rounds
734,http://www.armslist.com/posts/2757734,For Sale:  AK Stock,"Gum Branch, Jacksonville, North Carolina",$ 30,"Listed On: Saturday, March 1, 2014",Gun,no type,no type,no type,no type,"Brand new unused.
This is a polymer version of the popular Krinkov stock. I ordered this and it didn't come for three months. In the mean time I ordered another so I have two. I put the tan para cord on it as a project and thought it might look good with wood furniture, but it can be removed. It is a very sturdy stock and you will be glad you bought it. I included a picture of the same stock on my AK 47.

Just fit to you AK, drill the screw holes and enjoy.

Call or text REDACTED. 

Asking $30"
736,http://www.armslist.com/posts/2757736,For Sale:  $475.00,"Lynnwood, Seattle, Washington",$ 475,"Listed On: Saturday, March 1, 2014",Handguns,Smith & Wesson                                                                                ,9mm Luger (9x19)                                                                                ,no type,Pistol,"Smith & Wesson
SW990L
9MM
Serial# SAE9288
Thanks for looking   REDACTED
Scott"
737,http://www.armslist.com/posts/2757737,For Sale:  FNH Five-Seven + 1500 rds + Accessories,"Dayton, Dayton, Ohio","$ 2,000","Listed On: Saturday, March 1, 2014",Handguns,FN Herstal S.A.                                                                                ,no type,Single Action                                                                                ,Pistol,"Selling lightly used FNH Five-seven (5.7x28mm) handgun with (American Eagle) 1000 rounds & 500 (SS197) rounds; 5x magazines; tactical flashlights; and OWB holster. ONLY selling unless you have a Kriss Vector (SDP).  Selling all together, Not selling only gun or only ammo."
738,http://www.armslist.com/posts/2757738,For Sale:  Sig Sauer 1911 Scorpion .45 - unfired.,"Denver, Denver, Colorado",$ 985,"Listed On: Saturday, March 1, 2014",Handguns,Sig Sauer                                                                                ,45 ACP                                                                                ,Single Action                                                                                ,Pistol,"Cabelas has it for $1069 plus tax.   

The legendary 1911 design has been brought into the 21st century with the refinement today’s shooters demand. The SIG SAUER® 1911 proves that close tolerances equal complete reliability and need not be incompatible in an off-the-shelf pistol. SIG SAUER has introduced clean, distinct lines that American shooters have embraced, while retaining the crisp trigger pull, classic ergonomics, and exceptional accuracy they expect.

The 1911 Scorpion is truely unique, from its desert tan Cerakote® coated stainless frame and slide. Complete with a 5.0 lb SAO trigger, 8 round magazine, and low-profile night sights. 

The 1911 Scorpion features Hogue's innovative Magwell Grip Set. The advanced design combines grip plates and main spring housing in an integrated magazine well extension that promotes rapid magazine changes. Manufactured from G10, the Magwell Grips provide strength and light weight in a highly functional assembly. The grips feature Hogue's Piranha texture for excellent retention in any environment and come in a multi-layer green and black pattern that accents the Scorpion's Cerakote Flat Dark Earth finish.

Item Number 1911R-45-SCPN 
Caliber 45 ACP 
Action Type SAO 
Trigger Pull DA N/A 
Trigger Pull SA 5 lbs 
Overall Length 8.7 in 
Overall Height 5.5 in 
Overall Width 1.4 in 
Barrel Length 5.0 in 
Sight Radius 6.5 in 
Weight w/Mag 41.6 oz 
Mag Capacity 8 Rounds 
Sights Low-Profile Night Sights 
Grips Hogue Custom G10 Grips 
Frame Finish FDE Cerakote® 
Slide Finish FDE Cerakote® 
Accessory Rail Yes 
Options Front Cocking Serations"
739,http://www.armslist.com/posts/2757739,For Sale/Trade:  Kimber Longmaster Classic .308 Leupold,"Bentonville, Fayetteville, Arkansas","$ 1,700","Listed On: Monday, March 17, 2014",Rifles,Kimber                                                                                ,308/7.62 NATO                                                                                ,Bolt Action                                                                                ,Rifle,"Kimber longmaster classic in excellent condition 
Leupold VX-R 3-9x40 (illuminated)
Leupold bases and rings (lapped)
Leupold alumina flip lens covers
Less than 50 rds through it
Just over $2000 invested"
740,http://www.armslist.com/posts/2757740,For Sale:  Heritage arms 22lr/22mag & Henry 22 lr,"Murfreesboro, Nashville, Tennessee",$ 200,"Listed On: Saturday, March 1, 2014",Handguns,Heritage Manufacturer                                                                                ,22 Long Rifle                                                                                ,Single Action                                                                                ,Revolver,I have a heritage revolver and a Henry rifle for sale. Revolver 200 and rifle 280. Obo call REDACTED. Ammo also availible I have around 700 rounds that I'll also sell to the buyer of these guns.
742,http://www.armslist.com/posts/2757742,For Sale/Trade:  Marlin 30-30 200m,"Eastgate, Cincinnati, Ohio",$ 1,"Listed On: Saturday, March 1, 2014",Rifles,Marlin                                                                                ,30-30 Winchester                                                                                ,Lever Action                                                                                ,Rifle,Good straight shooting gun in decent shape. Make offer
744,http://www.armslist.com/posts/2757744,For Sale:  People check your junk folders,"Oklahoma, Oklahoma, United States","$ 1,000","Listed On: Saturday, March 1, 2014",Handguns,Sig Sauer,no type,no type,no type,Just a friendly reminder to a buyer and seller to check to trash or junk folders have sent numerous emails wanting to buy and no responses! Thanks
745,http://www.armslist.com/posts/2757745,For Sale:  AR500 Armor plates,"West Lincoln, Lincoln, Nebraska",$ 120,"Listed On: Saturday, June 21, 2014",Tactical,no type,no type,no type,no type,"Up for sale is a complete set of ar500 armor plares.
Fabricated from Level III lab certified NIJ III material. Made in the USA
Every heat lot of AR500 OMEGA ARMOR is independently tested at an independent Ballistic laboratory to meet commercial ballistic standards.
Lab tested with 7.62mm Ball, M80, 149 gr. 2700 - 2800 FPS.
1x 10""x12"" Curved rectangle back plate bare steel
1x 10""x12"" Curved shooter cut front plate bare steel"
746,http://www.armslist.com/posts/2757746,Want To Buy:  Looking for raven Mp25 or 22lr pocket pistol,"Lynn Haven, Panama City, Florida",Offer,"Listed On: Thursday, March 20, 2014",Handguns,Raven Arms                                                                                ,25 ACP                                                                                ,no type,Pistol,Looking for buy a small pocket pistol for my wife or glove box. I am ccw holder and interested in small pocket pistols in good  working condition.
747,http://www.armslist.com/posts/2757747,For Sale/Trade:  *NEW* 8 TARGET RIMFIRE DUELING TREE!,"Tennessee, Tennessee, United States",$ 1,"Listed On: Wednesday, September 10, 2014",Ammo,no type,no type,no type,no type,"IF YOU HAVE A .22 RIFLE OR HANDGUN, YOU NEED TO LOOK AT THIS! This dueling tree is built for rimfire ammunition! It is made with mild steel paddles that are more cost efficient than the AR500 targets. For a ton of fun on a budget, this is the target for you. The unit completely disassembles, without the use of any tools, for easy transport and storage. Most commercial targets are either junk or way over engineered! Either option is a waste of your money! I have designed these to be highly effective without using alot of wasted material, which saves you money! This target has 8 target paddles. This target is rated for .22 short and .22 LR rounds. Please note that all high powered rifles and handguns can damage these paddles, this includes .17HMR ammo. I also offer AR500 trees for shooting high powered rifles and pistols. Please see my other listings for info and prices on them. I'm more than happy to meet you half way within reason. Please feel free to ask any questions. Price is $235 OBO. I've sold several of these and have had all happy shooters!"
748,http://www.armslist.com/posts/2757748,For Sale:  Westernfield 12ga  Shotgun,"Baltimore, Baltimore, Maryland",$ 225,"Listed On: Saturday, March 1, 2014",Shotguns,no type,12 Gauge                                                                                ,Pump Action                                                                                ,Shotgun,12 gauge pump shotgun.
750,http://www.armslist.com/posts/2757750,For Sale/Trade:  Benelli M4,"Santa Clara, California, United States","$ 2,300","Listed On: Saturday, March 1, 2014",Shotguns,Benelli                                                                                ,12 Gauge                                                                                ,Semi-automatic                                                                                ,Shotgun,"Benelli M4 p/g stock.  Have several upgrades GG&G large charge release button, trigger job by Clothey and Son's Gunsmithing , Mesa tactical side saddle.  Freedom Fighter charge handle and Black bore tactical vented choke.
Approx 150 rounds fired through this shotty"
751,http://www.armslist.com/posts/2757751,For Sale:  Nasi Helmet and Flag,"bloomington, Indianapolis, Indiana",$ 350,"Listed On: Saturday, April 19, 2014",Miscellaneous,no type,no type,no type,no type,"Nazi helmet
Restored helmet
About size 7 1/2
water on helmet from washing dust off
Flag is 3x5  reproduction
I accept paypal and will ship"
752,http://www.armslist.com/posts/2757752,"For Sale:  SIG SAUER P290RS, NIGHT SIGHTS, 2 CLIPS","Saint Charles, MO, St. Louis, Missouri",$ 460,"Listed On: Thursday, March 6, 2014",Handguns,Sig Sauer                                                                                ,9mm Luger (9x19)                                                                                ,Striker Fire                                                                                ,Pistol,"$460 obo

This gun is in great shape and is a great CCW. If interested email or text me at 636734724one."
753,http://www.armslist.com/posts/2757753,For Sale:  .38 S & W Ammo,"In nTown, Hampton Roads, Virginia",FREE,"Listed On: Saturday, March 1, 2014",Ammo,no type,no type,no type,no type,"Have 250 brand new rounds of .38 S & W, plus another box of 50 that are in great condition.  Will trade for other calibers, or sell cheap whichever is more agreeable."
755,http://www.armslist.com/posts/2757755,For Sale:  CORE 15 TAC 3,"Murfreesboro, Nashville, Tennessee",$ 900,"Listed On: Tuesday, August 19, 2014",Rifles,no type,223/5.56 NATO                                                                                ,Semi-automatic                                                                                ,Rifle,"Have a Core 15 TAC 3 that I bought on a spur of the moment and have maybe 100 rounds through it.  It's a good rifle and nothing wrong with it.  It has a 15"" Midwest Ind. forend with Mid Ind heat resistant panels.  The trigger is a nice one stage trigger.  Has a Troy vertical grip with it.  Comes with 2 pmags, a case, and Core's no BS warranty.  Would like to deal locally with meeting, but am willing to meet if it's not a far drive.  Not interested in trading really.  Text or call REDACTED"
756,http://www.armslist.com/posts/2757756,"For Sale:  SOLD PP: 600 Rds. Magtech .308 Winchester, FMJ BT","SE Loveland, Fort Collins, Colorado",$ 360,"Listed On: Friday, March 7, 2014",Ammo,no type,no type,no type,no type,"Up for sale is 600 rounds of loose 150gr. Magtech .308 Win. ammo, brass casing; bullet is Copper Jacketed non bi-metal and will not attract a magnet.  Looking for local sale around Loveland, Fort Collins, area. That's .60 a round for a quality ammo.
 Contact me at REDACTED or text me at REDACTED for more info.
For more info on the ammo check out the following link: http://www.magtechammunition.com/store/p14details427.php?pagePath=00000000,00000102itemList%3D"
757,http://www.armslist.com/posts/2757757,For Sale:  EAA BOUNTY HUNTER .357,"Gastonia, Charlotte, North Carolina",$ 375,"Listed On: Sunday, March 16, 2014",Handguns,European American Armory                                                                                ,357 Magnum                                                                                ,Single Action                                                                                ,Revolver,"EAA bounty hunter in .357mag single six, harden case, operates perfect. I havent seen to many of these German made singles around . I have owned many ruger single actions and in my opinion this gun is built just as well. its has a little holster wear on the ejector tube (easy fix) cylinder fade ring not bad for a gun this age..its a pleasure to shoot. Iam in no hurry to sell this gun and price is firm. face to face sell in my local area to only a permit or concealed carry holder.  ( holister is extra 75.00)"
758,http://www.armslist.com/posts/2757758,For Sale:  8 round KimPro Tacmag X 3,"Falcon, Woodmen Hills, Colorado Springs, Colorado",$ 50,"Listed On: Saturday, March 1, 2014",Magazines,no type,no type,no type,no type,"I have three 8 round KimPro Tacmag that have barely been used, and were never kept loaded. These retail at $32. You can find them for $20 online, but you have to pay for shipping."
759,http://www.armslist.com/posts/2757759,For Trade:  MOSSBERG MAV 88 NICE trade for s&w,"arden, Asheville, North Carolina",Offer,"Listed On: Saturday, March 1, 2014",Shotguns,Mossberg                                                                                ,12 Gauge                                                                                ,Pump Action                                                                                ,Shotgun,"nice maverick 88 12 gauge  new 18.5"" mossberg special barrel cyl bore .new duracote  od green paint . have original stock.    new heat shield and pistol grip.and over 100 rnds of shells from bird shot to 00 buck and slugs."
760,http://www.armslist.com/posts/2757760,For Trade:  3 guns for ar15,"chattanooga, Chattanooga, Tennessee",Offer,"Listed On: Saturday, March 1, 2014",Rifles,no type,7.62x39                                                                                ,Semi-automatic                                                                                ,Rifle,"Hi point 40 cal carbine brand new 3 mags,,,,, Sks paratrooper 20 and 30 round mag,,,, Mossberg 715t brand new......REDACTED"
761,http://www.armslist.com/posts/2757761,For Sale/Trade:  Stag Arms AR survival kit trade for pre ban lower reciever,"haverhill, Massachusetts, United States","$ 1,400","Listed On: Sunday, March 2, 2014",Rifles,Stag Arms                                                                                ,223/5.56 NATO                                                                                ,Semi-automatic                                                                                ,Rifle,"Stag Arms model 2 survival kit 2 ten red mags, k-bar, Gerber tool, pelican flashlight. Will trade for PRE-BAN Lower receiver."
763,http://www.armslist.com/posts/2757763,For Sale/Trade:  Davis 380,"Newport, Jacksonville, North Carolina",$ 200,"Listed On: Saturday, March 1, 2014",Handguns,Cobra                                                                                ,380 ACP                                                                                ,no type,Pistol,I have a Davis 380 with an upgraded Cobra stainless steel slide I want to trade for a 32 ACP. Gun functions well. Call or text REDACTED. Or Email
764,http://www.armslist.com/posts/2757764,For Sale/Trade:  Beretta Stainless Steel made in U.S.A.,"west county, St. Louis, Missouri",$ 550,"Listed On: Saturday, March 1, 2014",Handguns,Beretta USA                                                                                ,9mm Luger (9x19)                                                                                ,Double / Single Action                                                                                ,Pistol,"3 magazines(1-15round,2-10round), sorry no box or manual, and the guy who I got it from put Hogue grips on it, during which he broke one of the screw's top off so the threaded portion is still in the frame. Can be fixed, but I don't have the time. turns in to a great deal for you."
765,http://www.armslist.com/posts/2757765,For Sale/Trade:  Kimber Longmaster Classic .308 Leupold,"Joplin, Springfield, Missouri","$ 1,700","Listed On: Saturday, March 1, 2014",Rifles,Kimber                                                                                ,308/7.62 NATO                                                                                ,Bolt Action                                                                                ,Rifle,"Kimber longmaster classic in excellent condition 
Leupold VX-R 3-9x40 (illuminated)
Leupold bases and rings
Leupold alumina flip lens covers
Less than 50 rds through it 
Just over $2000 invested"
766,http://www.armslist.com/posts/2757766,For Sale:  Ruger 10/22 International,"Baltimore, Baltimore, Maryland",$ 325,"Listed On: Saturday, March 1, 2014",Rifles,Ruger                                                                                ,no type,no type,Rifle,Ruger 10/22 International Stock
767,http://www.armslist.com/posts/2757767,For Sale/Trade:  Stainless steel mini 14 Combat style,"Wyandotte, Detroit, Michigan",$ 0,"Listed On: Saturday, March 1, 2014",Rifles,Ruger                                                                                ,223/5.56 NATO                                                                                ,Semi-automatic                                                                                ,Rifle,"Very good condition stainless steel mini 14. Has been a safe dweller, bi-pod, 2 factory 20 round magazines and 2 30 round, a John mason muzzle brake with bayonet lug. Ati folding 6 position Tactical stock,weaver style scope mount which allows the use of the sights.3x9x42 scope. ."
768,http://www.armslist.com/posts/2757768,For Sale/Trade:  1972 Chevy Impala 350 motor,"Toledo, Toledo, Ohio","$ 3,500","Listed On: Saturday, March 1, 2014",Vehicles,no type,no type,no type,no type,I have a 1972 Chevrolet Impala with a 350 motor with only 50k on it. Its has an all original interior floor matts and all. It has had only 1 previous owner befor me and I have kept it in the garage. It has No Rust and No Bondo work has ever been done. BACKSEAT HAS NEVER BEEN RIDDEN IN!
769,http://www.armslist.com/posts/2757769,For Sale:  Henry repeating rifle 22lr,"Murfreesboro, Nashville, Tennessee",$ 280,"Listed On: Saturday, March 1, 2014",Rifles,Henry Repeating Arms                                                                                ,22 Long Rifle                                                                                ,Lever Action                                                                                ,Rifle,Henry 22 lr beautiful rifle 280 obo REDACTED. I also have ammo for sale for the buyer if interested.
770,http://www.armslist.com/posts/2757770,500 - Application Error,no type,no type,no type,no type,no type,no type,no type,no type,no type
771,http://www.armslist.com/posts/2757771,For Trade:  Kimber pro carry 2 hd stainless,"Montesano, Southwest Washington, Washington",Offer,"Listed On: Saturday, March 1, 2014",Handguns,Kimber                                                                                ,45 ACP                                                                                ,Single Action                                                                                ,Pistol,"I have a pro carry 2 hd ""4 inch barrel"". Gun is flawless. No scratches. No scuffs. Less than 100 rounds fired. Gun comes in box with paper work and one mag. If the trade is good then I can add four holsters. One being a shoulder holster. And I can throw in 70 rounds. 50 fmj and 20 hollow points."
773,http://www.armslist.com/posts/2757773,Want To Buy:  Sig P938 (preferably SAS or Equinox),"chicago/dupage, Chicago, Illinois",Offer,"Listed On: Saturday, March 1, 2014",Handguns,Sig Sauer                                                                                ,9mm Luger (9x19),no type,no type,"Looking for one. Please let me know if you have one for sale. Looking to spend market price, not more than I can get one for online or at my LGS. Thanks."
774,http://www.armslist.com/posts/2757774,For Sale/Trade:   Original Box For Colt Woodsman Match Target Model,"central/eastside, Portland, Oregon",$ 100,"Listed On: Saturday, March 1, 2014",Handguns,Colt                                                                                ,22 Long Rifle                                                                                ,no type,Pistol,Very rare. Solid condition with very intact hinge and end label. Even wear and tear with no fatal flaw of any nature. Seeking best cash or trade offer. That is all.
