,url,title,location,price,post date,category,manufacturer,caliber,action,firearm type,postcontent
453,http://www.armslist.com/posts/2757453,For Trade:  gen 2 glock 17,"medina, Cleveland, Ohio",Offer,"Listed On: Saturday, March 1, 2014",Handguns,Glock                                                                                ,9mm Luger (9x19)                                                                                ,Striker Fire                                                                                ,Pistol,"Looking to trade this glock 17 for a glock 19, 26 or body guard .380. The 17 is in overall good shape with just a few scratches on the slide ( I can send pictures if you would like) it comes with one 17 round magazine and glock holster. It doesn't come with a box or paper work. 
Any questions feel free to ask. Email me or text me at REDACTED"
456,http://www.armslist.com/posts/2757456,For Sale:  3 boxes of 9mm whinchester white box. New FMJ 115 gr (300 rounds),"Belton, MO, Kansas City, Missouri",$ 34,"Listed On: Monday, March 10, 2014",Ammo,no type,no type,no type,no type,"3 boxes of whinchester white box 9mm.  (100 rounds per box)

300 rounds total. 

$34 each box of 100. 
$90 for all 3.  (300 rounds)

text or email
816-44two-3538"
458,http://www.armslist.com/posts/2757458,For Sale/Trade:  Marlin 444SS,"Roanoke, Roanoke, Virginia",$ 400,"Listed On: Saturday, March 1, 2014",Rifles,Marlin                                                                                ,444 Marlin                                                                                ,Lever Action                                                                                ,Rifle,sold
459,http://www.armslist.com/posts/2757459,For Sale:  Brand New Unfired Ar-15,"Clinton, Knoxville, Tennessee",$ 700,"Listed On: Saturday, March 1, 2014",Rifles,DPMS                                                                                ,223/5.56 NATO                                                                                ,Semi-automatic                                                                                ,Rifle,"I have up for sale My New Frontier Ar-15 with a DPMS 5.56/.223  complete upper with forward assist. So will shoot either 5.56 or .223 safely Great looking rifle was conceived during the ""Gun ban scare"" and has been sitting since. Complete flat top upper ready for any optics to be mounted on it. Great little Gun just don't need it May entertain some trades, Main interest with be Ak-47's with ammo or boot but will entertain other guns as well. Feel free to email me or you can call or text me at REDACTED Price is 700"
460,http://www.armslist.com/posts/2757460,For Sale/Trade:  kahr cw40 and s&w sd40,"lexingtom, Lexington, Kentucky",$ 1,"Listed On: Saturday, March 1, 2014",Handguns,no type,40 S&W                                                                                ,Striker Fire                                                                                ,Pistol,I have two pistols for sale or trade.  One is a kahr cw40 that is brand new never shot and will require a bill of sale or transaction.  It comes with original box and papers and 1 clip. The smith and Wesson sd40 has had about 150 rounds through it. It comes with box papers and 2 clips. This one doesn't require a bill of sale as the other one just because I didn't get it through a ffl dealer like the kahr. I'm asking 400 obo for the kahr and 360 obo for the s&w. Will also trade. Thank you just text me. 859three5one24zero1
461,http://www.armslist.com/posts/2757461,For Sale:  Smith and Wesson package deal,"s willow, Manchester, New Hampshire",FREE,"Listed On: Monday, March 3, 2014",Handguns,Smith & Wesson                                                                                ,380 ACP                                                                                ,Single Action                                                                                ,Pistol,"Looking to move my two carry pieces. A bodyguard 380 and an M&P 9c. Both have holsters and the M&P has 3 mags and an APEX DCAEK trigger kit, the BG has 2 mags. Looking for 1000 for the pair. Less than 500 rounds fired between the 2."
462,http://www.armslist.com/posts/2757462,For Sale:  Walther G22,"Northridge, Los Angeles, California",$ 300,"Listed On: Saturday, March 1, 2014",Rifles,Walther                                                                                ,22 Long Rifle                                                                                ,Semi-automatic                                                                                ,Rifle,I am selling a OD Green Walther G22 rifle in 22LR. Its in good condition and comes with 2 mags and a carry case. Will meet at gun store for transfer. If interested call/text REDACTED.
463,http://www.armslist.com/posts/2757463,For Sale:  SAKO 30/06,"Hudson, WI, Minneapolis / St. Paul, Minnesota",$ 950,"Listed On: Saturday, March 1, 2014",Rifles,Sako                                                                                 ,30-06 Springfield                                                                                ,Bolt Action                                                                                ,Rifle,"SAKO MOUNTAIN EAGLE 30/06
ACTION IS SAKO FROM FINLAND
24"" KRIEGER BARREL 
BELL & CARLSON BLACK SYNTHETIC STOCK
$950        ALSO ASK ABOUT OPTION SCOPE
CALL OR TEXT JIM @ REDACTED
CAN SEND MORE PHOTOS
BUYER TO HAVE A VALID DRIVERS LICENSE & 
MUST FILL OUT & SIGN BILL OF SALE STATING
THAT THEY MAY LEGALLY PURCHASE A FIREARM"
464,http://www.armslist.com/posts/2757464,Want To Buy:  Henry Goldenboy .17HMR,"Lubbock area, Texas, United States",$ 550,"Listed On: Saturday, March 1, 2014",Rifles,Henry Repeating Arms                                                                                ,17 HMR                                                                                ,no type,Rifle,"Looking to buy a Henry Goldenboy .17 HMR or if anyone knows where I can find one. I've been looking for one for awhile now and it seems they are scarce! thanks for help!

contact at three6one-6seven6two9zero5"
465,http://www.armslist.com/posts/2757465,For Sale:  Taurus Thunderbolt .357 Magnum Pump-Action Rifle - Colt Lightening Replica,"Red Bank, Chattanooga, Tennessee",$ 630,"Listed On: Saturday, March 1, 2014",Rifles,Taurus                                                                                ,357 Magnum                                                                                ,Pump Action                                                                                ,Rifle,"Please include a phone number in your response. No phone number, and I'll delete your email. Thank you for your understanding, you'll find me very easy to get along with. 

A very unusual .357 for sale. 

LNIB, with box, and all included. 

This rifle WILL slam-fire. Hold the trigger and pump as fast as your wallet will permit. 

Lovely, and rare, case-hardened finish. 

None of the reliability issues the 45lc version suffered from. 

Will also chamber .38 special. 

Very few of this combination were ever made. Makes a great companion to a 357 revolver."
466,http://www.armslist.com/posts/2757466,"Want To Buy:  Wanting to trade for a Springfield XD9 or XD40 Full size (3.8/4"" Barrel) or Styer M9A1","Burnsville, Minneapolis / St. Paul, Minnesota",$ 1,"Listed On: Saturday, March 1, 2014",Handguns,Springfield                                                                                ,9mm Luger (9x19)                                                                                ,Striker Fire                                                                                ,Pistol,"Looking to trade my Beretta PX4 9mm Compact 3.2"" rotating barrel design, 2 double stack magazines, 3 interchangeable back straps for the grip. All in the Beretta hard case. Less than a box of rounds down the barrel, just not my style of shooter. 

I am looking to trade it for the Springfield XD9 or XD40 service model 4"" barrel. XD doesn't have to be in new condition, can have blemishes due to standard use as long as it is reliable, that's all that matters to me. Would like to do an even trade as the two are near the same price new. Let me know what you have. 

Thanks and have a great day..."
467,http://www.armslist.com/posts/2757467,For Sale/Trade:  PSA COMPLETE LOWER ALL MAGPUL AND MAGWELL GRIP,"Asheville, Asheville, North Carolina",$ 0,"Listed On: Saturday, March 1, 2014",Rifles,Palmetto State Armory                                                                                ,223/5.56 NATO                                                                                ,Semi-automatic                                                                                ,Rifle,"Text for pics

Please don't waste my time - looking for pistols 

REDACTED"
468,http://www.armslist.com/posts/2757468,For Sale:  Mint cond Never fired Winchester #94 30/30 Abe Lincoln Com. Rifle,"Ramona, San Diego, California",$ 650,"Listed On: Saturday, March 1, 2014",Rifles,Winchester                                                                                ,30-30 Winchester                                                                                ,Lever Action                                                                                ,Rifle,never fired safe queen. A collectors must. No box or papers just a like new rifle that has been hidden away like a approx. 50 year old time capsule. Mid 60'S.
469,http://www.armslist.com/posts/2757469,For Sale:  Ruger sr556 AR 15,"Roy, Seattle, Washington","$ 1,450","Listed On: Saturday, March 1, 2014",Rifles,Ruger                                                                                ,223/5.56 NATO                                                                                ,Semi-automatic                                                                                ,Rifle,"AR 15 piston operated with 3 gas settings, very good shape , flip up sights , custom CAA stock, carry bag, three 30 rd p mags, call or text for details REDACTED"
470,http://www.armslist.com/posts/2757470,For Sale/Trade:  complete upper for 556/223,"camp lejeune, Jacksonville, North Carolina",$ 440,"Listed On: Saturday, March 1, 2014",Gun,no type,no type,no type,no type,have a complete upper . . .it has no markings but it is a 16in match grade barrel with 12 in free float rail with m4 feed ramps and a m16 full auto bcg and a saw style charging handle low profile gas block. asking 440 as is unassembled. the assembled pic is what it should or would look like the first one is how it really is
471,http://www.armslist.com/posts/2757471,For Sale:  300 Blackout lake city brass,"Sanford, Raleigh / Durham / CH, North Carolina",$ 0,"Listed On: Friday, March 28, 2014",Ammo,no type,no type,no type,no type,"I have some 300 blkout brass for sale made from lake city once fired brass. Completely processed and ready to reload. Deprimed, resized, primer pocket swaged, trimmed, and tumbled in walnut media. .20 CENTS A PIECE. I have about 2500 pcs or more for sale. This is a pretty cheap price for completely processed compared to some of these website prices. I ship usps flat rate. Same price shipping to all states. Txt or email is fine. Will sell quickly at this price. Thanks for looking."
472,http://www.armslist.com/posts/2757472,For Sale:  6 position stock,"Fairborn Beavercreek, Dayton, Ohio",$ 25,"Listed On: Sunday, March 30, 2014",Gun,no type,no type,no type,no type,"This stock is commercial tube size,2 sling mount options"
473,http://www.armslist.com/posts/2757473,For Sale:  barnett bcx crossbow,"new port richey, Tampa/St. Pete, Florida",$ 500,"Listed On: Saturday, March 1, 2014",Archery,no type,no type,no type,no type,"Have a barnett bcx crossbow I am selling to get a new one. Been shot less than 20 times. On perfect condition. Comes with 3x32 illuminates scope, 10 arrows and a rope cocking device. 
Pleas email and I will get back you as soon as possible."
474,http://www.armslist.com/posts/2757474,For Sale/Trade:  F.I.E arms .38 special snub nose,"sapulpa, Tulsa, Oklahoma",$ 300,"Listed On: Saturday, March 1, 2014",Handguns,no type,38 S&W Special                                                                                ,Double / Single Action                                                                                ,Revolver,F.I.E .38 special snub nose revolver great lil gun for protection\carry will come with some rounds all in working order call or text with your offer 300.00 O.B.O may trade let me know what you got REDACTED
475,http://www.armslist.com/posts/2757475,For Sale/Trade:  Browning BAR .243 Belgium w/Leupold 4x12 scope,"Wilmington, Illinois, United States",$ 900,"Listed On: Sunday, March 9, 2014",Rifles,Browning                                                                                ,243 Winchester                                                                                ,Semi-automatic                                                                                ,Rifle,I have a beautiful Browning BAR .243 with a Leupold 4x12 scope and Browning 1 piece Base & Rings. I bought this gun new about 25 years ago. It is in excellent condition with a small number of rounds through it. Comes with 2 Belgium clips.
476,http://www.armslist.com/posts/2757476,For Sale:  Huge Inventory Clearance  ALL MUST GO!,"Downtown Denver, Denver, Colorado",FREE,"Listed On: Saturday, March 1, 2014",Handguns,no type,no type,no type,no type,"Big Inventory Clearance

Sunday March 2 Only
9am-4pm
1600 W 13th Ave 
Denver, CO 80204"
478,http://www.armslist.com/posts/2757478,For Sale:  custom AR15 sweet gun,"Lucedale, Gulfport / Biloxi, Mississippi",$ 1,"Listed On: Saturday, March 1, 2014",Rifles,Bushmaster                                                                                ,223/5.56 NATO                                                                                ,Semi-automatic                                                                                ,Rifle,Belong to a DEA agent buddy I got from him now what something els sell or trade REDACTED
479,http://www.armslist.com/posts/2757479,For Sale:  Mossberg 500 Road Blocker 12 GA Shotgun,"Saint Peter, Mankato, Minnesota",$ 349,"Listed On: Saturday, November 8, 2014",Shotguns,Mossberg                                                                                ,12 Gauge                                                                                ,Pump Action                                                                                ,Shotgun,"Nothing says ""back off"" more like a Mossberg 500 chambering a 12ga shell until you put a Barrett style muzzle break on it like this Road Blocker version. This shotgun really only has two practical purposes in life: Blasting watermelons or zombies in style and for home defense. This shotgun is gently used and is in very good condition just waiting for a new home. 

*Price reflects a 3% cash discount before MN sales tax (6.875%). Major Credit Cards accepted. Sorry, No Checks.
*You must have a valid MN drivers license for in state purchase and pass the background check.
*Will ship insured to your FFL for $35 (USPS Money Order only)"
480,http://www.armslist.com/posts/2757480,For Trade:  Kahr CW45 3 days old,"Largo, Tampa/St. Pete, Florida",Offer,"Listed On: Saturday, March 1, 2014",Handguns,Kahr                                                                                ,45 ACP                                                                                ,Double / Single Action                                                                                ,Pistol,"Looking to trade my Kahr CW45 chambered in a .45 ACP. It's very light weight andAccurate. Bought brand new 3 days ago, I have box and papers, one mag. Put 50 rounds down the pipe."
481,http://www.armslist.com/posts/2757481,For Sale/Trade:  NEW! MOSSBERG 30-30 Lever action,"Salem, Salem, Oregon",$ 400,"Listed On: Saturday, March 1, 2014",Rifles,Mossberg                                                                                ,30-30 Winchester                                                                                ,Lever Action                                                                                ,Rifle,"I have a new Mossberg model 464 lever action 30-30.
This looks just like the famous winchester 94 only it is a much better 30-30 in my opinion.
I also have two boxes of Remington ammo that come with this.
Asking $400 cash or $400 towards a trade for a Ruger mini 14 or AK or AR15
Whatcha got lets deal."
482,http://www.armslist.com/posts/2757482,For Sale:  Springfield Xd-40 with Extras,"Clinton, Knoxville, Tennessee",$ 475,"Listed On: Saturday, March 1, 2014",Handguns,Springfield                                                                                ,40 S&W                                                                                ,Striker Fire                                                                                ,Pistol,"I have up for sale My springfield Xd-40 in great shape. Overall a good looking gun that shoots even better. Comes with all the original equipment minus the mag holster, Don't know where It got placed,However It will come with an extras mag for a total of 3. This is a great gun just have too many carry guns. May entertain some trades but Cash is king Feel free to email me or call or text me at REDACTED Price is 475"
483,http://www.armslist.com/posts/2757483,For Sale/Trade:  Glock 36 gen 3,"Garner, Raleigh / Durham / CH, North Carolina",$ 600,"Listed On: Tuesday, April 22, 2014",Handguns,Glock                                                                                ,45 ACP                                                                                ,Striker Fire                                                                                ,Pistol,"Glock 36 gen 3. Aftermarket trigger, four mags, two are with pierce plus ones. Two are regular. Tactical grips installed. Trigger job was 80 dollars and just put in. Gun has only been shot once(one mag). Never holstered. Has tru dot night sights, 80 dollar value. All in all 160 dollars worth of upgrades, two extra mags at 30 dollars a piece. And the pierce extensions at 10 dollars a piece. So 240 dollars put into the gun. REDACTED, only real offers, I know what was put into this gun so don't try and lowball me. I am charging 675 which is jot what it's worth, it's worth 740 dollars."
484,http://www.armslist.com/posts/2757484,For Sale:  CZ 512 .22 mag,"greater metro, Portland, Oregon",$ 600,"Listed On: Saturday, March 8, 2014",Rifles,CZ USA                                                                                ,22 Magnum                                                                                ,Semi-automatic                                                                                ,Rifle,"BNIB CZ 512 .22mag semi-auto. Hard to find high quality firearm. Funding new project.Comes with 1-5 round mag and 2-10 round mags.
 600 cash FTF w/ Or DL or CCL
 Thanks Scott
 REDACTED"
485,http://www.armslist.com/posts/2757485,For Sale:  Remington Model 742 30-06 sprg.,"Decatur, Huntsville, Alabama",$ 325,"Listed On: Saturday, March 1, 2014",Rifles,Remington                                                                                ,30-06 Springfield                                                                                ,Semi-automatic                                                                                ,Rifle,Like new Remington Model 742 30-06 Woodmaster. Has original 3x-9x Redfield scope. Asking $325.00 for it. No trades. Pick up in Decatur. text or voicemail REDACTED
486,http://www.armslist.com/posts/2757486,"For Sale:  Huge Sale, Lots of AR and Shotgun Parts","Downtown Denver, Denver, Colorado",FREE,"Listed On: Saturday, March 1, 2014",Rifles,no type,no type,no type,Rifle,"Inventory Liquidation and Tactical  Garage Sale.

Sunday march 2 Only

9am-4pm
1600 W 13th Ave

Denver CO 80204"
487,http://www.armslist.com/posts/2757487,For Sale:  5.56 armor piercing ammo,"Portsmouth, New Hampshire, United States",$ 200,"Listed On: Saturday, March 1, 2014",Rifles,no type,223/5.56 NATO                                                                                ,no type,Rifle,"500, 5.56mm green tip steel core ammo"
489,http://www.armslist.com/posts/2757489,For Sale/Trade:  S&W Bodyguard .380 w/ laser and a few extras.,"Springdale, Fayetteville, Arkansas",$ 420,"Listed On: Saturday, March 1, 2014",Handguns,Smith & Wesson                                                                                ,380 ACP                                                                                ,no type,Pistol,"Located in springdale.
S&W Bodyguard .380.
Perfect condition. Everything from factory. De santis pocket holster and side belt clip installed but I do have the factory hardware to uninstall. Comes with pinky extender installed on mag but I still have the flat plate.
Call or text REDACTED"
490,http://www.armslist.com/posts/2757490,For Sale/Trade:  Tec-9 (Pre-90's Ban Model),"Lynchburg, Roanoke, Virginia",$ 480,"Listed On: Friday, March 7, 2014",Handguns,Intratec                                                                                ,9mm Luger (9x19)                                                                                ,no type,Pistol,"Looking to  trade a safe queen Intratec DC-9 Tec-9. This is the pre-Clinton model, which has the threaded barrel and shroud. Includes 2 mags (30 rounders)and barrel extension. Also have the box it came in. 
Gun is loads of fun. No malfunctions whatsoever. Makes anti-gunners cry every time you fire it.
Looking to trade for a ak (7.62 or 5.45), ar, or hk style rifle. Ak pistols and AR pistol uppers interest me as do quality 1911's.  May be interested in other firearms, so don't be afraid to send me an offer. Please, no .22's, mouse guns, .40's, hunting rifles, junk handguns, or cars/car parts.  Sale price $480

Local sale to fellow VA resident only. Buyer is signing a simple BoS, and must show valid Virginia DL in addition to VA voter registration card or CHP."
492,http://www.armslist.com/posts/2757492,"For Sale/Trade:  Ruger Security Six 4"" 357 MAG","Northside, Indianapolis, Indiana",$ 550,"Listed On: Friday, March 7, 2014",Handguns,Ruger                                                                                ,357 Magnum                                                                                ,Double / Single Action                                                                                ,Revolver,"4"" Blued 357 Magnum with Walnut grips. Comes  with leather holster and soft case. Box of hornady critical defense 357 ammo."
493,http://www.armslist.com/posts/2757493,For Sale:  Glock 26 Gen 3 LNIB,"New Castle, Indianapolis, Indiana",$ 475,"Listed On: Saturday, March 8, 2014",Handguns,Glock                                                                                ,9mm Luger (9x19)                                                                                ,Striker Fire                                                                                ,Pistol,"LNIB Glock 26 Gen 3 with everything from the factory. This gun is in perfect condition and has literally only had two mags ran through it. It was shot, cleaned, and put away. Asking $475."
494,http://www.armslist.com/posts/2757494,For Sale/Trade:  H&K P30 9mm,"Centralia, Southwest Washington, Washington",$ 850,"Listed On: Saturday, March 1, 2014",Handguns,Heckler & Koch                                                                                ,9mm Luger (9x19)                                                                                ,Double / Single Action                                                                                ,Pistol,"For Sale/Trade a LNIB H&K P30 in 9mm. Comes with everything from the factory including interchangeable palm swells, grip backs, manual, etc. 

2 hi-cap magazines. 475 rds through. Has decocker, but no safety. Luminescent sights that glow in the dark. Picatinny rail, too. 
Very good shooter, probably the only ""Tupperware"" brand pistols worth owning. They were the first one to invent the ""tupperware"" frame and not the Glock like some believe. Glock actually came in the third place."
495,http://www.armslist.com/posts/2757495,For Sale:  F250 4WD pickup.,"Norwood, Western Slope, Colorado","$ 3,500","Listed On: Saturday, March 1, 2014",Vehicles,no type,no type,no type,no type,"1990 FORD F250 4WD  LARIAT,Brand new--- tires,water pump, timing set and cover,radiator and all hoses,steel fan and shroud. ( over $2000 in new parts) Has 16"" stainless steel wheels and a camper shell.Needs a motor."
497,http://www.armslist.com/posts/2757497,For Trade:  Beretta 92fs INOX compact,"greenfield, Jackson, Tennessee",Offer,"Listed On: Saturday, March 1, 2014",Handguns,Beretta USA                                                                                ,9mm Luger (9x19)                                                                                ,Double / Single Action                                                                                ,Pistol,"As new in box stainless beretta 92 inox compact. Box, papers both mags two sets of grips. Trade for other guns. Text anytime or call REDACTED"
