,url,title,location,price,post date,category,manufacturer,caliber,action,firearm type,postcontent
491,http://www.armslist.com/posts/2746491,For Sale:  Yugo 24/47 Mauser w/ 200 rds 8mm ammo - Price Reduced,"Durham, Raleigh / Durham / CH, North Carolina",$ 275,"Listed On: Wednesday, March 26, 2014",Rifles,no type,8mm Mauser                                                                                ,Bolt Action                                                                                ,Rifle,"I have a Yugoslavian 24/47 Mauser for sale.  Good condition, no rust, no cosmoline.  Shoots well, very smooth action.  I am also including 200 rounds of 1950's Yugoslavian 8mm surplus ammo.  Ammo is brass cased and on stripper clips. I will consider trades for other C&R or  milsurp firearms. I can bring cash to deal to make it work if needed. $275 or best offer."
493,http://www.armslist.com/posts/2746493,"For Sale:  HK.45 MARK 23 W/Threaded Barrel, 2 Mags, NIB         Another HK Handgun From Jackson Armory!","Texas, Texas, United States","$ 1,300","Listed On: Thursday, February 27, 2014",Handguns,Heckler & Koch                                                                                ,45 ACP                                                                                ,no type,Pistol,"HK Mark 23 .45 W/Threaded Barrel & 2 Mags, New In Box. Stock # MSH270506KT. Serial # 23-015xxx. One of over a thousand Antique and Modern Collectible firearms, including Military, Sporting, Custom and Tactical guns, as well as Edged Weapons and Militaria we have for sale at Jackson Armory (see our other listings), this is also one of quite a few New In Box HK Pistols we currently have in stock. This is a new in the box HK MARK 23 Pistol, a full-size (5 ¾” barreled) tactical handgun, made in Germany by HK, and chambered for .45 acp. The massive pistol was designed for Police Duty and Military applications, but it certainly has other tactical applications as well. The pistol has a threaded barrel, and it’s ready for a “can” whenever the tactical situation calls for one! The all-black pistol is factory new, it comes with the factory box, and you get a total of 2 factory 12-round magazines"
494,http://www.armslist.com/posts/2746494,For Sale:  Smith and Wesson SD9VE 9mm w/ 4 mags,"Maryville, Knoxville, Tennessee",$ 330,"Listed On: Thursday, February 27, 2014",Handguns,Smith & Wesson                                                                                ,9mm Luger (9x19)                                                                                ,Striker Fire                                                                                ,Pistol,"Smith and Wesson SD9VE 9mm w/ 4 mags. Gun is in great shape with very low round count. 

865-229-669one"
495,http://www.armslist.com/posts/2746495,For Trade:  Springfield 1911 Range Officer + Extras,"St. Petersburg, Tampa/St. Pete, Florida",Offer,"Listed On: Thursday, February 27, 2014",Handguns,Springfield                                                                                ,45 ACP                                                                                ,Single Action                                                                                ,Pistol,"I'm looking to Trade my Springfield 1911 Range Officer - NM Serial #
Purchased New in Mid 2013 - Brand New Condition - Never Carried

Original Case, Paperwork, Factory Sights, Gun & Magazine Holsters
(3) Springfield 7 Round Magazines
(2) Pro Mag 10 Round Magazines
Harrison Rear Night Sight - 2 Dot
Dawson Precision Front Night Sight
VZ Slex Grip Screws & Grip O-Rings
Extra Set of Full Size 1911 Grips - Light Brown

Possible Trades
- Glock 19 / 26 / 30
- S&W M&P Pro 9mm
- Springfield XDM 3.8 Compact 9mm

I Want To Trade For A Handgun + Cash or 2 Handguns
Lowball Offers Without Cash Will Be Ignored

Valid FL DL or CWP Required for Bill of Sale"
496,http://www.armslist.com/posts/2746496,For Sale:  Nighthawk T3 Lightweight - FTF only,"anderson/muncie, Indianapolis, Indiana","$ 2,200","Listed On: Thursday, February 27, 2014",Handguns,Nighthawk Custom                                                                                ,45 ACP                                                                                ,Single Action                                                                                ,Pistol,"Very clean, low round count Nighthawk T3 lightweight 45acp. Bag, all papers and both mags. Built in 5 12. Has VZ diamondback grips, otherwise all original."
498,http://www.armslist.com/posts/2746498,For Sale/Trade:  STI International Tactical SS 5.0 Full Rail 1911 .45 acp (SOLD),"Sanford/Fort Bragg, Fayetteville, North Carolina","$ 3,000","Listed On: Wednesday, May 28, 2014",Handguns,no type,45 ACP                                                                                ,Single Action                                                                                ,Pistol,"New made in Texas STI Tactical SS 5.0 1911 (Not a 2011) in .45 acp package only been fired by gunsmith  to fit new barrel. Similar to a TRP Operator Full Rail it comes with factory box, original G-10 Grips, STI Magazine, Original Barrel  then added new G-10 VZ Simonich Gunner Grips (installed), Heinie Tritium Front Sight, Nighthawk Custom One Piece Mag-well with integrated lanyard loop. Also 6 Wilson Combat Mags, Comp-Tac Holster,  and Pelican Case.

Installed by professional gunsmith
STI Threaded Bull Barrel - Arnold Dew
Heinie Tritium Front Sight - Shooters
Nighthawk Custom One Piece Main Spring Housing - Shooters

Pics below show both sets of grips."
499,http://www.armslist.com/posts/2746499,For Sale:  FS:  Sig P238  .380,"west, Knoxville, Tennessee",$ 500,"Listed On: Saturday, March 22, 2014",Handguns,Sig Sauer                                                                                ,380 ACP                                                                                ,Single Action                                                                                ,Pistol,"Brand new unfired except at factory. I bought it new two weeks ago. Now something else has peaked my interest.

All black with black plastic grips. One mag. Night sights. Holster,case, paperwork.

Price is  $500 cash firm.  if you can find one cheaper, then go get it. NO TRADES no shipping.

I live in west Knoxville. I work in Oak Ridge. I can meet in either or in between. 

cell is REDACTED



buddy dropped his price so I'll drop mine. this is a good deal. if I still have it next weekend it will get shot."
500,http://www.armslist.com/posts/2746500,For Sale:  Ak47 Bakelite Mags 30rnds,"Va beach, Hampton Roads, Virginia",$ 40,"Listed On: Thursday, February 27, 2014",Rifles,no type,no type,no type,Rifle,Russian Tula original Bakelite magazines
501,http://www.armslist.com/posts/2746501,For Sale:  HickerBilly Merchandise,"Terre Haute, Indiana, Mississippi, United States",$ 26,"Listed On: Monday, March 31, 2014",Miscellaneous,no type,no type,no type,no type,"Specialty 2 pc. License Plates.  $25.99

Backing Plate is Vinyl on Aluminum Backing Plate. Backing Plates are offered in Reflective Black, Orange, Blue, Red, Yellow, White, Fluorescent Pink, Red, Red/Orange or Orange, or Camouflage Blaze Orange, White, Pink, or Regular.  You pick backing/front colors to make own color scheme.Front plate is Laser cut carbon steel, Primed, and Powder Coated.  Colors offered are black, white, purple, blue, red, pink, yellow, green, chrome, or granny smith green.

Vehicle Vinyl Decals  $25.50 to $5.25

Fits most vehicle windshields.  6 ½ “ height by 48 ½” wide
Offered in Reflective/$20.00 (White, Yellow, Red, Blue) Fluorescent/$20.00 (Orange, Yellow, Green, Pink, Red/Orange, Red) and Camouflage/$25.50 (Camo, Pink, White, Blaze Orange) or Diamond Plate/$22.50 (Red, Blue,)
Offered in rear window decals as well.  Small and medium sizes $6.00 to $11.00
Price does not include shipping.  Shipping approx. $5.00.  

Hickerbilly is defined as:

Midwestern slang term. (possible origin: Indiana) 
A cross between a hick and a hillbilly, and therefore the worst of the lot. A farmer boy who wears plaid flannel down jackets, camo pants/overalls, owns more than one pickup truck, prays to Jesus, lives in trailer, etc. etc.  You can't swing a dead cat in Kentucky without hitting a hickerbilly.

http://www.youtube.com/watch?v=91fEHw7OZko"
502,http://www.armslist.com/posts/2746502,For Trade:  All German Sig P220 45acp LNIB,"Canaan, NH, New Hampshire, United States",Offer,"Listed On: Saturday, June 7, 2014",Handguns,Sig Sauer                                                                                ,45 ACP                                                                                ,Double / Single Action                                                                                ,Pistol,"Early(1983) all German Sig P220 pistol in original red felt lined box with 2 factory magazines, owners manual and test target. Pistol looks completely un-fired."
504,http://www.armslist.com/posts/2746504,"Want To Buy:  Ruger SP-101 in .357 Magnum, 3"" barrel","Regional, Flagstaff, Arizona",Offer,"Listed On: Thursday, February 27, 2014",Handguns,Ruger                                                                                ,357 Magnum,no type,no type,"WTB Ruger SP-101 in .357 Magnum with 3"" barrel, new or mint condition. Local face to face purchase only. I have Arizona DL and CCW.

Thanks!"
506,http://www.armslist.com/posts/2746506,For Sale:  tc venture brand new 270,"southtowns, Buffalo, New York",$ 365,"Listed On: Thursday, February 27, 2014",Rifles,Thompson Center                                                                                ,270 Winchester                                                                                ,Bolt Action                                                                                ,Rifle,Guaranted accuracy never shot
507,http://www.armslist.com/posts/2746507,For Sale:  thompson center omega,"east side, Janesville, Wisconsin",$ 180,"Listed On: Thursday, February 27, 2014",Muzzle,Thompson Center                                                                                ,50 Black Powder                                                                                ,no type,Muzzle Loader,"bare bones synthetic stock, blued barrel, open sights, shot under 5 times, very accurate"
508,http://www.armslist.com/posts/2746508,"For Sale:  Boberg XR9-S Platinum 9mm W/2 Mags, New In Box         Another Quality Firearm From Jackson Armory!","Texas, Texas, United States","$ 1,200","Listed On: Thursday, February 27, 2014",Handguns,no type,9mm Luger (9x19)                                                                                ,Double Action,no type,"Boberg XR9-S Platinum 9mm, New In Box W/2 Mags. Stock # MSH271414. Serial # S01xxx. One of over a thousand Antique and Modern Collectible firearms, including Military, Sporting, Custom and Tactical guns, as well as Edged Weapons and Militaria we have for sale at Jackson Armory (see our other listings), this is a factory new in the box Boberg XR9-S Onyx 9mm pistol. Designed for concealed carry, the XR9-S, chambered for 9mm, is 5.1” in total length with a 3.3’ barrel, and it still holds 7=1 rounds of powerful 9mm! The Platinum version is all-stainless with a black integral grip. It has been upgraded with night sights. The pistol is double action only with the 6lb trigger upgrade. There is virtually nothing to snag on clothing on the gun. Made in the USA, this is a very high-quality handgun – you might want to scrimp on a .22 pistol you shoot beer cans with, and maybe a cheap shotgun for Dove Season, but for a gun that might one day save your life, you want the finest you can get, as well as one that is easy to carry wearing almost any type clothing, summer or winter – this Boberg is the gun! The pistol is factory new, it comes with the factory box and a total of 2 factory magazines."
509,http://www.armslist.com/posts/2746509,For Sale/Trade:  remington 1100 12 ga.  and more,"bradford, Pennsylvania, United States",$ 475,"Listed On: Tuesday, April 8, 2014",Shotguns,Remington                                                                                ,12 Gauge                                                                                ,Semi-automatic                                                                                ,Shotgun,Beautiful gun excellent blueing really nice wood bore is excellent smooth with imp barrel comes with extra synthetic stock set has nice scope Hastings barrel is also for sale at an extra cost it is brand new rifled slug barrel with sights it is a Hastings paradox cost over 300$ cash deal or open to trades this is not a magnum trade for mini 14 or sxs 20ga or nice 270 open to other offers also maybe hinds big red
510,http://www.armslist.com/posts/2746510,For Sale:  ***SAIGA 20 GAUGE*** LOTS OF EXTRAS***********,"bloomington, Indiana, United States","$ 1,300","Listed On: Thursday, February 27, 2014",Rifles,Saiga                                                                                ,no type,Semi-automatic                                                                                ,Rifle,"I have a IZ Saiga 20 gauge in great shape with lots of extras. This is a semi-auto shotgun, no need for pumping! Less than 500 rounds through it, i absolutely love this gun, but need the money. saiga package includes--origional foregrip-picatinny quad rail system- sight mark holographic sight with 4 reticle patterns and 7 brightness settings-3 extra batterys for holo sight-utg 150 lumens tactical flashlight with quick release. comes with additional body for off gun use, as well as pressure switch(currently mounted to foregrip)-2 extra batterys for utg flashlight-5 position foregrip with battery storage- bipod-hogue contured grip-tapco trigger and trigger guard-tapco 6 position stock-cheek riser for better target aqusition-rubber butt pad(it kicks)-reliability kit installed-3 3"" 5 round magazines-1 2 3/4 5 round magazine-1 2 3/4 13 round magazine- large plano field box with rifle stand -smaller plano ammo box-55 rounds remmington 2 3/4 slugs-150+ rounds of kent precision steel 3"" -200 rounds mixed remmington/winchester target loads-a few rounds of specialty ammo (ball and chain, dragons breath, flechettes)i will not accept trades at this time unless im trading up. I will only sell the entire package."
512,http://www.armslist.com/posts/2746512,For Trade:  large impressive solitare diamond,"lower burrell, Pittsburgh, Pennsylvania",Offer,"Listed On: Thursday, February 27, 2014",Miscellaneous,no type,no type,no type,no type,"Spent 2800 at "" jarod's""  looking for 1200$ cash or trade for firearms.  The diamond is just under 3/4 carot, clear, colorless, certified, and laser inscribed.  Comes with all paperwork andreciepts. Its obvious how high quality this diamond is.  Please no shipping unless you send your money via cash or post office money order, or ship your firearms FIRST. No exceptions, outher than face to face."
515,http://www.armslist.com/posts/2746515,Want To Buy:  WANTED SPRINGFIELD M1A/M14 7.62Nato Blue&Wood NAT'L MATCH Rifle,"Northeast/Falcon, Colorado Springs, Colorado","$ 1,600","Listed On: Saturday, March 29, 2014",Rifles,Springfield                                                                                ,308/7.62 NATO                                                                                ,Semi-automatic                                                                                ,Rifle,"I WANT TO BUY a Very Good to Mint to NIB SPRINGFIELD M1A/M14 BLUE&WOOD NATIONAL MATCH or possibly LOADED model 7.62Nato/.308 rifle WANTED in CO Springs , FTF ONLY. Prefer all Original NIB or lightly fired , though a well cared for shooter in Very Good condition is acceptable. Trade value up to $2000. in my iron(Colt Hbar/Mini30,Sig2022/9mmAll NIB for NIB NM or $1700. for NIB LOADED model. SIG NIB 2022/9mm SWISS ""Eurorail"" version  ; NIB Colt Hbar AR15; NIB 182Series 7.62x39 Ruger Mini30 Walnut&Blue
Ruger Mini 30 7.62x39 182 Series 14 yr ond blue&Walnut.  LOCAL FTF CO Springs ONLY  WILL ALSO Trade My NIB Loaded in Black Stock for a LOADED in WALNUT FTF +/-Cash"
517,http://www.armslist.com/posts/2746517,For Sale:  marlin lever action 45/70 $450 obo,"newport, Knoxville, Tennessee",$ 450,"Listed On: Thursday, February 27, 2014",Rifles,Marlin                                                                                ,45-70 Government                                                                                ,Lever Action                                                                                ,Rifle,I have a 45/70 marlin lever action rifle model #1895ss  it has a simmons 3-9 x 40 scope gun is in pretty good shape  has a few very light nicks and scratches please call or text for pics REDACTED comes with full box ammo 20rds
518,http://www.armslist.com/posts/2746518,Want To Buy:  Single shot 30/30,"West, Oklahoma City, Oklahoma",Offer,"Listed On: Thursday, February 27, 2014",Rifles,H&R                                                                                ,30-30 Winchester                                                                                ,Break Open                                                                                ,Rifle,Looking for an H&R or NEF single shot 30/30 with iron sights.
519,http://www.armslist.com/posts/2746519,For Sale:  Firefield 6.7 carbine length 2 piece quad rail,"Hillsborough, Tampa/St. Pete, Florida",$ 25,"Listed On: Saturday, March 15, 2014",Gun,no type,no type,no type,no type,"The Firefield Carbine 6.7"" Quad Rail features a two-piece design and mil-spec picatinny rail. This riflescope mount is quick and easy to install. The Carbine 6.7 inch Quad Rail 2 piece by Firefield features a hardimage anodized aluminum construction for reliability under heavy use. The Firefield Carbine 6.7-inch Quad Rail, Two piece has numbered rail slots.

$25 firm. great condition"
520,http://www.armslist.com/posts/2746520,For Sale:  Taurus judge defender,"Indianapolis, Indianapolis, Indiana",$ 450,"Listed On: Thursday, February 27, 2014",Handguns,Taurus                                                                                ,45 Colt,no type,no type,"I have a blued Taurus judge defender I am selling. It shoots 410 shotgun shells and 45 colt. I just don't shoot it as much as I wanted to and there are other guns out there I want. It comes with the gun, box, and a whole box of 410 shells. It's only had 6 rounds through the whole gun so it is practically new. I am open for trades but really want just cash. 
Trade for:
1911 45acp
Beretta 92
And other types of handguns"
521,http://www.armslist.com/posts/2746521,For Sale:  Saiga 20 Russian shotgun like new,"Wittenberg, Wausau, Wisconsin",$ 500,"Listed On: Thursday, February 27, 2014",Shotguns,Saiga                                                                                ,20 Gauge                                                                                ,Semi-automatic                                                                                ,Shotgun,"Selling a like new Saiga 20 gauge shotgun. Gun comes with two magazines for 2 3/4 and 3 inch shells. Gun is like new with less then 10 rounds fired since I bought gun new.

I am asking $500 cash only FTF sales, no trades. 

Buyer must me a Wisconsin resident and show me drives license at time of transfer. 

Please call me at 7one5-two97-two545 no emails or text. 7am-9pm

Sorry but emails will go unread."
523,http://www.armslist.com/posts/2746523,Want To Buy:  10 rounds mag for mosin archangel,"Oshkosh, Wisconsin, United States",Offer,"Listed On: Thursday, February 27, 2014",Magazines,no type,no type,no type,no type,I would love to buy 1-2 10 round mags for my mosin nagant with the archangel stock. e-mail me with how many and how much. I also have 2 I.O. 30 round polymer AK mags (7.62x39) That I would trade.
524,http://www.armslist.com/posts/2746524,For Sale:  CENTURY ARMS PAP M85 PSTL .223/5.56  No NY Sales,"Lyons-Wayne County, Rochester, New York",$ 499,"Listed On: Sunday, August 3, 2014",Handguns,Century International Arms                                                                                ,223/5.56 NATO                                                                                ,Double Action                                                                                ,Pistol,"CENTURY ARMS PAP M85 PSTL .223/5.56 30RD  NEW Yugo Zastava M85PV AK pistol features a 10 1/4” barrel, 19.3” overall length, 6.6lbs, stamped receiver, wood handguard and Zastava factory serial numbered certificate. Comes with 1 original Yugo 30rd magazine!
2 in stock"
525,http://www.armslist.com/posts/2746525,"For Sale:  Bulgarian AKKS - Milled AK47 new under-folder w/ chrome barrel, matching numbers","Downtown, Lexington, Kentucky","$ 1,139","Listed On: Tuesday, March 4, 2014",Rifles,no type,7.62x39                                                                                ,Semi-automatic                                                                                ,Rifle,"Bulgarian AKKS - Milled AK47 under-folder 7.62x39mm Semi-Auto Rifle

You are getting an ALL MATCHING NUMBERS rifle, newly built in Kentucky, by Meridian Ordnance LLC (a licensed 07 FFL 02 SOT manufacturer). Even the bakelite hand-guard has a matching serial. The receiver is the superb CNC Warrior model which is a very good match to the original pattern, including the correct flared lightening cuts which are often incorrectly reproduced with a ball end mill by some other manufactures. The barrel is chrome lined and parkerized under the Moly Resin semi gloss black finish which is a great match for the original finish. This is a beautiful rifle. Original furniture and cleaning rod included.

We accept credit and debit cards plus 3%. Price does not include sales tax for KY residents or shipping to your dealer. Local pickup requires 4473 background check. 

For more on Meridian Ordnance LLC and our work visit our webpage here for customer reviews and product photos:

www.meridianordnance.com"
527,http://www.armslist.com/posts/2746527,For Sale:  Winchester 94,"SW OKC, Oklahoma City, Oklahoma",$ 375,"Listed On: Thursday, February 27, 2014",Rifles,Winchester                                                                                ,30-30 Winchester                                                                                ,Lever Action                                                                                ,Rifle,I have a Winchester Model 94 with the gold trigger for sale.  Straight shooter. $450 or best offer.
528,http://www.armslist.com/posts/2746528,For Trade:  GLOCK 27 .40 CAL w/ NIGHT SIGHTS GEN 4,"Jellico, Knoxville, Tennessee",Offer,"Listed On: Thursday, February 27, 2014",Handguns,Glock                                                                                ,40 S&W                                                                                ,Striker Fire                                                                                ,Pistol,"Night sights, pierce grip extension, gen 4 , glock box. 3 mags. REDACTED"
529,http://www.armslist.com/posts/2746529,For Sale:  Savage 210 bolt shotgun mint! w/ scope,"Wittenberg, Wausau, Wisconsin",$ 500,"Listed On: Monday, May 26, 2014",Shotguns,Savage Arms                                                                                ,12 Gauge                                                                                ,Bolt Action                                                                                ,Shotgun,"Selling a like new Savage 210 bolt 12 gauge shotgun. Bought gun new and only fired 8 shells total to site scope in. Gun is in like brand new shape!  It has a BSA shotgun scope mounted to it. 

I am asking $500 cash only FTF sales, no trades. 

Buyer must me a Wisconsin resident and show me drives license at time of transfer. As well i sign a bill of sale.

Please call me at 7one5-two97-two545 no emails or text. 6m-10pm

Sorry but emails will go unread."
530,http://www.armslist.com/posts/2746530,For Sale:  LNIB LEE PRECISION Single Stage Reloading Press Kit,"Archdale, Greensboro, North Carolina",$ 150,"Listed On: Thursday, February 27, 2014",Ammo,no type,no type,no type,no type,"LEE PRECISION Breech Lock Challenger Kit
http://leeprecision.com/breech-lock-challenger-kit.html

-Kit contains everything pictured with the exception of the Press Base Plate 
 Press
 Powder Measure
 Manual Scale
 Hand Priming Tool
 Priming Shellholders
 Funnel
 Primer Pocket Cleaning Tool
 Deburring Tool
 Chamfering Tool
 Case Trimming Tool
 Case Lube
 Large & Small Priming Arms
The items listed above are all items that come in the kit. This kit was purchased in January and in have loaded about 300 rounds with it. This is an awesome kit for loading.  I am selling this kit to upgrade to a turret style press for a little higher volume loading. 

The only thing additional that you would have to purchase equipment wise is the specific die set(s) for the caliber you wish to load. 

I also have 8 Breech Lock Bushings available. They typically run about $10/pr. 

I am currently not interested in any trades and am pretty firm on my price as this us a great deal. 

I will ship to you if needed this kit fits in a Large Flat Rate box for $17.00

I accept paypal for faster transaction. 

You can reach me by voice or text @ REDACTED"
