,url,title,location,price,post date,category,manufacturer,caliber,action,firearm type,postcontent
783,http://www.armslist.com/posts/2746783,For Trade:  sold,"south, St. Louis, Missouri",Offer,"Listed On: Thursday, February 27, 2014",Ammo,no type,no type,no type,no type,l
784,http://www.armslist.com/posts/2746784,"For Sale:  Saiga 12 Shotgun $1,500 This is a great gun and performs flawless.","Chelsea, Detroit, Michigan","$ 1,500","Listed On: Thursday, February 27, 2014",Shotguns,Saiga                                                                                ,12 Gauge                                                                                ,Semi-automatic                                                                                ,Shotgun,"Saiga 12 Shotgun $1,500
This is a great gun and performs flawless. 

Eotech Sight 
Custom Muzzle Brake
Tapco G2 Single hook Trigger
Axis pin Retainer
Ar-15 Trigger Guard / With Euro Grip 
JTE Power Main Spring
Low Brass Reliability Kit
Tromix Bolt On Charging Handle
Tromix weld on Back Plate
JTE Mag Well
M4 Style Collapsible Stock
Hard Chrome Blot Carrier 
Durracoat Complete Gun 
Picitanny Forearm Rail 
Forearm Grip
4 – 12 round Magazines 

All work done professorially by Underground Gunworks and I have the receipts.  

Rock River Predator Pursuit 223 W/ EOP (Extended Optic Platform) eliminates the need for hi-rise scope mounts. This is a tack driver at 200 yards!   
$1,500
With:
Magpul PRS Buttstock
Winter Trigger Guard
Euro Grip
Quad Rail (Rifle Length) Midwest Industries 
Bushnell 6x18 Scope 
Oversize Charging Handle
20’’ Barrel with custom flash suppressor
Magpul Forearm rifle handle
Rock River National Match Two Stage Trigger
2-30 round Magazines  

All work done by Underground Gunworks>
Both guns are in pristine condition and have been well taken care of! Complete break down and cleaning after each trip to the range.     

Would consider less if you are interested in both. Thanks for looking!

Email: pastorjoe@chelseafcc,com
Cell: REDACTED"
785,http://www.armslist.com/posts/2746785,For Sale:  S&W M&P Shield 40,"Leesburg, Ga, Albany, Georgia",$ 400,"Listed On: Thursday, February 27, 2014",Handguns,Smith & Wesson                                                                                ,40 S&W                                                                                ,no type,Pistol,NEW IN BOX - S&W M&P Shield 40
787,http://www.armslist.com/posts/2746787,Want To Buy:  Hi-Point,"Green Bay, Green Bay, Wisconsin",Offer,"Listed On: Thursday, February 27, 2014",Handguns,Hi Point                                                                                ,no type,Double / Single Action                                                                                ,Pistol,"I've never had a Hi-point, but want to try one.  I am looking primarily for .380 or 9mm, but would also consider 40 or 45 caliber.  Not interested in other stuff, I have Rugers, Remingtons, and Taurus."
788,http://www.armslist.com/posts/2746788,For Sale:  Springfield Armory XDS 9 Bi-Tone,"Leesburg, Ga, Albany, Georgia",$ 550,"Listed On: Saturday, April 5, 2014",Handguns,Springfield                                                                                ,9mm Luger (9x19)                                                                                ,no type,Pistol,"NEW IN BOX - Springfield Armory XDS 9 Bi-Tone.  $550 cashor trade for a FDE Glock 9mm

Will ship to local FFL for $15."
789,http://www.armslist.com/posts/2746789,For Sale:  7mm-08 Ruger American rifle,"SE Tulsa, Tulsa, Oklahoma",$ 275,"Listed On: Thursday, February 27, 2014",Rifles,Ruger                                                                                ,7mm-08 Remington                                                                                ,Bolt Action                                                                                ,Rifle,"7mm-08 Ruger American for sale. No trades. Local sale only, face to face. Must sign Firearm Bill of Sale.

I bought this rifle middle of last year. Only 20 rounds through it. Took a doe with it last rifle season. Excellent condition! Paid $350.00 for it new, asking $275.00 cash. 1 box of Hornady and 1 box of Federal come with it. $60.00 value

From Ruger website:

Stock:	Black Composite	Capacity:	4
Material:	Alloy Steel	Finish:	Matte Black
Barrel Length:	22.00""	Overall Length:	42.00""
Sights:	None-Bases Supplied	Weight:	6.38 lbs.
Twist:	1:9.5"" RH	Grooves:	6
Length of Pull:	13.75""	Suggested Retail:	$449.00
Features:

Ruger Marksman Adjustable™ Trigger offers a crisp release with a pull weight that is adjustable between 3 and 5 pounds, allowing shooters to make that perfect shot.
Ergonomic, lightweight stock (designed for quick, easy handling) blends a classic look with modern forend contouring and grip serrations.
Soft rubber recoil pad is crafted for maximum recoil reduction.
Three-Lug 70 degree bolt provides ample scope clearance, and utilizes a full diameter bolt body and dual cocking cams for smooth, easy cycling from the shoulder.
Power Bedding® is an integral bedding block system that positively locates the receiver and free-floats the barrel for outstanding accuracy.
Hammer-Forged Barrel, resulting in ultra-precise rifling that provides exceptional accuracy, longevity and easy cleaning.
Features an easy-to-actuate tang safety that provides instant security, visibility and accessibility.
Rotary magazine fits flush with the stock and offers the smooth feed that has become the hallmark of Ruger® rotary magazines.
Also features a drilled and tapped receiver for mounting the included scope bases, sling swivel studs."
790,http://www.armslist.com/posts/2746790,For Sale:  Thompson Center Encore Pro Hunter XT Black .50 Cal Weathershield,"New Holland, Pennsylvania, United States",$ 719,"Listed On: Thursday, February 27, 2014",Muzzle,Thompson Center                                                                                ,50 Black Powder                                                                                ,no type,Muzzle Loader,"For sale I have a New Thompson Center Encore Pro Hunter XT Black .50 caliber muzzleloader! This rifle has a 28 inch fluted barrel with the weather shield finish. The stock is the black composite style. The sights are fiber optic, with the rear being adjustable. It is also drilled and tapped so you can mount a scope. Item number 5744. We have 1 in stock and we are listing it on Gunbroker, Armslist, and Gunsamerica so we expect it to sell fast.

Our store is The Sportsman’s Shop, located in the town of New Holland, Pennsylvania. We specialize in firearms from pistols, to rifles, and shotguns! At the Sportsman’s Shop we have in inventory over 1000 guns on any given day. For more information on our store visit our website, www.thesportsmansshop.com. To contact us about a gun in our posting send us a message or you can call us at REDACTED. If you leave your phone number in your message, we will do our best to call you promptly!"
792,http://www.armslist.com/posts/2746792,For Sale:  Streamlight TLR-2 Light /Laser combo,"sneads ferry, Jacksonville, North Carolina",$ 175,"Listed On: Thursday, February 27, 2014",Gun,no type,no type,no type,no type,"Great combo, used on my 1911 and it was an added comfort and quick target aquisition"
793,http://www.armslist.com/posts/2746793,For Sale/Trade:  Smith & Wesson MP9c,"Columbus/ Seymour, Indiana, United States",$ 450,"Listed On: Thursday, February 27, 2014",Handguns,Smith & Wesson                                                                                ,9mm Luger (9x19)                                                                                ,Striker Fire                                                                                ,Pistol,"I have for sale or for trade a MP9c. Very low round count only fired 12 rds. Comes with 2 12 rd mags,  the three different back straps, and case. My selling price is $450 or I prefer to trade. My email goes directly to my phone, if you have any questions."
795,http://www.armslist.com/posts/2746795,For Sale/Trade:  1962 Browning Hi Power 9mm,"Pleasant Garden, Greensboro, North Carolina",$ 700,"Listed On: Thursday, June 12, 2014",Handguns,Browning                                                                                ,9mm Luger (9x19)                                                                                ,Double / Single Action                                                                                ,Pistol,"1962 Belgium Browning Hi Power 9mm . Hard to find blued finish , shoots beautifully , flawless. Kinda dinged up as you can see in the picture. Putting the price value with the gun at 80% which is fair I think."
796,http://www.armslist.com/posts/2746796,For Sale:  TulAmmo 7.62X39mm FMJ 1000 round cases,"East Kingston, New Hampshire, United States",$ 250,"Listed On: Thursday, March 27, 2014",Ammo,no type,no type,no type,no type,"I have several 1000 round cases of TulAmmo 7.62X39mm FMJ ammo for sale.  Cash, local check or credit card +3%.  NO sales to MA residents."
798,http://www.armslist.com/posts/2746798,Want To Buy:  glocks new to great condition paying 400-475,"atlanta downtown area  4049036632, Atlanta, Georgia",$ 400,"Listed On: Thursday, February 27, 2014",Handguns,Glock                                                                                ,no type,no type,Pistol,Currently vehicless im willing to pay a extra 100 bucks on top of price for delivery thanks
801,http://www.armslist.com/posts/2746801,For Sale:  Springfield XD 45,"Oakcliff, Dallas, Texas",$ 475,"Listed On: Thursday, February 27, 2014",Handguns,Springfield                                                                                ,45 ACP                                                                                ,Single Action                                                                                ,Pistol,"I have a perfect condition all black Springfield XD 45 cal for sale comes with trijicon sights and 4 mags that hold 13 each

214five978four7four"
802,http://www.armslist.com/posts/2746802,"For Sale:  Rock River Predator Pursuit 223 W/ EOP (Extended Optic Platform) $1,300","Chelsea, Detroit, Michigan","$ 1,300","Listed On: Sunday, March 16, 2014",Rifles,no type,no type,no type,Rifle,"Rock River Predator Pursuit 223 W/ EOP (Extended Optic Platform) $1,300 eliminates the need for hi-rise scope mounts. This is a tack driver at 200 yards!   
$1,300
With:
Magpul PRS Buttstock
Winter Trigger Guard
Euro Grip
Quad Rail (Rifle Length) Midwest Industries 
Bushnell 6x18 Scope 
Oversize Charging Handle
20’’ Barrel with custom flash suppressor
Magpul Forearm rifle handle
Rock River National Match Two Stage Trigger
2-30 round Magazines  

All work done professorially by Underground Gunworks and I have the receipts.  
Gun is in pristine condition and have been well taken care of! Complete break down and cleaning after each trip to the range.     



Email: pastorjoe@chelseafcc,com
Phone: REDACTED"
803,http://www.armslist.com/posts/2746803,For Sale:  Rifle/Pistol conversions,"Madson, Charleston, West Virginia",$ 7,"Listed On: Thursday, February 27, 2014",Tactical,no type,no type,no type,no type,Prints and specs for the most common models and half the price of Amazon or Ebay
804,http://www.armslist.com/posts/2746804,For Sale:  Springfield Armory xd40,"Falcon, Colorado Springs, Colorado",$ 450,"Listed On: Thursday, February 27, 2014",Handguns,Springfield                                                                                ,40 S&W                                                                                ,Striker Fire                                                                                ,Pistol,"I have a Springfield Armory xd40 with two magazines the mag holster the SA holster and a leather galco in the waistband holster, plus a few rounds that are left over.  

I have less than 200 rounds through it.  No issues with it at all love the gun just switching to a different caliber."
805,http://www.armslist.com/posts/2746805,For Sale:  Mossberg 500 HS410,"Grand Rapids, Grand Rapids, Michigan",$ 350,"Listed On: Thursday, February 27, 2014",Shotguns,Mossberg                                                                                ,410                                                                                ,Pump Action                                                                                ,Shotgun,"For sale is a like new Mossberg 500 Home Defense model in .410. I have only put 5 shots through it and it has been stored in the safe ever since. $350 OBO

Call or text REDACTED"
806,http://www.armslist.com/posts/2746806,For Sale/Trade:  Enhanced Springfield Armory GI 1911,"lorain county, Sandusky, Ohio",$ 525,"Listed On: Thursday, February 27, 2014",Handguns,Springfield                                                                                ,45 ACP                                                                                ,Single Action                                                                                ,Pistol,"Springfield Armory GI 1911, bead blast stainless finish, nighthawk trigger, nighthawk checkered mainspring housing, novak front sight, harrison design rear sight, fitted wilson barrell bushing with custom spring plug, wilson combat magazine, custom slim line grips, all new springs and pins, grip bushings and screws, this a very nice 1911"
807,http://www.armslist.com/posts/2746807,For Sale:  Antique WWII 1943 Brass Flare Pistol Gun!!!,"Northside, Jacksonville, Florida",$ 200,"Listed On: Wednesday, May 21, 2014",Antique,no type,no type,no type,no type,"WWII US Military 37mm Brass Flare Pistol.  Includes unique serial number engraved on gun. This 37mm top-break flare gun was manufactured in July, 1943 by International Flare Signal Co, in Tippecanoe City, Ohio, and is so marked on the handle, and marked “JUL ‘43” on the left side of the receiver. The heavy pistol probably saw US Navy service in WWII, however it could have been used by the Army Air Corps to launch planes, or for other uses. It features a solid brass receiver and grip, and a heavy steel barrel. The pistol is single action. This gun is pretty heavy, and is not regulated."
808,http://www.armslist.com/posts/2746808,For Trade:  A 2 gun or 3 gun trade for AR-15,"Corryton, Knoxville, Tennessee",Offer,"Listed On: Thursday, February 27, 2014",Rifles,DPMS                                                                                ,223/5.56 NATO                                                                                ,Semi-automatic                                                                                ,Rifle,I wana trade a New Savage 110 30-06 wood stock with a new simmons scope Shot 1 time and a pardnder protecter pump 12 ga with factory cardboard box and all that came with it... The 380 is an ARMI F.LLI TANFOGLIO GT 380.. i do have 40 rounds for the 30 06 if can put sum with if can give lil 223
810,http://www.armslist.com/posts/2746810,For Sale:  CCI AR TACTICAL 22 LONG RIFLE AMMO,"Spotsylvania, Virginia, United States",$ 385,"Listed On: Thursday, February 27, 2014",Ammo,no type,no type,no type,no type,"I have 20 boxes of this ammo for sale, each box contains 300 rounds. I am selling it by the 10 box case . I will not sell anything less then 10 boxes at a time. And I will not break a case up so you can buy 10 or all 20 boxes. Price is $385 per case. Price is VERY FIRM , NO trades, NO lower offers. All emails with lower offers or offers to buy less then 10 boxes will be deleted ."
811,http://www.armslist.com/posts/2746811,For Sale/Trade:  LNIB FN Five-seveN MKII + ammunition,"Yukon, Oklahoma City, Oklahoma","$ 1,500","Listed On: Thursday, February 27, 2014",Handguns,FN Herstal S.A.                                                                                ,5.7x28mm                                                                                ,Striker Fire,no type,"Hi, up for sale/trade is a LNIB Five seveN MK2 in perfect condition. Comes with 3 mags, box, papers ect. Exactly 20rds have been fired for testing and sighting. 

Also comes with 200rds of SS197 ballistic tip V-max ammunition, and 100rds of SS195LF."
812,http://www.armslist.com/posts/2746812,For Sale:  Glock 36 w/ 5 magazines,"East County, San Diego, California",$ 525,"Listed On: Thursday, February 27, 2014",Handguns,Glock                                                                                ,45 ACP                                                                                ,Striker Fire                                                                                ,Pistol,"Powerful compact 45acp CCW choice
(5) 6 round magazines
Original Glock Case included
LOCAL only with San Diego FFL of your choice north of the 94/I8
You pay all fees.
Cash price is firm.

IF THIS LISTING IS STILL UP, IT IS AVAILABLE."
814,http://www.armslist.com/posts/2746814,For Sale:  new Keltec KSG latest version.,"Republic, Springfield, Missouri","$ 1,100","Listed On: Thursday, February 27, 2014",Shotguns,no type,12 Gauge                                                                                ,Pump Action                                                                                ,Shotgun,"Like title says new Keltec KSG latest version. $1100 cash.
Call 417_830-133eight"
815,http://www.armslist.com/posts/2746815,For Sale:  CZ-52 Pistol,"South side, Grand Rapids, Michigan",$ 260,"Listed On: Tuesday, March 4, 2014",Antique,no type,no type,no type,no type,I have a CZ-52 pistol in excellent shape.  Comes with 2 mags and one box of ammo.  Asking $260 obo.  No trades.  Local pick up.
816,http://www.armslist.com/posts/2746816,For Sale:  NEW NIB Century Arms Zastava PAP M70 Serbian AK-47,"Pensacola, Pensacola, Florida",$ 950,"Listed On: Thursday, February 27, 2014",Rifles,Century International Arms                                                                                ,7.62x39                                                                                ,Semi-automatic                                                                                ,Rifle,"New in box AK-47 PAP M70 from Century Arms International, # R12087-N. Made in the same factory that produced top quality rifles for former Yugoslavia like the M70B1 and M70AB2, the newly manufactured PAP rifles are the civilian version of the M70 series. These Serbian AK47 beauties are the latest imports from the world famous Zastava factory. In my opinion much cleaner, nicer looking rifles than the Century Romanian AK 47.

This rifle is the HI-CAP classic featuring a beautiful full wood stock, forend with a pistol grip. This is a very nice well-made rifle featuring a picatinny rail built into the receiver cover for easy mounting of your favorite optics and accessories, and a hammer forged barrel. It comes with two 30 rd metal magazines. Barrel: 16.25"" with a 1:10 twist; Overall length is 36.25""; Weight: 7.7 lbs.

Hit the buy it now button and I'll throw in 2 additional NEW 30 rd metal Romanian mags and SHIP IT FREE!

Shipping is $40 within the Continental US via FedEx Ground. We ship only to FFL’s.

Payment forms accepted are cashier’s check, money order."
817,http://www.armslist.com/posts/2746817,Want To Buy:  .221 Remington Fireball Brass and maybe ammo,"NW, Albuquerque, New Mexico",Offer,"Listed On: Saturday, March 22, 2014",Ammo,no type,no type,no type,no type,"Hello,  I'm looking to buy some Remington .221 Fireball Brass.  What do you have?  Call/Text Rick 5O5*6IO*529I"
818,http://www.armslist.com/posts/2746818,For Sale/Trade:  custom built rem 700,"meigs co, Chattanooga, Tennessee","$ 1,000","Listed On: Thursday, February 27, 2014",Rifles,Remington                                                                                ,300 Winchester Magnum                                                                                ,Bolt Action                                                                                ,Rifle,300 win mag sendero with knoxx stock tac bolt knob an muzzle break call or text only  REDACTED no scope
819,http://www.armslist.com/posts/2746819,For Sale:  Tiffany Blue Beretta Nano 9mm handgun with Stainless Steel colored slide,"South Bend, South Bend, Indiana",$ 500,"Listed On: Sunday, May 20, 2018",Handguns,Beretta USA                                                                                ,9mm Luger (9x19)                                                                                ,Double Action                                                                                ,Pistol,"***We ship our firearms nation wide where they are legal*** ***We do NOT charge credit card fees*** This item for sale is a NIB Tiffany Blue Beretta Nano 9mm pistol with stainless steel colored slide for $499.99 + tax if you are an Indiana resident (+ shipping if you are unable to come in to the store. We are an FFL operating out of South Bend Indiana and we ship all over the country.  We are located at 2604 S Main st. in South Bend Indiana and share a facility with Mark's Auto Care Center. If you're local, feel free to stop by! Our hours are M-F: 9am to 530pm and Saturday: 9am to 2pm. We care closed on Sunday. We are also certified DuraCoat re-finishers. We can professionally re-finish almost any firearm in our inventory or in yours with a variety of colors and camo patterns! Whether it be OD-green, FDE, hot pink, zebra stripe, your initials, or a variety of other options, we are the guys for the job! We provide a 5 year warranty on all of our finish work. Please visit us at www.tzarmory.com or www.facebook.com/tzarmory to check out our other firearms for sale and other firearm finishes that we've done!  The Beretta Nano is the ultimate evolution of the micro compact carry pistol. Utilizing a removable, serialized sub-chassis the Nano pistol can be easily modified with replaceable grip frames and is simple to disassemble and maintain. Ease of use and concealment were key drivers in the development of the Nano. The Nano’s extremely low profile, snag free design makes it easy to carry and draw from concealment. To accommodate right or left-handed use, the Nano’s magazine release button can be easily reversed. The light, durable, frame employs modern thermoplastic technology through the use of fiberglass reinforced technopolymer. The Nano’s sights are user adjustable with a 1.3mm hexwrench and your fingers. This allows anyone to adjust their sights without the assistance of a gunsmith. Modular structure, ergonomics and ease of use make the Beretta Nano the ideal firearm for concealed carry. Made in The U.S.A. Item # - JMN9S15 UPC_Code - 082442189543 Description - BTA BU-9 NANO 9MM PST B AS 6RD Manufacturer - Beretta Model # - BU-9 Nano Type - Semi-Automatic Pistol Finish - Tiffany Blue DuraCoated Stock - Textured Front Strap Sights - FT: Ramp RR: Adjustable for Windage Barrel Length - 3.07"" Overall Length - 5.63"" Weight - 17.67 oz Caliber - 9MM Capacity - 6+1 Action - Double Action Only # of Mags - 2 Receiver - Fiberglass Reinforced Technopolymer Additional Features - Reversible Magazine Release"
821,http://www.armslist.com/posts/2746821,For Sale:  Chinese type 56 sks,"Middletown, Cincinnati, Ohio",$ 350,"Listed On: Wednesday, March 5, 2014",Rifles,no type,7.62x39                                                                                ,Semi-automatic                                                                                ,Rifle,"Early Chinese military type 56 sks with matching numbers down to the piston rod.  It appears this rifle has scene some action do to wear on the butt stock from shouldering and tip of the barrel from bayonet being deployed.  All original parts, bore is in great shape. I've never shot it just cleaned the Cosmo off, but appears to be in great shooting condition.  Has bayonet attached and cleaning rod.  These are getting hard to find don't miss your chance to own a piece of early military history. Cash only  no trades text with offer REDACTED thnx"
823,http://www.armslist.com/posts/2746823,"For Sale/Trade:  Sig Sauer P220R ""Extreme"" ***SOLD***","Macon County, Asheville, North Carolina","$ 1,100","Listed On: Monday, March 10, 2014",Handguns,Sig Sauer                                                                                ,45 ACP                                                                                ,Double / Single Action                                                                                ,Pistol,"I have for Sale or Very Specific Trade one Sig Sauer P220R Extreme edition that is 9 months out of the factory and has less than 100 rounds down the pipe(you can see the lack of smileys in the 2nd picture). This Extreme edition comes from the factory with Siglite Night sights, Elite slide, Short reset trigger and G-mascus(G-10) Piranha grey/blk grips. I am including 7 Eight round Mec-Gar Magazines(They make Sig OEM mags) 5 are stamped Sig and 2 are stamped Novaks but all are made in Italy mec-Gars, A Sig-Tac paddle retention holster(unused) and a Sig CPL pistol laser. This is a Top of the Line/Premium pistol.  Lowball offers will be ignored!!! I cannot add boot so if it isn't a straight trade, I will have to decline politely.

I will sell the Gun with 2 mags/box/papers/lock as from the factory for $925"
