,url,title,location,price,post date,category,manufacturer,caliber,action,firearm type,postcontent
0,http://www.armslist.com/posts/2746000,For Sale:  11 Rounds - 41 SHORT RIMFIRE  ---  NAVY ARMS ( .41 Short Derringer ) Vintage Ammo,"San Diego, San Diego, California",$ 45,"Listed On: Wednesday, April 23, 2014",Ammo,no type,no type,no type,no type,"11 ROUNDS ....  41 Short Rimfire bullets , All copper casing with V head stamp , Vintage Factory production ammo.........NAVY ARMS , used in many derringers 

call REDACTED"
1,http://www.armslist.com/posts/2746001,For Sale:  Glock 36 with Night Sights,"Springdale, Fayetteville, Arkansas",$ 525,"Listed On: Thursday, February 27, 2014",Handguns,Glock                                                                                ,45 ACP                                                                                ,no type,Pistol,"I have a Glock 36, which is the single stack .45 auto (6+1) model. This is a generation 3 Glock, since the Glock 36 is not yet made in Gen 4. It comes with TruGlo Night Sights, original box, papers and three six round mags. This gun has only been fired 100 rounds and is in mint condition. I am a certified Glock Armorer, so the gun is maintained very well. I'm asking $525 firm and NO TRADES. Bill of sale to be completed. For info please text me at REDACTED"
2,http://www.armslist.com/posts/2746002,For Sale/Trade:  Ruger single six SS 22 lr  3 SCREW,"orlando, Orlando, Florida",$ 599,"Listed On: Thursday, February 27, 2014",Handguns,Ruger                                                                                ,22 Long Rifle                                                                                ,Single Action                                                                                ,Revolver,"ruger single six ss revolver 22 lr exc 599.00 trade 352 634 2o84 want 10 ft boat trailer plus cash

rare only came in 22 lr not 22 magnum cylinder"
3,http://www.armslist.com/posts/2746003,For Sale:  .380 ACP 100 RNDS.,"san antonio, NW, San Antonio, Texas",$ 29,"Listed On: Thursday, February 27, 2014",Ammo,no type,no type,no type,no type,TULAMMO .380 ACP FMJ STEEL CASE 91 GR. NON CORROSIVE BERDAN PRIMED
4,http://www.armslist.com/posts/2746004,For Sale:  ar 15 armalite m4 223   556,"laurel, Billings, Montana",$ 975,"Listed On: Thursday, February 27, 2014",Rifles,Armalite                                                                                ,223/5.56 NATO                                                                                ,Semi-automatic                                                                                ,Rifle,16 inch barrel very clean flat top text pics 855-5603
5,http://www.armslist.com/posts/2746005,"For Sale:  Marlin VRX 17 HMR, Heavy Barrel, Package Deal, Ready To Shoot","Burlington, Raleigh / Durham / CH, North Carolina",$ 480,"Listed On: Thursday, February 27, 2014",Rifles,Marlin                                                                                ,17 HMR                                                                                ,Bolt Action                                                                                ,Rifle,"Marlin VRX 17 HMR package deal, ready to shoot

Approximately $600 total invested.
Selling for $480.  Reasonable offers considered.  Cash only.  Absolutely NO TRADES considered.  Selling all together, will not separate items to be sold individually.

This is a highly accurate rifle.  See the photo of the 100 yd target below.  Tight groupings.  Could be even better with a much more steady shooter.  A total of approximately 200 rounds has been shot through this rifle.  Very consistent gun and taken well care of.

Bolt action .17 hmr caliber rifle with heavy bull barrel

Total Package Includes the following:
Rifle
Bushnell Scope - Fixed 3 Power
Bi-Pod - Blackhawk
Sling - Non-slip
Soft sided case
3 - seven rnd mags - Marlin
1 - four rnd mag - Marlin
700 rnds of mixed Hornady and Winchester ammo.  All brand new un-opened boxes.
All original papers and manuals included.

Conditions of sale will include buyer signing a bill of sale.  Willing to meet in Durham, Burlington, Graham, and Greensboro areas.  Please contact via the email link provided by Armslist."
6,http://www.armslist.com/posts/2746006,For Sale:  Mossberg 810A 30-06 with Tasco Scope,"Cottage Grove, Eugene, Oregon",$ 280,"Listed On: Thursday, February 27, 2014",Rifles,Mossberg                                                                                ,30-06 Springfield                                                                                ,Bolt Action                                                                                ,Rifle,Finish in good condition stock has some light scratches but in good shape overall. Jeweled bolt. Tasco Scope. Call or Text Chris 602-565-nine nine 2 zero
7,http://www.armslist.com/posts/2746007,For Sale:  2160 rds 5.45 russian surplus,"Topeka, Topeka, Kansas",$ 250,"Listed On: Thursday, February 27, 2014",Ammo,no type,no type,no type,no type,"I have 2160 of 7n6 surplus for sale or trade one spam can is unopened the other I have in a ammo can. I'm asking 250 or trade for ar15 parts, stocks,sights, stripped lowers,ect."
8,http://www.armslist.com/posts/2746008,For Sale/Trade:  1908 Colt Vest Pocket,"Roseville, Sacramento, California",$ 400,"Listed On: Thursday, February 27, 2014",Handguns,Colt                                                                                ,25 ACP                                                                                ,Double / Single Action                                                                                ,Pistol,"This Colt Vest Pocket dates to the 1912 era and appears to have been re-blued at one point in the last 102 years.  Tight action, unmarked mag and no real issues to note other then cosmetic wear to the finish. Overall, a pretty solid 1908 Colt.  Although a C&R, it must be transferred through a 01 FFL dealer pursuant to CA law."
9,http://www.armslist.com/posts/2746009,For Sale/Trade:  WTS/WTT Arsenal SLR-107FR plus extras,"Dallas, Dallas, Texas",$ 0,"Listed On: Wednesday, March 5, 2014",Rifles,no type,7.62x39                                                                                ,Semi-automatic                                                                                ,Rifle,"Looking to sell or trade an Arsenal SLR-107FR. Just purchased early this month. Rifle is clean with no scratches or marks. Asking $1050 for the rifle alone or $1400 for rifle, mags, and 500rds of high end brass and 400rds of Tula."
10,http://www.armslist.com/posts/2746010,For Sale/Trade:  Glock 19 package,"Northside, Evansville, Indiana",$ 650,"Listed On: Thursday, February 27, 2014",Handguns,Glock                                                                                ,9mm Luger (9x19)                                                                                ,no type,Pistol,"For Sale Glock 19 Gen 4 w Grip Inserts, Sub 500 rd round count, Triggers been reworked w a Glock Factory smooth trigger hand polished (desired pre MIM bar), NY1 trigger spring Hand Polished - connector Firing Pin Safety has been hand polished along w Firing Pin. Weapon has a nice smooth pull with limited take up and short reset, 3 week old (installed manu. 8/13 according to pkg) Truglo TFOs Yellow Rear Green Front , Comes w 3 Standard Capacity Mags, Blackhawk Serpa Holster and an Alienware Holster. Looking for 650.00 or trade for Sig P229 in 9mm FTF in or around Evansville In. for trade can ship on buyers dime. All factory parts included Serr. Trigger original Trigger Spring and Connector"
11,http://www.armslist.com/posts/2746011,Want To Buy:  SWR Specwar 7.62,"Orlando, Orlando, Florida",Offer,"Listed On: Thursday, February 27, 2014",NFA,no type,no type,no type,no type,I am looking to buy a SWR Specwar in 7.62. 5/8 x 24. I am also looking to  e file so if there are any dealers with the SWR in stock contact me. Does not have to be in Orlando.
12,http://www.armslist.com/posts/2746012,Want To Buy:  M1 Garand,"South-Western NH, New Hampshire, United States",$ 1,"Listed On: Thursday, February 27, 2014",Rifles,Springfield                                                                                ,30-06 Springfield                                                                                ,Semi-automatic                                                                                ,Rifle,I'm interested in purchasing an M1 Garand in good working condition. I would like to spend less than 1000 and am really looking for a shooter in the low-mid 800's. Let me know what you have. Thanks!
14,http://www.armslist.com/posts/2746014,For Sale/Trade:  Kassnar .410 *Excellent Condition*,"Kenosha, Oak Creek, Racine, Wisconsin",$ 175,"Listed On: Thursday, February 27, 2014",Shotguns,no type,410                                                                                ,Break Open                                                                                ,Shotgun,This .410 break action shotgun would be perfect for the young hunter. The single barrel clean action makes learning to use a firearm a fun experience. The honey stock is a unique feature that makes this a rare find.
15,http://www.armslist.com/posts/2746015,For Sale:  Romanian Sar1 AK-47 w/xtra Mags and Ammo,"Warren,  Mi, Detroit, Michigan","$ 1,200","Listed On: Thursday, February 27, 2014",Rifles,no type,7.62x39                                                                                ,Semi-automatic                                                                                ,Rifle,"New never used Romanian Sar1 AK-47 semi auto..with ATI stock...7 steel 30rd mags Made in Bulgaria. ..
2 Tapco 30rd Mags...1 steel 10rd Mag...39 boxes of steel Ammo...42 boxes of Brass Ammo...also includes 
Original wood stock and side scope attachment... $1200 Cash only and No trades.."
18,http://www.armslist.com/posts/2746018,"For Sale:  CTC Lasergrips (S&W K/L Frame, Round Butt)","Murfreesboro, Nashville, Tennessee",$ 120,"Listed On: Thursday, February 27, 2014",Gun,no type,no type,no type,no type,"Up for sale are a set of used model# LG308 Crimson Trace Lasergrips for K and L frame round butt model Smith & Wesson revolvers. The grips are in very good condition. No box or papers - only grips, screws, and a set of batteries.

Price is $120 in the Murfreesboro area or buyer pays shipping.

Not an actual photo but they are the same model."
20,http://www.armslist.com/posts/2746020,For Sale:  Kimber m96 6.5x55SE,"Charles county, Maryland, United States",$ 450,"Listed On: Thursday, February 27, 2014",Rifles,Kimber                                                                                ,6.5x55 Swedish                                                                                ,Bolt Action                                                                                ,Rifle,Priced to sell or trade . Very nice condition. All matching numbers. Extremely accurate. Willing to trade for. 308 win or. 270 win. James (301) 609-0821. Price is firm.
21,http://www.armslist.com/posts/2746021,For Sale:  Kel Tec P11 9mm,"Denton, Dallas, Texas",$ 180,"Listed On: Thursday, February 27, 2014",Handguns,Kel-Tec                                                                                ,9mm Luger (9x19)                                                                                ,Double Action                                                                                ,Pistol,"Kel Tec P11 9mm
This gun is well used, but is still reliable.
9 MM LUGER - 10 ROUND CAPACITY 
ONE FACTORY MAGAZINE INCLUDED 
BLACK FRAME AND GRIPS 
BLUED FINISH SLIDE 
BARREL LENGTH 3.1"" 
OVERALL LENGTH 5.85"" 
FIXED FRONT SIGHT - ADJUSTABLE REAR SIGHTS 
THE KEL TEC P 11 IS A VERY POPULAR CHOICE FOR CCW 



BUYER IS RESPONSIBLE FOR ENSURING COMPLIANCE WITH YOUR OWN STATE & LOCAL FIREARM LAWS."
23,http://www.armslist.com/posts/2746023,For Sale:  AR15 NEVER FIRED DPMS WILL ALL accessories,"Cabot, Little Rock, Arkansas",$ 900,"Listed On: Wednesday, March 5, 2014",Rifles,DPMS                                                                                ,223/5.56 NATO                                                                                ,Semi-automatic                                                                                ,Rifle,"Nit a shot fired still has book And manual.  AIM 1.5 -6 - 4.30 tactical scope.   high stress laser under first Magellgrip rigged switch to turn on when picked up.   AIMSHOT CRee 500 Lumen LED tactical light to make it even easier should an intruder enter.   Front Quadrail Grip so it can't be taken during a struggle.    Comes with three 30 round mags And one 40.
Fires both 5.56/.223 NATO round

Please look at my other listings you may like"
27,http://www.armslist.com/posts/2746027,For Sale:  bolt action .22 rifle + Ammo,"Harford county, Baltimore, Maryland",$ 200,"Listed On: Thursday, February 27, 2014",Rifles,Savage Arms                                                                                ,22 Long Rifle                                                                                ,Bolt Action                                                                                ,Rifle,Savage arms model 120 .22 single shot bolt action rifle. Nice little rifle comes with 3 boxes of ammo ready to shoot today! It is accurate and very fun to shoot. The box of federal ammo is opened but it is only missing like ~30 rounds. Everyone needs a .22 rifle
28,http://www.armslist.com/posts/2746028,For Sale:  Lnib H&k 45c da/sa,"Plano, Dallas, Texas",$ 950,"Listed On: Thursday, February 27, 2014",Handguns,Heckler & Koch                                                                                ,45 ACP                                                                                ,Double / Single Action                                                                                ,Pistol,"Was given to me as a gift, ran 1 box of ammo through it and put it back in the safe. Want to sell or trade for a glock 10mm sf or gen 4 + extras/ammo/cash.  Make an offer, worst I can say is no. Trigger is a very smooth/crisp double/single action with decocker. Comes with 2 mags, factory box and paperwork"
29,http://www.armslist.com/posts/2746029,For Sale:  bushmaster ar 15,"laurel, Billings, Montana","$ 1,200","Listed On: Thursday, February 27, 2014",Rifles,Bushmaster                                                                                ,223/5.56 NATO                                                                                ,Semi-automatic                                                                                ,Rifle,Flat top 20 inch semi heavy sportsman barrel flash hider 30 rd mag text pics 855-5603  very good condition optics ready
30,http://www.armslist.com/posts/2746030,For Sale/Trade:  Keltec P11 and Springfield XDM9 4.5,"Ingleside, Chicago, Illinois",$ 800,"Listed On: Thursday, February 27, 2014",Handguns,Springfield                                                                                ,9mm Luger (9x19)                                                                                ,Double Action                                                                                ,Pistol,"I'm looking to sell my Keltec P11 for $300 and my Springfield XDM9 for $500. They are both mint condition and almost new. I polished the barrels on both guns, but the Keltec P11 has polished trigger bar also. Keltec P11 comes with the factory box, mag, lock and 2 extra hi cap mags also. The Springfield XDM9 will come with the factory box, mags, mag loader, holster, lock and a DPM Systems Technology mechanical recoil reduction system. Must have valid foid card and must meet in person REDACTED"
31,http://www.armslist.com/posts/2746031,For Sale:  NEW 5.56/.223 AR15 MANY EXTRAS $1799.00 O.B.O.,"UKIAH, California, United States","$ 1,799","Listed On: Thursday, February 27, 2014",Rifles,no type,223/5.56 NATO                                                                                ,Semi-automatic                                                                                ,Rifle,"FOR SALE NEW AR-15 5.56/.223CAL. $1799.00 O.B.O. UKIAH CA

NEW 
UPPER MANUFACTURED BY RGUNS, 3X9X50 BURSKA SCOPE, RED/GREEN DOT SIGHT, TACTICAL FLASHLIGHT, SIX POSITION ADJ. BUTTSTOCK, AERO PRECISION LOWER MANUFACTURED FOR SURPLUS GUNS & AMMO. BULLET BUTTON INSTALLED FOR CA COMPLIANCE. PRICED TO SELL AT $1799.00 O.B.O. 

I ACCEPT: PAYPAL, CASH, MONEY ORDER OR CHECK (CHECKS MAY TAKE UP TO 10 BUSINESS DAYS TO CLEAR). SHIPPING & PACKAGING $50.00 IN THE 48 STATES. SHIPS IMMEDIATELY UPON CLEARED PAYMENT.
REDACTED
THANKS.
DEAN"
32,http://www.armslist.com/posts/2746032,For Sale/Trade:  Para-Ordnance 14.45 *Excellent Condition*,"Kenosha, Oak Creek, Racine, Wisconsin",$ 900,"Listed On: Wednesday, March 5, 2014",Handguns,Para Ordnance                                                                                ,45 ACP                                                                                ,Single Action                                                                                ,Pistol,"This Para-Ordnance 14.45 is a great looking and fun shooting piece. It comes with the original box and two mags, one of which is still in its original packaging. The double stack mag fits snugly into the still comfortable, yet expanded magwell. With a 14+1 .45 ACP, you should be able to take care of business without ever reloading. Those soda cans don't stand a chance!"
34,http://www.armslist.com/posts/2746034,For Sale:  Kimber m96 6.5x55 SE,"Charles county, Maryland, United States",$ 450,"Listed On: Thursday, February 27, 2014",Rifles,Kimber                                                                                ,6.5x55 Swedish                                                                                ,Bolt Action                                                                                ,Rifle,Priced to sell or trade . Very nice condition. All matching numbers. Extremely accurate. Willing to trade for. 308 win or. 270 win. James (301) 609-0821. Price is firm.
35,http://www.armslist.com/posts/2746035,For Sale/Trade:  Kimber pro carry 2 with new Wilson combat mags,"Auburn, Montgomery, Alabama",$ 950,"Listed On: Thursday, February 27, 2014",Handguns,Kimber                                                                                ,45 ACP                                                                                ,Single Action                                                                                ,Pistol,Have the pro carry 2. Gun has the bull barrel and looks amazing except for 2 very small scratches on the bottem in front of the trigger guard. It would be about 20 bucks to get a touch up kit and cover them. But I am a obsessive about my guns so i will give you 2 unopened Wilson combat mags. 35 to 40 bucks a piece to make up for that. So that's 80 bucks trade value to make up for the mental anguish of a small scratch on this baby. That last pic shows it. This means I am only adding one extra mag into the asking price or trade value. Name is Phillip. You can txt or call me at REDACTED.
36,http://www.armslist.com/posts/2746036,For Sale:  1100 rds 22 lr 22lr 17 hmr 22 mag,"reno, Reno, Nevada",$ 180,"Listed On: Thursday, February 27, 2014",Ammo,no type,no type,no type,no type,"Have some 17 hmr, 22mag, 22lr. 
Think i have some 22 id sell 
mostly cci so its not really going to be cheap bulk boxes. 

I have 3 cci 100 packs of mini mag that are 1240fps
I have 2 boxes of 300 which are 1200fps and 1240fps
1 box of 22 mag winchester 
1 box of 17hmr federal
1 box of Winchester 100 pack 

I'm not going to break it up, need it all gone.

looking to get whats there"
37,http://www.armslist.com/posts/2746037,For Sale:  remington 7400,"east, Oklahoma City, Oklahoma",$ 450,"Listed On: Thursday, February 27, 2014",Rifles,Remington                                                                                ,270 Winchester                                                                                ,Semi-automatic                                                                                ,Rifle,"remington 7400 

270 win.  scope and one mag"
38,http://www.armslist.com/posts/2746038,For Sale/Trade:  Ruger 1022 vintage model carbine,"Albany, Corvallis / Albany, Oregon",$ 275,"Listed On: Thursday, February 27, 2014",Rifles,Ruger                                                                                ,22 Long Rifle                                                                                ,Semi-automatic                                                                                ,Rifle,Built in 73 with desired walnut sporter stock...with BSA red dot and older Japan model Bushnell Banner 4x scopes. Two 25 round mags and soft case. Not bad shape for being over 40 years old but it is used. Will consider trades for other gun or scope
39,http://www.armslist.com/posts/2746039,For Sale/Trade:  Khar CW40 and 10oz of Silver,"North West, Houston, Texas",$ 500,"Listed On: Thursday, February 27, 2014",Handguns,Kahr                                                                                ,40 S&W                                                                                ,Double Action                                                                                ,Pistol,"I'd like to trade my Khar CW40 and 10oz silver bar for  something else. 
About the Khar: It's a nice gun with minimal wear chambered in .40 caliber.  It will come with two 6 round magazines, a Galco leather holster, and possibly 100< rounds of ammunition. 

The silver is a standard 10oz bar. It is still in it's plastic wrapper and can be verified legitimate with a quick google search for ""year of the snake 2013 silver bullion"" 
Here is one such link; http://www.austincoins.com/offer/2013-Year-of-the-Snake-Silver-Bullion-Bars-10-oz/16289

I'd like to trade for a larger frame high capacity handgun like a glock, XD, stuff like that. I'm also interested in semi automatic rifles. That being said,I'm open to all offers and it doesn't hurt to ask! 
I can be reached at; seven one three-560-eighty six zero four"
40,http://www.armslist.com/posts/2746040,For Sale/Trade:  Canik 55 TP 9mm with extar,"charlestown, Indiana, United States",$ 500,"Listed On: Thursday, February 27, 2014",Handguns,no type,9mm Luger (9x19)                                                                                ,no type,Pistol,"I have a OD green Canik 55 MDL TP 9mm. Its a nice gun never fired expect for the test fire. It feels great in my hand. I can't say anything bad about it.

it comes with 2 17 count mags, a canik speed loader, cleaning kit, a canik gun hostler with 2 different straps, 50 rounds blazer brass ammo, 25 critical defense hornady ammo, and gun case. Can't load pic from my phone but have them ready just ask

can email me or text me at REDACTED text first don't have a lot of minutes asking 500 obo ad will be delete when sold"
41,http://www.armslist.com/posts/2746041,For Sale:  Sig Sauer .22 Mosquito Excellent Condition w/Extra Mag & Ammo,"Denver, Denver, Colorado",$ 295,"Listed On: Thursday, February 27, 2014",Handguns,Sig Sauer                                                                                ,22 Long Rifle                                                                                ,no type,Pistol,"I have a Sig Sauer Mosquito  and extras I would like to sell. Best price to sell fast. 

Sig .22 
2 mags
100 Blazers
100 CCI Mini Mags

Must be at least 21 years old, have a valid Colorado Drivers License and be legally able to purchase and own a firearm. Buyer pays transfer fee through FFL.

Call or Text
REDACTED"
42,http://www.armslist.com/posts/2746042,For Sale:  LMT AR Pistol Loaded with extras,"Tacoma/Olympia, Southwest Washington, Washington","$ 1,100","Listed On: Thursday, February 27, 2014",Rifles,LMT                                                                                ,223/5.56 NATO                                                                                ,Semi-automatic                                                                                ,Rifle,"Factory Built LMT 10.5"" Pistol Upper w/ Daniel Defense Lite 9.0 Rail
SAA Factory Built Lower w/ stage 2 trigger

Extras:
PWS FSC 556 Compensator
Magpul Gen2 Mbus Sights
Bushnell TRS-25 Red Dot Sight and Riser Mount
Hogue Pistol Grip
Ergo Rail Covers
3 Position Foregrip
Sling Mount End Plate
250 Lumen Cree4 Tactical Light and Mount 
1 30 Pmag"
43,http://www.armslist.com/posts/2746043,For Sale:  Winchester ''1897'' long barrel shotgun,"Downtown, Grand Forks, North Dakota",$ 300,"Listed On: Thursday, February 27, 2014",Antique,no type,no type,no type,no type,"I have here a beautiful Winchester 1897 long barreled 12 gauge shotgun.  I have owned this shotgun for many years but only every fired it once to confirm that it worked.  It cycles shells flawlessly and seems to be in fine mechanical shape.  It appears as though the receiver body was repaired at one point (not sure) so I included close-ups of the area.  The wood furniture is beautiful with only light signs of use.  For more pictures please visit (http://www.flickr.com/photos/61262140@N06/sets/REDACTED2599813/).  I only accept cash and require to see a state-issued ID to record a few details for my own records.  The transaction will be conducted in the parking lot of either Cabelas or Scheels of Grand Forks/East Grand Forks.  Sale is final.  Please email or text only, I cannot answer my phone at work."
