,url,title,location,price,post date,category,manufacturer,caliber,action,firearm type,postcontent
497,http://www.armslist.com/posts/1421497,For Sale:  Remington 597 VTR .22,"Tampa, Tampa/St. Pete, Florida",$ 525,"Listed On: Monday, April 8, 2013",Rifles,Remington                                                                                ,22 Long Rifle                                                                                ,Semi-automatic                                                                                ,Rifle,"I have a new, never been fired Remington 597 vtr. It has a strap, red dot scope, collapsible stock, nickel teflon plating, black matte finish, 10 rd magazine, 2 25rd banana clips and 1000 rds of .22lr hollow points. Asking $525 or best offer."
498,http://www.armslist.com/posts/1421498,For Sale:  Ruger Mini 14 .223,"Streetsboro Ohio, Buckeye Firearms, Cleveland, Ohio",$ 950,"Listed On: Monday, April 8, 2013",Rifles,Ruger                                                                                ,223/5.56 NATO                                                                                ,Semi-automatic                                                                                ,Rifle,"Brand New Ruger Mini 14s in .223 stocked at Buckeye Firearms in Streetsboro Ohio! Please stop by or give us a call, REDACTED, Buckeye Firearms 9225 State Route 14, Streetsboro Ohio 44241 right next to Taco Bell!"
499,http://www.armslist.com/posts/1421499,For Sale/Trade:  new CRIMSON TRACE GRIPS  J FRAME,"cuyahoga falls, Cleveland, Ohio",$ 125,"Listed On: Monday, April 8, 2013",Optics,no type,no type,no type,no type,new in box crimson trace lazer grips
501,http://www.armslist.com/posts/1421501,For Sale/Trade:  four colt ar-15 mags,"central, Wichita, Kansas",$ 25,"Listed On: Monday, April 8, 2013",Magazines,no type,no type,no type,no type,All four are in great shape. Haven't been used In at the last 35 year's.  Cash or trade. Make an offer. I'm now told that they are 10 or probably 15 round mags. 100 bucks for the four.
502,http://www.armslist.com/posts/1421502,For Sale:  NEW REMINGTON MODEL 597 W/ SCOPE 3-9X32 WITH CLIP HOLDS 10 RDS.,"Bethany, Oklahoma City, Oklahoma",$ 265,"Listed On: Monday, April 8, 2013",Rifles,Remington                                                                                ,22 Long Rifle                                                                                ,Semi-automatic                                                                                ,Rifle,"NEW REMINGTON MODEL 597 W/BULL BARREL AND FREE FLOATING,22 LR. ALSO SCOPE 3-9X32. VERY CLEAN BLACK ALL OVER. JEFF REDACTED.  ON TECHS PLEASE"
503,http://www.armslist.com/posts/1421503,For Sale:   FNH Five SeveN FDE w/ 2 10rd mag ext. plus 450rds,"MA, Western Iowa, Iowa","$ 1,100","Listed On: Monday, April 8, 2013",Handguns,FN Herstal S.A.                                                                                ,5.7x28mm                                                                                ,Double Action                                                                                ,Pistol,"FN Five-SeveN FDE (flat dark earth) pistol with 3 factory mags plus 2 10rd mag ext. Plus 450 rds. - 300rds of SS195 L.F. and 150rds of SS197.... its has been fired for 20 rds .The gun is in a great condition . Only serious buyer can contact me ,please no trading"
504,http://www.armslist.com/posts/1421504,For Sale:  browning hi power captain model,"natchez ms, South West Mississippi, Mississippi","$ 1,000","Listed On: Monday, April 8, 2013",Handguns,Browning                                                                                ,9mm Luger (9x19)                                                                                ,Single Action                                                                                ,Pistol,browning hi power captain model like new with two 10 rd mags
505,http://www.armslist.com/posts/1421505,For Trade:  snowmobile,"arvada, Colorado, United States",Offer,"Listed On: Monday, April 8, 2013",Farming,no type,no type,no type,no type,1996 Polaris Indy Lite GT 340cc 2 up with rack. missing windsheild need the carbs clean (old gas) got it to run for a short time
506,http://www.armslist.com/posts/1421506,For Sale/Trade:  45acp hardball...   300 rounds,"newark, Columbus, Ohio",$ 150,"Listed On: Monday, April 8, 2013",Ammo,no type,no type,no type,no type,Freezer bag full of 45acp...   230 grain hardball...   Factory rounds...   No reposed..  is a mix of ppu winchester and federal...  300 rounds...  Really would like a fair trade for 22lr here in Newark...   Cash works to...   150 dollars or best offer...
507,http://www.armslist.com/posts/1421507,For Sale/Trade:  Browning Citori 12 O/U,"Montgomery, Montgomery, Alabama","$ 1,000","Listed On: Tuesday, May 7, 2013",Shotguns,Browning                                                                                ,12 Gauge                                                                                ,Over and Under                                                                                ,Shotgun,Browning Citori 12 O/U Hunting Model Grade 1 30 inch barrels with invector chokes. 1000 cash price is firm.
508,http://www.armslist.com/posts/1421508,For Sale/Trade:  Brand new Ar 15 carbine hand guard  and m4 adjustable butt stock.,"West side of green bay, Green Bay, Wisconsin",$ 20,"Listed On: Monday, April 8, 2013",Gun,no type,no type,no type,no type,Black carbine carbon hand guard. And a black m4 style adjustable butt stock. Will take cash offers. Prefer trades.
510,http://www.armslist.com/posts/1421510,For Trade:  Glock G19 Gen4 with Trijicon Night Sites,"Chattanooga, Chattanooga, Tennessee",Offer,"Listed On: Monday, April 8, 2013",Handguns,Glock                                                                                ,9mm Luger (9x19)                                                                                ,Striker Fire                                                                                ,Pistol,"I have a Glock 19 Gen4 with Trijicon night sites for trade only.

Three(3) 15 round mags

Everything from the factory

Excellent condition.

Excellent condition!!!"
511,http://www.armslist.com/posts/1421511,For Trade:  TAURUS JUDGE,"North, Minnesota, United States",Offer,"Listed On: Monday, April 8, 2013",Handguns,Taurus                                                                                ,45 Long Colt                                                                                ,Double / Single Action                                                                                ,Pistol,"Taurus Judge for trade has lower tactical rail very low round count 
Looking to trade for full size 9mm of equal or grater value 
Text or email REDACTED
FNX
FNH hammer fire 
PPQ
Tactical M&P"
512,http://www.armslist.com/posts/1421512,For Sale:  WOLF 7.62 X 39MM 123G FMJ AMMO - 800 ROUNDS,"Jackson, Jackson, Mississippi",$ 285,"Listed On: Monday, May 6, 2013",Ammo,no type,no type,no type,no type,"$285 for the entire lot of 800 rounds of Wolf 7.62 x 39mm 123 grain FMJ. This ammo is steel cased and non corrosive. It is manufactured in Russia. It comes in 40 factory sealed boxes containing 20 rounds each. I will split into smaller lots if needed.

Prefer local face to face cash deal. Contact me if you are interested in shipping. I will not ship to Hawaii, Alaska, internationally, or any other state where restrictions apply.

By contacting me to purchase this ammunition you are stating that you are of legal age (18 years of age in most jurisdictions) and your receipt and/or possession of this ammunition is lawful. The buyer is solely responsible for compliance with any and all laws regulating this item(s)."
513,http://www.armslist.com/posts/1421513,For Trade:  30rnd ar15 mags for ak47 mags,"colorado springs, Colorado Springs, Colorado",Offer,"Listed On: Monday, April 8, 2013",Magazines,no type,no type,no type,no type,I have some ar15 mags i'd like to swap for ak47 mags I don't care how many they hold if you have some just reply to my ad thanks alot
514,http://www.armslist.com/posts/1421514,For Sale:  Rare DWM Commercial Suel Kreighoff with grip and lever safety.,"South of Menomonie, Eau Claire, Wisconsin","$ 7,000","Listed On: Monday, April 8, 2013",Handguns,no type,no type,no type,no type,Weapon was determined to be authentic by Julia Auction House 3 years ago after it ran it through a NRA check.  Bought the weapon in 2001 for 7500 plus tax. Is only one known to have the factory grip safety in circulation now. weapon is in fine condition. Serial numbers match. Pictures available upon request
515,http://www.armslist.com/posts/1421515,For Sale:  Sig Sauer P238 BNIB W/Laser &1000 rds of ammo,"grove city, Columbus, Ohio","$ 1,000","Listed On: Monday, April 8, 2013",Handguns,Sig Sauer                                                                                ,380 ACP                                                                                ,Double / Single Action                                                                                ,Pistol,Have a brand new in box Sig P 238 for sale with over 1000 rds of ammo and 3 mags and holster will not separate and only ftf sales.Must be an Ohio resident the ammo is misc.
516,http://www.armslist.com/posts/1421516,For Sale:  Smith & Wesson 581 -Nickel- 4 Inch 357 Mag,"North dakota, North Dakota, United States",$ 400,"Listed On: Monday, April 8, 2013",Handguns,Smith & Wesson                                                                                ,357 Magnum                                                                                ,Bolt Action                                                                                ,Revolver,"A very nice S&W 581, beautiful nickel finish, 4 inch barrel, square notch rear sight and ramp front sight, ,,Distinguished Service Magnum,, no nicks or dings"
517,http://www.armslist.com/posts/1421517,For Sale:  1984 Factory 26 SKS rifle,"Holland, Southside- Laketown twp, Grand Rapids, Michigan",$ 375,"Listed On: Monday, April 8, 2013",Rifles,Norinco                                                                                ,7.62x39                                                                                ,Semi-automatic                                                                                ,Rifle,"I have a veteran ( excellent condition) sks rifle for sale.  All matching numbers, bayonet, cleaning kit in base of stock, sling is all original.  Good shooter, bluing in great condition.  Local sales to Holland , Mi area only.  No travel or shipping.
Thanks for looking ***** SOLD PENDING PICKUP *****"
518,http://www.armslist.com/posts/1421518,For Sale:  Glock Model 20 Pistol Gen. 3 (10mm),"Middleton, Boise, Idaho",$ 495,"Listed On: Monday, April 8, 2013",Handguns,Glock                                                                                ,10mm                                                                                ,Striker Fire                                                                                ,Pistol,"Here we have a gently used Glock Model 20 Pistol (10mm). This pistol comes with two 15 rd. magazines and is in great shape.

3% additional fee for credit card transactions.
We will ship out of state to FFL Dealers.

Make sure you check your State & Local laws before committing to buy an item.
It is your responsibility to know if a firearm is compliant with your state laws. We will not accept returns on weapons that end up being non-compliant in your state.

We will not ship high capacity magazines to Ca; HI; South Bend, IN; MD; NJ; NY; D.C.; CT; CO or MA.

MID*STAR FIREARMS
JKD Professional Gunsmithing and Sales
8390 Highway 44
Middleton, Idaho 83644
REDACTED
REDACTED	
FFL Dealer
Located between Star and Middleton on Highway 44.
Now selling Hunting and Fishing Licenses.
Over 400 new and used guns in stock.
NOW OPEN MONDAY'S!!!
Hours: Monday-Friday  10am to 6pm
Saturday 10am to 5pm
Closed Sunday."
519,http://www.armslist.com/posts/1421519,For Sale:  AR-15 30rd Magazines *New*,"Blythewood, Columbia, South Carolina",$ 15,"Listed On: Monday, April 8, 2013",Magazines,no type,no type,no type,no type,"I have 4, new in the plastic, AR-15 aluminum magazines."
520,http://www.armslist.com/posts/1421520,For Sale:  winchester 22 lr,"littleton, Denver, Colorado",$ 55,"Listed On: Monday, April 8, 2013",Ammo,no type,no type,no type,no type,500 rnd Winchester xpert.hv  38 grain $55.00
521,http://www.armslist.com/posts/1421521,"For Sale:  Sig Sauer P220 .45 w/ 2 mags, 2 polymer holsters","Near Downtown, Colorado Springs, Colorado",$ 850,"Listed On: Friday, April 12, 2013",Handguns,Sig Sauer                                                                                ,45 ACP                                                                                ,Double / Single Action                                                                                ,Pistol,"I bought this one a few years ago, but recently purchased a more concealable 9mm.  I hate to see this one go, my only .45, but right now it just sits around and gets no carry time.  Runs perfectly, never had a jam.  $850 obo.  Serious inquiries please.  Note, I am not sure if I still have the manual.  But I believe you can get them on-line for free from Sig.  Comes with two mags, 2 polymer holsters, and hard case that could use additional padding,but fine for storage."
522,http://www.armslist.com/posts/1421522,For Sale:  Utah Non-resident Concealed Weapons Permit - $100 (Horry/Georgetown),"Horry,Georgetown, Myrtle Beach, South Carolina",$ 100,"Listed On: Monday, April 8, 2013",Handguns,no type,no type,no type,no type,"Utah Non-resident Concealed Weapons Permit - $100 (Horry/Georgetown)
 The Utah Non-Resident Concealed Weapons Permit allows you to carry in 36 states in conjunction with your South Carolina Permit!! It is the best way to maximize your concealed carry abilities and travel anywhere south of Maryland and east of Colorado without restriction! This permit in conjuction with your South Carolina CWP allows you to carry you weapon concealed in Georgia, Mississippi, Alabama and Pennslyvania, which you South Carolina permit alone does not allow.
 FACTS:
 You DO NOT have to be a resident of Utah to get the permit
 We teach these classes in the Myrtle Beach area
 The class is 4 hours long and requires no shooting and no test
 The permit is valid for 5 years
 We do the fingerprinting and required passport photo in the class so you don't have to go get it done at extra expense!!
 Since there is no shooting, we can teach the class anywhere! Call us and we'll get a group together in your area.
 Utah does not reciprocate with South Carolina so you still need to get your South Carolina Permit to carry in SC.

The cost of the class is $100 and includes your fingerprinting, passport photograph required by the State of Utah, the class and certification stamp. An additional $51 application fee is required to be sent with the packet to the State of Utah either by credit card or check (yes they accept personal checks).
 Please call REDACTED or REDACTED with questions or go to our website at Shooting-Solutions.com"
523,http://www.armslist.com/posts/1421523,For Trade:  ruger .380 lcp,"rochester, Rochester, New York",Offer,"Listed On: Monday, April 8, 2013",Handguns,Ruger                                                                                ,380 ACP                                                                                ,Single Action                                                                                ,Pistol,like new willing to trade for 9mm comes with holster box and everything it came with new
524,http://www.armslist.com/posts/1421524,For Sale:  Ruger Mini 14 .223 Stainless Finish,"Streetsboro Ohio, Buckeye Firearms, Cleveland, Ohio","$ 1,000","Listed On: Monday, April 8, 2013",Rifles,Ruger                                                                                ,223/5.56 NATO                                                                                ,Semi-automatic                                                                                ,Rifle,"New Ruger Mini 14s in .223 with stainless steel finish in stock at Buckeye Firearms in Streetsboro Ohio! Please stop by or give us a call, REDACTED, Buckeye Firearms 9225 State Route 14, Streetsboro Ohio 44241 right next to Taco Bell!"
526,http://www.armslist.com/posts/1421526,"For Trade:  APPLE Products - 64gb IPAD, 8gb IPOD Touch, 8gb Ipod NANO Watch","Southwest, Portland, Oregon",Offer,"Listed On: Monday, April 8, 2013",Miscellaneous,no type,no type,no type,no type,"I have a new (no box) 64gb IPAD with Wifi for trade.  This was a gift (i already have one) and I have no need for it.  It comes with a blue magnetic cover that doubles as a stand. $450

IPOD Touch (4th Gen) White - 8gb - $150

IPOD Nano Watch - Red Nano with an all black aluminum watchband.  It completely encases the IPOD while still allowing access for the charger, as well as access to the buttons. Screen is in perfect condition, what you see in pictures is dust -  $250

I would like to trade any of these (or all of them) for a pistol, however would consider rifles too.  I am also willing to throw in cash if needed for the right deal.

Pistols that I would like to trade it for (however I am open to any offer):

Beretta 92f (blued, non-shiny)
Sig Mosquito
Glock (9mm, .40, .357)

Not interested in revolvers

I am out of the state until Saturday 4/13 so feel free to email offers and I will respond as quickly as possible.  I am willing to travel for the right deal."
527,http://www.armslist.com/posts/1421527,"Want To Buy:  Jennings, Jimenez, phoenix, raven, bryco, iver johnson, erma, excam, etc.. .22, .380, .25","Muskogee, Oklahoma, United States",Offer,"Listed On: Thursday, May 16, 2013",Handguns,no type,no type,no type,Pistol,"THIS IS WANTING TO BUY.....NOT FOR SALE. I have several different guns to trade. Looking for any caliber. It can be broken or just a parts gun or a good shooter. It can be any of the pistols above or ones like it. Any make, model, or caliber. TEXT ONLY.......REDACTED"
528,http://www.armslist.com/posts/1421528,For Sale/Trade:  remington 721- reach out and touch somebody,"westminster, Colorado, United States",$ 500,"Listed On: Monday, April 8, 2013",Handguns,Remington                                                                                ,no type,Bolt Action,no type,"From 1921 up to WWII, Remington made sporting rifles (the Model 30 and variations) using Model 1917 receivers and parts left over from WWI production. They made only such parts as they had to. At the end of WWII, they decided that the M1917 ploy had about run its course. Even though they used some tricks to disguise the origin of the rifles, customers were aware that they were buying what was essentially a warmed over military rifle.

So they turned their engineers and designers, including the famous Mike Walker, loose with blank sheets of paper. The result was not one, but two rifles, the standard length 721 and the short action 722. The 722 was released with a brand new cartridge, the famous ""triple deuce"", the .222 Remington, from which came a whole slew of cartridges, including the military 5.56mm, aka the .223 Remington.

The 721/722 rifles were made to be affordable, a contrast to the Winchester 70, famed as the ""Rifleman's Rifle"" but quite expensive. The result of the desire to keep the price down was that the rifles were plain. While special treatment, even engraving and inlay, was available, the standard rifles had no checkering, trigger guards were stamped steel, and so on.

But they shot and shot well. A lot of owners wanted to upgrade, and for a while gun shops had bins full of take off stocks, replaced by better grade custom stocks. Eventually, Remington got the word and, using the same basic action, produced the Model 700, now I believe the best selling CF sporting rifle in the world.

There is a sad sidelight to the Remington success story. Winchester (Olin) was unable to admit that it was losing sales to Remington and began to focus on military surplus rifles as the source of their economic woes. So they persuaded Senator Tom Dodd, of CT, father of the current CT senator Chris Dodd, to include a ban on military surplus imports in his Gun Control Act of 1968, not hard to do after JFK was killed with a surplus rifle. In a nasty example of special interest lobbying, Winchester's attorneys even wrote that part of the law. There were hints that Dodd received more than thanks and campaign support, but nothing was ever proven.

i have a remington 721 30-06 bolt action rifle. has been fully taken down , cleaned meticulously cared for!! it is a safe queen! i have fired it and with my burris scope i am able to hit a pop can at 479 yards....... 

bore mint! wood minty! all metal is free of rust or pitting! all mechanisms show very minimal wear. i will include one box of barnes factory ammunition with er. 
$500 cash takes er, or a trade for a nice pistol
looking for
s&w 
ruger
glock
cz  

just let me know what you may have, worst i can say is no.
call or text gets me quickest but email is ok too.  720 620 78 84
bill of sale or peek at your permit or valid cdl . 
AFTER JULY 1ST THIS RIFLE WILL NO LONGER BE AVAILABLE, UNLESS YOU CARE TO DO AN FFL TRANSFER. .........
I WILL SHIP FROM MY FFL FROM MINE TO YOURS, WE CAN SPLIT THE SHIPPING.

NO PAYPAL, CHECKS OR  MONEYGRAMS.. CASH OR POSTAL OFFICE MONEY ORDER!

CASH OR CASH, TRADES POSSIBLE."
529,http://www.armslist.com/posts/1421529,For Sale:  Glock 19 fifteen round magazine,"Clarksville, Nashville, Tennessee",$ 30,"Listed On: Monday, April 8, 2013",Magazines,no type,no type,no type,no type,New glock 19 15 round magazine
531,http://www.armslist.com/posts/1421531,"For Sale:  AR15 AR 15 22lr complete rifle, 2 stage, microdot, ACE ultralight, 2nd lower","NW suburbs - will ship, Chicago, Illinois","$ 1,400","Listed On: Monday, April 8, 2013",Rifles,CMMG                                                                                ,22 Long Rifle                                                                                ,Semi-automatic                                                                                ,Rifle,"I have a complete rifle with:

Delaware machine lower
[url=http://www.cmmginc.com/product_p/55ca6c5.htm]CMMG lower parts kit[/url]
[url=http://www.cmmginc.com/product_p/55ca630.htm]CMMG 2 stage trigger[/url]
[url=http://palmettostatearmory.com/index.php/ar-15-05/lower-parts/palmetto-state-armory-classic-m4-stock-kit.html]Palmetto State Armory M4 Stock Kit[/url]
[url=http://www.cmmginc.com/product_p/22b1c50.htm]CMMG LIghtweight 22lr Upper[/url]
[url=http://www.primaryarms.com/Primary_Arms_Micro_Dot_With_Removable_Base_p/md-06.htm]Primary Arms Micro Dot[/url]
4 - [url=http://www.44mag.com/product/blackdog_machine_10_round_magazine/black_dog_machine]10 Round Black Dog Machine Magazines[/url] 

I have put about 2000 rounds through it, after the first 100 rounds it has been completely reliable and more accurate than I am. There are minor scratches on the lower receiver and small gauges behind the rear take down pins from fitting a different upper that was out of spec.

I also have an [url=http://jtdistributing.net/store/product1711.html]ACE Ultra Light Rifle Stock[/url] and 2nd Delaware Machine stripped lower

Looking for $1400 for everything shipped."
534,http://www.armslist.com/posts/1421534,For Sale:  Beretta PX4 full size .40 sw plus extra mags and ammo,"Knoxville, Knoxville, Tennessee",$ 600,"Listed On: Monday, April 8, 2013",Handguns,Beretta USA                                                                                ,40 S&W                                                                                ,Double / Single Action                                                                                ,Pistol,"I have a like new Beretta Px-4 in .40 caliber. It has no marks or scratches it is in perfect condition. I have the case and owners manual. I have 2 extra full size Beretta magazines plus the one that came with it. I have a Gun Mate Nylon Holster with extra mag pouch in perfect shape. This gun has been cleaned every time it was shot, there have been less than 250 shots through it without a single jam. It has never had steel cased ammo through it. I also have about 500 rounds of ammo. 75 ish hollow points, the rest is full metal jacket. I would be willing to sell ammo separate. I will sell the gun, mags, and holster for 600 OBO. I will sell ammo for 275. I will sell all together for 850 OBO"
