,url,title,location,price,post date,category,manufacturer,caliber,action,firearm type,postcontent
730,http://www.armslist.com/posts/1602730,For Sale/Trade:  nagant in 45-70 gov re-barrel proposal,"seattle, Seattle, Washington",$ 500,"Listed On: Saturday, May 11, 2013",Rifles,no type,45-70 Government                                                                                ,Bolt Action                                                                                ,Rifle,I have a proposition for anyone interested in a nagant in 45-70 gov. I want to make one but I lack the chamber reamers and they are about 500 bucks which is a little out of my price range but If one of you would like to help me fiance the tools and provide me with a nagant and barrel of your choice I would be more than happy to do all the work for you. After that if someone would like to provide me with an old nagant and barrel in return I will build one for you as well.  If you have any questions please feel free to ask.
731,http://www.armslist.com/posts/1602731,"For Sale:  ZEV (glockworx) BRASS MAGWELL ""INSERT"" for gen 4 Glocks 17,22,34,35 about 3 ounces of brass inserted into backstrap will hold the magwell in place or can be just added weight.","N.E. St Petersburg, Tampa/St. Pete, Florida",$ 30,"Listed On: Saturday, May 11, 2013",Gun,no type,no type,no type,no type,"ZEV (GLOCKWORX) BRASS MAGWELL ""INSERT"" about 3 ounces, can be used for holding a magwell or just adding weight to a light pistol, fits 4 gen Glocks without the added grip. LIKE NEW"
732,http://www.armslist.com/posts/1602732,For Sale:  Glock 20,"Hinesville, Savannah, Georgia",$ 475,"Listed On: Saturday, May 11, 2013",Handguns,Glock                                                                                ,no type,Striker Fire                                                                                ,Pistol,"Glock 20 Gen 2 w/ Night Sights (Dim) 1 ""U"" notch Hi-Cap mag, US prefix serial number (US - G-20 - March 1991 *Born Date) No box, excellent condition. Grip Force Adapter NOT INCLUDED. I also have 500+ rounds of JHP and 4 mags available to the buyer or other party, I'll also accept trades. 
(Glock 20 is the one in the lower right in the picture)"
734,http://www.armslist.com/posts/1602734,For Sale:  ar-15 *** RARE***  42 round mags new in box $40 ---2 for $75,"new castle , muncie, Indianapolis, Indiana",$ 75,"Listed On: Saturday, May 11, 2013",Magazines,no type,no type,no type,no type,pro-mag new in box ar-15 223/5.56  42 round magazines LIFETIME WARRANTY
735,http://www.armslist.com/posts/1602735,For Sale:  S&W M&P 15 Sport 223/5.56 optic ready NEW,"Okc, ok, Oklahoma City, Oklahoma",$ 690,"Listed On: Saturday, May 11, 2013",Rifles,Smith & Wesson                                                                                ,22 Long Rifle                                                                                ,Semi-automatic                                                                                ,Rifle,"New in box AR/ A-3 semi auto rifle. Contact REDACTED B&M 1815-4 N Harrison Shawnee, ok 74804. Hours 11am-6pm M-F."
736,http://www.armslist.com/posts/1602736,For Sale:  .40 S&W LEAD 180 grain,"Hamilton, Cincinnati, Ohio",$ 75,"Listed On: Saturday, May 11, 2013",Ammo,no type,no type,no type,no type,Ulrtamax Reman . 225 rounds per box 75.00 each. Must be 21!!
737,http://www.armslist.com/posts/1602737,For Sale/Trade:  500  22 long's,"haskell area, Tulsa, Oklahoma",$ 55,"Listed On: Saturday, May 11, 2013",Ammo,no type,no type,no type,no type,500 cci  22 long's not long rifle
738,http://www.armslist.com/posts/1602738,For Sale:  4 russian molot 45 round AK-74 bakelite magazines 5.45x49,"Warner robins, Macon, Georgia",$ 275,"Listed On: Saturday, May 11, 2013",Magazines,no type,no type,no type,no type,"in good condition, 45 round magazines (russian molot factory) with stamps.  Great addition to your AK-74, AK74 variant, or krinkov.  Lot of 4.  Will ship if needed.  Call, text or email. REDACTED"
739,http://www.armslist.com/posts/1602739,For Sale:  22 Long Rifle Ammunition,"Southside, Pueblo, Colorado",$ 5,"Listed On: Saturday, May 11, 2013",Ammo,no type,no type,no type,no type,(8) Boxes of (50) 22 Long Rifle Ammunition - $5.00 each
740,http://www.armslist.com/posts/1602740,For Sale:  M&p 9c with owb holster.,"Columbus, Columbus, Ohio",$ 450,"Listed On: Saturday, May 11, 2013",Handguns,Smith & Wesson                                                                                ,9mm Luger (9x19)                                                                                ,Striker Fire                                                                                ,Pistol,Yes I have up for sale my m&p 9c with a desantis scubbard owb holster the only reason I'm selling is because I ended up with a m&p shield and the 9c has been in the safe ever since also comes with 50 rds of target ammo. I've only shot this gun 125 rds through it and it ran flawlessly. Thanks looking have a great Mother's Day weekend. Must be 21 years old with a valid Ohio ID ccw preferred.
741,http://www.armslist.com/posts/1602741,For Sale:  IWI Tavor SAR-FD16 5.56 223,"Rexburg, Idaho Falls, Idaho","$ 2,799","Listed On: Saturday, May 11, 2013",Rifles,no type,223/5.56 NATO                                                                                ,Semi-automatic                                                                                ,Rifle,"We have one IWI Tavor in Flat Dark Earth.  These go fast so call us if you want it.
REDACTED"
742,http://www.armslist.com/posts/1602742,For Sale/Trade:  FT: MY NEW EOTECH FOR YOUR AIMPOINT  500$,"Palm beach, Florida, United States",$ 0,"Listed On: Saturday, May 11, 2013",Optics,no type,no type,no type,no type,"I have an eotech xsp2-0 
A month old
Only shot with it once
Have hard case and all paperwork and warranty 
Multicam hood
Will put down more on top for your trade (ammo,mags,whatever)
ONLY LOOKING FOR T1 and h1 models 
500$ firm
REDACTED call or text"
744,http://www.armslist.com/posts/1602744,For Sale:  Taurus 7 shot .357 Magnum Revolver,"Gate City, Virginia, United States",$ 400,"Listed On: Saturday, May 11, 2013",Handguns,Taurus                                                                                ,357 Magnum                                                                                ,Double Action                                                                                ,Revolver,"Blued Taurus M66 7 shot revolver. Have box with matching serial number on box. 6"" barrel"
746,http://www.armslist.com/posts/1602746,For Sale:  Marlin Model 60 .22 with Rifle scope and Sling,"East Springfield, Springfield, Missouri",$ 200,"Listed On: Saturday, May 11, 2013",Rifles,Marlin                                                                                ,22 Long Rifle                                                                                ,Semi-automatic                                                                                ,Rifle,2000 Marlin Model 60 22 in great shape. 14+1 round tube fed magazine with safety and auto-lockback on last round. Has uncle Mikes sling swivels installed with a Redhead thumb hole strap. Also has a bass pro brand 9x32 scope that's never even been in the woods. This gun is a tack driver. Shoots excellent. 290 in it.. Asking 200 obo. Will take 120 without the scope. Call or text 417.380.95six.seven
747,http://www.armslist.com/posts/1602747,For Sale:  223/5.56 DPMS,"Greenwood, Indianapolis, Indiana",FREE,"Listed On: Saturday, May 11, 2013",Rifles,DPMS                                                                                ,223/5.56 NATO                                                                                ,no type,Rifle,"Nice AR style rifle. Well taken care of with a few extras.
Sling, 300 rounds of 223, Nikon P223 Scope. 
Looking for reasonable offers. Don't have to sell, but looking to purchase another firearm."
748,http://www.armslist.com/posts/1602748,For Sale/Trade:  FREE FREE FREE Entertainment Hutch,"NORTH, Colorado Springs, Colorado",$ 1,"Listed On: Friday, May 17, 2013",Miscellaneous,no type,no type,no type,no type,"Entertainment hutch for FREE! Made of pine. Item is in great shape.

For more info call Darrell @ REDACTED"
749,http://www.armslist.com/posts/1602749,For Sale:  Ruger 10-22 Match grade.,"Astoria, Oregon Coast, Oregon",$ 500,"Listed On: Saturday, May 11, 2013",Rifles,Ruger                                                                                ,22 Long Rifle                                                                                ,Semi-automatic                                                                                ,Rifle,"I have a Ruger 10-22. Not perfect has a couple blemishes on the reciever, but a very solid and nice firing rifle! You cant even find the BX-25 mags for these right now! Has a heavy match grade Adams & Bennet bull barrel, with a camo floating stock. It had a Barska Contour 3-9x42mm, red and green illuminated reticle with lockable external windage and elevation adjustments. Just installed a Timmony match grade trigger with under trigger guard quick mag release, and a 25rd BX-25 Ruger mag. 
I paid $140.00 scope, $200 for the trugger assembly alone. I feel $500.00 is a more than fair price. I dont drive so you would have to come to me on the coast in Astoria. Thanks for looking!Price is firm. Won't entertain offers. Take it or leave it!"
750,http://www.armslist.com/posts/1602750,For Sale/Trade:  gsg 522,"sherwood, Little Rock, Arkansas",$ 395,"Listed On: Saturday, May 11, 2013",Rifles,no type,no type,no type,Rifle,Nice gun shoots great has foldable stock and quad rail comes with one 22 rd magazine REDACTED might intern trades
751,http://www.armslist.com/posts/1602751,For Sale/Trade:  Rem 700 varmint 308,"Near richlands, Jacksonville, North Carolina","$ 1,200","Listed On: Friday, May 31, 2013",Rifles,Remington                                                                                ,308/7.62 NATO                                                                                ,Bolt Action                                                                                ,Rifle,Nice rifle has a nikon monarch ucc 6.5x20 would like to see what you have
752,http://www.armslist.com/posts/1602752,For Sale:  Colt LE901-16S Modular Carbine 308,"Rexburg, Idaho Falls, Idaho","$ 2,699","Listed On: Saturday, May 11, 2013",Rifles,Colt                                                                                ,308/7.62 NATO                                                                                ,Semi-automatic                                                                                ,Rifle,"We have one Colt LE901-16S Modular Carbine in 308win Black.  This is the newest one from colt that shoots 308 and will accept AR15 uppers.  Dont miss out these go quick.  Call us if you want it.
REDACTED"
753,http://www.armslist.com/posts/1602753,For Sale:  .223 Remington factory new brass ammo,"Oakland, Pittsburgh, Pennsylvania",$ 140,"Listed On: Saturday, May 11, 2013",Ammo,no type,no type,no type,no type,"200 rounds (10 x 20 round boxes) of .223 55 grain Remington centerfire ammunition.  Brand new in the box. First quality factory fresh brass...clean shooting KLEANBORE primers.  Very reliable feed and function and reloadable brass...don't waste your money on cheap steel cased Russian crap.  Local Pick up in Oakland.  Cash or Paypal ""discrete""."
754,http://www.armslist.com/posts/1602754,For Sale:  308 Brass for Reloading (100 CT) - $35 Shipped!,"Greenridge, Greenville, South Carolina",$ 35,"Listed On: Saturday, May 11, 2013",Ammo,no type,no type,no type,no type,"$30 per 100 Face to Face (FTF)

I have 400 pieces of 308 range brass for sale in quantities of 100. 

 I'm asking $35 SHIPPED anywhere in the U.S.  If you buy more than 100, there is a discount on shipping.  The more you buy the cheaper it is to ship.

It has been cleaned, tumbled and inspected. THIS IS NOT AMMO! Please contact me for questions or purchases.   You can also reply to this add with contact information and I'll get in touch with you.

I take paypal or money order.  If you're local, it's $35 for face to face pickup.  

Tommy"
755,http://www.armslist.com/posts/1602755,For Sale/Trade:  80# anvil $80 or trade,"south, Wichita, Kansas",$ 80,"Listed On: Saturday, May 18, 2013",Knives,no type,no type,no type,no type,"80# anvil, I know little about it. Doesn't seem to ring when you hit it, pretty old, face a little beat up. $80 or trade for ammo, reloading, knives, tablet, whatever really text REDACTED"
756,http://www.armslist.com/posts/1602756,For Sale/Trade:  DPMS panther A2 classic,"Va beach, Hampton Roads, Virginia","$ 1,100","Listed On: Saturday, May 11, 2013",Rifles,DPMS                                                                                ,223/5.56 NATO                                                                                ,Semi-automatic                                                                                ,Rifle,"Brand new DPMS panther A2 never fired 20 in Crome lined  bull barrel 1 mag and hard case come with upgraded front rail umc  and ar15 single rail for carry handle have the original one I will give you as well
Thanks charly REDACTED"
758,http://www.armslist.com/posts/1602758,For Sale:  5,"OKC, Oklahoma City, Oklahoma",$ 5,"Listed On: Saturday, May 11, 2013",Magazines,no type,no type,no type,no type,5
759,http://www.armslist.com/posts/1602759,For Sale:  SIG SAUER 1911 TACOPS CARRY .45ACP---BRAND NEW,"SAN DIEGO, San Diego, California","$ 1,400","Listed On: Saturday, May 11, 2013",Handguns,Sig Sauer                                                                                ,45 ACP                                                                                ,Single Action                                                                                ,Pistol,"The legendary 1911 design has been brought into the 21st century with the refinement today’s shooters demand. The SIG SAUER® 1911 proves that close tolerances equal complete reliability and need not be incompatible in an off-the-shelf pistol. SIG SAUER has introduced clean, distinct lines that American shooters have embraced, while retaining the crisp trigger pull, classic ergonomics and exceptional accuracy they expect. The 1911 TACOPS CARRY model features a SAO trigger, low profile night sights, integral accessory rail, ambidextrous safety, Magwell, and Ergo XT grips. 

This listing is for the highly-sought after BRAND NEW, NEVER FIRED & NEVER USED SIG SAUER 1911 TACOPS CARRY--- .45ACP ACCURACY RIGHT OUT-OF-THE-BOX

SALES TO CALIFORNIA PERMITTED. SHIPPING TO VERIFIED FFL ONLY."
760,http://www.armslist.com/posts/1602760,For Sale:  1$,"grafton, Cleveland, Ohio",$ 1,"Listed On: Saturday, May 11, 2013",Ammo,no type,no type,no type,no type,"Bulleyes Gun shop has some decent supply of ammo, 45, 22lr, 9mm 40., a lot and not overpriced."
761,http://www.armslist.com/posts/1602761,"For Sale:  20"" Barrel for sale or trade for 16"" barrel M4 type (Would sale whole rifle for $2000 obo)","Muncie, IN, Indiana, United States",$ 750,"Listed On: Saturday, May 11, 2013",Rifles,no type,223/5.56 NATO                                                                                ,Semi-automatic                                                                                ,Rifle,"I have a bushmaster AR15 w/ a 20"" tappered target barrel.  Long range shooting and accurate.  I would like a smaller 16"" M4 type barrel.  If you would be interested in purchase mine, or trade let me know.... Entire Rifle for sale for $2000 obo"
762,http://www.armslist.com/posts/1602762,For Sale:  Beretta -- AL391 YOUTH Urika 2 X-Tra Grain 20ga.,"New York, New York, United States",$ 700,"Listed On: Saturday, May 11, 2013",Handguns,Beretta USA,no type,no type,no type,Beretta AL391 YOUTH Urika 2 X-Tra Grain 20ga. This gun has had a box of shells thru it. This gun is very clean
764,http://www.armslist.com/posts/1602764,"For Sale:  Dpms ar-15 bull barrel ,willing to trade for 1911,ak-47,ak-74","North liberty, Cedar Rapids, Iowa","$ 1,000","Listed On: Sunday, May 26, 2013",Rifles,DPMS                                                                                ,223/5.56 NATO                                                                                ,Semi-automatic                                                                                ,Rifle,"Dpms bull barrel ar-15. Low round count. Bravo Company extractor upgrade kit,magpul trigger winter guard,arms back up rear sight,collapsable rear stock. Comes with 4 30 round magazines and hard case.if you have something to trade I am willing to hear what you have.(firearms only)."
765,http://www.armslist.com/posts/1602765,For Sale:  400 Rounds of 7.62x51 Nato in sealed battle packs,"south, Tampa/St. Pete, Florida",$ 250,"Listed On: Sunday, May 26, 2013",Ammo,no type,no type,no type,no type,"400 rounds of German made NATO 7.62x51 (.308) ammo in two sealed battle packs. Most stores if they still have this are selling at about $1.25 a round. Both packs, all 400 rounds for $250 or best offer, trades considered."
766,http://www.armslist.com/posts/1602766,"For Sale:  Hi Point C9 mm Luger, custom finish","Moncks Corner, Charleston, South Carolina",$ 180,"Listed On: Saturday, May 11, 2013",Handguns,Hi Point                                                                                ,9mm Luger (9x19)                                                                                ,no type,Pistol,This Hi Point has been refinished (by a professional painter) and is one of a kind... The upper and the magazine ... very nice and low priced home protection.
767,http://www.armslist.com/posts/1602767,For Trade:  M1 Garand,"Montclair, Riverside, California",Offer,"Listed On: Thursday, May 30, 2013",Rifles,Springfield                                                                                ,30-06 Springfield                                                                                ,Semi-automatic                                                                                ,Rifle,I have a M1 Garand that I am looking to trade for any other type of firearm. This is a project gun that requires the barrel to be replaced. I will consider other trades or cash.
768,http://www.armslist.com/posts/1602768,For Sale:  4 30 round east german 5.45x39 bakelite magainzes with pouch,"Warner robins, Macon, Georgia",$ 160,"Listed On: Saturday, May 11, 2013",Magazines,no type,no type,no type,no type,"Lot of 4 east german 5.45x39 magazines with pouch.  These mags are 30 round magazines.  Will fit any AK-74, AK74 variant, or krinkov.  Will ship if needed.  Call, text, or email. REDACTED.  I do have more east german mags if you want to purchase more."
769,http://www.armslist.com/posts/1602769,For Sale:  CVA Wolf Muzzleloader,"Valparaiso, IN, Indiana, United States",$ 150,"Listed On: Monday, May 27, 2013",Muzzle,Connecticut Valley Arms                                                                                ,50 Black Powder                                                                                ,no type,Muzzle Loader,"Basically a brand new CVA Wolf .50cal break action muzzleloader.  Has Alpen Optics Kodiak scope on it, see-through scope mounts, and fiber optic sights.  Contact me through here or text me at REDACTED."
770,http://www.armslist.com/posts/1602770,For Sale/Trade:  40 sw JHP's & FMJ,"Moncks Corner, Charleston, South Carolina",$ 80,"Listed On: Friday, May 17, 2013",Ammo,no type,no type,no type,no type,"One 50 rd box of Ferederal 180 gr. Hydra Shok 40 sw
One 20 rd box of Magtech 180 gr. Guardian Gold 40 sw
One 50 rd box of Federal 180 gr. FMJ 40 sw
One 50 rd box of  Blazer Brass 180 gr FMJ 40 sw

Total of 170 rds.   $80"
771,http://www.armslist.com/posts/1602771,For Sale:  .45 Auto ACP 165gr Federal Premium Personal Defense JHP,"metro, Houston, Texas",$ 0,"Listed On: Saturday, May 11, 2013",Ammo,no type,no type,no type,no type,"Not much to say about this awsome Federal Premium Personal Defense Jacket Hollow Point Low Recoil 165grain.  I just sold my 45 pistol but still have 2 boxes of these 45 ACP Federal left.  There are 20 rds in each box. Total of 40 rounds Federal Premium Personal Defense JHP which I bought at Walmart few weeks ago. Thought someone may interesting to pick it up.  Price is shown on the receipt below in red square mark $54.06
Contact me if you are interested.  This is the best JHP ammo which hard to come by these days. This post will be deleted once it sold.  Thanks."
772,http://www.armslist.com/posts/1602772,For Sale:  In Stock Chinese T53 carbines 7.62x54R in Good+ condition,"Farwell, Michigan, United States",$ 150,"Listed On: Tuesday, July 16, 2013",Rifles,Century International Arms                                                                                ,7.62x54R                                                                                ,Bolt Action                                                                                ,Rifle,"I have in stock several Chinese T53 carbines in handpicked Good+ condition. These rifles have been headspaced, and the lot includes a few that are all stamped matching. Price is $150.00. These rifles will have at least 80% metal finish, very good+ condition bore or better and the wood will be in good condition or better. I will ship to your FFL. Thanks for looking and God Bless."
773,http://www.armslist.com/posts/1602773,For Sale:  glenfield marlin 60,"west, Cincinnati, Ohio",$ 125,"Listed On: Saturday, May 11, 2013",Rifles,no type,22 Long Rifle                                                                                ,Semi-automatic                                                                                ,Rifle,glenfield marlin model 60 125 or trade for 9mm/22 at normal prices
774,http://www.armslist.com/posts/1602774,For Sale:  5 PMAG AR15 W/ Window MAG570-BLK Package - NEW!,"WA, Washington, United States",$ 115,"Listed On: Sunday, June 16, 2013",Magazines,no type,no type,no type,no type,"We're offering a package of 5 PMAG MAG570-BLK Magazines for $114.99 shipped. These are new and still in the wrapper. These are the hard to find PMAGS with the Window.

MAGPUL PMAG 30rd W/ Window GEN M2 - Black

Hurry, these will not last long. Please e-mail us if interested. We will ship these anywhere that is legal in the US for this price. The picture shows 3, but we've added 2 extra to the package for a total of 5 magazines."
776,http://www.armslist.com/posts/1602776,For Sale:  Colt 38 Super,"Dodge County, Milwaukee, Wisconsin","$ 1,300","Listed On: Tuesday, May 21, 2013",Handguns,Colt                                                                                ,38 Super                                                                                ,no type,Pistol,Hello i have for sale a Colt Custom 38 Super in mint condition comes with 170  rounds and leather holster if interested email or text i can be reached at REDACTED Thanks
777,http://www.armslist.com/posts/1602777,"For Sale:  Mossberg Maverick 88 12 GA Home Defense Size 18"" Barrel","Moncks Corner, Charleston, South Carolina",$ 275,"Listed On: Saturday, May 11, 2013",Shotguns,Maverick                                                                                ,12 Gauge                                                                                ,Pump Action                                                                                ,Shotgun,"This is a Maverick 88 12ga 2 3/4 and  3"" chamber, 18"" barrel, barrel heatshield, pistol grip, forestock has a built in handle on it, sling mounts, front sling mount is also a mount for a flashlight or laser... Made by Mossberg.  Sweet little home defense model..."
780,http://www.armslist.com/posts/1602780,For Sale:  5 Tapco 30 round Magazines and 1 50 Cal Metal Ammo Can,"Bradenton, Sarasota, Tampa/St. Pete, Florida",$ 100,"Listed On: Saturday, May 11, 2013",Magazines,no type,no type,no type,no type,"5 Tapco 30 round AR-15 Mags and 1 of the Army Surplus 50 Cal ammo cans pictured.  4 of the Tapco mags are brand new in package and 1 was used once to sight in my rifle.  $105 cash, Call or text REDACTED if interested.    

Would be willing to trade for some 20 round G3 Pmags.  The 20 rounders work better with bipods."
781,http://www.armslist.com/posts/1602781,For Sale:  Smith and Wesson .22 Long Rifle,"Eugene, Eugene, Oregon",$ 450,"Listed On: Saturday, May 11, 2013",Rifles,Smith & Wesson                                                                                ,22 Long Rifle                                                                                ,Semi-automatic                                                                                ,Rifle,"I have had the gun for almost a year. I have shot at least 500 rounds through the gun. The gun istelf is in good condition. Stock, grip, and sights are all magpul industries. It also will come with the troy front grip. Comes with one 30 round magazine as well as sling. 

The only problem with the gun is that the top rail has glue residue on it. It does not effect the guns performance in anyway. 

Looking to sell fast.
I will negotiate a price. I would consider a trade but I am looking fo cash."
