,url,title,location,price,post date,category,manufacturer,caliber,action,firearm type,postcontent
0,http://www.armslist.com/posts/1602000,For Sale:  Kahr CW9,"Oldsmar, Tampa/St. Pete, Florida",$ 500,"Listed On: Saturday, May 11, 2013",Handguns,Kahr                                                                                ,9mm Luger (9x19)                                                                                ,no type,Pistol,"Make: Kahr
Model: CW9
Condition: used, but like new
Price: $500
Location: Oldsmar
Trades: I'm always looking for a Walther PPQ (classic).
Notes: I'm trying to fund another purchase. I think I priced this fairly, at a pre-craziness level, with the extra mag and holster."
1,http://www.armslist.com/posts/1602001,For Sale:  .45 ACP SIG SAUER 1911 SCORPION Commander 8+1...BAD A** Pistol!,"westside, Bend, Oregon","$ 1,025","Listed On: Saturday, May 11, 2013",Handguns,Sig Sauer                                                                                ,45 ACP                                                                                ,Single Action                                                                                ,Pistol,"5.0 Trigger, CeraKote Flat Dark Earth, Hogue G10 Gripset, low profile Siglite fixed night sights, 4.2"" Conceal Carry... BNIB never fired...ftf, no ship, oregon res., non felon."
2,http://www.armslist.com/posts/1602002,For Sale:  S&W 9ve 9mm,"snohomish, Seattle, Washington",$ 450,"Listed On: Saturday, May 11, 2013",Handguns,no type,no type,no type,no type,Smith and wesson 9ve in 9mm has laser 2 mags and a spec ops knife that goes with it. Looking to sell or trade would like 450 to sell and would like to trade for a tuaras. 357 or a .17 hmr rifle open to other offers but only guns please
3,http://www.armslist.com/posts/1602003,For Sale:  5000 rds CCI 22 .22 LR 40gr Lead Nose Standard Velocity,"Dayton, Dayton, Ohio",$ 575,"Listed On: Saturday, May 11, 2013",Ammo,no type,no type,no type,no type,"5000 rds 22lr cci 40 gr, call or text 937 469 16o5"
4,http://www.armslist.com/posts/1602004,For Sale/Trade:  Smith and Wesson CS45 auto compact rare LNIB,"trinity, Greensboro, North Carolina",$ 650,"Listed On: Saturday, May 11, 2013",Handguns,Smith & Wesson                                                                                ,45 ACP                                                                                ,Double / Single Action                                                                                ,Pistol,"CS45 Auto compact stainless LNIB sale or trade 650
REDACTED"
5,http://www.armslist.com/posts/1602005,"For Sale:  Beretta Model 96 ""Saf T Lok"" magazine lock","Raleigh, Raleigh / Durham / CH, North Carolina",$ 20,"Listed On: Saturday, May 11, 2013",Magazines,no type,no type,no type,no type,"I have a Saf T Lok magazine lock, new still in package for sale. $20.00. Retails for $69.99. * Insert indicates that slight modification of inside of left grip required. Templet included.

The SAF T LOK Magazine Lock is a fully functioning ammunition magazine that installs by inserting the SAF T LOK magazine.  SAF T LOK locks are cycle tested, proven to last a lifetime and carry a Lifetime Warranty.

The SAF T LOK is the only lock that will lock a loaded gun. Combinations can be entered in 3 seconds, by feel, even in the dark. In a dangerous situation the combination can be pre-set for one-click operation. Prevents firing of a weapon, even with a round in the chamber. Prevents unauthorized use and accidental shootings. The Saf T Lok Magazine Lock is completely mechanical, made from durable nickel plated components, stainless steel springs and levers, case hardened carbon steel magazine and heat and chemical resistant Xenoy plastic housing - NO keys to find and NO batteries to fail. Both SAF T LOK's become part of the firearm complimenting its function and appearance."
6,http://www.armslist.com/posts/1602006,For Sale/Trade:  22,"portland, Portland, Oregon",$ 1,"Listed On: Sunday, September 15, 2013",Ammo,no type,no type,no type,no type,na
8,http://www.armslist.com/posts/1602008,For Sale:   100 american eagle 223 rounds,"hamburg, Buffalo, New York",$ 80,"Listed On: Saturday, May 11, 2013",Ammo,no type,no type,no type,no type,I have a box of 223 rounds. 100 count. Don't have anything that shoots 223. Asking 80. Want to sell asap texts only REDACTED
9,http://www.armslist.com/posts/1602009,For Sale:  Bushmaster Carbon 15 w/red dot sight,"Peru, La Salle, Illinois",$ 900,"Listed On: Friday, June 28, 2013",Rifles,Bushmaster                                                                                ,223/5.56 NATO                                                                                ,Semi-automatic                                                                                ,Rifle,"I have a NIB Bushmaster Carbon 15 with red dot sight. 5.56/.223, 16 inch barrel, collapsible stock, 1 30 round mag, sling, paperwork and box. Need to free up some cash. Will take $900. Buyer must have FOID card. No sales tax or FFL transfer fees!!!!!"
10,http://www.armslist.com/posts/1602010,For Sale/Trade:  Barnes Precison Machine AR with AimPoint Comp M2 Optic and Upgrades,"Summerville, Charleston, South Carolina",$ 1,"Listed On: Thursday, May 16, 2013",Rifles,no type,223/5.56 NATO                                                                                ,Semi-automatic                                                                                ,Rifle,"Barnes Precision Machine CQB Patrolman's Carbine/AR with upgrades, factory & soft case with papers, and AimPoint Comp M2 Optic.

* MagPul ACS Buttstock
* MagPul MIAD Grip
* "" "" MOE Foregrip
* "" "" MBUS Front and Rear Flip-Up Sights
* "" "" Single/Double Pt. Sling
* BPM Upper/Lower/BCG/Free Float/Flash Hider w/Breacher Tip
* BPM Stainless Steel Barrel 1/8 Twist
* Charging Assist
* Sling Mount
* AimPoint Comp M2 Optic
* BlackHawk Pivot and Tilt Bi-Pod
* 1 Blk PMAG, 1 FDE PMAG, and 2 GI Mags

*All MagPul items are in FDE

This is an exceptional shooters rifle. Below is a link to one of their field manuals.

*THE 3RD PIC SHOWS A DIFFERENT OPTIC THAN THE AIMPOINT INCLUDED IN THE SALE.

http://www.usamade-ar15parts.com/v/vspfiles/templates/BPM_sales/images/BPM-Manual.pdf#page=1&zoom=auto,0,620

The price is $2250 in cash or trade value of $2450.00. Call 8four3-four42-2zero19 for inquiries. Thank you."
12,http://www.armslist.com/posts/1602012,For Sale:  American Fiber-Lite Canoe Fifteen Foot Fiberglass trade for Firearm,"Moncks Corner, Charleston, South Carolina",$ 300,"Listed On: Saturday, May 11, 2013",Fishing,no type,no type,no type,no type,I have a 15 foot fiberglass American Fiber-Lite canoe that I would like to sell or trade for firarms
13,http://www.armslist.com/posts/1602013,For Sale:  Remington 870 Express Magnum (20g),"Oldsmar, Tampa/St. Pete, Florida",$ 400,"Listed On: Saturday, May 11, 2013",Shotguns,Remington                                                                                ,20 Gauge                                                                                ,Pump Action                                                                                ,Shotgun,"Make: Remington
Model: 870 Express Magnum (20g)
Condition: Used, but in great condition
Price: $400
Location: Oldsmar"
14,http://www.armslist.com/posts/1602014,For Sale:  hk 93 preban 40 round magazine,"medford, Medford, Oregon",$ 125,"Listed On: Friday, January 24, 2014",Gun,no type,no type,no type,no type,"like new dated 6-1-76 very early hk93 mag rare to find in this condition. will work with hk93, hk43, hk53 & clones c93 v93
i don't think this magazine has ever had a round in it. it looks like it has never been in a rifle.
REDACTED"
15,http://www.armslist.com/posts/1602015,For Sale:  Raven MP-25 very nice condition,"S Lexington/Nicholasville, Lexington, Kentucky",$ 100,"Listed On: Saturday, May 11, 2013",Handguns,Raven Arms                                                                                ,25 ACP                                                                                ,no type,Pistol,I have a Raven MP-25 25ACP pistol for sale. It has been shot very little and is in pretty good shape. It cycles and works perfect. I just don't need it. I have a full mag of ammo that goes with it(that's all I have for it). It is black with wood grips. $100. E-mail me for more info. I am having trouble posting pics. I can meet in the Nicholasville/Lexington area only. Thanks.
16,http://www.armslist.com/posts/1602016,For Sale:  $425.00,"NE, Indiana, United States",$ 425,"Listed On: Saturday, May 11, 2013",Shotguns,Stoeger                                                                                ,20 Gauge                                                                                ,Break Open                                                                                ,Shotgun,"Stoeger Deluxe Coach Gun, 20 ga., mint condition, single gold trigger, break open, side by side shotgun. Phone REDACTED"
17,http://www.armslist.com/posts/1602017,For Sale:  Remington 870 top folding stock w/ extras,"Wilmington, Wilmington, North Carolina",$ 450,"Listed On: Saturday, May 11, 2013",Shotguns,Remington                                                                                ,12 Gauge                                                                                ,Pump Action                                                                                ,Shotgun,Remington 870 express with ATI top folding stick. Surefire mounted flash light and box of ammo. Pelican hard carry case as well good price for everything.
18,http://www.armslist.com/posts/1602018,For Sale/Trade:  dan wesson .357 revolver,"royal oak, Detroit, Michigan",$ 1,"Listed On: Saturday, May 11, 2013",Handguns,Dan Wesson                                                                                ,357 Magnum                                                                                ,no type,Revolver,"I have an excellent condition Dan Wesson revolver. 6"" barrel in .357 magnum. The serial # dates this to 1978 and is in amazing condition for its age and one of the finest handguns I've ever handled. Extremely accurate and reliable. I also have speed loaders, holster, and a ton o ammo for the right deal."
19,http://www.armslist.com/posts/1602019,For Sale/Trade:  2000 KTM 250sx Dirtbike,"Lawton, Lawton, Oklahoma",$ 0,"Listed On: Saturday, May 11, 2013",Vehicles,no type,no type,no type,no type,"2000 KTM 250 sx Dirtbike, very fast with new tires. Runs great"
20,http://www.armslist.com/posts/1602020,For Sale:  .270 WSM coyote lite winchester,"loxley/saraland, Mobile, Alabama",$ 700,"Listed On: Tuesday, October 15, 2013",Rifles,Winchester                                                                                ,270 WSM                                                                                ,Bolt Action                                                                                ,Rifle,"winchester coyote lite model 70 bolt action. synthetic stock, black fluted barrel, gun has been fired (1) time. no scope but does have rail mounts for scope."
21,http://www.armslist.com/posts/1602021,For Sale:  glock 19 gen 3 custom barrel,"Tacoma, Seattle, Washington",$ 115,"Listed On: Saturday, May 11, 2013",Gun,no type,no type,no type,no type,I have like new custom polish barrel for glock 19 gen 3 . Call or text REDACTED
22,http://www.armslist.com/posts/1602022,For Sale/Trade:  Taurus 24/7 OSS TACTICAL// M&P 9C,"South Whitley, Fort Wayne, Indiana","$ 1,200","Listed On: Saturday, May 11, 2013",Handguns,Smith & Wesson                                                                                ,9mm Luger (9x19)                                                                                ,no type,Pistol,I have 2 handguns for sale one is a Taurus 24/7 OSS TACTICAL 9mm with factory box and everything that came with it 2 17 rd mag custom IWB and tactical leg holster. Shot less than 30 rounds thru it.  Also I have a Smith and Wesson M&P 9c with original box and paperwork and everything that came new except for small grip has medium installed on it. Has 6 mags 4 with pinky extension.  Looking for a John boat with trailer doesn't need extras just float or make me a cash offer not looking for any other offer thanks for looking REDACTED text anytime.
23,http://www.armslist.com/posts/1602023,For Sale/Trade:  FNP .40 Green FDE with two mags,"South, Billings, Montana",$ 500,"Listed On: Thursday, June 20, 2013",Handguns,FN Herstal S.A.                                                                                ,40 S&W                                                                                ,Double / Single Action                                                                                ,Pistol,"I have a real nice FNP .40 in FDE(brown/green). Great shape, tow 14rnd mags. Really a nice gun. $500 or trade."
25,http://www.armslist.com/posts/1602025,For Sale:  Outdoor shooting range.,"Woodstock il ( Northern Il.), Illinois, United States",$ 15,"Listed On: Saturday, May 11, 2013",Shotguns,Mossberg                                                                                ,20 Gauge                                                                                ,Semi-automatic                                                                                ,Shotgun,"Outdoor Riflr/Shotgun/Pistol range. Woodstock il. 60098  90, 50,35yd.rifle. Tactical pistol practice aerea. 
standing shotgun target range. Limited firearm rental. Targets available. ""Make the bowling pins dance"" on the rifle/pistol range. Call for reservation Dave:REDACTED, or Cliff REDACTED. 10A.M. to Sun down. 7 day's a week."
26,http://www.armslist.com/posts/1602026,For Sale/Trade:  .308 Winchester superX power-point 3 boxes,"Boulder, Denver, Colorado",$ 23,"Listed On: Friday, May 17, 2013",Ammo,no type,no type,no type,no type,"have three boxes of .308, premium hunting ammo I no longer have a rifle for. Want to retail value+ tax I payed originally so about $23 per box. Email me with your ammo trade offers and I'll let you know!
Thanks for looking!"
27,http://www.armslist.com/posts/1602027,"For Sale:  APEX TATICAL ""GUNSMITH SEAR"" FOR S&W, M&P's  30.00 plus 3.00 shipping","N.E. St Petersburg, Tampa/St. Pete, Florida",$ 30,"Listed On: Saturday, May 11, 2013",Gun,no type,no type,no type,no type,"APEX TATICAL ""GUNSMITH SEAR"" for S&W, M&P's , Gives very light smooth break, should use the APEX ""ULTIMATE STRIKER BLOCK"" also, which I have for sale."
28,http://www.armslist.com/posts/1602028,Want To Buy:  9mm Hollowpoint ammunition,"Albemarle, Charlotte, North Carolina",$ 1,"Listed On: Saturday, May 11, 2013",Ammo,no type,no type,no type,no type,"looking for jacketed hollowpoints in 9mm luger. prefer Winchester/Federal/Speer, but open to all ideas. I have cash in hand, would like to meet today or tomorrow. looking for 20-50 round boxes. email me with what you have exactly, how much youre asking, and where you are located at. thanks in advance."
30,http://www.armslist.com/posts/1602030,For Sale:  Hornady 230GR HP/XTP 45 CAL Bullets,"Southside, Pueblo, Colorado",$ 30,"Listed On: Saturday, May 11, 2013",Ammo,no type,no type,no type,no type,(12) Boxes of (100) Hornady 230GR HP/XTP 45 CAL Bullets $30.00 each
31,http://www.armslist.com/posts/1602031,For Sale:  H&R Single Shot 12 Gauge,"Seneca, SC, Greenville, South Carolina",$ 150,"Listed On: Saturday, May 11, 2013",Shotguns,H&R                                                                                ,12 Gauge                                                                                ,Single Shot                                                                                ,Shotgun,H&R Single Shot 12 Gauge Shotgun. Topper Model 148. Not perfect but shoots great. REDACTED you can call or text.
32,http://www.armslist.com/posts/1602032,For Sale:  Bushmaster AR-15,"Lebanon, Springfield, Missouri",$ 890,"Listed On: Sunday, June 16, 2013",Rifles,Bushmaster                                                                                ,223/5.56 NATO                                                                                ,Semi-automatic                                                                                ,Rifle,"Barely Used Bushmaster XM15-E2S .223/5.56 Model, comes with box. Ready for optics! Comes with a box of 20 .223 rounds. Lowered Price!"
33,http://www.armslist.com/posts/1602033,"For Sale/Trade:  Misc AR parts, trade for guns or ammo or sell","north of columbia, Columbia, Missouri",$ 500,"Listed On: Saturday, May 11, 2013",Gun,no type,no type,no type,no type,Miscellaneous group of AR parts. New A.R.M.S. S.I.R. #50C bi-level rail quad. $400. Tru-glo reflex sight. $50. Factory takeoff 6 pos stock $20. New Barska 1'x 25mm reddot $40. Knights Armament Co. Carbine length Rail covers (4) new $30. There's easily over $500 worth of stuff here. Would trade for guns and/or ammo. Or sell for cash. Would sell or trade it all. In moberly. Call or text REDACTED http://www.mountsplus.com/AR-15_Accessories/AR-15_Scope_Rings/ARMS-50C.html I will ship and can accept paypal. Thanks.
35,http://www.armslist.com/posts/1602035,For Sale:  Beretta U22 Neos,"Menomonie, Eau Claire, Wisconsin",$ 250,"Listed On: Saturday, May 11, 2013",Handguns,Beretta USA                                                                                ,no type,no type,Pistol,"Very nice condition .22 semi auto. Adjustable rear sight, or you can use the full length top rail to add any optics of your choice. Very accurate, and hasn't been used much.
Includes case and 3 magazines.
Firm on price, face to face CASH sale. Will meet in Menomonie area.
E-mail or call / text: 71five 5five six nine five19. Thanks"
36,http://www.armslist.com/posts/1602036,For Trade:  BRAND NEW(Never Fired) Ruger Mini 14 Ranch Rifle!,"Fountain Inn, Greenville, South Carolina",Offer,"Listed On: Saturday, May 11, 2013",Rifles,Ruger                                                                                ,223/5.56 NATO                                                                                ,Semi-automatic                                                                                ,Rifle,"This is a Brand New Ruger Mini 14 Ranch Rifle Still in the box and comes with all original accessories (Ruger Scope Mounts,Ruger Lock, Paperwork, ect....) and all is remains sealed. I am primarily looking to trade for a high quality pistol but will entertain reasonable cash offers aswell. Text REDACTED"
37,http://www.armslist.com/posts/1602037,For Sale:  45 auto umc 250 rounds,"west, Wichita, Kansas",$ 140,"Listed On: Saturday, May 11, 2013",Ammo,no type,no type,no type,no type,This is the yellow umc value pack 230 grain  250 rnds send ph# if you want them
38,http://www.armslist.com/posts/1602038,For Sale:  Ruger LC380,"East Valley, Gold Canyon, Arizona, United States",$ 350,"Listed On: Wednesday, September 4, 2013",Handguns,Ruger                                                                                ,380 ACP                                                                                ,Double Action                                                                                ,Pistol,"Ruger LC380 Semiauto the same pistol as the popular LC9 but with the 380 recoil. Makes a geat conceal carry weapon.
Reduced to $350 no credit card upcharge 7.7% sales tax
Email, text, or call Bob
REDACTED
REDACTED

Desert Dawg Arms is a federally licensed firearms dealer. All appropriate transfer forms and background checks apply. All federal and state laws apply. Must be 21 years of age for handguns. Additional fees are shipping. State tax of 6.7% does apply for AZ residents."
39,http://www.armslist.com/posts/1602039,Want To Buy:  BERETTA 96 .40S&W Stainless/INOX,"Norfolk, Nebraska, United States",Offer,"Listed On: Saturday, May 11, 2013",Handguns,Beretta USA                                                                                ,40 S&W                                                                                ,no type,Pistol,Looking for BERETTA 96 .40S&W Stainless/INOX. Looking to buy or trade. If interested please send me a message.
40,http://www.armslist.com/posts/1602040,For Sale/Trade:  Ruger 44 magnum,"Burkesville, Kentucky, United States",$ 600,"Listed On: Saturday, May 11, 2013",Handguns,Ruger                                                                                ,44 Magnum                                                                                ,Single Action                                                                                ,Revolver,Here is a nice Ruger 44. New Model Super Blackhawk. Seven inch barrell.  Serial No. 82-55826. Made in USA. Single action revolver.  I don't text.
41,http://www.armslist.com/posts/1602041,For Sale:  stevens model 31 and hr 410,"snohomish, Seattle, Washington",$ 450,"Listed On: Saturday, May 11, 2013",Shotguns,no type,no type,no type,Shotgun,Selling as a set only and looking for 450 firm both are old and have wear but shoot and function. Would also be willing to trade for a pistol
42,http://www.armslist.com/posts/1602042,For Sale:  7mm-08 ammo,"Southeast Michigan - Adrian area, Michigan, United States",$ 25,"Listed On: Friday, June 28, 2013",Ammo,no type,no type,no type,no type,"I have a full box of 7mm-08 140g Winchester Ballistic Silvertips and a partial box (6) of 140g Remington Express Core Lokt. $25 or best offer for both

FTF only in Southeast Michigan, Northwest Ohio.

Thanks."
44,http://www.armslist.com/posts/1602044,"For Sale/Trade:  Remington 870 express super magnum 18"", w/full tactical rail, and tons of accessories","South Hills, Pittsburgh, Pennsylvania",$ 575,"Listed On: Sunday, May 26, 2013",Shotguns,Remington                                                                                ,12 Gauge                                                                                ,Pump Action                                                                                ,Shotgun,"Ultimate home defense shotgun! Remington 870 express super magnum. Can shoot 2 3/4, 3"", and 3 1/2"" I have added a black aces full length tactical quad rail($145.00), ATI pistol grip stock($45.00), MFT React Torch and Vertical Grip($55.00), BSA laser with weaver mount($25.00), AR-15 carry handle, L.E.D. Flashlight, Remington 18"" barrel ($100).

I also have the original 28"" barrel, and wood stock that was covered in a greyish textured paint that I'll include if the offer or trade is right. 

If you have any questions can call or text Chad at REDACTED. Yes, that's a 712 and not 412. I live in the South Hills and can meet you in the area to show the shotgun."
45,http://www.armslist.com/posts/1602045,For Sale/Trade:  Club Car Precedent (UPDATED-SEE BOTTOM OF DESCRIPTION),"Summerville, Charleston, South Carolina",$ 1,"Listed On: Friday, June 7, 2013",Miscellaneous,no type,no type,no type,no type,"Custom Club Car Precedent for sale/trade/partial trade. It is painted granite blue metallic and has the following:

*Headlights and taillights
*Over sized roof to cover back seat
*Overhead Pioneer CD Player and speakers in protective enclosure
*4 12vt 2011 Heavy Duty Interstate Batteries
*Full Windshield
*Attached Charger mounted in rear under seat
*Battery Charge Indicator
* Horn

The cart is priced at $2950.00 cash or trade. Call Eight43-4four2-201nine for inquiries. Thank you

****UPDATE:  FOR $3250.00 IN CASH OR TRADE I WILL INCLUDE A SET OF 22 INCH TERF/OFF-ROAD TIRES BALANCED AND MOUNTED ON BLACK WHEELS.  THERE IS APPROXIMATELY 90-95% TREAD LIFE ON 2 OF THE TIRES.  THE OTHER 2 ARE NEW."
46,http://www.armslist.com/posts/1602046,For Sale:  bulk ammo,"Rogers, Minnesota, United States",$ 1,"Listed On: Saturday, May 11, 2013",Ammo,no type,no type,no type,no type,"Gander Mountain in Rogers has .380, 9mm, 40S&W, and .223 bulk packs (200-350) rounds per pack on the shelves today for around $110 each. Get it while you can!"
47,http://www.armslist.com/posts/1602047,For Sale:  Interarms AKM underfolder,"canon city/pueblo area, Pueblo, Colorado",$ 900,"Listed On: Saturday, May 11, 2013",Rifles,no type,no type,no type,Rifle,"Im selling my Akm under folder by inter arms.  its in great shape, with only about 300 rnds through it. included are four magazines.  im asking $900"
48,http://www.armslist.com/posts/1602048,For Sale:  M&P 15-22 magazines,"Brookwood, Tuscaloosa, Alabama",$ 35,"Listed On: Saturday, May 11, 2013",Magazines,no type,no type,no type,no type,I have 5 M&P factory magazines. $150 for all or $35 each. All hold 25 rounds. Local pick up only. I've had problems with people and PayPal so I'm not even bothering. Feel free to TEXT ONLY. I work midnights some so please don't disturb lol 572-2691
49,http://www.armslist.com/posts/1602049,For Sale:  XM855 5.56 Penetrator,"St.Matthews, Louisville, Kentucky",$ 325,"Listed On: Saturday, May 11, 2013",Ammo,no type,no type,no type,no type,"420rd can of Federal XM855 62gr 5.56. $325 cash only, face to face in Louisville only. Thanks."
