,url,title,location,price,post date,category,manufacturer,caliber,action,firearm type,postcontent
0,http://www.armslist.com/posts/1421000,"For Sale/Trade:  Assorted Gun Parts For M1 Garand, 1911/1911A1, AR-15, Etc.","Lexington, Lexington, Kentucky",$ 100,"Listed On: Monday, April 8, 2013",Gun,no type,no type,no type,no type,"Have a couple of M1 Garand parts (stock ferrule, sling swivel). Assorted 1911/1911A1 parts (mainspring housing, links, springs,etc). Majority of the gun parts, and a few tools are for the AR-15 type guns (combo tool, stripper clips, stripper clip guide, pins, springs, A1 rear sight assembly, etc). Also have a low-light front sight assembly for a Yugo AK-47 (for the Mitchell Arms guns). Just email me with any questions. Would like to sell/trade all the parts as a package deal, Thanks for looking.

* Please just look at the pictures. Since I don't know some of the parts, just email me with any questions. Can't remember all of them, had them for a long time. I'm getting old and senile...lol *

** Asking for $100 obo, or trade **"
1,http://www.armslist.com/posts/1421001,For Sale/Trade:  Sar Arms SARSASP,"tulsa, Tulsa, Oklahoma",$ 450,"Listed On: Monday, April 8, 2013",Shotguns,no type,12 Gauge                                                                                ,Semi-automatic                                                                                ,Shotgun,Sar Arms SARSASP semi-auto tactical shotgun. Gun is brand new never fired. It has had shells in the magazine but never used. Gun does not have a box but I do have a brand new bull dog tactical case for the gun which is included in the price. Gun is flawless and has a clean record.
2,http://www.armslist.com/posts/1421002,"For Sale:  S&W 442 revolver, holster, speed loader, 200 rounds of target ammo.","Nova, Northern Virginia, Virginia",$ 700,"Listed On: Monday, April 8, 2013",Handguns,Smith & Wesson                                                                                ,38 S&W                                                                                ,Double Action                                                                                ,Revolver,"Like title says, I have a 442 for sale. It's in great condition, never shot and bought new a few months ago. I have an iwb holster, a speed loader and 200 rounds of target ammo. 700$ firm, don't bother emailing me with other offers. I'm in northern va."
3,http://www.armslist.com/posts/1421003,For Sale:  Ducks Unlimited 300 Win-Mag,"seymour, Springfield, Missouri",$ 850,"Listed On: Monday, April 8, 2013",Rifles,Mossberg                                                                                ,300 Winchester Magnum                                                                                ,Bolt Action                                                                                ,Rifle,Mossberg 4x4 300 win mag stainless with Nikon scope. for sale 850. or trade if interested please call REDACTED
4,http://www.armslist.com/posts/1421004,For Sale:  Tapco T6 Stock for Ruger 10/22,"Blue Springs, Kansas City, Missouri",$ 75,"Listed On: Monday, April 8, 2013",Gun,no type,no type,no type,no type,"Selling a Tapco T6 stock for the Ruger 10/22, in excellent condition. Stock is collapsible, color is ""dark earth."" A brand new one retails for 104.99 on the Cabela's website, this one is yours for $75."
5,http://www.armslist.com/posts/1421005,For Sale/Trade:  Center Point scope,"Terre Haute, Terre Haute, Indiana",$ 50,"Listed On: Monday, April 8, 2013",Optics,no type,no type,no type,no type,I have a new still in the package Center Point 3-9x32 scope for sale or trade. I'm asking 40obo.
6,http://www.armslist.com/posts/1421006,For Sale:  NEW ****9mm remington umc...****,"near frankfort, Kentucky, United States",$ 1,"Listed On: Monday, April 8, 2013",Ammo,no type,no type,no type,no type,"NEW NO RELOADS!!!!!!remington 9mm UMC 2  boxes of 250....will break down and sell in boxes of 50 for 24$ a box or sell whole box together for 110$

ALSO have 2 boxes of TULAMMO 9mm 20$ per box of 50
2 boxes of TULAMMO .40 for 25$ per box"
7,http://www.armslist.com/posts/1421007,For Sale:  Glock 17 mags,"Tulsa, Tulsa, Oklahoma",$ 15,"Listed On: Sunday, August 4, 2013",Magazines,no type,no type,no type,no type,Glock 17 KCI mags made in Korea. I have 3 left. All are brand new. $15 Each firm text or call REDACTED
8,http://www.armslist.com/posts/1421008,For Sale:  crimson trace laser grips for glock brand new never opened,"speedway, Indianapolis, Indiana",$ 150,"Listed On: Monday, April 8, 2013",Handguns,Glock                                                                                ,no type,Striker Fire,no type,Brand new never opened picture shows what models it will fit on ordered friday sold the glock this weekend 150 firm REDACTED
9,http://www.armslist.com/posts/1421009,For Trade:  Want to trade for a 45 ACP,"Springfield, Dayton, Ohio",Offer,"Listed On: Monday, April 8, 2013",Handguns,no type,45 ACP                                                                                ,no type,Pistol,"Would like to find a good trade deal on a 45 ACP. PRETTY OPEN TO MODEL

I have some nice shop power tools, wood working too that I would trade. Total value available, $875.
Email your interest for details and pictures"
11,http://www.armslist.com/posts/1421011,For Sale/Trade:  Smith & Wesson SD40VE,"East Burb, Cleveland, Ohio",$ 400,"Listed On: Sunday, April 14, 2013",Handguns,Smith & Wesson                                                                                ,40 S&W                                                                                ,Striker Fire                                                                                ,Pistol,"S&W SD40VE  2 - 14 round mags . Stainless slide. New in December with receipt.
 50 rounds down the pipe.
.40 s&w 

FtF transfer only. All regulations follwed."
12,http://www.armslist.com/posts/1421012,For Sale:  Winchester model 1894 .30.30,"Easton, Southeastern, PA, Pennsylvania",$ 350,"Listed On: Monday, April 8, 2013",Rifles,Winchester                                                                                ,30-30 Winchester                                                                                ,Lever Action                                                                                ,Rifle,I have a nice winchester 1894 for sale. Some bluing missing on receiver but the gun is in great working order
13,http://www.armslist.com/posts/1421013,For Sale/Trade:  Glock 17 gen 4 shaved frame with holster and ammo,"Howard 43028, Ohio, United States",$ 499,"Listed On: Monday, April 8, 2013",Handguns,Glock                                                                                ,9mm Luger (9x19)                                                                                ,Striker Fire                                                                                ,Pistol,"Hello, I have a gen 4 G17, newer production with the new factory guide rod. Purchased new about 9 months ago. My fingers did not fit in between the frame grooves, so I had them removed. It doesnt look factory, but not terrible. In no way effects structure. Also had a mag well installed, and the bottom of the frame where the mag well is had been dremeled out so there isnt any excess material. Factory case and goodies, and backstraps and two 17 round mags. Also have a Fobus paddle holster, 100 rounds of WWB and 50 rounds Hornady Steel Match. Did the work without intention of sale, but I had some $$ problems come up so I am taking a loss. I am willing to travel within reason. Also would entertain interesting trades with cash. I know some people hate the grips being messed with, but it fits my big ole mits perfect this way haha."
14,http://www.armslist.com/posts/1421014,Want To Buy:  7.62x25 Tokarev ammo,"Fremont, Nebraska, United States",Offer,"Listed On: Friday, April 19, 2013",Ammo,no type,no type,no type,no type,"I am looking to buy 7.62x25 Tokarev ammo.  Surplus or commercial is fine.

Text or call REDACTED

To the guy near Osmond, I lost your number, please text again."
16,http://www.armslist.com/posts/1421016,For Sale:  smith 9mm,"west, Janesville, Wisconsin",$ 450,"Listed On: Monday, April 8, 2013",Handguns,Smith & Wesson                                                                                ,9mm Luger (9x19)                                                                                ,Double / Single Action                                                                                ,Pistol,smith&wesson model 669 in 9mm  little holster ware 4 clips original box and holster
17,http://www.armslist.com/posts/1421017,For Sale:  DPMS 556,"Grandville, Grand Rapids, Michigan","$ 1,700","Listed On: Monday, April 8, 2013",Rifles,DPMS                                                                                ,223/5.56 NATO                                                                                ,Semi-automatic                                                                                ,Rifle,"Im selling a DPMS AR 15 556 for sale gun is in brand-new condition with less than  300 rounds fired through it. Gun comes with two steel 30 round mags and one steel 10 round mags. The gun is equipped with a quadrail,holographic scope, flashlight,laser and front foregrip and colapsable stock. Everything that you would want to put on it, it's already there! Asking $1700 or best offer. Reply via email or call/text 1-REDACTED"
18,http://www.armslist.com/posts/1421018,For Sale/Trade:  LNIB PARA SSP,"Sumner County, Nashville, Tennessee","$ 1,000","Listed On: Monday, April 8, 2013",Handguns,Para Ordnance                                                                                ,45 ACP                                                                                ,Single Action                                                                                ,Pistol,"Beautiful gun have 2 wilson mags, 1 pro mag, 1 para mag, holster and some ammo as well"
21,http://www.armslist.com/posts/1421021,For Sale:  1000 rds of 9mm,"Oklahoma city, Oklahoma, United States",$ 490,"Listed On: Monday, April 8, 2013",Ammo,no type,no type,no type,no type,"I have 20 boxes of Federal 9mm FMJ. I will break half if i have to $260 for 500. $490 for 1000 rds. NO TRADE. cash only
Text or email only 405-550-nine469"
22,http://www.armslist.com/posts/1421022,For Sale:  300 Remington S.A. Ultra Mag,"Dickson, Nashville, Tennessee",$ 75,"Listed On: Sunday, August 11, 2013",Ammo,no type,no type,no type,no type,I have two boxes for a total of 40 rounds.  Paid 55.99 per box.
23,http://www.armslist.com/posts/1421023,For Sale:  New Ar-15,"Cutlerville, Grand Rapids, Michigan","$ 1,200","Listed On: Monday, April 8, 2013",Rifles,no type,223/5.56 NATO                                                                                ,Semi-automatic                                                                                ,Rifle,"I am selling a brand new ar15 rifle.  This is an Rguns lower assembly with a red x arms upper.  This rifle has only 20rds through it.  It has a quad rail handguard, yankee hill flip up front sight gas block, magpul flip rear sight, and a 16"" M4 barrel with 1/9 twist.  The barrel is also nitride treated, making it extremely hard and wear resistant.  This rifle also comes with a red/green dot scope, vertical fore grip, tactical carry case and 2 aluminum mags, one 20rd and one 30rd.  $1200.  I will also consider trades for 223 and 9mm factory ammo."
24,http://www.armslist.com/posts/1421024,For Sale:  Stevens 311 20 gauge Side by Side Shotgun,"Lakeville, Minneapolis / St. Paul, Minnesota",$ 375,"Listed On: Saturday, April 13, 2013",Shotguns,Savage Arms                                                                                ,20 Gauge                                                                                ,Side by Side                                                                                ,Shotgun,"Selling my Stevens 311 20 gauge. It has 3"" chambers, 28"" barrels and double triggers. Fixed chokes. Very nice shotgun, no issues, no splits and no cracks. 
Great little American made side by side. To my knowledge there is no other sxs in this price range that can compete with it. 

I purchased this gun from a friend of the original owner. Next is what he told me,

""I purchased the shotgun from a friend of mine who purchased it new some years ago..He was in the Marine Corps during the Korean War and was a machine gunner..He wounded 3 times and won countless medals for valor.. Once he was out of the Military, he joined the Pennsylvania State Police and retired as a Captain. He was a hunter and this was his bird gun..""

Buyer must be willing to sign a bill of sale, show MN DL and have either a Permit to carry or Permit to purchase to prove you are legal to own a firearm.

Thank you"
25,http://www.armslist.com/posts/1421025,For Sale/Trade:  Cerakote firearms finishing,"Orange County, Riverside, California",$ 30,"Listed On: Thursday, September 26, 2013",Gun,no type,no type,no type,no type,"Custom cerakote finishing for ar15 lowers, 80% lowers, 1911 frames, ak47 parts and accersories, barrels etc... 

Very cheap prices for cerakoteing 

Available finishes:
Magpul flat dark earth
armor black
tactical grey
coyote tan
Tarjac green
Magpul OD green
Benelli sand
burnt bronze
patriot brown
zombie green
bright white
prison pink
micro slick
clear coat

Please email me what you would like done, it's a 1-3 day turn around for all paint jobs 
Or shoot me a text at REDACTED"
26,http://www.armslist.com/posts/1421026,For Sale:  250 rds Remington 'Gun Club' 12 Gauge Target Loads,"Monument, Colorado Springs, Colorado",$ 100,"Listed On: Monday, April 8, 2013",Ammo,no type,no type,no type,no type,"For sale are 250 rounds (10 boxes of 25) Remington 'Gun Club' Target Loads. 

$100, cash only.  Call or text me at (937) Six Eight Nine-6174"
27,http://www.armslist.com/posts/1421027,For Sale:  Thermold 30 round AR mags. Brand new,"Fairfield, Cincinnati, Ohio",$ 20,"Listed On: Monday, April 8, 2013",Magazines,no type,no type,no type,no type,I have some brand new Thermold 30 round AR mags for sale. $20 each. Can ship if needed. Thanks.
28,http://www.armslist.com/posts/1421028,For Sale:  glock 40 cal 31rnd mag unopened,"speedway, Indianapolis, Indiana",$ 75,"Listed On: Monday, April 8, 2013",Handguns,Glock                                                                                ,40 S&W                                                                                ,Striker Fire                                                                                ,Pistol,Brand new got todAy in mail sold glock yesterday do not need text REDACTED
29,http://www.armslist.com/posts/1421029,For Sale:  Savage Tactical 12 Gauge,"Reno, Reno, Nevada",$ 400,"Listed On: Monday, April 8, 2013",Shotguns,Savage Arms                                                                                ,12 Gauge                                                                                ,Pump Action                                                                                ,Shotgun,"Tactical 12 Gauge
Fully loaded..holds 5 plus 1.....
Includes- laser, light, strobe, butt sleeve,
Sling, soft case, pistol grip sleeve, ammo
Less than 30 rounds through it......
Great defense gun or blaster......perfect new condition!"
31,http://www.armslist.com/posts/1421031,For Sale:  S&W SD9VE + 220 rds.,"mid, Tulsa, Oklahoma",$ 500,"Listed On: Monday, April 8, 2013",Handguns,Smith & Wesson                                                                                ,9mm Luger (9x19)                                                                                ,Double Action                                                                                ,Pistol,"200 rds. fired. Comes with two 17 round mags,original box,all paperwork,and lock. Aslo comes with 200 rds. of 115gr. fmj. and 20 self defense rds. No trades."
33,http://www.armslist.com/posts/1421033,For Sale:  Marlin 30-30 Excellent Condition,"Hohenwald, TN, Nashville, Tennessee",$ 450,"Listed On: Monday, April 8, 2013",Rifles,Marlin                                                                                ,30-30 Winchester                                                                                ,Lever Action                                                                                ,Rifle,"Marlin 30-30 shot a few times comes about five boxes and about an extra 15 rounds

asking $450 with ammo OBO"
34,http://www.armslist.com/posts/1421034,For Sale/Trade:  winchester 1894,"thomasville, Greensboro, North Carolina",$ 400,"Listed On: Sunday, April 21, 2013",Rifles,Winchester                                                                                ,30-30 Winchester                                                                                ,Lever Action                                                                                ,Rifle,"excellent condition. stock is perfect looking to get a nice 9mm, .40 or possibly a 45 acp.
worst i say is no. rounds available as well $20 per 20 rounds which is what they're running at walmart or included for the right trade.

ONLY TRADE FOR OTHER GUN'S"
35,http://www.armslist.com/posts/1421035,For Sale:  Ruger m77. 250 savage,"Lacrosse, Wisconsin, United States",$ 550,"Listed On: Monday, April 8, 2013",Rifles,Ruger                                                                                ,no type,Bolt Action                                                                                ,Rifle,"Tang safety. Red butt pad. Bluing is near perfect. The stock does have some handling marks
Caliber is 250 savage. $REDACTED213"
36,http://www.armslist.com/posts/1421036,For Sale:  FOR SALE,"Monroe, Washington, United States",$ 15,"Listed On: Monday, April 8, 2013",Gun,no type,no type,no type,no type,"M15 GRENADE LAUNCHER SIGHT FOR THE FOLLOWING: m1903, m1903A1, 1903A3 M1 RIFLES AND M1 CARBINE. Steal in wrapper, unopened. $15.00 and I will ship to you or meet in Monroe."
37,http://www.armslist.com/posts/1421037,For Trade:  Smith and Wesson model 10 Trade for Gen 2 or 3 Glock 19 or 17,"Columbus, Columbus, Ohio",Offer,"Listed On: Monday, April 8, 2013",Handguns,Smith & Wesson                                                                                ,38 S&W Special                                                                                ,Double / Single Action                                                                                ,Revolver,I have a used model 10 smith .38 it has holster wear but it locks up really nice want to trade for Gen 2 Glock 19 or 17. can add ammo if needed. can send pics on request.
38,http://www.armslist.com/posts/1421038,For Sale:  Sig sp2022 9mm,"Oakland county, Detroit, Michigan",$ 425,"Listed On: Monday, April 8, 2013",Handguns,Sig Sauer                                                                                ,9mm Luger (9x19)                                                                                ,Double / Single Action                                                                                ,Pistol,Used but excellent shape SIG SP2022 9mm 1 15rd magazine $425. Must be able to get a purchase permit or have a CPL
39,http://www.armslist.com/posts/1421039,For Sale:  AR-15  .223/5.56 MAGAZINES,"AMELIA, Cincinnati, Ohio",$ 1,"Listed On: Monday, April 8, 2013",Magazines,no type,no type,no type,no type,NEW THERMOLD 20rd. MAGS. $25
41,http://www.armslist.com/posts/1421041,For Trade:   TRADE ONLY...SIG SAUER 1911-22-FDE,"Bowling Green/Findlay, Lima, Ohio",Offer,"Listed On: Monday, April 8, 2013",Handguns,Sig Sauer                                                                                ,22 Long Rifle                                                                                ,Double / Single Action                                                                                ,Pistol,"LNIB..Less than a year old, Original box, manual, tools and 1 magazine"
42,http://www.armslist.com/posts/1421042,For Sale:   GSG 522 22 LWT,"East Bend (336)692-0317, Winston Salem, North Carolina",$ 425,"Listed On: Monday, April 8, 2013",Rifles,German Sport Guns                                                                                ,22 Long Rifle                                                                                ,no type,Rifle,"American Tact 522CLB22 GSG522  Carb SA 22 LR 16.25"" 22+1 Fixed Pos Stk Blk

The GSG-522 has the established features of MP5-Style-Rifles, but with
visual improvements which also meet a better functional purpose. First the
better grip of the cocking lever, second the improved open sights for
faster aiming, and third the GSG-522 comes with a removable Weaver Rail,
which allows the customer to fix an optical device at customer's option.
The ergonomically handle with anti-Slip-Points are redesigned as well as
the  safety lever. 110 rd drum also available for an additional $120.00


SPECIFICATIONS:
Mfg Item Num:       522CLB22    
Category:           TACTICAL RIFLES               
Action              :Semi-Automatic
Caliber             :22 Long Rifle
Barrel Length       :16.25""
Capacity            :22+1
Trigger             :Standard
Safety              :Manual
OAL                 :33.6""
Weight              :
Stock               :Fixed
Metal Finish        :Black

We accept visa/mastercard/discover at a 3% loss of cash. USPS money orders same as cash.If sending money order you will be required to obtain & send tracking number. 25.00 Shipping NC. residence pay 6.75% sales tax. You can email or call Brad with Carolina Firearms at REDACTED. Business Hours are Mon-Sat 9am until 10pm, Sun 2pm until 10pm."
43,http://www.armslist.com/posts/1421043,For Sale:  1650 Rounds of Federal .22LR,"Akron, Ohio, United States",$ 55,"Listed On: Monday, April 8, 2013",Ammo,no type,no type,no type,no type,"I have 3 boxes of Federal .22 Long Rifle ammo for sale. The ammo is copper hollow points and each box contains 550 rounds.

Will sell for $55 per box. Local sale and cash only please .

If interested please email, text or call me at REDACTED. Thanks"
44,http://www.armslist.com/posts/1421044,For Sale/Trade:  Mossberg special purpose 12ga tactical,"Scottsburg, Indiana, United States",$ 350,"Listed On: Thursday, April 25, 2013",Shotguns,Mossberg                                                                                ,12 Gauge                                                                                ,Pump Action                                                                                ,Shotgun,"Mossberg 12 gauge pump action shotgun. 
It has a 20"" barrel, a heat shroud, a pistol grip,
has the large shot tube. (8+1)."
45,http://www.armslist.com/posts/1421045,For Sale/Trade:  Brand New S&W M&P 15 Complete upper receiver(need to sell)  Make Me And offer!!,"Santa Barbara, Los Angeles, California",$ 500,"Listed On: Wednesday, August 28, 2013",Rifles,Smith & Wesson                                                                                ,223/5.56 NATO                                                                                ,Semi-automatic                                                                                ,Rifle,"Brand new never fired S&W 556/223. comes with CA bullet button. Motivated to sell make me an offer!

500 OBO

text or call REDACTED"
46,http://www.armslist.com/posts/1421046,Want To Buy:  IM LOOKING TO BUY THE SIG SAUER P238 THE SCORPION AND THE P 938 SAME,"BUTLER COUNTY, Cincinnati, Ohio",Offer,"Listed On: Monday, April 8, 2013",Handguns,Sig Sauer                                                                                ,380 ACP                                                                                ,Double / Single Action                                                                                ,Pistol,IM LOOKING TO BUY OR TRADE FOR THE SCORPION SIG SAUER P 238 AND THE P 938 THANK YOU IF YOU HAVE ONE OR BOTH EMAIL ME AND SEND ME YOUR NUMBER SO WE CAN WORK SOMETHING OUT IM LOOKING FOR NEW OR VERY CLOSE TO NEW THANKS ED
47,http://www.armslist.com/posts/1421047,For Sale:  Tapco 30rd ak mag 7.62x39,"lynnwood, Seattle, Washington",$ 10,"Listed On: Monday, April 8, 2013",Magazines,no type,no type,no type,no type,"I have 1 tapco ak 47 mag left just making room for my steel mags it works great only used it once and if i said it was new you would totally believe it. Don't support these people charging crack prices for this stuff people, cabela's in marysville has these for like 15 bucks DO NOT PAY MORE THAN THAT! ESPECIALLY USED!  and don't forget to keep supporting the 2A :)!!! (we can keep winning but we can't give up!) local ftf only"
48,http://www.armslist.com/posts/1421048,For Sale:  Sig Sauer P250,"Highlands Ranch, Colorado, United States",$ 500,"Listed On: Monday, April 8, 2013",Handguns,Sig Sauer                                                                                ,9mm Luger (9x19)                                                                                ,Double / Single Action                                                                                ,Pistol,"For sale a Sig Sauer P250 9mm
Comes with One Mag 
Used
Easily convertable 
Great Gun adapts to your hands!!!

If interested contact me"
