,url,title,location,price,post date,category,manufacturer,caliber,action,firearm type,postcontent
447,http://www.armslist.com/posts/1602447,For Sale:  .223 ammo,"Mooresville, Charlotte, North Carolina",$ 35,"Listed On: Wednesday, May 29, 2013",Ammo,no type,no type,no type,no type,.223 55 grain FMJ Black Hills ammo. 78 rounds. This was my son's ammo and he sold his rifle.
449,http://www.armslist.com/posts/1602449,For Trade:   	 22lr phoenix 22a semi auto pistol new in box WTT,"Orlando, Orlando, Florida",Offer,"Listed On: Saturday, May 11, 2013",Handguns,Phoenix Arms                                                                                ,no type,no type,Pistol,Would like to trade this brand new phoenix 22a pistol semi auto. It is brand new in the box with everything that comes with it new. I bought it new and has never been shot. I would like to trade for a 22lr revolver or maybe other guns. Let me know. I can add cash for the right deal.
450,http://www.armslist.com/posts/1602450,For Sale:  Smith and Wesson factory M&P15-22 10 round long magazine NEW,"Omaha, Omaha, Nebraska",$ 30,"Listed On: Saturday, May 11, 2013",Magazines,no type,no type,no type,no type,"Brand new in bags m&p15-22 10 round long magazines. can be converted to 25.
$30 each. leave a number on message I'll contact you.
4 mags available.

trades interested are red dot optics (micro clone or bushnell trs-25), .22lr ammo. 9mm ammo"
451,http://www.armslist.com/posts/1602451,For Sale/Trade:  Springfield XDS 45 + Ammo,"Liberty/Easley, Greenville, South Carolina",$ 800,"Listed On: Tuesday, July 2, 2013",Handguns,Springfield                                                                                ,45 ACP                                                                                ,Double Action                                                                                ,Pistol,"Up for sale or trade is my like new (only 100 rounds fired) Springfield XDS 45. Included are (2) 5 round mags, an Uncle Mike's IWB holster, a 20 round box of Gold Dot personal protection ammo and the XDS box with factory paddle holster, mag holster, lock, factory fired casing and all paperwork. I also have 400 rounds of Blazer 230 grain FMJ. Total package price = $800

I am a SCCWP holder and prefer to sell to the same, but will make an exception if you're a SC resident, present a valid SC drivers license and are willing to complete a firearms bill of sale, which I'll provide.

I live in Liberty and can meet anywhere between Seneca, Anderson or Greenville.

E-mail using the 'Contact Seller' option and I'll get back to you ASAP."
452,http://www.armslist.com/posts/1602452,For Sale:  Sig Sauer P226 (nickel) 9mm package,"downtown, Fort Collins, Colorado","$ 1,200","Listed On: Saturday, May 11, 2013",Handguns,Sig Sauer                                                                                ,9mm Luger (9x19)                                                                                ,Double / Single Action                                                                                ,Pistol,"Sig Sauer P226 with original nickel plated slide made in W. Germany. 

1x 15 rd and 4x 13rd magazines. Comes with just under 500 rounds

Has upgraded sights and grips. Comes in a hard case with a paddle holster. 

$1200 or best offer 

Serious buyers please include phone number in your e-mail. Thanks."
453,http://www.armslist.com/posts/1602453,For Sale:  FS Bulgarian AK-74,"mchenry, Illinois, United States",$ 900,"Listed On: Saturday, May 11, 2013",Rifles,Century International Arms                                                                                ,5.45x39mm                                                                                ,Semi-automatic                                                                                ,Rifle,"For Sale Bulgarian AK-74 Bulgarian Wood Furniture Tapco G2 trigger comes with Bulgarian Circle 10 21 and 25 30 round magazines 6 total magazines 2 of them fire Brick red for collectors. Also comes with 1,080 rounds of 5.45x39 cash only no trades or I wouldn't get rig of it"
455,http://www.armslist.com/posts/1602455,For Sale:  Beretta 3032 tomcat-32 Stainless Steel,"Se PDX, Portland, Oregon",$ 435,"Listed On: Friday, May 17, 2013",Handguns,Beretta USA                                                                                ,32 ACP                                                                                ,Double Action                                                                                ,Pistol,"This is a practically brand new .32 Beretta 3032 tomcat-32 in Stainless Steel. It is in perfect shape. It has been fired a few times however there are no scratches anywhere on the firearm. This is a hard to find little gun, It does not come with a box, however it does have the factory paperwork. It is Double Action!

I am willing to ship this firearm for an additional 20.00"
456,http://www.armslist.com/posts/1602456,For Sale:  120 rds 223 tulammo ammo,"tulsa, Tulsa, Oklahoma",$ 50,"Listed On: Saturday, May 11, 2013",Ammo,no type,no type,no type,no type,"I have 120rds 223 tulammo 
Text or call me REDACTED"
457,http://www.armslist.com/posts/1602457,"For Sale:  Win. Model 37A .410 Single Shot 26"" bl. 3"" Full Choke Break Open","S.E., Grand Rapids, Michigan",$ 295,"Listed On: Saturday, May 11, 2013",Shotguns,Winchester                                                                                ,410                                                                                ,Single Shot                                                                                ,Shotgun,"Win. Model 37A .410 Single Shot 26"" bl. 3"" full choke break open. Bluing and bore excellent. Some clear finish worn off one side of stock. Has the wide beavertail fore-end. 60's early 70's. REDACTED"
458,http://www.armslist.com/posts/1602458,For Sale:  Rock River Elite Operator-2 Mid-Length,"Greer, Greenville, South Carolina","$ 1,600","Listed On: Saturday, May 11, 2013",Rifles,Rock River Arms                                                                                ,223/5.56 NATO                                                                                ,Semi-automatic                                                                                ,Rifle,"Rock River Elite Operator-2 w/hard case, two mags, tactical carry handle, two stage trigger.  Less than 100 rounds thru gun.

Contact Tim REDACTED"
459,http://www.armslist.com/posts/1602459,For Sale:  Colt Series 70 1911,"Jonesboro, Jonesboro, Arkansas","$ 1,400","Listed On: Saturday, May 18, 2013",Handguns,Colt                                                                                ,45 ACP                                                                                ,Single Action                                                                                ,Pistol,"Very nice colt series 70 1911 mfg in the 70s
nickle plated 
text me at REDACTED

Thanks"
461,http://www.armslist.com/posts/1602461,For Sale:  Springfield 1911-M1,"Ft Smith, Fort Smith, Arkansas",$ 800,"Listed On: Saturday, May 11, 2013",Handguns,Springfield                                                                                ,45 ACP                                                                                ,Double / Single Action                                                                                ,Pistol,"Springfield 1911-M1     45acp  upgraded sights and trigger, shoots like a Springfield should. Comes with leather Tagua holster, range bag and original factory case, 8 mags-2-Wilson Combat, 2-Pachmyr, 2- factory issue, 1-Kimber, 1- Mec-gar  Located in Ft Smith cash only  no trades."
463,http://www.armslist.com/posts/1602463,For Sale:  30-06 ammo,"Salisbury, Winston Salem, North Carolina",$ 60,"Listed On: Sunday, June 2, 2013",Ammo,no type,no type,no type,no type,"I have;  
2 full boxes of 150 GR. Remington Core-Lokt  PSP
1 full box of 165 GR. Winchester PSP
1 full box of 150 GR. Winchester PHP
7 rounds of 150 GR. Winchester Ballistic Silver Tip
15 rounds of 165 GR. Hornaday BTSP InterLock
Not interested in selling separately. $75 for all of them
Call or text me at REDACTED"
464,http://www.armslist.com/posts/1602464,For Sale/Trade:  85 GMC Sierra 4x4,"Rogers, Fayetteville, Arkansas","$ 4,000","Listed On: Saturday, May 11, 2013",Vehicles,no type,no type,no type,no type,"I have a red 4x4 GMC Sierra for sale. Runs great. Very fun toy! I am looking to full trade, partial trade and cash, or for the right gun or guns full trade and cash from me. E-mail for details."
465,http://www.armslist.com/posts/1602465,For Sale:  COLT LE6920 NIB,"Alamogordo, Las Cruces, New Mexico","$ 1,300","Listed On: Saturday, May 11, 2013",Rifles,Colt                                                                                ,223/5.56 NATO                                                                                ,Semi-automatic                                                                                ,Rifle,"NEW IN BOX ONLY OUT FOR PICTURES. COLT LE 6920 2013 Edition. 556 CAL. 16"" barrel. Call or text at REDACTED."
466,http://www.armslist.com/posts/1602466,For Sale:  Mossberg 930 Spx semi auto shotgun,"Carmel, Indianapolis, Indiana",$ 650,"Listed On: Saturday, May 11, 2013",Shotguns,Mossberg                                                                                ,12 Gauge                                                                                ,Semi-automatic                                                                                ,Shotgun,I have a never shot mossberg 930 spx. I am mostly looking to sell but i will take a lesser shotgun and cash if its just right. I am the original owner and it was bought brand new. I also believe i still have the box as well. I am asking 650 obo . Or a trade and cash towards my end. The shell sleeve does not come with it . No loball offers they will be ignored. I know what this is worth. Text 3one7 71zero 3six9five. I also cannot travel far and would prefer you come to me as im not fond of toting this around and selling in public. I also require a ltch as i want to make sure who im selling to. Thanks for looking!
468,http://www.armslist.com/posts/1602468,For Sale:  Box of ammo,"estacada, Portland, Oregon",$ 200,"Listed On: Saturday, May 11, 2013",Ammo,no type,no type,no type,no type,"4 boxes of .223 give or take, partial box of Remington 300 win mag (4missing) box of 50 Winchester .45 ammo, some hollow point .45 box of 50 hollow point .22 asking 200 for all  John REDACTED"
469,http://www.armslist.com/posts/1602469,For Sale:  9MM 200 RDS,"Tulsa/sapulpa, Oklahoma, United States",$ 80,"Listed On: Saturday, May 11, 2013",Ammo,no type,no type,no type,no type,200 rounds of 9mm $80
470,http://www.armslist.com/posts/1602470,For Sale:  Glock G27 3rd Gen sub-compact with Ameriglo I-dot Pro night sights,"Frankfort, Lexington, Kentucky",$ 480,"Listed On: Saturday, May 11, 2013",Handguns,Glock                                                                                ,40 S&W                                                                                ,Striker Fire                                                                                ,Pistol,"Glock G27 3rd gen sub-compact with Ameriglo I-dot Pro tritium night sights. Also has a set of Talon rubberized grip decals installed(which can be easily removed) The pistol is in excellent condition with a low round count, this is a great concealed carry handgun. The gun will come with the 2 factory 9rd mags one with pinky extension installed, factory case & paperwork. The price is firm $480 cash in Frankfort area. Thanks"
471,http://www.armslist.com/posts/1602471,For Trade:  glock 30 and glock 23,"greenwood, Indianapolis, Indiana",Offer,"Listed On: Saturday, May 11, 2013",Handguns,Glock                                                                                ,45 ACP                                                                                ,Double Action                                                                                ,Pistol,"i want to trade either my glock 30 gen3 or glock 23 gen 3 mainly for a springfield xd prefer 45acp but will consider 9mm and 40. both guns are like new in the box with very low round counts. i have extras for each gun as well.

you can contact me at REDACTED and i will text pics and let you know everything they come with."
472,http://www.armslist.com/posts/1602472,For Sale:  30rd Gen2 PMAGS with Window Black,"West, San Antonio, Texas",$ 15,"Listed On: Saturday, May 11, 2013",Magazines,no type,no type,no type,no type,"OK gents.  I finally scored some 20rd PMAGS at a decent price.  I am looking to unload 5-10 Black 30 round gen2 PMAGS WITH windows to make room for the new addition.  

Price is $15 per mag, firm.

First come first served with cash in hand.  1604&Potranco area only.

REDACTED"
474,http://www.armslist.com/posts/1602474,Want To Buy:  Kel-Tec PMR-30,"Carolina Forest, Myrtle Beach, South Carolina",Offer,"Listed On: Saturday, May 11, 2013",Handguns,Kel-Tec                                                                                ,no type,Double / Single Action                                                                                ,Pistol,I'm looking to purchase or trade for a Kel-Tec PMR-30.
475,http://www.armslist.com/posts/1602475,For Sale:  Mauser Bayonets,"Travelers Rest, SC, Greenville, South Carolina",$ 75,"Listed On: Friday, August 8, 2014",Gun,no type,no type,no type,no type,"Two Mauser bayonets that are Serbian  made. They originally were made for the Mauser Model 24 but will fit any Mauser 8mm rifle. One is brand new with matching serial numbers on the scabbard. The frog has been used but this bayonet is museum quality. The other looks new, but the serail numbers on the bayonet and scabbard do not match there fore I am asking $50.00 for this one. It too, looks new, but had a polished blade and bolster whereas the new one is jet black from the factory . Both were made in 1944 during the midst of WWII. Sorry the picture wasn't any clearer."
477,http://www.armslist.com/posts/1602477,For Sale:  Ds arms ar-15,"Mchenry, Rockford, Illinois","$ 1,200","Listed On: Saturday, May 11, 2013",Rifles,DS Arms                                                                                ,223/5.56 NATO                                                                                ,Semi-automatic                                                                                ,Rifle,Ds arms 223/556 ar-15 comes with a couple usgi mags and cleaning kit.   Never fired brand new
478,http://www.armslist.com/posts/1602478,For Sale:  new england firearms pardner 410,"douglasville, Atlanta, Georgia",$ 200,"Listed On: Saturday, May 11, 2013",Shotguns,H&R                                                                                ,410                                                                                ,Break Open                                                                                ,Shotgun,New england firearms pardner 410 single shot shotgun new 200 cash a full box of 25 shells included
479,http://www.armslist.com/posts/1602479,Want To Buy:  300BLK UPPER WANTED,"Greer, Greenville, South Carolina",Offer,"Listed On: Thursday, May 23, 2013",Rifles,no type,no type,Semi-automatic                                                                                ,Rifle,Looking for a 300blk upper. Will buy or trade. Send me offers with descriptions and price.
481,http://www.armslist.com/posts/1602481,For Sale:  GLOCK 19 GEN 4 with Beavertail Straps,"SW, Indianapolis, Indiana",$ 625,"Listed On: Saturday, May 11, 2013",Handguns,Glock                                                                                ,9mm Luger (9x19),no type,no type,"GLOCK 19 GEN 4
Brand New In Box, never fired
Rare Beavertail Edition - comes from GLOCK with  2 sets of back straps, 1 Regular set & 1 Beavertail set. GLOCK is not shipping these on all GEN 4's, it is very random.  
$625"
482,http://www.armslist.com/posts/1602482,For Sale:  COLT MODEL SINGLE ACTION ARMY -- CALIBER 38 WCF 38-40 REVOLVER MADE 1908 C&R OK,"Oregon, Oregon, United States",$ 900,"Listed On: Saturday, May 11, 2013",Handguns,Colt                                                                                ,no type,Single Action                                                                                ,Revolver,"THIS IS A COLT SINGLE ACTION ARMY IN CALIBER 38-WCF ((38-40))REVOLVER MADE IN 1908. THE BORE HAS A MEDIUM SHINE WITH A HINT OF LITE FROST TO IT. THE CYLINDERS HOLES ARE BRIGHT AND SHINY VERY NICE. THE FINISH IS A BIT WORN AND HAS SLIGHT PATINA TO IT BUT THERE'S STILL SOME CASE COLORS ON IT. THE TIMING AND LOCKUP ARE VERY GOOD AND THERE'S 5 CRISP CLICKS TO EVERY HAMMER PULL. THE BARREL IS 4-3/4"" LONG AND THE GUN ALL AND ALL SEEM TO FUNCTION LIKE IT SHOULD AND IS A GOOD ON FOR THE COLLECTION."
483,http://www.armslist.com/posts/1602483,For Sale:  633 rounds of .233 bullets,"Parkersburg/Vienna, Charleston, West Virginia",$ 325,"Listed On: Saturday, May 11, 2013",Ammo,no type,no type,no type,no type,OBO REDACTED
484,http://www.armslist.com/posts/1602484,For Sale:  Aquila .380 Auto JHP,"70th & Vine, Lincoln, Nebraska",$ 26,"Listed On: Saturday, May 11, 2013",Ammo,no type,no type,no type,no type,"2- Aquila 380 Auto 90gr Jacketed Hollow Point 50 rounds per box
$ 26/Box or both boxes for $45"
485,http://www.armslist.com/posts/1602485,For Sale:  Remington 700 .270,"Miami, Miami-Dade, South Florida",$ 500,"Listed On: Saturday, May 11, 2013",Rifles,Remington                                                                                ,270 Winchester                                                                                ,Bolt Action                                                                                ,Rifle,"I have a synthetic stock 700 in .270 with a Nikon Buckmasters 3-9x40 scope. The rifle is in good shape with some marks on the barrel. No rust just white scuffs from hunting with it. I am asking $500 FTF in South Florida. 

I would like to trade for a basic Ruger Mini 14 or 30."
486,http://www.armslist.com/posts/1602486,For Sale:  KELTEC SUB-2000 .40 S&W Carbine w/Lots of Accessories!,"Joliet, Chicago, Illinois",$ 450,"Listed On: Saturday, May 11, 2013",Rifles,Kel-Tec                                                                                ,40 S&W                                                                                ,Bolt Action                                                                                ,Rifle,"KELTEC SUB-2000 .40 S&W Carbine 

Including:

•	Qty 1 – Keltec Sling
•	Qty 1 – Tacticool Bolt Tube Cover
•	Qty 1 – Tacticool Operating Handle Cover
•	Qty 4 – 20 Round Beretta 96 Magazines
•	Qty 1 – Case
•	Qty 1 – Product Booklet

Original Owner – 250 Rounds

-------------------------------------------------------------------------------------------
Cash or Trade for .40 S&W Handgun/Carbine or AR-15 5.56 UPPER
-------------------------------------------------------------------------------------------

** VALID ILLINOIS FOID *** BILL OF SALE INCLUDED ***"
487,http://www.armslist.com/posts/1602487,For Sale:  870 Tactical,"Apex, Raleigh / Durham / CH, North Carolina",$ 400,"Listed On: Saturday, May 11, 2013",Shotguns,Remington                                                                                ,12 Gauge                                                                                ,Pump Action                                                                                ,Shotgun,"Remington 870 Tactical with door breaching choke tube. 12 Gauge 8 capacity mag Ghost ring sights. Bought it for $600 looking to get 400, need some cash. Call or text REDACTED"
488,http://www.armslist.com/posts/1602488,For Sale:  Taurus PT840 .40 Caliber Pistol,"Del City, Oklahoma City, Oklahoma",$ 395,"Listed On: Monday, June 10, 2013",Handguns,Taurus                                                                                ,40 S&W                                                                                ,no type,Pistol,"Taurus PT840 .40 Caliber Pistol - $395.00

No emails, please.

Call REDACTED or come by Best Buy Pawn and Gun in Del City. (4312 SE 29th Street near SE 29th and Sunnylane) - Make sure you mention you saw it on Armslist!

If you are out of state, we can ship these to a FFL dealer. Shipping out of state is $20 for all hand guns and $30 for long guns. Payments can be made using a credit card by phone or with postal money order. 

You can also come check out our guns at our store!!

Business Hours:
Monday - Friday 9am - 7pm
Saturdays 9am - 5pm
Sundays - Closed"
489,http://www.armslist.com/posts/1602489,For Sale/Trade:  500 rounds of 223 Rem. 5.56 ammo Barnaul Brown Bear.,"Hillsborough, Raleigh / Durham / CH, North Carolina",$ 225,"Listed On: Saturday, May 11, 2013",Ammo,no type,no type,no type,no type,"1 unopened case of 500 rounds 55g FMJ ammo made by Barnaul, same manufacturer of Silver Bear and Golden Bear, Russian made ammo llike Wolf.
$225
REDACTED"
490,http://www.armslist.com/posts/1602490,For Sale:  2000 Rounds 22lr CCI Mini-Mag HP & Winchester,"Augusta, Augusta, Georgia",$ 280,"Listed On: Saturday, May 11, 2013",Ammo,no type,no type,no type,no type,"x7 (100 rounds each) CCI Mini Mag HP 1260 fps 36 grain Plated Hollow Point
x16 (50 rounds each) Winchester Power Point High Velocity 40 grain X22LRPP
x4 (50 rounds each) Winchester Hollow Point High Velocity 37 grain X22LRH
x6 (50 rounds each) Winchester T22 Match Lead Round Nose 40 grain

Willing to ship. I accept PayPal for payment."
491,http://www.armslist.com/posts/1602491,For Sale:  LNIB Beretta 84FS Cheetah .380,"East Side, Lafayette, Indiana",$ 800,"Listed On: Saturday, May 11, 2013",Handguns,Beretta USA                                                                                ,380 ACP                                                                                ,Double / Single Action                                                                                ,Pistol,"Italian made Beretta .380 never carried/no marks/safe queen pistol, condition is 9.9 out of 10. The only wear on the entire gun is on the feed ramp which doesn't even have all of the black finish worn off! Exactly one box 50 rounds ran through this fine .380. Comes with 2 factory 10 round mags and 2 aftermarket 13 round mags all fit flush. This is a great shooting .380 no longer available for purchase here in the US. Also included are all items included in original case: blue plastic factory case itself, grey cardboard outer factory case, lock, manuals, 2 cleaning brushes, parts cup. I am also tossing in 50 rounds of .380 Mag Tech jacketed hollow points and 110 rounds of ball target rounds. 100 of the ball rounds are reloads (none were ever fired in this gun, just bought to have due to ammo shortage in case I felt the need to take it to the range but never did) the other 10 are S&B factory rounds I had laying around for years.

These sell online with 2 mags and no ammo for $850+ in worse condition. Take this chance to own a unique firearm no longer available and the best .380 I have ever fired!

Price is firm low offers will be ignored. I have no problem keeping this pistol or selling via online auction if need be. Buyer must have valid Indiana ID and license to carry and sign bill of sale, or meet at local gun shop to fill out 4473 form for transfer of ownership ($20 expense to buyer)."
492,http://www.armslist.com/posts/1602492,For Sale:  Magpul/Red X Arms AR15,"Duluth, MN, Minnesota, United States","$ 1,000","Listed On: Friday, May 17, 2013",Rifles,no type,223/5.56 NATO                                                                                ,Semi-automatic                                                                                ,Rifle,"This is a custom built AR15. Aero Precision lower receiver, RedXArms Upper, OD green Magpul furniture, 16"" 1:7 twist barrel. 5 months old, Less than 1000 rounds through it. Shoots and looks great. Asking 1,000 OBO for this. Please respond to this add, or call/text me at REDACTED."
493,http://www.armslist.com/posts/1602493,"For Sale/Trade:  Ammo, not at gun show prices!","Holland, Toledo, Ohio",$ 1,"Listed On: Saturday, May 11, 2013",Ammo,no type,no type,no type,no type,"I have 1650 rounds of 22lr, 250 rds 9mm, 100 rds of .223, 100 rds of 556

The 22lr is one 525 Remington, I paid $50 plus tax at Buffalo Trading in Findlay Sell for $50.  

.Also 5 225 Remington gold I paid $25 each for at Gander. Sell for $25 ea.

.223 I paid $11.99 plus tax, so $12.85 a box at Cabelas. Sell for 13 a box. Have 10.

Last, I have 9mm I paid $17.99 a box plus tax, so $19.25. Sell for $19. Have 8."
