,url,title,location,price,post date,category,manufacturer,caliber,action,firearm type,postcontent
717,http://www.armslist.com/posts/1421717,For Sale:  Boberg XR9-S,"Newcastle, Oklahoma City, Oklahoma",$ 900,"Listed On: Sunday, April 14, 2013",Handguns,no type,9mm Luger (9x19)                                                                                ,Double Action                                                                                ,Pistol,"Up for sale is the hard to find Boberg XR9-S.  This little pistol has had a grand total of 30 rounds fired through it.  Functions flawlessly, was cleaned and oiled before it was put away a little over a year ago.  I have the original box and paperwork with this firearm.  

These are basically a bullpup pistol design, allowing for a longer barrel in a small, concealable frame.  Pistol will fire +p ammo.  I am the original owner, went through the waiting process at Boberg, and it was worth it.  However I am selling this to fund a project.  Not many people have heard of these, and they are not everyone's cup of tea because you can buy a 9mm cheaper, but these are just quality in every sense of the word.   Price will reflect a this as a used (however slightly) firearm, and will be set at 900.00.   I challenge someone to find one this nice for a cheaper price!   The firearm is located in Newcastle, FTF and cash is required.

If you have any questions, please feel free to call me at 4zero5-6two6-one8one4.

-Adam"
718,http://www.armslist.com/posts/1421718,For Sale:   **PRICE REDUCED** LIKE NEW DPMS ORACLE 5.56/.223 W/LOTS OF EXTRAS,"NE Heights, Albuquerque, New Mexico","$ 1,500","Listed On: Monday, April 8, 2013",Rifles,DPMS                                                                                ,223/5.56 NATO                                                                                ,Semi-automatic                                                                                ,Rifle,"I have a like new DPMS oracle RFAC-03 5.56/.223 AR-15 rifle (going anywhere from $750.00 up to $1,000+).This rifle has about 300-350 rounds fired through it and has been cleaned and maintained after every outing. This Rifle is completely upgraded as far as accessories;
1-Black Magpul MOE 6 position stock. going for $ 50.00
1- Black Magpul MOE Hand guard. going for $ 30.00
1-Black Magpul MOE vertical grip. going for $ 20.00
1-Stark Industries grip W/ built in trigger guard. going for $37.00
1- Vortex strike fire red/green dot system W/ magnifier. going for $169.99
1- set of flip up iron sights. going for $49.97
5- 30 round magazines (2 Magpul P-mags,3 steel). going for $ 25 - $45+
450- rounds of factory loaded 5.56 (some .223) all brass cased Ammunition. going for $ .80 up to $1.00+ per round !
The only ding with this rifle is one of the trigger guard ""ears"" is broken, but i did JB weld it back on there, so it is on there pretty good and in no way affects the rifle, just not pretty to look at, but you cant see it because the Stark grip, with its built in trigger guard, i have on there covers it up nicely (see pictures). So with over $400 worth of accessories ( And i actually paid more for them, the prices listed above are just an average of what they're going for online) and 450 rounds of ammo,that is hard to find right now and super expensive ( $1.00+ per round), i find this to be a great deal. I will also include an extra Black-Magpul MOE grip and all the original parts that came with the rifle. if you need any more pics or info just let me know price firm at 1500.00. please contact mike @ REDACTED YOU WILL NEED VALID NEW MEXICO ID AND LEGALLY ABLE TO OWN A FIREARM. Thank you."
719,http://www.armslist.com/posts/1421719,For Sale:  1938 -1895 Nagant Tula in Mint condition w/ammo 7.62x38r,"Grand Rapids NE, Grand Rapids, Michigan",$ 325,"Listed On: Saturday, April 13, 2013",Handguns,no type,no type,Double / Single Action                                                                                ,Revolver,"I have a 1938 Tula marked 1895 Nagant. This is in Mint condition, It appears never fired, however due to age and not being original owner, I can not confirm that. It will come with original Holster, Cleaning rod, Screw Driver I also have Surplus ammo for this, it is hotter load than the Privi you buy at the store. I will  include 252 rds (comes in 14 Rds Boxes). $325 OBO gun with ammo. Gun only $200OBO . Pictures to follow shortly."
720,http://www.armslist.com/posts/1421720,For Sale:  Springfield M1A 308 Rifle,"Georgia, Georgia, United States","$ 1,400","Listed On: Monday, April 8, 2013",Rifles,Springfield                                                                                ,308/7.62 NATO                                                                                ,Semi-automatic                                                                                ,Rifle,Comes with three 10 round magazines also rifle is in great condition and has been shot less than 50 rounds.Wood is great with one minor handling mark that I can find.
722,http://www.armslist.com/posts/1421722,For Sale:  N.E.F single shot pardner .410,"Nottingham, Southeastern, PA, Pennsylvania",$ 160,"Listed On: Wednesday, May 8, 2013",Shotguns,no type,410                                                                                ,Single Shot                                                                                ,Shotgun,"Hey im looking to trade/sell  drive half way to wherever tonight just let me know will come with a camo padded sleeve comes with 30 rounds of ammo 4 slugs, 10 self defense, and 16 plastic pellets"
723,http://www.armslist.com/posts/1421723,For Sale:  Mossberg 715T 25 round magazines,"OaklandCounty, Michigan, United States",$ 55,"Listed On: Monday, April 8, 2013",Magazines,no type,no type,no type,no type,"I have for sale Mossberg 715T,25 round, 22LR magazine.

These are new, OEM Mossberg, in factory sealed packages,each one also comes with a loader

The part number for these are 95712

I have several available, the price is 55.00 each NO TRADES-PRICE IS FIRM"
725,http://www.armslist.com/posts/1421725,For Sale:  50 rounds of 7.62x54r,"Tacoma, Washington, United States",$ 40,"Listed On: Monday, April 8, 2013",Ammo,no type,no type,no type,no type,"Come get it, will not travel for this, just need to get rid of it 

I'll throw in a M91/30 Mosin bayonet for ten dollars too"
727,http://www.armslist.com/posts/1421727,For Sale:  Sig Sauer 716 Patrol,"Anywhere, Nebraska, United States",$ 1,"Listed On: Monday, April 8, 2013",Rifles,Sig Sauer                                                                                ,308/7.62 NATO                                                                                ,Semi-automatic                                                                                ,Rifle,"Selling rifle, PMAG 20LR mags and ammo...  Taking reasonable offers and no trades (unless you have a RFB)

You can use this link to get a good idea of what these guns are going for and you can make offer off these numbers:  http://www.gunbroker.com/All/BI.aspx?Keywords=sig+sauer+716&BuyNowOnly=1&Sort=4&Tab=2"
728,http://www.armslist.com/posts/1421728,For Trade:  NIB S&W M&P9 w/ holster,"Columbus, Columbus, Ohio",Offer,"Listed On: Monday, April 8, 2013",Handguns,Smith & Wesson                                                                                ,9mm Luger (9x19)                                                                                ,Striker Fire                                                                                ,Pistol,"I have a NIB S&W M&P9 full size for sale/trade. Never been fired, just found something I wanted more after I had ordered it. My loss is your gain.

Comes with the different back straps and two mags, manual, etc. Everything it comes with from the factory.

I also have a Galco black leather OWB holster. 

I paid 550 for the gun (plus shipping and transfer fees) and 75 for the holster.

Please be fair on any offer you make."
729,http://www.armslist.com/posts/1421729,For Sale/Trade:   Springfield XD Subcompact 9mm,"West Florence, Florence, South Carolina",$ 500,"Listed On: Monday, April 8, 2013",Handguns,Springfield                                                                                ,9mm Luger (9x19)                                                                                ,Striker Fire                                                                                ,Pistol,"I have a XD subcompact 9mm in very good condition available for sale. This package comes with the carry case, one 13 round magazine, one 16 round magazine, factory XD holster, mag holster, speed loader, and bore brush. I will also include a leather Don Hume holster for the buyer."
730,http://www.armslist.com/posts/1421730,For Sale:  Pistol Brass for reloading,"Bethany, Portland, Oregon",$ 1,"Listed On: Monday, April 8, 2013",Ammo,no type,no type,no type,no type,"I have the following once fired brass. It has not been processed. Prefer local buyer but will ship - buyer pays shipping.

40 S&W 500 rounds - mostly Remington - $30.00 
38 Special 800 rounds - mostly Remington - $48.00
357 Magnum 80 rounds - mostly Remington - $5.00 (not shipped separately)"
731,http://www.armslist.com/posts/1421731,For Trade:  brand new sig p220 elite 45 acp for spring xds 45acp,"foley/fairhope, Mobile, Alabama",Offer,"Listed On: Monday, April 8, 2013",Handguns,Sig Sauer                                                                                ,45 ACP                                                                                ,Double / Single Action                                                                                ,Pistol,"brand new sig p220 elite never fired with all the goodies,  want to trade for springfield xds
In like condition.
compare prices before you question...
ftf trade only baldwin county. not for sale and only for trade for xds in 45acp !!
no others .
pm me if serious only
thanks"
732,http://www.armslist.com/posts/1421732,Want To Buy:  looking for a single shot 12 gauge.,"lakewood/tacoma, Seattle, Washington",$ 200,"Listed On: Monday, April 8, 2013",Shotguns,no type,12 Gauge                                                                                ,Single Shot                                                                                ,Shotgun,"Looking for a single shot/single break 12 gauge. Preferably NE Firearms, but will consider buying other brands. 

Willing to show Washington state ID and fill out a sales agreement. But dont ask me for my CPL, i have one but im not giving out any uneeded info. If a gun dealer doesnt need my cpl for a shotgun, neither do you. Willing to pay cash, and price depends on condition and brand."
733,http://www.armslist.com/posts/1421733,For Sale/Trade:  Diamondback DB9ss,"Warren, Detroit, Michigan",$ 375,"Listed On: Monday, April 8, 2013",Handguns,Diamondback Arms                                                                                ,9mm Luger (9x19)                                                                                ,no type,Pistol,"Bought it brand new feb 23 2013. Don't really like it it has to much kick for me I bought it because it's the perfect size to carry. I'm just not to fond of all the kick that it has. Asking 375$ FIRM. Might trade for another handgun can add cash if needed. Thanks. Also asking that you have a cpl or purchase permit will not sell if you do not. 


**For everyone telling me that I over paid (466.40) it is a Diamondback DB9ss So next time you look it up you will realize that I didn't. It would of been the same amount if not more for buying off online and shipping and all of that."
734,http://www.armslist.com/posts/1421734,For Sale:  Gun Cart,"Xenia, Ohio, United States",$ 325,"Listed On: Monday, May 27, 2013",Tactical,no type,no type,no type,no type,Custom made gun cart for Cowboy Action Shooting. Removable ammo box and accessory box. Foldable for easy storage and transportation. PRICE REDUCED!
735,http://www.armslist.com/posts/1421735,For Sale:  glock 26 9mm gen 3,"northwest, Oklahoma City, Oklahoma",$ 575,"Listed On: Sunday, April 14, 2013",Handguns,Glock                                                                                ,9mm Luger (9x19)                                                                                ,Striker Fire                                                                                ,Pistol,"very nice glock 26 with low round count, includes box and all factory stuff
contact by phone REDACTED"
736,http://www.armslist.com/posts/1421736,"For Sale:  AMD-65 AK47, With Scope and Ammo","Daytona Beach, Florida, United States",$ 800,"Listed On: Friday, April 19, 2013",Rifles,no type,7.62x39                                                                                ,Semi-automatic                                                                                ,Rifle,"Selling my Hungarian AMD-65. 
This gun was imported by TGI (not Century Arms) so it is a quality built AK47. 

Includes 1 30rd magazine Upgraded rear pistol grip (Hogue)
 Includes scope (Romanian LPS TIP2 with integrated mount) 
Features a folding stock with added check riser. 

This gun shoots great and has been very accurate for me. Gun is used and the finish was redone but overall the gun looks great and functions 100% 

***Ammo can be included for an additional price*** 

This is a great AK-47. Shoots 7.62x39"
737,http://www.armslist.com/posts/1421737,Want To Buy:  44 mag,"Sw oklahoma area to dallas ft woth area, Lawton, Oklahoma",$ 600,"Listed On: Monday, April 8, 2013",Handguns,Smith & Wesson                                                                                ,44 Magnum                                                                                ,Double / Single Action                                                                                ,Revolver,"I would prefer smith and wesson but will consider tarus, single or double action, I am interested in cowboy style pistols. barrels no longer than 6 inches please. looking to spend 500 to 600 dollars"
739,http://www.armslist.com/posts/1421739,For Sale:  KCI 50 RND DRUM FOR GLOCK 9MM,"GREENFIELD, Indianapolis, Indiana",$ 160,"Listed On: Monday, April 8, 2013",Magazines,no type,no type,no type,no type,"KCI 50 RND DRUM FOR GLOCK 9MM
NIB/Never Loaded

Call or Text James at REDACTED"
740,http://www.armslist.com/posts/1421740,For Sale:  Winchester 67A  .22 cal Rifle,"Cleveland (Streetsboro), Cleveland, Ohio",$ 150,"Listed On: Monday, April 8, 2013",Antique,no type,no type,no type,no type,"Winchester 67A  .22 cal Rifle
Bolt Action sigle shot., Perfect bore, really nice piece, shots perfect.

Nice piece of history!  
Made between 1934- 1963"
741,http://www.armslist.com/posts/1421741,For Sale:  Great keltec p11 9mm,"Clemmons, Winston Salem, North Carolina",$ 1,"Listed On: Monday, April 8, 2013",Handguns,Kel-Tec                                                                                ,9mm Luger (9x19)                                                                                ,Double Action                                                                                ,Pistol,"I have a nice keltec p11 9mm.. It's in great shape and come with the box and paper work.. I'm located in clemmons and not traveling far cause I will sale pretty cheap..
Please make CASH offers.."
743,http://www.armslist.com/posts/1421743,For Trade:  Springfield XDS NIB,"Jefferson City, Columbia, Missouri",Offer,"Listed On: Monday, April 8, 2013",Handguns,Springfield                                                                                ,45 ACP,no type,no type,Brand new xds with 2 5 round mags 1 7 extend handle mag. 100 rounds of brass ammo with paper and xd gear.
745,http://www.armslist.com/posts/1421745,For Sale:  HIGH QUALITY 223 AMMUNITION - 500 rounds,"Medford, Medford, Oregon",$ 500,"Listed On: Monday, April 8, 2013",Ammo,no type,no type,no type,no type,"500 rounds of ASYM 75grain BTHP Match Grade, w/cannelure, in [10] 50-round boxes.

Unavailable anywhere.......$500."
746,http://www.armslist.com/posts/1421746,For Sale:  600rds 22lr Remington Subsonic,"Westminster, North Denver, Denver, Colorado",$ 95,"Listed On: Tuesday, April 9, 2013",Ammo,no type,no type,no type,no type,"I have 6-100ct sleeves of Remington Subsonic.

$95 takes it all!

Will not break it up. 
Thank you for looking.
Cash only. No shipping/delivery. 
Must be legal to buy ammo.
22, .22, 22lr, .22lr"
748,http://www.armslist.com/posts/1421748,For Sale:  Colt 32,"Athens, Tn., Knoxville, Tennessee",$ 949,"Listed On: Monday, April 8, 2013",Antique,no type,no type,no type,no type,"Etching on Barrel says ""Colt New 32"", Manufacture date 1878 according to serial number
 5 shot pocket revolver. 
Nickel finish is nearly perfect. 95%. The action is tight and precise. This pistol has not had many rounds fired through it. Condition is far above any I have seen to date. This will be a great addition to any collection. You will not be disappointed."
749,http://www.armslist.com/posts/1421749,For Sale:  CMMG AR15 pistol,"Anywhere, Nebraska, United States",$ 1,"Listed On: Monday, April 8, 2013",Handguns,no type,223/5.56 NATO                                                                                ,no type,Pistol,"Bought for SBR project but have since changed my mind.  Also have 10 x PMAG30 Gen 2 windowed, 4 x PMAG30 Gen 3 and 1 x CSA magazines.  Have 340 rounds of American Eagle brass and 1000 (2 x sealed cans) of Tula steel jacket rounds.  Make reasonable offer and no trades unless you have a RFB for trade)

Please use this link to help decide what to offer:  http://www.gunbroker.com/All/BI.aspx?Keywords=ar+pistol"
750,http://www.armslist.com/posts/1421750,Want To Buy:  GLOCK .357 SIG IN OD GREEN or FLAT DARK EARTH,"Co springs, Colorado Springs, Colorado",$ 750,"Listed On: Saturday, April 13, 2013",Handguns,Glock                                                                                ,357 SIG                                                                                ,Striker Fire                                                                                ,Pistol,"Looking for a .357 sig Glock in OD green or Flat Dark Earth. (I would perfer the model 32).

$700 to $800 cash depending on condition. If you have one just tell me the approx age/round count/what gen it is.  Also if you have rounds, I can include more cash depending on number of rounds.

IF you are interested in a trade, I have a Glock 19 with night sights that'd I'd be willing to trade for your Glock 31 or 32 in OD green/Flat Dark Earth, PLUS I'd throw in say $100 to $150 cash? Or let me know how much cash you think would be fair. Can also include some rounds."
751,http://www.armslist.com/posts/1421751,For Sale:  Mossberg 590 Pistol grip W/ door breacher,"Streetsboro Ohio, Buckeye Firearms, Cleveland, Ohio",$ 440,"Listed On: Monday, April 8, 2013",Shotguns,Mossberg                                                                                ,12 Gauge                                                                                ,Pump Action                                                                                ,Shotgun,"New mossberg 590s complete with pistol grips and door breacher muzzle breaks in stock at Buckeye Firearms in Streetsboro Ohio! Please stop by or give us a call, REDACTED, Buckeye Firearms 9225 State Route 14, Streetsboro Ohio 44241 right next to Taco Bell!"
752,http://www.armslist.com/posts/1421752,For Sale:  .,"Fairfield, Ca., Sacramento, California",$ 1,"Listed On: Saturday, April 13, 2013",Rifles,IO Inc                                                                                ,7.62x39                                                                                ,Semi-automatic                                                                                ,Rifle,.
753,http://www.armslist.com/posts/1421753,For Sale:  IMI UZI Model 45 Carbine  45ACP or 9MM  (shoots both),"New Castle County, Delaware, United States","$ 2,215","Listed On: Monday, April 15, 2013",Rifles,Israel Weapon Industries                                                                                ,45 ACP                                                                                ,Semi-automatic                                                                                ,Rifle,"45 ACP to 9mm para / .41 AE Conversion kit (.41AE barrel and mag not included).  Imported by Action Arms of Philadelphia Excellent condition. In less than 5 minutes you can convert this 45 to 9mm.   Comes with everything shown.
4 mags, (2-9mm and 2-45acp) 3 barrels (2-9mm and 1 45acp) 3 bolts (2-9mm and 1 45acp)."
754,http://www.armslist.com/posts/1421754,For Trade:  like new rossi 357,"new castle, Indiana, United States",Offer,"Listed On: Monday, April 8, 2013",Handguns,Rossi-Braztech                                                                                ,357 Magnum                                                                                ,Double Action                                                                                ,Revolver,Rossi 972 357mag 6in barrel stainless very very low round count less than 50 bought new last year. I don't have to get rid of it I'm just seeing what I can get in trade interested in just about any thing will send pics just ask txt (765)six24six one 68.
755,http://www.armslist.com/posts/1421755,For Sale:  Ruger AC556,"South Denver, Denver, Colorado","$ 9,000","Listed On: Monday, April 8, 2013",NFA,no type,no type,no type,no type,"Ruger AC556 Factory Machine Gun Semi,3 Round, and Full Auto ATI Side Folding Strikeforce Stock with Scorpion Recoil System Millett DMS-1 Optic (12) 30 Round Ruger Magazines (5)NIB (7) 20 Round Ruger Magazines Entire Package Perfect in every way! Rifle runs like a top! On Form 4 in Colorado $50 shipping to your Class 3 Dealer"
756,http://www.armslist.com/posts/1421756,For Sale:  Remiongton 22 LR,"Pasadena / Glen Burnie, Baltimore, Maryland",$ 55,"Listed On: Monday, April 8, 2013",Ammo,no type,no type,no type,no type,"3 100 Round Remington 22 LR Round Nose

$20 each or $55 takes all three"
757,http://www.armslist.com/posts/1421757,For Sale:  DPMS Oracle 308 .308 7.62x51 RFLR-308 AR10 AR-10,"Washington, Washington, United States","$ 1,100","Listed On: Monday, April 8, 2013",Rifles,DPMS                                                                                ,308/7.62 NATO,no type,no type,"New unfired in the factory box DPMS Panther .308. Comes with one magazine and a set of Magpul Flip Up Sights. Caliber 308 Win / 7.62 NATO, Weight 8.3 lbs, Length 32.5""/ 36.5"" Barrel 16"" HBAR 4140 Chromemoly 1/10 twist with A2 Flash Hider."
758,http://www.armslist.com/posts/1421758,"Want To Buy:  Looking For SCAR 17, AR-10, or Colt LE6920. Make A Profit Today!","Denver- Can Travel, Colorado, United States",$ 1,"Listed On: Monday, April 8, 2013",Rifles,Colt                                                                                ,223/5.56 NATO                                                                                ,Semi-automatic                                                                                ,Rifle,"Experienced shooter, gun enthusiast and active duty Air Force buyer for high end products.  I have $4000 in cash that I have been saving for some high end rifles.  My main target is a SCAR 17, any color.  I understand a panic buying frenzy has driven prices through the rough recently, but they appear to be coming back down steadily and consistently.  Therefore, I will ensure you make a profit by offering $3000 for a Black NIB SCAR 17 ($400 over MSRP and right at market price on gunbroker), or $3200 for an FDE.  

I am also interested in good quality AR-10s and 15s.  Mainly looking for a Colt LE6920 which are currently going for $1300 on gunbroker BNIB.  If you have any of these things, send me an email and make some free cash today.  Again, I won't loball you, so please do not gouge me.  I am only asking for market prices, not what you think the market for your gun is at.  Thanks for looking!"
759,http://www.armslist.com/posts/1421759,For Sale:  AR-15 Lower Recievers- 2 Available- Seekins and Del-Ton- one with LPK less FCG,"Sisters, Bend, Oregon",$ 175,"Listed On: Monday, April 8, 2013",Gun,no type,no type,no type,no type,"I have a couple of AR-15 Lower receivers for sale. These are both new, never built.

The first is a Seekins Precision Forged marked Multi-Cal. Has a lower parts kit installed, less the fire control group. I am asking $200 for this one. SOLD PENDING FUNDS

The second is a Del-Ton Forged marked 5.56. This is a stripped receiver only with grip. Asking $175.00 for this one. SOLD 

No trades, make an offer if you want although I'm about at my minimum on these. Check the prices- I'm asking basically what I have into these, considering shipping and transfer fees. 


These are for sale FTF cash only. I WILL NOT SHIP. 

I can send pictures if you want."
761,http://www.armslist.com/posts/1421761,For Sale:  Plum Crazy Complete AR Lower Receiver New with a 30 Round magazine.,"Warrenton, St. Louis, Missouri",$ 375,"Listed On: Monday, April 8, 2013",Gun,no type,no type,no type,no type,"New, only put on an upper to test function, which was solid. Would be great for a light weight build. It is a 556, but can be used with 6.8, 300 BLK, 6.5 Grendel, and 556.

Magazine is also new, polymer. Also, 556.

Price is firm. Local pickup. Text or email for pics or questions."
