,url,title,location,price,post date,category,manufacturer,caliber,action,firearm type,postcontent
716,http://www.armslist.com/posts/3495716,For Sale:  Windham Weaponry AR-15 SRC R16M4FTT,"Laguna Beach, Orange County, California",$ 800,"Listed On: Saturday, September 13, 2014",Rifles,Windham Weaponry                                                                                ,223/5.56 NATO                                                                                ,Semi-automatic                                                                                ,Rifle,"Manufacturer:Windham Weaponry: Model #:R16M4A4TT-CF1 (Carbon Fiber) SRC: Type:Rifle: Finish:Black matte: Stock:6-Position Telescoping Buttstock: Sights:No Sights: Barrel Length:16"" Chrome-Lined M4 Profile BBL"" Overall Length:32.375"" Collapsed - 36.125"" Extended: Weight:5.85 lbs: Caliber:223: Capacity:30+1: Action:Semi-Automatic: # of Mags:1:	Packaging:Black Plastic Case: Receiver:Carbon Fiber Flat Top Receiver: Muzzle:A2 Flash Suppressor: Features:Optics Ready For Accessory Sights: M4 Double Heat Shield Handguards, Rifling 1-9"" Good Condition."
717,http://www.armslist.com/posts/3495717,"For Sale:  LNIB 8"" COLT ANACONDA","wichita, Wichita, Kansas","$ 1,900","Listed On: Wednesday, October 1, 2014",Handguns,Colt                                                                                ,44 Magnum                                                                                ,Double / Single Action                                                                                ,Revolver,"I have a like new in box 8"" colt anaconda for sale. Comes with original box and paperwork, shot very little , near mint condition, no flaws no lowballers please these are very hard to come by and will only take asking price thank you call, text or email if interested (3REDACTED  , not interested in trades at this time"
719,http://www.armslist.com/posts/3495719,"For Sale:  Geissele S3G, Hornady, Magpul PRO","Lithia/Valrico, Florida, United States",FREE,"Listed On: Sunday, September 14, 2014",Gun,no type,no type,no type,no type,"S3G trigger for sale.  Asking $225.00 OBO

Magpul PRO sights (front & rear) $160.00 for the set

Hornady LE GMX Barrier Penetrator 5.56 (not .223) ***Best Auto Glass defeating round I have found. 200 rounds for $200"
720,http://www.armslist.com/posts/3495720,For Trade:  shotgun only,"sicklerville, New Jersey, United States",Offer,"Listed On: Saturday, September 13, 2014",Shotguns,no type,12 Gauge                                                                                ,Pump Action                                                                                ,Shotgun,"Hi. I have a brand new never fired Linberta 12 gauge shotgun in box and all paperwork. 
I purchased this shotgun for home defense and hunting.  After starting my NJ hunters work book and being a new hunter I didn't know their was a regulation that you can't hunt with a shotgun that chambers more then 3 rounds.  My shotgun is 5+1 and I can't hunt. Im looking to trade straight up no cash involved for a pump 12 gauge with 3 max to be chamber I would like a black shotgun and used by nice condition. Thanks"
722,http://www.armslist.com/posts/3495722,For Sale:  Marlin m1 rear sight,"Anderson/Starr, Greenville, South Carolina",$ 75,"Listed On: Thursday, November 6, 2014",Gun,no type,no type,no type,no type,Marlin M1 rear sight.$75
723,http://www.armslist.com/posts/3495723,For Sale:  yy,"ee, Denver, Colorado",$ 1,"Listed On: Wednesday, September 24, 2014",Optics,no type,no type,no type,no type,oo
726,http://www.armslist.com/posts/3495726,For Sale/Trade:  Sig Sauer P226 9mm Luger Auto Pistol with 2 Magazines,"Vancouver, Southwest Washington, Washington",$ 700,"Listed On: Saturday, September 13, 2014",Handguns,Sig Sauer                                                                                ,9mm Luger (9x19)                                                                                ,Double / Single Action                                                                                ,Pistol,"Up for sale or trade is my 1987-vintage Sig Sauer P226 9mm Luger auto pistol with two Sig Sauer 15-round magazines.  NRA Grade: Excellent+  No noticeable wear.  Clean shiny bore.  Well cared for.

Can meet after work (around 4:30 or 5:00 p.m.) most weekdays in Vancouver. I will not ship this. Must be 21 or older and show me a Washington drivers license or other current government ID card."
728,http://www.armslist.com/posts/3495728,For Trade:  Savage / Stevens 320 Pump Shotgun 12g,"Eastside / Greenfield, Indianapolis, Indiana",Offer,"Listed On: Saturday, September 13, 2014",Shotguns,Savage Arms                                                                                ,12 Gauge                                                                                ,Pump Action                                                                                ,Shotgun,"Tactical version with piston grip, iron ghost ring sights /w green fiber,  never fired, with original box."
729,http://www.armslist.com/posts/3495729,For Sale:  mosin-nagant model 91/30. I have two for sale $200 for both,"west, Des Moines, Iowa",$ 200,"Listed On: Saturday, September 13, 2014",Rifles,no type,7.62x54R                                                                                ,Bolt Action                                                                                ,Rifle,"The first one is 100% ready to go dated 1943. matching numbers with bayonet

The second one is dated 1938 but is missing  the extractor and the forearm. 
$200 takes both"
730,http://www.armslist.com/posts/3495730,For Sale:  60's series Colt 38 Super Commander,"Carson City, Reno, Nevada","$ 1,900","Listed On: Thursday, January 29, 2015",Handguns,Colt                                                                                ,38 Super,no type,no type,60's series Colt 38 Super Commander. Comes with factory magazine. Firm on price and I dont want to trade.
731,http://www.armslist.com/posts/3495731,"For Sale:  .308  WIN 150 grain ""Hog"" Special - power point Winchester","chelsea/280, Birmingham, Alabama",$ 100,"Listed On: Saturday, September 13, 2014",Ammo,no type,no type,no type,no type,"Winchester. 308 power point Hog Special 150gr.  I have a case (10 boxes of 20rds)
Asking $100
Text/Call REDACTED

*These bullets retail for $18.99 plus tax...........my price----$10.00 per box."
732,http://www.armslist.com/posts/3495732,For Sale:  Marlin XT-17V .17HMR,"Hohenwald, Nashville, Tennessee",$ 275,"Listed On: Tuesday, September 23, 2014",Rifles,Marlin                                                                                ,17 HMR                                                                                ,Bolt Action                                                                                ,Rifle,"22"" 1:9 twist bull barrel, Camo dipped walnut wood stock. Adjustable Pro-Fire trigger system.

Includes 1 4rd. mag., 1 7rd. mag., Center Point 4-16x40 AO scope w/ flip caps, and Harris 1A2-H 13.5-23"" bipod.

$275 Not interested in trades. PRICE IS FIRM"
733,http://www.armslist.com/posts/3495733,For Sale/Trade:  AR-15 556 trade for Ak  SKS-M,"Lawrenceburg TN, Nashville, Tennessee",$ 600,"Listed On: Friday, September 19, 2014",Rifles,CMMG                                                                                ,223/5.56 NATO                                                                                ,Semi-automatic                                                                                ,Rifle,"Ar-15 5.56 1:7 16"" barrel psa M4 Flat top upper, Nitride Bolt carrier Group, polymer lower, Cmmg lower parts kit, Aluminum carbine length quad rail, Detachable carry handle, 3 steel 30 round mags with 190 rounds of ammo, 30 rounds through it no issues. $700 trade Or $600 cash for gun and 1 mag only, Will take a pistol and cash or standard SKS and cash


Gun scare is over sorry,  if your still wanting $1000 for your Wasr or $800 for your SKS then i'm wanting $1500 for my AR. Be Realistic please"
734,http://www.armslist.com/posts/3495734,For Trade:  Tactical Ruger 10/22  Archangel 556 Stock Trade for Pistol,"Scranton/ Wilkes-Barre, Wilkes-Barre/Scranton, Pennsylvania",Offer,"Listed On: Saturday, September 13, 2014",Handguns,Ruger                                                                                ,22 Long Rifle                                                                                ,Single Action                                                                                ,Pistol,"Up for trade is a Scoped Ruger 10/22 with an Archangel 556 Tactical stock. It's in great shape, shoots beautiful and is a tack driver! Great for training, plinking and just some good old cheap fun. It's comes with a foregrip, 1x 25rd magazine and I have a reflex red dot sight for it as well. Would rather trade then sell, but cash is king!

Pa residents only with drivers license or ltcf
No shipping"
735,http://www.armslist.com/posts/3495735,For Sale:  Remington Model 700 .270,"Can meet from San Antonio to Austin on I 35, Austin, Texas",$ 450,"Listed On: Saturday, September 13, 2014",Rifles,Remington                                                                                ,270 Winchester                                                                                ,Bolt Action                                                                                ,Rifle,"Nice Remington Model 700 BDL .270. Beautiful wood stock as well. I will even throw in the 2 boxes of ammo I have since I will no longer them. 
Deer season is around the corner and this would be the perfect gun"
736,http://www.armslist.com/posts/3495736,For Sale:  HiPoint JHP 40 S&W,"Colorado Springs, Colorado Springs, Colorado",$ 145,"Listed On: Saturday, September 13, 2014",Handguns,Hi Point                                                                                ,40 S&W                                                                                ,no type,Pistol,http://www.hi-pointfirearms.com/Hi-Point-handguns/40SW_handgun.html
737,http://www.armslist.com/posts/3495737,For Trade:  Sig sauer nightmare carry,"Billings, Billings, Montana",Offer,"Listed On: Saturday, September 13, 2014",Handguns,Sig Sauer                                                                                ,45 ACP                                                                                ,Single Action                                                                                ,Pistol,New sig nightmare two tone match trigger barel and night sights. Nicest 1911 you can buy with 8 combat mags and leather holster looking to trade for Nice quality hunting rifle with scope hunting ready prefer stainless
738,http://www.armslist.com/posts/3495738,For Sale/Trade:  Yugo Pap M92 / Ak47,"Knoxville, Knoxville, Tennessee",$ 875,"Listed On: Thursday, October 30, 2014",Rifles,Zastava                                                                                ,7.62x39                                                                                ,Semi-automatic,no type,"Yugo pap m92 for trade or sale ... The gun is practically brand new only having 5 Shots thru it. It includes 4-30 round Magazines and around 900 rounds of ammo.....asking 875 cash or trade and cash or two for one ?????

Also I have a Saiga 12 converted that I could make a package deal with and it has 4 magazines with it as well as the drum magazine to go with it to. But the package deal would definitely have to be a considerable price ......"
739,http://www.armslist.com/posts/3495739,Want To Buy:  Enfield Rifles CASH IN HAND,"Gainesville, Atlanta, Georgia",Offer,"Listed On: Thursday, April 16, 2015",Rifles,no type,no type,no type,no type,"I'm looking to purchase a couple of Enfield rifles local to North Georgia.  I'm primarily interested in No.I Mk.III's and No.4 Mk.I's but will consider Jungle Carbines.  

I have cash in hand and I'm willing to travel reasonable distances to make a deal. 

South African, Australian and New Zealand rifles move to the front of the line."
743,http://www.armslist.com/posts/3495743,For Sale:  Remington 700  30-6 with Tasco World Class 3-9 x40 scope,"Grayson KY about 100 miles east of Lexington, Lexington, Kentucky",$ 450,"Listed On: Saturday, September 13, 2014",Rifles,Remington                                                                                ,30-06 Springfield                                                                                ,Bolt Action                                                                                ,Rifle,"For sale is a Remington 700  30-6 with a  Tasco World class 3-9 x 40 scope.  Gun is in excellent condition, has a small scratch on the trigger guard, but in perfect shape other than that. Sighted in ready for deer season.  It also has a limbsaver recoil pad installed on the butt that makes it much better to shoot.  I am also including 2 boxes (20 each) of Remington Core-Loct  180 grain ammo. May be interested in trades for 1911's (Springfield or Colt) or carbine rifle, but they must be in excellent shape.  Please see attached pictures $450 OBO"
744,http://www.armslist.com/posts/3495744,For Sale/Trade:  Kimber Warrior 45 ACP 1911,"Jackson - will travel, Michigan, United States","$ 1,200","Listed On: Saturday, September 13, 2014",Handguns,Kimber                                                                                ,45 ACP                                                                                ,Single Action                                                                                ,Pistol,"I should be keeping this but I'm craving something new. This is the only 1911 I've ever owned that has never had a single hang up. This pistol has ran flawless since day one.

Comes with box, papers, 2 mags, and I have a bunch of extras I can include depending on the deal (Galco holster, drop leg holster, grips, extra mags, ammo, etc)"
745,http://www.armslist.com/posts/3495745,For Sale:  22LR Subsonic Ammo,"High Point/Greensboro, Greensboro, North Carolina",$ 65,"Listed On: Saturday, September 13, 2014",Ammo,no type,no type,no type,no type,"I have two bricks of 22LR Subsonic ammo for sale.

Winchester Super X, 40 grain HP, 1065 FPS $65.00 for 500 rounds

PMC Moderator, 38 grain HP, 950 FPS $60.00 for 500 rounds"
746,http://www.armslist.com/posts/3495746,For Sale:  Combat Armory AR15 Grooved Grip,"West Mesa, Phoenix, Arizona",$ 10,"Listed On: Saturday, September 13, 2014",Gun,no type,no type,no type,no type,"Installed on my lower but took it off because I didn't like the look.

Description:

This is a black pistol grip replacement for your AR-15 with ambidextrous thumb rests. It also has a compartment underneath for batteries and/or small tools. 

High Strength Industrial Grade Polymer Body
Black Color
Battery/Tool Compartment
Ergonomic Design
Ambidextrous Thumb Rests"
747,http://www.armslist.com/posts/3495747,For Sale:  Ruger LCP .380 Auto + Box + Matching Pistol Rug + Ammo,"Vancouver, Southwest Washington, Washington",$ 380,"Listed On: Sunday, September 21, 2014",Handguns,Ruger                                                                                ,380 ACP                                                                                ,Double / Single Action                                                                                ,Pistol,"Up for sale or trade is my Ruger LCP .380 Auto pistol with the original box, matching Ruger pistol rug and 200 rounds of .380 ammo.  (The ammo alone is worth $80.)

Can meet after work (around 4:30 or 5:00 p.m.) most weekdays in Vancouver. I will not ship this. Must be 21 or older and show me a Washington drivers license or other current government ID card."
748,http://www.armslist.com/posts/3495748,For Sale/Trade:  Stainless Kimber Pro Carry 2,"Appomattox/Farmville, Lynchburg, Virginia",$ 800,"Listed On: Saturday, September 13, 2014",Handguns,Kimber                                                                                ,45 ACP                                                                                ,Single Action                                                                                ,Pistol,"Got a kimber pro carry 2 for sale or trade. Stainless, overall good shape, has new Wolff recoil spring after Kimber's recommended break in period. Comes with 2 mags, 20 rounds of jhp and a Blackhawk holster. 

For trades, I'm only looking for a PSL, 308 semi-auto rifle (PTR, FAL, 308 AR)  AR pistols, 5.56 non-AR rifles (so like aug clones, hk53 clones, etc), or AK rifles or pistols in 7.62x39 (no WASRs).  Trade value $825. Cash price is $800. Lynchburg/Appomattox area only."
749,http://www.armslist.com/posts/3495749,For Sale:  SOLD - Glock G36 Gen 3 .45 ACP with Tru Dot - 3 dot Night Sights - SOLD,"Lake St. Louis, St. Louis, Missouri",$ 450,"Listed On: Saturday, September 13, 2014",Handguns,Glock                                                                                ,45 ACP                                                                                ,Striker Fire                                                                                ,Pistol,"This is a Glock G36 Gen 3 45ACP with roughly 400 rounds through it and has had night sights installed on it. It comes with the original case, two 6 round magazines, original manual and all original accessories. I have also installed a Talon grip wrap. Not interested in trades."
751,http://www.armslist.com/posts/3495751,For Sale/Trade:  Ruger P93 DC 9mm,"loveland, Fort Collins, Colorado",$ 1,"Listed On: Saturday, September 13, 2014",Handguns,Ruger                                                                                ,9mm Luger (9x19)                                                                                ,Striker Fire                                                                                ,Pistol,Shoots great! Has 1 mag. Can throw in a nice conceal holster for the right trade. Please do not respond via armslist. My email is giving me problems. Text is easier or leave message REDACTED
752,http://www.armslist.com/posts/3495752,For Trade:  Ruger M77 Mark II .223 For an AR-15,"Huntington, Huntington / Ashland, West Virginia",Offer,"Listed On: Saturday, September 13, 2014",Rifles,Ruger                                                                                ,223/5.56 NATO                                                                                ,Bolt Action                                                                                ,Rifle,"Beautiful, like new Ruger rifle with a Banner scope and a new Montana sling."
753,http://www.armslist.com/posts/3495753,For Sale:  Hi Point JHP 45 ACP,"Colorado Springs, Colorado Springs, Colorado",$ 145,"Listed On: Saturday, September 13, 2014",Handguns,Hi Point                                                                                ,45 ACP                                                                                ,no type,Pistol,"http://www.hi-pointfirearms.com/Hi-Point-handguns/45ACP_handgun.html

Laser is NOT included"
754,http://www.armslist.com/posts/3495754,For Sale:  Weatherby  270 Win Mag with Bushnell 4 x 16 scope,"Can meet from San Antonio to Austin on I 35, Austin, Texas",$ 400,"Listed On: Saturday, September 13, 2014",Rifles,Weatherby                                                                                ,270 Winchester                                                                                ,Bolt Action                                                                                ,Rifle,Very nice package for sale here. The bushnell scope is very nice and part of the package. Hunting season is close and at this price it needs a home.
755,http://www.armslist.com/posts/3495755,For Sale:  Ruger 10/22 stainless,"Melbourne, Florida, United States",$ 250,"Listed On: Friday, September 19, 2014",Rifles,Ruger                                                                                ,22 Long Rifle                                                                                ,Semi-automatic                                                                                ,Rifle,"Ruger 10/22 stainless/black synthetic 50th anniversary edition. In great shape with under 100 rounds through it. Comes with sling studs mounted by a gun smith, flex sling, a bx25 mag, and 10/22 softcase. Call or text three two one eight seven two four four four seven."
757,http://www.armslist.com/posts/3495757,For Sale/Trade:  Tisas 1911 .45 trade for taurus pt92 or ???,"avon, Indianapolis, Indiana",$ 420,"Listed On: Saturday, September 13, 2014",Handguns,no type,45 ACP                                                                                ,Double Action                                                                                ,Pistol,"I've got a Tisas 1911 45 for trade only. If you've never heard of these, check out Hickock45's review on YouTube. This 1911 has been an absolute blast to shoot. Its mil-spec, so great for a build gun. It eats any ammo you feed it flat nose or round nose. These are in the same bracket as RIA, and I've never had a problem in some 200+ rounds. Comes with one 8+1 mag (any 1911 mags fit this weapon) and 30 rounds or so of fmj. Nice crisp trigger pull with no slack at all. They sell for 400+tax, and this firearm is well worth every penny of that. Really wanting to trade because I can't afford to buy .45 ammo anymore for fun lol! Will like to see ID for age purposes, not recording any info. Shoot me an offer, worst I can do is respectfully decline!!

Can include nice leather holster if yours comes with one!"
758,http://www.armslist.com/posts/3495758,For Sale/Trade:  Custom Super Vepr 308,"Findlay, Lima, Ohio",$ 900,"Listed On: Friday, September 19, 2014",Rifles,no type,308/7.62 NATO,no type,no type,Custom Super Vepr 308 21.6 inch barrel with a modified G3 handguard that is solid. 3 10rd mags and 1 5rd mag included.  Trades can be + or - cash depending on what you have.  No shotguns or archery stuff please. I won't even reply to lowball offers
759,http://www.armslist.com/posts/3495759,For Sale:  Hi Point 380 Auto,"Colorado Springs, Colorado Springs, Colorado",$ 135,"Listed On: Saturday, September 13, 2014",Handguns,Hi Point                                                                                ,380 ACP                                                                                ,no type,Pistol,http://www.hi-pointfirearms.com/Hi-Point-handguns/380ACP_handgun.html
760,http://www.armslist.com/posts/3495760,For Sale:  Cobra Derringer 22lr,"north, Lexington, Kentucky",$ 100,"Listed On: Saturday, September 13, 2014",Handguns,Cobra                                                                                ,22 Long Rifle                                                                                ,Single Action                                                                                ,Derringer,"Cobra Derringer 22lr
Red anodized with pearl grips
2 shots thru it
Includes box manuals
Leather handmade leather belt holster
$100 firm
REDACTED"
761,http://www.armslist.com/posts/3495761,For Trade:  new york arms double barrel 12 gauge,"warrior, Birmingham, Alabama",Offer,"Listed On: Saturday, September 13, 2014",Shotguns,Savage Arms                                                                                ,12 Gauge                                                                                ,Side by Side                                                                                ,Shotgun,New york arms double barrel 12 gauge.from the research ive done these were made from 1903-1918 so this thing is close to 100 years old so it has alot of wear.stock has cracks and dings but it shoots and functions great has 18 & half inch barrels.this does not have demascus barrels so u can shoot anykind of shell through it.for trade onlyREDACTED
762,http://www.armslist.com/posts/3495762,For Sale:  Springfield Armory 1911 mil-spec,"fayetteville, Dunn, Fayetteville, North Carolina",$ 450,"Listed On: Saturday, September 13, 2014",Handguns,Springfield                                                                                ,45 ACP                                                                                ,Single Action                                                                                ,Pistol,"For sale is a 1911. Stainless steel finish. Good gun. Shoots straight. Low round count. Have hogue grip and wood grips. 1 magazine.


will trade for
Xd 45,, but not limited to"
763,http://www.armslist.com/posts/3495763,For Sale/Trade:  LNIB Beretta M9 92FS 9mm Two Tone Silver & Black,"Fort Walton Beach, Pensacola, Florida",$ 525,"Listed On: Thursday, November 20, 2014",Handguns,Beretta USA                                                                                ,9mm Luger (9x19)                                                                                ,Double / Single Action                                                                                ,Pistol,"Like new in case, never fired Beretta 92FS 9mm, comes with 2 mags. Txt REDACTED

In addition to the pistol I have crimson trace laser grips $100
Surefire rail & light $125"
