,url,title,location,price,post date,category,manufacturer,caliber,action,firearm type,postcontent
263,http://www.armslist.com/posts/3704263,For Sale:  MOSSBERG ULTIMAG 12 GAUGE PUMP,"FOPT WAYNE INDIANA, Fort Wayne, Indiana",$ 300,"Listed On: Thursday, November 13, 2014",Shotguns,Mossberg                                                                                ,12 Gauge                                                                                ,Pump Action                                                                                ,Shotgun,BEAUTIFUL SHOTGUN WITH CHEEK REST.FIELD AND CANTILEVER SLUG BARRELS.SOLD AS CASH DEAL ONLY
264,http://www.armslist.com/posts/3704264,For Sale:  B-Square HK 91 and 93 and MP5 Receiver One Piece Scope Mount,"Farmville, Greenville, North Carolina",$ 40,"Listed On: Thursday, November 13, 2014",Gun,no type,no type,no type,no type,B-Square HK 91 and 93 and MP5 Receiver One Piece Scope Mount
265,http://www.armslist.com/posts/3704265,For Sale/Trade:  Walther p22 pistol,"north okc, Oklahoma City, Oklahoma",$ 300,"Listed On: Thursday, November 13, 2014",Handguns,Walther                                                                                ,22 Long Rifle                                                                                ,no type,Pistol,"black walther p22. shoots 22lr. great condition, hardly ever fired."
266,http://www.armslist.com/posts/3704266,For Sale/Trade:  Sig 1911.22,"Aurora, Chicago, Illinois",$ 450,"Listed On: Thursday, November 13, 2014",Handguns,Sig Sauer                                                                                ,22 Long Rifle                                                                                ,Single Action                                                                                ,Pistol,As new sig 1911 .22 in dark earth
267,http://www.armslist.com/posts/3704267,For Sale/Trade:  Taurus PT-1911,"BA/Tulsa, Tulsa, Oklahoma",$ 550,"Listed On: Thursday, November 13, 2014",Handguns,Taurus                                                                                ,45 ACP                                                                                ,Single Action                                                                                ,Pistol,PRICE-UPDATE --> Just pulled out of safe. I have a great Taurus PT – 1911 for sale/trade. Barrel polished and is extremely accurate. Very tight tolerances and never any jams. This gun functions flawless. I am open to trades. Just ask....! FTF in Tulsa area only and can throw in ammo for the right trade.
268,http://www.armslist.com/posts/3704268,For Sale:  Winchester 1890,"Lebanon TN, Nashville, Tennessee",$ 899,"Listed On: Thursday, November 13, 2014",Rifles,Winchester                                                                                ,no type,Bolt Action                                                                                ,Rifle,"Great Condition if interested or have any questions, please feel free to contact me"
269,http://www.armslist.com/posts/3704269,For Sale:  Century Arms GP 1975 Sporter 7.62X39 AK-47,"louisiana, Louisiana, United States",$ 680,"Listed On: Thursday, November 13, 2014",Rifles,no type,no type,no type,no type,"You must make arrangements with a dealer in your state to receive the firearm and transfer it to you.Contact dealers when willing to do transfers...Your bid is a contract - Do not place a bid unless you are going to purchase the item.You must contact the Seller and request payment instructions from the Seller,Thanks!!!"
270,http://www.armslist.com/posts/3704270,For Sale/Trade:  RIA M1911-A1FS Tactical two tone *Sale Pending*,"Reno, Reno, Nevada",$ 560,"Listed On: Thursday, November 13, 2014",Handguns,Rock Island Armory                                                                                ,45 ACP                                                                                ,Single Action                                                                                ,Pistol,"Rock Island two tone tactical. Two weeks old with box and papers. Looking only for the trade below,  otherwise cash offers. Lifetime warranty card is unfilled and intact."
271,http://www.armslist.com/posts/3704271,For Sale:  Beretta Urika 2 Sporting X-tra,"dothan, Dothan, Alabama",$ 800,"Listed On: Thursday, November 13, 2014",Shotguns,Beretta USA,no type,no type,no type,"-Beretta Urika 2 Sporting X-tra Grain -30"" -20GA"
272,http://www.armslist.com/posts/3704272,For Sale/Trade:  Barnes CQB AR-15 Package Deal,"Raleigh, NC, Raleigh / Durham / CH, North Carolina","$ 1,400","Listed On: Tuesday, December 2, 2014",Rifles,no type,223/5.56 NATO                                                                                ,Semi-automatic                                                                                ,Rifle,"Barnes Precision Machine CQB Patrolman
Manufactured in Apex, NC
Barnes Precision Upper with 18"" stainless match grade barrel
1/8 twist and A2 flash hider and breaching tip
.223 Wylde chamber (.223 or 5.56)
Ultralite rail system with Magpul fore grip
Front sling swivel mount
Barnes Precision lower with Magpul MOE stock and grip
BPM bolt carrier group (NOT nickel boron)
Magpul MBUS sights
Vortex Strike Fire II Red/Green dot 4 MOA sight
LED flashlight with momentary switch and mount
Six polymer 30 round magazines
Blackhawk soft nylon case
Original BPM plastic case with matching serial number
***SALE ALSO INCLUDES ~ 420 ROUNDS OF FEDERAL 5.56 BALL AMMO IN AMMO CAN***

This is an awesome rifle.  I just don't get to shoot it.  The Vortex sight is less than six months old and has never been to the range.
Rifle has had less than 150 rounds put down the pipe.  Right now, there are other things that I need more than I need this rifle.
That being said, I am not desperate, so please do not waste everyone's time with some low ball, sub-1,000 dollar offer.  
Retail price for all of the items listed is pushing $2,000.00.

All laws will apply.  Buyer must show ID and proof of eligibility to own a firearm, i.e. conceal carry, pistol permit, etc., and sign a bill of sale, or we can meet at an FFL holder.

$1,400.00 for everything listed.
Will entertain offers for individual items.
Will not break-up the rifle to sell the upper or lower.
If the ad is up the rifle is available.

GOD BLESS AMERICA!"
275,http://www.armslist.com/posts/3704275,"For Sale:  Rossi R92 .45Colt Lever action 16"" barrel- large loop.","McKinney, Dallas, Texas",$ 400,"Listed On: Thursday, November 13, 2014",Rifles,Rossi-Braztech                                                                                ,45 Long Colt                                                                                ,Lever Action                                                                                ,Rifle,"Used M92 Carbine .45Colt Blue 8+1 16"" Rnd Bbl Lrg Loop. Used one time, maybe 15 rounds. Ejects from the top. 

No shipping, no trades, face to face, price is firm, cash only."
276,http://www.armslist.com/posts/3704276,For Sale:  *NEW* Springfield XDS,"Milford, Cincinnati, Ohio",$ 547,"Listed On: Tuesday, January 6, 2015",Handguns,Springfield                                                                                ,9mm Luger (9x19)                                                                                ,Striker Fire                                                                                ,Pistol,"Springfield XDS 9mm
Caliber: 9 mm
Capacity: 7+1
Barrel: 4"""
277,http://www.armslist.com/posts/3704277,For Sale:  ***priced to sell*** Glock 17,"Spokane/CDA, Spokane, Washington",$ 625,"Listed On: Thursday, November 13, 2014",Handguns,Glock,no type,no type,no type,"Salient Arms minus-striker and 4.5lb striker spring.
Tuned and polished trigger bar
Tuned ejector housing
Trigger return spring
Safety plunger/safety plunger spring
Tuned 3.5 connector
New Trijicon HD's with orange front
Stippled/undercut trigger and trigger guard
Comes with everything from glock. Light not included. Thanks for looking"
278,http://www.armslist.com/posts/3704278,For Sale:  AR-15 Magazines!,"North Fargo, Fargo, North Dakota",$ 400,"Listed On: Thursday, November 13, 2014",Magazines,no type,no type,no type,no type,"AR-15 magazines. I have a bunch of AR-15 magazines for sale! Only reason for selling off the last of my mags is because I'm converting everything to 5.56x45mm and 7.62x39mm AK. All mags except the GI mags are in near new condition. GI mags show wear, but function flawlessly. Here is what I have:

3 Pmag 20 rounders ($15 a piece)
 1 Bushy 20 rounder ($12)
 2 Cproducts 30 rounders ($12 a piece)
 2 Tapco 30 rounders ($15 a piece)
 3 Pmag 30 rounders ($15 a piece)
 5 OKAY 30 rounders ($12 a piece)
 8 unmarked COLT 30 rounders ($12 a piece)
 1 Lancer 48 rounder ($50)
 1 Surefire 60 rounder ($80)


All added up together is $442. Will sell all for $400 cash to one buyer. Or make offer. Don't need to sell, but would like funds for other things. ONLY TRADES IM INTERESTED IN ARE 30 ROUND MAGAZINES FOR A CHINESE NORINCO BWK-92 (84S). Located in Fargo, ND."
279,http://www.armslist.com/posts/3704279,For Sale:  Banned converted Saiga 20 gauge,"Concord, Charlotte, North Carolina",$ 900,"Listed On: Thursday, November 13, 2014",Shotguns,Saiga                                                                                ,20 Gauge                                                                                ,Semi-automatic                                                                                ,Shotgun,Nice Converted Saiga 20 gauge
281,http://www.armslist.com/posts/3704281,For Sale/Trade:  Smith and Wesson 5906,"Westside, Wichita, Kansas",$ 475,"Listed On: Thursday, November 13, 2014",Handguns,Smith & Wesson                                                                                ,9mm Luger (9x19)                                                                                ,Double / Single Action                                                                                ,Pistol,"Smith & Wesson 5906 
Original Box with 3 magazines
316two5978two1"
283,http://www.armslist.com/posts/3704283,For Sale/Trade:  Glock 30 gen 3 with night sights,"Michigan city, Valparaiso, Indiana",$ 550,"Listed On: Tuesday, January 27, 2015",Handguns,Glock                                                                                ,45 ACP                                                                                ,Striker Fire                                                                                ,Pistol,I have a gen 3 glock 30 sf  with trijicon bright and tough night sights and two mags with sherpa holster and desantis cozy partner text REDACTED
284,http://www.armslist.com/posts/3704284,For Sale:  Ak47 tapco furniture,"Okmulgee/Morris, Tulsa, Oklahoma",$ 600,"Listed On: Thursday, November 13, 2014",Rifles,no type,7.62x39                                                                                ,Semi-automatic                                                                                ,Rifle,Ak47 with tapco furniture has 4 mags with it 1 magpul p mag 30 round 1 steel 30 round and 2 steel 20 round mags. Comes with 500 plus ammo steel case rounds. I believe it's a Romanian made not 100% can send more pics contact me at REDACTED
285,http://www.armslist.com/posts/3704285,For Sale:  45 acp 500Rnds,"Milford, Cincinnati, Ohio",$ 220,"Listed On: Thursday, November 13, 2014",Ammo,no type,no type,no type,no type,"Selling 500 rounds of 45 acp, Estate (owned by Federal). Asking $220 OBO, please no low ballers."
287,http://www.armslist.com/posts/3704287,For Sale/Trade:  Weatherby Mark XXll,"Hazleton, Wilkes-Barre/Scranton, Pennsylvania",$ 650,"Listed On: Thursday, November 13, 2014",Rifles,Weatherby                                                                                ,22 Long Rifle                                                                                ,Semi-automatic                                                                                ,Rifle,Weatherby Mark XXll 22LR semi auto. Has weaver fixed power scope. Sling
289,http://www.armslist.com/posts/3704289,For Trade:  Ruger 10/22 with soft case,"West, Reno, Nevada",Offer,"Listed On: Thursday, November 13, 2014",Rifles,no type,no type,no type,no type,Hello I'm offering up my Ruger 10/22 to trade for a Mosin Nagant or SKS. I would prefer the carbine version Mosin. If you have any other interisting firearms you'd like to trade for my Ruger let me know.
290,http://www.armslist.com/posts/3704290,For Sale:  Browning BT-99 Pigeon Grade,"North West, Phoenix, Arizona","$ 2,200","Listed On: Saturday, December 20, 2014",Shotguns,Browning                                                                                ,12 Gauge                                                                                ,Break Open                                                                                ,Shotgun,"Browning BT-99 Pigeon Grade Trap. 34"" barrel Full Choke. Monte Carlo stock. Beautiful Wood. Comes with Browning Case.As near as I can tell, based on serial number this shotgun was built in 1980.

This shotgun is in excellent shape."
292,http://www.armslist.com/posts/3704292,For Sale:  AR 15 New Black rain ordnance norguard built lower receiver,"Charlotte, Charlotte, North Carolina",$ 400,"Listed On: Thursday, November 13, 2014",Rifles,no type,223/5.56 NATO                                                                                ,Semi-automatic                                                                                ,Rifle,Black rain ordnance with Norgaurd coating built lower receiver.  This lower is brand new.  The only reason I took it out of the box was to install the parts kit.  It has been sitting in my safe for close to year.  I bought it stripped for $400.  I'm asking the same with the parts kit installed. Firm
293,http://www.armslist.com/posts/3704293,For Sale:  PSA AR-15 - Preowned,"Columbia, Columbia, South Carolina",$ 670,"Listed On: Thursday, November 13, 2014",Rifles,Palmetto State Armory                                                                                ,223/5.56 NATO                                                                                ,Semi-automatic                                                                                ,Rifle,"This firearm is available for purchase online click the link below. Open seven days a week from 8:30 am to 6:30 pm. Firearm is pre-owned but is in good condition. Has some minor scratches and shows signs of use.

BUY THIS FIREARM TODAY - CLICK HERE

Decker's Jewelry and Pawn
1735 Decker Blvd Ste 70
Columbia SC 29206
REDACTED"
294,http://www.armslist.com/posts/3704294,For Sale:  *NEW* Springfield XDS,"Milford, Cincinnati, Ohio",$ 499,"Listed On: Friday, December 19, 2014",Handguns,Springfield                                                                                ,9mm Luger (9x19)                                                                                ,Striker Fire                                                                                ,Pistol,"Springfield XDS 9 mm
Caliber: 9 mm
Capacity: 7+1
Barrel: 4"""
295,http://www.armslist.com/posts/3704295,"For Sale:  RossiM92 Carbine .44Mag- Lever action 16"" barrel","McKinney, Dallas, Texas",$ 400,"Listed On: Wednesday, December 24, 2014",Rifles,Rossi-Braztech                                                                                ,44 Magnum                                                                                ,Lever Action                                                                                ,Rifle,"Used Rossi R92 Round Barrel- M92 Carbine .44Mag Blue 8+1 16"".

Used twice, maybe 20 rounds total if that. Lot's of fun to shoot. Top eject rifle. Comes with bag.

Price is firm, cash only. Face to face, no trades or shipping. Thank you."
296,http://www.armslist.com/posts/3704296,For Sale:  Colt Mustang Pocketlite 380 acp,"Greeley, Fort Collins, Colorado",$ 525,"Listed On: Thursday, November 13, 2014",Handguns,Colt                                                                                ,380 ACP                                                                                ,Single Action                                                                                ,Pistol,"Colt mustang blued 380 acp with two mags and box. These are getting harder to find in any condition, some holster wear, made in 1990. Great CCW gun. 525.00 no trades and all laws apply."
297,http://www.armslist.com/posts/3704297,For Sale:  RUSSIAN SAIGA AK 47 RIFLE IZ 132R,"Uptown, Charlotte, North Carolina",$ 550,"Listed On: Thursday, November 13, 2014",Rifles,Saiga                                                                                ,7.62x39                                                                                ,Semi-automatic                                                                                ,Rifle,"Russian Saiga AK 47 Rifle,762 x 39 semi auto, these are imported base AK47 hunting Style rifles with a Black Polymer hunting buttstock and fore end. The Saiga rifles are intended for hunting big and medium-sized game under different climatic conditions. The rifles are developed on the base of the venerable Kalashnikov assault rifle and chambered for 7.62x39 . These rifles are brand new & come with 16 inch chrome lined barrels , side mount rail for mounting optics, 1 ten round mag & all new construction in the famous  Russian IZHMASH Arsenal.They do not use standandard AK mags but will work with the Sure fire 30 round hi cap magazines

Comes with extra 20 round magazine."
298,http://www.armslist.com/posts/3704298,For Sale:  425.00,"ozark, Springfield, Missouri",$ 425,"Listed On: Thursday, November 13, 2014",Handguns,Ruger                                                                                ,9mm Luger (9x19)                                                                                ,Striker Fire                                                                                ,Pistol,new ruger sr9c stainless. very nice gun. two clips one 17 rd one 10rd. with carring case and holster. 425.00 REDACTED    also 100 rds included
299,http://www.armslist.com/posts/3704299,For Sale:  Yugoslavian SKS rifle 7.62x39,"Chesapeake (Hickory/Great Bridge), Hampton Roads, Virginia",$ 425,"Listed On: Thursday, November 13, 2014",Rifles,no type,7.62x39                                                                                ,Semi-automatic                                                                                ,Rifle,Matching numbers  Yugoslavian SKS rifle 7.62x39. The rifle comes equipped with a Tapco Intrafuse stock which is six position collapsible. It also has a Picatinny rail to add extra accessories. It is fed with 20 round detachable Tapco magazines also included. It also has a Tapco sling. Great gun!
300,http://www.armslist.com/posts/3704300,For Sale:  Kahr cm9,"Sumter, Columbia, South Carolina",$ 340,"Listed On: Thursday, November 13, 2014",Handguns,Kahr                                                                                ,9mm Luger (9x19)                                                                                ,Double Action                                                                                ,Pistol,"Kahr cm9 in excellent condition with factory box/papers, n82 tactical iwb holster, uncle mikes pocket holster and 20rds federal hydra shok jhp.

Reply to ad or text REDACTED"
301,http://www.armslist.com/posts/3704301,For Sale:  Kimber Ultra Carry Two With Free Shipping,"Southside OKC, Oklahoma City, Oklahoma","$ 1,300","Listed On: Thursday, November 13, 2014",Handguns,Kimber                                                                                ,9mm Luger (9x19)                                                                                ,Single Action                                                                                ,Pistol,"pecifications: Caliber: 9mm Height (inches) 90 degrees to barrel: 4.75. Weight (ounces) with empty magazine: 25. Length (inches): 6.8. Magazine capacity: 8. Ambidextrous thumb safety. Recoil spring (pounds): 16. Full-length guide rod. Frame: Material: Aluminum. Finish: Satin silver. Width (inches): 1.15. Front strap serrations. PVD coating on small parts Front strap checkering: ball-milled grooves. Grooved aluminum mainspring housing Round heel. Slide: Material: Stainless steel. Finish: High polish bright blue PVD. Cut scroll engraving and border. Barrel Length: 3-inch. Material: Stainless steel. Twist rate (left hand): 16. Ramped. Sights: Type: Tactical Wedge night sights, fixed. Radius: 4.8 inches. Grips: blue/black ball-milled G-10 thin grips Trigger: Solid aluminum, match grade Factory setting (approximate pounds): 4.0–5.0. . Firearm must be sent to an FFL Dealer of your choice in your state of residence. No sales to anyone under the age of 21 regardless of type of firearm. (Gun Sold As Is / Warranty With Manufacturer / NO RETURNS / All Sales Are Final) Shipping and full purchase price insurance included in price to lower 48 states only. No Canada or Hawaii sales! USPS money order only or credit/debit cards accepted with a 3.2% convenience fee added to price. Any other means of payment sent by mail not being a post office money order will be shredded and item will be relisted. It will be your responsibility to recover your funds as I will not get involved in anyway. Price is firm / No Negotiations. I expect payment in 5 days from purchase date. NO EXCEPTIONS TO ANY OF MY TERMS."
302,http://www.armslist.com/posts/3704302,For Sale:  Ap-9  tec-9,"West indy, Indianapolis, Indiana",$ 600,"Listed On: Thursday, November 13, 2014",Handguns,no type,9mm Luger (9x19)                                                                                ,no type,Pistol,I have a brand new never fired ap-9  willing to trade for any type of Assault pistol AK-47or Ar-15 or glocks give me a call at REDACTED
303,http://www.armslist.com/posts/3704303,For Trade:  Ruger SR9 for trade,"Huntsville/Madison, Huntsville, Alabama",Offer,"Listed On: Thursday, November 13, 2014",Handguns,Ruger                                                                                ,9mm Luger (9x19)                                                                                ,Striker Fire                                                                                ,Pistol,"Ruger SR9 BI-TONE with box, papers and two 17 rnd mags.  Gun is in excellent shape. Would like to trade for a Sig sp2022 9mm or a gen 2 or gen 3 glock.  If interested email or text me at REDACTED"
304,http://www.armslist.com/posts/3704304,For Sale:   DPMS/Panther AR-15 type A-3 5.56 Compliant AR15,"Tennessee, Tennessee, United States",$ 820,"Listed On: Thursday, November 13, 2014",Rifles,no type,223/5.56 NATO                                                                                ,Semi-automatic,no type,"You are bidding on a new, AR-15 type DPMS/Panther Arms, optics ready carbine. Features a heavy A3 upper receiver, .95"" Bull barrel and A2 stock for user comfort. Ships with 10 Rd Mag. This is a State Compliant model.You must contact the Seller and request payment instructions from the Seller,Thanks!!!"
305,http://www.armslist.com/posts/3704305,For Sale:  NEW ENGLAND FIREARMS 12 GA. SINGLE SHOT LIKE NEW,"walkerton area, South Bend, Indiana",$ 125,"Listed On: Monday, November 24, 2014",Shotguns,H&R                                                                                ,12 Gauge                                                                                ,Single Shot                                                                                ,Shotgun,"Gun is like new!  28"" full choke barrel.  Call REDACTED no texts or emails."
306,http://www.armslist.com/posts/3704306,For Sale:  IWI TAVOR,"Heath, Ohio, United States","$ 1,699","Listed On: Thursday, November 13, 2014",Rifles,Israel Weapon Industries                                                                                ,223/5.56 NATO                                                                                ,Semi-automatic                                                                                ,Rifle,"**MSRP $1999.00**
Description: IWI TAVOR B16 223 RFL B 30RD  
Manufacturer: IWI-US 
Model #: Tavor SAR-B16  
Type: Rifle: Semi-Auto  
Finish: Black  
Stock: Black Polymer Bullpup Configuration 
Sights: Integral Backup Folding Sights FT: Tritium Post  
Barrel Length: 16.5"" 
Overall Length: 26.125""  
Weight: 7.9 lbs  
Caliber: 223  
Capacity: 30+1  
Action: Semi-Automatic  
# of Mags: 1  
Muzzle: Flash Hider 
Features: Uses STD AR15/M16 Magazines
100% Ambidextrous Configuration/Optional LH Bolts"
