,url,title,location,price,post date,category,manufacturer,caliber,action,firearm type,postcontent
502,http://www.armslist.com/posts/3704502,Want To Buy:  Milsurp Pistols,"Ogden, Wilmington, North Carolina",$ 300,"Listed On: Monday, December 1, 2014",Handguns,FÉGARMY Arms Factory                                                                                ,9mm Luger (9x19)                                                                                ,Single Action                                                                                ,Pistol,"Want to buy low end milsurp or service pistols. Would like to add to my collection. Pistols for example include star model b series, feg tokerevs/makarovs/hipowers, norinco ttc, colt police special, croation php, old 1911's, old sig's and old mausers.

The more worn the better, i like pistols with character. Revolvers included. If they need refinishing or the bluing is gone thats ok too. Not looking for black powder at this time. Im more interested in the history than shootability. I have items to trade as well"
503,http://www.armslist.com/posts/3704503,For Trade:  Hk p2000 9mm,"Tampa, Tampa/St. Pete, Florida",Offer,"Listed On: Thursday, November 13, 2014",Handguns,Heckler & Koch                                                                                ,9mm Luger (9x19)                                                                                ,Double / Single Action                                                                                ,Pistol,Hk p2000 v2 in 9mm with box two 13 round magazines lock and 3 extra back straps. Looking to trade for the best ar 15 I can get doing an even trade. Not really looking for other trades but I don't mind hearing offers for other firearms. If you offer something good I could consider it.
504,http://www.armslist.com/posts/3704504,For Sale/Trade:  carbon fiber 22a smith and Wesson 1 of 1500,"Springfield, Ohio, United States",$ 450,"Listed On: Wednesday, November 19, 2014",Handguns,Smith & Wesson                                                                                ,22 Long Rifle                                                                                ,Striker Fire                                                                                ,Pistol,"Have a 22 smith and Wesson carbon fiber. Great 
Shooting plinker. Looks cool. Only 1500 made has 3 mags and blackhawk soft holster. 50 rds ammo.  450.00
Also have mossburg pump 12 gauge adjustable choke  vent rib. Shoots good.  225.00 will text pics

Text works best REDACTED"
505,http://www.armslist.com/posts/3704505,For Sale/Trade:  Kimber Custom Eclipse II,"East Nashville, Nashville, Tennessee","$ 1,000","Listed On: Friday, November 28, 2014",Handguns,Kimber                                                                                ,45 ACP                                                                                ,Single Action                                                                                ,Pistol,"For sale or trade is a like new Kimber Custom Eclipse II. It has only been fired at the factory but as it's not setting on a dealer's shelf, it's technically used. The pics posted below do not do the pistol justice. The pistol features night sights, a beveled mag well and a finish that's unique to Kimber. In addition, the original box and paperwork are included. I'm primarily interested in selling as I have my eye on a couple of other firearms."
506,http://www.armslist.com/posts/3704506,For Sale:  Xd40 subcompact,"4 seasons area, Greensboro, North Carolina",$ 450,"Listed On: Thursday, November 13, 2014",Handguns,Springfield                                                                                ,40 S&W                                                                                ,Striker Fire                                                                                ,Pistol,"Nice xd40 subcompact. 3 mags, holster and mag holder. $450 obo"
508,http://www.armslist.com/posts/3704508,For Sale:  LWRC M6 IC SPR,"Gainesville, Gainesville, Florida","$ 2,000","Listed On: Thursday, November 13, 2014",Rifles,no type,no type,no type,Rifle,"Got a lnib LWRC M6 IC SPR, 14.7'' barrel with permanently pinned muzzle brake to make it 16'', has spiral fluted barrel. im the first owner, bought it brand new, has the original receipt for the gun ($2350) got box papers and everything it came when I purchased the gun , upgraded the trigger to a geissele super dynamic 3 gun flat face trigger ($270, best trigger I've ever felt, has it on all my rifles) , comes with the stock trigger from lwrc also. shot exactly 3 mags through it, not a single mark anywhere on the rifle including the bolt carrier, can't even tell it has even be fired. selling to buy a 308 for long distance shooting. asking $2000 Located in Gainesville


tags: glock kimber sig hk beretta kimber benelli ksg remington mossberg AK arsenal springfield 1911 40 45 noveske daniel wilson spikes rock river wasr smith wesson s&w m&p mp scar xdm taurus 9mm trijicon aimpoint eotech tavor keltec scar spas h&k"
509,http://www.armslist.com/posts/3704509,For Sale:  Ruger Mini 30 Folding Stock 7.62x39,"SW, Oklahoma City, Oklahoma",$ 875,"Listed On: Thursday, November 13, 2014",Rifles,Ruger                                                                                ,7.62x39                                                                                ,Semi-automatic                                                                                ,Rifle,"Ruger Mini 30 
Ranch Rifle (Built in scope mounts)
Butler Creek Folding Stock 
7.62 x 39
3 metal Mags, 45 Round, 30 Round (new in package), standard 20 Round
Bushnell 3-9 x 40 Scope (Mounted)
Hard Plastic foam lined carry case.
REDACTED Call or Text"
510,http://www.armslist.com/posts/3704510,For Sale/Trade:  Mitchell's Mauser m48 8mm collectors grade,"Cleveland, Cleveland, Ohio",$ 450,"Listed On: Wednesday, November 19, 2014",Rifles,Mauser                                                                                ,8mm Mauser                                                                                ,Bolt Action                                                                                ,Rifle,"Mitchell's Mauser m48 yugo 8mm collectors grade I have certificate of authenticity,original box bayonet ammo pouches and clening kit.matching numbers."
511,http://www.armslist.com/posts/3704511,Want To Buy:  50 BMG,"Milwaukie, Portland, Oregon",Offer,"Listed On: Wednesday, November 19, 2014",Ammo,no type,no type,no type,no type,I am looking for 200 rounds of 50 BMG ball ammo let me know what you have and the asking price.
512,http://www.armslist.com/posts/3704512,For Sale:  Baretta PX4 Storm .40,"Hilliard, Columbus, Ohio",$ 325,"Listed On: Thursday, November 13, 2014",Handguns,Beretta USA                                                                                ,40 S&W                                                                                ,Double / Single Action                                                                                ,Pistol,For sale is a mint condition Baretta PX4 Storm (full size) in .40SW. Gun comes with 3 mags and box. No trades and price is not negotiable. Please send message for pics. - thanks!
514,http://www.armslist.com/posts/3704514,"For Sale/Trade:  Rock River LAR-15, Heavy Barrel","East Nashville, Nashville, Tennessee","$ 1,000","Listed On: Thursday, November 13, 2014",Rifles,Rock River Arms                                                                                ,223/5.56 NATO                                                                                ,Semi-automatic                                                                                ,Rifle,"For sale or trade is a Rock River LAR-15 mid length.  This rifle features a heavy barrel and the upper contains a built in rear sight which co-witnesses perfectly with an optic, especially an EOTech or Aimpoint.  The rifle has Magpul furniture from end to end and has been shot very little.  It balances really well for a heavy barrel and is a tack driver. The rifle comes with one Magpul magazine and two GI mags."
516,http://www.armslist.com/posts/3704516,For Sale:  STI International Tactical 5.0 .40cal,"Tulsa Metro, Tulsa, Oklahoma","$ 1,800","Listed On: Thursday, November 13, 2014",Handguns,no type,40 S&W                                                                                ,Single Action                                                                                ,Pistol,"High capacity double stack ""2011"" model in .40cal with three 17rd and one 15rd magazines, box and papers.  Have put through break-in process with no failures and is extremely accurate. $1800"
517,http://www.armslist.com/posts/3704517,For Sale:  GLOCK 19 IN 9MM COMPACT MODOLE  NEW,"DOWNTOWN FASHION SQUARE MALL, Orlando, Florida",$ 500,"Listed On: Thursday, November 13, 2014",Handguns,Glock                                                                                ,9mm Luger (9x19)                                                                                ,Double Action                                                                                ,Pistol,"New handgun tested at range dureing purchase and has been left in glock case since then
looking to sell no tradeing
cash offer only thank you for reading my post"
518,http://www.armslist.com/posts/3704518,For Sale:  Remington .357 mag ammo,"Ann arbor, Detroit, Michigan",$ 40,"Listed On: Thursday, November 13, 2014",Ammo,no type,no type,no type,no type,50 rounds of Remington .357 mag 180 gr semi-jacketed hollow point. Call or text fo r more information-734 929 72eight eight
519,http://www.armslist.com/posts/3704519,For Trade:  Box of 40 cal,"Grove City, Columbus, Ohio",Offer,"Listed On: Thursday, November 13, 2014",Ammo,no type,no type,no type,no type,Box of 40 cal
520,http://www.armslist.com/posts/3704520,For Sale/Trade:  New Never Fired Zavasta N-PAP M70 TACTICAL,"Minneapolis, Minneapolis / St. Paul, Minnesota","$ 1,100","Listed On: Monday, December 1, 2014",Rifles,Century International Arms                                                                                ,7.62x39                                                                                ,no type,Rifle,"Rifle has and includes original wood furniture. Has a side folding Ace  pressure actuated folding stock with A2 buffer tube, and Luth-AR Modular Buttstock with adjustable hight and shoulder placement. QD attachments on the stock and sling points on the rifle and stock folding adapter. Gun has rail with tactical foregrip on it. Rifle is brand new. Comes with original everything. Two mags, box, furniture, and box's for all the after market parts. Also has a new spikes tactical Dynacomp Muzzle device custom fitted. It's an ak47 so knock down power and penitration is high as expected.  All local and federal rules apply for age, residency, and criminal records. Valid Minnesota I.D. and over 21. This is a solid rifle, look up NuthingFancy's review on YouTube and several others. It's the finest built AK47 I've owned."
521,http://www.armslist.com/posts/3704521,For Sale/Trade:  Russian 1939 Tula Mosin Nagant,"Franklin, Dayton, Ohio",$ 200,"Listed On: Tuesday, November 18, 2014",Rifles,no type,7.62x54R                                                                                ,Bolt Action                                                                                ,Rifle,This is a Russian 1939 in super nice condition. 7.62x54R. Some ammo included. $200.00 Dan REDACTED
523,http://www.armslist.com/posts/3704523,For Sale:  Ruger LCR 38+P,"west, Topeka, Kansas",$ 375,"Listed On: Thursday, November 13, 2014",Handguns,Ruger                                                                                ,38 S&W Special                                                                                ,Single Action                                                                                ,Suppressors,Like new Ruger LCR low rounds $375.00 text 78five 64o398eight
524,http://www.armslist.com/posts/3704524,For Sale:  Benelli Super Black Eagle II shotgun,"Richland, Tri-Cities, Washington","$ 1,000","Listed On: Thursday, November 13, 2014",Shotguns,Benelli                                                                                ,12 Gauge                                                                                ,Semi-automatic                                                                                ,Shotgun,"For Sale I have a like new, in case,  Left Handed, 12 GA Benelli Super Black Eagle II shotgun. It is black and has been fired little.  I bought it and upon receipt found it was a LH shotgun.  I would gladly trade for the same in RD version  or sell this one for $1000.00.  The sell for much more new.  Please call or text me at 1-REDACTED. Thanks"
525,http://www.armslist.com/posts/3704525,"For Sale:  ""Mossberg 500"" Coast to Coast shotgun.","Cold Springs, Reno, Nevada",$ 300,"Listed On: Thursday, November 13, 2014",Shotguns,Mossberg                                                                                ,12 Gauge                                                                                ,Pump Action                                                                                ,Shotgun,This is essentially a Mossberg 500 that was manufactured for the Coast to Coast stores and has their stamp on it. Others than that is a Mossberg 500 with a cool Cerakote™ Paint job on it and a updated pistol grip stock. Not asking much for it so I'm firm on my price.
526,http://www.armslist.com/posts/3704526,For Sale:  Smith And Wesson 38 special CTG,"Lagrange, Fort Wayne, Indiana",$ 400,"Listed On: Thursday, November 13, 2014",Handguns,Smith & Wesson                                                                                ,38 S&W Special                                                                                ,no type,Revolver,Smith And Wesson 38 special CTG
528,http://www.armslist.com/posts/3704528,For Sale:  Bushmaster AR-15 pistol .223 Wylde (5.56),"south side.., Fayetteville, Arkansas",$ 900,"Listed On: Thursday, November 13, 2014",Handguns,Bushmaster                                                                                ,223/5.56 NATO                                                                                ,no type,Pistol,"Bushmaster AR-15 pistol. 7.5"" barrel, free float handguard, one point sling mount, brand new upper!
Chambered in .223 Wilde, which brings 5.56 ammo into the safe preasure zone, while decreasing the bullets distance to the lands. This leads to increased accuracy, and better performance out of .223 Remington ammo.
900 obo."
529,http://www.armslist.com/posts/3704529,For Sale:  model 870 remington  tactical shotgun all black,"east colorado springs, Colorado Springs, Colorado",$ 220,"Listed On: Thursday, November 13, 2014",Shotguns,Remington                                                                                ,12 Gauge                                                                                ,Pump Action                                                                                ,Shotgun,"I have a , Tactical Blackhawk Spec. Ops Blasted Black Oxide 18"" Adjustable 12 guage shotgun- 3"" Matte Black- for sale. featrures optional (not included) pistol grip, and a system simlar to the ar-15 with a rail and interchangable parts making it more agile and wicked looking-- but i returned the ones I bought to the store. I Bought the 870 from an estate sale about a year back and want to find something else. priced to sell-- new ones are regular priced at 599$ and are on sale at cabelas right now for 469$.
 Must be a Colorado resident over 18 y.o. with valid  ID."
530,http://www.armslist.com/posts/3704530,For Trade:  M&P 9 Compact with thumb Safety,"Glenpool, Tulsa, Oklahoma",Offer,"Listed On: Wednesday, November 19, 2014",Handguns,Smith & Wesson                                                                                ,9mm Luger (9x19)                                                                                ,Striker Fire                                                                                ,Pistol,"I have a mint perfect M&P Compact with thumb safety, box, all backstraps, and one mag.  Looking for trade only, and only what I list a s trade.  Face to Face in my area only, if you cannot meet in my area, please do not email.  Thanks."
531,http://www.armslist.com/posts/3704531,For Sale:  .308 WIN AMMO. 151 ROUNDS TOTAL,"Fernley, Reno, Nevada",$ 120,"Listed On: Thursday, November 13, 2014",Ammo,no type,no type,no type,no type,"I have 151 rounds .308 WIN. left. I sold my Howa and have this ammo left.
Unopened Boxes
4 Boxes Federal XM80C 7.62x51mm. 149gr. FMJ 80 rounds total
1 box SSA .308 175gr. HPBT- 20 rounds total
1 box PPU .308 Match HPBT 10,9g/168gr.- 20 rounds
1 box Perfecta .308 147gr. FMJ.
loose ammo
11 rounds mixed.
Total is 151 rounds .308 worth/cost approximately $150 to $140 

ASKING $120.00/O.B.O
thanks,
Call or text REDACTED"
532,http://www.armslist.com/posts/3704532,For Sale:  .375 h&h mag ammo,"Ann arbor, Detroit, Michigan","$ 1,600","Listed On: Thursday, November 13, 2014",Ammo,no type,no type,no type,no type,"1 box/20 rounds of Federal supreme .375 h&h mag 300 grain bear claw ammunition x2 $80.00 per box

.75 box/15 rounds of federal supreme .375 h&h mag 300 grain solid ammunition x1 $55.00 per box 

1 box/20 rounds of federal supreme.375 h&h mag 300 grain trophy bonded ammunition x1
$80.00 per box

1 box/20 rounds of federal supreme .375 h&h mag 300 grain trophy bonded sledgehammer solid ammunition x4 $100.00 per box 

1 box/20 rounds of federal supreme .375 h&h mag 300 grain nosler partition ammunition x4(1 box has 2 rounds missing, but i can make up for it with 2 rounds of the same quality) $70.00 per box

1 box/20 rounds of pmc .375 h&h mag 300 grain x-bullet hollow point ammunition x8(1 box has 5 rounds missing, but i can make up for it with 5 rounds of the same quality) $50.00 per box

1 box/20 rounds of Winchester supreme fail safe cxp4 .375 h&h mag 300 grain ammunition ×1 $60.00 per box

1 box/20 rounds of Winchester supreme fail safe cxp4 .375 h&h mag 270 grain ammunition x1 $50.00 per box

1 box/20 rounds of Remington .375 h&h mag 270 grain soft point ammunition x1 $50.00 per box

1 box/20 rounds of vulpes venture inc. Fox cartridge division .375 h&h mag 270 grain solid ammunition x1 $60.00 per box

1 box/20 rounds of vulpes venture inc. Fox cartridge division .375 h&h mag 270 grain f/safe ammunition x1 $60.00 per box

Feel free to contact me with any questions or concerns. If you feel my prices are a bit off but you are still interested get ahold of me and we'll see what we can work out. Call or text any time 734 929 72eight eight"
533,http://www.armslist.com/posts/3704533,For Sale:  P83 Wanad,"SWAC, Fort Wayne, Indiana",$ 300,"Listed On: Thursday, November 13, 2014",Handguns,no type,9mm Makarov                                                                                ,Double / Single Action                                                                                ,Pistol,"I have a Polish P83 Wanad,( 9x18 Makarov Cal.). In excellent condition. VERY minor carry wear and like most of these pistols, very few rounds fired, bore like new, bright and shiny.
Includes 2 mags and 50rds of ammo.
300 Must be legal to own firearms with valid Indiana ID, prefer LTCH."
535,http://www.armslist.com/posts/3704535,For Sale/Trade:  Looking to trade for a centry c39 rifle,"NE Albuquerque, Albuquerque, New Mexico",$ 1,"Listed On: Thursday, November 13, 2014",Rifles,Springfield                                                                                ,7.62x39                                                                                ,Semi-automatic                                                                                ,Rifle,Im looking for a centry arms c39 ak rifle I have a draco-c ak pistol with upgrades or i have a Springfield 1911a1 mil-spec im looking for a strait trade if interested my number is REDACTED
536,http://www.armslist.com/posts/3704536,For Sale:  Ruger Security Six 6 inch,"Murfreesboro, Nashville, Tennessee",$ 425,"Listed On: Monday, December 29, 2014",Handguns,Ruger                                                                                ,357 Magnum                                                                                ,Double / Single Action                                                                                ,Revolver,"Ruger Security Six six inch. 
Action very good. slight holster wear. Extra set of Ruger original target grips.
Or best reasonable offer."
537,http://www.armslist.com/posts/3704537,For Sale:  PTR 91,"Richmond, Lexington, Kentucky","$ 1,000","Listed On: Monday, November 24, 2014",Rifles,no type,308/7.62 NATO                                                                                ,Semi-automatic                                                                                ,Rifle,"Nearly brand new PTR 91 KF, I have literally shot 5 rounds out of it total. Gun is MINT. Bristol, CT production. Would prefer to sell it outright, but will entertain some trades or partial trades. Let me know what you have worst I can say is no.
Things I am looking specifically for S&W 1911 E-Series, Colt AR15, Sig P220 SAS Gen 2, Beretta 92f/fs not a1, Glock 19 or 32, Sig P229 no rail, Colt Commander"
538,http://www.armslist.com/posts/3704538,Want To Buy:  Canik 55 tp 9,"Cumberland valley, Cumberland Valley, Pennsylvania",$ 350,"Listed On: Thursday, November 13, 2014",Handguns,Century International Arms                                                                                ,9mm Luger (9x19)                                                                                ,Double / Single Action                                                                                ,Pistol,"Looking for desert tan mostly but will consider all offers, price is negotiable"
539,http://www.armslist.com/posts/3704539,For Sale:  WTB shot gun,"Wichita, Wichita, Kansas",FREE,"Listed On: Thursday, November 13, 2014",Shotguns,no type,no type,no type,Shotgun,"Looking for a cheap 12g shot gun. I don't want a barrel longer than 20"" I can go get a cheap $180.00 870 replica at walmart and that is along the lines of what I want. 

Really hoping to find a winchester defender.

I figured I would start here first though. Please don't try to sell me your $500 870s.. let's be mindful of each others time."
540,http://www.armslist.com/posts/3704540,Want To Buy:  WTB 22 LR Ammo Want To Buy .22 22lr Ammunition WTB,"Midwest City, Oklahoma City, Oklahoma",$ 999,"Listed On: Thursday, November 13, 2014",Ammo,no type,no type,no type,no type,"I Want to Buy 22 LR Ammo - Paying Cash .8 cents per round.
bring any amount you are willing to sell by my work 10am to 7pm Mon-Sat
No Amount is too Small or Too Big. Txt me and lemme know what you have!!
Thank You!! -Dennis

bring ammo to Dennis at:
6101 SE 15th St.
Midwest City, OK 73110

txt me: 405 - 408 - Four Six Eight Six 
or Call Us @ 405 - 610 - 2166"
541,http://www.armslist.com/posts/3704541,For Sale/Trade:  new fn fnx tactical 45,"muskogee, Tulsa, Oklahoma","$ 1,200","Listed On: Thursday, November 13, 2014",Handguns,FN Herstal S.A.                                                                                ,45 ACP                                                                                ,no type,Pistol,"I have a new fn fnx tactical 45 auto with 6 15round mags case and all the goodies that come with it.  I am the original owner.
 Will take partial trades but need at least 600 cash and rest in trade
 Would sell as is with all 6 mags for 1200 cash no less regardless.
Needing to pay medical bill but im not desperate  ill pawn it before i give it away."
543,http://www.armslist.com/posts/3704543,For Trade:  S&W M&P Shield 9,"St. Paul, Minneapolis / St. Paul, Minnesota",Offer,"Listed On: Thursday, November 13, 2014",Handguns,Smith & Wesson                                                                                ,9mm Luger (9x19)                                                                                ,Striker Fire                                                                                ,Pistol,"S&W M&P Shield 9 with Apex sear and all trigger surfaces smoothed out (very crisp trigger)
comes with 2 flush fit (7 round) mags and 2 extended (8 round) mags.

Around 500 rounds down the pipe with no issues."
