,url,title,location,price,post date,category,manufacturer,caliber,action,firearm type,postcontent
708,http://www.armslist.com/posts/3704708,For Sale:  Mossberg 500 12ga,"Del City, Oklahoma City, Oklahoma",$ 295,"Listed On: Thursday, November 13, 2014",Shotguns,Mossberg                                                                                ,12 Gauge                                                                                ,Pump Action,no type,"Mossberg 500 12ga, used, pistol grip - $295"
709,http://www.armslist.com/posts/3704709,For Sale:  Ruger M77 .308 w/ scope and tripod,"Del City, Oklahoma City, Oklahoma",$ 650,"Listed On: Thursday, November 13, 2014",Rifles,Ruger                                                                                ,308/7.62 NATO,no type,no type,Ruger M77 .308 w/ scope and tripod - $650
710,http://www.armslist.com/posts/3704710,For Sale:  remington 597 heavy barrel 200.00 firm,"machesney park, Rockford, Illinois",$ 200,"Listed On: Monday, December 8, 2014",Rifles,Remington                                                                                ,22 Long Rifle                                                                                ,Semi-automatic                                                                                ,Rifle,would like to sell my like new Remington 597 hb with 4x32 scope and 3 magazines and bipod.
711,http://www.armslist.com/posts/3704711,For Sale:  PS90 NIB,"Kirtland AFB, Albuquerque, New Mexico","$ 1,250","Listed On: Thursday, November 13, 2014",Rifles,FN Herstal S.A.                                                                                ,5.7x28mm                                                                                ,Semi-automatic                                                                                ,Rifle,"Brand New PS90 for sale or trade.
I bought it and never got around to shooting it. I'd like to sell it to get something I will use more often. I want to buy a KSG and they are going for around 799 new so if you have one for trade, I would like to get about 450 cash in addition or another 450 dollar firearm.
I may be interested in other trades but I am certainly not looking for run of the mill AR15s.
Price is based on average used retail. If you are not MIL/LE I may require a background check.
You can text 617-85two-689six

Trades: KSG, Sig 716, 1911 plus cash, etc"
712,http://www.armslist.com/posts/3704712,For Sale:  SOLD,"xxx, Alabama, United States",FREE,"Listed On: Monday, December 15, 2014",Farming,no type,no type,no type,no type,sold
713,http://www.armslist.com/posts/3704713,Want To Buy:  Beretta 92/96 Inox,"Lexington, Columbia, South Carolina","$ 100,000","Listed On: Thursday, November 13, 2014",Handguns,Beretta USA                                                                                ,40 S&W                                                                                ,no type,Pistol,"I'm looking for a Beretta 96 Inox. I'd prefer a 96 but I'm also interested in the 92. Whichever one it is, it has to have all stainless controls. I'm not interested in the models that have the black controls. It's easiest to reach me by text at REDACTED. Thanks"
715,http://www.armslist.com/posts/3704715,"For Sale:  TT Gunleather slim ""Mike's Special"" iwb for Glock 19/23/32","Youngstown, Youngstown, Ohio",$ 90,"Listed On: Thursday, November 13, 2014",Holsters,no type,no type,no type,no type,"I have a like new custom leather IWB holster from TT Gunleather for the Glock 19/23/32.The model is the slim ""Mikes Special "". Its right handed and fits up to 1.5"" belt."
716,http://www.armslist.com/posts/3704716,For Sale/Trade:  SigArms Mauser M2 45 ACP Pistol,"DOWNTOWN, Huntsville, Alabama",$ 1,"Listed On: Thursday, November 13, 2014",Handguns,Mauser                                                                                ,45 ACP                                                                                ,Single Action                                                                                ,Pistol,"Mauser M2 chambered in 45 acp. Pistol is in good shape, just needs a new home. I purchased it on a whim and since I shoot 9mm most of the time I figured I would just try to trim down the number of calibers in my collection. Comes in original Mauser box with 2 magazines and trigger lock & key as well as the instruction booklet. Looking for cash offers or possible trades on 9mm pistols or 9mm chambered rifles. Not interested in Hi-point, Lorcin, or any low end stuff. This gun is built like a tank and you just don't see them often. Most you find online are chambered in 40SW. I also might trade for a 357, but not really interested in any other calibers at this time. Sorry for the stock photos but if you are interested I can text you pics of my actual gun. FTF transactions only in the Huntsville area and I only trade or sell to CCW carriers or folks with voters ID. Just don't want my guns falling into the wrong hands! Thanks"
717,http://www.armslist.com/posts/3704717,For Sale:  Glock 22 RTF,"Locust Grove, Atlanta, Georgia",$ 500,"Listed On: Thursday, November 13, 2014",Handguns,Glock                                                                                ,40 S&W                                                                                ,Double Action                                                                                ,Pistol,"Glock Model 22 (RTF) full size transitional gun with the Rough Texture Finish. You don't see many of these. Has a mag release like the Gen four but internals and grips like the Gen 3 with the RTF on the frame. Chambered in .40 Smith & Wesson.

Selling with two (2) 15-Round magazines, one (1) Leather Creek black , belt holster, two (2) boxes of Lawman - 165 grain 40S&W, one (1) box of SpeerLE Law Enforcement Gold Dot – 180 grain 40 S&W and one (1) box of Zombie Max – 165 grain 40 S&W."
718,http://www.armslist.com/posts/3704718,For Sale/Trade:  remington 742,"springfield, Springfield, Missouri",$ 499,"Listed On: Saturday, February 14, 2015",Rifles,Remington                                                                                ,30-06 Springfield                                                                                ,Semi-automatic                                                                                ,Rifle,semi auto model 742 in 30-06cal.great shape.BEST OFFER OR TRADE. COME SEE AT WASHINGTON PAWN 1355 e kearney springfield MO 65803 in old b&t pawn building. PHONE REDACTED
719,http://www.armslist.com/posts/3704719,"For Sale:  Springfield XDS 4.0 9 mm LNIB with 1 mag, all XDS Gear and a box of Federal ammo","brooklyn park, Minneapolis / St. Paul, Minnesota",$ 480,"Listed On: Thursday, November 13, 2014",Handguns,Springfield                                                                                ,9mm Luger (9x19)                                                                                ,Striker Fire                                                                                ,Pistol,Text: REDACTED
720,http://www.armslist.com/posts/3704720,For Sale:  Bravo Concealment DOS G30s Holster,"Wheatfield, Indiana, United States",$ 45,"Listed On: Thursday, November 13, 2014",Holsters,no type,no type,no type,no type,"Hello.  I have a great condition Bravo Concealment DOS G30s holster.  Only used for about a week.  Excellent shape.  

Please text for a response.  REDACTED

Thanks"
721,http://www.armslist.com/posts/3704721,For Sale:  Smith&Wesson M&P 22 LNIB w/ 2 mags and a 500 round brick Remington yellow jacket ammo,"brooklyn park, Minneapolis / St. Paul, Minnesota",$ 420,"Listed On: Thursday, November 13, 2014",Handguns,Smith & Wesson                                                                                ,22 Long Rifle                                                                                ,Striker Fire                                                                                ,Pistol,Text: REDACTED
723,http://www.armslist.com/posts/3704723,For Sale:  Ruger American Rifle .308 Wolf Camo,"Charlotte, 4724 Old Pineville Rd., Charlotte, North Carolina",$ 350,"Listed On: Thursday, November 13, 2014",Rifles,Ruger                                                                                ,308/7.62 NATO                                                                                ,Bolt Action                                                                                ,Rifle,"I have a new in box Ruger American Rifle, .308 Winchester with a 22 inch barrel. This rifle comes with the Wolf pattern camouflage on a synthetic stock, black finish on barrel and receiver, 4 round detachable rotary magazine and comes with the factory paperwork and cardboard box.

Come check this rifle out in person at The Arms Room in Charlotte. Give me a call @ 980-237-eight9eight1 if you have any questions. Shipping can be arranged for $20. Check us out on Facebook @ www.facebook.com/thearmsroomcharlotte or try our website @ www.targuns.com Thanks for looking and have a good day."
724,http://www.armslist.com/posts/3704724,For Sale:  Sig Sauer P220 45acp w Night Sights,"Bethany, Oklahoma City, Oklahoma",$ 700,"Listed On: Thursday, November 13, 2014",Handguns,Sig Sauer                                                                                ,45 ACP                                                                                ,Double / Single Action                                                                                ,Pistol,"Sig Sauer P220 45acp with night sights and hogue grip. Comes with two mags, one 7 round and one 8 round. Carrying case included. Ammo already loaded into mags will be included as well. Great handgun. Beautiful and reliable. Never a jam or misfire. It is very accurate. Excellent craftsmenship. I hate to sell her but I need the money for hospital bills. Asking price is $700 or best offer. Thank you for looking. If interested text me @ 580-three 62-644six or email me. Thank you"
726,http://www.armslist.com/posts/3704726,For Sale:  $215 Weaver scope illuminated German #4 30mm,"Ypsilanti Milan Dearborn Grosse Pointe, Detroit, Michigan",$ 215,"Listed On: Tuesday, January 27, 2015",Optics,no type,no type,no type,no type,$215. Briefly mounted in Larue scope mounts on my ar15 . I also bought a 24 mm scope at the same time that's what I'm using. So for sale is the 50 mm scope it's a 2.5 x 10 x 50 mm weaver classic extreme with the lighted German number four reticle and adjustable parallax.
727,http://www.armslist.com/posts/3704727,For Sale:  Evac Litters,"Cornelius, Charlotte, North Carolina",$ 250,"Listed On: Friday, November 28, 2014",Tactical,no type,no type,no type,no type,"All USGI. Raven collapsible litter, SKED litter kit, poleless litter.  Used in training only, in great condition."
729,http://www.armslist.com/posts/3704729,For Sale:  .223 55gr FMJ - 500Rds,"Englewood, Denver, Colorado",$ 140,"Listed On: Thursday, November 13, 2014",Ammo,no type,no type,no type,no type,"I have 500 rounds of .223 55gr FMJs.  These are reloads that I bought a few years back at Tanner.  Bought from one of the regulars there and I've shot 1000s of rounds of their ammo, but I don't recall their name.  Been awhile since I've been to Tanner.  No longer own anything to shoots .223.   $140."
730,http://www.armslist.com/posts/3704730,For Sale:  Custom .308 nail driver,"prp, Louisville, Kentucky",$ 500,"Listed On: Thursday, November 13, 2014",Rifles,Remington                                                                                ,308/7.62 NATO                                                                                ,Bolt Action                                                                                ,Rifle,Super accurate rifle with a nice scope and shoots like a dream. Has a custom painted mauser stock that could use another paint job or coating in my opinion. The barrel is a high end short Remington barrel. The bolt is a mauser bolt and is smooth as silk. Awesome hunting rifle or long range rifle. Don't miss out hurry. I am open to any and all trades and offers worst I can say is no so who knows what will happen. Asking $500 obo. REDACTED
732,http://www.armslist.com/posts/3704732,For Sale:  .38 Special / 232 rounds total - Price Lowered,"Deerfield Beach, Broward, South Florida",$ 50,"Listed On: Tuesday, November 18, 2014",Ammo,no type,no type,no type,no type,"An assortment of .38 ammo with a retail value of $95-100.  232 rounds total.

Remington 130gr MC (L38S11)            35rds	
Winchester 125gr +P (USA38JHP)        32rds	
Federal 158gr LRN (AE38B)                 20rds	
Winchester PDX1 130gr +P (S38PDB)   15rds	

Loose in bags - both lead (flat nose or semi-wadcutter?)
Winchester +P         40rds
Federal                   90rds

$65 shipped or $50 face to face"
733,http://www.armslist.com/posts/3704733,"For Sale:  Gen 4 Glock 19, RMR, Slide milling, Nite Sites","downtown, Cincinnati, Ohio","$ 1,200","Listed On: Thursday, November 13, 2014",Handguns,Glock                                                                                ,9mm Luger (9x19)                                                                                ,Striker Fire                                                                                ,Pistol,"Hello I am looking to sell my customized Generation 4 Glock 19. It's very, very, very difficult for me to let this go but unfortunately I need the money. Comes with the following. 

 All milling and serration work done by http://ateiguns.com
 Trijicon suppressor height night sites ($150)
 Trijicon RMR Slide Milling ($160)
 Trijicon RM01, RM02 - ($550)
 Half Top Serration-Front ($135)
 Enhanced Serration Glock Front and Rear ($135)
 Raven concealment holster ($79.99)
 Raven concealment double mag carrier ($64.99)
 Streamlight TLR-1S available also for additional ($100)
 The Glock itself ($599.99)

 After all that being said, it would be at least a 6 month wait to get all of this done

 Well over $2000 in this package and that's before taxes and the waiting.. Please, please do not waste my time or yours with lowball offers. Do your research before offering."
735,http://www.armslist.com/posts/3704735,For Trade:  Glock27 gen3 other pistol,"Fayetteville, Fort Bragg, Spring Lake, Fayetteville, North Carolina",Offer,"Listed On: Thursday, November 13, 2014",Handguns,Glock                                                                                ,40 S&W                                                                                ,Striker Fire                                                                                ,Pistol,"I have a very nice glock 27 gen 3 with original box, 2 mags, and hogue slip on grip.  around 40-50 rds fired through it.  I can take pics but it looks like every other Glock27"
736,http://www.armslist.com/posts/3704736,For Sale:  Winchester 61 22lr,"prescott valley, Prescott Valley, Arizona","$ 1,000","Listed On: Thursday, November 13, 2014",Rifles,Winchester                                                                                ,22 Long Rifle,no type,no type,"Winchester Model 61 pump action rifle in .22 short, long, or long rifle Cal. This 1957 manufacture. (SN: 258944) rifle features a polished blue finished action and 24 inch barrel and a Walnut stock and forearm. This rifle does have the grooved rcv. Thanks for looking!"
737,http://www.armslist.com/posts/3704737,For Sale:  Beretta 84B/.380ACP,"West STL County (close to Lindbergh and 40), St. Louis, Missouri",$ 400,"Listed On: Friday, December 26, 2014",Handguns,Beretta USA                                                                                ,380 ACP                                                                                ,Double / Single Action                                                                                ,Pistol,"Beretta 84B. This pistol is in great condition but has very minor wear marks at the backstrap, top of the barrel and back of the trigger guard. I replaced the grips with the appropriate new Beretta grips and the original grips are in good shape but show signs of being carried. Comes with 2 13 round magazines but no box or owners manual. Ambidextrous safety and smooth trigger. Steel slide and alloy frame. If you like the Beretta 92FS; you'll find this to be very similar."
738,http://www.armslist.com/posts/3704738,For Sale:  Iver Johnson Carbine,"Lebanon TN, Nashville, Tennessee",$ 349,"Listed On: Thursday, November 13, 2014",Rifles,Iver Johnson Arms                                                                                ,22 Long Rifle                                                                                ,Semi-automatic                                                                                ,Rifle,"Rifle. 22 Caliber. Excellent condition, includes 2 Magazines. Any questions please feel free to contact."
739,http://www.armslist.com/posts/3704739,For Sale:  Large Conceal Carry Holster,"YORK, Harrisburg, Pennsylvania",$ 14,"Listed On: Thursday, November 13, 2014",Holsters,no type,no type,no type,no type,"GLKL LARGE FRAME GUNS
GLOCK 20,21
RUGER 92,96
BERETTA 
92,96,8000
TAURUS 92,96"
740,http://www.armslist.com/posts/3704740,For Sale:  Smith & Wesson M&P40 4.25 barrel large frame 10 round trijicon night sights G,"Chula Vista, San Diego, California",$ 425,"Listed On: Thursday, November 13, 2014",Handguns,Smith & Wesson                                                                                ,40 S&W                                                                                ,Striker Fire                                                                                ,Pistol,"Smith & Wesson M&P 40 with trijicon night sights Green
4.25 barrel 
large frame 
2 ea. 10 round mags
W/ comp-tac Minotaur Holster 
and(2) exrta Palmswell Grip Sizes to adjust your grip
No Box 
Buyer pay all transfer fees 
Cash only"
741,http://www.armslist.com/posts/3704741,For Sale/Trade:  Colt AR15 M-4 carbine FDE Tan,"Centre,AL, Rome, Georgia","$ 1,000","Listed On: Thursday, November 13, 2014",Rifles,Colt                                                                                ,223/5.56 NATO                                                                                ,Semi-automatic                                                                                ,Rifle,"Custom Colt upper with Alot of upgrades all mil-spec
Colt 16"" barrel with custom muzzle break
PSA lower
Professional cerekoted FDE tan
And Ammo and accessories, tactical light/ forward assist"
743,http://www.armslist.com/posts/3704743,For Sale/Trade:  savage model hog hunter 308,"springfield, Springfield, Missouri",$ 800,"Listed On: Friday, February 27, 2015",Rifles,Springfield                                                                                ,308/7.62 NATO                                                                                ,Bolt Action                                                                                ,Rifle,bolt action model 11 with leupold scope2-7x33 threaded barrel BEST OFFER OR TRADE. COME SEE AT WASHINGTON PAWN 1355 e kearney springfield MO 65803 in old b&t pawn building. PHONE REDACTED
744,http://www.armslist.com/posts/3704744,For Sale:  308 Upper and lower stripped nib,"Springfield MO, Missouri, United States",$ 315,"Listed On: Thursday, November 13, 2014",Gun,no type,no type,no type,no type,"308 Stripped upper and lower. DPMS cut Black. Ready for that 308 AR build! Brand new in the box. Must complete FBI NICS background check. Pick Up in Springfield MO. Or ship to your FFL
$315.00 for the pair."
745,http://www.armslist.com/posts/3704745,For Sale/Trade:  06 special addition Yamaha blaster with title!!!,"Hendricks county, Indianapolis, Indiana","$ 1,850","Listed On: Thursday, November 13, 2014",Vehicles,no type,no type,no type,no type,Hi I have a very clean 06 special addition Yamaha blaster with the title it runs good looking to trade for a 50 BMG or other nice guns $1850.
746,http://www.armslist.com/posts/3704746,For Trade:  Excellent Morgan Monroe Acoustic/Electric Guitar,"Locust Grove, Tulsa, Oklahoma",Offer,"Listed On: Thursday, November 13, 2014",Miscellaneous,no type,no type,no type,no type,"Mint condition guitar, purchased several years ago and been played a handful of times, originally paid $899.99 in Houston Texas Music store, comes with original hard shell case and leather strap and new set of Martin Retro Strings, willing to trade for nice .22 pistol, Model Number MV-EC-45, list for over $1000.00, contact Dave at REDACTED, please pickup in Locust Grove, I'm disabled and don't drive."
747,http://www.armslist.com/posts/3704747,For Sale/Trade:  Browning Cynergy 28ga.,"Central Upper Peninsula, Upper Peninsula, Michigan","$ 1,900","Listed On: Thursday, November 13, 2014",Shotguns,Browning                                                                                ,28 Gauge                                                                                ,Over and Under                                                                                ,Shotgun,"O/U, 28"" barrels with 2 extended Gold Band skeet chokes and one flush modified, excellent condition"
748,http://www.armslist.com/posts/3704748,"For Sale:  LWRC 16"" M6A2-S COMPLETE UPPER RECEIVER 5.56 $1099","Bradenton, Florida, United States","$ 1,099","Listed On: Thursday, November 13, 2014",Gun,no type,no type,no type,no type,"AVGUNS.com 
Store * REDACTED * Fax REDACTED * 
Custom Shop Proudly Presents this Factory New LWRC M6A2-S (Stretch) Edition Gas-Piston complete upper receiver in 5.56mm NATO (.223) caliber. This LWRC M6A2-S AR15 Line of Gas-Piston uppers that futures longer gas block system with will offer softer recoil impulse. Super limited supply as LWRC no longer offers this upper. This LWRC M6A2-S upper is 16.1"" barrel length. LWRC M6A2-S comes to you in Hard Coat Mil-Spec Type III Black Anodized Hard Finish. Featuring: Factory New LWRC Int. B.U.I.S. Flip-Up Sights. Operators manual, sight tool, oil. Bid With Confidence as you will NOT be disappointed! You are good to go! 

This unit will provide outstanding reliability and accuracy for any tactical or sporting situation. This unit incorporates the latest in LWRC Gas Piston technology. The LWRC rifle line is known the world over for it’s rugged, reliable, system taking the AR15 platform to a New Level! Bid with confidence as you will not be disappointed! You are good to go! This is a Gun Point Custom exclusive Production and you will not see this packages any were on the WEB!
!! We will Pay Top Dollar for Legal Machine and Sub-Machine Guns !!

Don’t miss our way cool Full-Auto Fun vids on our YouTube Channel 
Please feel free to contact us direct from 9-9 / 7 Days. 
We are looking forward to hearing from you! 

AVGUNS.com
Store * REDACTED * Fax REDACTED * 

The Largest LWRC KAC, COLT, KRISS-USA, POF-USA Factory Authorized CLASS III Dealer and Stocking Warehouse Distributor in the Nation! Our Quality Customer Service doesn't end there. We are the only POF-USA & LWRC Authorized and Sponsored CUSTOM SHOP. What that means to you is that you get the best service, at the BEST PRICE! That also means that we carry a Large Selection of Accessories and provide many Custom Services for your one stop shopping!

Custom Accessories and Services:

Leupold Mark 4 Tactical Scopes
A.R.M.S. Inc Mounting Solutions
Advance Armament Supressors
Troy Industries B.U.I.S. Sights
Silenserco Suppressors
Gemtech Suppressors
MagPul Accessories
GG&G Accessories
Vltor Accessories
AimPoint Optics
EoTech Optics
Trijicon Optics

Ships UPS Ground with full insurance $29.
Postal MO's and CC orders will ship in 24 hours.
CC’s add 3.6% fee. All MO’s/ bank checks will be held until cleared
We do ship to all Communist states. Call for details!

Gun Point 
Class 3 FFL / 07 SOT 
4920 Lena Rd unit 102 
Bradenton, Florida 34211 
Store * REDACTED * Fax REDACTED * 

""Whoever said the pen is mightier than the sword obviously never encountered automatic weapons."" 
General Douglas MacArthur."
749,http://www.armslist.com/posts/3704749,For Sale:  Smith and Wesson M&P 15-22 with extras,"prp, Louisville, Kentucky",$ 525,"Listed On: Thursday, November 13, 2014",Rifles,Smith & Wesson                                                                                ,22 Long Rifle                                                                                ,Semi-automatic                                                                                ,Rifle,Super nice and like new Smith M&P 15-22. Has a nice scope on it and also comes with a laser light and bipod. Has quad rails for more customization. Shoots 22 so it's great for beginners or target shooting maybe even some squirrels lol. Has over $700 worth of accessories and firearm. Open to any and all trades shoot me an offer or trade offer. Asking $525 obo
750,http://www.armslist.com/posts/3704750,For Sale:  RUGER NEW MODEL SUPER BLACKHAWK,"kirkland, Seattle, Washington",$ 550,"Listed On: Thursday, November 13, 2014",Handguns,Ruger                                                                                ,44 Magnum                                                                                ,Single Action                                                                                ,Revolver,"MAG 44 REVOLVER, 6 SHOT, 7.5 INCH BARREL, WITH HOLSTER. Some nics in the wood handle, and the metal is beautiful.



g-87284-1"
