,url,title,location,price,post date,category,manufacturer,caliber,action,firearm type,postcontent
0,http://www.armslist.com/posts/3495000,For Sale/Trade:  S&W 629 1 of 500,"WNC, Asheville, North Carolina",$ 1,"Listed On: Saturday, September 13, 2014",Handguns,Smith & Wesson                                                                                ,44 Magnum                                                                                ,Double / Single Action                                                                                ,Revolver,"S&W model 629 44mag Dealer Exclusive 1 of 500 . Looking to trade. Can add ammo if needed or cash depending on trade. Trade value is $1,000 on the pistol"
2,http://www.armslist.com/posts/3495002,For Sale:  .40 S&W Sell/Trade All Factory loaded,"Tacoma, Southwest Washington, Washington",FREE,"Listed On: Saturday, September 13, 2014",Ammo,no type,no type,no type,no type,"Looking to trade some factory .40 S&W Ammo. Willing to sell the FMJ stuff for .25 a round, Except for the total nylon jacket it's .20 cents a round, the self defense stuff for .30 a round.

I would prefer to trade though, looking for 55 gr 22-250 rounds, .45 ACP, .44MAG, .22LR, .32ACP

I will need to add up the self defense ammo that I have that's the only thing I didn't count.

Here's what I have of FMJ rounds:

500 WWB 165 Grain, 100 per box
100 CCI Blazer 165 grain 50 per box (as are all the rest of these)
50 PMC Bronze 165 grain
200 Herters Total Nylon Jacket 165 grain (.20 a round)
100 Independence 165 grain
100 American eagle 165 grain
100 Bitterroot ammo 180 grain
50 Herters 180 grain
50 HSM (remanufactured) 180 grain
250 American Eagle 180 grain
100 WWB 180 grain

I would prefer deals to be in the local Tacoma area, unless your taking a lot then I will drive a little."
3,http://www.armslist.com/posts/3495003,For Sale:  .22 Long Rifle Savage Stevens 87B,"Wichita Falls, Texas, United States",$ 175,"Listed On: Saturday, September 13, 2014",Rifles,Stevens Arms                                                                                ,22 Long Rifle                                                                                ,Semi-automatic                                                                                ,Rifle,"Good condition, hardly ever used."
4,http://www.armslist.com/posts/3495004,For Sale:  M&P 9mm full size,"Bay city, Michigan, United States",$ 400,"Listed On: Saturday, September 13, 2014",Handguns,Smith & Wesson                                                                                ,9mm Luger (9x19)                                                                                ,Striker Fire                                                                                ,Pistol,"Need to sell this weekend. M&P 9mm full size. Comes with 3-17rd mags, one if which is brand spanking new. Pistol is in immaculate condition with a low round count. $400 firm, NO TRADES. Pick up in Bay City or will meet VERY close by."
5,http://www.armslist.com/posts/3495005,For Sale:  Ruger #1 300 Win Mag.,"Columbus, Columbus, GA, Georgia",$ 900,"Listed On: Saturday, September 13, 2014",Rifles,Ruger                                                                                ,300 Winchester Magnum                                                                                ,Single Shot                                                                                ,Rifle,"Stainless, Laminate Grey 300 Win Mag. Includes rings. New in box."
6,http://www.armslist.com/posts/3495006,For Sale/Trade:  Glock 42,"Hermitage, Nashville, Tennessee",$ 500,"Listed On: Saturday, September 13, 2014",Handguns,Glock                                                                                ,380 ACP                                                                                ,Striker Fire                                                                                ,Pistol,"Bought this the other day. Not sure if I like it or not. Wanna test the waters. Comes as is, but with factory box, 2 magazines, etc. Blackhawk IWB holster, Pearce pinky extension, 25 round box of Hornady Critical Defense. Looking to trade for Glock 19, 26, 27, 29, 30, 36. At least Gen 3, Gen 4 preferred, but not a must. Will sell for $500. Email or text REDACTED"
8,http://www.armslist.com/posts/3495008,For Sale:  EOTech 553A65,"Wadmalaw Island, Charleston, South Carolina",$ 300,"Listed On: Saturday, September 13, 2014",Optics,no type,no type,no type,no type,"EOTech 553A65  with quick release lever. Returns within 1 MOA when replaced on picatinny
rail. Comes with Pelican box"
9,http://www.armslist.com/posts/3495009,"For Sale:  22S revolver, custom grips","Old Town, Fort Collins, Colorado",$ 100,"Listed On: Saturday, September 13, 2014",Handguns,no type,22 Long Rifle                                                                                ,Double Action                                                                                ,Revolver,"I bought this a couple years ago at Jax Outdoor, but only shot it once.
Not into plinking any more, so selling. 

The original grips were tiny and one was cracked. 
So I made these custom grips from alder. 
I haven't stained yet, which would bring out the grain a lot more.
Was waiting to find a buyer to choose stain color. 
I will also attach them to the frame after staining (and sealing).
Or you can save $7 and do both yourself."
10,http://www.armslist.com/posts/3495010,For Sale:  200 Rounds 7.62/308,"Dallas, Dallas, Texas",$ 80,"Listed On: Saturday, September 13, 2014",Ammo,no type,no type,no type,no type,"180 Rounds 7.62 Ball and 20 Rounds Remington Core-Lokt .308 150gr soft pt

I sold the rife I had purchased this ammunition for and found it recently when I was moving.  I can meet in the Dallas area.  Cash only. Call or text REDACTED"
11,http://www.armslist.com/posts/3495011,Want To Buy:  Wtb browning buckmark,"Western ma, Massachusetts, United States",Offer,"Listed On: Wednesday, September 24, 2014",Handguns,Browning                                                                                ,22 Long Rifle                                                                                ,no type,Pistol,"Looking for a browning buckmark
Cash in hand"
12,http://www.armslist.com/posts/3495012,For Sale:  Ruger 10/22 Custom Jewel Super Light 18 oz. Cool,"prescott valley, Prescott Valley, Arizona","$ 9,320","Listed On: Saturday, September 13, 2014",Rifles,Ruger                                                                                ,22 Long Rifle                                                                                ,Semi-automatic                                                                                ,Rifle,"Ruger 10/22 Custom Jewel Super Light Weight 18 oz. Custom Match Bull Barrel, Threaded 1/2X28 Custom Foward Throw Compenstaor 30% Of Muzzle Blast!Thread! Custom 3# lbs Trigger Work! Custom Boy Right or Left Thumb Hole Stock SS Evolution With Custom Finger Groves! Life Time Buffer, Custom Bolt,Balanced Polished & Jewel! Custom Bolt Handle! Sniper 6X24X50 Scope With Built In Range Finder! Custom Bi-pod Hard Shell Case! Cal's Custom Gun's & Knives Been Building for 20 Years! Stocks Weight 3 lbs. Barrels 18 ozs."
13,http://www.armslist.com/posts/3495013,For Sale:  Custom cerakote left handed AR-15,"South Tulsa, Tulsa, Oklahoma","$ 1,100","Listed On: Tuesday, September 30, 2014",Rifles,no type,223/5.56 NATO                                                                                ,Semi-automatic                                                                                ,Rifle,"Custom built and cerakoted left handed AR-15 , 20"" stainless bull barrel $1100 or obo. Call or txt REDACTED.

Left, Left Hand, AR15, Cerakote, Kimber, Colt, Ruger, Sig, L\H, L/H"
14,http://www.armslist.com/posts/3495014,For Sale:  MOSSBERG 500 pistol gripped persuader,"San Diego, San Diego, California",$ 100,"Listed On: Saturday, September 13, 2014",Shotguns,Mossberg                                                                                ,12 Gauge                                                                                ,Pump Action                                                                                ,Shotgun,"I fired 10 shells through this and added the forward grip. It's in like new condition. 

Ppt at FFL only. No trades"
16,http://www.armslist.com/posts/3495016,"For Sale:  Rossi .357 mag 2"" snub chrome w/ ammo","White Rock, Dallas, Texas",$ 295,"Listed On: Saturday, September 13, 2014",Handguns,Rossi-Braztech                                                                                ,357 Magnum                                                                                ,Double / Single Action                                                                                ,Revolver,"I have for sale a chrome snubby six shot by Rossi, sister company to Taurus. They make just as good of a revolver, and this has been a fun little gun to own. I just don't need 3 revolvers. I only buy .357's so that you can shoot either .38's or the .357. Its not an airweight, which is a good thing because that magnum would punish you. Ive put about 50 rounds through it, but gotta move it, so Im throwing in a box of .38 hollow points(cheap stuff, but still hollow points) to help it sell. Also throwing in a HKS speed loader. Comes with the original box. Price is $295 firm. But if your short on cash I can hold back the ammo n speedloader to make it happen. Text is the fastest way to reach me. REDACTED. Thanks for lookin."
17,http://www.armslist.com/posts/3495017,For Sale:  top  break revolver collection,"north jersey, New Jersey, United States",$ 1,"Listed On: Saturday, September 13, 2014",Antique,no type,no type,no type,no type,top break revolver collection. smith wesson   harrington richardson.  world war 2  rifle  belts.  m1 garand with collection of enclips and bayonet.  enfield rifle  ww2. available for private collectors and ffl offers.   respond with your phone number
18,http://www.armslist.com/posts/3495018,For Sale:  100 Rounds 357 Magnum Winchester,"Dallas, Dallas, Texas",$ 20,"Listed On: Saturday, September 13, 2014",Ammo,no type,no type,no type,no type,"Two boxes of 357 Magnum ammunition.  One 125gr JSP for target/range and one 145gr Silvertip HP.
I sold the gun I had purchased this ammunition for and found it recently when I was moving. I can meet in the Dallas area. Cash only. Call or text REDACTED"
19,http://www.armslist.com/posts/3495019,For Sale:  Remington Model 11 military,"Cumming, Georgia, United States",$ 500,"Listed On: Thursday, January 8, 2015",Shotguns,Remington                                                                                ,12 Gauge                                                                                ,Semi-automatic                                                                                ,Shotgun,Remington Model 11 Military 12ga  28 inch barrel $500 cash or trade
20,http://www.armslist.com/posts/3495020,For Sale/Trade:  Ar15 S&W sport 15 w/iron sights,"huntsville, Huntsville, Alabama",$ 0,"Listed On: Saturday, September 13, 2014",Rifles,Smith & Wesson                                                                                ,223/5.56 NATO                                                                                ,Semi-automatic                                                                                ,Rifle,S&W sport 15 for sale. Calibers in .223 or 5.56 NATO. Comes with original rear and forward iron sights. 1 magpul magazine holds 30 rounds. And ruger sling. Have put about 100 rounds through it and has been cleaned after every trip to the range. Looking to get 700$ or best offer or trade for something of equal value. NO PISTOL TRADES!!
21,http://www.armslist.com/posts/3495021,For Sale:  Remington 700 .30-06,"Springfield, OH, Ohio, United States",$ 500,"Listed On: Saturday, September 13, 2014",Rifles,Remington                                                                                ,30-06 Springfield                                                                                ,Bolt Action                                                                                ,Rifle,I have an older Remington 700 chambered in .30-06. It has the walnut stock and a lighter contoured barrel. Has a 3-9 Leupold scope. It's in overall good condition and very accurate.
24,http://www.armslist.com/posts/3495024,For Trade:  22LR AND 223/5.56 AMMO FOR TRADE,"Austin, Austin, Texas",Offer,"Listed On: Saturday, September 13, 2014",Ammo,no type,no type,no type,no type,"I've got a ton of 22lr, 223, and 5.56 ammo that I'm looking to trade. I'm open to just about anything firearm related but I'm especially interested in accessories for my 10/22 and my possibly AR15. 

This is a great opportunity to turn your unused stuff into ammo that you will actually use. Let me know what you've got and what ammo you're interested in."
27,http://www.armslist.com/posts/3495027,For Sale/Trade:  Keltec P 11 With side Mounted laser Possible trade,"Manchester, Hartford, Connecticut",$ 299,"Listed On: Sunday, September 28, 2014",Handguns,Kel-Tec                                                                                ,9mm Luger (9x19)                                                                                ,Double / Single Action                                                                                ,Pistol,"I HAVE A KELTEC P 11 9 MM FOR SALE THIS HAS HAD MAYBE 30 ROUNDS FIRED THROUGH IT. IT ALSO HAS A LASERLYTE  ck-amf9 SIDE MOUNT LASER. THIS IS A PERFECT CARRY PISTOL NOT TOO HEAVY AND TH 10 PLUS ONE CAPACITY IS PERFECT. I ONLY HAVE ONE MAGAZINE FOR IT AND THE ORIGINAL BOX AND PAPERWORK FOR BOTH THE LASER AND THE GUN. IT IS PICTURED IN ANOTHER BOX BECAUSE THE LASER WILL NOT FIT INTO THE ORIGINAL BOX. YOU WILL NOT BE DISAPPOINTED WITH THIS PISTOL.
IF YOU ARE IN CONNECTICUT YOU MUST HAVE A CONCEALED CARRY  PERMIT TO PURCHASE THIS PISTOL I WILL CALL IT IN WITH YOUR PERMIT NUMBER AND HAVE IT TRANSFERRED INTO YOUR NAME. IF YOU LIVE OUTSIDE CONNECTICUT I WILL HAVE MY FFL SHIP IT TO YOUR FFL. THERE WILL BE NO EXCEPTIONS TO THE ABOVE STATEMENT FOR IN STATE SALE OR OUT OF STATE SALE."
28,http://www.armslist.com/posts/3495028,For Sale:  FOR SALES,"MICHIGAN, Michigan, United States","$ 3,850","Listed On: Saturday, September 13, 2014",Rifles,Masterpiece Arms                                                                                ,22 Long Rifle                                                                                ,Bolt Action,no type,"Merkel 280 EL As new Merkel 280EL with 27"" barrels. Straight grip, double triggers, and ejectors. This gun is 98-99% but does not have a case or box. Compare this price to new retail. Guns is for sale locally as well. I give a ""no questions asked"" 24 hour inspection period that begins when UPS confirms delivery to your receiving FFL holder. I feel an accurate assessment of the gun can be performed within this time frame. If you can't arrange to view the gun within the 24 hour period, let me know BEFORE the gun ships and we'll schedule shipment to meet your needs. This inspection period does not include factory new guns, unless a manufacturer's flaw is discovered. Disassembly beyond the barrels and forearm, or firing without prior approval, will void the return privilege. Once I receive the gun back and determine it to be in the same condition as when it left, I'll promptly return your money, less shipping costs of course. I try very hard to accurately describe my items, and being a buyer as well, I full well realize one can't make a decision on any gun without first having it in hand. California sales are welcome. And, as always, quality long gun trades are encouraged! And, as always, quality long gun trades are encouraged! Especially high condition/high grade American double shotguns, pre-64 Winchester Model 70's, and American sporting rifles by such makers as Griffon & Howe, Hoffman, Niedner, R.G. Owen, and others. Thanks for looking."
29,http://www.armslist.com/posts/3495029,"For Sale:  Smith and Wesson S&W Model 617 6"" Barrel 22 Revolver","North Dallas, Dallas, Texas",$ 700,"Listed On: Saturday, September 13, 2014",Handguns,Smith & Wesson                                                                                ,22 Long Rifle                                                                                ,no type,Revolver,"Smith and Wesson Model 617 10 short 22 revolver with a 6” barrel.  In very good condition.
I can meet in the Dallas area.  Call or text REDACTED."
30,http://www.armslist.com/posts/3495030,For Sale/Trade:  Ruger Security Six Stainless .357 magnum,"mineola, East Texas, Texas",$ 450,"Listed On: Saturday, September 13, 2014",Handguns,Ruger                                                                                ,357 Magnum                                                                                ,Double Action                                                                                ,Revolver,Ruger Security Six Stainless Steel .357 magnum revolver. 144 rounds .38 special. 25 rounds .357 magnum.
31,http://www.armslist.com/posts/3495031,For Sale:  NEW - RUGER 10/22 RIFLE - CASE AND RANGE PASSES INCLUDED!,"ALBUQUERQUE -- COORS AND GOLF COURSE, Albuquerque, New Mexico",$ 240,"Listed On: Saturday, September 13, 2014",Rifles,Ruger                                                                                ,22 Long Rifle                                                                                ,Semi-automatic                                                                                ,Rifle,"Brand new Ruger 10/22 Carbine Rifle 50th Anniversary 

Unfired and comes with a hard carry case and original box and 5 FREE RANGE VISIT PASSES TO CALIBERS !!!!! 

$240 Cash and carry - I am not accepting offers or trades 

Bill of sale and New Mexico resident required to purchase 

----- Include phone number when you reply to my ad ------

Info on this model is here --

http://www.ruger.com/products/1022Carbine/specSheets/1151.html"
32,http://www.armslist.com/posts/3495032,For Sale/Trade:  Laminate Winchester model 70.300 WSM muzzlebrake,"Lansing, Lansing, Michigan",$ 900,"Listed On: Wednesday, January 14, 2015",Rifles,Winchester                                                                                ,300 Winchester Short Magnum                                                                                ,Bolt Action                                                                                ,Rifle,"laminated stock, custom muzzlebrake,controlled round feed, trigger job,  high gloss barrel , superb condition.Original owners manual, new haven ct manufacture
Burris mounts,cabelas 3x12x40 ext scope,sling.  10 loaded rds 10 brass, the break is very effective , very manageable recoil for a 300 mag."
33,http://www.armslist.com/posts/3495033,"For Sale:  Colt cobra 2""","Tacoma, Seattle, Washington",$ 480,"Listed On: Saturday, September 13, 2014",Handguns,Colt                                                                                ,38 S&W Special                                                                                ,Double / Single Action                                                                                ,Revolver,"I would like to sell  my blued 1975 Colt cobra 2"" 38spl revolver . It is in overall great condition for a 39 year old pistol . The action is tight and runs smooth. It is a beautiful revolver and needs to do more than sit in my safe.

I am located in tacoma and would prefer that any sale take place in that area.

Call email or text REDACTED

Thank you!"
35,http://www.armslist.com/posts/3495035,For Sale/Trade:  Kimber Ultra Carry ii,"anywhere, Tennessee, United States",$ 700,"Listed On: Saturday, September 13, 2014",Handguns,Kimber                                                                                ,45 ACP,no type,no type,Carried Used not abused Kimber Ultra Carry II
36,http://www.armslist.com/posts/3495036,For Sale:  CRKT Fulcrum,"Xenia, Ohio, United States",$ 40,"Listed On: Saturday, September 13, 2014",Knives,no type,no type,no type,no type,"For Sale CRKT Fulcrum. Like new condition, beautiful finish with no box or manual. This model has been discontinued by CRKT. Blade is AUS 8 stainless steel.Will ship in the USA or local pickup. Email, text, or call REDACTED."
37,http://www.armslist.com/posts/3495037,For Sale:  howa targetmaster 308,"Lebanon, Nashville, Tennessee",$ 650,"Listed On: Saturday, September 13, 2014",Rifles,Howa                                                                                ,308/7.62 NATO                                                                                ,Semi-automatic                                                                                ,Rifle,"I Have A Very Nice Howa Targetmaster 308. This Is An Awesome Rifle And Comes From Factory With Hogue Stock , Two Stage Trigger That Has A Great Trigger Pull. Has A 4X16 Scope Heavy Fluted Bull Barrel. Wanting To Trade For A Higher End Tactical Type Shotgun. Will Add Cash For.Right Trade. Benelli M4, Keltec Ksg Etc. Etc. Let Me Know What You Have. Call Or Text REDACTED"
38,http://www.armslist.com/posts/3495038,"For Sale:  reloading Powder, Unique,Bullseye, Red-Dot","wonewoc, Wisconsin, United States",$ 1,"Listed On: Friday, October 3, 2014",Reloading,no type,no type,no type,no type,"Bluff View Arms 501 Center ST/HWY 33 in Wonewoc.
Has A full line of Reloading supplies.
We also do scope mounting,& gun cleaning.
We will be going to a lot of gun show's this fall so call or email to see were we will be!!!!
REDACTED
REDACTED"
39,http://www.armslist.com/posts/3495039,For Sale:  1 of 350 Colt Silver Stallion 45 1911,"southern, Cincinnati, Ohio","$ 1,600","Listed On: Saturday, September 13, 2014",Handguns,Colt                                                                                ,45 ACP                                                                                ,Single Action                                                                                ,Pistol,commander 45 auto box it came in from factory hang tag plastic engraved by master engraver ken flannery 1600
40,http://www.armslist.com/posts/3495040,For Sale:  Nordic components  sr-22 ruger 10/22 tactical chassis,"Murfreesboro, Nashville, Tennessee",$ 220,"Listed On: Wednesday, October 22, 2014",Rifles,Ruger                                                                                ,22 Long Rifle                                                                                ,Semi-automatic                                                                                ,Rifle,For sale is a like new 10 22 conversion to an sr-22.  this is a quality unit by Nordic components. Made of aluminum not plastic like others.  so good Ruger made the SR 22 with it. it does also include the top rail for it all you need to do is a before end of your choice your receiver and barrel and you're good to go.  not really interested in trades unless its for a glock 42  for which I can add some cash these go for 280 shipping on Gunbroker so no low balling please.
41,http://www.armslist.com/posts/3495041,For Sale:  Rare 22LR rifle,"Old Town, Fort Collins, Colorado",$ 120,"Listed On: Saturday, September 13, 2014",Rifles,no type,22 Long Rifle                                                                                ,Single Shot                                                                                ,Rifle,"I inherited this from my father 16 years ago, and haven't used it.

It was made by Firearms International Corp, in Washington, DC.

It's a single-shot."
42,http://www.armslist.com/posts/3495042,For Sale:  M&P 15-22 by Smith and Wesson + EXTRA - ORANGE COUNTY,"HUNTINGTON BEACH, ORANGE COUNTY, Orange County, California",$ 425,"Listed On: Saturday, September 13, 2014",Rifles,Smith & Wesson                                                                                ,22 Long Rifle                                                                                ,Semi-automatic                                                                                ,Rifle,"One of the Best 22LR tactical rifle ever made, easy to use and very similar to an AR-15.

Make: Smith and Wesson
Caliber: 22 Long Rifle
Location: ORANGE COUNTY

Price: $425

Transfer fee is only $35 and NO TAX (SAVE SOME MONEY!!!)


Other info: 
I AM FACING SOME FINANCIAL DIFFICULTY AND NEED THE MONEY.
WELL KEPT (LESS THAN 100 ROUNDS FIRED)
THIS RIFLE HAS DETACHABLE MAGAZINE. AND BULLET BUTTON IS NOT REQUIRED !!! (RIM-FIRE CALIBER RIFLE)

INSPECTION WELCOME !!! RIFLE COMES WITH (1) 10rd MAGS, 6-position COLLAPSIBLE STOCK, FORWARD GRIP, PROTECTIVE HAND-GUARD (look at the picture)

IF YOU HAVE QUESTIONS PLEASE USE PRIVATE MESSAGE


Key words: Orange County, Los Angeles, Oceanside, Riverside, FFL, Ammo, AK47, AR-15, M4, firearms, 9mm, 45acp, magpul, handgun."
