,url,title,location,price,post date,category,manufacturer,caliber,action,firearm type,postcontent
0,http://www.armslist.com/posts/7597000,For Sale:  9mm Carbine Rifle,"Bardstown, Louisville, Kentucky",$ 300,"Listed On: Sunday, November 19, 2017",Rifles,no type,no type,Semi-automatic                                                                                ,Rifle,"9mm Carbine Rifle, Black Poly Stock, Plus P Rated. Semi-Auto, With Adjustable Peep Sight, Sling Swivel, Sling, and Scope Base. Also has a red dot scope and two 10 round clips and a 25 round clip."
1,http://www.armslist.com/posts/7597001,For Sale:  American,"Minnetonka, Minneapolis / St. Paul, Minnesota",$ 335,"Listed On: Sunday, November 19, 2017",Rifles,Ruger                                                                                ,308/7.62 NATO                                                                                ,Bolt Action                                                                                ,Rifle,"Sturm Ruger American rifle chambered in 308, black synthetic, Ruger item #6903, brand new in its box, if your reading this, the gun is still available, inquiries asking such will be ignored, as will low ball offers. Sorry no trades."
3,http://www.armslist.com/posts/7597003,For Sale:  SCCY CPX2 FDE with extras,"Beavercreek, Dayton, Ohio",$ 260,"Listed On: Sunday, November 19, 2017",Handguns,no type,no type,no type,no type,FDE SCCY CPX 2 with Traction grip enhancements and extra factory mag for a total of 3. Have box and every thing from factory. Price is FIRM. Do not waste my time if you don't want to pay what I'm asking.
5,http://www.armslist.com/posts/7597005,"For Sale:  Complete 16"" 7.62x39 upper w/mags and more.","Lady Smith, Fredericksburg, Virginia",$ 300,"Listed On: Sunday, November 19, 2017",Rifles,no type,no type,no type,Rifle,"Everything you need to run 7.62x39 steel case ammo reliably. M1S 16"" 7.62x39 carbine upper, complete with BCG, charging handle and, Magpul handguard. Less than 1500 rounds. Bolt is new and only has about 100 rounds on it. Bolt has power extractor spring and firing pin is enhanced. Barrel has a Yankee Hill Machine muzzle comp and a birdcage is included as well (5/8-24). Also included is a power hammer spring, H2 buffer and, 2 C-products mags that run reliably. Super fun combo that runs reliably and is cheap to feed. $300, willing to ship. I do have additional mags available if interested."
12,http://www.armslist.com/posts/7597012,For Sale:  Ruger American,"Minnetonka, Minneapolis / St. Paul, Minnesota",$ 330,"Listed On: Sunday, November 19, 2017",Rifles,Ruger                                                                                ,243 Winchester                                                                                ,Bolt Action                                                                                ,Rifle,"Sturm Ruger American rifle chambered in 243, black synthetic, Ruger item #6904, brand new in its box, if your reading this, the gun is still available, inquiries asking such will be ignored, as will low ball offers. Sorry no trades."
13,http://www.armslist.com/posts/7597013,For Sale:  Glock 42,"MYRTLE BEACH, Myrtle Beach, South Carolina",$ 400,"Listed On: Thursday, November 30, 2017",Handguns,Glock                                                                                ,380 ACP,no type,no type,I have a new in box glock 42 with 3 mags box and papers from factory 400.00 firm
14,http://www.armslist.com/posts/7597014,For Sale:  Springfield Armory XD 9mm,"Hennepin, Minneapolis / St. Paul, Minnesota",$ 350,"Listed On: Sunday, November 19, 2017",Handguns,Springfield                                                                                ,9mm Luger (9x19)                                                                                ,no type,Pistol,Springfield Armory XD 9mm. Comes with 3clips.
15,http://www.armslist.com/posts/7597015,For Sale:  HK USP 45 Compact,"St.Pete, Tampa/St. Pete, Florida",$ 700,"Listed On: Sunday, November 19, 2017",Handguns,Heckler & Koch                                                                                ,45 ACP                                                                                ,Double / Single Action                                                                                ,Pistol,"Up for sale is a LNIB HK USP 45C with box, papers 2 8rd mags and Talon grips. The pistol has only seen the range once with a box of 50 Federal FMJ and a box of 20 Federal HST JHP down the pipe. It was then cleaned and stored in safe. It functioned flawlessly as you would expect from a HK and the recoil impulse is like a 9mm as well as being ridiculously accurate. The reason I am selling it is because I have 2, fell in love with my first one so I bought this as a backup. Looking to make room in the safe for another toy. I paid 935 out the door for her so I believe my price is fair. - If it's listed it's available.- Price is fair and FIRM- I don't travel, if you want it then prepare to come to St.Pete.- CCW holders go to top of list.....BOS required.- Lowballers, scammers and fishers need not contact me as you will be ignored.- Trades welcome if it's a QUALITY firearm....no junk!"
16,http://www.armslist.com/posts/7597016,For Sale:  Arsenal slr106u pistol ak in 556,"Montpelier, Bryan, Toledo, Ohio",$ 950,"Listed On: Sunday, December 10, 2017",Rifles,no type,223/5.56 NATO                                                                                ,Semi-automatic                                                                                ,Rifle,"For sale krink style arsenal ak in 556x45 model 106u pistol,  made in Bulgaria with arm brace made by sb tactical. Comes with 2 arsenal circle 10 mags, 1-30rnd and 1-20rnd,  everything is in like new condition, has been shot very little. Very clean and straight gun. Asking $950.00I WILL NOT SHIP FTF ONLY! cash is king but I will consider quality trades, no junk please.To contact me faster text or call REDACTED"
17,http://www.armslist.com/posts/7597017,For Trade:  Springfield XDS 9mm,"Harrison, Chattanooga, Tennessee",Offer,"Listed On: Sunday, November 19, 2017",Handguns,Springfield                                                                                ,9mm Luger (9x19)                                                                                ,Striker Fire                                                                                ,Pistol,"I have a XDS 9mm 3.3 I want to trade for a XDS in .45, preferably the 4.0 but would take the 3.3. It is 2 tone, has a pocket clip, and a 8 and 9 round magazine, as well as 150 rounds of target ammo and 20 defense rounds. All trades need to be able to prove that they can legally own a firearm, I can provide proof that I can."
18,http://www.armslist.com/posts/7597018,For Sale:  Lnib sig sp2022 with case,"Central, San Antonio, Texas",$ 400,"Listed On: Sunday, November 19, 2017",Handguns,Sig Sauer                                                                                ,9mm Luger (9x19)                                                                                ,Double / Single Action                                                                                ,Pistol,"TODAY ONLY PRICE Good afternoon.im selling a Sig 2022 9mm pistol like new in box hasn't been fired.got a deal on something else so selling this one.comes 2 15 round Sig pro magazinds.case,lock,paddle holster,1 other backstrap.price is 400 cash TODAY ONLY .im not looking for trades. Must have Texas identification and sign bill of sale"
20,http://www.armslist.com/posts/7597020,For Sale:  Ruger Super Redhawk .44 mag,"Lakeville, Minneapolis / St. Paul, Minnesota",$ 750,"Listed On: Sunday, November 19, 2017",Handguns,Ruger                                                                                ,44 Magnum                                                                                ,Double Action                                                                                ,Revolver,"Almost new Ruger Super Redhawk .44 Magnum.  Sorry for generic pic, I was dont have a working camera at the time of posting.  If you want a photo ask and I will send one.Comes with original box and scope rings."
22,http://www.armslist.com/posts/7597022,For Sale:  CZ p-07,"OCALA, Ocala, Florida",$ 475,"Listed On: Sunday, November 19, 2017",Handguns,CZ USA                                                                                ,9mm Luger (9x19)                                                                                ,Double / Single Action                                                                                ,Pistol,"i have a CZ p-07 with four mags, box, night sights, kydex holster, box and paperwork.  Pick up near me in ocala --sorry I am too tight on time due to work to drive right now. Text me at REDACTED anytime"
23,http://www.armslist.com/posts/7597023,For Sale:  Mossberg SSI 1 .270 w/ Leupold Scope,"Richfield, Milwaukee, Wisconsin",$ 325,"Listed On: Sunday, November 19, 2017",Rifles,Mossberg                                                                                ,270 Winchester                                                                                ,Single Shot                                                                                ,Rifle,"Like new both wood and metal, with Leopold VX1-2-7 X 33mm scope, 2 boxes of Remington shells. I purchased it unfired from Cabelas' 4 years ago along with the scope and have put approximately 20 rounds through it, maximum. It's a tack driver that has never seen the elements of moisture- really a gorgeous rifle and scope.rifle with scope rings $325with scope $465Cash only- once the rifle is sold the ad will be pulled so no need to ask.Thanks,"
24,http://www.armslist.com/posts/7597024,For Sale:  Unfired Smith and Wesson M&P Shield 9,"Central Muncie, Muncie, Indiana",$ 425,"Listed On: Sunday, November 19, 2017",Handguns,Smith & Wesson                                                                                ,9mm Luger (9x19)                                                                                ,Striker Fire                                                                                ,Pistol,I have a brand new unfired 9mm M&P Shield with a $70 DeSantis IWB holster to go with it.
27,http://www.armslist.com/posts/7597027,For Sale/Trade:  Glock 43,"Ramsey, Fayetteville, North Carolina",$ 430,"Listed On: Sunday, November 19, 2017",Handguns,Glock                                                                                ,9mm Luger (9x19)                                                                                ,Striker Fire                                                                                ,Pistol,I have a Glock 43 that come with the case 2 mags and a pocket clip 1 of the mags has a + plus Vickers Tactical mag extension and the other has a pierce grip pinky extension. Only about 250 round threw it very clean gun. You must have ppp or cwp.
28,http://www.armslist.com/posts/7597028,"Want To Buy:  Taurus TCP,Ruger LCP,Kel Tec","Rock hill, Rock Hill, South Carolina",$ 185,"Listed On: Sunday, November 19, 2017",Handguns,no type,380 ACP                                                                                ,Double / Single Action                                                                                ,Pistol,"Hello..I'm looking to purchase a micro compact.380 around the $175-200 price range that's in decent shape,long as it performs as it's supposed to. I have my S.C. CWP.Wanting something small to pocket or ankle carry. Looking for Taurus 738,Ruger LCP,Kel Tec,Remington RM,Beretta Pico,S&W Bodyguard,or open to small revolver. 803-374-9 twenty-two7.Thanks! Steven"
29,http://www.armslist.com/posts/7597029,For Sale:  EoTech w/ magnifier,"West, Knoxville, Tennessee","$ 1,000","Listed On: Sunday, November 19, 2017",Optics,no type,no type,no type,no type,EoTech w/ magnifier. Used less than a dozen times. Good condition. New battery.
30,http://www.armslist.com/posts/7597030,For Sale:  FS: Glock 22 (.40 Cal - GEN 4) - Like NEW In Box,"Masterson Station, Lexington, Kentucky",$ 425,"Listed On: Wednesday, December 13, 2017",Handguns,Glock                                                                                ,40 cal                                                                                ,Double Action                                                                                ,Pistol,"I'm selling my Gen 4 Glock 22 (.40 cal) with Glock Night Sights and a Hogue rubber grip on it. I paid right under $600 for it and only shot 35 rounds through it for my last job as a Corrections Officer for range qualification. It is very sturdy and super accurate. I am including approximately 80 rounds of .40 cal and some of those are Hornady close quarters law enforcement ammo. I still have the original box in perfect condition, 4 different sizes/styles of back straps for the handle of the pistol, and booklet. It has a 5.5 LB trigger and I will also include 3 Glock 15-round magazines. Like I said, this Glock is practically brand new. I take very good care of all of my belongings. The pistol is clean and it has been stored in a smoke-free home in the padded box. I work in Law Enforcement, but I only ever used it on the firing range one time. Text me at REDACTED."
31,http://www.armslist.com/posts/7597031,For Sale:  Handguns for sale,"Jackson, Jackson, Tennessee",FREE,"Listed On: Sunday, November 19, 2017",Handguns,no type,no type,no type,no type,Springfield xds 9mm $400S&W M&P 9mm $425Brand new Taurus 445 44 special $450Glock 30 nite sights holster and mag holster 2 mags $525Sig 938 9mm sports edition with leather holster $500
32,http://www.armslist.com/posts/7597032,For Sale:  Custom G19 gen 4w/ conversion kit,"South Side, South Bend, Indiana",$ 825,"Listed On: Friday, December 22, 2017",Handguns,Glock                                                                                ,9mm Luger (9x19)                                                                                ,Striker Fire                                                                                ,Pistol,Like new g19 Gen 4 with the following:truglo night sightspyramid complete trigger kit installed(original included)3 magsoringal box and paperworkadvantage arms 22lr conversion kit
33,http://www.armslist.com/posts/7597033,For Sale:  Browning Hi Power 9mm,"San Antonio, San Antonio, Texas",$ 600,"Listed On: Sunday, November 19, 2017",Handguns,Browning                                                                                ,9mm Luger (9x19)                                                                                ,Single Action                                                                                ,Pistol,"I am selling a Browning Hi Power Belgium made.  Comes with two Magazines 13 rds.  Factory barrel.  The gun is completely factory with wood grips.  It is a great shooter.  The finish has seen better days but it has no pitting or rust.  The wood grips show dents and scratches.  I Believe the gun was was manufactured in 1975 according to the serial #.  I will ship to a FFL.  Local buyers should be ready to fill out a bill of sale CCW preferred, DL a must."
34,http://www.armslist.com/posts/7597034,For Sale:  Mossberg 4x4 25-06,"Kettering, Dayton, Ohio",$ 315,"Listed On: Sunday, November 19, 2017",Rifles,Mossberg                                                                                ,25-06 Remington                                                                                ,Bolt Action                                                                                ,Rifle,"This is a great gun! Shoots straight, and comes with scope, sling and bipod. Looking to sell, no trades."
35,http://www.armslist.com/posts/7597035,For Sale/Trade:  Hi-Point carbine 9mm,"Burlington, Northern Kentucky, Kentucky",$ 150,"Listed On: Sunday, November 19, 2017",Rifles,Hi Point                                                                                ,9mm Luger (9x19)                                                                                ,Semi-automatic                                                                                ,Rifle,"9mm Hi-point carbine includes factory hardware, factory mag and red ball extended 20rd mag. Also including clone EOtech (holds zero) and flip up iron sights(not pictured). Looking to sell or trade for 6.5 Grendel uppers or interested in hunting caliber rifles. Must be KY resident and prefer ccw holder."
36,http://www.armslist.com/posts/7597036,For Sale:  270 win. Savage Axis,"Depere, Green Bay, Wisconsin",$ 299,"Listed On: Sunday, November 19, 2017",Rifles,Savage Arms                                                                                ,270 Winchester                                                                                ,Bolt Action                                                                                ,Rifle,Like NEW Savage Axis 270. Comes with new Weaver scope. $299 or best offer. Is in A+ condition.
38,http://www.armslist.com/posts/7597038,For Sale/Trade:  G34 with upgrades and extras,"Middletown, Cincinnati, Ohio",$ 800,"Listed On: Saturday, March 31, 2018",Handguns,Glock                                                                                ,9mm Luger (9x19)                                                                                ,Striker Fire                                                                                ,Pistol,Glock 34 gen 4 with the following upgrades and extras:StipplingZev fulcrum pro trigger and springsZev magwellHaley Strategic night sightsSilencerco threaded barrelLone wolf compensatorTungsten guide rod7 mags Gcode paddle holsteroriginal factory items except backstrapsTLR not includedThere is about $1400 in this package so please be reasonable with offers.$800 casharound $1000 trade value
41,http://www.armslist.com/posts/7597041,For Trade:  S&W M&P 40 cal,"Rock Hill, Rock Hill, South Carolina",Offer,"Listed On: Sunday, November 19, 2017",Handguns,Smith & Wesson                                                                                ,40 S&W                                                                                ,Striker Fire                                                                                ,Pistol,"S&W M&P 40 cal with 4 15 round mags, holster, and box. Looking for a 40 cal, 9mm with a thumb safety or 357 mag snub nose. Gun is in great shape very accurate has some holster wear."
42,http://www.armslist.com/posts/7597042,Want To Buy:  WANT TO BUY KNIVES.ONE OR WHOLE COLLECTIONS,"Surfside Beach, Myrtle Beach, South Carolina",$ 111,"Listed On: Wednesday, February 14, 2018",Knives,no type,no type,no type,no type,PRICE DEPENDS ON KNIFE AND CONDITION
46,http://www.armslist.com/posts/7597046,"For Sale:  Ria 1911 a2 13+1 trade for Glock 17,19","Miami, Miami-Dade, South Florida",$ 450,"Listed On: Sunday, November 19, 2017",Handguns,Rock Island Armory                                                                                ,45 ACP                                                                                ,Double / Single Action                                                                                ,Pistol,RIA 1911a2 with Wilson Combat beaver tail and hammer 13+1rds call or text REDACTED$450 or trade for Glock 19 or 17
47,http://www.armslist.com/posts/7597047,For Sale:  Glock 26 gen 4,"Boise, Boise, Idaho",$ 450,"Listed On: Sunday, November 26, 2017",Handguns,Glock                                                                                ,9mm Luger (9x19)                                                                                ,Double Action                                                                                ,Pistol,"Glock 26 gen 4. Its in like new condition (fired once) and comes with 3 mags all with Pearce grip extenders, all original grip backstraps, tool, cleaning brush, speedloader, and original glock hard case. Ill also include a never used alien gear holster."
49,http://www.armslist.com/posts/7597049,For Sale/Trade:  .44 Magnum Underwood/Hornady Factory Deer Ammo,"Wadsworth, Copley, Akron, Ohio",$ 1,"Listed On: Saturday, February 10, 2018",Ammo,no type,no type,no type,no type,"I have several boxes of factory .44 magnum factory ammo for sale that I'm not using.(2) Hornady Leverevolution .225 gr FTX, 20 count each $18(1) Underwood 200 gr Nosler J.H.P, 20 count $20(1) Underwood 180 gr XTP, 20 count $20 *SOLD(1) Underwood 180 gr XTP, 48 count (2 out of 50 missing) $40 *SOLDIf you're not familair with Underwood Ammo, check them out. High quality stuff, compares to and exceeds Buffalo Bore.Email or call 330-618-1670. No trades, NO TEXTs, No scammers. ""IS THIS ITEM STILL AVAILABLE"" will be ignored."
50,http://www.armslist.com/posts/7597050,For Sale:  SilencerCo Glock 19 Threaded Barrel,"Concord, Charlotte, North Carolina",$ 150,"Listed On: Sunday, November 19, 2017",Gun,no type,no type,no type,no type,"This is for a new SilencerCo Glock 19 Threaded barrel, model AC862. Never put in a gun or shot through. Technical details: Tech Info:Fit: Glock 19 (Gen 3 & 4)Caliber: 9mm LugerMaterial: 416R Stainless SteelFinish: Black NitrideLenght: 4.5""Threads: 1/2"" - 28Twist: 1 in 10 RH"
51,http://www.armslist.com/posts/7597051,For Sale:  Caesar Guerini Forum 20/28 combo,"Land O Lakes, Tampa/St. Pete, Florida","$ 8,500","Listed On: Sunday, November 19, 2017",Shotguns,Caesar Guerini                                                                                ,no type,Over and Under                                                                                ,Shotgun,"This shotgun appears to be unfired. The action is in miraculous condition. There is a small amount of surface rust on the forearm metal. I can send Pisces if you are an interested buyer. A combo like this would cost around 15k. Due to the surface minor rust on forearm and slight engraving blur on right side, it is discounted a great deal. All mechanics and other finishes are LNIB. Again does not appear to have ever been fired, lock up is EXTREMELY tight. You will not find this combo in a Forum anywhere with these length barrels and if you do it will be double the cost. The 28ga is a 30” barrel and the 20ga is a 32” barrel. The wood stock is phenomenal, no handling marks at all. I’ll consider a trade or partial trades for Harley Davidson soft tail of equal or greater value, colt snake guns LNIB, FN Scar 17s FDE, Colt SAAs, other high end shotguns both field and sporting. Must have a valid ID and sign bill of sale. If the add is up then the gun is available so please don’t ask. Thank you."
53,http://www.armslist.com/posts/7597053,For Sale:  Handgun,"Smithfield, Raleigh / Durham / CH, North Carolina",$ 350,"Listed On: Sunday, November 19, 2017",Handguns,Smith & Wesson                                                                                ,40 S&W                                                                                ,Double Action                                                                                ,Pistol,Smith & Wesson Sd40ve. Excellent condition. Two 15 round clips. 3 boxes of ammo. Must have purchase or concealed permit.
54,http://www.armslist.com/posts/7597054,"For Sale:  Rock Island 1911 3.5""","Winston-Salem, Winston Salem, North Carolina",$ 300,"Listed On: Sunday, November 19, 2017",Handguns,Rock Island Armory                                                                                ,45 ACP                                                                                ,Double Action                                                                                ,Pistol,"I have a Rock Island 3.5"" 1911 45acp for sale. Has wrap around grip. In good shape."
55,http://www.armslist.com/posts/7597055,For Sale:  Youth Remington 870 20ga.,"De Pere, Green Bay, Wisconsin",$ 299,"Listed On: Sunday, November 19, 2017",Shotguns,Remington                                                                                ,20 Gauge                                                                                ,Pump Action                                                                                ,Shotgun,Like NEW Youth Remington 870 shotgun. Comes with a choke tube and camo shotgun case. In A+ condition. $299 or best offer.
57,http://www.armslist.com/posts/7597057,"For Sale/Trade:  Colt 14.5"" Barrel New","Warrenton, St. Louis, Missouri",$ 300,"Listed On: Sunday, November 19, 2017",Gun,no type,no type,no type,no type,"NOS M4 Colt 14.5"" Barrel.  Dated 2005, Never Installed or Used.  Additional Pictures Sent Upon Request."
59,http://www.armslist.com/posts/7597059,For Trade:  Winchester 69a 22 rifle,"Greeneville, Tri-cities, Tennessee",Offer,"Listed On: Sunday, November 19, 2017",Rifles,Winchester                                                                                ,22 Long Rifle                                                                                ,Bolt Action                                                                                ,Rifle,I have for trade a winchester 69a 22 rifle. Its in nice condition for its age and comes with a vintage weaver scope.  Could add ammo for right trade.
