,url,title,location,price,post date,category,manufacturer,caliber,action,firearm type,postcontent
499,http://www.armslist.com/posts/7395499,For Sale:  2 carry guns for sale,"West, Wichita, Kansas",$ 250,"Listed On: Monday, October 2, 2017",Handguns,Smith & Wesson                                                                                ,no type,Double / Single Action                                                                                ,Pistol,"1.) keltec pf9 with box and 2 mags $250 or best offer will come with 1 box of ammo2.) smith and Wesson body guard 380 with laser only 1 mag no box $250 will come with 1 box of ammo, gun looks brand new. Call text or message REDACTED"
500,http://www.armslist.com/posts/7395500,"For Sale:  Anderson AR-15 with 20"" .223 Wylde Barrel","Princeton-Trenton area, Chillicothe, Missouri",$ 450,"Listed On: Monday, October 2, 2017",Rifles,Anderson Manufacturing                                                                                ,223/5.56 NATO                                                                                ,Semi-automatic                                                                                ,Rifle,"A2 style AR-15 built from an Anderson lower and unknown milspec upper with fixed carry handle receiver. It has a 20"" .223 Wylde Barrel that can shoot .223 or 5.56. Comes with a Butler Creek strap, one 5 round magazine and one 30 round magazine. Only selling to fund other gun purchases. $450 firmPublic meetup in Princeton or Trenton, MO. Must be willing to do a bill of sale with ID, and be of legal age and status to buy a firearm.Would consider trades, just let me know what you have.Also selling a Gen 4 Glock 19 for $450 firm. I also have a USGI ALICE pack with aluminum frame for $65Respond through email and we can exchange phone numbers."
501,http://www.armslist.com/posts/7395501,For Sale/Trade:  Sig Sauer 556XI,"Maysville, Jacksonville, North Carolina","$ 1,200","Listed On: Tuesday, January 9, 2018",Rifles,Sig Sauer                                                                                ,223/5.56 NATO                                                                                ,Semi-automatic                                                                                ,Rifle,"For Sale/Trade Sig Sauer 556XI.  Purchased in 2014, and went into the safe.  Has never been fired.  Comes with (1) Hex-Mag 30rd magazine and fold down BUIS.Price $1200 OBOLocal face to face sale only, and buyer must sign Bill of Sale."
502,http://www.armslist.com/posts/7395502,For Sale/Trade:  Glock 43 new,"Morristown, Knoxville, Tennessee",$ 430,"Listed On: Monday, October 2, 2017",Handguns,Glock                                                                                ,9mm Luger (9x19)                                                                                ,Striker Fire                                                                                ,Pistol,Brand new. Never fired. Comes with 3 mags all with pinky extensions.  One mag has a plus 2 extension.  Comes with all factory paper workand box. Factory sites. Looking to trade for Glock 26. Call or text REDACTED
503,http://www.armslist.com/posts/7395503,For Sale/Trade:  FS/FT Rare Para Ordnance P16-40 Stainless S&W 40 high cap,"Chicago, Chicago, Illinois",$ 650,"Listed On: Sunday, May 6, 2018",Handguns,Para Ordnance                                                                                ,40 S&W                                                                                ,Striker Fire                                                                                ,Pistol,"P16-40 in stainless steel. The version of the P16-40 includes everything shown, additional pictures upon request.Open to trades, let me know what you got"
504,http://www.armslist.com/posts/7395504,For Sale/Trade:  40s&w ammo 700+rounds,"Daytona Beach, Volusia County, Florida",$ 135,"Listed On: Monday, October 2, 2017",Ammo,Para Ordnance                                                                                ,40 S&W                                                                                ,Striker Fire                                                                                ,Pistol,For sale/trade is 40s&w ammo. I have 596 rounds of 180gr. fmj target ammo and 100 rounds of hollow point ammo along with 20 rounds of self defense ammo. Buy:$135 Trade:$160 I am located in Daytona Beach
505,http://www.armslist.com/posts/7395505,For Sale:  SMITH & WESSON INC MOD 42-1 W/2-INCH BARREL 5-SHOT SHROUDED HAMMER .38 Special,"North Carolina, North Carolina, United States",$ 400,"Listed On: Monday, October 2, 2017",Handguns,Smith & Wesson                                                                                ,38 S&W Special                                                                                ,Double Action                                                                                ,Revolver,THIS LITTLE SHROUDED HAMMER S&W LOOKS ALMOST NEW AND WORKS GREAT AS WELL. IT COMES IN THE FACTORY HARD CASE WITH FACTORY PAPER WORK.THIS GREAT LITTLE REVOLVER AND GOOD BUY
506,http://www.armslist.com/posts/7395506,For Sale:  Stag Arms Model 5 Ar-15 6.8spc,"Eau claire, Eau Claire, Wisconsin",$ 850,"Listed On: Monday, October 2, 2017",Rifles,Stag Arms                                                                                ,6.8mm SPCII                                                                                ,Semi-automatic                                                                                ,Rifle,"Stag Arms Model 5 6.8spc with 3x9-40 scope, hogue stock and grips, single point sling, 2-25rnd mags and a 10rnd mag. Only been shot about 100 times. Comes with 200rnd of ammo"
507,http://www.armslist.com/posts/7395507,For Sale:  Molot Vepr super in 308 win plus extras,"central, Lincoln, Nebraska",$ 840,"Listed On: Thursday, October 12, 2017",Rifles,Stag Arms                                                                                ,308/7.62 NATO                                                                                ,Semi-automatic                                                                                ,Rifle,"Rifle has about 20 rounds through it still in very good condition. Has a 21 inch threaded barrel with thread protector pinned to it. Comes with cleaning rod and kit, 1 factory 5 rd and 1 factory 10 rd magazine, 2 cspecs 10 rd magazines, 40 rounds perfecta 308 ammo and 40 winchester super x 308 power point ammo. Not looking for trades at this time Must have Nebraska ID along with handgun purchase permit or conceal carry permit and sign a bill of sale."
509,http://www.armslist.com/posts/7395509,For Sale/Trade:  Winchester SX3,"Greenville, Grand Rapids, Michigan",$ 900,"Listed On: Sunday, October 29, 2017",Shotguns,Winchester                                                                                ,12 Gauge                                                                                ,Semi-automatic                                                                                ,Shotgun,selling my bird gun. It was used last season and three times this year.  Holds 3 1/2
511,http://www.armslist.com/posts/7395511,For Sale:  Glock 30sf Gen3,"Scottsburg, Indiana, United States",$ 450,"Listed On: Monday, October 2, 2017",Handguns,Glock                                                                                ,45 ACP                                                                                ,Striker Fire                                                                                ,Pistol,"I have a very nice Gen 3 Glock 30sf Im looking sell. Its in great condition with new Talon Grips, 3 mags, blade tec holster, extended slide release, ghost 3lb connector and undercut trigger gaurd as well as factory box. $450 obo ftf in Scottsburg can txt REDACTED"
513,http://www.armslist.com/posts/7395513,For Sale:  975 Rounds Federal .22 LR,"Camdenton, MO, Missouri, United States",$ 39,"Listed On: Monday, October 2, 2017",Ammo,no type,no type,no type,no type,Up for sale is three (3) unopened 325 round boxes of Federal .22 long rifle 40 Grain cartridges. This .22 rimfire has been kept in my safe since purchased new earlier this year. Purchase price is $39.00 for 925 rounds and that is $.04 a round and less than any online vendor I could find. Another 3 boxes is available for extra dollars.NO TRADES and will not ship for this price.
514,http://www.armslist.com/posts/7395514,For Sale:  rail and covers,"Midwest city, Oklahoma City, Oklahoma",$ 65,"Listed On: Monday, November 27, 2017",Gun,no type,no type,no type,no type,"10 rubber utg covers $10
2 plastic rail covers $10
7"" steel quad rail $65
Muzzle brake $40"
515,http://www.armslist.com/posts/7395515,For Sale:  Brownells 300 Blk Barrel,"San Jacinto, Riverside, California",$ 125,"Listed On: Monday, October 2, 2017",Gun,no type,no type,no type,no type,"Brownells brand BTAC 300 Black Out barrel. 16 inch barrel with 1/8 twist, M4 feed ramps, and a standard 5/8 x 24 thread pitch. Installed and taken off after 50 rounds of brass cased ammo. The barrel is also dimpled for the used YHM gas block and spikes tactical gas tube thats included, also includeded is a Brownells A2 flash hider, crush washer, and Break Through clean sample oil $125 Shipped."
517,http://www.armslist.com/posts/7395517,For Sale:  1878 coach Gun,"Derby, Wichita, Kansas",$ 555,"Listed On: Monday, October 2, 2017",Shotguns,Maverick                                                                                ,12 Gauge                                                                                ,Break Open                                                                                ,Shotgun,"Cimmarron Arms Model 1878 Coach Gun.  This gun has never been fired.  I have the original paper work.  I have the original box and it is in perfect shape. I encourage going to the Cimmarron Arms website and read the reviews.  cimmarronarms.com.  The price includes 4 extra firing pins ($57.00) and shipping.  As per the Derby Post Office, the shipping cost is $30.00.  The manufacturer is not listed in this web sites drop down.  The shotgun is made by the Peoples Republic of China or PRC."
518,http://www.armslist.com/posts/7395518,For Sale:  Ruger American pro compact  9mm,"Roanoke, Roanoke, Virginia",$ 350,"Listed On: Thursday, October 19, 2017",Handguns,Ruger                                                                                ,9mm Luger (9x19)                                                                                ,Striker Fire                                                                                ,Pistol,"Like new ruger American pro compact 9mm. Great firearm about the same size as a Glock 19. Super ruggedly built with nice trigger and nice textile reset . I much prefer it to the m&p series which has a false reset and the Springfield xd series which has a mile long reset. Gun is fully ambidextrous without switching mag release from one side to other .Comes with case and backstraps , one short 12rd mag and one 17rd extended mag with sleeve, everything as new . Only reason I am selling it is to put money towards an ar15.  $350 firm. Must sign a bill of sale and be 21 and va resident. Prefer cwp holders"
519,http://www.armslist.com/posts/7395519,For Sale/Trade:  Sig Sauer p 226 X5 Mastershop German Import,"Mentor, Akron, Ohio","$ 2,500","Listed On: Monday, October 2, 2017",Handguns,Sig Sauer                                                                                ,9mm Luger (9x19)                                                                                ,Striker Fire                                                                                ,Pistol,I can/will do a partial tradeThis guns has about 200 rounds through it. I have everything it came with. It is a German Import. All Custom Mastership hand fitted adjustable trigger target sight magwell two magazines. Beautiful gun
520,http://www.armslist.com/posts/7395520,For Sale:  Marlin 39A Mountie,"South, Crown Point, Indiana",$ 850,"Listed On: Monday, October 2, 2017",Rifles,Marlin                                                                                ,22 Long Rifle                                                                                ,Lever Action                                                                                ,Rifle,nice looking and shooting gun made in 57 or 58 . This is for the gun only
521,http://www.armslist.com/posts/7395521,For Sale:  AR-15 surplus magazines,"Green Bay, Green Bay, Wisconsin",$ 5,"Listed On: Monday, October 2, 2017",Magazines,Marlin                                                                                ,22 Long Rifle                                                                                ,Lever Action                                                                                ,Rifle,"I have 15 suplus AR15/M4 military surplus 30 round magazines for sale. $5 each. Will not ship, cash only call/text REDACTED"
522,http://www.armslist.com/posts/7395522,For Sale/Trade:  Mossberg 500,"Westchase, Tampa/St. Pete, Florida",$ 0,"Listed On: Sunday, October 15, 2017",Shotguns,Mossberg                                                                                ,12 Gauge                                                                                ,Pump Action                                                                                ,Shotgun,Mossberg 500.  5+1 capacity.  ATI stock fold-over.  Side saddle on the side of the reciever and shell holder on the fold-over stock$300
523,http://www.armslist.com/posts/7395523,For Sale:  Ruger Mark III Lite Bronze Limited Edition,"Peabody, Massachusetts, United States",$ 499,"Listed On: Thursday, October 12, 2017",Handguns,Ruger                                                                                ,22 Long Rifle                                                                                ,Striker Fire                                                                                ,Pistol,Hard to find 22lr Ruger Mark 3 lite in Limited Edition Bronze. Comes with 2 mags and stock everything else. Runs great. $550
525,http://www.armslist.com/posts/7395525,For Sale:  .308 Sniper Rifle Rem 700,"El Dorado Hills, Sacramento, California","$ 3,100","Listed On: Monday, October 2, 2017",Rifles,Remington                                                                                ,308/7.62 NATO                                                                                ,Bolt Action                                                                                ,Rifle,"Fully Tricked .308 Rem.Sniper Rifle, Timney Trigger, Battle Comp Muzzle brake, 10 round magazine, Bell and Carlson stock, oversized bolt, knight force optics, 5.5x22-59 moar reticle, scope was 2,000 alone. Sighted in with Hornady RFD sniper ammunition. Good quality bipod. Each upgrade, cost estimate 150.00 each. Have ammunition for it, but packed in boxes for a move, Herters abt.10 boxes, 600 new win.unprimed brass, Sierra comp, bullets the accuracy load, Sierra hunting bullets, Barnes for Elk.Will sell ammo, separately, Barrell has 12 rnds thru bore, to sight in the Hornady ammunition, so new not broken in Yet!"
526,http://www.armslist.com/posts/7395526,For Sale/Trade:  2-7 scope,"Denver, Denver, Colorado",$ 100,"Listed On: Monday, October 2, 2017",Optics,Remington                                                                                ,308/7.62 NATO                                                                                ,Bolt Action                                                                                ,Rifle,This is a vintage weatherby varable 2-7 scope. It has some scraches in it and some ring marks. Still sealed up. Works great! Was on my grandfather's 3030. Open to offers. Look at my other listing's for other equipment.
527,http://www.armslist.com/posts/7395527,Want To Buy:  Shield 9mm NO SAFTEY,"Garrettsville, Cleveland, Ohio",Offer,"Listed On: Monday, October 2, 2017",Handguns,Smith & Wesson                                                                                ,9mm Luger (9x19)                                                                                ,Striker Fire                                                                                ,Pistol,Looking for a 9mm shirld with no saftey. Ccw holder.
528,http://www.armslist.com/posts/7395528,For Sale:  Bushmaster AR-15,"mason, Cincinnati, Ohio",$ 600,"Listed On: Saturday, October 14, 2017",Antique,Smith & Wesson                                                                                ,9mm Luger (9x19)                                                                                ,Striker Fire                                                                                ,Pistol,"Bushmaster AR-15 with three mags filled with ammo, a attached tatical ligt and a red dot sight.  Only 100 rounds thru it.  Comes with a nice case.  The red dot is a cheaper brand but it works great.  It also had rails on it and I still have the orginal front grips.  It also had pop up sights I put on since this model did not come with fixed sites.   The red dot is great for 40 yards are closer and the pop up sights are great for those farther out shots."
529,http://www.armslist.com/posts/7395529,For Sale/Trade:  *BNIB* SCCY CPX2 9MM Cash *$259*,"Oklahoma City, Oklahoma City, Oklahoma",$ 259,"Listed On: Monday, October 9, 2017",Handguns,SCCY                                                                                ,9mm Luger (9x19)                                                                                ,Double Action                                                                                ,Pistol,"TRADES AVAILABLE BNIBCash Price Only$259 Cash SCCY CPX-2 Compact 9MM, 3.1"" BarrelPolymer Frame, Black Finish10Rd, 3 Dot Sights, 2 Magazines"
533,http://www.armslist.com/posts/7395533,For Sale:  AR-15,"Nampa, Boise, Idaho",$ 600,"Listed On: Monday, October 2, 2017",Rifles,Anderson Manufacturing                                                                                ,223/5.56 NATO                                                                                ,no type,Rifle,Anderson AR pistol comes with 2 mags . 30 and 40rnd magsshoots 223/5.56600 obo ... REDACTED text
535,http://www.armslist.com/posts/7395535,For Sale/Trade:  Spanish Pistol,"Anderson, Greenville, South Carolina",$ 275,"Listed On: Wednesday, February 7, 2018",Handguns,Smith & Wesson                                                                                ,32 ACP                                                                                ,Double Action                                                                                ,Pistol,Spanish Pistol 32 cal autovery good condition $275
536,http://www.armslist.com/posts/7395536,For Sale/Trade:  Mp15 sport 2 with extras,"Nashville, Nashville, Tennessee",$ 900,"Listed On: Monday, October 2, 2017",Rifles,Smith & Wesson                                                                                ,223/5.56 NATO                                                                                ,Semi-automatic                                                                                ,Rifle,"M&P15 sport 2, about 500 rounds through with no issues or malfunctioning. Excellent rifle. Comes with mag pull and factory fore end, magpul vertical fore grip, 2 red dot sights, one is a closed optic other is holographic, 870 rounds, 40 steel mags, detachable carry handle, and a mounted strobe/light. 900 firm."
537,http://www.armslist.com/posts/7395537,For Sale:  Mossberg MVP LC .308 FDE! NEW,"Georgia, Georgia, United States",$ 940,"Listed On: Monday, October 2, 2017",Rifles,Mossberg                                                                                ,223/5.56 NATO                                                                                ,Semi-automatic                                                                                ,Rifle,"A NEW INBOX  Mossberg MVP LC .308 FDE! NEW,FOR SALE,THIS RIFLE IS GIFT FROM MY OLD FRIEND AM SELLING IT BECAUSE I NEED CASH IN THE HOUSES,SHIPPING WILL COST $30,EMAIL ME FOR ANY QUESTION."
543,http://www.armslist.com/posts/7395543,For Sale:  Ruger SR22 Exclusive Carolina Blue,"Enid, Northwest, OK, Oklahoma",$ 375,"Listed On: Monday, October 2, 2017",Handguns,Ruger                                                                                ,22 Long Rifle                                                                                ,Double / Single Action                                                                                ,Pistol,SOLD.  Won't deactivate for some reason.
544,http://www.armslist.com/posts/7395544,For Sale/Trade:  *BNIB* FN FNX 9mm Cash *$599*,"Oklahoma City, Oklahoma City, Oklahoma",$ 599,"Listed On: Monday, October 16, 2017",Handguns,FN Herstal S.A.                                                                                ,9mm Luger (9x19)                                                                                ,Double / Single Action                                                                                ,Pistol,"TRADES AVAILABLEBNIB Cash Price Only$599 CashFN America FNX-9 DA/SA, Semi-automatic Full Size Pistol, 9mm 4"" Barrel, Polymer FrameStainless Finish, Fixed 3-Dot SightsManual Safety, 17Rd, 3 Magazines"
545,http://www.armslist.com/posts/7395545,For Sale:  SMITH & WESSON INC MOD 42-1 W/2-INCH BARREL 5-SHOT SHROUDED HAMMER .38 Special,"North Carolina, North Carolina, United States",FREE,"Listed On: Monday, October 2, 2017",Handguns,Smith & Wesson                                                                                ,38 S&W Special                                                                                ,Double Action                                                                                ,Revolver,THIS LITTLE SHROUDED HAMMER S&W LOOKS ALMOST NEW AND WORKS GREAT AS WELL. IT COMES IN THE FACTORY HARD CASE WITH FACTORY PAPER WORK.THIS GREAT LITTLE REVOLVER AND GOOD BUY
546,http://www.armslist.com/posts/7395546,For Sale:  Sig 522 Commando - Like New! Hard to Find!,"Greer, Greenville, South Carolina",$ 495,"Listed On: Monday, October 2, 2017",Rifles,Sig Sauer                                                                                ,22 Long Rifle                                                                                ,Semi-automatic                                                                                ,Rifle,Looking to sell my like new (less than 100 rds througt it) Sig 522 commando. I have the original box and paperwork. Very fun plinker!
547,http://www.armslist.com/posts/7395547,For Sale:  Glock 26 Full Gray,"Overland Park, Kansas City, Kansas",$ 530,"Listed On: Monday, November 27, 2017",Handguns,Glock                                                                                ,9mm Luger (9x19)                                                                                ,Single Action                                                                                ,Pistol,"Lipsey's Exclusive! Glock 26 Gen 4 Full Gray.$530+tax  Model: G26 G4 Caliber: 9mm Type: Semi-Auto Pistol Action: Safe Action Barrel: 3.42"" Capacity: 10+1 Finish: Gray Cerakote Length: 6.29"" Safety: 3 Safeties Sights: Fixed StockFrameGrips: Polymer Frame / Gray Polymer Grips Magazine: 3 / 10 rd. Weight: 21.71 oz. RateOfTwist: 1-in-9.84"" ItemType: Firearm Feature1: Interchangeable Backstrap Feature2: Reversible Magazine Catch Feature3: Textured Grip"
549,http://www.armslist.com/posts/7395549,For Sale:  Strike Industries Rail USED,"San Jacinto, Riverside, California",$ 125,"Listed On: Monday, October 2, 2017",Gun,no type,no type,no type,no type,"Strike Indsutries Mega Fins 7 inch, free floated, keymod hand gaurd. It had been cerakoted burnt bronze. The rail is in great shape with no dings or bends. Included are 2 BCM keymod rail sections, all screws, and instilaion tools. $125 shipped."
550,http://www.armslist.com/posts/7395550,For Sale:  Remington R1 Commander 1911,"new port richey, Tampa/St. Pete, Florida",$ 550,"Listed On: Friday, December 8, 2017",Handguns,Remington                                                                                ,45 ACP                                                                                ,Single Action                                                                                ,Pistol,"Remington R1 Commander 1911 with cerakote matte black finish, comes with original case and manual. Great condition, works flawlessly 3 Wilson Combat 47D Magazinesskeleton hammerbobtail grip safety call/message REDACTED for faster reply550"
551,http://www.armslist.com/posts/7395551,For Sale/Trade:  Savage axis,"North, Knoxville, Tennessee",$ 500,"Listed On: Monday, October 23, 2017",Rifles,Savage Arms                                                                                ,45 ACP                                                                                ,Bolt Action                                                                                ,Rifle,Almost new savage axis 270 with aftermarket boyds stock would like to trade for 308 text REDACTED thanks
