,url,title,location,price,post date,category,manufacturer,caliber,action,firearm type,postcontent
1,http://www.armslist.com/posts/7462001,For Sale:  Glock 19 (upgraded),"Glendale, Phoenix, Arizona",$ 799,"Listed On: Thursday, October 26, 2017",Handguns,Glock                                                                                ,9mm Luger (9x19)                                                                                ,Single Action                                                                                ,Pistol,"Selling my glock 19,it has only about 300-400 rounds through it and has been cleaned and maintained religiously. I bought the gun for $650It has a good amount of upgrades. Including:-USA backplate ($35 value)-gold magazine release, breakdown release and pins ($75 value)-custom stippling job ($85 value)-very very nice aftermarket drop in trigger ($195 value) Total upgrade cost $395So im willing to let the gun go for $799 OBOIt comes with the case it came in and two magazine.i also have two 33rd magazines and a 60 round drum both 9mm obviously. As as well as 1000 rounds of 9mm.both these things I am will to let go at a very discounted price. Plz let me know if intrested.so you can get ahold of my via txt/callREDACTED"
2,http://www.armslist.com/posts/7462002,For Sale:  Hi-Point C9 with two mags,"Boerne, San Antonio, Texas",$ 175,"Listed On: Monday, October 23, 2017",Handguns,Hi Point                                                                                ,9mm Luger (9x19)                                                                                ,Double Action                                                                                ,Pistol,Hi-Point C9 with standard and extended magazines with case. Two Mags one eight round and one ten round. Gun has 50 round fired through it.
3,http://www.armslist.com/posts/7462003,For Sale:  Colt 1911 Commander Model Pistol .45 Auto,"Mesquite, Dallas, Texas",$ 999,"Listed On: Friday, November 3, 2017",Handguns,Colt                                                                                ,45 ACP                                                                                ,Double / Single Action                                                                                ,Pistol,"G-105003-1Colt 1911 Commander Model Pistol .45 Auto, One Magaine, Great Condition"
4,http://www.armslist.com/posts/7462004,For Sale:  Suarez g19 with rmr,"Clarksville, Clarksville, Tennessee",$ 900,"Listed On: Tuesday, October 17, 2017",Handguns,no type,no type,no type,no type,"Looking to sell or trade my g19 with a rm02 from trijicon.I finally picked up an rmr from armslist and its not really my cup of tea the g19 comes with a suarez 319 complete slide with trijicon supressor sights, RMR mounted, and a KKM PRECISION barrel. I have over 1300 invested in this as it sits. Here are my trade interests.G26 with extras and cashP320rx tacops straight trade 9MM320rx compact with a little cash 9MMGen 4 g19 with cashOr will sell outright for $900May consider other trades feel free to shoot me an offer"
6,http://www.armslist.com/posts/7462006,For Sale:  AMMO Armscor 22 TCM,"Columbus, Columbus, GA, Georgia",$ 80,"Listed On: Friday, November 10, 2017",Ammo,no type,no type,no type,no type,(NEW)  FACTORY MADE AMMO AND I no longer have the gun to use them.*Made by same people that make the guns - BUY ALL ONLY - 350 rounds only 100.00*High quality Armscor 22 TCM 9 (2500FPS) BRASS 350 RDS (Original 22TCM NOT the new  22tcm 9r)*PICK IT UP OR SHIPPING IS EXTRA IF YOU WANT IT*SHIPPED MUST PAY BY USPS MONEY ORDER - PICKUP WILL PAY BY CASH******** MESSAGE ME THROUGH ARMSLIST
7,http://www.armslist.com/posts/7462007,For Sale:  LadySmith 357 Model 60LS,"Minneapolis, Minneapolis / St. Paul, Minnesota",$ 510,"Listed On: Monday, October 23, 2017",Handguns,Smith & Wesson                                                                                ,357 Magnum                                                                                ,Single Action                                                                                ,Revolver,Lady Smith handgun revolver 357 Magnum Model LS wood grip. Great condition. Great for conceal and carry. Must see . OR BEST OFFER !!Minnesota366 at outlook dot com
8,http://www.armslist.com/posts/7462008,For Sale:  Core 15 HardCore X3,"Ocala, Ocala, Florida","$ 2,200","Listed On: Tuesday, October 17, 2017",Rifles,Core Rifle Systems                                                                                ,223/5.56 NATO                                                                                ,Semi-automatic                                                                                ,Rifle,"You're looking at a beautiful core 15 hardcore X3 with a 20th fluted barrel the rifle has only been shot a handful of times it in is in excellent condition the only reason I'm selling is to help pay for a surgery my wife is having.  I'm not intrested in any kind of trades serious inquiries only thank you for your time and interest. Here is a link to the exact rifle only mine has the no longer available and Core 20"" stainless fluted barrel as well as Troy battle sites. https://core15rifles.com/core15-hardcore-x1.html#/product/1032"
9,http://www.armslist.com/posts/7462009,For Sale:  New Tavor X95 with M21 sight,"Ham Lake, Minneapolis / St. Paul, Minnesota","$ 1,700","Listed On: Tuesday, October 17, 2017",Rifles,Israel Weapon Industries                                                                                ,5.56×45mm NATO                                                                                ,Semi-automatic                                                                                ,Rifle,"New, unfired Tavor X95 with mepro M21 optic for sale.priced to sell, price is firm!  No trades at all.Thanks!"
10,http://www.armslist.com/posts/7462010,For Sale/Trade:  Bushmaster ar15 carbin15,"Erie, Erie, Pennsylvania",$ 475,"Listed On: Sunday, October 22, 2017",Rifles,Bushmaster                                                                                ,223/5.56 NATO                                                                                ,Semi-automatic                                                                                ,Rifle,New in box bushmaster carbon 15. 475$ or best reasonable offer
12,http://www.armslist.com/posts/7462012,For Sale:  SMITH WESSON MP40 COMPACT +3 MAGS+KYDEX HOLSTER/$20 SHIP,"EASTON/LEHIGH VALLEY/ABE, Allentown, Pennsylvania",$ 350,"Listed On: Friday, November 3, 2017",Handguns,Smith & Wesson                                                                                ,40 S&W                                                                                ,Double Action                                                                                ,Pistol,"UP FOR SALE IS A SMITH & WESSON MP40 COMPACT 40 CALIBER SEMI AUTO PISTOL+ NIGHT SIGHTS+COMES WITH 3-10 ROUND MAGAZINES & KYDEX CUSTOM HOLSTERWHICH RETAILS FOR $80 USED BUT IN EXCELLANT CONDITION WITH LESS THAN 100 ROUNDS THRU ITSPECS:Action: Semi-Automatic, Striker Fired • Finish: Armornite® • Barrel Length: 3.5"" • Sights: 3 Dot Night Sights • Magazine(s): 1-10 Round Flush Base, 2-10 Round Finger Rest Base • Grips: Polymer-3 Interchangable Palm Swell Sizes • Weight: 24.9 oz. • Overall Length: 6.7"""
13,http://www.armslist.com/posts/7462013,For Sale:  Mosin M44 Carbine,"North Charlotte, Charlotte, North Carolina",$ 400,"Listed On: Tuesday, October 17, 2017",Rifles,Century International Arms                                                                                ,7.62x54R                                                                                ,Bolt Action                                                                                ,Rifle,"1945 Russian M44 Mosin with all matching ( barrel, bolt, buttplate, magazine well) serial numbers. Smooth Bolt, Shiny Bore, overall great condition. Call or text (336) 8four8 - 42four8."
18,http://www.armslist.com/posts/7462018,For Sale:  Lady Smith 357 Model 60LS adjusted for carry,"Minneapolis, Minneapolis / St. Paul, Minnesota",$ 510,"Listed On: Monday, October 23, 2017",Handguns,Smith & Wesson                                                                                ,357 Magnum                                                                                ,Double Action                                                                                ,Revolver,Great gun. Lady Smith revolver. Rubber grip. 357 Magnum Model 60LS. This revolver has been adjusted for conceal and carry such as purse carry or pocket carry. This gun can be removed from a purse or pocket quickly because it has been altered by a qualified gunsmith for conceal and carry quick draw. Must see . OR BEST OFFER !Minnesota366 at outlook dot com
19,http://www.armslist.com/posts/7462019,For Sale:  Beretta nano 9mm,"Wright city, St. Louis, Missouri",$ 325,"Listed On: Tuesday, October 17, 2017",Handguns,Beretta USA                                                                                ,no type,Striker Fire                                                                                ,Pistol,never fired.
20,http://www.armslist.com/posts/7462020,For Sale:  Remington 700,"Seffner, Tampa/St. Pete, Florida",$ 380,"Listed On: Saturday, December 9, 2017",Rifles,Remington                                                                                ,7mm Remington Magnum                                                                                ,Bolt Action                                                                                ,Rifle,camoscope
22,http://www.armslist.com/posts/7462022,For Sale:  Psa a-10 mlok in .308,"Walterboro, Charleston, South Carolina","$ 1,100","Listed On: Tuesday, October 17, 2017",Rifles,Palmetto State Armory                                                                                ,308/7.62 NATO                                                                                ,Semi-automatic                                                                                ,Rifle,"New, psa a-10 with stainless Barrel, mlok strikefire 2 red dot"
23,http://www.armslist.com/posts/7462023,Want To Buy:  ISO: Remington 12a,"Orange Park, Jacksonville, Florida",Offer,"Listed On: Tuesday, October 17, 2017",Rifles,Remington                                                                                ,22 Long Rifle                                                                                ,Pump Action                                                                                ,Rifle,"I'm looking for a reasonably priced, good condition Remington Model 12a or other pump style .22lr. I am interested in a local trade or sale. Right now I am not interested in dealing with shipping. Let me know if you have something like this for sale and the sale price. Thank you."
25,http://www.armslist.com/posts/7462025,For Sale:  35 REM,"Broadview Heights, Cleveland, Ohio",$ 100,"Listed On: Tuesday, October 17, 2017",Ammo,no type,no type,no type,no type,I have (3) 20rnds boxes of Federal 200gr HiShok bullet Ammo and (1) 20rnd box of Remengton 150gr PTD Soft Point and (3)rnds of Remington 200gr Soft Point.Call or Text REDACTED
26,http://www.armslist.com/posts/7462026,For Sale/Trade:  AR -10,"Lexington, Columbia, South Carolina",$ 750,"Listed On: Tuesday, October 17, 2017",Rifles,DPMS                                                                                ,308/7.62 NATO                                                                                ,Semi-automatic                                                                                ,Rifle,"Never fired, DPMS AR-10. Gun has M.O.E package and flip up rear sight. I bought it, and it went straight to the safe, and has been there ever since."
27,http://www.armslist.com/posts/7462027,For Sale/Trade:  S&W M&P Shield 40 Carry,"Columbus, Minneapolis / St. Paul, Minnesota",$ 350,"Listed On: Friday, November 24, 2017",Handguns,Smith & Wesson                                                                                ,40 S&W                                                                                ,Striker Fire                                                                                ,Pistol,"I would prefer to sell, but may trade my Carry pistol. This is the one with the external safety. If you want to buy the pistol I want 350 for it. Includes Original box, 3 magazines, IWB kydex holster and 70 rounds of self defense ammo. Perfect shape."
28,http://www.armslist.com/posts/7462028,For Sale:  10mm ammo. 250rds of 180gr fmj.  5 boxes of 50 for 250rds of remongton. 5 brand new boxes,"Newton, Des Moines, Iowa",$ 95,"Listed On: Monday, October 23, 2017",Ammo,no type,no type,no type,no type,Call or text REDACTED. Thanks
29,http://www.armslist.com/posts/7462029,For Sale:  Winchester Model 101 12 GA Over Under Shotgun G-103259-2,"Bellingham, Bellingham, Washington","$ 1,199","Listed On: Wednesday, February 21, 2018",Shotguns,Winchester                                                                                ,12 Gauge                                                                                ,Over and Under                                                                                ,Shotgun,"Winchester Model 101 ""Waterfowl"" 12 GA Winchoke Over Under Shotgun Chokes Included!   30"" Barrel   7 lb 12 oz   In good shape, some minor scuffs on stock from use, but nothing serious or into the wood ( See Pictures ). G-103259-2We are located at 3205 Northwest Ave. Bellingham Wa. 98225Hours of Operation:Mon-Sat 10am-7pmSunday  10am-4pmIf you have any questions or would like any additional pictures feel free to email us at CheckmatePawn @ Gmail . com or call us at REDACTED. Thanks!Checkmate Pawn Preferred Payment Methods:-CASH-Visa/MastercardTerms & Conditions:All Sales are FINAL.Checkmate Pawn does not hold items for extended time periods.Every item is also for sale in our store."
30,http://www.armslist.com/posts/7462030,For Sale:  Remington 770 .270 with case,"Calera, Birmingham, Alabama",$ 300,"Listed On: Tuesday, October 17, 2017",Rifles,Remington                                                                                ,270 Winchester                                                                                ,Bolt Action                                                                                ,Rifle,"Practically new Remington 770 with camo sling, factory scope, mag and a case with some ammo. $300. Shot a few times to site in scope two years ago. Safe kept.  Located in Calera can meet in Birmingham metro."
31,http://www.armslist.com/posts/7462031,For Sale:  Siaga 308cal,"Florissant, St. Louis, Missouri",$ 975,"Listed On: Tuesday, October 17, 2017",Rifles,Saiga                                                                                ,308/7.62 NATO                                                                                ,Semi-automatic                                                                                ,Rifle,Siaga semi auto 308 cal.aftermarket skeletonized stock quad fore grip.folding bipod. Detachable scope mount with scope.i have 1 five round mag 2 twenty-four round mags.sling. also have original stock and fore grip.less than 300 rounds through  it.   $975.00 text Dan at REDACTEDPics available.
32,http://www.armslist.com/posts/7462032,For Sale:  Glock 42,"Indianapolis, Indianapolis, Indiana",$ 375,"Listed On: Tuesday, October 17, 2017",Handguns,Glock                                                                                ,380 ACP                                                                                ,Striker Fire                                                                                ,Pistol,"Like new Glock 42 includes 3 loaded mags, talon grips, Bladetech IWB Holster,  OWB holster, case/paperwork. $375 FIRM. No trades. Must have carry permit. REDACTED"
33,http://www.armslist.com/posts/7462033,For Trade:  Savage model 93,"Woodbridge, Northern Virginia, Virginia",Offer,"Listed On: Tuesday, October 17, 2017",Rifles,Savage Arms                                                                                ,22 Long Rifle                                                                                ,Bolt Action                                                                                ,Rifle,i acquired this savage model 93 .22 rifle in a trade package and have no use for it. Looking to see what i can trade it for.
35,http://www.armslist.com/posts/7462035,"For Sale:  Thompson Center ""Black Diamond""","Ringgold, Dalton, Georgia",$ 150,"Listed On: Monday, November 6, 2017",Muzzle,Thompson Center                                                                                ,50 Black Powder                                                                                ,no type,Muzzle Loader,I'm selling a really nice muzzle loader. It was just sighted in this past weekend and hold a great group. I'm looking to try to get $150 obo. I also have a pack of the 209 primers and some bullets that I'll let go with it. May take trades let me know what you have. Any questions call or text REDACTED
38,http://www.armslist.com/posts/7462038,For Sale/Trade:  Surefire XC1 LED Handgun Weapon Light,"Downtown/Irmo, Columbia, South Carolina",$ 225,"Listed On: Tuesday, October 17, 2017",Gun,no type,no type,no type,no type,"Brand new in box Surefire XC1 weapon light.
$225 or best offer.
Will trade for ammo (ONLY 9mm, .45ACP, 5.56, or 22LR CCI Mini Mags).
Will trade for guns."
39,http://www.armslist.com/posts/7462039,For Sale:  Savage 93r17 SS Heavy Barrel,"Brunswick, Savannah, Georgia",$ 300,"Listed On: Tuesday, October 17, 2017",Rifles,Savage Arms                                                                                ,17 HMR                                                                                ,Bolt Action                                                                                ,Rifle,Savage model 93r17 SS Heavy Barrel w/Accutrigger. BSA 3-12x-40mm. DNZ rings. 300rds Hornady ammo. 1 5rd clip
40,http://www.armslist.com/posts/7462040,For Sale:  2000 rounds wolf gold .223/556 ammo brass case reloadable,"Midland, Michigan, United States",$ 550,"Listed On: Tuesday, December 5, 2017",Ammo,no type,no type,no type,no type,2000 rounds wolf gold ammo in .223 Remington / 556. great reloadable brass cases ammunition .  check out reviews and YouTube. You can't go wrong.
42,http://www.armslist.com/posts/7462042,For Sale:  Mossberg 500,"Westchase, Tampa/St. Pete, Florida",$ 175,"Listed On: Tuesday, October 17, 2017",Shotguns,Mossberg                                                                                ,12 Gauge                                                                                ,Pump Action                                                                                ,Shotgun,Mossberg 500.  Shoots fine except it isn't always extracting round from the tube for chambering.  I'm not a gun smith so figure I'd offer it up at a good price for someone that knows more about shotguns than me and wants to work on it.  It isn't a safe queen and has a few scratches and wear marks.  Otherwise it shoots just fin.
43,http://www.armslist.com/posts/7462043,For Sale:  Scar 17 factory lower,"east side, Colorado Springs, Colorado",$ 650,"Listed On: Tuesday, October 17, 2017",Gun,no type,no type,no type,no type,Complete factory lower receiver plus one stock mag. Scar 17. $650 or trade for AK47. Will not ship must meet in person.
45,http://www.armslist.com/posts/7462045,For Sale:  7.62x54 NonCorrosive Ammunition,"NW, Fresno, California",$ 100,"Listed On: Tuesday, October 17, 2017",Ammo,no type,no type,no type,no type,"440 round Russian sealed can of noncorrosive 7.62 x 54 ammunition. For Nagant, Tokarev, and other rifles."
46,http://www.armslist.com/posts/7462046,For Sale/Trade:  Kahr CM9,"North, Fort Wayne, Indiana",$ 275,"Listed On: Monday, October 23, 2017",Handguns,Kahr                                                                                ,9mm Luger (9x19)                                                                                ,Double Action                                                                                ,Pistol,Selling used lightly carried CM9. Comes with 1 6 round magazine with extended and original baseplate. Has Talon grips which can be easily removed.  No blemishes. FTF in Fort Wayne only.
47,http://www.armslist.com/posts/7462047,For Sale/Trade:  Eagle Arms AR-15 New in Box,"N. Charleston, Charleston, South Carolina",$ 475,"Listed On: Monday, October 23, 2017",Rifles,Armalite                                                                                ,223/5.56 NATO                                                                                ,Semi-automatic                                                                                ,Rifle,"Eagle Arms AR-15, two mags, optics ready.  AR-15 Semi Automatic Rifle  This rifle has never been fired, new in original box.accepts 5.56mm NATO and .223 Remington16"" Chrome-Moly Barrel1:8"" Twist rate30 Rounds A2 style pistol grip6 Position Collapsible MFT BMS Stock6"" Standard Hand Guard"
48,http://www.armslist.com/posts/7462048,For Sale/Trade:  Dan Wesson ECO .45 acp,"Lakeville, Minneapolis / St. Paul, Minnesota","$ 1,300","Listed On: Tuesday, October 17, 2017",Handguns,Dan Wesson                                                                                ,45 ACP                                                                                ,Single Action                                                                                ,Pistol,I have a mint Dan Wesson Eco in .45 acp with 4 mags and factory case and papers
49,http://www.armslist.com/posts/7462049,"For Sale:  M1A Scout Squad with extras, case","Fresno, Fresno, California","$ 1,400","Listed On: Tuesday, October 17, 2017",Rifles,Springfield                                                                                ,7.62x51mm NATO                                                                                ,Semi-automatic                                                                                ,Rifle,"Up for sale is my Springfield M1A in FDE. Comes with 1 mag, range bag, bipod mount, bipod, extended picatinny top rail, as well as the original rail. It is in fantastic shape and has only been shot twice with less than 200 rounds fired through it. If interested text me REDACTED. Price is 1400 firm."
51,http://www.armslist.com/posts/7462051,For Sale:  Judge Public Defender,"Indianapolis, Indianapolis, Indiana",$ 450,"Listed On: Tuesday, October 17, 2017",Handguns,Taurus                                                                                ,45 Long Colt                                                                                ,no type,Revolver,Taurus Judge Public Defender polymer excellent condition includes a nice De Santos leather holster Hornady Critical Defense 45LC (20) Winchester PDX 410 Defense ammo Hogue full size griporiginal grip and factory box/paperwork $450
52,http://www.armslist.com/posts/7462052,For Sale/Trade:  Sig P227 *night sights* and upgrades with 6 mags and 3 holsters - $925 OBO or AR15 trade,"Faribault, Minneapolis / St. Paul, Minnesota",$ 925,"Listed On: Tuesday, October 17, 2017",Handguns,Sig Sauer                                                                                ,45 ACP                                                                                ,no type,Pistol,LNIB Sig Sauer P227 .45 ACP ($1000 + tax) Siglight Night Sights Sig Short Reset trigger Hogue Grips ($125)6 Factory Magazines ($45 each)Leather DeSantis IWB Holster ($60)MDJ IWB holster ($45)Thigh holster ($30)Also will include 2 magazine holsters Stock Sig Sauer GripsOver $1450 spent on setup Gun has barely been fired less than 200 rounds Looking for $925 CASH Colt AR15 + some cash High End AR’sSig P320 + Cash all reasonable offers will be considered Please TEXT/CALL for immediate response REDACTED. Feel free to ask for more pictures
53,http://www.armslist.com/posts/7462053,For Sale:  Benelli SBE2 12 Gauge,"Florence, Florence, South Carolina","$ 1,300","Listed On: Tuesday, October 17, 2017",Shotguns,Benelli                                                                                ,12 Gauge                                                                                ,Semi-automatic                                                                                ,Shotgun,Benelli SBE2 in Bottomland for sale the gun is in great shape only selling to upgrade to the SBE3. Text REDACTED for more info
55,http://www.armslist.com/posts/7462055,For Sale:  FNX 9mm w Night Sights,"Brunswick, Savannah, Georgia",$ 580,"Listed On: Tuesday, October 17, 2017",Handguns,FN Herstal S.A.                                                                                ,9mm Luger (9x19)                                                                                ,Double / Single Action                                                                                ,Pistol,"FNX 9mm safe queen less than 100rds down range. Night sights, 3 mags, grips, docs and box"
