,url,title,location,price,post date,category,manufacturer,caliber,action,firearm type,postcontent
716,http://www.armslist.com/posts/7462716,For Sale:  S&W Shield. Pre-owned,"Kenosha, Kenosha, Wisconsin",$ 400,"Listed On: Thursday, January 11, 2018",Handguns,Smith & Wesson                                                                                ,9mm Luger (9x19)                                                                                ,Striker Fire                                                                                ,Pistol,"We have a Smith and Wesson shield in, gently used. The sights have been upgraded with ameriglo i dot night sights. Roughly a 100 dollar value. The gun comes with a 7 and a 8 round magazine. The Gun Shop LLC1452 Sheridan RoadKenosha WI 53140  REDACTED"
717,http://www.armslist.com/posts/7462717,For Sale:  Fully urgraded ar-15,"Las Vegas, Las Vegas, Nevada","$ 1,200","Listed On: Tuesday, October 17, 2017",Rifles,Bushmaster                                                                                ,223/5.56 NATO                                                                                ,Semi-automatic                                                                                ,Rifle,"Bushmaster Ar-15 with Fde Troy Pdw Stock, Fde Troy Alpha Rail With Flip-up Front Sight, Fde Troy rear Doa Flip-up sight, Troy Vertical grip, Troy Squid Grips, Troy Ambi Safety Selector, Troy Ambi Magazine release, Troy Extended Bolt Catch Release, Tanker Muzzle Brake, Magpul Fde K2+ pistol grip, Magpul Fde Trigger Gaurd, Magpul Gen3 Fde 30 round magazine with a Taran Tactical +5 round extension, and Ambi charging handle want to trade for a ak-47/74 plus cash on your end or a gun valued around 1400 or sell for $1200 obo but I'll hear all offers 702-5two3-1216"
719,http://www.armslist.com/posts/7462719,For Sale:  Diamond Kronik XT by Bowtech Compound Hunting Bow,"Albers, IL, St. Louis, Illinois",$ 300,"Listed On: Tuesday, October 17, 2017",Archery,no type,no type,no type,no type,"Diamond Kronik XT by Bowtech. The bow has been fired less than 20 times and comes ready to hunt. The bow comes with everything that is in the pictures which includes: arrows, 2 sets of mechanical broad heads, field tips, Quick Fletch fletching, full body harness and a soft case"
720,http://www.armslist.com/posts/7462720,For Sale:  Bushnell Trophy red dot 1x28mm,"Virginia Beach, Hampton Roads, Virginia",$ 60,"Listed On: Sunday, October 29, 2017",Optics,no type,no type,no type,no type,"Selling a Bushnell Trophy 1X28mm red dot sight. The red dot comes with orginal box sight mounts, caps, and everything needed to mount up to rifle."
721,http://www.armslist.com/posts/7462721,For Sale:  Beretta 92fs Inox,"Richmond, Detroit, Michigan",$ 630,"Listed On: Tuesday, October 17, 2017",Handguns,Beretta USA                                                                                ,9mm Luger (9x19)                                                                                ,Double / Single Action                                                                                ,Pistol,Hi. I haven't used but excellent condition Beretta 92fs Inox. Less than 500 rounds have been fired to it. I changed out the guide rod to put a steel guide rod in still have the original plastic guide rod period comes with two 15 round mags and case
722,http://www.armslist.com/posts/7462722,For Sale:  Weatherby Weathermark .257 mag,"Mid island, Hilton Head, South Carolina","$ 1,700","Listed On: Tuesday, October 17, 2017",Rifles,Weatherby                                                                                ,257 Weatherby Magnum                                                                                ,no type,Rifle,left hand load Absolute perfect condZeiss conquest scope
723,http://www.armslist.com/posts/7462723,For Sale:  Slidefirenstock,"Town, Martinsburg, West Virginia",$ 350,"Listed On: Tuesday, October 17, 2017",Gun,no type,no type,no type,no type,new in box for ar-15  slidefire but stock
725,http://www.armslist.com/posts/7462725,For Sale:  Ruger P95,"North Highlands, Sacramento, California",$ 375,"Listed On: Tuesday, October 17, 2017",Handguns,Ruger                                                                                ,9mm Luger (9x19)                                                                                ,Double / Single Action                                                                                ,Pistol,I have a Ruger P95 for sale. Barely used. Just sits in the safe so the deal gets passed onto you.   Very low round count. Maybe 200 rounds if that. Priced to sell at $375. Comes with original paperwork Ruger lock speed loader and two magazines. If interested contact Chuck at REDACTED.
726,http://www.armslist.com/posts/7462726,For Sale/Trade:  Colt AR,"Columbus, Columbus, Ohio","$ 1,300","Listed On: Tuesday, October 17, 2017",Rifles,Colt                                                                                ,223/5.56 NATO                                                                                ,Semi-automatic                                                                                ,Rifle,"Colt AR-15 stamped M4 Carbine. Cal 556 on the reciever. comes with Comp Aimpoint M2, MaTech BUIS, and Knights Armament rail system. Also Comes with 3 mags. Not interested in pistols. Will meet locally around columbus"
727,http://www.armslist.com/posts/7462727,For Sale:  90 Day Layaway Plan,"CHARLOTTE, Charlotte, North Carolina",$ 30,"Listed On: Tuesday, May 8, 2018",Services,no type,no type,no type,no type,"Hyatt Guns’ layaway plan is simple and easy and allows you to pay for your purchase over time. Log into our website at www.hyattgunstore.com, simply place your order online as you normally would, and select “Layaway” under the Payment Method. Items eligible for our layaway plan will have a blue button that says “Layaway Available for this Item.” Upon receipt of your 20% non-refundable deposit, we will take the item out of our inventory and activate your 90-day term. All layaways are subject to a $30 surcharge. During the layaway period, you can either make several payments, or just make one final payment at the end of 90 days, at which time we will ship your item or it can be picked up in our retail store. Special orders: You can do a layaway on special order guns. Your deposit will be processed and your layaway period starts when the gun comes in. Making payments is simple. Just login to our website, click the My Account tab, and click Layaway Orders. We regret that under no circumstances will your layaway be held longer than 90 days. If we haven’t received payment in full when your 90-day term expires, your layaway will be canceled and any and NO payments will be refunded. Items on a layaway cannot be changed once the deposit has been received. If a layaway is canceled prior to the 90-day term, no refund will be given."
728,http://www.armslist.com/posts/7462728,For Sale:  Berrata 21r,"Hamilton, Cincinnati, Ohio",$ 425,"Listed On: Tuesday, October 17, 2017",Handguns,Beretta USA                                                                                ,22 Long Rifle                                                                                ,no type,Pistol,Like new had one clip shot through it. In box all papers
730,http://www.armslist.com/posts/7462730,For Sale/Trade:  Remington 1911R1 Carry Commander,"Lake County, Chicago, Illinois",$ 900,"Listed On: Tuesday, October 17, 2017",Handguns,Remington                                                                                ,45 ACP                                                                                ,Single Action                                                                                ,Pistol,"Hello everyone looking to sell a Remington 1911R1 Carry Commander.  Comes with Crimson Trace Lader grips(red), has a tritium front sight, 2 mags, and a gunfighterinc IWB kydex holster."
731,http://www.armslist.com/posts/7462731,For Sale:  German Mod. 98 IDF Capture DOU 45 7.62 NATO,"Denver, Denver, Colorado",$ 775,"Listed On: Wednesday, February 21, 2018",Rifles,no type,7.62x51mm NATO                                                                                ,Bolt Action                                                                                ,Rifle,"Very Good Condition. 24"" Barrel. Excellent bore. Matching numbers on receiver and bolt. Reciever is marked 7.62, Mod. 98, dou 45. Has winter trigger guard. 7.62 is stamped into the stock on the underside towards the buttplate. Comes with leather sling. Import marked by Armscorp."
732,http://www.armslist.com/posts/7462732,For Sale/Trade:  Glock 22,"Shelbyville, Indianapolis, Indiana",$ 425,"Listed On: Tuesday, October 17, 2017",Handguns,Glock                                                                                ,40 S&W                                                                                ,Striker Fire                                                                                ,Pistol,REDACTED. Sell or trade
733,http://www.armslist.com/posts/7462733,For Sale:  Sig Sauer P938,"Dallas, Dallas, Texas",$ 600,"Listed On: Tuesday, October 17, 2017",Handguns,Sig Sauer                                                                                ,9mm Luger (9x19)                                                                                ,Single Action                                                                                ,Pistol,"Sig Sauer P938 9mm Pistol compact size comes in Purple color and black . Has 1 magazine , safety on left and right side. Single action . Has rubber grips"
734,http://www.armslist.com/posts/7462734,For Sale:  Winchester Model 94 30-30 (post 64),"Albuquerque, Albuquerque, New Mexico",$ 350,"Listed On: Tuesday, October 17, 2017",Rifles,Winchester                                                                                ,30-30 Winchester                                                                                ,Lever Action                                                                                ,Rifle,Includes: XS ghost ring sights and rail.Call or Text: REDACTED / *CASH ONLY - NO TRADES*
735,http://www.armslist.com/posts/7462735,For Sale/Trade:  Henry Big Boy,"Benson, North Carolina, United States",$ 0,"Listed On: Friday, November 17, 2017",Rifles,Henry Repeating Arms                                                                                ,357 Magnum                                                                                ,Lever Action                                                                                ,Rifle,"Beautiful rifle, LNIB, fired maybe a dozen times for function testing. This is a .357 mag big boy in steel. Wood is very nice, Has a leather wrap on Lever for rapid firing.No dings or scratches.I would like to trade this rifle for a Kimber Ultra carry II in 9mm or a CZ rami with decocker in 9mm. Cash on my or your end depending on trade. I have a CCW and all paper work on the up and up.I will look at other trades."
737,http://www.armslist.com/posts/7462737,For Sale:  Handgun,"Columbus, Ohio, United States",$ 600,"Listed On: Tuesday, October 17, 2017",Handguns,Ruger                                                                                ,9mm Luger (9x19)                                                                                ,Single Action                                                                                ,Pistol,Ruger handgun . 9mm.. sliver & Black
738,http://www.armslist.com/posts/7462738,For Sale/Trade:  Springfield XDs 9mm - unfired,"Lone Tree, Denver, Colorado",$ 400,"Listed On: Tuesday, October 17, 2017",Handguns,Springfield                                                                                ,9mm Luger (9x19)                                                                                ,Striker Fire                                                                                ,Pistol,"Unfired FDE Springfield XDs with 2 - 7 round mags, 3 - 8 round mags, 2 - 9 round mags, factory box, XD Gear holster (not in picture), and an XD Gear double mag carrier (not in picture).  Everything is as new/unfired except one of the seven round mags (the one with the pinky extension).  I purchsed this new a couple months ago, but I've since decided to go in another direction.$400 cash (firm on price), buyer to pay fees at a mutually agreed upon FFL.  On a trade, we each pay our own fees."
740,http://www.armslist.com/posts/7462740,For Sale/Trade:  Springfield xd 40 subcompact and a hr pardner12ga 18.5,"Oakland, Memphis, Tennessee",$ 600,"Listed On: Tuesday, October 17, 2017",Handguns,no type,no type,no type,no type,Xd 40 subcompact with houge grip box all xd gear and a hr pardner 12ga 18.5 home defense
741,http://www.armslist.com/posts/7462741,"For Sale:  Beretta USA 3032 Alleycat With Factory Night Sights, Box, Manuals!","Riverside, Inland Empire, California",$ 375,"Listed On: Tuesday, October 17, 2017",Handguns,Beretta USA                                                                                ,32 ACP                                                                                ,Double / Single Action                                                                                ,Pistol,"Hard to come across this one since they stopped making it.This is not a regular Tomcat, this one has the factory upgraded Tritium Night Sights which were an additional $115 above a regular 3032 Tomcat price.If you do not know what this gun is, do not even bother.Matte Black finish.The ultimate concealed carry weapon, coming with the original serial numbered box and paperwork.A .32acp was the standard police round for YEARS in Europe, and will KILL YOU just as well as a 9mm or a .45 ACP round...Pricd is firm, not looking for any offers.You pick up, you are responsible for the private party fee locally.First come first served, priced to sell.Last one pulled $475 on Gun Broker."
742,http://www.armslist.com/posts/7462742,For Sale:  Ruger p95,"McDonough, Atlanta, Georgia",$ 350,"Listed On: Tuesday, October 17, 2017",Handguns,Ruger                                                                                ,9mm Luger (9x19)                                                                                ,Single Action                                                                                ,Pistol,Selling a ruger p95 got a new firearm text me REDACTED
743,http://www.armslist.com/posts/7462743,For Sale:  Diamondback DB15,"Far east, El Paso, Texas",$ 800,"Listed On: Tuesday, October 17, 2017",Rifles,Diamondback Firearms                                                                                ,5.56×45mm NATO                                                                                ,Semi-automatic                                                                                ,Rifle,"Selling my rifle due to not shooting as much as I want. Comes with a $70 Aimsport red dot sight, $90 surefire muzzle brake, angled foregrip and several magazines. Chambered in5.56 and has not been fire very much."
744,http://www.armslist.com/posts/7462744,For Sale/Trade:  Vickers Glock 17,"Columbus, Indianapolis, Indiana",$ 650,"Listed On: Tuesday, October 17, 2017",Handguns,Glock                                                                                ,9mm Luger (9x19)                                                                                ,Striker Fire                                                                                ,Pistol,"I have only put 4 or 5 mags through this pistol. All of the Vickers parts are included, but have never been installed. Will come with box, papers, mags, and extras just as new. It is the Dark Earth model with a black slide. It is in perfect condition but needs to be with someone who will shoot it as it deserves. RTF2 Frame of course. I prefer to meet in or around Columbus. Texts preferred eight one two 560 zero seven three five"
745,http://www.armslist.com/posts/7462745,For Sale:  Smith & Wesson AR-15,"Winchester, Winchester, Virginia",$ 815,"Listed On: Tuesday, October 17, 2017",Rifles,Smith & Wesson                                                                                ,223/5.56 NATO                                                                                ,no type,Rifle,"Has custom scope, custom Magpul adjustable button stock, custom forearm grip, 4 magazines, 60 rounds of 556 ammunition, and carrying case with sling that holds 5 magazines. Great condition! Have only shot around 200 rounds of ammunition through it and would get the rifle clean after every shooting by a gunsmith. Contact TJ @ REDACTED, for further questions."
747,http://www.armslist.com/posts/7462747,For Sale:  BATTLEWORN FLAG GLOCK 19 #MURICA FREE MAGPUL MAG,"Greenville/Tarboro, Greenville, North Carolina",$ 589,"Listed On: Tuesday, October 17, 2017",Handguns,Glock                                                                                ,9mm Luger (9x19)                                                                                ,Double Action                                                                                ,Pistol,Brand new in box BATTLEWORN GLOCK 19 GEN 4. Comes with FREE Magpul Pmag AR/M4 30rd magazine.
749,http://www.armslist.com/posts/7462749,For Sale:  Winchester 62a,"Selma, San Antonio, Texas","$ 1,000","Listed On: Tuesday, October 17, 2017",Rifles,Winchester                                                                                ,22 Long Rifle                                                                                ,Pump Action                                                                                ,Rifle,very nice Winchester 62a nice wood great condition
752,http://www.armslist.com/posts/7462752,Want To Buy:  WTB FAL or FAL parts,"Downtown, Louisville, Kentucky",Offer,"Listed On: Tuesday, October 17, 2017",Rifles,no type,no type,no type,Rifle,Looking for FALs or FAL parts.
753,http://www.armslist.com/posts/7462753,For Trade:  Tisas 1911,"All, Tulsa, Oklahoma",Offer,"Listed On: Tuesday, October 17, 2017",Handguns,no type,45 ACP,no type,no type,Tisas 1911 in 45acp with ammo
754,http://www.armslist.com/posts/7462754,For Sale/Trade:  Special Edition OIF PSA Lower with Keymod upper and Vortex Spitfire Optics.,"Columbia, Columbia, South Carolina",$ 700,"Listed On: Tuesday, October 17, 2017",Rifles,Palmetto State Armory                                                                                ,223/5.56 NATO                                                                                ,Semi-automatic                                                                                ,Rifle,Moderetly used (less than 460 rounds)Features of the rifle- Nickle Boron BCG- Nitride Midlength Barrel with 1:7 twist- Free Float Keymod rail- Ergo grip- Vortex Spitfire. Price is 700 OBO
755,http://www.armslist.com/posts/7462755,For Sale:  PSE Thunderbolt and Bear,"Lewiston, Maine, United States",FREE,"Listed On: Tuesday, October 17, 2017",Archery,no type,no type,no type,no type,"I have a PSE Thunderbolt with quiver and some other things on itBear Archery oldschool bowOpen to trades or cash offers, really just looking to see whose interested for some bows this hunting season!"
756,http://www.armslist.com/posts/7462756,For Sale:  GP 100 w/Nill-Griffe Grips,"Cartersville, Atlanta, Georgia",$ 750,"Listed On: Tuesday, October 17, 2017",Handguns,Ruger                                                                                ,357 Magnum                                                                                ,Double / Single Action                                                                                ,Revolver,"Hey guys,Up for grabs is a Ruger GP100 with 4"" barrel. I purchased this gun new in 2014. Included is Nill-Griffe wooden grips imported from Germany, original Houge rubber grips, leather holster, box, and docs.I have put roughly 50 rounds through this revolver. Let me know if you have any questions. Not looking for any trades, unless its crazy in my favor. I need the cash for a non-firearm related project.Can meet face to face in close proximity to Cartersville, West Cobb, and Marietta areas. I will need to peek at drivers license to confirm age and residency. If shipping to a FFL I will need to run a credit card through my workplace plus 3% credit card fee and shipping cost."
758,http://www.armslist.com/posts/7462758,Want To Buy:  Henry .22 WMR. Looking to trade for.,"West, Pensacola, Florida",Offer,"Listed On: Tuesday, October 17, 2017",Rifles,Henry Repeating Arms                                                                                ,22 WMR                                                                                ,Lever Action                                                                                ,Rifle,"I am currently looking to trade for a Henry Lever action .22 WMR .22 magnum I have a few options to trade.May be interezted in other brands also, just let me know what you have. No pistols at this time.Sig Sauer P320, Sig Mosquito, Walther P22, Glock 42, I am not looking for a .22LR"
759,http://www.armslist.com/posts/7462759,For Sale:  M&P9 SHIELD PC PORTED EXC,"Grand Rapids, Grand Rapids, Michigan",$ 335,"Listed On: Saturday, October 28, 2017",Handguns,Smith & Wesson                                                                                ,9mm Luger (9x19)                                                                                ,Single Action                                                                                ,Pistol,"Excelent Condition M&P9 Shield From The Performance Center, 1-7 and 1-8 Round Mag, Fiber Optic Sights, Ported Slide and Barrel"
761,http://www.armslist.com/posts/7462761,For Sale:  Glock 26 4th gen,"Oak ridge, Knoxville, Tennessee",$ 600,"Listed On: Tuesday, October 17, 2017",Handguns,Glock                                                                                ,9mm Luger (9x19)                                                                                ,Striker Fire                                                                                ,Pistol,glock 26 4th gen for sale. Gun has glock night sights with a stream light / laser combo on (tlr6) Also has two magazine with magazine extension on them. Have original base plates and gun case. Gun is in like new condition with less than hundred rounds put through it. Also have an left and right inside the waist band holsters. I am not willing to trade or take less than the asking price. Please call 865 six nine six 4820. Thanks.
762,http://www.armslist.com/posts/7462762,For Sale:  80 Rounds .22lr Long Rifle,"Deltona, Orlando, Florida",$ 30,"Listed On: Tuesday, October 17, 2017",Ammo,no type,no type,no type,no type,"80 Rounds of .22lr Interceptor and Super High Velocity from Aguila.Stored correctly, runs great through my marlin.30$ Firm. Local pick up.call or text REDACTED"
764,http://www.armslist.com/posts/7462764,For Sale:  Mossberg 590A1 12 ga,"Anaconda, Helena, Montana",$ 450,"Listed On: Tuesday, October 17, 2017",Shotguns,Mossberg                                                                                ,12 Gauge                                                                                ,Pump Action                                                                                ,Shotgun,"Awesome shotgun with very few rounds through it - less than 50. It is 8+1 capacity and has ghost ring sights. Only modification is a slightly shorter stock as it shoulders faster than the hunting stock it came with. Also including 250 rounds of 2.75"" bird shot$450 FIRM"
765,http://www.armslist.com/posts/7462765,For Sale:  Complete aero precision rifle with upgrades,"Prp, Louisville, Kentucky",$ 780,"Listed On: Tuesday, October 17, 2017",Rifles,no type,no type,no type,Rifle,I have a complete aero precision rifle that's been sitting in my safe gathering dust. Lot of upgrades on it asking 780 or best offer text REDACTED for more details and info
766,http://www.armslist.com/posts/7462766,For Sale:  Wiley Clapp Colt Commander,"West of Lincoln, Nebraska, United States",$ 800,"Listed On: Tuesday, October 17, 2017",Handguns,Colt                                                                                ,45 ACP                                                                                ,Single Action                                                                                ,Pistol,"For Sale Wiley Clapp .45acp Colt Commander. Has a  ambi safety added since picture taken but is otherwise untouched, as Mr. Clapp intended. Approximately 150rnds through it so not even broke in yet. And has sat in the safe since so may as well go to a good home where it will get played with more often.Comes with original box, paperwork etc. And 3 7rnd Colt magazines800.00 FirmCCW/Purchase Permit Required."
767,http://www.armslist.com/posts/7462767,For Sale:  WWII samurai sword,"South, Lincoln, Nebraska",FREE,"Listed On: Tuesday, October 17, 2017",Handguns,no type,no type,no type,no type,i have an authentic WWII officer samurai gunto sword in great shape and super sharp looking to trade for high end firearms or sell text me at REDACTED
