,url,title,location,price,post date,category,manufacturer,caliber,action,firearm type,postcontent
278,http://www.armslist.com/posts/7395278,For Sale/Trade:  Sig Sauer 1911 Extreme,"PDX, Portland, Oregon",$ 700,"Listed On: Thursday, October 12, 2017",Handguns,Sig Sauer                                                                                ,45 ACP                                                                                ,Single Action                                                                                ,Pistol,"Testing the waters here with my Sig Sauer 1911 Extreme. Bought this last February and it's been an amazing pistol, no malfunctions straight from the box as you would expect from Sig. Only reason for selling is because another gun has caught my eye and I need to sell something to recoup some funds, you know how it goes.Less than 500 rounds through it, never been holstered, cleaned after every outing, just a range queen.Comes with two mags, Sig case, and all the papers and stuff. Asking $700, you pay transfer. Please contact me via PM or text me at REDACTED.Would be interested in trades, really looking for a HK USP45 or FNX45T"
279,http://www.armslist.com/posts/7395279,For Sale:  Springfield XDs 4.0 9mm,"Brownsburg, Indianapolis, Indiana",$ 400,"Listed On: Sunday, October 8, 2017",Handguns,Springfield                                                                                ,9mm Luger (9x19)                                                                                ,Striker Fire                                                                                ,Pistol,"Lightly used Springfield XDs 4.0 in 9mm. Comes with two 7 round magazines. One has the extended pinkie grip. Crossbreed OWB holster with combat cut comes with it. You can't get a tighter to the body OWB holster anywhere. Original case, lock, and cheap paddle holster and magazine holder also included."
280,http://www.armslist.com/posts/7395280,For Sale:  Ar15 300 blackout,"Chesapeake, Hampton Roads, Virginia",$ 750,"Listed On: Tuesday, October 10, 2017",Rifles,Del-ton Inc                                                                                ,300 Blackout (7.62x35mm)                                                                                ,Semi-automatic                                                                                ,Rifle,I have a delton ar15 300 blackout with a custom lower and a 3x scope with 250rds of ammo and a soft gun case $750.00  cash
281,http://www.armslist.com/posts/7395281,"For Sale:  CZ 1911 A1 .45 LESS THAN 1,000 PRODUCED","Edmond, Oklahoma City, Oklahoma",$ 775,"Listed On: Tuesday, October 17, 2017",Handguns,CZ USA                                                                                ,45 ACP                                                                                ,Single Action                                                                                ,Pistol,CZ 1911A1. 45 auto. The pistol has been shot but very few times and is in like new condition. This G.I. style pistol is built like a tank and very accurate! One of the hardest pistols to find on the market today. CZ produced 999 of these pistols before halting production. Some say that the reason for halting production was the start up of the CZ Dan Wesson 1911. This pistol has super tight tolerance and a nice trigger. I found 2 for sale: 1 on gun broker for  $1400 and one with wear for $850 on Armslist in another state. I'm wanting  $775. Please call or text Jimmy @REDACTED.
282,http://www.armslist.com/posts/7395282,For Sale:  Ar 15 pistol w/change upper,"Ft.Worth, Dallas, Texas","$ 1,800","Listed On: Thursday, November 23, 2017",Handguns,CZ USA                                                                                ,45 ACP                                                                                ,Single Action                                                                                ,Pistol,"I have an ar15 pistol with several upgrades. its' a spikes lower currently with a 300 black out upper,  i have another upper identical in 223/556 also.  comes with the drum, burris fast fire and also burris 3x, sold as a package, im not splitting up,  price is firm, and NO TRADES...  I'll try and remember what I upgraded it with, but I believe it has a match grade trigger, fail zero BCG, and ""brace"" not a stock..  I will get more info on it when i get a chance.."
283,http://www.armslist.com/posts/7395283,For Sale:  Kimber Micro 380 - .380 ACP Semi-Auto Pistol,"Canton, Ohio, United States",$ 450,"Listed On: Monday, October 2, 2017",Handguns,Kimber                                                                                ,380 ACP                                                                                ,Double / Single Action                                                                                ,Pistol,"*Excellent condition, little to no wear on the slide, frame or grips, very slight amount of wear on the barrel from what appears to be very scarce use. *Includes oem box w/ paperwork*Includes soft zip case*Includes two magazines#G-1013278-1"
284,http://www.armslist.com/posts/7395284,For Sale:  Glock 19,"Byron, Macon, Georgia",$ 550,"Listed On: Saturday, October 7, 2017",Handguns,Glock                                                                                ,9mm Luger (9x19),Double / Single Action                                                                                ,Pistol,Never fired perfect condition. Upgraded trigger and trigger pull.Agency arms barrel. I will throw in factory parts. Text REDACTEDThe gun alone is worth 550. The barrel was 200 and the trigger was 175. 550 total.
285,http://www.armslist.com/posts/7395285,For Sale/Trade:  1953 Romainian Tokarev TTC 7.62x25,"FORT THOMAS, Northern Kentucky, Kentucky",$ 400,"Listed On: Monday, October 2, 2017",Handguns,Century International Arms                                                                                ,7.62x25 Tokarev                                                                                ,Single Action                                                                                ,Pistol,"I purchased this handgun as my first one for my 21 birthday. The gun fires well and i had used it as a carry for that time as well. Im looking more for a trade. I want another handgun preferably a revolved or other full-size hand gun will even boot for the right gun. This gun is a matching numbers weapon. I have an original magazine and 2 replacement mags as well. I have a nylon holster for the magazines. It comes with 299 rds of fmj from sellier & bellot and i have 38rds of JHP from PPU. To buy im asking 400 to take it all. Again thats a holster, over 300rds, 3 magazines, and the handgun."
286,http://www.armslist.com/posts/7395286,For Sale/Trade:  Sb47 stabilizing brace,"Prp, Louisville, Kentucky",$ 35,"Listed On: Tuesday, October 24, 2017",Gun,Century International Arms                                                                                ,7.62x25 Tokarev                                                                                ,Single Action                                                                                ,Pistol,like new sb47 brace for any pistol with buffer tubeak adapter and buffer tube not included
287,http://www.armslist.com/posts/7395287,For Sale:  Glock 21 Gen4 LNIB,"Morrisville NC, Raleigh / Durham / CH, North Carolina",$ 580,"Listed On: Monday, October 2, 2017",Handguns,Glock                                                                                ,45 ACP                                                                                ,Striker Fire                                                                                ,Pistol,I am selling my Glock 21 Gen4 in perfect condition.  It is the Grey frame model. It comes with all the stuff it originally came with plus Talon grips. It was fired around 100 rounds. It has the Zev Ultimate trigger kit installed and will come with the original as well. I am asking for $580 or will sell it without the Zev upgrade for $480. Must have NC CCP or valid original permit which I will keep as well as a valid NC Drivers license. No exceptions. I will not travel more than 20 miles from Morrisville for a deal.Please email if interested or text at 919-457-two 7 zero 5Thanks.
288,http://www.armslist.com/posts/7395288,For Sale:  CZ Shadow 2,"Friendswood, Houston, Texas","$ 1,125","Listed On: Monday, October 2, 2017",Handguns,CZ USA                                                                                ,9mm Luger (9x19)                                                                                ,Double / Single Action                                                                                ,Pistol,"Product Name  Shadow 2 Black   SKU  91254   MSRP  $1,299.00   Chambering  9mm Luger   Magazine Capacity  17+1   Frame  Steel   Trigger Mech  SA/DA   Sights  Fiber Optic front, HAJO rear   Barrel  Cold Hammer Forged   Barrel Length  4.89 in   Weight  46.5 oz   Overall Length  8.53 in   Safety  Ambidextrous Manual Safety     Shipping @ $25 and TX sales tax if applicable are buyers responsibility. 3% for Credit Card purchases.     When Price, Quality, and Customer Service matter……. Gulf Coast Arms! Gulf Coast Arms 2111 W. Parkwood Ave #201 Friendswood, TX 77546"
291,http://www.armslist.com/posts/7395291,For Sale:  Game reaper scope mount,"Missoula, Missoula, Montana",$ 55,"Listed On: Monday, October 2, 2017",Optics,no type,no type,no type,no type,"Brand spanking new. Best scope mount money can buy. One pine, no moving parts. Fits Winchester Model 70 , Long Action, medium, 1""scope"
292,http://www.armslist.com/posts/7395292,For Sale:  Brand New Gamo - Crossman Air Rifles,"Sumner, Tacoma, Washington",$ 79,"Listed On: Tuesday, October 10, 2017",Air,no type,no type,no type,no type,I have for sale a couple of brand new in box air rifles shown in the photo:Crossman Phantom Hunter .177 caliber with 4x32 scope........$79Gamo Bone Collector.177 caliber with 4x32 scope..................$99
293,http://www.armslist.com/posts/7395293,For Sale:  E29R-9-CBT,"Jasper, Birmingham, Alabama",$ 750,"Listed On: Monday, October 2, 2017",Handguns,Sig Sauer                                                                                ,9mm Luger (9x19)                                                                                ,Double Action                                                                                ,Pistol,Sig Sauer P229R combat in great condition. Only 5 rounds Have been fired with it.
294,http://www.armslist.com/posts/7395294,Want To Buy:  anschutz exe mplar 22 cal,"mogadore, Akron, Ohio",$ 500,"Listed On: Monday, October 2, 2017",Handguns,Sig Sauer                                                                                ,22 Long Rifle                                                                                ,Bolt Action                                                                                ,Revolver,"im looking for a anschutz exemplar 22 cal bolt action pistol,bolt should be on left hand side for a right handed shooter, either email or call REDACTED thanks and have a blessed day"
295,http://www.armslist.com/posts/7395295,For Sale:  AMP-69,"justice, North Carolina, United States","$ 1,500","Listed On: Monday, October 2, 2017",Rifles,FN Herstal S.A.                                                                                ,7.62x39                                                                                ,Semi-automatic                                                                                ,Rifle,For sale   AMP-69   semi-auto   7.62x39     takes AK mags  wire folding stock     this rifle is similiar to the  AMD-65    this is the civilian version    the manufacturer is   F.E.G.     if you don't know what they look like   then do your research   $1500   firm    and no trades   if you want to see it get off your lazy ass     and no endless emails.
296,http://www.armslist.com/posts/7395296,For Sale:  Beretta 1301,"Bridgeton, St. Louis, Missouri",$ 800,"Listed On: Tuesday, May 8, 2018",Shotguns,Beretta USA                                                                                ,12 Gauge                                                                                ,Semi-automatic                                                                                ,Shotgun,Semi auto 12 gauge shotgun $800.00 For $1000 comes with vortex red dot.
297,http://www.armslist.com/posts/7395297,"For Sale/Trade:  6.5 Grendel AR 18""","Daytona Beach, Volusia County, Florida",$ 800,"Listed On: Monday, October 2, 2017",Rifles,Beretta USA                                                                                ,6.5mm Grendel                                                                                ,Semi-automatic                                                                                ,Rifle,"For sale trade is my 6.5 grendel AR. It has a Bear Creek Arenal 18 inch mid legth 416r stainless steel 1/8 twist fluted barrel, a 15"" free floating keymed rail, PSA premium bolt carrier with an Odis bolt(type 2), has an extended handle on the milspec charging handle. The lower is ""The Jack"" from Spikes Tactical. It has a milspec lpk installed and the Fab Defense GLR-16 adjustable stock. It comes with 5 25rd and 1 5rd AR Stoner magazines specifically for 6.5 Grendel. Optic not included. I also have 960 rounds of 100gr Wolf steel  ammo.  Gun w/ammo $950 Gun only $800. Upper w/ammo $500. My prices are firm any offer that is lower will be ignored. I will not sell just the ammo or lower until the upper is sold. I am located in Daytona Beach and am willing to travel."
298,http://www.armslist.com/posts/7395298,For Trade:  Ruger,"Haskell, Tulsa, Oklahoma",Offer,"Listed On: Monday, October 2, 2017",Handguns,Ruger                                                                                ,44 Magnum                                                                                ,Single Action                                                                                ,Revolver,"Ruger Vaquero 44 Macnum, 7.5"" Barrel, Blue Finish. Solid."
299,http://www.armslist.com/posts/7395299,For Sale/Trade:  rock island 200 38sp with everything,"Eaton, Dayton, Ohio",$ 290,"Listed On: Thursday, October 12, 2017",Handguns,Rock Island Armory                                                                                ,38 S&W Special                                                                                ,Double / Single Action                                                                                ,Revolver,"I've got a rock island 200 38sp with extra grips two speed reloader and double speed reloader pouch one leather holster,one nylon holster,and leg drop holster  ,and comes with ammo  asking. 290 obo text me at REDACTED"
300,http://www.armslist.com/posts/7395300,For Sale:  Marlin 60 SSK .22 LR Semi Auto Stanless Synthetic ** Layaway Available **,"Miami, Miami-Dade, South Florida",$ 145,"Listed On: Monday, January 1, 2018",Rifles,Marlin                                                                                ,22 Long Rifle                                                                                ,Semi-automatic                                                                                ,Rifle,"Marlin 60 SSK .22 LR Semi Auto Stanless Synthetic ** Layaway Available **Overall Condition: Used ( This Rifle comes without Original Box and Paperwork )Stock Number: G-1005062-1Shipping Cost: $25.00Price: $145.00Manufacturer: MarlinModel: 60SSKAction: Semi AutoBarrel: 18""Capacity: 14+1"
301,http://www.armslist.com/posts/7395301,For Sale:  AR pistol,"Sapulpa, Tulsa, Oklahoma",$ 750,"Listed On: Monday, October 2, 2017",Rifles,Marlin                                                                                ,223/5.56 NATO                                                                                ,Semi-automatic                                                                                ,Rifle,"2.23 / 5.56 AR PistolDPMS lower receiver, BCM Gunfighter grip, ambidextrous charging handle, Sig SBX-15 Stabilizing brace, BCM bolt carrier group, 10.5"" stainless steel .223 Wylde barrel, M LOK handguard."
303,http://www.armslist.com/posts/7395303,For Sale/Trade:  ruger sr40c,"livingston, Bozeman, Montana",$ 400,"Listed On: Monday, October 2, 2017",Handguns,Ruger                                                                                ,40 S&W                                                                                ,Striker Fire                                                                                ,Pistol,"3.5 inch bbl,two mags 1 9 rd,1 15 rd,box two holsters,ftf no shipping locals only"
304,http://www.armslist.com/posts/7395304,For Sale:  GLOCK 17L NIB Longslide 9mm,"Colerain, Cincinnati, Ohio",$ 550,"Listed On: Monday, October 2, 2017",Handguns,Glock                                                                                ,9mm Luger (9x19)                                                                                ,Striker Fire                                                                                ,Pistol,NIB Gen3 glock 17L. 6.3 in bbl adjustable target sights extended controls and 4.5pd factory competition 550
305,http://www.armslist.com/posts/7395305,For Sale:  Deer Rifle,"Bridgeton, St. Louis, Missouri",$ 650,"Listed On: Tuesday, May 8, 2018",Rifles,Thompson Center                                                                                ,308/7.62 NATO                                                                                ,Bolt Action                                                                                ,Rifle,Limited edition Thompson center Pro hunter chambered in 308. 3 shot 1 moa guaranteed from the factory. Hunted with this rifle for a few years and has some scratches on it. Has a built in recoil reducing stock. 3x9x40 Thompson center scope. Sighted in and ready to go
308,http://www.armslist.com/posts/7395308,For Sale:  CMMG 9mm AR Carbine in FDE,"West, Cleveland, Ohio",$ 900,"Listed On: Sunday, November 5, 2017",Rifles,CMMG                                                                                ,9mm Luger (9x19)                                                                                ,Semi-automatic                                                                                ,Rifle,"CMMG makes some of the best 9mm AR carbines. It's a tack driver & has been 100% reliable with a variety of range ammo.  It uses Colt style mags which are cheap and available. Selling to fund another purchase. FDE CMMG MK9 Lower w/M4 Butt Stock $369.95FDE CMMG MK9LE Upper Group w/WASP NATO 1/10 Barrel $749.95Comes with extra mags, FDE carry handle, sling, furnitre, quadrail, etc...Not really looking for trades, but may take a VP9SK or Glock 26 + cash.I'm not interested in boats, goats, or your sister."
309,http://www.armslist.com/posts/7395309,For Sale:  STI ar15 223/556,"Ft.Worth, Dallas, Texas","$ 1,500","Listed On: Thursday, November 23, 2017",Rifles,CMMG                                                                                ,223/5.56 NATO                                                                                ,Semi-automatic                                                                                ,Rifle,"This is an sti built and set up for 3 gun ar15.  16"" barrel with a few upgrades..... I'll get specifics in the next day or so....  Price is firm, NO trades!...."
310,http://www.armslist.com/posts/7395310,For Sale:  Glock 19 gen2,"Fwb, Okaloosa County, Florida",$ 450,"Listed On: Monday, October 2, 2017",Handguns,CMMG                                                                                ,223/5.56 NATO                                                                                ,Semi-automatic                                                                                ,Rifle,"with factory toperware box and 2 mags, night sights. 450.00"
311,http://www.armslist.com/posts/7395311,For Sale:  S&W M&P Shield PARTS,"Alabaster, Birmingham, Alabama",$ 50,"Listed On: Monday, October 2, 2017",Gun,CMMG                                                                                ,223/5.56 NATO                                                                                ,Semi-automatic                                                                                ,Rifle,"Selling off OEM Smith & Wesson Shield 9/40 parts. All in perfect condition ready to use. Includes:-factory recoil spring-factory trigger-factory trigger spring kit (sear, springs, striker block, etc)-7 total M&P magazine base plates-4 spring followers-4 extended mag inserts (2 are stippled)-4 brand new pinky extensions-factory front and rear sights-pierce frame plug (not pictured)"
312,http://www.armslist.com/posts/7395312,For Sale:  S&W SD9VE 9mm,"Hermitage, Nashville, Tennessee",$ 300,"Listed On: Monday, October 2, 2017",Handguns,Smith & Wesson                                                                                ,9mm Luger (9x19)                                                                                ,Semi-automatic                                                                                ,Pistol,"I have a basically brand new 9mm Smith and Wesson shot maybe 25-50 times. Comes with 2 16 round clips, lock and original case I bought it in. Asking 300 obo."
313,http://www.armslist.com/posts/7395313,For Sale:  Savage 10 Trophy hunter,"Beaufort, Hilton Head, South Carolina",$ 525,"Listed On: Monday, October 2, 2017",Rifles,Savage Arms                                                                                ,308/7.62 NATO                                                                                ,Bolt Action                                                                                ,Rifle,"In very good condition. Has had 2 boxes of ammo shot through it. Held good groups. Only reason im selling is because I have to replace the rear differential on my truck, and don't have the extra money right now.The picture of the buttstock shows one small scratch in the wood, that's the only marking on the gun.good rifle at a good price. I bought it in August."
314,http://www.armslist.com/posts/7395314,For Sale:  Springfield XDs with extras!,"Leavenworth, Kansas City, Kansas",$ 500,"Listed On: Monday, October 2, 2017",Handguns,Springfield                                                                                ,9mm Luger (9x19)                                                                                ,Bolt Action                                                                                ,Pistol,Very nice gun. It has the talon grips along with wording on the side painted white.Maybe 300 rounds through it! Only reason for selling is I want to switch to another gun. It comes with 6 mags and the hard case along with a right holster and a Blackhawk left holster. I also have the XD holster and mag pouch that will come along with it. Asking $500 for it all! Or will do a trade for a M&P shield 9mm with some cash on your end! Thanks for looking !for more pics or info please text or call REDACTED!MUST BE A KANSAS RESIDENT!!! Will NOT sell gun to anybody outside the state of Kansas
316,http://www.armslist.com/posts/7395316,For Sale:  AR15,"North, Springfield, Missouri",$ 600,"Listed On: Monday, October 2, 2017",Rifles,Palmetto State Armory                                                                                ,223/5.56 NATO                                                                                ,Semi-automatic                                                                                ,Rifle,"PSA upper, Anderson lower, CMMG parts kit, PSA bolt/carrier, 7075 milspec buffer tube, rails on the handguard. About 200 rounds through it. Never an issue.  Just looking to build something different.  I will include a mag."
317,http://www.armslist.com/posts/7395317,For Sale:  Ruger 10/22 and a lifetime supply of 22lr,"Hope Mills, Fayetteville, North Carolina",$ 850,"Listed On: Monday, October 2, 2017",Rifles,Ruger                                                                                ,22 Long Rifle                                                                                ,Semi-automatic                                                                                ,Rifle,"About 40rds down the rifle with a skeletonized charging handle/magazine release, custom trigger job for 4.5lb pull. Approximatel;y 8900 rounds of 22lr with some being supersonic. Magazines: (2) Ruger BX 25 double mags, (3) Ruger BX 25 mags, (1) Remington 10 rd mag, HC3R (6) clips. Ammo: 700rds federal value [packs, 6300 federal champion, 250 CCI - 40gr, 350 loose, 50 federal lightning, 50 whinchester, 80 CCI CB, and a ton in the HC3R magazine kitAccessories: comes with numerous parts, including an attachment that turns the Ruger into a gatling gun! Super awesome, gets expensive quick. This is a sweet deal, and with what just happened we all know something is coming down the pipe about firearms."
