,url,title,location,price,post date,category,manufacturer,caliber,action,firearm type,postcontent
735,http://www.armslist.com/posts/7597735,For Sale:  CZ 2075 Rami BD,"Maineville, Cincinnati, Ohio",$ 625,"Listed On: Saturday, December 23, 2017",Handguns,CZ USA                                                                                ,9mm Luger (9x19)                                                                                ,Double / Single Action                                                                                ,Pistol,I have a like new CZ 2075 Rami BD in 9mm for sale. This is the decocker with night sights version. I purchased this gun new in March 2017 and have put roughly 100 rounds through it. I bought it with the intention of using it as my EDC but found I prefer my single stack due to comfort. I love the way the gun feels in hand and it shoots great but it will just sit in the safe. I'm not interested in any trades. You must be an Ohio resident leagally to own a firearm and prefer to deal with fellow CHL holders. I will ask for a copy of your ID up sale.
736,http://www.armslist.com/posts/7597736,For Sale:  FedArms AR Pistol,"Royal Oak, Detroit, Michigan",$ 800,"Listed On: Sunday, November 19, 2017",Antique,no type,no type,no type,no type,"FedArms AR Pistol. Red dot and Distance flip up magnifier iron sights, magpul 30 round magtest fires to zero. Other than that New"
737,http://www.armslist.com/posts/7597737,For Sale:  Gen 2 Millenium Pro 45ACP,"Moscow Mills, St. Louis, Missouri",$ 225,"Listed On: Sunday, November 19, 2017",Handguns,Taurus                                                                                ,45 ACP                                                                                ,Double Action                                                                                ,Pistol,GEN 2 MILLENIUM PRO PT145No issues.   Works excellent. Comes with 1 mag.  no box. I want $225 FIRMMUST MEET IN TROY OR MOSCOW MILLS.WILL ONLY SELL TO SOMEONE WITH MISSOURI PICTURE ID.
739,http://www.armslist.com/posts/7597739,For Sale/Trade:  Norinco SKS with a ton of extras,"Seymour, Knoxville, Tennessee",$ 675,"Listed On: Sunday, November 19, 2017",Rifles,Norinco                                                                                ,7.62x39                                                                                ,no type,Rifle,"I have an SKS with a lot of extras. Comes with Tapco T6 stock, UTG railed receiver that doubles as a shell deflector, an extended mag release, CAA pistol grip, BACP cheek piece, UTG optic sight, two 30 rnd mags, and a 75 round drum. Really looking to sell but might consider trading for the right handgun. Send offers to REDACTED"
741,http://www.armslist.com/posts/7597741,For Sale:  Taurus .38 Special,"Midtown, Atlanta, Georgia",$ 300,"Listed On: Sunday, November 19, 2017",Handguns,Taurus                                                                                ,38 S&W Special                                                                                ,Single Action                                                                                ,Revolver,"Great, reliable. Excellent condition. Very little wear. Comes. 5 Shit. Thanks for looking! See my other listing for Keltec PF-9 as well!"
742,http://www.armslist.com/posts/7597742,For Sale/Trade:  firearms for honda shadow,"Metrowest, Massachusetts, United States","$ 3,000","Listed On: Sunday, November 19, 2017",Handguns,Glock                                                                                ,45 ACP                                                                                ,Striker Fire                                                                                ,Pistol,i'm looking to trade some of my firearms for a Honda Shadow 750 or 1300
744,http://www.armslist.com/posts/7597744,For Sale:  Dpms panther,"broken arrow, Tulsa, Oklahoma",$ 500,"Listed On: Thursday, December 14, 2017",Rifles,DPMS                                                                                ,223/5.56 NATO                                                                                ,Semi-automatic                                                                                ,Rifle,Trying to get rid of my ar. Never get to use it.  Asking 500 obo
745,http://www.armslist.com/posts/7597745,For Sale/Trade:  Ruger GP100 .357 w/ extras,"Cleveland, Cleveland, Ohio",$ 600,"Listed On: Sunday, November 19, 2017",Handguns,Smith & Wesson                                                                                ,357 Magnum                                                                                ,Double / Single Action                                                                                ,Revolver,Ruger GP100 .357 4” barrel - excellent condition Fiber optic front sightAdjustable rear sightWilson Combat spring kit(original springs included)Extra Hogue grip(larger)Box and lockBuild date is 2016Asking $600 or trade for what’s listed below with cash going either way if necessary.
746,http://www.armslist.com/posts/7597746,For Sale:  Glock 19 Gen 4  FDE,"NE SPRINGFIELD, Springfield, Missouri",$ 500,"Listed On: Friday, November 24, 2017",Handguns,Glock                                                                                ,9mm Luger (9x19)                                                                                ,Striker Fire                                                                                ,Pistol,Never FIRED. LIPSEY'S FDE Cerakote . Everything from factory & 3 mags. $500 CASH.  Would consider $400 and $100 worth of quality ammo. 9mm or 38 Special+P
747,http://www.armslist.com/posts/7597747,For Sale:  Highpoint 9mm carbine,"Madison area, Huntsville, Alabama",$ 250,"Listed On: Wednesday, November 29, 2017",Rifles,Hi Point                                                                                ,9mm Luger (9x19)                                                                                ,Semi-automatic                                                                                ,Rifle,Good shape 9mm carbine with clip sling and forward grip
748,http://www.armslist.com/posts/7597748,For Sale:  Browning Abolt II,"Jonesborough, Tri-cities, Tennessee",$ 900,"Listed On: Sunday, November 19, 2017",Rifles,Browning                                                                                ,300 Winchester Short Magnum                                                                                ,Bolt Action                                                                                ,Rifle,Browning Abolt II in 300wsm with a Bushnell Elite 5-15x50... comes with about 75 rounds of ammo and some empty brass. Text REDACTED for a faster response
750,http://www.armslist.com/posts/7597750,For Sale:  Tristar 12  ga O/U,"Post falls, Coeur D' Alene, Idaho",$ 400,"Listed On: Sunday, November 19, 2017",Shotguns,TriStar                                                                                ,12 Gauge                                                                                ,Break Open                                                                                ,Shotgun,Tristar Silver Hunter- 12 ga - manual chokesGreat field and skeet gun with a few blems on the stick but operates excellent. Contact Brian at REDACTED$400 obo
752,http://www.armslist.com/posts/7597752,For Sale/Trade:  Glock 32 /357sig with 9mm conversion,"South, Indiana, United States",$ 0,"Listed On: Thursday, January 11, 2018",Handguns,Glock                                                                                ,357 SIG                                                                                ,Striker Fire                                                                                ,Pistol,Gen 3 glock 32 with a 9mm lone wolf as conversion barrel and some ammo two mags. Would like to trade for an AR pistol. Or ?????? I' am open its basicly the same as a glock 19 but also shoots 357 sig I do not have a box for this gun
753,http://www.armslist.com/posts/7597753,For Sale/Trade:  Cz52 7.62x25 tokarev  trade for revolver,"Jonesboro, Jonesboro, Arkansas",$ 350,"Listed On: Sunday, November 26, 2017",Handguns,no type,no type,no type,Pistol,Cz52 tokarev  all orig with holster two mags cleaning rod and two mags these guns are getting hard to find $350  call  or text REDACTED
754,http://www.armslist.com/posts/7597754,For Sale:  Mossberg MVP Light Chassis Tactical (7.62mm NATO),"South Charlotte, Charlotte, North Carolina","$ 1,399","Listed On: Sunday, November 19, 2017",Rifles,Mossberg                                                                                ,308/7.62 NATO                                                                                ,Bolt Action                                                                                ,Rifle,"FEATURES: The patented MVP bolt design compatible with standard AR magazines (AR15, LR308/SR25); features the MDT LSS light chassis aluminum stock; Milspec Magpul CTR Adjustable LOP Stock with A-frame profile to reduce snagging for height adjustment. Offered with either a 16.25” (5.56mm NATO) or 18.5” (7.62mm NATO) barrel threaded with SilencerCo ASR muzzlebrake (thread cap included). Patented LBA adjustable trigger system, an oversized bolt handle, Picatinny rail, adjustable bipod and optional Vortex Viper HS-T 4x zoom and MRAD reticle (Rings included).Also comes with: SUPERIOR VORTEX® OPTICS The Vortex Viper HS-T has precise, repeatable and durable elevation and windage turrets built for dialing. Matching hashmark-based MRAD reticle ensures positive point of aim. 4x zoom range coupled with ample eye relief gets shooters on target. Vortex rings included."
758,http://www.armslist.com/posts/7597758,For Sale:  Marlin 30 30,"lewisville, Winston Salem, North Carolina",$ 300,"Listed On: Sunday, November 19, 2017",Rifles,Marlin                                                                                ,30-30 Winchester                                                                                ,Lever Action                                                                                ,Rifle,used jm stamped 30 30 2000 model  open sights 300.00 firm REDACTED
759,http://www.armslist.com/posts/7597759,For Sale:  Mossberg 500,"West Alexandria, Dayton, Ohio",$ 200,"Listed On: Sunday, November 19, 2017",Shotguns,Mossberg                                                                                ,12 Gauge                                                                                ,Pump Action                                                                                ,Shotgun,Mossberg 500. Very clean gun. 12gauge. Will come with quite a few shells as well. $200 obo. Motivated to sell
760,http://www.armslist.com/posts/7597760,For Sale:  1k rounds of 9mm pmc fmj,"Littleton, Denver, Colorado",$ 180,"Listed On: Sunday, November 19, 2017",Handguns,Glock                                                                                ,9mm Luger (9x19)                                                                                ,Striker Fire                                                                                ,Pistol,1000 rounds of brand new pmc fmj ammo. $180.  Must sell today come pick it up.
761,http://www.armslist.com/posts/7597761,For Sale:  S&W Shield 9 new never fired,"Edmond, Oklahoma City, Oklahoma",$ 350,"Listed On: Sunday, November 19, 2017",Handguns,Smith & Wesson                                                                                ,9mm Luger (9x19)                                                                                ,Striker Fire                                                                                ,Pistol,"New, never fired Smith and Wesson M&P Shield 9mm.1 7 round flush mag1 8 round extended magThis is the model with the safety.brand new, but no box.  Asking $350 obo."
762,http://www.armslist.com/posts/7597762,For Sale:  LH Stag 10,"Hillsboro, Portland, Oregon",$ 900,"Listed On: Saturday, November 25, 2017",Rifles,Stag Arms                                                                                ,308/7.62 NATO                                                                                ,Semi-automatic                                                                                ,Rifle,"LH Stag 10 .308 with 80 rounds ran thru it. Great rifle, just to heavy & loud for me. Will also included a Vortex Crossfire II 4-16x50 Scope, 1 10rd mag & 2 30rd mags, 3 boxs of ammo, Laser Bore Sight by Sight Mark, and carry case for rifle. FFL to FFL transfer only."
764,http://www.armslist.com/posts/7597764,For Sale:  Enfield,"Overland Park, Kansas City, Kansas",$ 175,"Listed On: Sunday, November 19, 2017",Rifles,Savage Arms                                                                                ,303 British                                                                                ,Lever Action                                                                                ,Rifle,Enfield long branch no4 mk1 303. It's an old rifle that will need cleaned and serviced
765,http://www.armslist.com/posts/7597765,For Sale:  LNIB Glock 17 Gen4 9MM in excellent condition!,"KNOXVILLE, Knoxville, Tennessee",$ 540,"Listed On: Sunday, November 19, 2017",Handguns,Glock                                                                                ,9mm Luger (9x19)                                                                                ,Striker Fire                                                                                ,Pistol,I have for SALE ONLY my Glock 17 Gen4 9MM in like new condition priced at $540! It comes with factory case. 4 factory Glock 17 round mags. 4 backstraps. Lasermax red micro rail laser.This thing is like new with no signs of wear at all! It doesn't even have a mark on the barrel! You would have to buy a brand new one to find one in better condition! I live in East Knox County.  You can TEXT me @ REDACTED. Let me know. Thanks.
767,http://www.armslist.com/posts/7597767,For Sale:  H&R Excell Auto 12 gauge tactical,"Downtown, New Orleans, Louisiana",$ 300,"Listed On: Sunday, November 19, 2017",Shotguns,H&R                                                                                ,12 Gauge                                                                                ,Semi-automatic                                                                                ,Shotgun,"H&R Excell Auto 12 gauge with 18.5 inch barrel. Fires both 2 3/4 and 3 inch shells. Synthetic stock with rail for light. Multiple chokes included and takes Remington chokes. Also includes an aluminum shell saddle and an elastic shell saddle, shot plug, and choke wrench. Adjustable gas system. 300 or best offerhttps://imgur.com/a/4xUHp"
768,http://www.armslist.com/posts/7597768,For Sale:  HK USP Tactical .40,"Mt Pleasant, Charleston, South Carolina",$ 650,"Listed On: Tuesday, January 16, 2018",Handguns,Heckler & Koch                                                                                ,40 S&W                                                                                ,Double / Single Action                                                                                ,Pistol,"For Sale: A lightly used HK USP Tactical in 40 S&W. The gun comes with the hard case, two magazines and threaded barrel protector. I have put approximately two hundred rounds through it and I am the original owner. Feel free to contact me if you have any questions."
769,http://www.armslist.com/posts/7597769,For Sale:  Kel-Tec PF-9,"Midtown, Atlanta, Georgia",$ 290,"Listed On: Sunday, November 19, 2017",Handguns,Kel-Tec                                                                                ,9mm Luger (9x19)                                                                                ,no type,Pistol,Barely used Kel-Tec PF-9. 1 mag. Excellent pocket revolver. Thanks for looking and please see my add for the Taurus .38 Special
770,http://www.armslist.com/posts/7597770,For Sale:  Smith &Wesson M&P .45,"McFarland, Madison, Wisconsin",$ 450,"Listed On: Sunday, November 19, 2017",Handguns,Smith & Wesson                                                                                ,45 ACP                                                                                ,no type,Pistol,Looking to sell my .45 comes with two mags loaded with hollow points two loaded with fmj’s and comes with half a box of rounds
771,http://www.armslist.com/posts/7597771,For Sale/Trade:  Smith&Wesson 9c carbon,"Fishers, Indianapolis, Indiana",$ 500,"Listed On: Sunday, November 19, 2017",Handguns,Smith & Wesson                                                                                ,9mm Luger (9x19)                                                                                ,Striker Fire                                                                                ,Pistol,"This is a great little carry price.It is a Smith and Wesson, 9c, 2.0, carbon fiber.I have a iwb kydex, 150 rounds of range ammo, and 4 mags. 1 stock 12 round, 2 with pinky extension, one 17 round. The case and cleaning rod it came with.It is in perfect shape without any dings or scratches. Functions great and looks cool to boot.Do a little research before contacting me. They go for a little bit more with the carbon finish plus I have a nice setup rounds and holster.I do not want to sell outright but I would be willing to do a partial trade plus cash.My ideal situation would be a 2 gun trade.Maybe an 870, Or other shotgun and a low end Taurus 38 or windicator or something along those lines and of course if your gun is of equal value I would do a straight trade. I am open to all offers that are reasonable. Just ask worse thing I can say is no.Or ignore you if you offer me 50 bucks and a pair of tennisshoes.I am a indiana resident legal to own and cary. I expect the same from you.I live in fishers and I am willing to drive 30-45 minutes for the right deal but prefer that we meet here."
772,http://www.armslist.com/posts/7597772,For Sale:  Glock 19 Gen 4,"NE CAPE CORAL, South West Florida, Florida",$ 460,"Listed On: Friday, December 8, 2017",Handguns,Glock                                                                                ,9mm Luger (9x19)                                                                                ,Striker Fire                                                                                ,Pistol,"Glock 19 legendary reliability and accuracy.  In like new condition, about 125 rounds fired. Original box, (2) 15 round magazines, (1) Glock 30 round magazine, speed loader, 2 grip modifiers (Backstraps), Glock lock and instructions.  Great dependable personal protection. $460.00 includes everything ($440.00 W/O Glock 30 round mag.). Converting to cash now that I am retired. Florida Drivers License and CCW preferred. You must be able to legally possess a firearm in the U.S. I will remove this ad when it is no longer available. So if you read this, it is still for sale. (Lot of people never show up.)"
773,http://www.armslist.com/posts/7597773,For Sale:  AR-15 80% Lower,"417, Springfield, Missouri",$ 50,"Listed On: Sunday, November 19, 2017",Gun,no type,no type,no type,no type,80% lower reciever
774,http://www.armslist.com/posts/7597774,For Sale:  Benelli Super Black Eagle,"Columbus, Columbus, Ohio","$ 1,000","Listed On: Sunday, November 19, 2017",Shotguns,Benelli                                                                                ,12 Gauge                                                                                ,Semi-automatic                                                                                ,Shotgun,"Hello, This is a posting for my Benelli Super Black Eagle 12 Awg. Matte Black. This gun comes with a 24"" rifled deer barrel and is perfect for hunting in Ohio. This gun is in like new condition and has only been cycled 5 times. I do not use this gun as I rifle hunt in West Virgina. Price is Firm at $1,000. No Scammers, No Trades, I do not need assistance selling this Gun. Cash only. No Shipping. Will happily meet to have you check the gun out before purchase."
776,http://www.armslist.com/posts/7597776,For Trade:  30oz of 999 silver (trade for handgun),"Lynnwood, Bellevue, Seattle, Washington",Offer,"Listed On: Sunday, November 19, 2017",Handguns,Smith & Wesson                                                                                ,9mm Luger (9x19)                                                                                ,Double / Single Action,no type,"I've got 3 x 10oz silver bars Bought from Bellevue rare coin( 9mm or 45acp )Looking to Trade for a Handgun: - Cz75 B- Glock 19 larry vickers- Glock 17 larry vickers- SIG P226 9mm- Beretta Inox 9mm- 1911 SIG , Colt- HK P30L 9mm- CZ SP-O1- SIG P229 9mm- m&P 2.0 FDE full size 9mmOffer away?"
777,http://www.armslist.com/posts/7597777,For Trade:  SIG P226R for Glock 19 Gen 5,"Fredericksburg, Fredericksburg, Virginia",Offer,"Listed On: Sunday, November 19, 2017",Handguns,Sig Sauer                                                                                ,9mm Luger (9x19)                                                                                ,Double / Single Action                                                                                ,Pistol,Sig P226R 9mmNight sightsE2 grips2-15rd magsBox etc
778,http://www.armslist.com/posts/7597778,For Sale:  Ruger P95 $250,"Kennesaw, Atlanta, Georgia",$ 250,"Listed On: Sunday, November 19, 2017",Handguns,Ruger                                                                                ,9mm Luger (9x19)                                                                                ,Double / Single Action                                                                                ,Pistol,"Ruger p95 for sale:  $250:  original plastic box, two 15 rnd and one 10 rnd magazine, orginal owners  manual, no lock, but does have a loading tool.This modle handgun was issused to the US tank core and the Iraqi Army.  It just shoots and shoots.  Lightly used, less than 500 rounds through it."
781,http://www.armslist.com/posts/7597781,For Sale:  Barrett rec 7 gen I,"edmond, Northwest, OK, Oklahoma","$ 1,600","Listed On: Sunday, November 19, 2017",Rifles,Barrett                                                                                ,223/5.56 NATO                                                                                ,Semi-automatic                                                                                ,Rifle,"Super nice rifle! Was bought new never been shot, put in safe and stored. Barrett gen I rec 7 assault rifle. Also being sold with Barrett soft tactical case which is in great shape and 3 magazines. Price is firm on the rifle. I also have a brand new so tech red dot sight and brand new eotech magnifier that work for this gun if interested. Please contact Wes at 4o5 three65 4nine24"
782,http://www.armslist.com/posts/7597782,For Sale:  AR15 and GLOCK parts,"Lacey, Olympia, Washington",FREE,"Listed On: Sunday, November 19, 2017",Gun,no type,no type,no type,no type,looking to sell some stuff to fund another projectprrimary arms 1-6 gen 2 5.56 acss scope $150aero precision ultralight spr 30mm mount$50modulus arms hd universal AR15 jig$60polymer 80 pf940c Glock 80% lower brand new never completed $100polymer 80 pf940 v1.5 Glock 80% percent lower brand new never completed$50glock gen 3 complete upper assembly with plastic factory sights low round count$250glock 19 lower parts kit$40dpms AR15 lower parts kit $40magpul bev block$302 Glock 17 factory 10 round mags $10 eachtactical machine 80% AR15 lower receiver$30aim surplus AR15 h2 nickel boron bcg$70prices are low for quick sale so prices ar firm
783,http://www.armslist.com/posts/7597783,For Sale:  ACOG 6x48,"Broad Run, Northern Virginia, Virginia",FREE,"Listed On: Wednesday, February 21, 2018",Optics,no type,no type,no type,no type,"ACOG 6 x 48For 5.56 riflesGreen self luminous tactical sight enhances target identification, without box.Make a reasonable offerPayPal or cash only"
785,http://www.armslist.com/posts/7597785,For Sale:  Advanced M26 taser with  holster and cartridges,"Vandalia, Dayton, Ohio",$ 425,"Listed On: Sunday, November 19, 2017",Miscellaneous,no type,no type,no type,no type,advanced m26 .  Same as police issued.  10 total cartridges.  Holster with thumb break. Blackhawk duty.  Everything is ready to go.  425$ takes allleave a number with your reply or get ignored.
786,http://www.armslist.com/posts/7597786,For Sale/Trade:  Sig Sauer mosquito,"Fort collins, Fort Collins, Colorado",$ 320,"Listed On: Sunday, November 19, 2017",Handguns,Sig Sauer                                                                                ,22 Long Rifle                                                                                ,Double / Single Action                                                                                ,Pistol,i have a Sig Sauer Mosquito it’s a .22Lr come with original sig case and 1 10 round mag
787,http://www.armslist.com/posts/7597787,For Sale:  HK SP5K 9MM,"Bend, Bend, Oregon","$ 2,800","Listed On: Thursday, December 14, 2017",Handguns,Heckler & Koch                                                                                ,9mm Luger (9x19)                                                                                ,no type,Pistol,For sale is a lightly used H SP5K 9MM pistol.  Comes with everything from the factory.I am NOT looking for any trades.  I am willing to ship and buyer pays all fees.
