,url,title,location,price,post date,category,manufacturer,caliber,action,firearm type,postcontent
452,http://www.armslist.com/posts/7597452,"For Trade:  M&P9 ""2.0"" FDE","Montevideo, Minnesota, United States",Offer,"Listed On: Sunday, November 19, 2017",Handguns,Smith & Wesson                                                                                ,9mm Luger (9x19)                                                                                ,Double Action                                                                                ,Pistol,"Full-size M&P9 2.0 w/ thumb safety in FDE, Brand New in box -I bought this about a month ago and haven't even picked it up from the shop yet but will be doing so this week. I reconsidered and there are some other things I'd rather have than another 9mm to get lost in my closet. Things such as a variable power 1-4 or 1-6 optic such as a Vortex Strike Eagle, Primary Arms 1-6 or trijicon and will add cash from either side to settle; pistol is valued at 500.00 an excellent price compared to Cabela's 579.00 and my price is firm. I'm only interested in optics that are in brand new or real damn close to brand new condition. I would also like to consider 20"" ""Government"" A3 (flat top) 5.56 upper (A2 front post, etc.) or entire rifle with cash balance obviously depending on manufacturer and condition. Muzzle loader offers also welcome. Keep trade offers at the 500.00 dollar minimum if you don't have any money, you know the drill, low-ballers will likely be unpolitely told to get real."
453,http://www.armslist.com/posts/7597453,For Sale:  FN 509 (9mm),"Auburn, Washington, United States",$ 400,"Listed On: Sunday, November 19, 2017",Handguns,FN Herstal S.A.                                                                                ,9mm Luger (9x19)                                                                                ,Striker Fire                                                                                ,Pistol,"I am looking to sell my FN 509 (9mm). Has had 50rds fired downrange and comes with everything you would get brand new including: (2) 17rd mags, original cardboard box, and FN soft case. Has contrast sights as well.$400 (buyer pays transfer)Located in Auburn/Lake Tapps text REDACTED"
454,http://www.armslist.com/posts/7597454,For Sale:  First sale Springfield 45 XD mod 2,"Tazewell, Knoxville, Tennessee",$ 500,"Listed On: Friday, November 24, 2017",Handguns,Springfield                                                                                ,45 ACP                                                                                ,Double / Single Action                                                                                ,Pistol,For sale is a Springfield XD 45 Cal mod2 new in box comes with 2 13 round clips and all the factory stuff $500 firm no trades call or text REDACTED thanks
455,http://www.armslist.com/posts/7597455,"For Sale:  Mossberg SA-28 28 gauge Semi-Automatic - New, Unfired","Springfield, Springfield, Missouri",$ 425,"Listed On: Friday, December 1, 2017",Shotguns,Mossberg                                                                                ,28 Gauge                                                                                ,Semi-automatic                                                                                ,Shotgun,"Purchased 3 weeks ago. New, unfired Mossberg SA-28 semi-automatic shotgun. Has front fiber optic sight. 26” barrel. Comes with 4 additional chokes. Call, text REDACTED or email. No trades."
456,http://www.armslist.com/posts/7597456,For Sale:  Glock 26 gen 4 for AK,"Norman, Oklahoma City, Oklahoma",FREE,"Listed On: Sunday, November 19, 2017",Rifles,no type,no type,no type,Rifle,"hi, i have a glock 26 gen 4, i would like to trade it for an AK47, cz scorpion or AR pistol. I have the following2 10 rnds glock mag2 17 rnds glock mag1 31 rnds magglock original boxtrue glo fiber optic low light sights in package bran new. Text me at 405-318-32zero2"
457,http://www.armslist.com/posts/7597457,For Sale/Trade:  Burris P.E.P.R mount,"Huntsville, Huntsville, Alabama",$ 65,"Listed On: Tuesday, December 12, 2017",Optics,no type,no type,no type,no type,"Brand new, never used."
458,http://www.armslist.com/posts/7597458,For Sale/Trade:  41 magnum dies,"Akron, Akron, Ohio",$ 5,"Listed On: Friday, December 1, 2017",Reloading,no type,no type,no type,no type,I have 41 magnum dies for sale or trade. I don't reload for this caliber. $10 cash or equal trade. Open for all trades.
461,http://www.armslist.com/posts/7597461,For Sale:  Ruger LCP Custom,"North End, Columbus, Ohio",$ 199,"Listed On: Sunday, November 19, 2017",Handguns,Ruger                                                                                ,380 ACP                                                                                ,Double Action                                                                                ,Pistol,"Ruger LCP Custom .380. 6+1, has enhanced trigger and sights on it. Talon ruberrized grip. One magazine."
462,http://www.armslist.com/posts/7597462,For Sale:  RUGER SR 22,"Northwest, Bakersfield, California",$ 400,"Listed On: Sunday, November 19, 2017",Handguns,Ruger                                                                                ,22 Long Rifle                                                                                ,Double / Single Action                                                                                ,Pistol,I have a like new OFF ROSTER Ruger sr 22. It maybe has 200 rounds out it. Comes with soft case and two 10 round mags. Supper clean no marks no wear marks.
463,http://www.armslist.com/posts/7597463,For Sale:  Sig Sauer P229,"Southgate, Detroit, Michigan",$ 350,"Listed On: Sunday, November 19, 2017",Handguns,Sig Sauer                                                                                ,40 S&W                                                                                ,Double / Single Action                                                                                ,Pistol,"Beautiful Sig P229 in 40 S&W, comes with 2 ten round and 2 twelve round factory magazines, gun is in near perfect condition. For sale only, no trades please."
464,http://www.armslist.com/posts/7597464,For Sale:  Benelli 20 GA Ultra Light,"Chambersburg, Pennsylvania, United States","$ 1,175","Listed On: Sunday, November 19, 2017",Shotguns,Benelli                                                                                ,20 Gauge                                                                                ,Semi-automatic                                                                                ,Shotgun,"Benelli FSA 20GA Ultra Light Semi Automatic, 3"" chamber, 24"" VR blue barrel, satin walnut WeatherCoat stock, 2 shot mag., featherweight alloy receiver, shortened mag. tube and forearm, raised carbon fiber target rib, 6 lbs. Importation began 2006.  The gun has been shot only once.  Original Benelli case with all orginal paperwork."
465,http://www.armslist.com/posts/7597465,For Sale:  Springfield 1911 RO 9mm,"Grand Haven, Grand Rapids, Michigan",$ 650,"Listed On: Sunday, November 19, 2017",Handguns,Springfield                                                                                ,9mm Luger (9x19)                                                                                ,no type,Pistol,"Springfield Range Officer 1911 9mmPurchased new in April 2017 comes with original case and equipment. It also comes with the Springfield promotional items- holster, magazine pouch, and a total of 5 magazines. asking $650 obo"
466,http://www.armslist.com/posts/7597466,Want To Buy:  AR15,"Beaverton/Hillsboro, Portland, Oregon",$ 250,"Listed On: Tuesday, January 2, 2018",Rifles,no type,5.56×45mm NATO                                                                                ,Semi-automatic                                                                                ,Rifle,"Have an AR you just cant seem to sell? Need to get it sold? Im your guy. The market really has seemed to fall out on ARs as of late and has me wanting to pick up a spare that's cheap to use and abuse. Looking for a functional AR15, I am not brand or model specific. Needs an A2 front post, pros for midlength and Carry handle if possible. Picture is for an idea of what ill be doing with it."
468,http://www.armslist.com/posts/7597468,For Sale:  Gen5 Glock 17 w/ nightsites,"Greenfield, Jackson, Tennessee",$ 550,"Listed On: Sunday, November 19, 2017",Handguns,Glock                                                                                ,9mm Luger (9x19)                                                                                ,Striker Fire                                                                                ,Pistol,Like new gen 5 17 with the factory upgraded Glock Spartan Operator sights. Price is firm. Contact REDACTED for faster response.
469,http://www.armslist.com/posts/7597469,For Sale:  1873 Beasley's by Uberti,"SILVERWOOD, Flint, Michigan",$ 650,"Listed On: Sunday, December 10, 2017",Handguns,Uberti                                                                                ,no type,Single Action                                                                                ,Revolver,"2 sequentially numbered colt/Uberti Beasley's in 45 colt.5.5""  beautiful shape . built for S.A.S.S. comp..Custom leathet double rig 7deg forward can't. Also available extra. No shipping"
471,http://www.armslist.com/posts/7597471,For Sale:  Ruger Super Redhawk 454 Casull / 45 Colt Target Gray + Extras,"North, Topeka, Kansas","$ 1,350","Listed On: Tuesday, December 12, 2017",Handguns,Ruger                                                                                ,454 Casull                                                                                ,Double Action                                                                                ,Revolver,"Selling my Ruger Super Redhawk in Target Stainless (gray) with 7.5 inch barrel. Perfect condition. Low rounds fired. Comes with original grips, Ruger scope rings and original sights. Upgraded with Hogue Monogrip, Weigand scope rail and Burris Tactical 6-screw rings. Included is a Leupold 28mm, 4-power scope. Scope was sent to Leupold and upgraded with threaded objective and eyepiece which allows the use of screw-on caps to protect the optics.Also including the following...Brand new Lee dies for .454, never used.454 reloading manualOne partial box of factory Federal Fusion ammo (15 rounds)103 rounds of reloaded ammo162 pieces of once-fired brass$1350 Email through this site or call 785 224 4 six 3 seven (NO TEXTS)If the ad is still up, I still have the gun. I will not respond to ""is this still available"" emails."
473,http://www.armslist.com/posts/7597473,For Sale:  Glock 19 Gen 4 MOS 9mm,"East, Wichita, Kansas",$ 550,"Listed On: Sunday, November 19, 2017",Handguns,Glock                                                                                ,9mm Luger (9x19)                                                                                ,Striker Fire                                                                                ,Pistol,"I'm selling a Gen 4 Glock 19 MOS in 9mm. Frame has been stippled, finger grooves removed, trigger guard undercut, smooth faced factory Glock trigger, Vickers extended mag and slide releases, and it has Ameriglo Tritium 3 dot suppressor height sights. Very low round count. Slide finish shows wear from holstering. I have everything that came from factory, MOS plates, box, lock, 3-15 round magazines but I'll also throw in 2 extra Magpul 17 round magazines plus 50 rounds of Winchester Ranger 147gr hollow points, cleaning brush, and magazine loader.  Also for an extra $50 I'll add a Raven Concealment Phantom OWB holster. Or if you want it just the way it came from the factory without Ameriglos, Magpul magazines, or any upgrades I'll let it go for $450.Please contact me @ REDACTED. I can send more pictures also if needed. Thanks for looking."
476,http://www.armslist.com/posts/7597476,For Sale:  Springfield XD 40 Sub Compact Mod .2,"GAINESVILLE, Atlanta, Georgia",$ 400,"Listed On: Monday, December 18, 2017",Handguns,Springfield                                                                                ,40 S&W                                                                                ,Striker Fire                                                                                ,Pistol,This pistol comes with (1) 9 round magazine and (1) 12 round magazine w/grip extension. The red fiber optic front sight makes getting on target quick and easy. This would be a good concealed carry or glovebox gun. Less than 100 rounds have been fired and its in great condition.
477,http://www.armslist.com/posts/7597477,"For Sale/Trade:  Colt 1911 100th Anniversary Edition, 100 Years of Service 45 ACP","North Salem, Salem, New Hampshire",$ 850,"Listed On: Friday, December 29, 2017",Handguns,Colt                                                                                ,45 ACP                                                                                ,Single Action                                                                                ,Pistol,"Excellent condition collectors piece. Cold Commander 1911 45 ACP engraved with ""100 Years of Service"" from the factory.All original case, magazines, paperwork, and accessories included. Must have NH ID and permit to conceal carry."
480,http://www.armslist.com/posts/7597480,For Sale:  CVA 50 cal,"Hummelstown, Harrisburg, Pennsylvania",$ 325,"Listed On: Thursday, November 30, 2017",Muzzle,Connecticut Valley Arms                                                                                ,50 Black Powder                                                                                ,no type,Muzzle Loader,"CVA Optima .50 cal stainless fluted barrell with scope, case and sling. New. unused, never fired. No scratches."
481,http://www.armslist.com/posts/7597481,For Sale:  Glock 19 gen 3 9mm,"Fairfax, Northern Virginia, Virginia",$ 650,"Listed On: Sunday, December 31, 2017",Handguns,Glock                                                                                ,9mm Luger (9x19)                                                                                ,Double / Single Action                                                                                ,Pistol,Lbnib2 mags va only
482,http://www.armslist.com/posts/7597482,For Sale:  M&P Shield .45,"North end, Columbus, Ohio",$ 399,"Listed On: Sunday, November 19, 2017",Handguns,Smith & Wesson                                                                                ,45 ACP                                                                                ,Double Action                                                                                ,Pistol,"Smith & Wesson M&P Shield .45. One 6 round magazine, one 7 round magazine."
486,http://www.armslist.com/posts/7597486,For Sale/Trade:  Midwest Industry metal sights,"Huntsville, Huntsville, Alabama",$ 100,"Listed On: Monday, December 4, 2017",Gun,no type,no type,no type,no type,"Brand new, never used. Got them off a sig that I sold. Fit dovetail mounts, Sig's, dovetail gas blocksMake an offer"
489,http://www.armslist.com/posts/7597489,For Sale:  9mm brass,"spring hill, Nashville, Tennessee",$ 1,"Listed On: Monday, December 4, 2017",Ammo,no type,no type,no type,no type,"For sale or trade, two 5 gal buckets of once fired 9mm brass. Please don't ask me how many there are. I have no idea. Make me a resonable offer.Text REDACTED"
490,http://www.armslist.com/posts/7597490,For Sale:  Ruger mini14,"Madison area, Huntsville, Alabama",$ 525,"Listed On: Friday, November 24, 2017",Rifles,Ruger                                                                                ,223/5.56 NATO                                                                                ,Semi-automatic                                                                                ,Rifle,"Great shape .223 mini 14 with ATI folding stock and 2 clips, scope and sling"
492,http://www.armslist.com/posts/7597492,For Sale:  For sale kahr cw9 burnt bronze slide 9mm,"Tazewell, Knoxville, Tennessee",$ 350,"Listed On: Sunday, November 19, 2017",Handguns,Kahr                                                                                ,9mm Luger (9x19)                                                                                ,Double / Single Action                                                                                ,Pistol,For sale is a kahr cw9 burnt bronze slide 9mm very low round count 20 rounds through it $350 firm no trades call or text REDACTED thanks
494,http://www.armslist.com/posts/7597494,For Sale:  GLOCK 43,"North west, Bakersfield, California",$ 800,"Listed On: Sunday, November 19, 2017",Handguns,Glock                                                                                ,9mm Luger (9x19)                                                                                ,Striker Fire                                                                                ,Pistol,Like new glock 43 I only have 100 rounds down it bought it to carry but it just sitting in the safe. I might be willing to drive to meet in south in Valencia or north to Visalia for full price. Buyer pays for their dross.
495,http://www.armslist.com/posts/7597495,For Sale:  New Aero Precision based AR15 w/ Magpul,"East of Indy, Indianapolis, Indiana",$ 500,"Listed On: Sunday, November 26, 2017",Rifles,Aero Precision                                                                                ,223/5.56 NATO                                                                                ,Semi-automatic                                                                                ,Rifle,"Up for sale is a new AR15 built with the following components:- Aero Precision G2 lower receiver- Palmetto State Armory premium upper assembly with midlength gas system- AIM Surplus nitride C58 BCG- BCM lower parts kit with PNT trigger group- KNS anti rotation pins- Magpul ambi selector- Kaw Valley Precision Tungsten powder buffer- magpul stealth grey furniture with SL stock, enhanced buttpad, K2 grip, MOE vertical grip- Magpul Grey rear sight- Grey Hexmag 30 roung magazineRifle is new and has never been fired. It is premium inside and out. It is better than most of the stuff hanging in Rural King by a long shot. I am not looking for trades at all, just cash. I would like $500 cash for it, firm. I don't need to sell, so please dont bother with crazy offers. Please feel free to email me with any questions you may have."
496,http://www.armslist.com/posts/7597496,For Sale:  TAURUS PT738 .380,"Moscow Mills, St. Louis, Missouri",$ 150,"Listed On: Sunday, November 19, 2017",Handguns,Taurus                                                                                ,380 ACP                                                                                ,Striker Fire                                                                                ,Pistol,"Taurus PT738 380 pocket pistol.  Excellent condition with original box, papers, key.  2 mags..one with pinky extension.    I want $150 ....FIRM.    MUST BE ABLE TO MEET IN TROY OR MOSCOW MILLS.     I WILL ONLY SELL TO SOMEONE WITH A MISSOURI PICTURE ID."
497,http://www.armslist.com/posts/7597497,For Sale/Trade:  Sig Sauer p226 elite scorpion 9mm lnib 5 mags,"Macedonia, Cleveland, Ohio",$ 950,"Listed On: Sunday, November 19, 2017",Handguns,Sig Sauer                                                                                ,9mm Luger (9x19)                                                                                ,no type,Pistol,Description says it all.. elite scorpion 9mm lnib took to the range one time other than that has lived in the gun cabinet.har bright sig night sights and the best short reset trigger you will ever feel..read some reviews if your not familiar with this gun..well over 1200 dollars with the extra factory sig mags..it looks and shoots perfect ..5 mags total all hi-cap ..this is the best of the best.
498,http://www.armslist.com/posts/7597498,For Sale:  Rare Remington model seven 270 wsm whitetail edition with leopold gold ring 3-9x40,"Havelock, Jacksonville, North Carolina",$ 850,"Listed On: Sunday, November 19, 2017",Rifles,Remington                                                                                ,no type,Bolt Action                                                                                ,Rifle,Hard to find remington model seven. Beautiful rifle it stays in the safe alot because i am afraid to damage it. Very acurate! Will include rcbs die set and plenty of brass and factory rounds as well! Seventwoseven 5347630
501,http://www.armslist.com/posts/7597501,For Trade:  MTM R-50 CASE,"Akron, Akron, Ohio",Offer,"Listed On: Sunday, November 19, 2017",Reloading,no type,no type,no type,no type,I have MTM R-50 CASE for trade. I do not reload for a caliber for this box. Will trade box for box.
503,http://www.armslist.com/posts/7597503,For Sale:  Kel-Tec P32,"Aliso Viejo, Orange County, California",$ 375,"Listed On: Sunday, November 19, 2017",Handguns,Kel-Tec                                                                                ,32 ACP                                                                                ,Double Action                                                                                ,Pistol,Approximately 300 rounds fired. Excellent pocket gun. Very slim and comfortable to carry. Comes with everything you see here. Asking $375.
504,http://www.armslist.com/posts/7597504,For Sale:  New OE Sig 245 Mags,"Navarre, Pensacola, Florida",$ 140,"Listed On: Friday, January 5, 2018",Magazines,no type,no type,no type,no type,"I have 5 OE Sig 245 new Magazines for sale 140.00 for all, thats 28.00 each cash today.Thanks Robert368-1824 Cell"
506,http://www.armslist.com/posts/7597506,For Sale/Trade:  Rims and tires,"Adamsville, Birmingham, Alabama",$ 800,"Listed On: Sunday, November 19, 2017",Vehicles,no type,no type,no type,no type,"I have a set of rims and tires I took off of my 2016 Silverado. They are 265/65/R18 and are in great condition with less then 8000 miles on them, the tires retail for $200 a piece brand new. If interested text or give me a call at 205-966-32five8"
507,http://www.armslist.com/posts/7597507,For Trade:  WTT SLR107FR for Norinco M14s,"Fort Smith, Fort Smith, Arkansas",Offer,"Listed On: Sunday, November 19, 2017",Rifles,no type,7.62x39                                                                                ,Semi-automatic                                                                                ,Rifle,"Have Arsenal SLR-107FR in great condition, wanting to trade for Norinco or Polytech M14 clone in similar condition.  Rifle has approx. 200 rounds fired since new.  Side fold stock and Bulgarian sling.  Surplus steel 30 round magazine included.  Not looking to sell or any other trades.  Please text 479 four three zero 0589"
508,http://www.armslist.com/posts/7597508,For Sale:  remington 700 aac sd,"Chouteau, Tulsa, Oklahoma",$ 500,"Listed On: Friday, November 24, 2017",Rifles,Remington                                                                                ,308/7.62 NATO                                                                                ,Bolt Action                                                                                ,Rifle,"i have a remington 700 aac sd 308 heavy barrel, hogue stock and muzzlebreak"
509,http://www.armslist.com/posts/7597509,For Sale:  Tactical shotgun,"Toledo, Toledo, Ohio",$ 300,"Listed On: Sunday, November 19, 2017",Shotguns,American Tactical Imports                                                                                ,12 Gauge                                                                                ,no type,Shotgun,"12ga Savage arms custom ati advanced recoil butt pad also comes in with original Has the 18” barrel triLitE home multi functional home defense flashlight attached to barrel mount, Ghost ring sights fiber optic bead. Sling for shells. Face to face transaction only firm on price as well"
510,http://www.armslist.com/posts/7597510,For Sale:  NAZI WWII 8mm Black Tip Tracer Collector Ammo,"Nashville, Nashville, Tennessee",$ 1,"Listed On: Sunday, November 19, 2017",Ammo,no type,no type,no type,no type,Nazi WWII 8mm Ammo Collector 1938 Black Tip Tracers We can work a deal out on the price!
511,http://www.armslist.com/posts/7597511,For Sale:  Incog glock 43 holster,"Hillsboro, Portland, Oregon",$ 50,"Listed On: Wednesday, January 17, 2018",Holsters,no type,no type,no type,no type,I carry my 19 more. So my glock 43 incog iwb holster is for sale. $50. Black fuzz with the super mojo. REDACTED cell.
513,http://www.armslist.com/posts/7597513,For Sale:  Magpul stuff,"Raeford, Fayetteville, North Carolina",$ 1,"Listed On: Sunday, November 19, 2017",Gun,no type,no type,no type,no type,Magpul afgmagpul afg2magpul qd attachsrtike industries muzzle brake SOLDoffer$$
