,url,title,location,price,post date,category,manufacturer,caliber,action,firearm type,postcontent
229,http://www.armslist.com/posts/7597229,For Sale:  Glock 22 Dark Earth,"San Diego, San Diego, California",$ 550,"Listed On: Sunday, January 28, 2018",Handguns,Glock                                                                                ,40 S&W                                                                                ,Double Action                                                                                ,Pistol,"UP FOR SALE IS A UNFIRED GLOCK 22 DARK EARTH IN 40S&W WITH TWO MAGAZINES, FACTORY ORIGINAL CASE AND GUN LOCK. I WILL DO PPT IN ANY PART OF THE CITY, THANK YOU."
230,http://www.armslist.com/posts/7597230,For Sale:  CZ-P07,"Mansfield, Ohio, United States",$ 400,"Listed On: Tuesday, December 5, 2017",Handguns,CZ USA                                                                                ,9mm Luger (9x19)                                                                                ,Double / Single Action                                                                                ,Pistol,"Czp07 for sale about 100 rounds trough it. Comes with 2 Mags and a few Cajun gun works parts. Similar size to Glock 19, cz p10c and new Smith and Wesson mp2.0 compact."
231,http://www.armslist.com/posts/7597231,"For Sale:  Stevens/Savage SxS 20 Gauge, 311H","Rochester Hills, Detroit, Michigan",$ 425,"Listed On: Saturday, March 17, 2018",Shotguns,Savage Arms                                                                                ,20 Gauge                                                                                ,Side by Side                                                                                ,Shotgun,"Beautifull Stevens/Savage SxS 20 gauge, 28"" barrel, excellent condition.Blueing excellent, stock and fore arm very little wear. bore is prestine, all original, hard to find in this condition.I will not respond to the following:NO LOW BALL BIDSNO TRADESNO SHIPPINGNO EMAILS FROM GMAIL ADDRESS (99% SCAMS)ONLY PICTURES PROVIDED ARE ON LISTING IF YOU WOULD LIKE TO EXAMINE FIREARM BEFORE ANY TRANSACTION NO PROBLEM."
232,http://www.armslist.com/posts/7597232,For Sale:  S&W MP 15,"ST. Charles, St. Louis, Missouri",$ 575,"Listed On: Friday, November 24, 2017",Rifles,Smith & Wesson                                                                                ,223/5.56 NATO                                                                                ,Semi-automatic                                                                                ,Rifle,"Smith & Wesson M&P 15 with Case, 5, 30 round clips and NcStar mark3 Scope. Has a 5.56 1/9 twist barrel. Very good condition."
233,http://www.armslist.com/posts/7597233,"For Sale:  Surefire m73 rail, a2 carry handle, CTR stock, etc","Central, Atlanta, Georgia",$ 125,"Listed On: Sunday, November 19, 2017",Gun,no type,no type,no type,no type,"Surefire m73 rail with 4 kac panels - 80.00 shippedpalmetto state A2 carry handle and free a2 grip (no screw) - 40.00 shippedPainted milspec Magpul CTR stock - 40.00 shippedDeal for all of it, 125.00Call or text REDACTED"
236,http://www.armslist.com/posts/7597236,For Sale:  3,"Virginia Beach, Hampton Roads, Virginia",$ 45,"Listed On: Sunday, November 19, 2017",Magazines,no type,no type,no type,no type,Defence
238,http://www.armslist.com/posts/7597238,For Sale:  BROWNING SILVER HUNTER,"Gainesboro, Cookeville, Tennessee",$ 850,"Listed On: Tuesday, November 28, 2017",Shotguns,Browning                                                                                ,12 Gauge                                                                                ,Semi-automatic                                                                                ,Shotgun,"FOR SALE: Browning Silver Hunter. 28"" barrel, 3"" chamber. Smooth shooting, 12 Gauge semi-auto, very nice gun , in like new condition. It come with 3 Invector plus choke tubes. $850 CASH REDACTED CALL OR TEXT"
239,http://www.armslist.com/posts/7597239,For Sale:  GLOCK 36,"IRVINE, Orange County, California",$ 500,"Listed On: Wednesday, November 29, 2017",Handguns,Glock                                                                                ,45 ACP                                                                                ,Striker Fire                                                                                ,Pistol,"STIPPLED GRIP, NEW GLOCK SLIDE ($255-ORIGINAL SLIDE HAD RMR CUT WHICH DIDN'T ALLOW FOR REAR SIGHT).REPLACED GLOCK NIGHT SIGHTS WITH DAWSON 310-223 FIBER OPTIC SIGHTS ($90), ZEV FULCRUM DROP IN TRIGGER KIT (ZT-FUL-DRP-45-BR, $180) INSTALLED, 2 MAGS, CASE, LOCK AND MANUAL.PPT AT TITAN SPORTING, IRVINE.BUYER PAYS $35 DROS. ALL OEM PARTS INCLUDED EXCEPT FOR RMR SLIDE.NO TRADES, NO SHIPPING, FTF CASH SALE ONLY."
240,http://www.armslist.com/posts/7597240,For Sale/Trade:  Winchester Model 50,"Hope Mills, Fayetteville, North Carolina",$ 400,"Listed On: Sunday, November 19, 2017",Shotguns,Winchester                                                                                ,12 Gauge                                                                                ,Semi-automatic                                                                                ,Shotgun,"Winchester Model 50, semi auto 12 gauge with a fixed modified choke. Serial number puts it being made in 1959. Excellent condition original finish, flawless operation. Looking to sell or trade."
241,http://www.armslist.com/posts/7597241,For Sale/Trade:  Stevens 320 Tactical 12 gauge,"Suffolk, Hampton Roads, Virginia",$ 275,"Listed On: Sunday, November 19, 2017",Shotguns,Savage Arms                                                                                ,12 Gauge                                                                                ,Pump Action                                                                                ,Shotgun,"Stevens 320 Tactical 12 gauge, fires less than 10 times, want to trade for a hunting rifle or 275obo"
242,http://www.armslist.com/posts/7597242,For Sale/Trade:  Mossberg 500,"South, Lexington, Kentucky",$ 300,"Listed On: Sunday, November 19, 2017",Antique,no type,no type,no type,no type,"For sale or trade, a like new Mossberg 500 8 round patrol shotgun. This gun is in great shape! Excellent as is or would make an excellent project shotgun for all your tacti-cool wish list products! Looking to sell but would be willing to trade for the right offer! See my wants below."
244,http://www.armslist.com/posts/7597244,"For Sale:  Remington 700 BDL Deluxe 25-06 with a 24"" blued","Suburbs, Wilmington, North Carolina",$ 950,"Listed On: Sunday, November 19, 2017",Rifles,Remington                                                                                ,25-06 Remington                                                                                ,Bolt Action                                                                                ,Rifle,"Up for sale is my personal 1971 Remington 700 BDL Deluxe 25-06 with a 24"" blued varmint heavy barrel, blued receiver, black floor plate and jeweled bolt mounted in a beautiful walnut stock. AWESOME condition for a rifle manufactured in 1971. Very light use on the target range only. I am not a gun dealer so please look closely at the photos and come to your own conclusion regarding condition. The condition was put at 98% by my local gun shop. Should you want to see a specific part of this fabulous gun photographed I will try to accommodate your request. It has a Redfield 6-18x scope. The walnut stock has wonderful grain patterns. You will need an FFL to ship. No sales or shipment to CA or international. Cash, bank check, personal check, PayPal or money orders. No credit card payments. If you wish to use PayPal please add 3% to the sale price. All funds must clear completely before item will be shipped. No exceptions. This is not a business for me. I am simply selling my personal firearms. I will be happy to answer any of your questions. Thanks and good luck."
245,http://www.armslist.com/posts/7597245,For Sale:  Makarov (IJ70-18AH) Double Stack,"Coos Bay, Oregon Coast, Oregon",$ 450,"Listed On: Thursday, March 22, 2018",Handguns,Makarov                                                                                ,9mm Makarov                                                                                ,Double Action                                                                                ,Pistol,Good condition double stack Makarov IJ70-18AH in 9mm Makarov.  Comes with a few extra mags.  Have any questions just shoot me an e-mail and I will get back with you.  Thanks
247,http://www.armslist.com/posts/7597247,For Sale:  SERIOUS HUNTING COLLECTION/MUST SEE/MY LOSS UR GAIN,"Sheboygan (South), Milwaukee, Wisconsin",$ 600,"Listed On: Sunday, November 19, 2017",Rifles,Mossberg                                                                                ,243 Winchester                                                                                ,Bolt Action                                                                                ,Rifle,"Here is an unbelievable hunting package for sale:   1)  NEW Mossberg bolt action .243 Win with fluted 20"" bbl and scoped (Dialed in to 1"" grps at 100yds)   2)  A NEW Rosse Adult single shot heavy tapered countoured 20"" .243 Win scoped and dIALED IN TO MAX    3)  Like NEW condition Stevens (Americn Made) double barrel 12 ga (one bbl MOD, other FULL) 2 3/4"" and lastly for muzzleloading a NEW Uberti Model 1858 Cap n Ball .44 cal revolver.....all reloading supplies included, balls, Pyrodex -- this has taken a doe last yr at 50yds, very accurate and fun too shoot..........MOST BE SOLD AS PACKAGE FOR THE LOWBALLPRICE IM ASKING:  600.00 FIRMbolt .243 new was 350.00   Rossi Single Adult H.B. .243 scoped was 250.00    Stevens double 12ga was 350.00   Uberti 1858 .44 Cap n ball was 250.00NOTE:  The Uberti has a superb trigger and when loaded with 40gr pyrodex launches a 160 ball or conical at over 1000fps!!!  Serious killing power for muzzleloading season or gun deer THIS PACKAGE IS LIKE UR LITERALLY GETTING TWO FINE GUNS FOR FREE!!!!!!!!!!    CAN BE REACHED VIA TEXT ONLY:  REDACTED       Pics upon request!!!!!!"
248,http://www.armslist.com/posts/7597248,For Sale:  Beretta M9-92FS 15rnd mags.,"Marietta, Lancaster, Pennsylvania",$ 55,"Listed On: Friday, November 24, 2017",Magazines,no type,no type,no type,no type,Up for sale I have (2) brand New Beretta 15 rnd mags for sale. Mags were removed from New M9 pistol that was purchased on 11-18-17. Thank you  for your time and interest
249,http://www.armslist.com/posts/7597249,For Sale:  Delton Echo 316 optic Ready rifle,"East Louisville -- Near Crestwood, Louisville, Kentucky",$ 550,"Listed On: Thursday, November 30, 2017",Rifles,Del-ton Inc                                                                                ,223/5.56 NATO                                                                                ,Semi-automatic                                                                                ,Rifle,"I have for sale a NEW IN BOX Delton Echo 316 Optic Ready 5.56/.223 chambered rifle ... It has a 16"" barrel with a carbine gas system and 1:9 twist rate."
250,http://www.armslist.com/posts/7597250,For Sale:  Smith & Wesson M&P Bodyguard,"State College and Williamsport area, State College, Pennsylvania",$ 325,"Listed On: Friday, April 27, 2018",Handguns,Smith & Wesson                                                                                ,380 ACP                                                                                ,Double Action                                                                                ,Pistol,"Like new Smith & Wesson M&P Bodyguard 380.Factory Crimson Trace green laser Comes with extra clip and pad-folio zippered holderOnly 100 rounds or so put through the gunComes with all paperwork, manual and boxRetails for $519Asking $325 or best offer. Great conceal carry gun!Will only meet face to face at a FFL. Buyer pays all transfer fees."
251,http://www.armslist.com/posts/7597251,For Sale:  Palmetto State Armory AR-15,"Kernersville, Greensboro, North Carolina",$ 500,"Listed On: Saturday, February 10, 2018",Rifles,Palmetto State Armory                                                                                ,223/5.56 NATO                                                                                ,Semi-automatic                                                                                ,Rifle,BNIB PSA AR-15 in .223/5.56 with 16in barrel. Please email with any questions. $500 firm
252,http://www.armslist.com/posts/7597252,For Sale:  MOSSBERG 835,"Gainesboro, Cookeville, Tennessee",$ 300,"Listed On: Sunday, November 19, 2017",Shotguns,Mossberg                                                                                ,12 Gauge                                                                                ,Pump Action                                                                                ,Shotgun,"For sale : Mossberg 835, Realtree camo, 24"" barrel, shoots up to 3.5"" shells. Its has Williams fiber optic sights, Hasting Ported turkey choke. Nice gun asking $300 CASH. CALL OR TEXT REDACTED"
253,http://www.armslist.com/posts/7597253,For Sale:  W Stamped,"nc, North Carolina, United States",$ 950,"Listed On: Sunday, November 19, 2017",Rifles,no type,no type,no type,Rifle,"Unmarked Winchester front sight. Undated Winchester marked barrel. NO EVIDENCE OF A T3 BARREL BAND EVER INSTALLED. No stock nose ""compression"" from a T3 barrel band either. Stock is Minty with strong cartouche.  There is also a ""W"" stamped on the bottom of the pistol grip. I've never seen that before and have had several experts examine without a conclusion as to why its there?. Also photoed.original assembly and not a ""restored"" item.Great example of an original rifle. HARD TO UPGRADE IN ANY COLLECTION!!!USPS money order Only.Muzzle measures a ""0"" ZERO!!!!!!. Bore is bright and strong."
255,http://www.armslist.com/posts/7597255,For Sale:  Colt Sp1 stripped upper...,"northside, Columbus, GA, Georgia",$ 250,"Listed On: Sunday, November 19, 2017",Gun,no type,no type,no type,no type,"Legit SP1 stamped ""C M"" upper receiver. Has dust cover and rear sight. In very goid shape considering its old as I am. Price is FIRM. Look at prices on the auction sites. I'll ship for actual cost. 954- two four zero -3562 for more info."
256,http://www.armslist.com/posts/7597256,For Sale:  2 magazine AR-15,"West side, Bend, Oregon",$ 20,"Listed On: Sunday, November 19, 2017",Ammo,no type,no type,no type,no type,I've got 2 magpul magazines for sale 20 for both
257,http://www.armslist.com/posts/7597257,For Sale:  SAIGA 12 Never Fired,"Farmington, Farmington, New Mexico","$ 1,799","Listed On: Saturday, May 5, 2018",Shotguns,Saiga                                                                                ,12 Gauge                                                                                ,Semi-automatic                                                                                ,Shotgun,"Comes with original furniture, breaching muzzle brake, stock and grip by Phoenix Technologies, quad rail by Black Aces Tactical, steel BUIS, 1 ten-round magazine, 1 twelve-round drum and 1 twenty-round drum. Never fired. Made in Russia. please text me at 505-427-9247 for serious inquiries ony. ABSOLUTELY NO CHECKS! If you want FFL2FFL transfer, I have to cash that Postal Money order first."
258,http://www.armslist.com/posts/7597258,For Sale:  P320 45acp Compact,"Clarksville, Nashville, Tennessee",$ 550,"Listed On: Sunday, November 19, 2017",Handguns,Sig Sauer                                                                                ,45 ACP                                                                                ,Striker Fire                                                                                ,Pistol,Selling my P320 compact in 45acpcomes with:5 factory Sig mags1 kydex OWB holster (fde color)a second grip module in FdeHas The Siglite Night Sites Apex Tactical Flat face trigger installed ( factory sig trigger is in the case)and 500 rounds of 230gr ball ammo.$550 firmwill entertain trade offers as well. Just let me know what you gotI respond to emails as quickly but can also be reached through text at (931)six2four-0six1twoI do live in Clarksville but can meet in the Nashville area
259,http://www.armslist.com/posts/7597259,For Sale:  Stag Arms 3G AR-15 Competition Rifle - 18” barrel,"Lake Dallas, Dallas, Texas",$ 850,"Listed On: Sunday, November 19, 2017",Rifles,Stag Arms                                                                                ,223/5.56 NATO                                                                                ,Semi-automatic                                                                                ,Rifle,"Stag Arms 3G AR-15 Competition Rifle - 18” barrelLike new. Has only had a couple of hundred rounds through it.18 inch 1/8 twist fluted stainless barrel.15"" free float Samson Evolution Handguard.Stag 3G CompensatorMagpul MOE buttstockMagpul MOE enhanced trigger guardRifle length gas system"
262,http://www.armslist.com/posts/7597262,For Sale:  Keystone Crickett .22lr,"Northland, Kansas City, Missouri",$ 130,"Listed On: Sunday, November 19, 2017",Rifles,no type,22 Long Rifle                                                                                ,Single Shot                                                                                ,Rifle,"I'm selling my daughter's youth model Keystone ""Davey Crickett"" .22lr.  I'm including 50 rounds of target bullets, and a free gun lock.  Original case and keys for the lock mechanism.  Gun has maybe been shot 20 times."
263,http://www.armslist.com/posts/7597263,For Sale:  Combat,"Virginia Beach, Hampton Roads, Virginia",$ 50,"Listed On: Sunday, November 19, 2017",Magazines,no type,no type,no type,no type,D
264,http://www.armslist.com/posts/7597264,"For Sale:  IMI Vintage Jericho 941 not IWI ""Baby Eagle"" SOLD PENDING FUNDS","Brooklyn, Michigan, United States",$ 375,"Listed On: Sunday, November 19, 2017",Handguns,no type,9mm Luger (9x19)                                                                                ,Double / Single Action                                                                                ,Pistol,"Early IMI 9MM Compact model, 2 mags and looks just about new. I took it on a trade because it was a good deal for me. Like I said in title this is vintage early one before they went to IWI gen 2 and such. Great shape and these are known to be very accurate and reliable guns. 375$ will ship to your FFL on your dime. Local ftf needs cpl or purchase permit. Text any questions to 5 one 7 66 two 94 zero 9. NO Trades...thanks."
265,http://www.armslist.com/posts/7597265,For Trade:  Glock 19 Gen 5,"southwest, Indianapolis, Indiana",Offer,"Listed On: Sunday, November 19, 2017",Handguns,Glock                                                                                ,9mm Luger (9x19)                                                                                ,Striker Fire                                                                                ,Pistol,"i have a Glock 19 Gen5 with low round count and still in great shape, the the trigger components have been polished and the trigget guard has been undercut already, has the box and all accesories along with a leather IWB holster, it also has a very nice set of Trigicon HD night sight installed. i can send pics just send me youe cell# and il will text them to you.the main reason i am wanting to trade this is because i have smaller hands and the Glock is just not a great fit for me."
266,http://www.armslist.com/posts/7597266,For Sale:  Bushnell Elite Tactical DMR 3.5-21x50MM G2 MIL,"Aurora, Denver, Colorado",$ 800,"Listed On: Friday, November 24, 2017",Optics,no type,no type,no type,no type,"excellent scope and only used a few times.  Sold the rifle this was on and no longer need the scope.  Comes with a original box and factory goodies.  It is MIlradian with the G2 reticle.  The tube is 34mm and comes with an Anderson one piece mount....and original box.$800 Cash, not looking for trades.email, call or text.  If the add is up, it's still for sale.  I WILL NOT REPLY TO YOUR EMAIL IF:  1) you ask if it's still available & 2) if you do not include your phone number.thanks,EricREDACTED"
268,http://www.armslist.com/posts/7597268,For Sale:  2 Reloaders For Sale,"Crookston, Minnesota, United States",$ 100,"Listed On: Sunday, November 19, 2017",Reloading,no type,no type,no type,no type,"I have 2 reloaders for sale. I really don't know much about them, I have never used them. The one with the box and instructions is a 10 gauge and the other is a 12 gauge. That's all I really know.Asking $100 each. I will ship thru a paypal transaction"
269,http://www.armslist.com/posts/7597269,For Sale/Trade:  OD Glock 21 gen 4,"Bristow, Northern Virginia, Virginia",$ 630,"Listed On: Friday, January 12, 2018",Handguns,Glock                                                                                ,45 ACP,no type,no type,Parting with my Like new Glock 21. A few mags through since new. Comes with all factory stuff and 5 glock mags. Just seeing what’s out there. Nothing specific in mind so tell me what you have to trade.
270,http://www.armslist.com/posts/7597270,For Sale/Trade:  S&W MP Shield 45  w/ extras-ammo,"Lexington, Columbia, South Carolina",$ 450,"Listed On: Saturday, November 25, 2017",Handguns,Smith & Wesson                                                                                ,45 ACP                                                                                ,Striker Fire                                                                                ,Pistol,"Smith WessonM&P Shield (new style, 2017)3 magsStealth Gear revolution holster 50 rounds of fmj20 rounds federal hydroshocksLike new, 60 rounds run through it$450.00 for allREDACTEDtxt for quickest response"
271,http://www.armslist.com/posts/7597271,For Sale/Trade:  Aimpoint M16 Carrying Handle Mount,"Virginia Beach, Hampton Roads, Virginia",$ 40,"Listed On: Sunday, November 19, 2017",Optics,no type,no type,no type,no type,Aimpoint M16 Carry handle mount.
272,http://www.armslist.com/posts/7597272,For Sale/Trade:  Taurus curve 380.,"Citronelle, Mobile, Alabama",$ 0,"Listed On: Sunday, November 19, 2017",Handguns,Taurus                                                                                ,380 ACP                                                                                ,Double Action                                                                                ,Pistol,New never fired Taurus 380 curve looking to trade for ar15 may add a little cash if need to. Let me know what you have.
274,http://www.armslist.com/posts/7597274,For Sale:  Spikes/BCM AR15,"Louisville, Louisville, Kentucky","$ 1,300","Listed On: Saturday, December 30, 2017",Rifles,no type,no type,no type,Rifle,Spikes lower BCM upper with a 14.5 inch barrel quite a few add-ons call or text REDACTED asking $1300 obo
275,http://www.armslist.com/posts/7597275,For Sale:  Glock 19 Threaded Barrel,"Exit 11/Sango, Clarksville, Tennessee",$ 150,"Listed On: Sunday, November 19, 2017",Gun,no type,no type,no type,no type,Selling my Silencer Co barrel for a Gen3 or Gen 4 Glock 19.less than 20 rounds through it.asking $150I answer both Emails and text(931)six2four-0six1two
