,url,title,location,price,post date,category,manufacturer,caliber,action,firearm type,postcontent
767,http://www.armslist.com/posts/5459767,For Sale:  Winchester m22 subsonic 45 grain 1600rds,"west knox cedar bluff, Knoxville, Tennessee",$ 122,"Listed On: Tuesday, June 21, 2016",Ammo,no type,no type,no type,no type,I have two 800 rd boxes of Winchester m22 subsonic that just hit the market. These are 45 grain and made specifically for suppressor use. Price is firm and must be able to meet on cedar bluff rd please. If ad is up item is still available for sale. Serious inquiries only.
768,http://www.armslist.com/posts/5459768,For Sale:  Lee Auto Hand Priming Tool,"North, Austin, Texas",$ 25,"Listed On: Sunday, May 8, 2016",Reloading,no type,no type,no type,no type,Lee Auto Hand Priming Tool with large and small primer trays. Like new.
769,http://www.armslist.com/posts/5459769,For Sale:  FEG Hungary AMD65,"sneads ferry, Jacksonville, North Carolina",$ 500,"Listed On: Thursday, May 19, 2016",Rifles,no type,7.62x39                                                                                ,Semi-automatic                                                                                ,Rifle,"Hungarian AMD 65 w/Zhukov folding stock, 3 magazines and 200rnds of 7.63x39, and single point bungee sling. 500 firm"
770,http://www.armslist.com/posts/5459770,For Sale:  Ruger SP101-22lr,"Edmond, Oklahoma City, Oklahoma",$ 525,"Listed On: Friday, May 13, 2016",Handguns,Ruger                                                                                ,22 Long Rifle                                                                                ,Double / Single Action                                                                                ,Revolver,Ruger SP101 22lr 8 shot revolver new in box $525 4 0 5 6 1 4 0 7 7 9
771,http://www.armslist.com/posts/5459771,For Sale/Trade:  32NAA ammo,"Savannah, Savannah, Georgia",$ 0,"Listed On: Sunday, May 8, 2016",Ammo,no type,no type,no type,no type,I have 23 boxes of COR BON 32NAA Ammunition available. 60gr jacketed hollow points. High quality ammo but I don't have a firearm for it. Make an offer. Open to trades for other ammo. This ammo retails for over $20 per box.
772,http://www.armslist.com/posts/5459772,For Sale:  380 reloading components,"Belle Center, Lima, Ohio",$ 125,"Listed On: Sunday, May 8, 2016",Reloading,no type,no type,no type,no type,"Selling 380 components. 730 100gr rnfp bullets, 500 sized mixed brass and lee 4 die set."
774,http://www.armslist.com/posts/5459774,For Sale:  FULL CUSTOM GLOCK 21,"Akron/Canton, Akron, Ohio",$ 900,"Listed On: Tuesday, July 19, 2016",Handguns,Glock                                                                                ,45 ACP,no type,no type,"This is a full custom Glock 21 build done by Middlebranch Machine of Canton, OH.  It features machining, Titanium Nitride, and Cerakote.  This one has Raptor ports, Ridgeback serrations, and flutes on the slide and barrel.  The machining enhances both appearance and grip of the firearm.  Titanium Nitride is surface treatment that is extremely hard and wear resistant.  Chances are that you won't see another like this at the range!  Asking $900 locally and am willing to ship to your FFL.  May be open to trades."
775,http://www.armslist.com/posts/5459775,For Sale:  MARLIN MODEL 989 M2 1962-65 22LR,"North Carolina, North Carolina, United States",$ 600,"Listed On: Sunday, May 8, 2016",Rifles,Marlin                                                                                ,22 Long Rifle                                                                                ,Semi-automatic                                                                                ,Rifle,"THIS IS A C&R OK 1962-65 MARLIN MODEL 989 M2 SEMI AUTO 22 LR WITH 18"" BARREL. EXCELLENT LIKE NEW CONDITION."
776,http://www.armslist.com/posts/5459776,For Sale/Trade:  Savage 110  7mm,"Munford/Millington, Memphis, Tennessee",$ 0,"Listed On: Saturday, June 18, 2016",Rifles,Savage Arms                                                                                ,7mm Remington Magnum                                                                                ,Bolt Action                                                                                ,Rifle,"Savage 110 7mm bolt-action.  Has accu-trigger, new Nikon 3-9x40 BDC reticle.   Wanting to sell or will trade for another rifle of equal value in 30-06,  .308,  .270."
777,http://www.armslist.com/posts/5459777,For Sale/Trade:  LNIB Remington R1 $500,"Randolph, Massachusetts, United States",$ 500,"Listed On: Sunday, May 8, 2016",Handguns,Remington                                                                                ,45 ACP                                                                                ,Single Action                                                                                ,Pistol,"Basically brand new gun never fired , no trade at this time $500 firm cash payment only will meet FTF at My FFL we'll split fee , must have LTC-A all laws will be followed. Text me for faster response 617-six15seven032 .Trade for Sig Sauer p938RevolverBeretta M9 Thanks for looking"
779,http://www.armslist.com/posts/5459779,For Sale:  Stevens 320,"Centerville, Macon, Georgia",$ 225,"Listed On: Sunday, May 8, 2016",Shotguns,Savage Arms                                                                                ,12 Gauge                                                                                ,Pump Action                                                                                ,Shotgun,"Stevens 320 tactical home defense 12 gauge.. Fired once.. Comes with ammo sling, spotlight and ammo holder on stock..$225"
780,http://www.armslist.com/posts/5459780,For Sale/Trade:  1911 sell/trade,"Hartselle al., Huntsville, Alabama",$ 500,"Listed On: Sunday, May 8, 2016",NFA,no type,no type,no type,no type,I have a ati 1911 45 acp in like new condition for sell or trade  (450) cash  (500) trade  obo  txt is faster  (256-654-239one) Steve I can add ammo or cash or both for guns listed below
782,http://www.armslist.com/posts/5459782,For Sale:  Crimson trace Laser Grips for Glock 19/23 Gen 2-3,"Southside Savannah, Savannah, Georgia",$ 125,"Listed On: Thursday, June 23, 2016",Gun,no type,no type,no type,no type,I have some Crimson Trace laser grips for the Gen 2-3 Glock 19/23 for sale. Asking $125. It may fit on other models (Glock 17/22)
783,http://www.armslist.com/posts/5459783,"For Sale:  Springfield XDm 4.5"" .45ACP - Limited 10 setup","Douglas County, Denver, Colorado",$ 500,"Listed On: Sunday, May 8, 2016",Handguns,Springfield                                                                                ,45 ACP                                                                                ,Striker Fire                                                                                ,Pistol,"** ALL Colorado laws apply, FFL transfer required, User pays transfer fee, FtoF in Douglas County preferred but willing to negotiate location within reason, Item located in Castle Pines (Douglas Cty near Castle Rock) **For sale - Springfield XDm 4.5"" .45ACP - Limited 10 setup.  Priced to sell, not interested in trades unless it is specifically one of these things: CBE Vertex 3D target sight w/ scope and lense, Elite Energy 32 or Energy 35 or Victory 37/39, Vortex PST FFP scopeI originally set this up thinking I would run a 9mm XDm in Production and a .45ACP in limited 10. Well, I've shot Limited 10 once in two years, and it was while my 9mm was at Springer Precision for internal magic work. That, and I'm enamored with my P320 now. Someone else needs to use this beauty to poke A-zone holes in USPSA targets (or take the blue bits off and do normal stuff with it).Fun stuff for trying to blast as fast as Cha-Lee (or at least look good while failing the previous)- solid stainless steel guide rod (have original as well)- Wolff 18lb recoil spring (have original as well)- Powder River Ultimate Match trigger kit (have original as well)- Powder River extended mag release (have original as well)- Springer Precision mag well in blue- Springer Precision backstrap designed for mag well (have all original back straps)- Springer Precision +.25 baseplates in blue, numbers 1-4 (have original base plates as well)- Dawson Precision FO front/blackout rear sight If you want, for an additional $50, I'll include the CompTac International holster with drop offset. The standard SA magazines hold 13 rounds, so they are quite legal to transfer.Comes with all the traditional XDm gear items and the black hard case.Best way to get ahold of me quickly: text REDACTED. I'll see PMs here, but won't be as quick. FYI, I'm out on travel a portion of next week."
785,http://www.armslist.com/posts/5459785,For Sale:  Savage hog hunter 223,"gladstone, Kansas City, Missouri",$ 550,"Listed On: Sunday, May 22, 2016",Rifles,Savage Arms                                                                                ,no type,Bolt Action                                                                                ,Rifle,Looking to sell my savage hog hunter good rifle low round count comes with a Boyds tactical stockLooking to sell to fund a different rifle feel free to shoot me an offer
786,http://www.armslist.com/posts/5459786,For Sale:  Thompson Center Hawken 50 cal,"Clarksville-Nashville, Clarksville, Tennessee",$ 150,"Listed On: Sunday, May 8, 2016",Muzzle,Thompson Center                                                                                ,50 Black Powder                                                                                ,no type,Muzzle Loader,In good condition overall...has some discolor on the end of barrel..other than that everything is good... Hawken .50 cal percussion cap #11...in Clarksville..call or text REDACTED
787,http://www.armslist.com/posts/5459787,For Sale/Trade:  PSA Premium 5.56 Upper,"Meridian, Meridian, Mississippi",$ 400,"Listed On: Sunday, May 8, 2016",Rifles,Palmetto State Armory                                                                                ,223/5.56 NATO                                                                                ,Semi-automatic                                                                                ,Rifle,"16"" Barrel lengthChrome moly vanadium barrel5.56 Nato Chamber1 in 7"" twist rateChrome-lined boreHPT/MPI BarrelM4 Feed rampsF-Marked Front sight postA2 Flash HiderSling LoopStandard Hand Guards w/ heat shieldsForged upper receiverT-MarksM16 Bolt Carrier Group and Charging HandleI've owned this upper for 2 months, shot 20 rounds through it. Decided I want to go another route. Willing to ship."
788,http://www.armslist.com/posts/5459788,Want To Buy:  Want Pump Action .22LR,"Mentor, Cleveland, Ohio",$ 200,"Listed On: Sunday, May 8, 2016",Rifles,no type,22 Long Rifle                                                                                ,Pump Action                                                                                ,Rifle,Hey there. I'm trying to find a cheap pump-action Rifle in .22LR or maybe even a cheap Lever-action. I have a Mossberg 702 to trade and/or a lot of .357/38 Special ammo plus 9mm and .45ACP. Also have a lot of various computer parts.
790,http://www.armslist.com/posts/5459790,Want To Buy:  WTB: GLOCK 42,"Barberton, Akron, Ohio",$ 425,"Listed On: Sunday, May 8, 2016",Handguns,Glock                                                                                ,380 ACP                                                                                ,Striker Fire                                                                                ,Pistol,LOOKING TO BUY A NEW OR LIKE NEW GLOCK 42. ALSO WOULD CONSIDER TO TRADE MY SPRINGFIELD XD9 SUBCOMPACT 9MM THAT COMES WITH 1-13 RD MAG AND 2- 16 RD MAGS AND ALL ACCESSORIES AS FROM THE FACTORY WHEN NEW.IT ALSO HAS A BRAND NEW RAVEN CONCEALMENT HOLSTER I PAID $105 FOR. CAN DISCUSS TRADE VALUE DIFFERENCES TO MAKE TRADE FAIR FOR BOTH PARTIES
791,http://www.armslist.com/posts/5459791,For Sale/Trade:  Springfield XD in .357 sig,"Birmingham & Huntsville, Birmingham, Alabama",$ 425,"Listed On: Wednesday, May 18, 2016",Handguns,Springfield                                                                                ,357 SIG                                                                                ,no type,Pistol,Springfield XD in .357 sig. Comes with 2 mags & box.
793,http://www.armslist.com/posts/5459793,For Sale:  AR-10 stripped upper,"Mccloch county, Texas, United States",$ 150,"Listed On: Sunday, May 8, 2016",Gun,no type,no type,no type,no type,I have a panther arms AR-10 stripped upper.  Never used.  NO BCG or barrel.  It will come with the charging handle.
795,http://www.armslist.com/posts/5459795,For Sale:  Kahr CW 380,"Wichita, Wichita, Kansas",FREE,"Listed On: Sunday, May 8, 2016",Handguns,no type,no type,no type,no type,Like new. Less than 25 round thru it. $300 Please text REDACTED
797,http://www.armslist.com/posts/5459797,For Sale:  Crossbreed Supertuck for the Smith and Wesson Shield,"Renton, Seattle, Washington",$ 80,"Listed On: Friday, September 9, 2016",Holsters,no type,no type,no type,no type,"I have a very lightly used Crossbreed Supertuck for Smith and Wesson Shield for sale. This particular one comes with the combat cut and horse hide upgrade.Would be willing to trade for 9mm luger, CCI 22 SV, M193 or M855 ammo."
799,http://www.armslist.com/posts/5459799,For Sale:  Glock 17/34 Gen 3 Black Frame,"Renton, Seattle, Washington",$ 300,"Listed On: Friday, May 27, 2016",Handguns,Glock                                                                                ,9mm Luger (9x19)                                                                                ,Striker Fire                                                                                ,Pistol,"I have a like new Glock 17/Glock 34 Black Frame for sale.  It is currently setup as a Glock 34 (minus disconnector, extended mag release, extended slide stop) but can set it up as a Glock 17 if you choose.  This is considered a firearm and is subject to applicable state laws.Will be open to trading for S&B 9mm 115gr ammo."
800,http://www.armslist.com/posts/5459800,For Sale:  glock 34  custom 3 gun build,"central, Springfield, Missouri",$ 1,"Listed On: Sunday, May 8, 2016",Handguns,Glock                                                                                ,9mm Luger (9x19)                                                                                ,Striker Fire                                                                                ,Pistol,"This was a build i did last winter, started as a New g34 gen 3 lower that i stripped and replaced with all zev tech parts. I bought a new blank raw slide and designed and had all the mill work done. Cerakoted the barrel and slide once complete. very light slide. Running a 1lb striker spring with a skeletonized zev tech striker. Zev mag well, Zev mag release, Zev barrel nut, Lone wolf threaded barrel, Zev tech fully adjustable trigger and have had it tuned, Comes with 2 stainless steel guide rods with 3 spring options for different loads. setup for factory loads currently. Has XS big dot sights with front being a night sight. Also comes with a new custom Blade tech holster made for that gun. I will sell gun without the mags or with the mags. Mags are new glock 17mags with Taran tacticatal Noveske extentions. The mags are over $100 each. Gun has had 225 rounds through it. Was built to run 3 gun or mod/tactical idpa and just like any hobby i changed directions. I have all the receipts on the build that i will give with the gun. Around 2500$  call or text if interested or if you would like any additional pics. REDACTED"
801,http://www.armslist.com/posts/5459801,For Sale:  Stevenings 320 tactical,"Evans city, Pittsburgh, Pennsylvania",$ 200,"Listed On: Sunday, May 8, 2016",Shotguns,Mossberg                                                                                ,12 Gauge                                                                                ,Pump Action                                                                                ,Shotgun,Have a stevens 320 tactical 12 gauge for sale has some light marks due to use ask $200 call or txt REDACTED thanks
802,http://www.armslist.com/posts/5459802,For Sale/Trade:  Star firestar plus 9mm compact,"West Cleveland, Cleveland, Ohio",$ 325,"Listed On: Sunday, May 8, 2016",Handguns,Star Firearms                                                                                ,9mm Luger (9x19)                                                                                ,Single Action                                                                                ,Pistol,I have a really nice star firestar plus 9mm compact for sale or trade for other 9mm compacts and up no bows or shotguns at all i have about 30 rounds with it it holds 13 and 1 very accurate gun and low recoil perfect gun to shoot no flaws at all there only thing as u see in pic it only has minimal holster were beautiful for its age pls no lowballs
803,http://www.armslist.com/posts/5459803,For Sale:  Henry .22 Lever Action,"Norman, Oklahoma City, Oklahoma",$ 250,"Listed On: Sunday, May 8, 2016",Rifles,Henry Repeating Arms                                                                                ,22 Long Rifle                                                                                ,Lever Action                                                                                ,Rifle,"Excellent condition Henry Repeating Arms Classic Lever Action (Model H001).  Rifle fires .22 Short/Long/Long Rifle.  This sale is for rifle only, I don't have the box or manual.  I am not looking to trade at this time, face-to-face in the Norman/Moore/OKC area.  Please TEXT REDACTED with any questions.  Thanks for looking!"
804,http://www.armslist.com/posts/5459804,"For Sale/Trade:  S&W M&P Pro .40  5""","Mooresville, Charlotte, North Carolina",$ 550,"Listed On: Saturday, May 21, 2016",Handguns,Smith & Wesson                                                                                ,40 S&W                                                                                ,Striker Fire                                                                                ,Pistol,"S&W M&P pro .40sw 5"".  This gun was setup as a backup for USPSA Limited division.  It has the Apex FSS flat faced trigger kit installed.  SSS stainless steel guide rod with 13# recoil spring.  Warren tactical rear sight.  Comes with 3 - 15 round mags,  All 3 back straps and original box.Note this is setup as a competition gun and is not for everyday carry."
807,http://www.armslist.com/posts/5459807,For Sale:  22lr CCI 40gr 1000 rounds,"Lake City, Florida, United States",$ 150,"Listed On: Sunday, May 8, 2016",Ammo,no type,no type,no type,no type,1000 rounds of 22lr 40gr CCI hollowpoint
808,http://www.armslist.com/posts/5459808,For Sale:  Walther PPQ M1 9mm,"Lorton, Northern Virginia, Virginia",$ 425,"Listed On: Friday, May 13, 2016",Handguns,Walther                                                                                ,9mm Luger (9x19)                                                                                ,Striker Fire                                                                                ,Pistol,Like new Walther PPQ M1 with two 15 round magazines.  I have only put 100 rounds through the gun and it has performed flawlessly. I have the original box which contains everything that comes with the gun when new. I have moved on to Sig Sauer and no longer need a similar pistol in 9mm. I will include a nice OWB Kydex holster that holds the gun close to the body and locks the gun in tight. Must be a VA resident with a drivers license and either a voter registration card or concealed carry permit (preferred). Must be willing to sign a bill of sale.
810,http://www.armslist.com/posts/5459810,For Trade:  Sigp226 9mm sa/da 6 mags,"Columbus, Columbus, Ohio",Offer,"Listed On: Sunday, May 8, 2016",Handguns,Sig Sauer                                                                                ,9mm Luger (9x19)                                                                                ,Double / Single Action                                                                                ,Pistol,"Sigp226r,6mags,nite sights,dak trigger kit,extra gun parts.Ftf columbus,21 over,ccw,state id."
811,http://www.armslist.com/posts/5459811,For Sale:  Silencerco Octane/Osprey 1/2-28 Piston Assembly,"Renton, Seattle, Washington",$ 60,"Listed On: Friday, May 20, 2016",NFA,no type,no type,no type,no type,"I have a lightly used piston assembly for the Silencerco Octane/Osprey family of supressors.  This comes with the spring, spring retainer and 1/2-28 piston."
812,http://www.armslist.com/posts/5459812,For Sale:  Glock 42,"Porterville, Fresno, California",$ 650,"Listed On: Sunday, May 8, 2016",Handguns,Glock                                                                                ,380 ACP                                                                                ,no type,Pistol,I have a lightly used glock 42 for sale. Round count is between 50-75 rounds.
813,http://www.armslist.com/posts/5459813,For Sale/Trade:  Star firestar plus 9mm compact,"West Cleveland, Cleveland, Ohio",$ 325,"Listed On: Sunday, May 8, 2016",Antique,no type,no type,no type,no type,I have a really nice star firestar plus 9mm compact for sale or trade for other 9mm compacts and up no bows or shotguns at all i have about 30 rounds with it it holds 13 and 1 very accurate gun and low recoil perfect gun to shoot no flaws at all there only thing as u see in pic it only has minimal holster were beautiful for its age pls no lowballs
814,http://www.armslist.com/posts/5459814,For Sale:  taurus 605 poly protector 357 mag,"Stroudsburg, East Stroudsburg, Pennsylvania",$ 330,"Listed On: Sunday, May 22, 2016",Handguns,Taurus                                                                                ,327 Magnum                                                                                ,no type,Revolver,New in box. 5 shot 357 mag. Never fired has the stainless cylinder and comes with 2 sets of grips. Have box and paperwork also. $350 FTF in Monroe County and you pay transfer.
815,http://www.armslist.com/posts/5459815,Want To Buy:  Baretta 92 fs or 92 A1,"Tampa, South West Florida, Florida",$ 450,"Listed On: Sunday, May 8, 2016",Handguns,Beretta USA                                                                                ,9mm Luger (9x19)                                                                                ,Double / Single Action                                                                                ,Pistol,Baretta model 92fs or model 92A1 wanted to purchase
817,http://www.armslist.com/posts/5459817,For Sale:  CCF Race Glock 34 All Metal Frame PRICE DROP,"West Orlando, Orlando, Florida",$ 999,"Listed On: Tuesday, August 9, 2016",Handguns,Glock                                                                                ,9mm Luger (9x19)                                                                                ,Striker Fire                                                                                ,Pistol,"CCF Race Frames Aluminum Glock 34 Gen 3 -ZEV Ultimate Adjustable trigger with V4 3lbs connector and spring kit.-ZEV Flared Mag Well -Wolf Stainless Steel Slide, Barrel guide rod, and Internals.-WOTG Fiber Optic front sight, Blacked out Y notch rear sight.-CCF Race Frames 1911 profile back strap and Glock profile back strap-Vickers Extended mag release.-Cerakote Tactical Grey-1 22 round Glock magazine with Arredondo +5 extensions-3 20 round Glock magazines with Arredondo +3 extensions-Glock Box
All parts and Cerakote are 2016.  Like new condition with very low round count. The rigidity of the aluminum frame and 1911 profile drastically change the way this Glock performs.  The Aluminium frame with a stock trigger alone is amazing, adding the ZEV trigger makes this thing shoot laser beams.  It is hard to call it a Glock.  The only Glock part on this gun is the slide release. IDPA / USPSA 3-Gun Steel Challenge competition ready. 9mm 17 17L 35 19 3-GunPrice drop from $1,300 to $999 firmWill consider trades for Ruger Precision Rifle in 6.5mm Creedmoor"
823,http://www.armslist.com/posts/5459823,For Sale:  Mosin Nagant,"Alexandria, Northern Kentucky, Kentucky",$ 225,"Listed On: Saturday, May 14, 2016",Rifles,no type,7.62x54R                                                                                ,Bolt Action                                                                                ,Rifle,"Mosin, Izhevsk, stamped 1942, seems to be unfired, no rust, normal marks from the armory, beautiful wood stock, has bayonet, ammo pouches carry strap, $ 225 ,  obo"
824,http://www.armslist.com/posts/5459824,For Sale:  Burris Fastfire 3,"Ankeny, Des Moines, Iowa",$ 150,"Listed On: Sunday, May 8, 2016",Optics,no type,no type,no type,no type,Burris fastfire 3 for sale good condition barely used. $150 FIRM
