,url,title,location,price,post date,category,manufacturer,caliber,action,firearm type,postcontent
501,http://www.armslist.com/posts/5459501,For Sale/Trade:  Barnes Precision AR,"East Nashville, Nashville, Tennessee","$ 1,300","Listed On: Sunday, May 8, 2016",Rifles,Bravo Company USA                                                                                ,223/5.56 NATO                                                                                ,Semi-automatic                                                                                ,Rifle,"For sale is a Barnes Precision AR Pistol with Sig Brace.  Although it's listed as a Bravo Company, it isn't as Barnes isn't an option.  This is a fantastic piece of work.  If you know ARs, you know Barnes makes all of their ARs in house in North Carolina, even down to the pins tha hold the upper and lower receivers together.  The craftmanship is superb.  This pistol features flip up front and rear sights and an 11"" barrel.  Rails, which are included, can be attached to the handguard.  The pistol also comes with a custom case.  Sorry, the Aimpoint is not included.  I've fired 50 rounds through it in order to sight in the optic...and, of course, to have a little fun.  I'm only selling as I have other ARs and really need/want a good 1911 or optic for the other AR"
502,http://www.armslist.com/posts/5459502,For Sale:  Beretta M9 30th Limited Addition,"dallas, Dallas, Texas",$ 750,"Listed On: Sunday, May 8, 2016",Shotguns,no type,no type,no type,Shotgun,CONDITION  new in boxBRAND.  Beratta M9 limited editionCALIBER.  9MM LugerLOCATION. TX
503,http://www.armslist.com/posts/5459503,For Sale/Trade:  Custom built 10/22 Takedown,"Huber heights, Dayton, Ohio",$ 420,"Listed On: Sunday, May 8, 2016",Rifles,Ruger                                                                                ,22 Long Rifle                                                                                ,Semi-automatic                                                                                ,Rifle,"Looking to sell my lightly used customized Ruger 10 22 takedown model. This is the black reciever with 16"" THREADED barrel model. Additions to the original rifle include:Hogue overmolded rubberized stock ($100) Ruger BX 2.5lb trigger assembly ($75)Volquartsen extended magazine release ($30)KIDD polished guide rod with multiple tension springs ($30)KIDD extended charging handle ($20)Fluted thread protector cap ($15)2 Ruger BX-25 magazines ($50)KIDD bolt buffer ($10)additionally if interested I have some 22lr ammo that I can sell on top of the gun send me me a text at REDACTED if interested !thanks"
506,http://www.armslist.com/posts/5459506,For Sale:  Westin bumper guard,"South, Wichita, Kansas",$ 225,"Listed On: Sunday, May 8, 2016",Miscellaneous,no type,no type,no type,no type,"Westin bumper guard off of a 2015 Chevrolet full size pickup, like new condition, was on truck for about 2 months, I have all the mounting brackets."
507,http://www.armslist.com/posts/5459507,For Sale:  Hogue Grips,"Bartlesville Area, Tulsa, Oklahoma",$ 30,"Listed On: Sunday, May 8, 2016",Gun,no type,no type,no type,no type,"Hogue grips. Used. All have been on a gun at some point. They were lightly used.SIG 220 one piece finger groove w/American mag release SIG 226 two piece standard hogue grip. Marked for 9mm.SIG 226 one piece finger groove. Marked for 9mm or 40S&W.S&W one piece finger groove for K and L frame square butt.""Handall"" for Glock and other semi auto pistols. This one has a small slit about 2mm in the back that has been there for years. Selling as a lot, but will consider dividing. $30 for the lot. If individual, $9 each. Feel free to make an offer.Buyer pays actual shipping if being shipped. USPS flat rate."
508,http://www.armslist.com/posts/5459508,For Sale:  Remington .30-06 Core-Lokt,"Huntsville, Huntsville, Alabama",$ 15,"Listed On: Sunday, May 8, 2016",Ammo,no type,no type,no type,no type,"I have four (4) boxes of Remington .30-06 165-grain Core-Lokt ammo for sale.  Selling for $15 a box, or $50 for all four boxes."
509,http://www.armslist.com/posts/5459509,For Sale:  Taurus 9,"Waynesville, Cincinnati, Ohio",$ 450,"Listed On: Sunday, May 8, 2016",Handguns,Taurus                                                                                ,9mm Luger (9x19)                                                                                ,Double / Single Action                                                                                ,Pistol,"taurus pt92 AFS 9mm. Two tone, laser rail, 2 clips original box. 450 firm REDACTED"
511,http://www.armslist.com/posts/5459511,For Trade:  Glock 26 Gen 3 plus extras,"Aiken, Columbia, South Carolina",Offer,"Listed On: Sunday, May 8, 2016",Handguns,Glock                                                                                ,9mm Luger (9x19)                                                                                ,Striker Fire                                                                                ,Pistol,"This Gen 3 Glock 26 is in excellent condition with just some very minor holster wear on the slide.  Comes with Pearce grip plug and four mags ( two original 10 rd mags plus a Gen 4 10 rounder and a Gen 4 15 rounder for the Glock 19 with X-grip adapter).  One of the 10 rd mags retains the compact factory base, one has a Pearce +0 grip extension and another has a +2 Glock factory extension for 12 rd capacity.  Also included are a Fobus retention paddle holster, a Cytac quick release paddle holster, and an Akar nylon belt slide holster with thumb break.  Also original factory box with cleaning tools, mag loader, and lock plus two boxes (100 rds) of FMJ 9mm ammo.Trades:  S&W stainless K-frame with 4"" barrel (Models 64, 65, 66, 67)."
512,http://www.armslist.com/posts/5459512,For Sale:  Misc. .223 reloading supplies,"any, Cleveland, Ohio",$ 1,"Listed On: Sunday, May 8, 2016",Reloading,no type,no type,no type,no type,"I no longer have a need for .223/5.56 so I'm selling off my reloading supplies.2 1/2 pounds of Hodgdon BLC-2 (two un-opened 1# jugs+one partial)1 pound (un-opened) Hodgdon CFE-223291 Federal Premium 205M Match Small Rifle Primers182 CCI No. 400 Small Rifle Primers500+ Hornady 55gr FMJ-BT bullets (.223)209 Armscor 55gr FMJ-BT bullets (.223)13 each 50 round ammo boxes2 each 100 round ammo boxes900 brass, including 50 of which are already primed with CCI 400 SRP's, ready to loadLee .223 die setWilson .223 case gaugeLooking for best offerthanks"
513,http://www.armslist.com/posts/5459513,"For Sale:  Glock 43 9mm, like new!","South, Janesville, Wisconsin",$ 450,"Listed On: Sunday, May 8, 2016",Handguns,Glock                                                                                ,9mm Luger (9x19),no type,no type,"This is a Glock 43 9mm with only SIX rounds fired so it is in like new condition.  Comes with two 6-round mags, box and everything it came with.  $450.No trades.  Will meet in Janesville only.  Buyer to show WI DL and CCW is preferred."
514,http://www.armslist.com/posts/5459514,For Sale/Trade:  Looking for SP101,"Tuttle, Oklahoma City, Oklahoma","$ 1,100","Listed On: Sunday, May 8, 2016",Handguns,Kimber                                                                                ,357 Magnum                                                                                ,Double Action                                                                                ,Pistol,Got a Kimber Pro Raptor II. Looking to trade for a Sp101 with another pistol. Looking for trade with same value.
515,http://www.armslist.com/posts/5459515,"For Sale:  1,500 rounds of 22lr (4cents/round)","Huber heights, Dayton, Ohio",$ 65,"Listed On: Friday, May 13, 2016",Ammo,no type,no type,no type,no type,"Looking to sell 1,500 rounds of 22 long rifleincluded is:2 boxes of Remington golden bullets 525rnd1 box of Remington thunderbolts 500rndplease send texts to REDACTEDthanks!"
516,http://www.armslist.com/posts/5459516,For Trade:  Sig Sauer 1911 scorpion carry,"calera, Birmingham, Alabama",Offer,"Listed On: Sunday, May 8, 2016",Handguns,Sig Sauer                                                                                ,45 ACP                                                                                ,Single Action                                                                                ,Pistol,Like new in box with all factory goodies.
518,http://www.armslist.com/posts/5459518,For Sale:  Sig P250 2sum,"Newark, Columbus, Ohio",$ 600,"Listed On: Sunday, May 8, 2016",Handguns,no type,9mm Luger (9x19)                                                                                ,Double Action                                                                                ,Pistol,Up for sale is a Sig p250 2sum in 9mm comes with full size and subcompact with 1 trigger module and hard case both are like new
519,http://www.armslist.com/posts/5459519,For Sale/Trade:  Mossberg shotgun and 715t 22:,"South 280, Birmingham, Alabama",$ 300,"Listed On: Sunday, May 8, 2016",Rifles,Mossberg                                                                                ,22 Long Rifle                                                                                ,Semi-automatic                                                                                ,Rifle,Mossberg maverick and mossberg 715t 22/ tactial trade for revolver or small pocket pistol of equal value
522,http://www.armslist.com/posts/5459522,For Sale:  Selling Several Handguns,"South, Springfield, Missouri",FREE,"Listed On: Sunday, May 8, 2016",Handguns,no type,no type,no type,no type,"Selling the following handguns.  All prices are firm.  Sig Legion 229 $1075.  Glock 17 several upgrades including Ghost 3.5 trigger, Extended Slide Release, grip reduced to 1911 style, $575. Glock 26 New in Box $485 includes mag extension. No trades just cleaning out our safe."
523,http://www.armslist.com/posts/5459523,For Sale:  Hoyt Carbon Matrix,"Woodbridge, Northern Virginia, Virginia",$ 850,"Listed On: Wednesday, May 18, 2016",Archery,no type,no type,no type,no type,"I am selling my LEFT-HANDED 2013 Hoyt Carbon Matrix G3 (RKT Cam @ a half) Bow. It comes with both 28"" and 29"" draw modules. (29"" ones currently on the bow) and poundage is 50-60. (Currently set @ 60 Lbs.) 35"""" Axle to axle length. I picked up a new carbon Hoyt and just moving this bow on to another hunter who won't have to pay the $1300 I did (just for the bow!) Includes: New custom string put on recently at the Archery Pro shop in Manassas New Trophy Ridge React 5 pin lighted sight (Real tree APG Camo to match bow)  Drop away rest Hoyt 5"" stabilizer (Camo matches bow) Hoyt 4 arrow Quiver (Camo matches bow) Brand new Plano Bow case for parallel limbed bows  Kick stand bow holder (clamps on and off in seconds and doesn't scratch bow) The bow alone is worth more than I am asking. I have the receipt for the string, sight, stabilizer and quiver and case. THE BOW IS LEFTHANDED AND NOT A SCRATCH ON IT. So, anyone wanting to send a lowball offer can just keep looking. This is a top-of-the-line carbon bow weighing only a few pounds. To give you an idea of how good a deal this is: Custom string ($170), New Sight ($150), New Stabilizer ($80) and New Quiver ($100) equals $500 and your getting a awesome bow for just $350!!! A bow that sold New 3 years ago for $1299!!!!   Please contact me with any questions or to see bow. I also belong to the NORVA archery club off Rt 123 and can take you out and let you shoot the bow if serious. Weather is warming up and time to start shooting at the range and getting ready for the long archery season."
524,http://www.armslist.com/posts/5459524,For Sale/Trade:  223 reloading supplies,"Tinley Park, Chicago, Illinois",$ 1,"Listed On: Sunday, May 15, 2016",Reloading,no type,no type,no type,no type,1 pound of imr 40643 piece lee die setCutter and lock studShell holder187 pieces of brassBox of small rifle primers200 55 grain fmj100 60 grain hornady soft points20 round catridge boxEverything you need to load 223 but the press. Nothing has been opened or used.Will seperate if interested.
526,http://www.armslist.com/posts/5459526,For Sale/Trade:  night scope,"east, Reno, Nevada",$ 0,"Listed On: Sunday, May 29, 2016",Optics,no type,no type,no type,no type,"this is an infrared rifle scope has a infrared illuminator built in-- designed for low light or total darkness its Russion made and they sell for $400 to $1200. dollars new depending on manufacture'r I do not read Russion so I dont know who makes it, I saw a simular scope on E-Bay with a $600. price tag -------------trying to see through it during daylight does not work----This is a night vision scope.. reason for adding this is that some people believe you can use it during daylight hours, no, it doesnt work during the day, hence the name night vision"
527,http://www.armslist.com/posts/5459527,For Sale/Trade:  LNIB PF9 Nickel Boron slide Consealed carry 9mm with ammo,"Margate, Broward, South Florida",$ 275,"Listed On: Sunday, May 8, 2016",Handguns,Kel-Tec                                                                                ,9mm Luger (9x19)                                                                                ,Double Action                                                                                ,Pistol,Like new in the box mint condition Keltec Pf9 Two tone w/ boron nickel slide. Only weights about 12 ounces makes it one of the lightest 9mm for carry. 3 dot sites very accurate. Very smooth 5 pound trigger. Only put 100 rounds thru it right out of the box and performed flawlessly! Comes with all original packaging including plastic case extra take down pin and a pinky extension and one 7 round mag. It's been 100% reliable! it's a great gun just looking for a smaller pocket gun let me know what you have.
528,http://www.armslist.com/posts/5459528,For Sale/Trade:  H&R 20 gauge pump,"Fitchburg, Madison, Wisconsin",$ 160,"Listed On: Monday, May 30, 2016",Shotguns,H&R                                                                                ,20 Gauge                                                                                ,Pump Action                                                                                ,Shotgun,"This is a copy of a Remington 870. Drilled and tapped for scope mounts, has screw-in chokes and has a fiber optic front sight. Excellent condition. Comes with a soft case and two boxes of Winchester Heavy Game Loads #6.    $160/offer/trade"
529,http://www.armslist.com/posts/5459529,For Sale:  Crimson Trace full size laser grips,"Tillmans Corner, Mobile, Alabama",$ 200,"Listed On: Sunday, May 8, 2016",Handguns,no type,no type,no type,no type,"Crimson Trace full size 1911 laser grips. Installed and fired three rounds. Sold the 1911, have no need for these anymore. $200. All original gear including the box."
530,http://www.armslist.com/posts/5459530,For Sale/Trade:  Smith&Wesson 642-1 w/Extras,"Barberton, Akron, Ohio",$ 1,"Listed On: Thursday, May 19, 2016",Handguns,Smith & Wesson                                                                                ,38 S&W Special                                                                                ,Double Action                                                                                ,Revolver,"BNIB Smith&Wesson model 642-1 38 special +P revolver. This gun is in brand new unfired condition. Comes with original box, paperwork, and lock. Also included is one box of personal defense ammo and one box of 100 target rounds. Also included are two brand new IWB holsters. One leather one kydex and both right handed.I have $585 invested but will look at all offers of cash, trade, cash plus trade, etc. paid:$435 - S&W$75 - ammo$75 - holsterswill not split upA proper I.D. and CHL preferred."
531,http://www.armslist.com/posts/5459531,For Sale/Trade:  Ak pistol. Ar pistol. Ruger SR45,"Huntington, Fort Wayne, Indiana","$ 1,855","Listed On: Sunday, May 8, 2016",Rifles,Century International Arms                                                                                ,7.62x39                                                                                ,Semi-automatic                                                                                ,Rifle,"Ak pistol Mini Draco romarm/cugir 7.62x39. Comes with strike industries rail, strike industries pistol grip, front trijicon night sight, sling attachment, bulldog carrying case, and with 2 pmags. Also has brand new dust cover. Fired very few times. $650. AR pistol spikes tactical lower, mil spec lower kit, hardened arms upper, 1/7 twist melonite Coated barrel .556/.223 Chambered, hardened arms upper, PSA BCG and CH, SIG Brace, key mod rail, and utg rail covers. $775. Ruger sr45 has 2 mags and hard case. $430. All up for trade offers. Full size AK not up for discussion please don't ask. Text REDACTED WILL NOT TRAVEL."
534,http://www.armslist.com/posts/5459534,For Trade:  CZ 85 ...9mm,"Louisville, Louisville, Kentucky",Offer,"Listed On: Sunday, May 8, 2016",Handguns,CZ USA                                                                                ,9mm Luger (9x19)                                                                                ,Double / Single Action                                                                                ,Pistol,"My CZ is in excellent condition....under 300 rounds fired through it. Identical to the the CZ 75. except for no decocker, has manual safety only. 3 magazines, adjustable rear sight with hi viz fiber optic front sight. Hard case and all paperwork along with an owb holster and a dual magazine holder. Comes with 2 sets of grips...have had the trigger internals polished to smooth/shorten the DA/SA pull...more pictures upon request..."
536,http://www.armslist.com/posts/5459536,For Sale:  LN BENELLI M3 Super90 Pre-Ban,"Geneva, Northeast Ohio, Cleveland, Ohio","$ 1,300","Listed On: Sunday, May 22, 2016",Shotguns,Benelli                                                                                ,12 Gauge                                                                                ,Semi-automatic                                                                                ,Shotgun,"This was purchased in Europe in 1994, Benelli M3 Super90 Pre-Ban combat shotgun with factory tube extension 7 plus 1. LN test fired 7 shells. Semi-Auto & Pump combined. Has been in climate contolled storage since. Beautiful Shotgun (Pre-Ban hard to come by)!  Valid Ohio Drivers licsence required. Will ship to your FFL for additional fee. Price is for one. I have two of these if interested. Call or Text Gary REDACTED"
538,http://www.armslist.com/posts/5459538,For Sale:  Japanese 7mm Ariska,"Punta gorda, South West Florida, Florida",$ 300,"Listed On: Sunday, May 8, 2016",Rifles,no type,no type,Bolt Action                                                                                ,Rifle,I have a well preserved and customized Japanese 7mm ARISAKA already for scope WITH several boxes of NEW production ammo. Bore is straight and gun looks great! Ammo alone costs $100.00. Will take $300.00 for all. Call jay REDACTED.
539,http://www.armslist.com/posts/5459539,For Sale/Trade:  BUSHMASTER AR 15,"SALEM AREA, Salem, Oregon",$ 700,"Listed On: Tuesday, May 24, 2016",Rifles,Bushmaster                                                                                ,5.56×45mm NATO                                                                                ,Semi-automatic                                                                                ,Rifle,"BUSHMASTER AR 15 XM15E2S. IN EXCELLENT CONDITION. VERY ACCURATE RIFLE. 556x45 NATO. CHROME LINED BARREL. ATI GRIP, MAGPUL STOCK. COMES WITH TWO HUNDRED ROUNDS OF AMMO. FEDERAL BRASS AND FOUR POLYMER MAGS. $700.00 FIRM,"
540,http://www.armslist.com/posts/5459540,Want To Buy:  looking for AR mags,"fenton, St. Louis, Missouri",Offer,"Listed On: Sunday, May 8, 2016",Magazines,no type,no type,no type,no type,"I'll try to save both of is time. I don't have the cash to spend $20-$30 on one mag.  To be honest I am looking for a deal, someone with a bunch of mags just looking to get rid of them. If you're that person shoot me a line."
541,http://www.armslist.com/posts/5459541,For Sale:  Glock 30s with night sights,"Palm harbor, Tampa/St. Pete, Florida",$ 500,"Listed On: Sunday, May 8, 2016",Handguns,Glock                                                                                ,45 ACP                                                                                ,Single Action                                                                                ,Pistol,"very good cond, has night sights, 2 mags and hard case. Also have a alien gear holster for left handers call or text REDACTED"
542,http://www.armslist.com/posts/5459542,For Trade:  S&W 629 Mountain Gun,"Southern middle Tennessee, Nashville, Tennessee",Offer,"Listed On: Sunday, May 8, 2016",Handguns,Smith & Wesson                                                                                ,44 Magnum                                                                                ,Double / Single Action                                                                                ,Revolver,"Looking for handgun trade offers on my Smith and Wesson 44 magnum. This is a hard to find model 629-4 Mountain Gun. (only 5000 made) 4 inch tapered barrel, chamfered cylinder and round butt. Wears custom wood finger groove grips from a Smith and Wesson model 329PD. Solid revolver, prelock with hammer mounted firing pin, stainless steel, tight lockup, excellent bore with adjustable target rear sights. Comes with a full box of Blazer 240 grain HP ammo (50 rds)No emails pleaseREDACTEDTennessee residents only with carry permit   NOTE: I will be in Nashville Monday evening through Wednesday midday if you want to inspect"
543,http://www.armslist.com/posts/5459543,For Sale/Trade:  KelTec sub2000,"Madison, Huntsville, Alabama",$ 425,"Listed On: Friday, May 27, 2016",Rifles,Kel-Tec                                                                                ,no type,Semi-automatic                                                                                ,Rifle,"KelTec sub 2000.  9mm, uses Beretta magazines.  Used with a few scuffs and in perfect working condition.  Comes with magazine pictured(holds 19 rounds).  Located in SE Madison.i prefer to trade but would sell for $425.  Or best offer."
544,http://www.armslist.com/posts/5459544,"For Sale/Trade:  Walther PPQ M2 9mm 5"" Barrel","apopka, Orlando, Florida",$ 0,"Listed On: Sunday, May 8, 2016",Handguns,Walther                                                                                ,9mm Luger (9x19)                                                                                ,Striker Fire,no type,"'LIKE NEW' Walther PPQ M2 9mm extended slide (less than 50 rds. through pistol), chambered in 9mm. 5 Inch Barrel MFG #2796091 - Comes with everything new in box. Interchangeable back straps (Small / Medium / Large), 2 15-round capacity magazines, original box & papers. Includes a low profile three-dot polymer combat sights. Ambidextrous magazine release button, ergonomic Walther grip, ambidextrous slide stop, front and rear slide serrations, excellent gun for daily carry, home defense or target shooting.Feel free to text me - REDACTEDFS: at $600.00 (I paid around $800.00 5 months ago) - open to 9mm trades - such as a Walther P99 AS (4""), H&K P30S or P30SK V3, H&K P2000 V3, Walther PPQ M2 4"" barrel, Smith & Wesson M&P9 (4.25"" barrel), open to good offers"
545,http://www.armslist.com/posts/5459545,For Sale:  Glock 43 LNIB w extras,"Lexington, Lexington, Kentucky",$ 500,"Listed On: Sunday, May 8, 2016",Handguns,Glock                                                                                ,9mm Luger (9x19)                                                                                ,Striker Fire                                                                                ,Pistol,"Glock 43 great condition, 3 mags all w pinky extensions, one has +2 (have reg base plates too), as well as Ghost trigger connector providing a smooth and crisp trigger. Factory case and papers."
546,http://www.armslist.com/posts/5459546,For Sale:  AR15 rifle,"Sevierville, Knoxville, Tennessee",$ 600,"Listed On: Sunday, May 8, 2016",Rifles,Spikes Tactical                                                                                ,223/5.56 NATO                                                                                ,Semi-automatic                                                                                ,Rifle,"For sale, custom AR15.  Spikes tactical flat top upper/with 16 inch diamond fluted barrel 1 in 9 twist 5.56 Nato.  Nickel boron BCG. Added YHM flip up front sight gas block. Anderson lower with DPMS internals and magpul furniture in FDE.  Rear flip up Magpul Gen II sight in FDE  and 30 round Hexmag inlcuded. This rifle is ready to go.  Thanks."
547,http://www.armslist.com/posts/5459547,For Sale:  Remington 1148 semi auto,"Hayes, Hampton Roads, Virginia",$ 275,"Listed On: Tuesday, May 17, 2016",Shotguns,no type,12 Gauge                                                                                ,Semi-automatic                                                                                ,Shotgun,Have a very nice Remington 1148 semi auto 12 gauge. 30 inch barrel. Very nice shape
550,http://www.armslist.com/posts/5459550,For Sale:  .458 bullets,"Redmond, Bend, Oregon",$ 30,"Listed On: Sunday, May 8, 2016",Reloading,no type,no type,no type,no type,"Barnes Original .458 400 grain Flat Nose Cannelured 45-70 bullets4 boxes of 50, $30 each"
