,url,title,location,price,post date,category,manufacturer,caliber,action,firearm type,postcontent
741,http://www.armslist.com/posts/5708741,For Sale:  Aimpoint Comp M4 M68 CCO NSN 1240-01-540-3690,"St Petersburg, Tampa/St. Pete, Florida",$ 599,"Listed On: Friday, July 22, 2016",Optics,no type,no type,no type,no type,Aimpoint Comp M4 M68 CCO NSN 1240-01-540-3690 2MOA scope like new excellent condition
742,http://www.armslist.com/posts/5708742,For Sale:  Lee Enfield Accessories. UPDATED,"edmond, Oklahoma City, Oklahoma","$ 123,456,789","Listed On: Sunday, October 16, 2016",Rifles,Century International Arms                                                                                ,303 British                                                                                ,Bolt Action                                                                                ,Rifle,"A few accessories for the Enfield rifle. Send for current list, thanks."
744,http://www.armslist.com/posts/5708744,For Sale:  WINCHESTER WRANGLER 1894 44 MAGNUM,"bartlett, Memphis, Tennessee",$ 650,"Listed On: Friday, July 22, 2016",Rifles,Winchester                                                                                ,44 Magnum                                                                                ,Lever Action                                                                                ,Rifle,"Winchester wrangler 1894 16'' SRC Big lever 44 mag in excellent shape,walnut stock. 650.00 Call or text  REDACTED"
745,http://www.armslist.com/posts/5708745,For Sale:  $350,"NW, Wichita, Kansas",$ 350,"Listed On: Friday, July 22, 2016",Handguns,Smith & Wesson                                                                                ,no type,Double / Single Action                                                                                ,Pistol,"New, never fired S&W M&P Shield, 40 cal. Comes with Kydex holster and two mags. This model does not have the thumb safety. Great conceal carry weapon."
746,http://www.armslist.com/posts/5708746,For Sale:  Springfield Armory XD 40 Tactical 5 inch,"Cottage Grove, Minneapolis / St. Paul, Minnesota",$ 375,"Listed On: Friday, July 22, 2016",Handguns,Springfield                                                                                ,40 S&W                                                                                ,Striker Fire                                                                                ,Pistol,"Selling this for a friend who's daughter has having some serious medical bills and is looking to offset the cost any way she can. This posting is for a SAI XD40 Tactical in 5-inch. Comes with the gear kit, 2 mags, plus a ProMag extended 20 round magazine as well. Round count is less than 200 but it was an EDC. Email for more questions or pictures."
747,http://www.armslist.com/posts/5708747,For Sale:  Savage A17,"Wichita, Wichita, Kansas",$ 450,"Listed On: Wednesday, September 21, 2016",Rifles,Savage Arms                                                                                ,17 HMR                                                                                ,Semi-automatic                                                                                ,Rifle,"New Savage Arms A17 .17HMR semi auto rifle. Has the AccuTrigger and delayed blowback system. 10rd rotary mag, 22 inch blued barrel and a Nikko Stirling 4X32 AO scope.Will include 1 box of CCI .17hmr ammo with purchase.Price includes tax"
749,http://www.armslist.com/posts/5708749,For Sale:  New Hi-Point Fire Arms JCP 40  S&W,"Lexington, Lexington, Kentucky",$ 186,"Listed On: Monday, November 7, 2016",Handguns,Hi Point                                                                                ,40 S&W                                                                                ,Double Action                                                                                ,Pistol,"Hi-Point offers affordably-priced semi-automatic handguns in a range of the most popular calibers. The model JCP .40 S&W Hi-Point pistol is built on a larger frame to assure a firm, comfortable grip and exceptional recoil control. Its polymer frame has been given a durable, attractive easy-grip finish and includes high-impact grips. All Hi-Point pistols features last round lock open and 3-dot, fully adjustable sights. Other extras on the Model JCP include a quick on-off thumb safety and a free extra rear peep sight and trigger lock. 100% American-made, parts and assembly.  Contact us at Dan's in Richmond at REDACTED today!"
750,http://www.armslist.com/posts/5708750,For Sale:  Walther PPX 9MM,"Tampa, Tampa/St. Pete, Florida",$ 275,"Listed On: Friday, July 22, 2016",Handguns,Walther                                                                                ,9mm Luger (9x19)                                                                                ,Double / Single Action                                                                                ,Pistol,Walther PPX Original Case2 16 Round MagazinesGun Lock
751,http://www.armslist.com/posts/5708751,For Sale:  S&W 629-5 Power-port,"Richmond, Lexington, Kentucky",$ 750,"Listed On: Friday, July 22, 2016",Handguns,Smith & Wesson                                                                                ,44 Magnum                                                                                ,Double / Single Action                                                                                ,Revolver,"Nice 629-5 ,44 mag in great condition,6 1/2 inch ported barrel,smith called them power-port,6 shot,adjustable sights. Call REDACTED"
752,http://www.armslist.com/posts/5708752,For Sale/Trade:  1000 rounds of .22 ammunition for trade for subsonic .22,"Gray, Tri-cities, Tennessee",$ 75,"Listed On: Wednesday, July 27, 2016",Ammo,no type,no type,no type,no type,"I have about 1,000 rds of high velocity .22 I want to trade for either American Eagle Suppressor or CCI standard velocity (1070fps). Straight up rd for rd.  Looking for subsonic .22 only or I just sell the lot for 75 bucks."
753,http://www.armslist.com/posts/5708753,"For Sale:  Glock G40 10mm 6"" with extras","Chandler, Phoenix, Arizona",$ 750,"Listed On: Friday, July 22, 2016",Handguns,Glock                                                                                ,no type,Striker Fire                                                                                ,Pistol,"This is a glock G40 MOS 6"" barrel 10mm.  It's only had about 150 rounds through it, imaculatly clean.  comes with box, 3 mags, mos adapter plates (unopened) never had an optic mounted.  Comes with about 200 rounds of factory new 10mm rounds.  Custom OWB Kydex, light bearing (tlr1, light not included) holster done in Kryptek Highlander"
756,http://www.armslist.com/posts/5708756,For Trade:  1961 baseball cards,"chillicothe, Columbus, Ohio",Offer,"Listed On: Friday, July 22, 2016",Miscellaneous,no type,no type,no type,no type,"Downsizing my collection.   I have 115 1961 baseball cards, all in soft sleeve and hard sleeve card protectors.   Mostly commons and some have doubles.   Retail is a little over $500.   But that's retail.   Looking to trade for some ammo.    12ga, 20ga, 223/556, 9mm, 44, 45, 7.62x39."
759,http://www.armslist.com/posts/5708759,For Sale:  beretta 3032,"woodridge il., Illinois, United States",$ 425,"Listed On: Saturday, October 29, 2016",Handguns,Beretta USA                                                                                ,32 ACP                                                                                ,Double / Single Action                                                                                ,Pistol,beretta 32 auto tomcat mod. 3032 excellent condition $  425.00
760,http://www.armslist.com/posts/5708760,For Sale:  Ar_15,"Jeffersontown, Louisville, Kentucky","$ 1,200","Listed On: Friday, July 22, 2016",Rifles,no type,223/5.56 NATO                                                                                ,Semi-automatic                                                                                ,Rifle,I am selling my Ar-15 for 1200.00 OBO.223 and .556 It has a green and red optical sightFlip up front and rear sightsMag tactical lowerMagpul zombie camo furnitureOnly has been shot one time with maybe 50 roundsNO TRADES CASH ONLY!!Only reason for selling it is because I never use it.Call or txt me at REDACTED
761,http://www.armslist.com/posts/5708761,For Sale/Trade:  Springfield 1911 A1 Mil-Spec,"Junction City/ Wichita, Wichita, Kansas",$ 600,"Listed On: Friday, July 22, 2016",Handguns,Springfield                                                                                ,45 ACP                                                                                ,Single Action                                                                                ,Pistol,"I have a Springfield 1911 Mil-Spec A1 with 3 mags, all the original holster that come with it and a IWB Galco holster. I am looking for trades or 600 hundred for it."
762,http://www.armslist.com/posts/5708762,For Trade:  Garrett Turbo,"Lincoln county, St. Louis, Missouri",Offer,"Listed On: Sunday, July 31, 2016",Miscellaneous,no type,no type,no type,no type,"72mm Garrett t6 turbo 5"" v band downpipe adapter 50mm bovNo shaft play"
763,http://www.armslist.com/posts/5708763,For Sale:  Benelli Montefeltro-12 gauge left hand semi auto,"Jacksonville, Jacksonville, North Carolina",$ 700,"Listed On: Friday, July 22, 2016",Shotguns,no type,no type,no type,Shotgun,"This Benelli Montefeltro 12 gauge semi-automatic shotgun is left hand friendly. It has a 28"" barrel and 14 1/4 length of pull. I am selling this fine firearm for the widow of one of our gun club members. It was purchased last year and his illness prevented him from shooting it very much. It is in excellent condition and comes with three extended choke tubes-cylinder, skeet and improved cylinder. Please email any questions. No trades."
764,http://www.armslist.com/posts/5708764,For Sale:  Glock 17 mos+rmr+aac threaded barrel+tlr,"Jax beach, Jacksonville, Florida","$ 1,200","Listed On: Friday, July 22, 2016",Handguns,no type,no type,no type,no type,"*Jacksonville beach* For sale only. Glock 17 MOS, rmr, alg mag well, aac threaded barrel, pmag floor plates, tlr light, original barrel, all original glock accessories that came in the case, never fired a round through the gun, barrel or sight. Asking $1200 or $700-800 plus a trade.REDACTED"
766,http://www.armslist.com/posts/5708766,For Sale:  Gen 3 glock 21,"Lewis center, Columbus, Ohio",$ 450,"Listed On: Wednesday, August 24, 2016",Handguns,Glock                                                                                ,45 ACP                                                                                ,Double Action                                                                                ,Pistol,Gen 3 glock 21 trijicon night sights about 250 rounds  through. Comes with case and two 13 round magazines.
768,http://www.armslist.com/posts/5708768,For Sale:  Ramshot Competition Powder,"Lake county, Chicago, Illinois",$ 175,"Listed On: Saturday, October 29, 2016",Reloading,no type,no type,no type,no type,"I have an extra 8lbs Ramshot Competition powder for sale. No shipping, local transaction only."
769,http://www.armslist.com/posts/5708769,For Sale/Trade:  ROSSI-357-MAGNUM-LIKE NEW,"HENDERSONVILLE, Asheville, North Carolina",$ 420,"Listed On: Friday, July 22, 2016",Handguns,Rossi-Braztech                                                                                ,357 Magnum                                                                                ,Double / Single Action                                                                                ,Revolver,"I HAVE A ROSSI M-971--357-MAGNUM--4-INCH--FULL UNDERLUG-DEEP BLUE FINISH--NO WEAR MARKS--PERFECT FACTORY WOOD GRIPS--ADJUSTABLE SIGHTS-UP AND DOWN AND LEFT AND RIGHT. TIGHT LOCK UP--SAFE QUEEN. GUN HAS 50 ROUNDS THRU IT OF 38.SPECIAL.     NEVER FIRED 38.SPECIAL + P--OR 357.MAGNUM.  BUT IT IS RATED FOR ALL THREE. GUN WAS PROFESONALLY CLEANED  7/21/16 INSIDE AND OUT. THAT WAS $ 60.00.---I HAVE A BOX OF NEW 38.SPECIAL-158.GRAIN-FULL METAL JACKETS TO GO WITH IT.  $ 420.00--O.B.0.   REDACTED. THE CONDITION OF THIS GUN IS UNBELIEVEABLE. IT IS AS NEW. 50 ROUNDS THRU IT YEARS AGO AND THEN IN THE SAFE, LIKE I SAID PRO CLEANED THURSDAY. HOW MANY GUNS RUN 3 TYPES OF AMMO? 38.SPECIAL-38.SPECIAL + P--357 MAGNUM."
771,http://www.armslist.com/posts/5708771,For Sale:  Ruger GP100 Wiley Clapp,"Spartanburg, Greenville, South Carolina",$ 700,"Listed On: Friday, July 22, 2016",Handguns,Ruger                                                                                ,357 Magnum                                                                                ,Double / Single Action                                                                                ,Revolver,"Ruger GP100 WIley Clapp model chambered in 357 and holds 6 rounds.  Has 3 inch barrel, satin stainless steel finish, wood and rubber grips, and is the only Wiley Clapp model not blued.  Only 2500 were supposed to be made, 4600 actually produced.  Has factory box with label matching the serial number.  It is un-fired.  Original retail was 829.00. Asking 700.00, and will require a completed bill of sale from both buyer and myself which I will keep for my records.  Located in Spartanburg.  Very hard to find model, unless someone is selling their used one."
772,http://www.armslist.com/posts/5708772,For Sale:  RCBS ChargeMaster 1500 electronic dispenser and scale,"Wichita, Wichita, Kansas",$ 200,"Listed On: Friday, July 22, 2016",Reloading,no type,no type,no type,no type,"Not reloading at the volume I have been at the past, so Its time to clear off the bench. Works perfect, kept indoors, comes with base weights, pan, owner's manual and power supply. These are $300+ new, asking $200obo"
773,http://www.armslist.com/posts/5708773,For Sale:  Hogue AR-15 grip,"town of Menasha, Appleton, Wisconsin",$ 10,"Listed On: Tuesday, August 9, 2016",Gun,no type,no type,no type,no type,"Marked with ""MEGA""  New, never used"
774,http://www.armslist.com/posts/5708774,For Sale:  Springfield XD9 Subcompact,"Cottage Grove, Minneapolis / St. Paul, Minnesota",$ 350,"Listed On: Friday, July 22, 2016",Handguns,Springfield                                                                                ,9mm Luger (9x19)                                                                                ,Striker Fire                                                                                ,Pistol,"Selling this for a friend who's daughter has having some serious medical bills and is looking to offset the cost any way she can. This posting is for a SAI XD9 SubCompact in 3.3-inch. Comes with the gear kit, 2 mags. Round count is less than 100. As I understand it, it lived life as a safe queen. Email for more questions or pictures."
775,http://www.armslist.com/posts/5708775,For Sale:  10/22 stainless,"Huntsville, Fayetteville, Arkansas",$ 240,"Listed On: Friday, July 22, 2016",Rifles,Ruger                                                                                ,22 Long Rifle                                                                                ,Semi-automatic                                                                                ,Rifle,a little older with metal trigger group. Has black synthetic ram line style stock (not sure of brand). Firm price.
777,http://www.armslist.com/posts/5708777,"For Sale:  ARmalite Awesome, SPR Mod1 Wylde","North County, San Diego, California","$ 1,299","Listed On: Saturday, July 30, 2016",Rifles,Armalite                                                                                ,5.56×45mm NATO                                                                                ,Semi-automatic                                                                                ,Rifle,"Go with original, go with ARmalite !This SPR Mod1 Armalite has:20"" Wylde heavy barrel for supreme accuracy.  This AR is a 10 shot-in-same-hole sort of AR.  See the photos...  that's my thumb in the picture.Two stage triggerHarris Bi-PodFixed stockNikon M223 BDC Scope.  If you use typical 223 ammo and this scope is dialed for you all the way out.  Otherwise, you can use the Nikon app to re-calculate the drop points easy.Seen only about 700 rounds through and cleaned after every trip so this AR is still just getting warmed up !Sale comes with extra mag, about 100 rounds of ammo, and the tactical case (if you want it)Call or text REDACTEDPrefer meet at Ambrose Armory (San Marcos) or San Diego Firearms Training (Poway).Buyer pays PPT cost (usually $35)"
778,http://www.armslist.com/posts/5708778,For Sale:  Kimber1911 custom I I 2 tone,"Grove city, Columbus, Ohio",$ 500,"Listed On: Friday, July 22, 2016",Handguns,Kimber                                                                                ,45 ACP                                                                                ,Double / Single Action                                                                                ,Pistol,Very nice only 3 months old kimber 1911 .45 and not even 50 rounds through it. Comes with the open box of 25 rounds or so of .45 ammo that hasn't been shot of that box of 50
779,http://www.armslist.com/posts/5708779,For Sale:  Bear Strike bow,"Town of Menasha, Appleton, Wisconsin",$ 100,"Listed On: Friday, July 22, 2016",Archery,no type,no type,no type,no type,"Very nice shape, comes with arrows, lighted nocks, quiver, and padded case."
781,http://www.armslist.com/posts/5708781,For Sale:  2200 Rds 22LR - CCI Mini-Mag and Rem Golden Bullet,"Fayetteville, Fayetteville, North Carolina",$ 125,"Listed On: Friday, July 22, 2016",Ammo,no type,no type,no type,no type,"Selling some excess 22LR ammo. I have the following for sale as a group only. FTF in Fayetteville, no shipping. 1) 800 rds (8 boxes) CCI Mini Mag 40gr CPRN 22LR2) 200 rds (2 boxes) CCI Mini Mag 36gr HP 22LR3) Approx 1200 rds Remington Golden Bullet (bucket comes with 1400 rds, Ive shot approx 200)"
783,http://www.armslist.com/posts/5708783,For Sale:  Taurus PT92,"West, Wichita, Kansas",$ 400,"Listed On: Friday, July 22, 2016",Handguns,Taurus                                                                                ,9mm Luger (9x19)                                                                                ,Double / Single Action                                                                                ,Pistol,"Extremely low round count PT92 in 9mm. Comes with hard case, two magazines, all paperwork and a lock. Very nice gun. Might be open to potential trades but no junk please."
785,http://www.armslist.com/posts/5708785,For Sale:  Brand new Remington Synthetic varmit  stock,"Rosemont/ park ridge, Chicago, Illinois",$ 20,"Listed On: Friday, December 1, 2017",Gun,no type,no type,no type,no type,Brand new.. has 2 swivel studs. For short action...20 bucks. REDACTED or email my will ship with paypal for extra fee
786,http://www.armslist.com/posts/5708786,For Sale:  Valentine One Radar Detector,"Fountain Inn, Greenville, South Carolina",$ 300,"Listed On: Wednesday, July 27, 2016",Miscellaneous,no type,no type,no type,no type,Slightly used Valentine One Radar Detector in box with manual and all accessoriesNot interested in trades
787,http://www.armslist.com/posts/5708787,For Sale/Trade:  Saiga 12 AK 12 gauge tactical shotgun,"Close to I65 exit 22, Bowling Green, Kentucky",$ 750,"Listed On: Friday, July 22, 2016",Shotguns,Saiga                                                                                ,12 Gauge                                                                                ,Semi-automatic                                                                                ,Shotgun,"This beast of a shotgun is in excellent condition. Semi auto and made in Russia.  Comes with a quad rail, adjustable gas block, front grip, muzzle break with door breacher, 5 round magazine and a few boxes of ammo. $750 obo. Text for quickest response.  REDACTED"
788,http://www.armslist.com/posts/5708788,Want To Buy:  remington 11-48,"Jefferson city, Missouri, United States",$ 100,"Listed On: Sunday, July 31, 2016",Shotguns,Remington                                                                                ,410                                                                                ,Semi-automatic                                                                                ,Shotgun,Would like to find a nice Remington 11-48 410 or 28.  It is best to contact me by e mail as I am a bit hard of hearing but I would give it a try @ REDACTED land line.
791,http://www.armslist.com/posts/5708791,For Sale:  LIKE NEW - Remington 870 Super Magnum 12 GA - 28in Ribbed Barrel - Adustble Choke,"Oldsmar, Tampa/St. Pete, Florida",$ 350,"Listed On: Monday, March 27, 2017",Shotguns,Remington                                                                                ,12 Gauge                                                                                ,Pump Action                                                                                ,Shotgun,LIKE NEW Remington 870 Super Mag 12 GA 28in Ribbed Barrel Adustble Chokeaccepts 2-3/4 inch shells - 3 inch shells - 3-1/2 inch shellsbead front sightLIKE NEW Condition
792,http://www.armslist.com/posts/5708792,For Sale:  Browning 20 gauge shotgun,"North Akron, Akron, Ohio",$ 550,"Listed On: Friday, July 22, 2016",Shotguns,Browning                                                                                ,20 Gauge                                                                                ,Semi-automatic                                                                                ,Shotgun,Browning 20 gauge shotgun great condition 6 bullets already loaded and I have one extra .
793,http://www.armslist.com/posts/5708793,For Sale:  AR 15 Parts,"Va Beach, Hampton Roads, Virginia",FREE,"Listed On: Wednesday, July 27, 2016",Gun,no type,no type,no type,no type,"-A2 front sight post with carbine length gas tube. The roll pin is jacked up so you'll need a new one. No taper pins, sight post or spring/detent $25-Low profile gas block with carbine length gas tube. $20-Resistance Armament AR15 .223/5.56 Chubby Motherf*cking Flash Can Concussion Linear Brake. It's scratched up. $20-Surefire 2 piece carbine length quad rail. I hit it with a coat of high temp engine paint. $15-Mission First Tactical Minimalist Stock. (Commercial) $25-UTG 3 slot, 1"" riser. $10-UTG 13 slot, 1/2"" riser $10**All items are used. The 2 risers are in really good shape. FTF in/around Va Beach. Thank you for looking.Interests:-cash-223 ammo-9mm ammo-Glock 15 round 9mm mags"
796,http://www.armslist.com/posts/5708796,For Sale:  Raptor Slide for Glock 19,"Columbus, Columbus, Ohio",$ 275,"Listed On: Wednesday, July 27, 2016",Gun,no type,no type,no type,no type,"Slide & sights only.Glock Store Performance Center custom slide for any generation Glock 19, known as the Raptor Slide, in FDE finish.  Including in the offer is a set of TRUGLO sights, red front & green rear. For the Glock Store Performance Center to cut your slide costs $325, to purchase a new slide, cut as a Raptor Slide is $499.This is a used slide, I got it as part of a ""tricked out"" Glock 19 that I purchased.  There is some wear on the left rear of the slide, I assume from it being carried.  This is a stripped slide, no internal parts.  Only the slide and sights.This slide makes one good looking Glock, perfect for adding any accessory that you want.Slide and sights, $275 cash.  Transacted FTF in Columbus, OH.+$15 insured shippingNo trades"
798,http://www.armslist.com/posts/5708798,For Sale:  S&W M&P 9c,"New Bedford, Massachusetts, United States",$ 400,"Listed On: Friday, July 22, 2016",Handguns,Smith & Wesson                                                                                ,9mm Luger (9x19)                                                                                ,Striker Fire                                                                                ,Pistol,-Like new S&W M&P 9c -About 50 rounds put through it (I cleaned it after I used it) -Been sitting in my safe in carry case for a couple of months -Sale includes M&P 9c & 2-10 round magazines (one with pinky extension)
799,http://www.armslist.com/posts/5708799,For Sale:  Kahr ct9,"Wyandotte, Detroit, Michigan",$ 300,"Listed On: Friday, July 22, 2016",Handguns,Kahr                                                                                ,9mm Luger (9x19)                                                                                ,Striker Fire                                                                                ,Pistol,"Selling my kahr ct9,purchased on 7/7/2016. Has three 8 round magazines and hard case. Only has 35 rounds through it. Just too small for me. Will show recite for sale date. Price is firm,.. hope she finds a good home."
801,http://www.armslist.com/posts/5708801,For Sale/Trade:  Converted Saiga 556,"Central, Little Rock, Arkansas",$ 0,"Listed On: Friday, July 22, 2016",Rifles,Saiga                                                                                ,223/5.56 NATO                                                                                ,Semi-automatic                                                                                ,Rifle,"Saiga 223/556, converted to pistol grip. Excellent condition. Takes circle 10 clear magazines"
