,url,title,location,price,post date,category,manufacturer,caliber,action,firearm type,postcontent
227,http://www.armslist.com/posts/5459227,For Sale:  colt 6920,"south, Green Bay, Wisconsin",$ 950,"Listed On: Sunday, May 8, 2016",Rifles,Colt                                                                                ,5.56×45mm NATO                                                                                ,Semi-automatic                                                                                ,Rifle,colt 6920 for sale magpul grip and ctr stock also has a quad rail with rubber handguards like new has masybe 300-400 rds through it also have a weatherby pa-459 tactical shotgun with sling ext tube feed asking 300$ obo         will send pics on request REDACTED
228,http://www.armslist.com/posts/5459228,For Sale:  Holsters,"Albany, Corvallis / Albany, Oregon",$ 25,"Listed On: Sunday, May 8, 2016",Holsters,no type,no type,no type,no type,Custom holsters
229,http://www.armslist.com/posts/5459229,For Sale:  keltec p11,"fresno, Fresno, California",$ 560,"Listed On: Sunday, May 8, 2016",Handguns,Kel-Tec                                                                                ,9mm Luger (9x19)                                                                                ,Double / Single Action                                                                                ,Pistol,"hello, im a democrat and like to take advantage of you by selling you a 280 dollar gun for 560. I hate you! buy my gun!"
231,http://www.armslist.com/posts/5459231,For Sale:  Taurus tcp 380,"Arlington, Jacksonville, Florida",FREE,"Listed On: Sunday, May 8, 2016",Handguns,no type,380 ACP                                                                                ,no type,Pistol,Looking for a Taurus tcp 380 email me if you have one you want to either trade
232,http://www.armslist.com/posts/5459232,For Sale:  LIKE NEW  GLOCK 22 GEN 3 .40 S&W,"sherman oaks, Los Angeles, California",$ 500,"Listed On: Sunday, May 8, 2016",Handguns,Glock                                                                                ,40 S&W                                                                                ,Striker Fire                                                                                ,Pistol,"LIKE NW CONDITION GEN 3 GLOCK 22 .40 CAL PISTOL FOR SALE.  COMES WITH 2 10 RD FACTORY MAGS, FACTORY SPEED LOADER, CABLE LOCK AND NON-ORIGINAL CASE. $500.00 OBO. CLEANEST ONE YOU CAN FIND.   100 RDS SHOT THRU IT LAST SUNDAY AND WORKS FLAWLESSLY AND JUST CLEANED.  MUST HAVE TRANSFERED LEGALLY AT FFL.  PREFERABLE AT TURNERS IN RESEDA OR PASADENA.  MUST BRING FIREARM SAFETY CARD AND 2 FORMS OF ID.  POSSIBLE TRADES WELCOME BUT LOOKING FOR CASH."
233,http://www.armslist.com/posts/5459233,For Sale:  GSG-522 MP5 Clone,"Jim Thorpe, Allentown, Pennsylvania",$ 330,"Listed On: Sunday, May 8, 2016",Rifles,American Tactical Imports                                                                                ,22 Long Rifle                                                                                ,Semi-automatic                                                                                ,Rifle,"Sellijg my GSG-522 MP5 clone. This thing is a lot of fun. Unfortunately, I really need the money right now. I've put about 200 rounds through it. I just bought it. It's an MP5 clone so it's probably one of the most customizable guns on the market. It's a .22LR high velocity. Somewhat flexible on the price as I need it gone ASAP. Thanks!"
234,http://www.armslist.com/posts/5459234,For Sale:  Walther CCP 9mm,"Jackson, Michigan, United States",$ 425,"Listed On: Sunday, May 8, 2016",Handguns,no type,9mm Luger (9x19)                                                                                ,Striker Fire                                                                                ,Pistol,Selling my Walther CCP 9mm.  I am selling gun with all factory accessories and one extra mag for a total of three mags.  Gun has less than 300 rounds through it no issues so far.  I am selling this to fund another project.
235,http://www.armslist.com/posts/5459235,For Sale:  Contico hard case.,"Anderson, Anderson, Indiana",$ 30,"Listed On: Sunday, May 8, 2016",Tactical,no type,no type,no type,no type,Contico hard case. May fit 2 rifles or shotguns. Good shape.
236,http://www.armslist.com/posts/5459236,"For Sale:  Ruger GP100 4"" .357","St Charles, St. Louis, Missouri",$ 525,"Listed On: Sunday, May 8, 2016",Handguns,Ruger                                                                                ,357 Magnum                                                                                ,Double / Single Action                                                                                ,Revolver,Excellent condition. Comes with factory case/papers.NO TRADES PLEASE 636 734 565three
237,http://www.armslist.com/posts/5459237,For Sale:  Strike Eagle 1-6x,"Walla Walla, Tri-Cities, Washington",$ 330,"Listed On: Sunday, May 8, 2016",Optics,no type,no type,no type,no type,New in box Vortex Strike Eagle 1-6 power scope.
238,http://www.armslist.com/posts/5459238,For Sale:  Taurus PT111 G2 9mm,"St Charles, St. Louis, Missouri",$ 250,"Listed On: Sunday, May 8, 2016",Handguns,Taurus                                                                                ,9mm Luger (9x19)                                                                                ,Double Action                                                                                ,Pistol,"New in box. Comes with factory box, 2 mags, papers.NO TRADES PLEASE 636 734 565three"
239,http://www.armslist.com/posts/5459239,For Sale:  FEG AMD-65 AK 7.62x39,"South, Lincoln, Nebraska",$ 650,"Listed On: Sunday, May 8, 2016",Rifles,no type,7.62x39                                                                                ,Semi-automatic                                                                                ,Rifle,This is an original TGI import of a REAL AMD65. Barrel and recivier are FEG of Hungary and this is not a USA made clone. In great condition and less than 100 rounds through the gun. Original owner. Cash only.
241,http://www.armslist.com/posts/5459241,Want To Buy:  Springfield MC Operator,"Midwest City, Oklahoma City, Oklahoma",Offer,"Listed On: Sunday, May 29, 2016",Handguns,Springfield                                                                                ,45 ACP                                                                                ,Single Action                                                                                ,Pistol,"Hey guys, today I am looking for a brand new in the box Springfield MC Operator. Have cash and or trades ready. Please message me through here if you have one, and I will reply with my phone number if we can make a deal. Must be able to meet me in Midwest city. Thanks!"
242,http://www.armslist.com/posts/5459242,For Sale/Trade:  colt mustang pocketlite,"kitsap, Bremerton, Washington",$ 600,"Listed On: Tuesday, July 12, 2016",Handguns,Colt                                                                                ,380 ACP                                                                                ,Single Action                                                                                ,Pistol,"in new condition colt mustang pocket lite. aluminum alloy frame, steel slide.  comes with 2 colt flush fit mags, . also colt red lazer, great little gun"
244,http://www.armslist.com/posts/5459244,Want To Buy:  Looking to buy used guns,"East, Wichita, Kansas",Offer,"Listed On: Sunday, May 8, 2016",Handguns,no type,no type,no type,no type,Let me know what you have looking for good dealsREDACTED
245,http://www.armslist.com/posts/5459245,For Sale:  Mossberg 835 12g,"Hattiesburg, Hattiesburg, Mississippi",$ 200,"Listed On: Sunday, May 8, 2016",Shotguns,Mossberg                                                                                ,12 Gauge                                                                                ,Pump Action                                                                                ,Shotgun,"For sale is a Mossberg 835 12g with wood stock. I dont know anything about shotguns, what you see is what you get. I am looking for BEST OFFER and a quick cash sale face to face in Hattiesburg area. Email me if you need anymore photos.."
246,http://www.armslist.com/posts/5459246,For Sale:  Molot Russian Vepr 5.56x45,"south, Lincoln, Nebraska",$ 650,"Listed On: Sunday, May 8, 2016",Rifles,no type,5.56×45mm NATO                                                                                ,no type,Rifle,"Here is a great condition Vepr that has not been fired much. 5.56 caliber also shoots .223. 20 inch cold hammer forged barrel. Includes the original box, manual, original mags,  an extra Bulgarian Circle 10 30 round mag, and a bullet guide that needs installed. Cash only."
252,http://www.armslist.com/posts/5459252,For Sale:  mossberg rifle,"beaver dam, Madison, Wisconsin",$ 400,"Listed On: Sunday, May 8, 2016",Rifles,Mossberg                                                                                ,30-06 Springfield                                                                                ,Bolt Action                                                                                ,Rifle,"Have a brand new in box mossberg bolt action rifle.it has wood stock, flutted barrel, removable muzzle break.has a base , but no scoop or rings. Want 400.00 obo. Plz text for pics.REDACTED."
254,http://www.armslist.com/posts/5459254,For Sale:  AK 47 New Wood Stock Set,"Merced, California, United States",$ 180,"Listed On: Sunday, May 8, 2016",Gun,no type,no type,no type,no type,I'm selling a Brand New Ak 47 Russian Red Wood Stock Set mabe by High Quality Timbersmith Company. Set comes with Screws and everything u need to for installation. If interested text or call me REDACTED
255,http://www.armslist.com/posts/5459255,For Sale:  Zastava PAP M85 5.56 with EXTRAS!,"south, Lincoln, Nebraska",$ 650,"Listed On: Sunday, May 8, 2016",Handguns,Century International Arms                                                                                ,no type,no type,Pistol,"This is a great condition handgun from Zastava of Serbia. Includes the original gun, manual, and purchase certificate. Also includes 10 authentic steel 30 round mags made in Serbia and the 1 original plastic mag it orginally came with. There is a Damage Industires muzzle projector installed instead of the thread cap."
257,http://www.armslist.com/posts/5459257,For Sale/Trade:  Springfield M1A SOCOM 16,"Renton, Seattle, Washington","$ 1,500","Listed On: Tuesday, June 14, 2016",Rifles,Springfield                                                                                ,308/7.62 NATO                                                                                ,Semi-automatic                                                                                ,Rifle,"Very good condition Springfield M1A SOCOM 16. 16"" Barrel. 308 battle rifle. Tritium front sight. Can include more magazines for the right trade. Springfield Lifetime Warranty.Comes with:20 round Springfield OEM magazineRenton FTF. I can cover the transfer fee."
259,http://www.armslist.com/posts/5459259,For Sale:  AR15,"northern side, Oklahoma, United States","$ 1,150","Listed On: Sunday, May 8, 2016",Rifles,Armalite                                                                                ,223/5.56 NATO                                                                                ,Semi-automatic                                                                                ,Rifle,"AR15 Anderson AM-15 lower, Split A upper receiver, Unique-ARs Chains free float Hand Guard, Low Pro gas block, 16"" inch 5.56 NATO 1/8 Twist barrel, Faux Silencer Surpressor, M16 BCG, Magpul MOE FDE Carbine Stock, Magpul FDE MOE Grip, milspec buffer tube with blackrain buffer, Ambi sling mount, windowed FDE PMAG. $1150 Cash/Trade, Enid OK.    FIREARMS TRADES ONLY.*"
260,http://www.armslist.com/posts/5459260,For Sale:  Factory Built AR pistol,"Terre Haute, Indianapolis, Indiana",$ 750,"Listed On: Sunday, May 8, 2016",Handguns,no type,no type,no type,no type,i have a like new only had out one time with a total of 30 rounds through it.I promise it will put a smile on your face.Palmetto AR pistol in 7.5 inch Multi caliber lower 556/223 Barrel Has the KAK blade buffer and brace set up with BaD lever Magpul trigger guard and mags plus a strik force charging handle and red marble Hogue rubber grip.The gun looks amazing and shoots even better.Plus a lot more that I have not listed.A steal at this price check it against others.text me at REDACTED
261,http://www.armslist.com/posts/5459261,For Sale:  Sub-compact 1911,"Vancouver, Southwest Washington, Washington",$ 500,"Listed On: Sunday, May 8, 2016",Handguns,Springfield                                                                                ,45 ACP                                                                                ,Double / Single Action                                                                                ,Pistol,I have a springfield sub-compact 1911. I bought myself a new compact pistol and I hardly use this gun anymore. I did have to put a custom front sights on it because the previous own did a horrible job with it. Comes with gun case and onoe magazine. Asking for $500 obo.
263,http://www.armslist.com/posts/5459263,For Sale:  XD-9 4.0 mod 2,"Naples, South West Florida, Florida",$ 520,"Listed On: Sunday, May 8, 2016",Handguns,no type,9mm Luger (9x19)                                                                                ,Striker Fire                                                                                ,Pistol,Gun is brand new. Has about 50 rounds shot threw it. No box just the gun and one 16 round double stacked mag. Great 9mm wish I could keep it but I need money sine summer is here. Would like 550 cash or best offer will negociate. Please contact me at REDACTED thank you.
264,http://www.armslist.com/posts/5459264,For Sale/Trade:  S&W Shield .40 for g26 or shield 9mm,"Corvallis, Corvallis / Albany, Oregon",$ 350,"Listed On: Saturday, May 28, 2016",Handguns,Smith & Wesson                                                                                ,40 S&W                                                                                ,Striker Fire                                                                                ,Pistol,"Wanting to trade my LNIB S&W Shield .40 for a glock 26 or a shield in 9mm.350 for the shield, 400 including ammo and several different styles of holsters, all IWB.Or straight across for the SW Shield 9mm"
268,http://www.armslist.com/posts/5459268,For Sale/Trade:  Ruger Lcp hogue grip,"port charlotte, South West Florida, Florida",$ 12,"Listed On: Monday, August 28, 2017",Gun,no type,no type,no type,no type,"New in box ruger lcp hogue grip for CRIMSON TRACE ordered it by mistake thinking it the regular one. Just want my $12 back or decent little trade, REDACTED thanks"
269,http://www.armslist.com/posts/5459269,For Sale:  Sig Sauer P238,"Humble/Atascocita, Houston, Texas",$ 550,"Listed On: Thursday, November 17, 2016",Handguns,Sig Sauer                                                                                ,380 ACP                                                                                ,Double / Single Action                                                                                ,Pistol,"Sig Sauer P238 Blackwood, 380 Auto, night sights, comes with case, paperwork and one Mag, Like New, call or text Bobby at REDACTED"
271,http://www.armslist.com/posts/5459271,"For Sale:  Spikes Spartan AR15 16""","Bricks, El Reno, Oklahoma",$ 750,"Listed On: Sunday, May 8, 2016",Rifles,Spikes Tactical                                                                                ,223/5.56 NATO                                                                                ,Semi-automatic                                                                                ,Rifle,"I have a spikes tactical Spartan build. Wanting to trade for a AK Variant, 1911, pt100, Ruger charger, 92fs or glock 19 great condition just as my rifle. Comes with a carry bag with 2 pockets for mags or anything you want to put in there (would like one to come with yours or keep mine) 2 mags 1Pmag and 1metal, about 50 rounds, sling and magpul pistol grip and foregrip, quad rails and covers and flip up rear sights. 750 OBO"
272,http://www.armslist.com/posts/5459272,For Sale/Trade:  S&W M&P 15-22 W/ magpul furniture,"Shattuck, Oklahoma, United States",$ 740,"Listed On: Friday, June 3, 2016",Rifles,Smith & Wesson                                                                                ,22 Long Rifle                                                                                ,Semi-automatic                                                                                ,Rifle,Looking for a good mosin or a pistol in 9mm OBO just looking for something else 200 rounds down the pipe.
273,http://www.armslist.com/posts/5459273,For Sale:  1877-1879 S&W 32sw broketop hammerless,"TYLERTOWN, Hattiesburg, Mississippi",$ 300,"Listed On: Wednesday, May 18, 2016",Antique,no type,no type,no type,no type,1877-1879 S & W 32 sw break top hammerless  nickel     4 digit serial number    my cell is REDACTED    asking 300.00 obo
274,http://www.armslist.com/posts/5459274,For Sale:  Like New Browning light 12 Belgium,"Sam's Valley/Eagle Point, Medford, Oregon",$ 600,"Listed On: Friday, May 13, 2016",Shotguns,Browning                                                                                ,12 Gauge                                                                                ,Semi-automatic                                                                                ,Shotgun,"Amazing condition Browning Light 12 made in Belgium.  Round knob 30"" full choke barrel with no rib.  I am afraid to shoot it, so it must go.  $600"
275,http://www.armslist.com/posts/5459275,For Sale:  AR pistol,"Terre Haute, Indianapolis, Indiana",$ 750,"Listed On: Sunday, May 8, 2016",Handguns,no type,no type,no type,no type,could only show one pic on other listing so here is another REDACTED
276,http://www.armslist.com/posts/5459276,For Sale/Trade:  AR-15,"ft campbell, Clarksville, Tennessee",$ 500,"Listed On: Sunday, May 8, 2016",Rifles,Smith & Wesson                                                                                ,223/5.56 NATO                                                                                ,Semi-automatic                                                                                ,Rifle,Brand new Smith and Wesson AR15 never fired would like to trade for any glock
277,http://www.armslist.com/posts/5459277,For Sale:  Springfield Professional 1911-A1 (PC9111),"SE Kenmore, Seattle, Washington","$ 2,200","Listed On: Sunday, May 8, 2016",Handguns,Springfield                                                                                ,45 ACP                                                                                ,Single Action                                                                                ,Pistol,"Springfield Professional 1911-A1 (PC9111)Nearly identical to FBI issue!! See http://www.hendonpub.com/resources/article_archive/results/details?id=3709Custom fit slide to national match frameCustom fit match barrel & bushingPolished feed ramp & fully throated barrelSpringfield Custom tool steel match hammer & searFitted speed trigger w/custom tuned 4 ½ lb. trigger pullTuned for total reliabilityLowered & flared ejection portTuned & polished extractorStandard 1911-A1 recoil spring guideCustom fit beavertail grip safetyCustom fit ambidextrous thumb safetyLow mount rear sight w/matching dovetail front sight3 dot tritium inserts in sightsCustom fit S&A magazine well, matched to bevel on frameHand checkered 20LPI front strap checkeringCheckered Cocobolo grips""Carry Bevel"" complete pistol""Black T"" finish complete pistol""Professional"" model markings on slideUsage: 550 roundsSpecs can bee seen at http://www.springfield-armory.com/custom.  Then click on ""Professional 1911-A1"".Buyer to choose FFL Dealer of Buyer's choice within reasonable driving distance from Eastside.Buyer to pay any and all FFL fees.Why selling? ~ Getting on the 9mm bandwagon........DavidREDACTED(NO TRADES, local sales only)"
278,http://www.armslist.com/posts/5459278,For Sale:  s&w 686p pro series 357mag,"goodyear, Phoenix, Arizona",$ 900,"Listed On: Sunday, May 8, 2016",Handguns,Smith & Wesson                                                                                ,357 Magnum                                                                                ,Double / Single Action                                                                                ,Revolver,"s&w pro series  357 mag stainless steel , very good condition  gun holds seven rounds has 2 moon clips , 5 inch barrel, hogue fubber grips  factory trigger job"
279,http://www.armslist.com/posts/5459279,For Sale:  Savage Mk II,"Vancouver, Southwest Washington, Washington",$ 200,"Listed On: Wednesday, August 24, 2016",Rifles,Savage Arms                                                                                ,22 Long Rifle                                                                                ,Bolt Action                                                                                ,Rifle,Bought it brand new and never fired it. I was going to use it for hunting small game but never done anything with it. Comes with 1 magazine and lock and cable. 200 Obo
281,http://www.armslist.com/posts/5459281,For Trade:  LNIB Springfield XDM Competition 5.25 9mm,"Ohio, Columbus, Ohio",Offer,"Listed On: Saturday, May 21, 2016",Handguns,Springfield                                                                                ,9mm Luger (9x19),no type,no type,"LNIB Springfield XDM Competition 5.25 9mm. 2 extra 19 round mags (5 total). Shot a mag through, cleaned afterwards and put it in the safe. I changed over to the 45acp XDM 5.25. Trades will have to be of high quality. Sig, Kimber, HK. I'm not interested in stock Glocks or 40. Thank you"
282,http://www.armslist.com/posts/5459282,For Trade:  springfield fde xd 45 night sights,"richmond, Richmond, Virginia",Offer,"Listed On: Sunday, May 8, 2016",Handguns,Springfield                                                                                ,45 ACP                                                                                ,Striker Fire                                                                                ,Pistol,"Up for trade i have a very nice fde full size springfield xd 45 with night sights, 3 13 round mags, case and retentition holster.Can text pics"
288,http://www.armslist.com/posts/5459288,For Sale:  Keltec p3at 380 pocket pistol,"Downtown, New Orleans, Louisiana",$ 200,"Listed On: Sunday, May 22, 2016",Handguns,Kel-Tec                                                                                ,380 ACP                                                                                ,Double Action                                                                                ,Pistol,"Have a very reliable Keltec p3at pocket pistol chambered in the 380. Light weight, small size, snag free design. Fits in any pocket of any clothing and does not print. Great conceal piece. Shoot me a textREDACTED text only or email at Tak3set@ gmail . Com"
289,http://www.armslist.com/posts/5459289,For Sale:  Troy Industries top rail for AK47,"Carlsbad, San Diego, California",$ 100,"Listed On: Sunday, May 8, 2016",Gun,no type,no type,no type,no type,Troy Industries top rail for ak47replaces gas tubeallows you to install red dot or other accessories on ak47MSRP $149brand newI installed it on my rifle but never shot it with it installed
290,http://www.armslist.com/posts/5459290,For Sale:  sig m400  Read info please!,"SCRANTON, Wilkes-Barre/Scranton, Pennsylvania",$ 550,"Listed On: Saturday, June 11, 2016",Rifles,Sig Sauer                                                                                ,223/5.56 NATO                                                                                ,Semi-automatic                                                                                ,Rifle,"Selling my sig m400 fewer then 20 rounds down range, just bought in December 2015. Located in scranton I do receive texts REDACTED"
291,http://www.armslist.com/posts/5459291,For Sale:  H&K VP9 with tritium sights,"Belleville IL, St. Louis, Illinois",$ 640,"Listed On: Sunday, May 8, 2016",Handguns,Heckler & Koch                                                                                ,9mm Luger (9x19)                                                                                ,Striker Fire                                                                                ,Pistol,"Looking to trade my VP9 with uninstalled tritium sights for your Springfield XDS, XDm Compact, Walther PPS or similar CCW piece in 9mm. I live in Swansea IL so if you are a MO resident we would have to meet at an FFL. Would also sell outright for $640. Has had about 50 rounds through the pipe and is in excellent shape. If you have any questions feel free to message me."
292,http://www.armslist.com/posts/5459292,For Sale:  1880-1890 S&W 38sw breaktop  hammerless,"TYLERTOWN, Hattiesburg, Mississippi",$ 250,"Listed On: Wednesday, May 18, 2016",Antique,no type,no type,no type,no type,S&W 38 sw breaktop hammerless  revolver  blued   5 digit serial number     asking 250.00 obo      REDACTED
