,url,title,location,price,post date,category,manufacturer,caliber,action,firearm type,postcontent
221,http://www.armslist.com/posts/5708221,"For Sale:  AR-15 - 16"" Carbine A3 - Magpul MOE","Beaver County, Pittsburgh, Pennsylvania",$ 725,"Listed On: Monday, April 10, 2017",Rifles,no type,223/5.56 NATO                                                                                ,Semi-automatic                                                                                ,Rifle,"No trades. PA Issue DL and LTCF required. BOS will be signed. If these cannot be provided, we will meet at an FFL. Buyer pays fee.Unfired KISS Carbine. This is a twin of another rifle that I have.  Upper: -Aero Precision upper -Integrity Arms Carbine Barrel w/FSB - 1/7 Twist - Nitride QPQ -Toolcraft F/A Profile BCG - MPI marked - phosphate -Aero GI Charging Handle -A2 Flash Hider -Magpul MOE Handguard -Magpul MVG  Lower: -Aero Precision Lower -PSA LPK -KAK Milspec Buffer Kit -Magpul MOE grip and trigger guard -Magpul MOE stock   Magpul Rear MBUS - still in package  $725  or by chance you want twins: $1350 or $1300 without MBUS"
224,http://www.armslist.com/posts/5708224,"For Sale:  NIB Ruger SP101 Standard 357 RemMag 2.25"" 5rd Rubber Grip Satin Stainless# 736676057184","Oakdale, Minneapolis / St. Paul, Minnesota",$ 549,"Listed On: Saturday, June 2, 2018",Handguns,Ruger                                                                                ,357 Magnum                                                                                ,Double / Single Action                                                                                ,Revolver,"Ruger SP101 Standard 357 RemMag 2.25"" 5rd Rubber Grip Satin Stainless    Product ID 3846 ¦   UPC 736676057184   Manufacturer Ruger   Description The Ruger SP101 revolvers are smaller framed guns which still can handle powerful .357 Magnum cartridges. They also feature a smaller Ruger cushioned grip system with no exposed metal at the back strap for shooter comfort, the patented triple locking cylinder mechanism that securely locks the cylinder into the frame at the front, rear, and bottom, and a stainless steel frame that has no weakening side plates. Built as some of the smallest, most powerful, smaller frame revolvers on the market, they feature Ruger's rugged durability and are engineered for solid performance.   Department Handguns › Revolvers   Type Revolver   Action Single/Double   Caliber 357 Remington Magnum   Barrel Length 2.25""   Capacity 5   Safety Transfer Bar   Grips Rubber   Sights Fixed   Weight 25 oz   Barrel Finish Satin Stainless   Frame Finish Satin Stainless Steel   Frame Material Stainless Steel   Gun Type Revolver   Model 5718    **This is a special order item and IS NOT STOCKED IN OUR STORE and full payment must be made prior to us submitting the order. This item takes 1-3 days to arrive from our local distributor (qty and availability may vary). Check out our website @ www.getgunsnow.com to see pictures of our store or stop in with any questions. Get Guns Now Inc. is not responsible for any errors that may occur in ad. Our hours are 10am-5pm Mon –Fri. You may also call us @ 651-340-8209 with any questions. We can ship to another FFL dealer for $25. Personal checks, money orders or certified checks accepted. Add 3% for credit cards. WE DO NOT DO TRADES AT THIS TIME OR LAYAWAYS we could consign a gun for you, our fee is 20%. Prices are subject to change without notice. Price includes your transfer fee."
225,http://www.armslist.com/posts/5708225,For Sale:  British Enfield No.4 Mk 2,"Pendleton, East Oregon, Oregon",$ 350,"Listed On: Friday, July 22, 2016",Rifles,no type,303 British                                                                                ,Bolt Action                                                                                ,Rifle,British Enfield No.4 Mk2 with old wood stock. .303 British
227,http://www.armslist.com/posts/5708227,For Sale:  Springfield Champion 1911 Mil- Spec 45,"West, Tulsa, Oklahoma",$ 500,"Listed On: Friday, July 22, 2016",Handguns,Springfield                                                                                ,45 ACP                                                                                ,Double / Single Action                                                                                ,Pistol,Springfield 1911 GI Mil-spec .45 in box. Very nice gun. American Classic. For More Info Text REDACTED
228,http://www.armslist.com/posts/5708228,For Sale:  Eotech XPS2,"East of BR, Baton Rouge, Louisiana",$ 450,"Listed On: Friday, July 22, 2016",Optics,no type,no type,no type,no type,Only use was to sight rifle in
230,http://www.armslist.com/posts/5708230,For Sale:  Wheeler AR-15 Roll pin Tool kit,"Missoula, Missoula, Montana",$ 35,"Listed On: Friday, July 29, 2016",Gun,no type,no type,no type,no type,"For sale: New never opened Wheeler AR-15 Roll Pin Install Tool Kit. All the punches and hamer to put a AR upper and lower togeather with ease. Has The punchs to install the bolt Catch a breese, one side cut down to allow clearance and also Rubber protected to not scratch reciever. Trigger guard tool to allow easy inserting and removing of Grigger guard.Will Sell for cash only, Face to face only, No checks of any kind, Will not ship. Thank you"
235,http://www.armslist.com/posts/5708235,For Sale/Trade:  Taurus millennium PT145,"Sevierville, Knoxville, Tennessee",$ 375,"Listed On: Friday, July 22, 2016",Handguns,Taurus                                                                                ,45 ACP                                                                                ,no type,Pistol,Taurus Millenium pt145 in like new condition have box paperwork child safety key 2 clips. Would like to trade for 380 or small 9mm. Will sell for  $375
236,http://www.armslist.com/posts/5708236,For Sale:  Double Barrel 20 Gauge,"Largo, Tampa/St. Pete, Florida",$ 260,"Listed On: Saturday, August 6, 2016",Shotguns,Savage Arms                                                                                ,20 Gauge                                                                                ,Side by Side                                                                                ,Shotgun,Stevens Ranger Model 315 double barrel 20 gauge shotgun in nice condition. $260. Largo. REDACTED
237,http://www.armslist.com/posts/5708237,For Sale:  Saiga 223 converted,"Reno, Reno, Nevada",$ 700,"Listed On: Friday, July 22, 2016",Rifles,no type,no type,no type,Rifle,"Case,cleaning tool,magpul collapsible 6 position stock,magpul grip, 2 mags 20 in barrel ...fires perfect....only trade I'll consider is a ruger mini otherwise 700.00"
238,http://www.armslist.com/posts/5708238,Want To Buy:  300 blackout upper,"Fall river, Massachusetts, United States",Offer,"Listed On: Friday, July 22, 2016",Rifles,no type,300 Blackout (7.62x35mm)                                                                                ,Semi-automatic                                                                                ,Rifle,Looking to purchase a 300 black out upper I would prefer it to be complete closer to me the better
239,http://www.armslist.com/posts/5708239,For Sale:  Like New Sig Sauer P290RS with laser,"New Haven, Ohio, United States",$ 500,"Listed On: Friday, July 22, 2016",Handguns,Sig Sauer                                                                                ,9mm Luger (9x19)                                                                                ,Double Action                                                                                ,Pistol,I have a sig sauer p290rs nitron with sig laser. I bought it new about a month and a half ago. I'm looking to sell it because it is to small for my hands. It has had roughly 30 to 50 rounds through it. If interested call/text REDACTED Thank You.
240,http://www.armslist.com/posts/5708240,For Sale/Trade:  45 xdm compact,"Junction city, Wausau, Wisconsin",$ 450,"Listed On: Tuesday, August 2, 2016",Handguns,Springfield                                                                                ,45 ACP                                                                                ,no type,Pistol,Springfield xdm-45 compact 3.8 double stack mag 9 rounds. Text me at REDACTED 450 Obo
241,http://www.armslist.com/posts/5708241,Want To Buy:  XDS 9mm,"Oklahoma City, Oklahoma City, Oklahoma",$ 350,"Listed On: Friday, July 22, 2016",Handguns,Springfield                                                                                ,9mm Luger (9x19)                                                                                ,Double / Single Action                                                                                ,Pistol,Want to buy Xds 3.3 9mm. Black frame and either bitone or blue slidetext REDACTED
244,http://www.armslist.com/posts/5708244,For Sale/Trade:  FNX9,"lenoir, Hickory / Lenoir, North Carolina",$ 485,"Listed On: Wednesday, July 27, 2016",Handguns,FN Herstal S.A.                                                                                ,9mm Luger (9x19)                                                                                ,Double / Single Action                                                                                ,Pistol,FNX9 Excellent condition. $485.00 obo. REDACTED
245,http://www.armslist.com/posts/5708245,For Sale/Trade:  Ar15 trade for a gaming pc or a pistol of same value,"Topeka, Topeka, Kansas",$ 950,"Listed On: Friday, July 22, 2016",Rifles,no type,5.56×45mm NATO                                                                                ,Semi-automatic                                                                                ,Rifle,Comes with 3 mags. Red dot site scope built in lazer. Case cleaner kit asking 900 you can text me at REDACTED
246,http://www.armslist.com/posts/5708246,"For Sale:  NEW Smith & Wesson Model 60 PRO 357MAG 3"" 5RD SS/WD AS","Hickory, Hickory / Lenoir, North Carolina",$ 678,"Listed On: Monday, May 15, 2017",Handguns,Smith & Wesson                                                                                ,357 Magnum                                                                                ,Double / Single Action                                                                                ,Revolver,"FAMILY:60 Series MODEL:60 Pro TYPE:Revolver ACTION:Double / Single Action FINISH:Stainless STOCK/FRAME:Alloy Frame STOCK/GRIPS:Wood WEIGHT:23.4 oz.   CALIBER/GAUGE:357 Magnum | 38 Special CAPACITY:5 BARREL:3"" OVERALL LENGTH:8.7""   SIGHTS:Front Night Sign / Rear Adj SAFETY:Internal Lock ADDL INFO:Ergonomic Grip ADDL INFO:Chamfered Charge HolesBRAND NEW IN BOX!Pricing includes a 3% cash discount for local pickup only!Shipping Options are Available to Your FFL of ChoiceNC residents pay 7% Sales TaxFoothills Jewelry and Loan2619 1st Ave SWHickory, NC  28602REDACTED"
248,http://www.armslist.com/posts/5708248,For Sale:  Nikon M223 scope,"South, Atlanta, Georgia",$ 225,"Listed On: Friday, July 22, 2016",Optics,no type,no type,no type,no type,Great condition. Text REDACTED
250,http://www.armslist.com/posts/5708250,For Sale:  Colt Python 4in Blue& Gold,"West, Tulsa, Oklahoma","$ 2,990","Listed On: Monday, October 3, 2016",Handguns,Colt                                                                                ,357 Magnum                                                                                ,Double / Single Action                                                                                ,Revolver,Colt Python 4in Blue with Gold Engarveding one of a kind like new in box with all paper $2990.00 +shipping Will be glad to talk about it if you see it it for sell (PRICE DROP)
254,http://www.armslist.com/posts/5708254,For Sale/Trade:  GLOCK22 GEN3 WILSON COMBAT BARREL PRICE REDUCED,"minden, Reno, Nevada",$ 600,"Listed On: Friday, August 12, 2016",Handguns,Glock                                                                                ,40 S&W                                                                                ,Striker Fire                                                                                ,Pistol,glock 22 gen 3 has a wilson combat barrel and a stock glock barrel.5 mags case warren sights fiber front steel guide rod holster nice trigger. very accurate gun. must meet in carson and have nv. id
255,http://www.armslist.com/posts/5708255,For Sale:  SPIKES UPPER AND LOWER,"Houston, Houston, Texas",$ 400,"Listed On: Friday, July 22, 2016",Rifles,Spikes Tactical                                                                                ,no type,Semi-automatic                                                                                ,Rifle,PLEASE READ FULL LISTING!Up for sale is a never fired Spikes Upper and Lower Reciever. (This is STRIPPED) Included:upper and lower7 inch elite tactical FDE rail (with barrel nut)elite tactical six position stockUTG stubby foregrip Magpul pistol gripupper and lower DOES NOT come withforward assist dust covertrigger groupsafety selectorBCGBARRELlower DOES comes withStrike industries enhanced trigger guard TE enhanced pivot push pinsFDE color fillSAVING THE ITERNALS FOR A FUTURE BUILD. started the build about three weeks ago had to place on hold.
257,http://www.armslist.com/posts/5708257,For Sale:  Savage .22 rifle,"Indianapolis, Indianapolis, Indiana",$ 250,"Listed On: Friday, July 22, 2016",Rifles,Savage Arms                                                                                ,22 Long Rifle                                                                                ,Bolt Action                                                                                ,Rifle,Brand new in the box never used savage mark ii not even the slide has ever been installed gun new at stores is $230 plus the bushnell scope is $120 im selling the gun and everything for $250 just don't have use for it REDACTED serious inquires only no trades
258,http://www.armslist.com/posts/5708258,For Sale/Trade:  mmr 556,"hickory, Hickory / Lenoir, North Carolina",$ 750,"Listed On: Friday, July 22, 2016",Rifles,Mossberg                                                                                ,223/5.56 NATO                                                                                ,Semi-automatic                                                                                ,Rifle,"NIB unfired Mossberg mmr hunter,556,1/9 20""changed out factory a2 stock to magpul moe sl collapsible"
260,http://www.armslist.com/posts/5708260,For Sale:  Null,"Kitsap County, Auburn, Alabama",$ 400,"Listed On: Wednesday, July 27, 2016",Handguns,American Derringers                                                                                ,45 ACP                                                                                ,Bolt Action                                                                                ,Revolver,Null
261,http://www.armslist.com/posts/5708261,For Sale:  AMT BACK UP 9MM,"Taylors, Greenville, South Carolina",$ 299,"Listed On: Monday, March 20, 2017",Handguns,Arcadia Machine and Tool                                                                                ,9mm Luger (9x19)                                                                                ,Double Action                                                                                ,Pistol,"AMT BACK UP 9MM,STAINLESS,MADE IN USA,add 4% if using a card"
262,http://www.armslist.com/posts/5708262,For Sale:  Brand New Gun Vault Biometric Safe,"Upland, Inland Empire, California",$ 150,"Listed On: Friday, July 22, 2016",Gun,no type,no type,no type,no type,Selling a brand new-never opened biometric safe by Gun Vault for $150. These retail for around $200.
263,http://www.armslist.com/posts/5708263,For Sale:  Franklin armament / colt / piston AR-15,"North, Everett, Washington","$ 1,400","Listed On: Sunday, July 31, 2016",Rifles,Colt                                                                                ,223/5.56 NATO                                                                                ,Semi-automatic                                                                                ,Rifle,I've got a built from the lower up custom AR. Featuring the Osprey piston system. I have had zero problems with this system. The rifle stays incredibly flat while shooting. Has on the high end 1000 rounds through it. The piston is built for longevity under rough conditions which is why I chose it. Only reason for selling is I recently built an SBR.Lower:                   Franklin armory LibertasLower kit:              Palmetto state lower kitStock:                   Magpul ACS-LGrip:                      Magpul MOEUpper:                   Complete Colt 1/7 twistPiston:                  Osprey Piston conversion kitForegrip:               Magpul MOEMuzzle break:       M4-72 severe dutySights:                   Magpul BUS rear*Eotech is not included. Only rifle it's self. Will come with 1 black magpul Pmag.Will trade for Kriss Vector Pistol Gen 2. Keltec KSG + cash.
265,http://www.armslist.com/posts/5708265,For Sale:  Tula Hex receiver Nagant!,"Mt. Pleasant, Charleston, South Carolina",$ 250,"Listed On: Friday, July 22, 2016",Rifles,no type,7.62x54R                                                                                ,Bolt Action                                                                                ,Rifle,"I still have yet to shoot this rifle, so I figured someone else will give it a better home. It is a hex receiver, 1935 Mosin Nagant with beautiful blonde wood. It is relatively unmarred, few dings or dents in the stock, a smooth action and trigger, no rust, and all of the goodies you would expect with a Mosin. Price is 250 or best offer, 300 trade value. More pictures on request."
269,http://www.armslist.com/posts/5708269,For Sale:  CUSTOM **~ TARGET BLK PWDR Target Rifle by P.E. George Phoenix AZ . Beautiful! Handmade REDUCED!,"Alabama, Alabama, United States",$ 700,"Listed On: Friday, July 22, 2016",Rifles,no type,no type,no type,Rifle,"BEAUTIFUL CUSTOM Percussion Target rifle by Custom Gunsmith P.E. George Phoenix, AZ. 44 cal. ""Track of the wolf"" style rifle. 32 inch long octagon barrel- 1:42.5 twist. Approx 1 inch dia. barrel. Set triggers, Half stock with brass and lead nose cap. Brass toe cap and crescent butt plate. No ram rod or ferrules ever mounted . Lyman tang mounted rear peep sight , globe front sight with circle post front sight. Interestingly made Set trigger system, brass trigger guard, Top of barrel marked ""Made expressly for GALE ROBERTS by P.E. GEORGE Phoenix , AZ"" Simple and well thought out and well made target rifle"
270,http://www.armslist.com/posts/5708270,For Sale:  Browning Challenger II,"Largo, Tampa/St. Pete, Florida",$ 260,"Listed On: Friday, July 22, 2016",Handguns,Browning                                                                                ,22 Long Rifle                                                                                ,Single Action                                                                                ,Pistol,"Browning Challenger II, .22 LR, two 10 round magazines, nice condition. Nice target pistol. $260. Largo. REDACTED"
271,http://www.armslist.com/posts/5708271,"For Sale:  Mossberg 930 semi auto 12 gauge 28"" barrel","Lakeville, Bloomington, Minnesota",$ 475,"Listed On: Monday, August 8, 2016",Shotguns,Mossberg                                                                                ,12 Gauge                                                                                ,Semi-automatic                                                                                ,Shotgun,"Great gun soft shooter. Only a couple boxes of shells through it. I got this and a over under for my son to try, for his high school trap team. He liked the over under better. I bought this gun at Dicks in March. Check out the review on randywakeman.com"
274,http://www.armslist.com/posts/5708274,For Trade:  glock 21 gen 4,"east, Louisville, Kentucky",Offer,"Listed On: Friday, July 22, 2016",Handguns,Glock                                                                                ,45 ACP                                                                                ,no type,Pistol,full size.45 awesome gun just lookig for more of a carry gun text REDACTED for more info
276,http://www.armslist.com/posts/5708276,Want To Buy:  .308 Win ammo,"Hamilton, Cincinnati, Ohio",$ 1,"Listed On: Tuesday, August 9, 2016",Ammo,no type,no type,no type,no type,Anyone have any .308 Win for sale? Thanks!
278,http://www.armslist.com/posts/5708278,For Sale:  Savage Mark II,"Mt Pleasant, Charleston, South Carolina",$ 200,"Listed On: Monday, August 8, 2016",Rifles,Savage Arms                                                                                ,22 Long Rifle                                                                                ,Bolt Action                                                                                ,Rifle,"I'm just cleaning out the safe, I havent shot this rifle in years. It is like new, no scratches or scuffs. Comes with the scope, so It would make a great first rifle or plinker. Price is 200 or best offer, open to trades. More pictures on request."
279,http://www.armslist.com/posts/5708279,For Sale:  2- S&W 22lr revolvers,"taos, Santa Fe, New Mexico",$ 750,"Listed On: Saturday, October 29, 2016",Handguns,Smith & Wesson                                                                                ,22 Long Rifle                                                                                ,Double / Single Action                                                                                ,Revolver,"REDUCED PRICE !!!!-------a S&W model 617-6 k frame -22long rifle masterpiece satin stainless(current production-2005) 10 round alumunium cylinder(slight turn line) 4""full lug bbl with combat trigger and S&W rubber combat grips and adjustable rear sites and has safety lock in the original box with the papers -- 95% to 98% weapon -- asking $750. ------ also have a S&W model 63-4 j frame(current production - 2007 with hammer lock ) 8 round cylinder with slight turn line - 5""bbl - adjustable rear sites - rubber finger groove grips - in the original box with papers -- 95% to 98% weapon --- asking $675. ---- i live in taos n.m. and am willing to meet halfway ---- my cell no is REDACTED( virginia cell no and i live in taos and im not going to change it) if you have any more questions"
281,http://www.armslist.com/posts/5708281,For Sale:  Inland GM M1 Carbine,"Cantonment, Pensacola, Florida","$ 1,200","Listed On: Friday, July 22, 2016",Rifles,no type,30 Carbine                                                                                ,Semi-automatic                                                                                ,Rifle,"For sale 1944 Inland GM M1 Carbine. In very good condition with only two small deep scratches on the hand grip near stock..flat bolt, all orginal parts.. The GM Inland came with the adjustable rear sights. Barrel is stamped Inland GM 7-44, on the inside of the sling holder its marke OI...Very smooth firing weapon for being 72 years old.. very smooth action no rust in the barrel."
282,http://www.armslist.com/posts/5708282,For Sale:  REMINGTON 870P POLICE MAGNUM W/ GHOST RING SIGHTS,"liverpool, Syracuse, New York",$ 750,"Listed On: Friday, July 22, 2016",Shotguns,no type,no type,no type,Shotgun,BRAND NEW NEVER FIRED REMINGTON 870P POLICE MAGNUM FOR SALE. HAS A FACTORY 2 SHOT EXTENSION TUBE WITH FACTORY GHOST RING SIGHTS. IT CAME FROM THE FACTORY WITH THE BLACKHAWK SPEC OPS 2 STOCK. PAID OVER 950.00 FOR IT A FEW MONTHS AGO. I WILL INCLUDE A NEW BLACKHAWK SHOTGUN CASE ALSO 100.00 VALUE. ASKING 750.00   ANY QUESTIONS TEXT ME AT REDACTED
283,http://www.armslist.com/posts/5708283,For Sale:  Glock 20SF,"Durham, Raleigh / Durham / CH, North Carolina",$ 470,"Listed On: Monday, October 17, 2016",Handguns,Glock                                                                                ,no type,Striker Fire                                                                                ,Pistol,"(Glock 20sf GEN 3) Less than 3 months old. Comes with an extra aftermarket 20lb steel guide rod spring that I purchased from glock store. Great Gun!! These guide rods handle the high powered 10 mm ammo like buffalo bore and underwood  better in my opinion.This is what you get: Glock 20sf pistol, 2 15 round mags, , steel aftermarket recoil guide rod with 20lb spring, bore cleaner with rod, and  extra aftermarket barrel ( made by loanwolf) original box. PRICE FIRM! PLEASE DO NOT CONTACT ME TO NEGOTIATE PRICE. PLEASE READ: MUST HAVE A VALID NC CONCEALED CARRY PERMIT OR ORIGINAL PURCHASE PERMIT AND DRIVERS LICENSE!!!I also do a firearms bill of sale and take a photo of DL and CCL for my records."
285,http://www.armslist.com/posts/5708285,For Sale:  Arx 15,"Rathdrum, Coeur D' Alene, Idaho",$ 900,"Listed On: Friday, July 22, 2016",Rifles,Palmetto State Armory                                                                                ,223/5.56 NATO                                                                                ,Semi-automatic                                                                                ,Rifle,"16"" arx 15. .556 or .223 nato; 1/7 twist with stainless steal barrel. Black magpul furniture. Upper is psa lower is Anderson all high quality 7025 aluminum. Comes with one new magpul mag. Asking 900 OBO any interested in trading for 10 mm or 40 cal. Handgun let me know what you got 208 fiveone 2 ninesixone 9"
