,url,title,location,price,post date,category,manufacturer,caliber,action,firearm type,postcontent
446,http://www.armslist.com/posts/5708446,For Sale:  S&W SD9 VE,"Tampa, Nashville, Tennessee",$ 290,"Listed On: Friday, July 22, 2016",Handguns,Smith & Wesson                                                                                ,9mm Luger (9x19)                                                                                ,no type,Pistol,"Here I have the S&W SD9VE. It is 6 months old, and only about 150 rounds have been fired through it. I have enjoyed this gun and it performs well but I need to seel it. I will not accept trades. $290 flat. This package includes the package, owner manual/warranty information, 2 15-round magazines, and a concealment inside-waistband holster. I will not ship the item, we must meet up for the sale You must be in compliance with all state, and federal gun lawn for the purchase and ownership of this pistol. I will have a Bill of Sale form we can fill out. I prefer you have a concealed weapons license, or at least you must have a driver's license to verify your identity to me. You must be a Florida resident. Call or text me if you are interested, and we will discuss where to meet up for the sale.: REDACTED."
447,http://www.armslist.com/posts/5708447,For Sale:  RIGARMI-BRESCIA  22LR.,"Taylors, Greenville, South Carolina",$ 150,"Listed On: Sunday, April 2, 2017",Handguns,no type,no type,no type,no type,"RIGARMI-BRESCIA 22LR,MODEL 1957,LOG#679"
448,http://www.armslist.com/posts/5708448,For Sale:  spring field xds 45,"sturgeon bay, Green Bay, Wisconsin",$ 450,"Listed On: Friday, July 22, 2016",Handguns,Springfield                                                                                ,45 ACP                                                                                ,Striker Fire                                                                                ,Pistol,"Springfield xds 45 3.3 100 rounds shot through, cleaned after every session.  1-7 round 1-6 round 2-5 round magazines.  Hard and soft case. Crossbreed mini tuck inside the waist band holster.  Box of Winchester defense rounds.  Magazine holster. Any questions text or call REDACTED"
449,http://www.armslist.com/posts/5708449,For Sale:  Sold,"east, Wichita, Kansas","$ 9,999,999","Listed On: Friday, July 22, 2016",Gun,no type,no type,no type,no type,SOLD
450,http://www.armslist.com/posts/5708450,For Sale:  New WaltherArms P99c AS,"Lexington, Lexington, Kentucky",$ 487,"Listed On: Monday, November 7, 2016",Handguns,Walther                                                                                ,40 cal                                                                                ,Double Action                                                                                ,Pistol,"Originally designed for police use, the Walther P99 began production in 1997 in 9mm and .40 S&W calibers.  It was originally designed for service use, as it is a full size handgun holding 16+1 in 9mm and 12+1 in .40 caliber, but what set the Walther apart was Walther’s replication of the feeling and action of a true traditional double action hammer system.  Competing with Glock, Walther wanted to appeal to users of hammer-fired guns such as the Beretta or Walther’s previous pistol, the P88.  A compact version of this P99, called the P99c AS (the c AS standing for compact Anti-Stress), was introduced in 2004.  It has a half-inch shorter barrel at 3.5 inches, and has a 1 inch shorter grip, coming in at 4.3 inches tall, and has a 10-round magazine in 9mm and 8 round magazine in .40 S&W.  Available at the Richmond KY store REDACTED."
451,http://www.armslist.com/posts/5708451,For Sale:  22mag taurus,"taos, Santa Fe, New Mexico",$ 450,"Listed On: Wednesday, August 3, 2016",Handguns,Taurus                                                                                ,22 Magnum                                                                                ,Double / Single Action                                                                                ,Revolver,"a model m941ss 22wmr caliber taurus 2"" bbl -- matte stainless steel finish - 8 round cylinder(with a slight turn line) - adjustable rear sites - orange front ramp site - taurus finger groove rubber grips - hammer lock safety(has one key) - in the original box with booklet and looks to be a 95% to a 98% weapon and asking $450. and are willing to meet halfway --- i live in taos n.m. and have a va. cell phone number of which i intend to keep of REDACTED if you have any more questions --- thx for looking"
454,http://www.armslist.com/posts/5708454,For Sale:  AR15 build tools,"Troy, St. Louis, Missouri",$ 100,"Listed On: Friday, July 22, 2016",Miscellaneous,no type,no type,no type,no type,Magpul armorers wrenchMagpul bev blockGrace brass hammerharbor freight torque wrenchharbor freight breaker barDasco punchesGrace roll pin punchesEverything you're going to need to properly build an AR. Asking $100. Will meet in Troy or Wentzville.ThanksSteve 6three64five90five8nine
455,http://www.armslist.com/posts/5708455,For Sale:  BNIB Glock 21,"Pryor, Tulsa, Oklahoma",$ 550,"Listed On: Friday, July 22, 2016",Handguns,Glock                                                                                ,45 ACP                                                                                ,no type,Pistol,Brand new in box never loaded or fired asking $550 obo
456,http://www.armslist.com/posts/5708456,For Sale:  Sig P938 Scorpion,"Brazil, Terre Haute, Indiana",$ 550,"Listed On: Friday, July 22, 2016",Handguns,Sig Sauer                                                                                ,9mm Luger (9x19)                                                                                ,Single Action                                                                                ,Pistol,"Sig Sauer P938 Scorpion for sale. Comes with original case, 2 magazines (7 round extended and 6 round), Jaguar Elite Kydex holster from Comfort Holsters, 300 rounds of Blazer Brass target ammo and 20 rounds of Speer Gold Dot hollow points. Gun doesn't even have 100 rounds through it. Will provide pictures upon request. Asking $550 obo"
457,http://www.armslist.com/posts/5708457,For Sale/Trade:  diamondback db9,"46235, Indianapolis, Indiana",$ 350,"Listed On: Friday, July 22, 2016",Handguns,Diamondback Firearms                                                                                ,9mm Luger (9x19)                                                                                ,Striker Fire                                                                                ,Pistol,I have diamond back db9 i recieve in trade and it is too small all i have is the gun and ammo... Looking to trade or sale straight out for $350.00 MORE SO ON THE TRADES RIGHT NOW REDACTED INDIANAPOLIS ONLY
458,http://www.armslist.com/posts/5708458,For Sale:  Glock mags,"Park Circle, Charleston, South Carolina",FREE,"Listed On: Friday, July 22, 2016",Magazines,no type,no type,no type,no type,I have 5 Glock 22 magazines for sale; they are drop free. Used not abused. All five for $75I have 4 Glock 23 mags; they are also drop free. Used but not abused. All four for $50.All nine mags for.........!115.Can ship on your dime if not local.
459,http://www.armslist.com/posts/5708459,For Sale:  Comp Tac Glock 19 holster,"pinson, Birmingham, Alabama",$ 65,"Listed On: Friday, July 22, 2016",Holsters,no type,no type,no type,no type,"I have an almost like new Comp-Tac Minatour IWB holster. It's been worn a handful of times. Great holster, I just prefer appendix Carry. Has C-clips for the ultimate in tuckable concealbility. Other shells are available from comptac for $26 So this can be used with other pistols. The shell included fits Block 19/23/32 but will fit 26/27/33 also. $65"
460,http://www.armslist.com/posts/5708460,For Sale:  NORTH AMERICAN ARMS  GUARDIAN  .380,"Gainesville, Atlanta, Georgia",$ 350,"Listed On: Tuesday, August 9, 2016",Handguns,North American Arms                                                                                ,380 ACP                                                                                ,Striker Fire                                                                                ,Pistol,NAA  Guardian .380  2-Mags  EXCELLENT CONDITION !  QUALITY Firearm SS
461,http://www.armslist.com/posts/5708461,For Sale:  Glock 34 cerakoted with ported lone wolf barrel,"Keene, Keene, New Hampshire",$ 650,"Listed On: Friday, July 22, 2016",Handguns,no type,9mm Luger (9x19)                                                                                ,Double Action                                                                                ,Pistol,just as the title says. Fde slide and black frame.
462,http://www.armslist.com/posts/5708462,For Sale:  Thompson Center,"Gloucester, Hampton Roads, Virginia",$ 625,"Listed On: Wednesday, August 3, 2016",Handguns,Thompson Center                                                                                ,223/5.56 NATO                                                                                ,Single Shot                                                                                ,Pistol,"Super 14 with ported SS barrel and Burris 4x scope in cal.223,excel.cond.$625.00 cash."
463,http://www.armslist.com/posts/5708463,For Sale:  Yugo m92 ak pistol with extras,"Minneapolis, Minneapolis / St. Paul, Minnesota",$ 900,"Listed On: Friday, July 29, 2016",Handguns,no type,7.62x39,no type,no type,"looking to sell my m92, it's a beautiful pistol in excellent condition. Chambered in 7.62x39 the fire arm has the following upgrades cnc warrior muzzle break/detent, magpul moe+ pistol grip, krebs trigger pin retaining plate,  ace side folder adapter, and a sig47 arm brace. The package also includes 1,100 rounds of 7.62x39 and eleven 30rd mags. My price is firm"
465,http://www.armslist.com/posts/5708465,For Trade:  Gen 4 Glock 27 + extras,"NW Mobile, Mobile, Alabama",Offer,"Listed On: Sunday, August 21, 2016",Handguns,Glock                                                                                ,no type,no type,Pistol,"Comes with the G27, 3 factory G27 mags (one of the three stock mags has a pierce pinky extension), some Hydra shock HPs, a Galco IWB holster, Trijicong HD night sights, extended slide release, and 3.5lb zev connector. (Box and papers included.)I also have 200 rounds of winchester fmj, G23 mags, and/or cash to add for the right trade. Local FTF only. Must have an Alabama concealed carry permit."
466,http://www.armslist.com/posts/5708466,"For Sale:  AR15 Premium PSA Upper, Spikes Lower","northside, Jacksonville, Florida",$ 675,"Listed On: Friday, July 22, 2016",Rifles,no type,5.56×45mm NATO                                                                                ,no type,Rifle,"I have this beautiful AR15 set up that is in like new condition for sale, the Upper is Complete Premium PSA with the CHF Barrel  and the Lower is a complete Spikes Tactical. All Magpul Moe furnitures. This AR 15 is priced to sell tofund another project."
467,http://www.armslist.com/posts/5708467,For Sale:  COLT JUNIOR 25 CAL.,"Taylors, Greenville, South Carolina",$ 450,"Listed On: Monday, October 10, 2016",Handguns,Colt                                                                                ,25 ACP                                                                                ,Single Action                                                                                ,Pistol,"COLT JUNIOR 25 CAL.,STAINLESS,WOOD GRIPS,LOG#680"
469,http://www.armslist.com/posts/5708469,For Sale:  Like new colt mt6731,"Bridgewater, Massachusetts, United States","$ 1,675","Listed On: Friday, July 22, 2016",Rifles,Colt                                                                                ,223/5.56 NATO                                                                                ,Semi-automatic                                                                                ,Rifle,Up for sale or trade is a like new (about 50 rounds fired to sight in the scope)colt mt-6731. Comes with a.c.o.g dual lever scope mount/release. Leupold scope. 2/20 2/30  preban mags case and some ammo. Trade  for multiple handguns or cash of $1675. Ftf efa10 with ma ltc-a. Between Boston and bridgewater
470,http://www.armslist.com/posts/5708470,For Sale:  Walther PPQ Navy 4.6 SD 9MM - NIB Never Fired,"SE, Boise, Idaho",$ 650,"Listed On: Friday, July 22, 2016",Handguns,Walther                                                                                ,9mm Luger (9x19)                                                                                ,Striker Fire                                                                                ,Pistol,"New n box, never fired Walther PPQ Navy with threaded barrell.  Best trigger on the market."
472,http://www.armslist.com/posts/5708472,For Sale:  US Autoweapons USM4 AR-15 5.56mm Red X Upper,"LOVELAND, Fort Collins, Colorado",$ 650,"Listed On: Friday, July 22, 2016",Rifles,no type,5.56×45mm NATO                                                                                ,Semi-automatic                                                                                ,Rifle,Nice rifle in excellent condition
474,http://www.armslist.com/posts/5708474,"For Sale:  Ruger Security Six 357 Mag 6"" Revolver - Mfg 1978","Matthews, Charlotte, North Carolina",$ 600,"Listed On: Friday, November 18, 2016",Handguns,Ruger                                                                                ,357 Magnum                                                                                ,Double / Single Action                                                                                ,Revolver,"Ruger Security Six .357 mag revolver with a 6"" barrel and adjustable rear sight. Blue condition is 92% with a small smudge spot on the left side frame between the trigger and grip, and some carry wear on the inner front strap and left side barrel. Also, there is a small nick on the rear sight. Bore is clean and grips are excellent. Action is smooth, and cylinder locks up tight with almost no movement. No factory box or paperwork. SN: 154-062xx."
475,http://www.armslist.com/posts/5708475,Want To Buy:  Colt 6920 SOCOM,"CIty, Charlottesville, Virginia",Offer,"Listed On: Friday, July 22, 2016",Rifles,Colt                                                                                ,223/5.56 NATO                                                                                ,no type,Rifle,Wish to buy a Colt 6920 SOCOM (preferably new or lightly used). VA resident. Have cash.
476,http://www.armslist.com/posts/5708476,For Sale:  GLOCK G17 Gen 3,"Utica, Detroit, Michigan",$ 550,"Listed On: Saturday, January 14, 2017",Handguns,Glock                                                                                ,9mm Luger (9x19)                                                                                ,Striker Fire                                                                                ,Pistol,BRAND NEW!!! Glock G17 Gen3 Full FDE. 9MM 17+1. Includes 2 magazines. Rare desert color.
477,http://www.armslist.com/posts/5708477,For Sale:  Glock 37 Polished SHARP,"Kannapolis, Charlotte, North Carolina",$ 350,"Listed On: Friday, July 22, 2016",Handguns,Glock                                                                                ,45 GAP                                                                                ,Striker Fire                                                                                ,Pistol,Glock 37. Polished on both sides of slide. Barrel also polished. Comes with 2 10rd mags.
478,http://www.armslist.com/posts/5708478,For Sale:  Hi Point JHP .45 ACP Striker Fire Pistol,"Kernersville, Winston Salem, North Carolina",$ 140,"Listed On: Sunday, September 11, 2016",Handguns,Hi Point                                                                                ,45 ACP                                                                                ,no type,Pistol,Hi Point JHP Semi-Auto Pistol in .45 ACP. $140. Come on down to West Mountain Pawn if you'd like to take a closer look!
479,http://www.armslist.com/posts/5708479,For Sale:  Sig Sauer MK25 PRIVATE PARTY w/ Extras,"Houston Area, Houston, Texas",$ 799,"Listed On: Friday, July 22, 2016",Handguns,Sig Sauer                                                                                ,9mm Luger (9x19)                                                                                ,no type,Pistol,"The best way to contact us is via email through Armslist.  Please note that our contact # does NOT receive any text messages.Up for sale is a like-new trade-in Sig Sauer P226 MK25.  This firearm features extra grips, night sights, 5 15rd magazines, & a 20rd magazine.This is a private party sale so there is no sales tax.  $799.99 or best reasonable offer.If you cannot pick up locally we can ship to an FFL near you for pick up."
480,http://www.armslist.com/posts/5708480,For Trade:  Ruger P89DC trade,"Goodyear, Phoenix, Arizona",Offer,"Listed On: Friday, July 22, 2016",Handguns,Ruger                                                                                ,9mm Luger (9x19)                                                                                ,Double / Single Action                                                                                ,Pistol,Up for trade is my excellent condition Ruger P89DC. Looking for someones forgotten ak47 collecting dust in their safe who is willing to even trade. Open to other trades most i can say is no thanks. 6two3- 3zero3-6three87
481,http://www.armslist.com/posts/5708481,For Sale:  Walther G22 Bullpup .22 lr Semi Auto Rifle,"LOVELAND, Fort Collins, Colorado",$ 375,"Listed On: Monday, August 1, 2016",Rifles,Walther                                                                                ,22 Long Rifle                                                                                ,Semi-automatic                                                                                ,Rifle,Nice rifle with case
482,http://www.armslist.com/posts/5708482,For Sale:  Winchester ranger model 120,"St. Louis, St. Louis, Missouri",$ 400,"Listed On: Friday, July 22, 2016",Shotguns,Winchester                                                                                ,12 Gauge                                                                                ,Pump Action                                                                                ,Shotgun,"Winchester Ranger Model 2 3/4"" 3"" Pump action"
483,http://www.armslist.com/posts/5708483,For Sale:  KelTec P32,"Legends Area, Kansas City, Kansas",$ 235,"Listed On: Friday, July 22, 2016",Handguns,Kel-Tec                                                                                ,32 ACP                                                                                ,Striker Fire                                                                                ,Pistol,"This little gun was my first CC piece. I chose it over a 380 becuase the 32 is much more controlable and therefore more accurate. The deal includes two boxes of 32acp, two holsters, gun and case. It fits in a suit coat pocket or jeans/shorts pocket. Great bug..."
484,http://www.armslist.com/posts/5708484,For Sale:  .380 FMJ Ammo,"Sunriver/La Pine, Bend, Oregon",$ 12,"Listed On: Friday, August 12, 2016",Ammo,no type,no type,no type,no type,"1 box of 50 rounds, brass cased .380 FMJ ammo"
485,http://www.armslist.com/posts/5708485,For Sale:  PRE-BAND AR/cm-2037,"Dunlap, Chattanooga, Tennessee","$ 4,000","Listed On: Friday, July 22, 2016",Rifles,no type,no type,no type,Rifle,"This is pre-band Ar/cm-2037 upper is col tm-16 bolt, lower is E,A,co moj j-15 with A-2 wood buttstock & tactical grip, grip on the cm-2037 is RM equipment gear with it is black hawk vestm203/ar 6 30rds mag 10 rds 37mm body armor 3A second chance 17x14 front 12x14 back mil-tactical leg holster &4 mag pouchbelt &canteen & pouch have boxs for cm-2037rm grip also stock handguard for the uper it like new!Ron"
486,http://www.armslist.com/posts/5708486,For Sale/Trade:  Bnib S&W MP15 Sport ll,"Northside Indianapolis, Indianapolis, Indiana",$ 0,"Listed On: Friday, July 22, 2016",Rifles,Smith & Wesson                                                                                ,223/5.56 NATO                                                                                ,Semi-automatic                                                                                ,Rifle,"brand new in box, not even a round chambered in it. Bought this with intensions of putting a bunch of mods on it but decided to go in another direction. Has rear magpul mbus sight on it. Comes with original mag and throwing on a brand new still in package magpul mag.$650email or text REDACTEDtrades:multiple gunsguns+cashglocks,sigs,kimber, etcquality guns"
487,http://www.armslist.com/posts/5708487,Want To Buy:  Waterfowl shotgun and 22long rifle,"Mankato, Mankato, Minnesota",Offer,"Listed On: Friday, July 22, 2016",Shotguns,Remington                                                                                ,12 Gauge                                                                                ,Semi-automatic                                                                                ,Shotgun,im looking for a decent starter 12g for my first season of duck and deer hunting. Not to picky looking around the 500 price range also looking for a .22 long rifle preferred bolt action but will look into others price range 200
488,http://www.armslist.com/posts/5708488,For Sale:  S&W SD9 VE,"Tampa, Tampa/St. Pete, Florida",$ 270,"Listed On: Friday, July 22, 2016",Handguns,Smith & Wesson                                                                                ,9mm Luger (9x19)                                                                                ,no type,Pistol,"Here I have the S&W SD9VE. It is 6 months old, and only about 150 rounds have been fired through it. I have enjoyed this gun as it performs well but I need to sell it. I will not accept trades. $270 flat. This package includes the box, 2 15 round magazines, the owner's manual, and gun cable lock, and a concealed weapon inner waistband holster! I will not ship the gun. We must meet up in person for the sale. You must be in compliance with all federal and state laws concerning gun purchases and pistol ownership. You must be 21+ years old and have a driver's license to prove to me your identity. If you have a concealed weapon license, it will put me more at ease. You must be a Florida resident. Call or text me if you are interested: REDACTED"
491,http://www.armslist.com/posts/5708491,For Sale:  Glock 23,"NE, Tallahassee, Florida",$ 450,"Listed On: Friday, July 22, 2016",Handguns,Glock                                                                                ,40 S&W                                                                                ,no type,Pistol,"Glock 23, gen 3, fired 6 times, perfect condition
Original owner, comes with all original items plus 54 rounds of gold dot ammo."
494,http://www.armslist.com/posts/5708494,Want To Buy:  Marlin Model 60 or 10/22 take down,"Franklin, Nashville, Tennessee",$ 100,"Listed On: Friday, July 22, 2016",Rifles,Marlin                                                                                ,22 Long Rifle                                                                                ,Semi-automatic                                                                                ,Rifle,Looking for a Marlin Model 60 or Ruger 10/22 take down with a threaded barrel
496,http://www.armslist.com/posts/5708496,For Sale/Trade:  Maverick 88 12 gauge,"Tulsa, Tulsa, Oklahoma",$ 160,"Listed On: Friday, July 22, 2016",Shotguns,Mossberg                                                                                ,12 Gauge                                                                                ,Pump Action                                                                                ,Shotgun,"in good shape, has the 26"" vent rib barrel"
499,http://www.armslist.com/posts/5708499,For Trade:  RIA 1911 tac ll FS 9mm,"West mphs,ar, Memphis, Tennessee",Offer,"Listed On: Friday, July 22, 2016",Handguns,Rock Island Armory                                                                                ,9mm Luger (9x19)                                                                                ,Single Action                                                                                ,Pistol,"FS RIA tac ll 1911 A1 9mm like new in box 2 mags,VZ grips,ambi safeties ,adj trigger,adj. sights,combat hammer,mag well  very nice super accurate,very reliable with any 9 mm ammo ."
500,http://www.armslist.com/posts/5708500,For Sale:  MARLIN MODEL 62 30 CARBINE LEVER HARD TO FIND!!!,"auburn, Seattle, Washington",$ 370,"Listed On: Friday, July 22, 2016",Rifles,Marlin                                                                                ,30 Carbine                                                                                ,Lever Action                                                                                ,Rifle,MARLIN MODEL 62 30 US CARBINE LEVER HARD TO FIND!!!
