,url,title,location,price,post date,category,manufacturer,caliber,action,firearm type,postcontent
0,http://www.armslist.com/posts/5708000,For Sale/Trade:  Sccy cpx2 9mm,"Potosi, St. Louis, Missouri",$ 300,"Listed On: Friday, July 22, 2016",Handguns,SCCY                                                                                ,no type,Single Action                                                                                ,Pistol,"Nice lightly used Sccy cpx2, 2 10 round mags. And a pocket holster. Looking to sale or trade. Sale price is 300 firm and trades I'm looking for are other 9mm guns. Eaa tangfolio, ruger p89, Taurus g2, preferably a star model BM 1911 clone. Make other trade offers  welcome.  Text me please at REDACTED ."
1,http://www.armslist.com/posts/5708001,For Sale:  Benelli Super Sport  12 ga,"South Point, Ohio, United States","$ 1,800","Listed On: Friday, July 22, 2016",Shotguns,Benelli                                                                                ,12 Gauge                                                                                ,Semi-automatic                                                                                ,Shotgun,"Shotgun has been shot only 3 or 4 times. Excellent condition. Unique carbon fiber finish with synthetic stock with a non slip, dimpled checkering pattern on the forearm and pistol grip. Some features include QuadraFit modular butt stock, comfortech recoil reduction system, reliable inertia drive system, cycles 2 3/4"" and 3"" shells, ported barrel reduces muzzle rise, curio barrel and choke tubes, includes 5 extended choke tubes, and hard case. Extra cheek pad included.For or sale to OHIO residents only. Cash only."
2,http://www.armslist.com/posts/5708002,"For Sale:  Smith & Wesson Model 60 Pro Series 3"" 357 magnum","Hickory, Hickory / Lenoir, North Carolina",$ 678,"Listed On: Tuesday, February 21, 2017",Handguns,Smith & Wesson                                                                                ,357 Magnum                                                                                ,Double / Single Action                                                                                ,Revolver,"SKU:178013    Model:60    Caliber:.357 Magnum®.38 S&W Special +P    Capacity:5 Rounds    Barrel Length:3"" / 7.6 cm    Front Sight:Night Sight    Rear Sight:Adjustable    Overall Length:7.75"" / 19.7 cm    Weight Empty:23.2 oz / 657.7 g    Action:Single/Double Action    Grip:Wood    Material:Stainless Steel Frame    Finish:Matte Stainless    Frame Size:Small - Exposed Hammer    Purpose:RecreationalPersonal ProtectionHome Protection   Condition:  NEW IN BOX   Pricing includes a 3% cash discount Insured FEDEX or USPS Shipping Available to Your FFL NC residents pay 7% Sales Tax"
3,http://www.armslist.com/posts/5708003,For Trade:  ** Nice Ruger 10-22 Stainless Carbine.       Extras.                                         * For Pistol or others *      Mustang Wheels,"South-Derby, Wichita, Kansas",Offer,"Listed On: Friday, July 22, 2016",Rifles,Ruger                                                                                ,22 Long Rifle                                                                                ,Semi-automatic                                                                                ,Rifle,"Nice Ruger 10/22 stainless carbine Grey laminated stockBushnell in silver, waterproof 3x9x32 scopeStandard magazine. New BX25x2 mag Shooters ridge 25 rd mag. 316*209*1397CCL HolderBill of sale requiredDon't ask me how much $$It's too much for you to flip.Fun to shoot with kids or Grandchildren .Or even yourself lolHave someone interested on Sunday but don't know if it's going to happen ..."
4,http://www.armslist.com/posts/5708004,Want To Buy:  WTB Savage .270,"Grand island, Nebraska, United States",Offer,"Listed On: Friday, July 22, 2016",Rifles,Savage Arms                                                                                ,270 Winchester                                                                                ,Bolt Action                                                                                ,Rifle,Looking for a savage .270 in good shape. let me know what you have if you're looking to sell.
5,http://www.armslist.com/posts/5708005,For Sale:  ATI American Tactical AR-15 (5.56/.223) Brand New!,"Berlin Heights/ Vermilion, Cleveland, Ohio",$ 550,"Listed On: Friday, July 22, 2016",Rifles,American Tactical Imports                                                                                ,223/5.56 NATO                                                                                ,Semi-automatic                                                                                ,Rifle,"ATI Tactical imports Omni Hybrid AR-15 5.56 .223Brand NEW Never fired!!!Comes with the original box, 30 round magazine, tactical gas block,This model has a Forward assist and Dust cover Also. Call or Text at REDACTED"
6,http://www.armslist.com/posts/5708006,For Sale/Trade:  Nexus 6P,"Spring Hill, Nashville, Tennessee",$ 450,"Listed On: Friday, July 22, 2016",Miscellaneous,no type,no type,no type,no type,i have a nexus 6P new in box. it will include a couple extra charges as well as an adopted case.
7,http://www.armslist.com/posts/5708007,For Sale/Trade:  Springfield XDS 45,"Off I-64, Louisville, Kentucky",$ 450,"Listed On: Friday, July 22, 2016",Handguns,Springfield                                                                                ,45 ACP                                                                                ,Double Action                                                                                ,Pistol,"Text for ONLY RESPONSE- REDACTED. Full package Springfield XDS 45 with owb holster, double mag holster and two mags. Also have a new Alien Gear IWB holster. Gun does have some carry wear but not to bad, like 85-90%."
8,http://www.armslist.com/posts/5708008,For Sale:  Sako 300 WSM,"Midland, Charlotte, North Carolina","$ 1,250","Listed On: Friday, July 22, 2016",Rifles,Sako                                                                                 ,300 Winchester Short Magnum                                                                                ,Bolt Action                                                                                ,Rifle,"Up for sale is a used Sako 300WSM. This gun is in great condition and only had about 30 rounds down the barrel. I may be interested in partial trades depending on what you have as well. Thanks for looking,Josh REDACTED)"
9,http://www.armslist.com/posts/5708009,For Sale:  Elite Energy 35 compound bow loaded,"Ayden, Greenville, North Carolina",$ 750,"Listed On: Friday, July 22, 2016",Archery,no type,no type,no type,no type,"Elite archery energy 35all black29"" drawperfect shape never huntednew Limbdriver pro v arrow resthha 5519 with dialbee stinger stabilizer$750possible trade for a 270 wsm or 300 wsmCall or text 252-717-one83seven"
10,http://www.armslist.com/posts/5708010,For Sale/Trade:  LWRC AR-15,"Frisco, Dallas, Texas","$ 1,100","Listed On: Wednesday, August 24, 2016",Rifles,LWRC International                                                                                ,5.56×45mm NATO                                                                                ,Semi-automatic                                                                                ,Rifle,"LWRC upper Stag arms lower AR-15 chambered in 5.56. samson 12.7 keymod rail, magpul forgrip/ handstop. batlink minimalist stock. acog no longer avaliable"
11,http://www.armslist.com/posts/5708011,For Sale:  Sig P226 tacops 40s&w slide,"west, St. Louis, Missouri",$ 425,"Listed On: Tuesday, August 2, 2016",Gun,no type,no type,no type,no type,"Sig Sauer P226 tacops slide/barrel and 4 15rd magazines. Possible trades are zenitco b30, b31s, b33 rails, glock 21, browning a-bolt 300 win mag or daniel defense ris ii. It has been lightly used as I mostly shoot 9mm. The tacops slide has front cocking serrations and a fiber optic/tritium front sight and tritium rear sights. Make a trade or cash offer."
12,http://www.armslist.com/posts/5708012,For Sale/Trade:  Sig p229r 9mm w/ 4 mags,"Bethany, Oklahoma City, Oklahoma",$ 650,"Listed On: Wednesday, July 27, 2016",Handguns,Sig Sauer                                                                                ,9mm Luger (9x19)                                                                                ,Double / Single Action                                                                                ,Pistol,"Good condition sig p229r with srt trigger and 4 mags.  Chambered in 9mmwanting to trade for an inox beretta 92fs or compact. Other trades I may look at but primarily looking for the 92fs inox, may be interested in the standard beretta 92fs with cash on your end. Handgun only"
13,http://www.armslist.com/posts/5708013,For Sale:  S&W Bodyguard .380 w/laser,"Auburn, Tacoma, Washington",$ 275,"Listed On: Friday, July 22, 2016",Handguns,Smith & Wesson                                                                                ,380 ACP                                                                                ,Double / Single Action                                                                                ,Pistol,"Selling practically new S&W Bodyguard .380 with integrated laser. The firearm has only been fired on one occasion with minimal rounds for testing.Comes with factory box, 2 magazines (one of them has a pinky extension) and grip texture on the handle.$275 plus you pay the FFL transfer. Must have CPL."
14,http://www.armslist.com/posts/5708014,For Sale/Trade:  Stream light m6 light laser combo,"Norman, Oklahoma City, Oklahoma",$ 150,"Listed On: Friday, July 22, 2016",Optics,no type,no type,no type,no type,Looking to sell or trade a barely used stream light m6 weapon light. Light laser combo.
16,http://www.armslist.com/posts/5708016,For Sale:  1000 Rounds Remington 223 Ammo,"North Greensboro, Greensboro, North Carolina",$ 335,"Listed On: Friday, July 22, 2016",Ammo,no type,no type,no type,no type,I have a case of new Remington 223 ammo for sale. 20 boxes of 50 for 1000 rounds. $335 for all 20 boxes or $17 per box of 50.
17,http://www.armslist.com/posts/5708017,For Sale:  Savage  12 Gauge Pump Model 69RXL - 12Gauge - Pump,"Southwest, Inland Empire, California",$ 325,"Listed On: Monday, December 11, 2017",Shotguns,Savage Arms                                                                                ,12 Gauge                                                                                ,Pump Action                                                                                ,Shotgun,"For sale is a nice, clean Savage Model 69 RXL Series E pump shotgun.  Capacity is 6+1, barrel is 18"", and it has factory swivel studs for a sling.  It is Cylinder choke and is a strong 99% overall condition with no nicks, dings or scratches that I could find.  LOP is 14 1/2"".  Perfect home defense gun or all around shooter.  $325.  Dave 95one-64two-171seven.If you are reading this ad it is still available, but if you still need to ask, leave a phone number or you get no response."
18,http://www.armslist.com/posts/5708018,For Sale:  Sphinx SDP,"East, Colorado Springs, Colorado",$ 810,"Listed On: Thursday, August 4, 2016",Handguns,KRISS/Sphinx                                                                                ,9mm Luger (9x19)                                                                                ,Double / Single Action                                                                                ,Pistol,Sphinx SDP 9mm 20 round count with Redleg Tactical IWB holster
19,http://www.armslist.com/posts/5708019,For Sale:  Ruger Mini-14 Tactical,"Pike County, Indiana, United States",$ 600,"Listed On: Tuesday, August 9, 2016",Rifles,Ruger                                                                                ,223/5.56 NATO                                                                                ,Semi-automatic                                                                                ,Rifle,"tactical stock with collapsible, folding stock; in excellent condition; have shot ~500 rds through it."
20,http://www.armslist.com/posts/5708020,For Sale:  RUGER P90 45ACP,"Taylors, Greenville, South Carolina",$ 325,"Listed On: Sunday, September 11, 2016",Handguns,Ruger                                                                                ,45 ACP                                                                                ,Double / Single Action                                                                                ,Pistol,"RUGER P-90 45ACP.,4.5 INCH BARREL,SAFTEY AND DECOCKER,LOG#631,add 4% if using a card"
21,http://www.armslist.com/posts/5708021,For Sale:  NIB Glock 22C Compensated 40cal,"Ocean Springs, Gulfport / Biloxi, Mississippi",$ 475,"Listed On: Friday, July 22, 2016",Handguns,no type,40 cal                                                                                ,Striker Fire,no type,"NIB Glock 22C 40cal, two 15rd mags, easy loader, rod/brush & box. $475. Ocean Springs."
22,http://www.armslist.com/posts/5708022,For Sale/Trade:  Glock 23 Gen4,"Off I-64, Louisville, Kentucky",$ 450,"Listed On: Friday, July 22, 2016",Handguns,Glock                                                                                ,40 cal                                                                                ,Double Action                                                                                ,Pistol,"Text for ONLY RESPONSE- REDACTED. Here is a LNIB Glock 23 Gen4 with everything from factory. Gun has never been shot, seriously just like you walked out of the shop with it new."
25,http://www.armslist.com/posts/5708025,For Sale:  Hornady .308cal 150gr fmj/c,"clark, South Dakota, United States",$ 200,"Listed On: Friday, July 22, 2016",Reloading,no type,no type,no type,no type,New in bag 1000 Hornady .308cal 150gr FMJ/wc $200.    $.20/pcs. Call or text 60588one998six
26,http://www.armslist.com/posts/5708026,For Sale/Trade:  Husqavarna weed eater and back pack blower,"Cleveland, Chattanooga, Tennessee",$ 300,"Listed On: Friday, July 22, 2016",Handguns,no type,no type,no type,no type,I know this isn't a gun post me and my wife moved to an apartment so I no longer have use for the they run great. Would like to trade for a couple hi points. Or another gun worth 300.00
27,http://www.armslist.com/posts/5708027,For Sale:  Ruger Super Blackhawk Bisley .44 Mag - Like New,"Arvada, Denver, Colorado",$ 450,"Listed On: Thursday, August 4, 2016",Handguns,Ruger                                                                                ,44 Magnum                                                                                ,Double / Single Action                                                                                ,Revolver,"Had this a few years and it's been sitting in the safe, reluctantly selling it to pay some bills. Includes a 50 count box of Remington 180gr JSP ammo. Local sales only, meet at FFL to complete transaction, a few I know of that have cheap transfer fees are The Shootist (Denver), Hammer Down (Wheat Ridge) and ARK Tactical (Littleton).    Grips: Bisley Black Laminate    Front Sight: Ramp    Barrel Length: 3.75""    Material: Stainless Steel    Capacity: 6    Rear Sight: Adjustable    Twist: 1:20"" RH    Finish: Satin Stainless    Overall Length: 9.63""    Weight: 44 oz.    Grooves: 6    Features Bisley-Style Grip    Patented transfer bar mechanism and loading gate interlock provide an unparalleled measure of security against accidental discharge.    Reliable with coil springs throughout for durability.    Adjustable rear sight and fixed, replaceable insert ramp front sight.    Cold hammer-forged barrel results in ultra-precise rifling that provides exceptional accuracy, longevity and easy cleaning."
29,http://www.armslist.com/posts/5708029,For Sale:  NICE - Smith & Wesson Model 60 - Stainless Steel - No Dash -2 Inch Barrel 38 spl - J Frame - Cheifs / Dectectives Special - 5 shot,"Oldsmar, Tampa/St. Pete, Florida",$ 550,"Listed On: Thursday, August 11, 2016",Handguns,Smith & Wesson                                                                                ,38 S&W Special                                                                                ,Double / Single Action                                                                                ,Revolver,Very NICE S&W Model 60 No DashStainless Steel 2 Inch Barrel 38 spl J Frame Cheifs / Dectectives Special 5 shot
30,http://www.armslist.com/posts/5708030,For Sale:  AR15 Upper Reciever & Bolt Carrier Group,"Mt. Pleasant, Charleston, South Carolina",$ 120,"Listed On: Friday, July 22, 2016",Gun,no type,no type,no type,no type,Smith & Wesson Upper Reciever & Bolt Carrier Group for AR15New.......never used or fired
32,http://www.armslist.com/posts/5708032,For Sale/Trade:  Glock 36,"Rochester, Rochester, New York",$ 400,"Listed On: Sunday, August 7, 2016",Handguns,Glock                                                                                ,45 ACP                                                                                ,Striker Fire                                                                                ,Pistol,"Glock 36, single stack. Used in great condition. 2 Mags, Box and materials. OWB holster also included.Might be willing to trade for a semi-auto 12 gauge."
33,http://www.armslist.com/posts/5708033,For Sale/Trade:  9mm Semiauto Pistol and More,"Maple Lake, Minnesota, United States",$ 0,"Listed On: Tuesday, August 2, 2016",Handguns,SCCY                                                                                ,9mm Luger (9x19)                                                                                ,Striker Fire                                                                                ,Pistol,"+++++ IF AD IS UP...PISTOl IS STILL AVAILABLEMY:+ SCCY CPX-2 (9mm) and (2) 10 round mags...Like New, in box.+ Leather IWB Holster+50 rounds ammo$235...pick up in Annandale.Thes get GREAT reviews and have lifetime warranty.The camo grip tape is non-perm ...comes off easily if not wanted.FOR YOUR: Firearm I might use."
34,http://www.armslist.com/posts/5708034,"For Sale:  Ruger AR556 .223/5.56, new in box","Del City, Oklahoma City, Oklahoma",$ 695,"Listed On: Wednesday, February 1, 2017",Rifles,Ruger                                                                                ,223/5.56 NATO                                                                                ,no type,Rifle,"Ruger AR556 .223/5.56, new in box  - $695"
36,http://www.armslist.com/posts/5708036,For Sale/Trade:  Daniel defense M4A1,"Oak harbor, Seattle, Washington","$ 1,800","Listed On: Wednesday, July 27, 2016",Rifles,Daniel Defense                                                                                ,223/5.56 NATO                                                                                ,Semi-automatic                                                                                ,Rifle,"For SALE or TRADE. Daniel defense M4A1 5.56 with. 14.5 inch barrel. This gun is awesome! Fired around 500 rounds since buying it last year. Comes with BCM flip up front and rear iron sights, tango down quick detach fore grip, BCM pistol grip, BCM charging handle and BCM stock. I also have the EO tech exps-3 red dot sight and EO tech G33 magnifier with original boxes for each of them. I'll also throw in 5 magazines. Looking to get $1800 for the package but will sell with out the magnifier and sight.  Without the EO techs rifle will cost $1200. Will trade for a fishing canoe or kayak and any high end fishing gear like rods and reels and waders that are in like new condition. Let me know what you have worst I could say is know. I also have a couple shotguns and a few other rifles and scopes if you're not looking for a Daniel defense."
37,http://www.armslist.com/posts/5708037,"For Sale:  GLOCK 17 w/ TRUGLO, Holster, & Ammo","Fort Riley, Ft. Riley, Kansas",$ 620,"Listed On: Friday, October 21, 2016",Handguns,Glock                                                                                ,9mm Luger (9x19)                                                                                ,Striker Fire                                                                                ,Pistol,"This is a GLOCK 17 GEN 4 (9mm) pistol with orginal case, interchangable backstraps, and three magazines (17 round capacity).It has TRUGLO sights.  It comes with a blackhawk retention holster and 46 rounds of 115 grain Hornaday critical defense hollow point ammunition.Only gone to the range once.  Less than 50 rounds fired through this pistol.Not interested in shipping."
38,http://www.armslist.com/posts/5708038,"For Sale:  , Hogue overmolded stock for short action 700 series Remington","Columbia, Columbia, South Carolina",FREE,"Listed On: Friday, July 22, 2016",Gun,no type,no type,no type,no type,I have a hug short action 700 Remington series stock for sale fits REDACTED Remington 700 rifles up to bull barrel as well $80 firm
39,http://www.armslist.com/posts/5708039,For Sale:  Lapua 308/170gr bullets,"east, Indianapolis, Indiana",$ 260,"Listed On: Friday, July 22, 2016",Reloading,no type,no type,no type,no type,for sale:   Lapua D46/rebated boat tail/.308/170gr. bullets.  These are no longer available from Lapua.  I have 1100 for $260.  I will ship if needed in 2 USPS small flat rate boxes for an additional $12 total.
42,http://www.armslist.com/posts/5708042,For Sale:  Savage model 10 .308 precision build,"Dover, Delaware, United States","$ 2,100","Listed On: Friday, July 22, 2016",Rifles,Savage Arms                                                                                ,308/7.62 NATO                                                                                ,Bolt Action                                                                                ,Rifle,Left hand modelrifle has:tac 21 chassis swfa scope dada scope ring mountharris style bipod kahntrol muzzle break magpul precision stock magpul pistol grip 1 magazine
43,http://www.armslist.com/posts/5708043,For Sale:  Springfield XD Sub-Compact 9mm,"Ohio City, Cleveland, Ohio",$ 350,"Listed On: Friday, July 22, 2016",Handguns,Springfield                                                                                ,9mm Luger (9x19)                                                                                ,no type,Pistol,"I've owned this pistol for several years, and there's only been about 100 rounds put through it.  I have 3 magazine in total that will come with the pistol.  I do not have the case.  Looking for cash, but the only trade i'm open to is a Glock 17, which I can bring cash to the deal for.  $350 Firm.Serious inquiries only please, but contact me with questions or details."
44,http://www.armslist.com/posts/5708044,For Sale:  S&W M&P 22LR for sale great price,"Tampa/Lutz, Tampa/St. Pete, Florida",$ 375,"Listed On: Friday, July 22, 2016",Rifles,Smith & Wesson                                                                                ,22 Long Rifle                                                                                ,Semi-automatic                                                                                ,Rifle,"S&W M&P 22LR for sale i may consider trading, but mainly looking for cash. I dont need the rifle its mainly for range practice and small game hunting. It is in superb shape and looks amazing asking 375 or best offer gun is worth 550 with camo brand new ive added a foregrip, a red dot sight and a retractable stock. so brand new would be well over 550. no low balls. serious inquiries only thanks. the TLR 3  tactical light does not come with it was only to see how it looked on the rifle."
45,http://www.armslist.com/posts/5708045,For Sale:  Glock 30 Gen 3/45 ACP,"Shawnee, Oklahoma City, Oklahoma",$ 450,"Listed On: Thursday, August 25, 2016",Handguns,Glock                                                                                ,45 ACP                                                                                ,Striker Fire                                                                                ,Pistol,"Glock 30 generation 3. Comes with 3 Glock 10 round magazines and around 50 rounds of hollow point. Also has 3-1/2 pound trigger, extended slide release and magazine release. I don't have the box it came in."
46,http://www.armslist.com/posts/5708046,For Sale/Trade:  9mm Revolver,"Edmond, Oklahoma City, Oklahoma",$ 380,"Listed On: Wednesday, August 10, 2016",Handguns,Taurus                                                                                ,no type,Double / Single Action                                                                                ,Revolver,"Taurus model 905 9mm revolver. More power than 38 special and uses less expensive 9mm ammo. Comes with 5 moon clips (work like speed loaders), lock keys and all original paperwork and box. Accurate and reliable. Very low round count. Must show concealed carry license to purchase. $380. Text REDACTED"
47,http://www.armslist.com/posts/5708047,For Trade:  8lb of Varget for 8lbs of H4350,"Kitsap, Bremerton, Washington",Offer,"Listed On: Tuesday, December 6, 2016",Reloading,no type,no type,no type,no type,Looking to trade unicorns here. An unopened 8 pound jug of Varget for a sealed container 8 pound container of H4350. Shoot me a PM if you have some. Thanks.
