,url,title,location,price,post date,category,manufacturer,caliber,action,firearm type,postcontent
734,http://www.armslist.com/posts/8003734,For Sale:  Browning 10 Gauge Pump,"Suffolk/Elizabeth  city, Hampton Roads, Virginia",$ 600,"Listed On: Thursday, March 8, 2018",Shotguns,Browning                                                                                ,10 Gauge                                                                                ,Pump Action                                                                                ,Shotgun,I have for sale / trade All black 10 gauge with Turkey  engravings on one side and goose on the other side on receiver... Not shipping nor traveling very long distances.. $600.00 text me anytime REDACTED... cash or let me see your trade offers ... Thanks
737,http://www.armslist.com/posts/8003737,For Sale:  Sig 229 S4 Suppressor Ready 9mm,"Lutz, Tampa/St. Pete, Florida",$ 800,"Listed On: Wednesday, February 21, 2018",Handguns,Sig Sauer                                                                                ,9mm Luger (9x19)                                                                                ,Double / Single Action                                                                                ,Pistol,"I am selling my sig p229 S4 variant. This is a factory suppressor ready 229. It comes with factory suppressor high sig sights and factory threaded barrel. It is chambered in 9mm, includes SRT trigger and runs flawlessly. Includes 2 13rnd mags. Asking $800 obo. No trades unless its also a high end sig in 9 or 45. No sales to felons, must be legally able to purchase a firearm and a resident of the state of florida. Please text 8I3 382 5I55"
739,http://www.armslist.com/posts/8003739,For Sale:  FNH FN15 SRP TACTICAL CARBINE 5.56 Rifle,"Wake Forest, Raleigh / Durham / CH, North Carolina","$ 1,074","Listed On: Thursday, May 3, 2018",Rifles,FN Herstal S.A.                                                                                ,223/5.56 NATO                                                                                ,Semi-automatic                                                                                ,Rifle,"FNH FN15 SRP TACTICAL CARBINE 5.56 Rifle More pictures coming soon- Qty of 2 available Description Caliber: 5.56x45mm Operation: Direct impingement Mag Capacity: 30 Rd. Weight: 6.0 lb. Barrel Length: 16″ PRIMARY FEATURES • Lightweight Midwest Industries LWM M-LOK 12” rail/forearm • Button-broached barrel with pinned and welded A2-style flash hider • Semi-automatic only RECEIVER • Hard-anodized aluminum • Flat-top receiver, MIL-STD-1913 rail at the 12 o’clock position • Midwest Rail System with M-LOK technology • Mid-length gas system • Precision Reflex low profile gas block with magnesium phosphate finish STOCK • A2 style grip • 6-Position buttstock TRIGGER • FN Combat Trigger BUFFER ASSY/TUBE • MIL-SPEC H-type buffer assembly with MIL-SPEC springs • MIL-SPEC buffer tube OPERATING CONTROLS • Ergonomic safety lever and magazine release • Forward Assist MAGAZINE • AR-style 30-round capacityPurchase Here: https://www.tarriverarms.com/product/fnh-fn15-srp-tactical-carbine-5-56-rifle/"
740,http://www.armslist.com/posts/8003740,For Trade:  CZ Bren 805 Pistol,"Akron, Akron, Ohio",Offer,"Listed On: Wednesday, February 21, 2018",Rifles,CZ USA                                                                                ,5.56×45mm NATO                                                                                ,Semi-automatic                                                                                ,Rifle,Not looking to sell  only wanting to trade for a iwi Tavor X95 prefer it in black because I already have it in FDEBren pistol Has SB Tactical folding arm braceIt's like new has exactly 60rds thru it/ box paperwork etcEotech not included unless your trade has a meprolight M21 on itThanks.
741,http://www.armslist.com/posts/8003741,For Sale:  Blaser Briley Spectrum Choke Tubes,"Snowflake, White Mountains, Arizona",$ 35,"Listed On: Wednesday, February 21, 2018",Gun,no type,no type,no type,no type,"Briley Spectrum chokes for 12 gauge Blaser F3 and F16. The two Improved Cylinder are brand new, the 2 Modified are slightly used with no scratches on the colored bands...like new still. $35 each."
742,http://www.armslist.com/posts/8003742,For Sale/Trade:  *SOLD* Beretta 1301 Tactical + light,"Ann Arbor, Ann Arbor, Michigan",$ 750,"Listed On: Wednesday, February 21, 2018",Shotguns,Beretta USA                                                                                ,12 Gauge                                                                                ,Semi-automatic                                                                                ,Shotgun,"Have too many guns that sit in the safe so this one has to go.Like new condition, two range trips, cleaned and cared for.Includes Steiner Mk7 battle light which is attached to the mag tube where the mag cap would normally be. Excellent setup for home defense. Comes with original packaging amd contents.Priced to sell."
744,http://www.armslist.com/posts/8003744,Want To Buy:  Cz shadow 2,"Brandon, Jackson, Mississippi",Offer,"Listed On: Wednesday, February 21, 2018",Handguns,CZ USA                                                                                ,9mm Luger (9x19)                                                                                ,Double / Single Action                                                                                ,Pistol,want to buy a cz shadow 2
745,http://www.armslist.com/posts/8003745,For Sale:  S&W M36 38spl,"Cheviot, Cincinnati, Ohio",$ 500,"Listed On: Wednesday, February 21, 2018",Handguns,no type,no type,no type,no type,"S&W M36 38spl. Box, 2 extra sets of mags, and paddle holster. $500obo."
748,http://www.armslist.com/posts/8003748,"For Sale:  Springfield Armory SAINT 5.56 16"" BRAVO Rifle","Wake Forest, Raleigh / Durham / CH, North Carolina",$ 745,"Listed On: Thursday, May 3, 2018",Rifles,Springfield                                                                                ,223/5.56 NATO                                                                                ,Semi-automatic                                                                                ,Rifle,"Springfield Armory SAINT 5.56 16"" BRAVO Rifle More Pictures coming soon- Qty 2 in stock Description Caliber: 5.56x45mm NATO (.223REM) Length: 35.5″ Fully Extended / 32.25″ Collapsed Weight: 6lbs 11oz Upper Receiver: Type III Hard Coat Anodized Aircraft Grade 7075 T6 Aluminum Flat Top, Forward Assist and M4 Feed Ramps Lower Receiver: Type III Hard Coat Anodized Aircraft Grade 7075 T6 Aluminum, Accu-Tite™ Tension System Barrel: 16″ Chrome Moly Vanadium, 1:8 RH Twist, Melonite® Gas System: Direct Impingement Mid-Length Gas System, .750 Diameter Gas Block Trigger: Springfield Armory® Proprietary, Nickel Boron Coated GI Sights: Springfield Armory® Low Profile Flip-Up, Dual Aperture Rear, 1/2 MOA Windage Adj. Trigger Guard: Bravo Company Pistol Grip: Bravo Company Mod 3 Handguard: New, Exclusive Bravo Company, KeyMod, PKMR Butt Stock: Bravo Company 6 Position Buffer Assembly: Carbine “H” Heavy Tungsten Buffer Receiver Extension: Mil-Spec Carbine Receiver Extension, 7075 T6 Type III Hard Anodized Aluminum Charging Handle: GI Style Bolt Carrier Group: M16 BCG w/ Carpenter 158 Steel Bolt, Shot Peened & Magnetic Particle Inspected Magazine: 1-30 Round Magpul PMAG Gen M3 Purchase Here: https://www.tarriverarms.com/product/springfield-armory-saint-5-56-16-bravo-rifle/"
749,http://www.armslist.com/posts/8003749,For Sale:  FNX 9,"Cheviot, Cincinnati, Ohio",$ 475,"Listed On: Wednesday, February 21, 2018",Handguns,no type,no type,no type,no type,FNX 9mm. 3 mags and case. Never fired. $475 SA/DA. Nice gun.
750,http://www.armslist.com/posts/8003750,For Sale:  Slide fire bump stock,"Shakopee, Bloomington, Minnesota",$ 350,"Listed On: Tuesday, February 27, 2018",Gun,no type,no type,no type,no type,"Slide fire SSAR-15A SBS bump stock. Fits pretty much any carbine style ar15. Used once, put about 200 rounds down range works great. Buy it now while you can. $350obo. Call or text Scott 612 two one four 8804."
755,http://www.armslist.com/posts/8003755,For Sale:  SPRINGFIELD XDS 9mm,"Danbury, Bridgeport, Connecticut",$ 375,"Listed On: Wednesday, February 21, 2018",Handguns,Springfield                                                                                ,9mm Luger (9x19)                                                                                ,Striker Fire                                                                                ,Pistol,springfield XDS 9mm 3.3 barrel. Lows rounds . Text  because I usually forget to check emails .  (203)2418932trades also possible for small pocket pistol
756,http://www.armslist.com/posts/8003756,For Sale:  Sig  P239 Scorpion 9mm,"Greensboro, Greensboro, North Carolina",$ 650,"Listed On: Wednesday, February 21, 2018",Handguns,Sig Sauer                                                                                ,9mm Luger (9x19)                                                                                ,Double / Single Action                                                                                ,Pistol,"This Sig p239 Scorpion is like new. Excellent condition, not a scratch, IN THE BOX. I have two, this one it too pretty for me to shoot, plus I'm downsizing. It has Tritium night sights, SRT and it's in perfect condition. There are a total of 5 new oem Sig magazines. Included is a Krounds Kydex pancake holster. Missing from it though are the G10 grips. I didn't like the feel. I replaced them with original grips and a Hogue Jr slip on. Feels much better. This pistol has had only 45 rounds fired. It is PERFECT"
759,http://www.armslist.com/posts/8003759,For Sale:  Smith & Wesson 686 Plus (7-Shot) .357 Magnum Revolver - TALO  Edition,"sedalia, Denver, Colorado",$ 745,"Listed On: Wednesday, February 21, 2018",Handguns,Smith & Wesson                                                                                ,357 Magnum                                                                                ,Double / Single Action                                                                                ,Revolver,Awesome Smith & Wesson 686 PLus (7-Shot) .357 Revolver - Like New in Orginal Serialized S&W Hard Shell Case with Papers. Save over $200 from new. Comes with 7-Shot Speed Loader.
761,http://www.armslist.com/posts/8003761,For Trade:  Custom Rock River M4 AR,"Sevier, Knoxville, Tennessee",Offer,"Listed On: Monday, February 26, 2018",Rifles,Rock River Arms                                                                                ,223/5.56 NATO                                                                                ,Semi-automatic                                                                                ,Rifle,"Rock River Upper and 16 inch barrel by Cerro Forge 1:8 Twist Nato, Anderson lower BAD Lever, fast reset trigger, Magpul  furniture,  keyhole handguard, 30 round magazine,  Nikon 3x9x40 scope.  If interested please text eight6five705threeone37. If it's listed I have it. Not interested in even trades. Thanks"
762,http://www.armslist.com/posts/8003762,For Sale:  AR 15,"Riverside, Clarksville, Tennessee",$ 500,"Listed On: Wednesday, February 21, 2018",Rifles,Stag Arms                                                                                ,5.56×45mm NATO                                                                                ,Semi-automatic                                                                                ,Rifle,Stag mod 2 in great condition. Comes with pmag
764,http://www.armslist.com/posts/8003764,For Sale:  Smith and Wesson top break,"South county, St. Louis, Missouri",$ 325,"Listed On: Wednesday, February 21, 2018",Handguns,Smith & Wesson                                                                                ,32 S&W                                                                                ,Double Action                                                                                ,Pistol,Smith and Wesson fourth model top break. Chambered in s&w 32. In great shape for its age 325 or best offer
765,http://www.armslist.com/posts/8003765,For Sale/Trade:  1945 Russian M44,"Lexington/St. Matthews, Columbia, South Carolina",$ 300,"Listed On: Monday, April 23, 2018",Rifles,no type,7.62x54R                                                                                ,Bolt Action                                                                                ,Rifle,"1945 Russian M44Includes replica sling, 4 speed clips and ~50 rounds of commercial ammo.Asking $300 Firm, please do not contact with a lower offer."
766,http://www.armslist.com/posts/8003766,"For Sale:  Microtech Ultratech OTF, LEO Model","Main, Dothan, Alabama",$ 400,"Listed On: Wednesday, February 21, 2018",Handguns,no type,no type,no type,no type,I am selling an authentic Microtech ultratech law enforcement officer (LEO) special edition knife. The knife has handling marks from being lightly carried but is in perfect mechanical condition.I will only sell to Alabama residents and will not ship outside Alabama due to Federal Regulations.
767,http://www.armslist.com/posts/8003767,For Sale:  Vortex Razor 56mm,"California, California, United States","$ 1,500","Listed On: Wednesday, February 21, 2018",Optics,no type,no type,no type,no type,This is an almost Brand new Scope. i would have loved to keep her but i need cash.it is in MIl not MOA4.5-27x56mmSide focus (1/10 MIL)Adjustments (10 MIL/Rev)
768,http://www.armslist.com/posts/8003768,For Sale:  Glock 34 Gen 4 Stock set-up $490,"Roanoke Blacksburg, Roanoke, Virginia",$ 490,"Listed On: Wednesday, February 21, 2018",Handguns,Glock                                                                                ,9mm Luger (9x19)                                                                                ,Striker Fire                                                                                ,Pistol,"Glock 34, Gen 4, 3 magazines. Newly purchased, shot one time at range, under 60 rounds.  Consider in new shape. $490 firm. No trades please. Comes with original case and everything in the case. Stock set-up, no modifications, as is from Glock."
769,http://www.armslist.com/posts/8003769,For Sale/Trade:  SIG 227 FDE,"Roanoke/NRV, Roanoke, Virginia",$ 900,"Listed On: Monday, April 16, 2018",Handguns,Sig Sauer                                                                                ,45 ACP                                                                                ,Double / Single Action                                                                                ,Pistol,SIG 227 VG condition FDE 9 mags ; comes with 3 (10) rounders and also have 6 extra mags for sale  3 NIB 10round and 3 NIB 14 round magsphoto is stock photo can send more pics if interested14 round mags hard to find and expensive gun retails new 800 and up mags are over 250.00 newwilling to ship
770,http://www.armslist.com/posts/8003770,For Sale:  Glock 42 FDE,"South, Huntsville, Alabama",$ 375,"Listed On: Friday, March 9, 2018",Handguns,Glock                                                                                ,380 ACP                                                                                ,Striker Fire                                                                                ,Pistol,Excellent condition. FDE with new iDot Pro night sights. Three magazines and case with paperwork. One magazine has MagGuts installed so you can get an extra round in it. All 3 magazines are the new 03 version.   Talon Grip installed along a grip plug. Must meet in or close to Huntsville.NO SHIPPING
772,http://www.armslist.com/posts/8003772,For Trade:  Kimber 1911 for trade $900,"Lynn haven, Panama City, Florida",Offer,"Listed On: Thursday, March 15, 2018",Handguns,Kimber                                                                                ,45 ACP                                                                                ,no type,Pistol,"I wanted to trade my Kimber pro crimson carry 2 it’s a 45 in excellent condition it has two magazines and the crimson trace grip. Im interested in a full size AK or full size Colt, S&W, or FN AR (with cash on my end if necessary), Saiga (12,20,or410) a FN 509,FNX, or five seven also the M&P, M&P shield, or M&P 380"
773,http://www.armslist.com/posts/8003773,For Sale:  Slide fire ak right hand stock,"Stroudsburg, East Stroudsburg, Pennsylvania",$ 250,"Listed On: Wednesday, February 21, 2018",Gun,no type,no type,no type,no type,Selling a new in package slide fire stock for stamped receiver AK. Cash only and pick up on stroudsburg. I'm not driving to meet you. No trades.
774,http://www.armslist.com/posts/8003774,For Sale:  LEATHER RIFLE SCABBARD--NEW,"Kokomo/peru, Kokomo, Indiana",$ 125,"Listed On: Wednesday, February 21, 2018",Rifles,no type,no type,no type,Rifle,I bought these while in Mexico. Nice high quality leather. Neat elk design.  Have decided to sell one of them and keep one. Will take $125. Your choice of color/design.  Text REDACTED
775,http://www.armslist.com/posts/8003775,For Sale/Trade:  Garmin Fenix 3 GPS smart watch,"Downtown/Irmo, Columbia, South Carolina",$ 190,"Listed On: Monday, February 26, 2018",Miscellaneous,no type,no type,no type,no type,"This Garmin is in really nice shape. Big display, easily viewable in any conditions.All the specs are available if you search ""Garmin Fenix 3 Sapphire"" in Google so I won't bore you here.Watch comes with the USB charger.Email me if you're interested. I can meet in downtown Columbia or in Irmo, depending on the day/time.$190 firm"
776,http://www.armslist.com/posts/8003776,Want To Buy:  ISO: G21 or G20,"Valdosta, Valdosta, Georgia",$ 500,"Listed On: Wednesday, February 21, 2018",Handguns,Glock                                                                                ,10mm                                                                                ,Striker Fire                                                                                ,Pistol,ISO: Glock 21 gen4        Glock 20 gen4I have cash in hand.
777,http://www.armslist.com/posts/8003777,For Sale/Trade:  Like New S&W M&P 45c Conceal Carry Package,"New Berlin, Milwaukee, Wisconsin",$ 550,"Listed On: Wednesday, February 21, 2018",Handguns,Smith & Wesson                                                                                ,45 ACP                                                                                ,no type,Pistol,"Like New S&W M&P 45c with low round count threw it comes with 3 8 round S&W magazines and 1 14 round S&W magazine w/ x-grip to fit to gun, updated Apex trigger, aluminum back slide plate w/ pit bull on it (Still have stock plate too) and IWH. About $750 invested into it with everything.. Also comes with two different defense (Ruger ARX & Ultimate Defense)ammo and 50 Windchester target Ammo with plastic hard case ammo holder..Cash works too... $550 OBO"
778,http://www.armslist.com/posts/8003778,"For Sale:  PRE WEEKEND SALE ***Glock, HK, Sig Sauer NO TRADES","Hartland, Ann Arbor, Michigan","$ 7,820","Listed On: Wednesday, February 21, 2018",Handguns,no type,no type,no type,no type,"PRE WEEKEND SALE ***Glock, HK, Sig Sauer NO TRADESPrices are FIRM with no trades.Please read what comes with each pistol....All pistols are in EXCELLENT condition or NEW"
779,http://www.armslist.com/posts/8003779,For Sale:  Ar15,"Greenleaf, Ft. Riley, Kansas",$ 600,"Listed On: Wednesday, February 21, 2018",Rifles,DPMS                                                                                ,223/5.56 NATO                                                                                ,Semi-automatic                                                                                ,Rifle,Dpms ar15 flip up sight' s and sure sight holographic sight quad rail all magpul add on s sling forgrip and 4 mags 600.00 location Greenleaf ks call or text REDACTED
780,http://www.armslist.com/posts/8003780,For Trade:  Savage Axis 30-06,"Fort Benning, Columbus, GA, Georgia",Offer,"Listed On: Wednesday, February 21, 2018",Rifles,Savage Arms                                                                                ,30-06 Springfield                                                                                ,Bolt Action                                                                                ,Rifle,"Savage axis Bolt action rifle30-0622"" barrel12x44 copperhead scope"
782,http://www.armslist.com/posts/8003782,For Sale/Trade:  Mossberg 500,"Homestead, Miami-Dade, South Florida",$ 350,"Listed On: Wednesday, February 21, 2018",Shotguns,Mossberg                                                                                ,12 Gauge                                                                                ,Pump Action                                                                                ,Shotgun,"never fired, includes pistol grip box of shells, and a hard case."
785,http://www.armslist.com/posts/8003785,For Sale:  Brand New Molot Vepr 223/556 Rare  Fluted Barrel Version,"Southwest, Las Vegas, Nevada","$ 1,200","Listed On: Wednesday, February 21, 2018",Rifles,no type,223/5.56 NATO                                                                                ,Semi-automatic                                                                                ,Rifle,Hi I have a brand new Molot Vepr  in 223/556 with a fluted barrel which I haven’t been able to fined another one like it come with factory ten round magazine looking to sell for $1200 obo
787,http://www.armslist.com/posts/8003787,For Sale:  Ar15 Hybrid Multi-Cal,"Cleveland, Chattanooga, Tennessee",$ 550,"Listed On: Wednesday, February 21, 2018",Rifles,no type,223/5.56 NATO                                                                                ,Semi-automatic                                                                                ,Rifle,AR15 Hybrid Multi-Cal 556/223. Only shot about 80 rounds through it good gun. Call or text prefer Text. REDACTED May trade
788,http://www.armslist.com/posts/8003788,For Sale/Trade:  Bushmaster m17s,"Port Charlotte, South West Florida, Florida",$ 800,"Listed On: Tuesday, February 27, 2018",Rifles,Bushmaster                                                                                ,5.56×45mm NATO                                                                                ,Semi-automatic                                                                                ,Rifle,Good condition Ser# 34** can send more pics upon request....For trade I'm interested in Springfield xdm 9mm plus cashand 1911's I can add cash on my end if needed for a 1911. Will also ship.
789,http://www.armslist.com/posts/8003789,For Sale/Trade:  AR15 Slide Fire/Bump Stock,"Indian Trail, Charlotte, North Carolina",$ 150,"Listed On: Wednesday, February 21, 2018",Gun,no type,no type,no type,no type,New/Unused no box Slide Fire SSAR-15 OGR version of bump stock for AR-15.Local pickup - Charlotte area.
793,http://www.armslist.com/posts/8003793,For Sale/Trade:  Aero 9mm survival rifle,"Irvington/East side, Indianapolis, Indiana",$ 575,"Listed On: Wednesday, February 21, 2018",Rifles,no type,9mm Luger (9x19)                                                                                ,Semi-automatic                                                                                ,Rifle,"TNW firearms Aero survival rifle. Caliber is 9mm. It works with 9mm Glock magazines. I will include 2 extra 33 round magazines. It has a single point sling mount installed. It has a red dot sight (CVlife, cheaper Amazon sight) mounted on it. 1 mag ran thru it to test and sight in. Unscrew the barrel and put it in a ""bug out"" bag. Check out their website and see all the different things you can do with a breakdown carbine. I have a great set up with my other rifle so i just dont really need this one. My lost is someone elses treasure."
794,http://www.armslist.com/posts/8003794,For Sale/Trade:  Built 18 inch side charging  AR-15,"North Georgia, Atlanta, Georgia",$ 0,"Listed On: Wednesday, February 21, 2018",Rifles,no type,223/5.56 NATO                                                                                ,Semi-automatic                                                                                ,Rifle,"18 inch side charging AR in .223 wylde. Upper was built by pro2a tactical in Atlanta. Lower is PSA with a mission first tactical stock, grip, and mbus sights. Rifle is very accurate and has less than 100 rounds through it. Comes with a 30 round Colt mag, 20 round mag and 60 rounds of 62 grain ammo. Shoot me an offer."
795,http://www.armslist.com/posts/8003795,For Trade:  Black tarus 357mag 8 shot,"Newport, Knoxville, Tennessee",Offer,"Listed On: Monday, March 12, 2018",Handguns,Taurus                                                                                ,357 Magnum                                                                                ,Double Action                                                                                ,Revolver,Nice gun just missing the tarus logo on one of the grips want to trade for ?? Offer up text anytime 4234650342 like to have a glock
