,url,title,location,price,post date,category,manufacturer,caliber,action,firearm type,postcontent
0,http://www.armslist.com/posts/8003000,For Sale:  Mossberg 930 Shotgun NEW,"Wells, Minneapolis / St. Paul, Minnesota",$ 500,"Listed On: Tuesday, February 20, 2018",Shotguns,Mossberg                                                                                ,12 Gauge                                                                                ,Semi-automatic                                                                                ,Shotgun,"Mossberg 930 Shotgun12 Gauge (2 3/4"" & 3"" shells)Semi Automatic Tactical ShotgunBRAND NEW, never fired.  Comes in original packaging all sealedFace to Face Cash SaleContact by Email or Text at 507-461-031(Seven) Prefer buyers with PTPPlease check out our other listings as we are thinning the herd and selling a ton of new and like new firearms, snap on toolboxes, and pelican coolerThanks for looking!"
3,http://www.armslist.com/posts/8003003,For Sale:  S&w 638 airweight,"Clarkston, Detroit, Michigan",$ 375,"Listed On: Saturday, May 5, 2018",Handguns,Smith & Wesson                                                                                ,38 S&W Special                                                                                ,Double Action                                                                                ,Revolver,"Hi there, Selling my S&W airweight. Inherited from my grandfather. It has the black finish and exhibits some exterior wear. Pictures on request. I do have my CPL for easy transfer. Has a few rounds of assorted .38 ammo."
5,http://www.armslist.com/posts/8003005,For Sale:  Magpul STR,"McFarland/Madison, Madison, Wisconsin",$ 55,"Listed On: Monday, February 26, 2018",Gun,no type,no type,no type,no type,NO TRADES.Magpul STR stock. - $55
8,http://www.armslist.com/posts/8003008,For Trade:  Norinco NHM-91,"Fond Du Lac, Appleton, Wisconsin",Offer,"Listed On: Sunday, February 25, 2018",Rifles,Norinco                                                                                ,7.62x39                                                                                ,Semi-automatic                                                                                ,Rifle,"rare NHM-91 made by Norinco. has a 20"" heavy duty barrel with a 1.5mm receiver. i fired 30rds through it. looks like it was never used still looks brand new. not in a hurry to get rid of just want to see what's out there."
10,http://www.armslist.com/posts/8003010,For Sale:  Trijicon MRO 1x25 Adjustable Red Dot Sight,"Downtown, Nashville, Tennessee",$ 389,"Listed On: Thursday, March 1, 2018",Optics,no type,no type,no type,no type,"Make an offer.  Brand new in hard plastic original case, never used.The Trijicon Miniature Rifle Optic (MRO®) is a reflex-style, sealed sight intended for use on rifles, carbines, and shotguns to provide fast target acquisition. It is designed to be used with both eyes open, providing the operator with maximum situational awareness. The large aperture and tapered light path maximizes the viewing area in such a small optic, allowing for fast target engagement – especially from non-standard shooting positions. Advanced lens coatings and electronics produce a crisp red dot. The brightness control dial on the MRO is specifically designed for ambidextrous usage. With a mid-adjustment “off” position and eight discernible brightness settings, this brightness dial allows for quick and ergonomic adjustments. The MRO features fully protected adjusters that maintain zero even during rough handling, and can be adjusted without the need for special tools. Hard-anodized, forged 7075-T6 housing is fully sealed and waterproof, providing durability in demanding conditions.Package Includes:1 Trijicon Logo Sticker (PR15)1 Lens Cloth1 MRO Manual1 Warranty Card1 MRO Mount Guide"
21,http://www.armslist.com/posts/8003021,For Sale:  Glock 36 for sale G36 .45acp,"fairview, Asheville, North Carolina",$ 450,"Listed On: Monday, February 26, 2018",Handguns,Glock                                                                                ,45 ACP                                                                                ,Single Action                                                                                ,Pistol,"Glock 36 .45acp with box,papers,bore brush, and 2 mags just like if bought new. No trades, and save your time if you want to lowball. Include a phone number in message for response. If you see this ad, then its still available."
24,http://www.armslist.com/posts/8003024,For Sale:  Reloading Supplies,"Frederick CO, Denver, Colorado",$ 450,"Listed On: Tuesday, February 20, 2018",Reloading,no type,no type,no type,no type,"Nosler Brass - 270 Win 50ct $50, 30-06 50ct $50, 7mm Mag 50ct $60Nosler Bullets - 270 caliber Ballistic Tip 150 grain 50ct $20, 30 caliber Ballistic Silver Tip 180 grain 50ct $25, 7mm caliber Partition 175 grain 50ct $30Winchester large rifle primers WLR 1000ct $30Winchester 30 cal 180 grain bullets 151ct $40Alliant Powder RL22 5 pound container $120Free assorted brass. 1 time shot. Nothing has been done after that .38, 30-06, 270 win, 40 cal720-340-6983"
26,http://www.armslist.com/posts/8003026,Want To Buy:  AR-15 Lower Receiver,"Fayetteville, Fayetteville, Arkansas",Offer,"Listed On: Wednesday, February 28, 2018",Gun,no type,no type,no type,no type,Looking for a AR-15 lower receiver.  A new stripped lower would be great but let me know what you have.
28,http://www.armslist.com/posts/8003028,"For Sale:  AR15 - .50 BMG Carbine 18""","Grosse Pointe, Detroit, Michigan","$ 1,400","Listed On: Tuesday, February 20, 2018",Rifles,no type,50 BMG                                                                                ,Bolt Action                                                                                ,Rifle,"Safety Harbor carbine length upper receiver in 50 BMG for any AR15 lower. With an 18"" barrel, this bolt action carbine will wake the dead - from several counties away! Far more convenient than a long-barreled 50 BMG, and still packs a massive 660 grain knock-out punch. *Unfired* complete upper receiver, box and manual included. Does not include lower receiver. Bipod, scope (Bushnell Elite Tactical), and ammo available at extra cost. No sales to prohibited persons, out of state, or anyone without ID (given what this rifle can do, I'd like to see your ID before the deal is done - you can see mine, too). No trades, sorry."
30,http://www.armslist.com/posts/8003030,For Sale:  primary arms 4-14x44,"epping salem, New Hampshire, United States",$ 150,"Listed On: Tuesday, February 20, 2018",Optics,no type,no type,no type,no type,primary arms 4-14x44 scope with rings in new shape $150 obro or trade
35,http://www.armslist.com/posts/8003035,For Sale/Trade:  Msar stg 5.56 gen 4,"Harvest, Huntsville, Alabama","$ 1,500","Listed On: Saturday, April 7, 2018",Rifles,Microtech                                                                                ,223/5.56 NATO                                                                                ,Semi-automatic                                                                                ,Rifle,"Msar stg 5.56 16"" barrel8 magsLooking for kriss vector , let me know what you have, this rifle is in amazing shape.REDACTED"
36,http://www.armslist.com/posts/8003036,For Trade:  M&P 9mm,"Marietta, Atlanta, Georgia",Offer,"Listed On: Monday, February 26, 2018",Handguns,Smith & Wesson                                                                                ,9mm Luger (9x19)                                                                                ,Striker Fire                                                                                ,Pistol,I have a M&P 9mm onlt 50 rounds have been fired through it. Comes with will 2 mags lock and molded inside pant holster made for the gun. Wanting to trade for glock 26 or 27 or a glock 19 only will trade with bill of sale and trader must have ccw.
37,http://www.armslist.com/posts/8003037,For Sale:  Beautiful.243 Remington 760 pump,"In town, Elizabethtown, Kentucky",$ 525,"Listed On: Monday, March 5, 2018",Rifles,Remington                                                                                ,243 Winchester                                                                                ,Pump Action                                                                                ,Rifle,this is a beautiful Remington pump 760 in.243 cal. Has had very few rounds through it. May be interested in partial trades. Text or call between 8am and 10 pm REDACTED asking $525
39,http://www.armslist.com/posts/8003039,For Sale:  Arsenal SLR-106F,"Columbia, Columbia, Missouri","$ 1,200","Listed On: Friday, March 23, 2018",Rifles,no type,223/5.56 NATO                                                                                ,Semi-automatic                                                                                ,Rifle,"Arsenal SLR-106F 5.56mm BD46 date code, ~300 rounds fired includes 8 circle 10 mags. Sells ASIS local to 65201, $1200 OBO"
41,http://www.armslist.com/posts/8003041,Want To Buy:  Wanted ruger 10/22 and sw mp15 ar15,"Oregon city, Portland, Oregon",Offer,"Listed On: Tuesday, February 20, 2018",Rifles,Ruger                                                                                ,22 Long Rifle                                                                                ,Semi-automatic                                                                                ,Rifle,Hi I am in the market for a 10/22 and smith and wesson ar15 let me know what you have. New at nw armory the ar is 500 so i am looking to pay around $350. Transfer fee is about 50 which I will pay as well.
43,http://www.armslist.com/posts/8003043,For Sale:  Rock Island Armory 1911,"South, Everett, Washington",$ 600,"Listed On: Thursday, March 1, 2018",Handguns,Rock Island Armory                                                                                ,45 ACP                                                                                ,Single Action                                                                                ,Pistol,Has approx 250 flawless rounds through it.  Has night sights and picatinny rail for mounting lights/lasers. Comes with (2) 8 round mags.  Buyer must have CPL and pay $25 transfer fee at Sound Loan & Pawn in North Everett.  Willing to trade for a gen 4 Glock 17 MOS.
45,http://www.armslist.com/posts/8003045,"For Sale/Trade:  S&W  1911SC- E Series w/ extras (mags, grips, screws)","Newark/Columbus, Columbus, Ohio",$ 0,"Listed On: Tuesday, February 20, 2018",Handguns,Smith & Wesson                                                                                ,45 ACP                                                                                ,Single Action                                                                                ,Pistol,"NOT PRESSED TO SELL OR TRADE. SO NO LOW BALLSI've got a great condition, Smith and Wesson 1911SC- E Series (Scandium frame). 4.25 inch. Comes with everything from factory as it would new. Will include 5 magazines total, Trijicon night sights, two sets of wood grips and screws (originals and custom set). Also a set of custom matte black grips. I'm asking $1,250 for the whole package. I will not Separate or take less. Again, that's including FIVE mags, THREE sets of grips and screws."
47,http://www.armslist.com/posts/8003047,For Sale:  M&P 15-22,"Akron, Akron, Ohio",$ 400,"Listed On: Tuesday, February 20, 2018",Rifles,Smith & Wesson                                                                                ,22 Long Rifle                                                                                ,Semi-automatic                                                                                ,Rifle,"Looking to trade or sell my M&P 15-22. Will trade for any Glock, can add cash if nessicary. Has been to the range twice. Roughly 400 rounds and cleaned after both times. Will come with 300rds of cci hollow points original box and a hard case.Any transaction will be done in a public place and must have Oh state id. Thank you"
48,http://www.armslist.com/posts/8003048,For Trade:  CZ 712 G2.,"Ft Worth, Dallas, Texas",Offer,"Listed On: Tuesday, February 20, 2018",Shotguns,CZ USA                                                                                ,12 Gauge                                                                                ,Semi-automatic                                                                                ,Shotgun,Cz 712 G2.  It’s a 28 inch 12 gauge.  Brand new.  Bought it 2/17/18. Comes as new in hard case with 5 chokes.  Call or text REDACTED
49,http://www.armslist.com/posts/8003049,For Sale/Trade:  Glock 19,"Eustis, cozad, North Platte, Nebraska",$ 600,"Listed On: Tuesday, February 20, 2018",Handguns,Glock                                                                                ,9mm Luger (9x19)                                                                                ,Striker Fire                                                                                ,Pistol,"Gen 4 Glock 19 distributors exclusive. Has 3 mags , case and all factory stuff."
51,http://www.armslist.com/posts/8003051,For Sale:  WInchester .22 bolt,"Bella Vista, Fayetteville, Arkansas",$ 250,"Listed On: Tuesday, February 20, 2018",Rifles,Winchester                                                                                ,22 Long Rifle                                                                                ,Bolt Action                                                                                ,Rifle,Russian made Winchester bolt .22 LR with scope. Good varmant rifle accurate. $250 4173858530
55,http://www.armslist.com/posts/8003055,For Sale/Trade:  Glock 27,"Bristol, Tri-cities, Tennessee",$ 425,"Listed On: Tuesday, February 20, 2018",Handguns,Glock                                                                                ,40 S&W                                                                                ,Striker Fire                                                                                ,Pistol,"Glock 27 gen 3. Has been undercut and stippled, 3 mags, one has extension also stippled to match. Factory glock night sights, iwb kydex holster and owb fobus holster. Looking for glock 19, 17 or 34 but also open to other guns, optics, reloading equipment, spotting scope, etc.... Text REDACTED"
56,http://www.armslist.com/posts/8003056,For Sale:  Pro-Tech Knives Limited Edition Chris Kyle Collection GODSON SAT/PL 3.15″ CHRIS KYLE PTCK751,"Hinsdale, Illinois, United States",$ 249,"Listed On: Sunday, May 6, 2018",Knives,no type,no type,no type,no type,"Buy now with free shipping! Please click link below. https://blackwolfsupply.com/index.php/product/pro-tech-knives-limited-edition-chris-kyle-collection-godson-sat-pl-3-15-chris-kyle-ptck751/  Description ***Available only to Illinois Residents with valid FOID card from our website***   Pro-Tech’s popular Godson Tuxedo with polished ivory micarta inlays featuring Laser Scrimshaw of the Chris Kyle “Legend” logo – matching ivory micarta push button, individually serial numbered 300 piece limited edition. Like Father, Like Son. This is the highly anticipated 3.15″ blade version of our popular Godfather automatic knife. Italian Inspiration and American Innovation have created another superior coil spring action auto knife. Like the original 4″ blade Godfather, the Godson will be issued in a wide variety of styles and materials.  Blade: 154-CM Stainless Steel, 3.15″ Long Blade, .110″ thick, 59RC Blade Edge: Plain Blade Finish: Satin Blade Length: 3.15″ Blade Style: Spear Point Brand: Pro Tech Model: Godson"
59,http://www.armslist.com/posts/8003059,For Sale/Trade:  1860 double barrel shotgun rare,"Beloit, Janesville, Wisconsin","$ 1,500","Listed On: Tuesday, February 20, 2018",Antique,no type,no type,no type,no type,I have a very rare h&jw king percussion 1860 civil war shotgun everything is in orginal configuration percussion caps need work stock could use work took it to an antique firearm specialist  and was told its worth over 3000 make me an offer will trade for a ar 15 pistol and a 9mm or 45 acp glock text 1608 718 9853 or 1500
61,http://www.armslist.com/posts/8003061,For Sale:  HK 45,"Reno, Reno, Nevada",$ 850,"Listed On: Tuesday, February 20, 2018",Handguns,Heckler & Koch                                                                                ,45 ACP                                                                                ,Double / Single Action,no type,HK45 full size DA/SA w/docker. Factory True Dot nights sites .45 ACP Comes with 3 10-round mags and soft case.Im primarily looking to tradeTruck Gun AR/AKLever ActionRevolversOlder GunsIm open to Resonable offers
62,http://www.armslist.com/posts/8003062,For Trade:  H&K MP5,"Spring Hill, Nashville, Tennessee",Offer,"Listed On: Tuesday, February 20, 2018",Handguns,Heckler & Koch                                                                                ,22 Long Rifle,no type,no type,"I have a H&K MP5 it has two 25 round mags and I can put 1000 rounds of ammo with it... it is pretty good shape , it does have one place on the rear sight where the paint  has rubbed off, I guess it bumped into something in my safe. I am only looking to trade at this time."
63,http://www.armslist.com/posts/8003063,For Sale:  Kel-Tec KSG and CZ 9mm,"St Cloud, St. Cloud, Minnesota","$ 1,500","Listed On: Tuesday, February 20, 2018",Shotguns,Kel-Tec                                                                                ,12 Gauge                                                                                ,Pump Action                                                                                ,Shotgun,"Kel Tec ksg with less than 50 rounds through it with light/laser, pistol grip and red dot.  Also comes with CZ p07 9mm with light and strobe light.  Come in tactical hard case with keys.  $1500 cash, non negotiable.  Kabar not included."
65,http://www.armslist.com/posts/8003065,For Sale:  New Kahr 380 7rd Free Shipping,"ARAB, Huntsville, Alabama",$ 25,"Listed On: Tuesday, February 20, 2018",Magazines,no type,no type,no type,no type,New in package Kahr 380 7rd mag. Free shipping!!Online payment or check/money order
66,http://www.armslist.com/posts/8003066,Want To Buy:  WTB USED OPS CORE LEVEL III BALLISTIC or TEAM WENDY EXFIL HELMET,"SF Bay, San Francisco, California",Offer,"Listed On: Tuesday, March 6, 2018",Tactical,no type,no type,no type,no type,"Looking for a used OPS CORE Level III ballistic or a Team Wendy in MED or MED/ LG size. Urban tan.   Looking to buy or can trade for any of my antique guns or rifles currently posted.   I am looking for a back-up service helmet for AD OCONUS, not for paintball or airsoft bullshit. Thanks   Lou   B/ 416 CA BN (ABN)  REDACTED"
67,http://www.armslist.com/posts/8003067,For Sale:  Browning Hi-Power,"North and Southern Surburbs, Minneapolis / St. Paul, Minnesota",$ 700,"Listed On: Tuesday, February 20, 2018",Handguns,Browning                                                                                ,9mm Luger (9x19)                                                                                ,Single Action                                                                                ,Pistol,"Up for sale is a 1980's vintage HP, made in Belgium, assembled in Portugal.  It has a target sight, Pachmayr grips, no box, very good condition, eg. no holster wear, on a few minor scratches, low round count, extra factory magazine.  $700.00, Firm.Serious inquiries only:  if you send me your ID, I will send you pictures.Terms of sale:FTF, MN resident sales only, PTP, Cash"
71,http://www.armslist.com/posts/8003071,For Sale:  S&W 2.0 4.25 9mm,"West, Orlando, Florida",$ 500,"Listed On: Tuesday, February 20, 2018",Handguns,Smith & Wesson                                                                                ,9mm Luger (9x19)                                                                                ,Striker Fire                                                                                ,Pistol,I have a new barely used mainly a safe queen Smith and Wesson 2.0 9mm 4.25 barrel for sale. My loss your gain. Comes with extra mags. More info feel free to message me
72,http://www.armslist.com/posts/8003072,For Sale:  Colt .45 Government 1911 CHROME,"Liberty, Kansas City, Missouri","$ 1,700","Listed On: Tuesday, February 20, 2018",Handguns,Colt                                                                                ,45 ACP                                                                                ,Single Action                                                                                ,Pistol,I have a beautiful Colt .45 Government model 1911. It is Polished Stainless. It has Spruce tree pinecone grips. This would make an excellent piece for any collection. There are a few very minor surface scratches that can be easily buffed out. Any gun with this finish with always have a few scratches. Price is $1700 or best offer. Text is the best way to reach me. REDACTED.
73,http://www.armslist.com/posts/8003073,For Sale:  F,"I, Portland, Oregon",$ 3,"Listed On: Tuesday, February 20, 2018",Magazines,no type,no type,no type,no type,Y
74,http://www.armslist.com/posts/8003074,For Sale:  Smith and Wesson M&P Shield 9mm,"Winchester, Muncie, Indiana",$ 325,"Listed On: Tuesday, February 20, 2018",Handguns,Smith & Wesson                                                                                ,no type,no type,Pistol,text for info.  REDACTED
75,http://www.armslist.com/posts/8003075,"For Sale/Trade:  S&W Shield 9mm, fde","Bowling Green, Bowling Green, Kentucky",$ 1,"Listed On: Tuesday, February 20, 2018",Handguns,Smith & Wesson                                                                                ,9mm Luger (9x19)                                                                                ,Striker Fire                                                                                ,Pistol,"Bought for carry gun but recently replaced. Low round count. Comes with original box, all paperwork/mags (grip extenders on both mags). Trades preferred. Trades for AR-15 in 5.56/Handguns only (no revolver or shotguns). Can add cash for the right item.Will only deal with Kentucky residents over 21. CCDW preferred, thanks."
76,http://www.armslist.com/posts/8003076,For Sale:  M&P 2.0 FDE 9mm,"Belton, Austin, Texas",$ 450,"Listed On: Tuesday, February 20, 2018",Handguns,Smith & Wesson                                                                                ,9mm Luger (9x19)                                                                                ,Striker Fire                                                                                ,Pistol,"For sale is a Smith & Wesson M&P 2.0 9mm FDE with 5-inch Barrel. Great for competition or tactical use. This gun only has about 200 rounds through it and feels brand new. Comes with original box, 4 back straps, and two 17 round magazines."
77,http://www.armslist.com/posts/8003077,For Sale:  Hornady sonic cleaner,"Burnsville, Minneapolis / St. Paul, Minnesota",$ 35,"Listed On: Tuesday, February 20, 2018",Reloading,no type,no type,no type,no type,like new Hornady sonic cleaner. Will come with half bottle of cleaner solution
78,http://www.armslist.com/posts/8003078,For Sale:  Leupold Vx-3,"South, Pittsburgh, Pennsylvania",$ 180,"Listed On: Sunday, March 4, 2018",Optics,no type,no type,no type,no type,Leupold VX-3!.5-5
84,http://www.armslist.com/posts/8003084,For Sale/Trade:  Russian Saiga AK74 5.45x39 LIKE NEW,"Lakeville, Minneapolis / St. Paul, Minnesota",$ 0,"Listed On: Tuesday, February 20, 2018",Rifles,Saiga                                                                                ,5.45x39mm                                                                                ,Semi-automatic                                                                                ,Rifle,"This is a clean, barely used Saiga AK 74. Imported/partially converted by RWC group. Rifle is in great shape. Can send additional pictures on request. Cool gun but dont want to invest in supporting another platform."
86,http://www.armslist.com/posts/8003086,For Sale:  Walther PPQ M2 9mm with holster,"Fort Collins, Fort Collins, Colorado",$ 525,"Listed On: Monday, April 23, 2018",Handguns,Walther                                                                                ,9mm Luger (9x19)                                                                                ,Single Action                                                                                ,Pistol,"I am selling my Walther PPQ M2 4"" in 9mm. I have put less than 500 rounds through it and it is in nearly new condition. I upgraded the guide rod to a BT stainless steel guide rod which helps manage the recoil better. I still have the old guide rod if you want to put the plastic one back in. I also have a holster for it as well. It comes with 2 mags, back straps, lock, case, extra guide rod, holster and Mag holder for holster. If interested, please email and put Walther PPQ on Armslist in the subject line as emails often go to my spam folder.All sales will go through an FFL of your choice. No Tradestags: walther, ppq, m2,"
