,url,title,location,price,post date,category,manufacturer,caliber,action,firearm type,postcontent
518,http://www.armslist.com/posts/8003518,For Sale:  Sig Sauer P226 Legion .357,"Southeast, Portland, Oregon",$ 900,"Listed On: Friday, March 2, 2018",Handguns,Sig Sauer                                                                                ,357 SIG                                                                                ,Double / Single Action                                                                                ,Pistol,"Up for sale is a Sig Sauer P226 Legion, chambered in .357SIG.  Included in the package are both the original plastic case and the Legion thermo-molded case with challenge coin, three original magazines, and 60 rounds of Speer Gold Dot defense ammo.The pistol is in great cosmetic shape, with only a small mark on the slide from holster wear that you can see in the photos.  Estimated round count on this gun is about 600.Photo album: https://imgur.com/a/EFwMzI also have three holsters for the gun available; a Blackhawk Serpa, Overwatch Treadstone IWB, and a Dara light-bearing IWB made for a Streamlight TLR-1, as well as an Overwatch IWB single mag carrier.  I'll give you a significant discount on the holsters if you buy them with the gun.Transfer of ownership and background check must be done using form 4473 at an FFL shop pursuant to state law.  I will ABSOLUTELY NOT sell to anyone for whom this poses an issue.Feel free to message me with any questions.Thanks for looking!"
519,http://www.armslist.com/posts/8003519,For Sale:  RIA 1911/Stoeger 410 /Carbon-15 Pistol,"Idaho falls, Idaho Falls, Idaho",FREE,"Listed On: Wednesday, February 21, 2018",Handguns,no type,no type,no type,no type,"I have a nice Rock Island M 1911-A1 FS in great condition. Have loaded mag, Gouch holster, and the gun. I also have a Stoeger Coach Gun 410 side by side. Has two triggers. Basically brand new. I have a Professional Ordnance Carbon-15 Pistol in 556/223 with one mag. Have ammo for that I can add if need be. Will trade or sell as whole package or individually."
520,http://www.armslist.com/posts/8003520,For Sale:  FN509 17Rnd,"co, Colorado, United States",$ 985,"Listed On: Wednesday, February 21, 2018",Handguns,FN Herstal S.A.                                                                                ,9mm Makarov                                                                                ,Double Action                                                                                ,Pistol,"FN 509 9mm No Manual Safety Black 17 Round Night SightFN 509 9mm NMS Black 17Rnd Night Sights Eligible for Free APL through FNH USA. See FNH USA web sight for details.DescriptionThe FN 509 is built on the proven architecture of the FNS Compact, FN made changes internally and externally to meet the rigorous performance standards of the MHS requirements and further developed the platform into the FN 509 with the help from industry experts. Over the course of development, the platform has been tested extensively for reliability, ammunition compatibility and durability – totaling more than one million rounds.Package Includes: Three interchangeable backstrapsOwner’s manualLocking deviceFN logo soft pistol caseSpecifications:Action: DoubleCaliner: 9mmBarrel Length: 4""Capacity: 17 Rounds-Number of Magazines: 3Rate of Twist: 1:10"" RHTrigger Pull: 5 1/2 - 7 1/2 lbsSight Radius: 5.79""Length: 7.40""Weight: 26.90 ozFinish: Black"
521,http://www.armslist.com/posts/8003521,For Sale:  glock 42 G 42 for sale,"michigan, Michigan, United States",$ 300,"Listed On: Wednesday, February 21, 2018",Handguns,Beretta USA                                                                                ,9mm Luger (9x19)                                                                                ,Double / Single Action                                                                                ,Pistol,"glock 42 semi automatic gun pistol in good condition and with full paper works ,with magazine plus loader ,cleaning brush available and with tight grip"
528,http://www.armslist.com/posts/8003528,For Sale:  steyr arms scout 7.62 x 61 precision rifle,"kentucky, Kentucky, United States",$ 750,"Listed On: Wednesday, February 21, 2018",Rifles,Steyr                                                                                ,308/7.62 NATO                                                                                ,Bolt Action                                                                                ,Rifle,"steyr arms scout 7.62 with 19 inch barrel,comes with hard case and 5 rounds magazine and shipping free,serious buyers only"
531,http://www.armslist.com/posts/8003531,For Sale:  Sig Sauer P220 German Made,"Windsor, Fort Collins, Colorado",$ 800,"Listed On: Wednesday, February 21, 2018",Handguns,Sig Sauer                                                                                ,45 ACP                                                                                ,Double / Single Action                                                                                ,Pistol,"German made Sig Sauer P220 .45 Cal, DA/SA in excellent condition.This is a great gunl it shoots great and runs strong!  This P220 has markins for New Hampshire and Germany ont he slide; the serial number on the frame is G-######.  This means that the parts were made in germany, and the pistol was assembled in exeter, NH.The pistol comes with a hard case (pictured) and seven 8 round magazines.I love this gun, but want to buy a project gun.  I am asking $800 for everything pictured."
532,http://www.armslist.com/posts/8003532,For Sale/Trade:  Diamondback db9,"Frankfort, Kentucky, United States",$ 200,"Listed On: Monday, February 26, 2018",Handguns,Diamondback Firearms                                                                                ,9mm Luger (9x19)                                                                                ,no type,Pistol,nice pistol
533,http://www.armslist.com/posts/8003533,For Trade:  REDACTED,"REDACTED, Ohio, United States",Offer,"Listed On: Wednesday, February 21, 2018",Miscellaneous,no type,no type,no type,no type,REDACTED
536,http://www.armslist.com/posts/8003536,For Sale:  Remington 1100 12 ga.,"Columbus, Columbus, Ohio",$ 575,"Listed On: Tuesday, February 27, 2018",Shotguns,Remington                                                                                ,12 Gauge                                                                                ,Semi-automatic                                                                                ,Shotgun,"Remington model 1100, 12 gauge semi auto shotgun. 30 inch vent rib barrel, Screw in modified choke, 2 3/4 inch chamber. This 1100 is in excellent overall condition. Built for gun matches but only attended two matches. Nordic components upgrades:Shotgun Extension 12 ga. Length: +8                           Shotgun Tube ClampLow Drag Follower 12 ga.Bolt Operating Handle"
540,http://www.armslist.com/posts/8003540,"For Trade:  G43, plus cash","Petersburg to Suffolk, Hampton Roads, Virginia",Offer,"Listed On: Wednesday, February 21, 2018",Handguns,no type,no type,no type,no type,New comes with 1mag 200rounds & cash Text 4345949159Also have a new m&p 40 to offer
542,http://www.armslist.com/posts/8003542,For Sale:  federal 12 gauge buck shot,"henderson, Las Vegas, Nevada",$ 210,"Listed On: Wednesday, February 21, 2018",Ammo,no type,no type,no type,no type,"250 rounds of 12 gauge, 2 3/4, 9 pellet buckshot made by federal ammunition.  Excellent quality."
544,http://www.armslist.com/posts/8003544,For Trade:  G43 & m&p shield 40,"Petersburg to Suffolk, Richmond, Virginia",Offer,"Listed On: Wednesday, February 21, 2018",Handguns,no type,no type,no type,no type,Both brand new unfired G43Shield 40Text 4345949159
545,http://www.armslist.com/posts/8003545,For Sale:  winchester 12 gauge slug,"henderson, Las Vegas, Nevada",$ 40,"Listed On: Wednesday, February 21, 2018",Ammo,no type,no type,no type,no type,"45 rounds ofwinchester super x 12 gauge slug.2 3/4, 1600 fps, 1oz. Selling all together."
549,http://www.armslist.com/posts/8003549,For Sale:  LNIB FDE Springfield XDS 45,"Stafford, Fredericksburg, Virginia",$ 475,"Listed On: Friday, March 30, 2018",Handguns,Springfield                                                                                ,45 ACP                                                                                ,Striker Fire                                                                                ,Pistol,"For sale is a LNIB Sprinfield Armory Flat Dark Earth frame black slide XDS 45. It has 200 rounds down the pipe. Comes with 6 mags 5 mags have fde baseplate. It comes witg Bladetech IWB kydex holster, original plastic hardcase. There are 2 8 rounders, 1 5 rounder, 3 7 rounders. Ammunition not included. Buyer must be VA resident with id and voter or ccw card.May be interested in trade for glock."
551,http://www.armslist.com/posts/8003551,For Sale:  22 cal. 53gr.  .224 Hollow Point bullets,"North, Redding, California",$ 100,"Listed On: Wednesday, February 21, 2018",Ammo,no type,no type,no type,no type,For sale are 12 boxs of 22 cal. 53gr. .224 Hollow Point bullets (100 ct per box) for reloading
552,http://www.armslist.com/posts/8003552,"For Sale:  Reliable Garage door Opener Repair | McKinney, Dallas","Mckinney, Texas, United States",FREE,"Listed On: Wednesday, February 21, 2018",Services,no type,no type,no type,no type,"Do you know the difference between springs that are in great shape and springs that have severe metal fatigue? It can be difficult to know where to look and what to look for, but that is what our experts are here for.
McKinney Garage Door provides Garage door spring repair in McKinney, Texas. We also install new springs if need be.
 
Choose us for:
    Spring installation
    Torsion spring replacement
    Extension spring replacement
    Replacing springs that show signs of metal fatigue
    Spring Lubrication
    25-Point Safety Inspection
    Or anything else
 
We can properly install new garage doors for you. It is no wonder that we are known as being the Best garage door repair and installation technicians in McKinney, TX.
 
Contact us (972) 439-1972
Visit us http://www.mckinneygaragedoor.net"
553,http://www.armslist.com/posts/8003553,For Sale:  Like New 9mm XD,"Hunters Creek, Orlando, Florida",$ 320,"Listed On: Wednesday, February 21, 2018",Handguns,Springfield                                                                                ,9mm Luger (9x19)                                                                                ,no type,Pistol,"Like New 9mm Springfield XDcomes with case, 4 magazines, speed loader, side hoaster, and holder for 2 mags.Wife wants me to get rid of it.Must go fast."
556,http://www.armslist.com/posts/8003556,For Trade:  New g43 plus cash,"Petersburg to Suffolk, Hampton Roads, Virginia",Offer,"Listed On: Wednesday, February 21, 2018",Handguns,no type,no type,no type,no type,G43OrM&p shield 40 4345949159
557,http://www.armslist.com/posts/8003557,"For Sale:  Zev Technologies G19 Gen 3 Glock 19 Z19 3G RMR 9mm W/ Sights, RMR Cover Plate & ZEV upper parts kit","Las vegas, Nevada, United States",$ 500,"Listed On: Wednesday, February 21, 2018",Gun,no type,no type,no type,no type,"Auction is for Zev Z19 for Glock 19 Gen 3, this will not fit Gen 4. ZEV Technologies Stainless Steel Slides were designed with tighter tolerances to increase accuracy and performance. Easy to install and Machined from Billet Stainless Steel then coated, these slides are a great addition to anyone's GLOCK collection. Machined from 1704 Billet Stainless Steel to have tighter tolerances than a factory slide. DLC or PVD coatings offered have a Rockwell hardness rating above that of factory coatings. ZEV Products always incorporate design, feel and performance at the same time. Note: Slide includes all internals excluding barrel. Internals Includes: Factory components, Channel liner, Striker sleeve, Spring cups, Extractor, Rod & bearing assembly and Back coverplate ZEV components: Stainless steel Firing Pin safety & Firing Pin, FPS Spring, & 2lb Striker spring...............you can contact me gunpartsavailable@outlook.com"
558,http://www.armslist.com/posts/8003558,For Sale:  Kimber ultra covert 1911,"Klamath falls, Oregon, United States",$ 500,"Listed On: Wednesday, February 21, 2018",Handguns,Kimber                                                                                ,45 ACP                                                                                ,no type,Pistol,Kimber ultra covert 1911 .45 Acp comes with ctc laser grip
559,http://www.armslist.com/posts/8003559,For Sale:  level 4 body armor,"henderson, Las Vegas, Nevada",$ 160,"Listed On: Wednesday, February 21, 2018",Tactical,no type,no type,no type,no type,XL size military grade level 4 body armor with ceramic plates all in excellent condition.  I wear a size 46-48 suit coat and usually large to extra large t-shirts.  this armor fits me perfectly.  might be too small if you wear any size larger.  I checked on shipping and it would cost approximately 50 dollars to ship to most parts of the U.S. its heavy.  make me an offer.
560,http://www.armslist.com/posts/8003560,For Sale/Trade:  Few for trade,"Petersburg to Suffolk, Richmond, Virginia",$ 0,"Listed On: Wednesday, February 21, 2018",Handguns,no type,no type,no type,no type,New g43 New m&p shield 40Rare s&w mod 36 no dash with pinned barell 4345949159 can add cash or extras.
564,http://www.armslist.com/posts/8003564,For Sale:  SMITH & WESSON Model 29-2,"Lawrenceville, New Jersey, United States","$ 1,499","Listed On: Sunday, May 6, 2018",Handguns,Smith & Wesson                                                                                ,44 Magnum                                                                                ,Double / Single Action                                                                                ,Revolver,"Used like new SMITH & WESSON Model 29-2,   44Mag   6 shotThis is a BEAUTIFUL RARE AND VERY HARD TO FIND REVOLVER IN 99% CONDITION.  It looks like it has never been shot, You would be hard pressed to find one in any better and especially with the FACTORY MATCHING BOX. Must see in person Its beautiful ASKING $1,499.00 or B/OAdd 3% for Credit Card"
565,http://www.armslist.com/posts/8003565,"For Sale:  Glock 19 GEN4 Slide, New Factory Part NO BARREL","LA, Louisiana, United States",$ 300,"Listed On: Wednesday, February 21, 2018",Gun,no type,no type,no type,no type,"Glock 19 GEN4 Slide, New Factory Part NO BARREL G19 . Comes with all internal upper parts, Sights, and buffer spring. All new Glock original factory parts. Ready for the custom barrel of your choice. No license required. Ships straight to your door you can contact me on CONNECTIONOFFIREAMRS@GMAIL.COM or text me 7205930347"
566,http://www.armslist.com/posts/8003566,For Sale:  WILTON 820 BABY BULLET VISE 2 inch jaws GUNSMITH  MACHINISTS  free shipping,"Lafayette, IN., Lafayette, Indiana",$ 275,"Listed On: Wednesday, February 21, 2018",Miscellaneous,no type,no type,no type,no type,"Vintage WILTON 820 2"" Baby Bullet Vise, Mini vise.Original, vintage and in great working condition.The vise opens up nice and smooth, base swivelsfreely and tightens. Jaws have no damage.Looks like is was not used much.Still has most of the original paint, with some minor rust.6 3/4"" L x 3 1/4"" W x 3 5/8"" H.Date marked on keyway is 1/1/80.$275Call or text: REDACTED,  JoeWill ship FREE, USPS with tracking, USA only.Wilton Chicago, Gunsmith vise, machinist, shop vise,jewelers vise, 820 vise, made in usa, vintage unrestored vise"
569,http://www.armslist.com/posts/8003569,For Sale:  Springfield Armory XDS 3.3 45,"New Port Richey, Tampa/St. Pete, Florida",$ 400,"Listed On: Wednesday, February 21, 2018",Handguns,Springfield                                                                                ,45 ACP                                                                                ,Striker Fire                                                                                ,Pistol,"Springfield XDS 3.3 IN 45acp.Like new.Comes with factory box,3 mags,lock,paperwork,holster and mag pouch.For sale in New Port Richey not looking to travel you must be legally able to own.Thanks."
571,http://www.armslist.com/posts/8003571,For Sale:  XD 9mm w/ extras,"Avon, Ohio, United States",$ 500,"Listed On: Wednesday, February 21, 2018",Handguns,Springfield                                                                                ,9mm Luger (9x19)                                                                                ,Striker Fire                                                                                ,Pistol,"9mm Springfield XD9 4"" barrel.  NOT the MOD2.  The firearm has been used for alittle over 2 years for target/recreation purposes.  (Approx 750 rounds have been fired through it).  The firearm comes with approximately 500 FMJ, approximately 100 JHP, plastic ammo box, magazine loader, 3 LEFT handed holsters (Level 2 Serpa, OWB alien gear, IWB alien gear), range bag, 16rd magazine x 4, factory plastic case, Cabela's ""pelican style"" storage box, pack of ""shoot & see"" targets."
576,http://www.armslist.com/posts/8003576,For Sale:  Hipoint 10mm Carbine,"Englishtown, New Jersey, United States",$ 375,"Listed On: Sunday, May 6, 2018",Rifles,Hi Point                                                                                ,no type,Semi-automatic                                                                                ,Rifle,"Hi point 10mm Carbine    BRAND: Hi-Point   MODEL:  10TS Carbine (1095TS)   CALIBER: 10mm   CAPACITY: 10 + 1   ACTION: Semi-Auto   SAFETY: Manual Thumb Safety   BARREL: 17.5""   FINISH: Black   SIGHTS: Adj. Peep Rear/Post Front"
577,http://www.armslist.com/posts/8003577,For Sale:  Kimber 1911 Grand Raptor II .45 ACP,"Missouri, Missouri, United States","$ 1,200","Listed On: Wednesday, February 21, 2018",Handguns,Kimber                                                                                ,45 ACP                                                                                ,Single Action                                                                                ,Pistol,"Kimber 1911 Grand Raptor II .45 ACP Semi-Auto Pistol. This pistol is BRAND NEW however. KIMBER 1911 GRAND RAPTOR II .45ACP 2-TONE NIB 45..Brand new,never be fired,with box and in excellent condition"
579,http://www.armslist.com/posts/8003579,For Sale:   Smith and Wesson M&P15 Sport II / NJ LEGAL,"Englishtown, New Jersey, United States",$ 640,"Listed On: Sunday, May 6, 2018",Rifles,Smith & Wesson                                                                                ,5.56×45mm NATO                                                                                ,Semi-automatic                                                                                ,Rifle,Smith and Wesson M&P15 Sport IIFactory NJ Legal    MODEL:  M&P15 Sport II (10203)   CALIBER: 223 Rem | 5.56 NATO   CAPACITY: 10   ACTION: Semi-Auto   WEIGHT:   6.45 lbs   STOCK/FRAME: Fixed Stock   SIGHTS: Magpul Folding Rear   FINISH: Black Anodize   BARREL: 16
580,http://www.armslist.com/posts/8003580,For Trade:  Taurus G2,"Jacksonville, Jacksonville, North Carolina",Offer,"Listed On: Wednesday, February 21, 2018",Handguns,Taurus                                                                                ,9mm Luger (9x19)                                                                                ,Double Action                                                                                ,Pistol,I have a brand new Taurus G2 pt111 9mm. It comes with a serpa IWB holster and two twelve round magazines. I would really like to trade for a smith and Wesson shield. If necessary I will add money to the trade.
583,http://www.armslist.com/posts/8003583,For Sale:   Ruger AR-556 / NJ Legal,"Englishtown, New Jersey, United States",$ 640,"Listed On: Sunday, May 6, 2018",Rifles,Ruger                                                                                ,5.56×45mm NATO                                                                                ,Semi-automatic                                                                                ,Rifle,Ruger AR-556 / Factory NJ Legal    BRAND: Ruger   MODEL:  AR-556 (8502)   CALIBER: 223 Rem | 5.56 NATO   CAPACITY: 10+1   ACTION: Semi-Auto   WEIGHT:   7.1 lbs.   BARREL: 16.1   STOCK/FRAME: Fixed Stock   SIGHTS: Adjustable Ruger Rapid Deploy   EXTRAS: NJ Compliant
584,http://www.armslist.com/posts/8003584,For Sale:   GLOCK G19 Gen5,"Englishtown, New Jersey, United States",$ 565,"Listed On: Sunday, May 6, 2018",Handguns,Glock                                                                                ,9mm Luger (9x19)                                                                                ,Striker Fire                                                                                ,Pistol,"Glock 19 Gen 5    BRAND: GLOCK   MODEL:  G19 G5 (PA1950203)   CALIBER: 9mm   CAPACITY: 15 + 1   BARREL: 4.02""   LENGTH: 7.28""   WEIGHT:  23.99 oz.   FINISH: nDLC Finish   ACTION: Safe Action   SAFETY: No Manual Safety   SIGHTS: Fixed Glock Sights"
585,http://www.armslist.com/posts/8003585,For Sale/Trade:  Mossberg international 71st,"Papillion, Omaha, Nebraska",$ 200,"Listed On: Wednesday, February 21, 2018",Rifles,Mossberg                                                                                ,no type,no type,Rifle,Just don’t use this anymore and looking to get rid of it $200 or best offer
586,http://www.armslist.com/posts/8003586,For Sale/Trade:  Sig Sauer P320 Compact FDE 9mm,"Albany, Corvallis / Albany, Oregon",$ 500,"Listed On: Wednesday, April 18, 2018",Handguns,Sig Sauer                                                                                ,9mm Luger (9x19)                                                                                ,Striker Fire                                                                                ,Pistol,"Sig Sauer P320 Compact in excellent condition. Very low round countComes with everything that was included from the factory: 2 15rd magazines, box, holster, etc.Currently has some Talon grips on it"
588,http://www.armslist.com/posts/8003588,For Sale:   SIG SAUER P320 Compact / Manual Safety,"Englishtown, New Jersey, United States",$ 575,"Listed On: Sunday, May 6, 2018",Handguns,Sig Sauer                                                                                ,9mm Luger (9x19)                                                                                ,Striker Fire                                                                                ,Pistol,"SIG SAUER P320 Compact / Manual Safety    BRAND: SIG SAUER   MODEL:  P320 Compact (320C-9-BSS-MS)   CALIBER: 9mm   CAPACITY: 15+1   BARREL: 3.9""   LENGTH: 7.2""   FINISH: Nitron   WEIGHT:  26 oz.   ACTION: Double Action Only   SAFETY: Manual Safety   SIGHTS: SIGLITE Night Sights"
590,http://www.armslist.com/posts/8003590,For Sale:  SAR K2P 9mm CZ P07 clone 3 mags - $300,"Chesapeake, Hampton Roads, Virginia",$ 300,"Listed On: Wednesday, February 21, 2018",Handguns,European American Armory                                                                                ,9mm Luger (9x19)                                                                                ,no type,Pistol,"This is an awesome CZ P07 clone that has quality far superior to the price. Comes with everything original. You will not be able to find a bad review anywhere. I don't need the money, so I am not that flexible and in no hurry. I bought a few too many 9s lately, so one 9 has to go. Yes I know CDNN has them for $270, but it has one mag and after factoring in shipping and all of the fees you are over $300 without getting 2 more mags and the grip that does make a huge difference. It is in like new condition. I will keep this up maybe a week, then I am just going to keep it. No trades. $300Text REDACTED."
591,http://www.armslist.com/posts/8003591,For Sale:   SIG SAUER P320 Full Size / 15rds,"Englishtown, New Jersey, United States",$ 590,"Listed On: Sunday, May 6, 2018",Handguns,Sig Sauer                                                                                ,9mm Luger (9x19)                                                                                ,Striker Fire                                                                                ,Pistol,SIG SAUER P320 Full Size / 15rds    BRAND: SIG SAUER   MODEL:  P320 Full (320F-9-BSS)   CALIBER: 9mm   STOCK/FRAME: Polymer   BARREL: 4.7   LENGTH: 8   CAPACITY: 15+1 Pinned   WEIGHT:  29.4 oz.   FINISH: Nitron   ACTION: Double Action Only   SAFETY:  Manual   SIGHTS: SIGLITE Night Sights
592,http://www.armslist.com/posts/8003592,For Sale:  Vortex Razor HD Gen II 3-18x50 EBR-2C Mils,"north carolina, North Carolina, United States","$ 1,450","Listed On: Wednesday, February 21, 2018",Optics,no type,no type,no type,no type,"Selling a Vortex Razor HD Gen II 3-18x50mm rifle scope. It’s in MILS with an EBR-2C reticle.Comes with original box and contents, and defender flip caps. Scope body has a few light blemishes, but you really have to look to see them. Glass is in perfect condition"
