,url,title,location,price,post date,category,manufacturer,caliber,action,firearm type,postcontent
271,http://www.armslist.com/posts/8003271,Want To Buy:  Naa guardian .380..maybe other brands micro,"Monkey junction, Wilmington, North Carolina",$ 1,"Listed On: Wednesday, February 21, 2018",Handguns,North American Arms                                                                                ,380 ACP                                                                                ,Double Action                                                                                ,Pistol,"Wtb a nice NAA guardian .380...might entertain other calibers, or other micro guns if you have a really sweet deal, i can order the guardian at a reasonable price..so please refrain from price gouging, i have my ccwEmail or text me a good deal 910-465-83-eight-nine"
274,http://www.armslist.com/posts/8003274,For Sale:  ESEE 6 Knife w/ Sheath,"South San Antonio, San Antonio, Texas",$ 100,"Listed On: Wednesday, February 21, 2018",Knives,no type,no type,no type,no type,"ESEE-6 knife w/ a black molded sheath, removeable clip plate and paracord. This knife has a 6.5"" drop point and with a partly serrated edge. It is made of 1095 carbon steel with a Rockwell hardness of HRC 55-57. It is black epoxy powder coated. It's overall length is 11.75"", blade width is 1.624"",  blade thickness is .188"" and it weighs 1 lb 6 oz. It is a full tang knife with removable olive colored micarta handles\grips and it is made in the U.S.A. This knife is used, but never used harshly or abused. It has no damage or engravings."
275,http://www.armslist.com/posts/8003275,For Sale:  1845 Musket Harpers Ferry,"Germantown, Memphis, Tennessee",$ 900,"Listed On: Wednesday, February 21, 2018",Antique,no type,no type,no type,no type,1845 Harpers Ferry Musket in good condition
277,http://www.armslist.com/posts/8003277,For Sale:  Conceal Carry Classes,"Milwaukee, Milwaukee, Wisconsin",$ 40,"Listed On: Saturday, March 24, 2018",Services,no type,no type,no type,no type,"Currently offering conceal carry courses, open to individuals and groups. $40/one person, $30/person for 2+. Open to anyone and everyone, regardless of firearms experience.Allow for 4hrs, with more time as needed. Offering one of the most flexible courses available, able to fit your needs, schedule, and experience. Won't spend hours trying to scare you, this course is about education and learning the law and your rights.Message me details of what you are looking for and we can schedule a time."
278,http://www.armslist.com/posts/8003278,For Sale:  H&R model 999 22lr revolver,"Madison, Madison, Wisconsin",$ 300,"Listed On: Wednesday, February 21, 2018",Handguns,H&R                                                                                ,22 Long Rifle                                                                                ,Double / Single Action                                                                                ,Revolver,"Good condition H&R 6"" 22lr 9 shot revolver, missing rear sight ""15 bucks on amazon"" screws are still there. No trades and lowered price. Have my eye on something else. Thanks for looking. Willing to travel with in reason. Say no more than 20 mins outside of madison area.TA serial number pretty sure is 1979"
279,http://www.armslist.com/posts/8003279,For Sale:  Surefire TAN FDE M600P M600P-A-TAN FURY 600 Lumens Light Rail Scout Extreme RARE,"Sarasota, Tampa/St. Pete, Florida",$ 425,"Listed On: Wednesday, April 4, 2018",Gun,no type,no type,no type,no type,Surefire TAN FDE M600P M600P-A-TAN FURY 600 Lumens Light Rail Scout Extreme RAREBrand New
280,http://www.armslist.com/posts/8003280,For Sale:  511 Tactical series cargo pants 32/34,"Wichita, Wichita, Kansas",$ 40,"Listed On: Saturday, March 31, 2018",Tactical,no type,no type,no type,no type,Never worn 511 Tactical series Khaki ripstop cargo pants size 32/34 with stretch waistbandgood pants for concealed carry
281,http://www.armslist.com/posts/8003281,For Sale/Trade:  Kel-tec PMR 30,"MADISON, Madison, Wisconsin",$ 400,"Listed On: Wednesday, February 21, 2018",Handguns,Kel-Tec                                                                                ,no type,Single Action                                                                                ,Pistol,"Kel-tec pmr30 black with hard case, 2 30 round mags, and all factory items.100 rounds through.Will trade and can add cash for quality .45 acp handgunsAny other different quality firearms could be considered.keltec pmr-30"
283,http://www.armslist.com/posts/8003283,For Sale:  Bump Fire Systems AR15 Bumpfire Bump Stock,"Falcon, Colorado Springs, Colorado",$ 380,"Listed On: Wednesday, February 21, 2018",Gun,no type,no type,no type,no type,"New, never opened pkg, Bump Fire Systems ""The feel of automatic fire AR15"" - Bumpfire Bump Stock.  These systems are going for over $500 on GunBroker.  Cash Only--no shipping.  $380 or best offer."
285,http://www.armslist.com/posts/8003285,For Sale:  Custom ar15 for sale,"North east, Albuquerque, New Mexico","$ 1,100","Listed On: Wednesday, February 21, 2018",Rifles,Palmetto State Armory                                                                                ,223/5.56 NATO                                                                                ,Semi-automatic                                                                                ,Rifle,"I'm selling an ar I recently finished putting together. Palmetto lower, Magpul stock and m lock carbine length hand guard, ergo grip deluxe sure grip, ergo grip never quit mag well grip, Giselle 2 stage trigger group, nickel boron bcg, Troy fixed rear sight. Comes with a magpul vertical grip that's not attached, a basic bag for it, and two pmags. It's got camo rustoleum coating. I've shot about 600 rounds through it."
286,http://www.armslist.com/posts/8003286,For Sale:  Glock 17 9mm gen 4 MOS upper slide G17 w/ RMR kit,"Texas, Texas, United States",$ 250,"Listed On: Wednesday, February 21, 2018",Gun,no type,no type,no type,no type,"Brand new Glock 17 Gen 4 MOS 9mm slide assembly. Complete with recoil spring and factory barrel with matching serial, and Glock mounting plates and Trijicon RMR mounting kit.Buyer to pay $10 shipping and handlingNo FFL required"
293,http://www.armslist.com/posts/8003293,For Sale:  Sig Sauer P320c,"Fayetteville, Fayetteville, Arkansas",$ 515,"Listed On: Friday, March 23, 2018",Handguns,Sig Sauer                                                                                ,9mm Luger (9x19)                                                                                ,Striker Fire                                                                                ,Pistol,SIG SAUER P320c..SIG NITE SIGHTS..3 15 ROUND MAGS..BOX..PAPERS..HOLSTER..LESS THAN 50 ROUNDS THRU IT..BASICALLY BRAND NEW..$515.00 CASH *THANKS*
294,http://www.armslist.com/posts/8003294,For Sale:  Ar-15,"Phenix city, Phenix City, Alabama",$ 600,"Listed On: Wednesday, February 21, 2018",Rifles,no type,5.56×45mm NATO                                                                                ,no type,Rifle,"PSA freedom 5.56 1/7 twist upper with lightweight keymod handrail. Anderson Lower with magpul furniture. Mbus pop up sights, mag and ammo. Rifle is like new less than 100rds.$600 obo"
295,http://www.armslist.com/posts/8003295,For Sale:  New Polymer80 Dealer,"Milwaukee, Milwaukee, Wisconsin",FREE,"Listed On: Thursday, March 1, 2018",Gun,no type,no type,no type,no type,"New Polymer80 dealer, if you've been interested in their %80 lowers, jigs, mags, accessories, etc. feel free to contact me with any questions and pricing.Have some personal experience with their products if you have any questions."
300,http://www.armslist.com/posts/8003300,For Sale:  P320,"Crofton, Maryland, United States",$ 600,"Listed On: Wednesday, February 21, 2018",Handguns,Sig Sauer                                                                                ,40 cal,no type,no type,I have a brand new P320. Never been fired.
301,http://www.armslist.com/posts/8003301,For Sale:  Ar-15,"North Columbus, Columbus, GA, Georgia",$ 600,"Listed On: Wednesday, February 21, 2018",Rifles,no type,5.56×45mm NATO                                                                                ,no type,Rifle,PSA freedom 5.56 1/7 twist upper with lightweight keymod handrail. Mbus pop up sights. Anderson Lower with magpul furniture. One mag and about 200 rounds of ammo. Rifle is like new and very solid.$600 obo
302,http://www.armslist.com/posts/8003302,For Sale:  Blade brace,"Picayune, Mississippi, United States",$ 50,"Listed On: Wednesday, February 21, 2018",Gun,no type,no type,no type,no type,Shockwave technologies blade brace. Brand new in unopened packageFor all pistols with standard AR style pistol tubes Great to provided balance and stability to those short barrel builds. asking 50 but will consider reasonable trade offersGlock sights Glock 9mm mags ETS mags33 round fun sticks
303,http://www.armslist.com/posts/8003303,For Sale/Trade:  Stevens 22lr,"Hopemills, Fayetteville, North Carolina",$ 160,"Listed On: Wednesday, February 21, 2018",Rifles,Savage Arms                                                                                ,22 Long Rifle                                                                                ,Bolt Action                                                                                ,Rifle,I have a Stevens model 34 bolt action with a extended clip 22lr beutiful rifle I’m intrested trading or selling but mostly selling 160$ obo 9107452344
305,http://www.armslist.com/posts/8003305,For Sale/Trade:  Canik TP9sfx,"Beech Grove, Indianapolis, Indiana",$ 450,"Listed On: Wednesday, February 21, 2018",Handguns,Century International Arms                                                                                ,9mm Luger (9x19)                                                                                ,Striker Fire                                                                                ,Pistol,Good shape Canik TP9sfx. Comes with 2 20 round mags. Factory box. Factory paddle holster. Optic plates and charging handle. $450
306,http://www.armslist.com/posts/8003306,For Sale/Trade:  AR and AK Slidefire Stocks BNIB,"Alliance, Canton, Ohio",$ 400,"Listed On: Saturday, April 21, 2018",Gun,no type,no type,no type,no type,"I have a BNIB SSAK47 and SSAR15 Slidefire Solution stocks for sale or trade. Will sell both for $400 cash, not interested in splitting them up at this time. I paid almost $650 for both and have receipts. Open to gun trades. Really interested in GLOCKs and wheel guns. Possibly shop stereo or tools or??? Txt anytime 33o.614.6246"
307,http://www.armslist.com/posts/8003307,For Sale:  GLOCK 17 GEN4 MOS NEW,"Kansas City, Kansas City, Missouri",$ 500,"Listed On: Wednesday, February 21, 2018",Handguns,no type,no type,no type,no type,"For sale is a like new Glock 17 mos gen 4. Again it’s jist like new only had less than 100 rounds through it when I was testing mags. I’m including all the factory parts and box such as the mos plates, factory mags, gen 4 backstraps. I also have some additional accessories for it like 30 round mags and a custom usgruntgear kydex holster + mag pouches. Those will add to the price but contact me for exactly what you want and what it would be total with that included. Call or text REDACTEDNo felons, no underage, no sketchy people, must have mo dL and meet in mo"
310,http://www.armslist.com/posts/8003310,For Sale:  H&K .40 P2000SK -V2,"NW Reno, Reno, Nevada",$ 700,"Listed On: Wednesday, February 21, 2018",Handguns,Heckler & Koch                                                                                ,40 S&W                                                                                ,Double / Single Action                                                                                ,Pistol,"Hello,This is an almost brand new H&K P2000sk-v2. It maybe has 500 rounds through it and has been cleaned after each use. Great little gun and great for concealed carry but it’s time to invest in a new toy. Let me know if you have any questions and good luck in your search."
315,http://www.armslist.com/posts/8003315,For Sale:  Burris UPDATED,"Kennesaw, Atlanta, Georgia",$ 125,"Listed On: Friday, April 20, 2018",Optics,no type,no type,no type,no type,Selling multiple scopes that were used as display models for a store. These scopes were never used and never mounted. Brand new scopes at a discounted price! I will delete optics as I sell so if it's still listed then one is still available. Cash is preferred but willing to trade if its a good deal! Email if you have any further questionsBurris Fullfield II 3-9x40 Ballistic Plex- $125PN 200162
317,http://www.armslist.com/posts/8003317,For Sale:  Glock 27 gen 4 40 cal,"Nashville, Nashville, Tennessee",$ 500,"Listed On: Wednesday, February 21, 2018",Handguns,Glock                                                                                ,40 cal                                                                                ,no type,Pistol,Comes with 2 15 clips an a 9 clip. Cash only . No trades.
319,http://www.armslist.com/posts/8003319,Want To Buy:  P80 glock 19,"Sacramento, Sacramento, California",Offer,"Listed On: Wednesday, February 21, 2018",Gun,no type,no type,no type,no type,hi i am looking to buy a slide and trigger from my p80 glock 19 build so if u have any send me a pic with price or otheir parts let me now.
320,http://www.armslist.com/posts/8003320,For Sale:  26-inch barrel AR upper receiver,"Niceville, Okaloosa County, Florida","$ 1,000","Listed On: Wednesday, February 21, 2018",Gun,no type,no type,no type,no type,"I am selling a 26-inch barrel AR upper receiver.  Barrel is stamped with ""NATO 5.56 1/9 H-bar"".  I have shot only 60 rounds through it since receiving it as a gift nearly 10 years ago.  It is complete with bolt carrier, bolt, and firing pin.  Does not come with a charging handle.  Carrying handle is incorporated and has a standard iron sights.  Comes with standard plastic handguards.  I do not know the maximum effective range but I do know that it very accurate out to 200 yards.  Best shot group was 1/2 inch at 200 yards with iron sights. photos available upon request."
321,http://www.armslist.com/posts/8003321,For Sale:  Glock 17 gen 4 with 4 extra 33 round mags and 500 rounds,"Barron, Eau Claire, Wisconsin",$ 600,"Listed On: Wednesday, February 21, 2018",Handguns,Glock                                                                                ,9mm Luger (9x19)                                                                                ,no type,Pistol,"Very good condition. Comes with 4 33 round mags and 3 17 round mags,  also comes with 500 rounds of 115 grain fmj and a little gadget that helps you load the mags. Willing to trade for a Ruger American predator in 6.5 creedmoor or 223 Remington."
323,http://www.armslist.com/posts/8003323,For Sale:  Taurus PT-111 Millennium G2 for sale,"Madison, Madison, Wisconsin",$ 180,"Listed On: Wednesday, February 21, 2018",Handguns,Taurus                                                                                ,9mm Luger (9x19)                                                                                ,Double / Single Action                                                                                ,Pistol,"I am looking to get rid of my pt-111 (9mm). I have put only 300 rounds threw it since I bought it on 08/2017. The gun comes with two 12 round magazines & I have a pro-mag 32 round that I will include in this deal. Reason I'm selling is because I got a new gun and i just need the extra money so I can upgrade my new handgun. The gun works flawlessly, I have not had a problem in the 300 rounds I put threw it at the range."
328,http://www.armslist.com/posts/8003328,For Sale:  Sig Sauer P250,"New Carlisle, Dayton, Ohio",$ 275,"Listed On: Wednesday, February 21, 2018",Handguns,Sig Sauer                                                                                ,40 S&W                                                                                ,Double Action                                                                                ,Pistol,"Selling my Sig .40 s&w. Very minimal wear and has maybe 100 shots through it. Comes with two magazines, one right handed iwb holster and one owb right handed holster. Unfortunately, one of the night sights have gone out but other than that it almost flawless. You may also contact me at 937-765-six2four6  Price is OBO Thanks"
329,http://www.armslist.com/posts/8003329,For Sale:  Oakley breach range bag new,"East, Wichita, Kansas",$ 125,"Listed On: Wednesday, February 21, 2018",Miscellaneous,no type,no type,no type,no type,New with tags 125.00REDACTED
330,http://www.armslist.com/posts/8003330,For Sale:  300aac 10.5 Aero Precision upper,"South, St. Louis, Missouri",$ 400,"Listed On: Wednesday, March 28, 2018",Gun,no type,no type,no type,no type,"Aero enhanced 9"" quad upper 10.5 Anderson barrel adjustable Anderson gas block Anderson Bcg   / charging handle no flash hider"
332,http://www.armslist.com/posts/8003332,For Sale/Trade:  FNH FNX-9,"South Shore, Massachusetts, United States",$ 425,"Listed On: Tuesday, April 10, 2018",Handguns,FN Herstal S.A.                                                                                ,9mm Luger (9x19)                                                                                ,Double / Single Action                                                                                ,Pistol,"Lightly Used FNX-9, great shooting gun just looking to get somthing smaller to carry.$425"
333,http://www.armslist.com/posts/8003333,For Sale:  Wolf 308 Win  Steel case,"Franktown, Denver, Colorado",$ 225,"Listed On: Monday, February 26, 2018",Ammo,no type,no type,no type,no type,780 rounds of Wolf 308 Win .steel case ammo.  720 rounds in boxes and 60+ loose.  150 gr FMJ
335,http://www.armslist.com/posts/8003335,For Sale/Trade:  Gen 4 Glock 19 w/Glock NS,"Near Cumberland, Indianapolis, Indiana",$ 550,"Listed On: Wednesday, February 21, 2018",Handguns,Glock                                                                                ,9mm Luger (9x19)                                                                                ,no type,Pistol,"I have a Glock 19 Gen 4 for sale. It has Glock night sights, A Blackhawk CQC owb holster, 2 mags, one has a +2 extension, box with an extra back strap and smaller beaver tail and the barrel cleaning tool. The gun has only had about 100 rounds through it so it’s not even broke in.Email me for more picturesMust have a valid drivers license and Concealed carry permit."
337,http://www.armslist.com/posts/8003337,For Sale:  New in Package Bump Fire Systems AR15 Bumpfire Stock,"North Tacoma, Tacoma, Washington",$ 150,"Listed On: Tuesday, April 17, 2018",Gun,no type,no type,no type,no type,"New in Package Bump Fire Systems AR15 Bumpfire Stock. Get one while you can! 150.00 FIRM, No trades, No Shipping"
338,http://www.armslist.com/posts/8003338,Want To Buy:  ISO AR-15 <900,"Las vegas, Las Vegas, Nevada",Offer,"Listed On: Wednesday, February 21, 2018",Rifles,no type,5.56×45mm NATO                                                                                ,Semi-automatic                                                                                ,Rifle,In search of ar 15. Can be any manufacture or build looking for all possible options. Preferred under $900
339,http://www.armslist.com/posts/8003339,For Sale/Trade:  Henry Golden Boy 357 Mag/38 Special,"East Of Indy, Indianapolis, Indiana",$ 575,"Listed On: Wednesday, February 21, 2018",Rifles,Henry Repeating Arms                                                                                ,357 Magnum                                                                                ,Lever Action                                                                                ,Rifle,I have a like new Henry Golden Boy 357 Magnum/38 Special lever action rifle I am looking to sell or trade. This rifle has had a little over 100 rounds through it and has been very well taken care of. The golden boy has a brass reciever and the action is one of the smoothest ive felt on a lever action! I am mainly wanting to sell but may consider trades.
341,http://www.armslist.com/posts/8003341,For Sale:  Marlin 22lr,"Hopemills, Fayetteville, North Carolina",$ 150,"Listed On: Wednesday, February 21, 2018",Rifles,Marlin                                                                                ,22 Long Rifle                                                                                ,Semi-automatic                                                                                ,Rifle,i have a Marlin model 60 22lr great looking gun if you are interested call or text me at 9107452344
342,http://www.armslist.com/posts/8003342,For Sale:  AR-15 rifles For Sale,"Fort Collins/Greeley, Fort Collins, Colorado",$ 575,"Listed On: Wednesday, February 21, 2018",Rifles,Palmetto State Armory                                                                                ,223/5.56 NATO                                                                                ,Semi-automatic                                                                                ,Rifle,"I have 3 PSA rifles built on Anderson lowers. All are unfired brand new. Your choice in which one. ~ Stainless 1x8 twist midlength~ Chrome moly 1x7 midlength~ Nitride 1x7 carbine $575 FTF NoCO . Buyer pays transfer fee. No Trades, No Criminals, No Bullshit. Cash or Gold"
343,http://www.armslist.com/posts/8003343,For Sale:  Ruger gp100 6in,"57220, South Dakota, United States",$ 650,"Listed On: Tuesday, March 6, 2018",Handguns,Ruger                                                                                ,357 Magnum                                                                                ,Double Action                                                                                ,Revolver,Up for sale less than 100 round shot count. Very clean Stainless Ruger gp 100. True dot adjustable night sights. Trigger job Wolff springs. Single is 4lb double action is around 2.5. Will include ammo for the right price. Comes with case and 2 safari speed mags.
345,http://www.armslist.com/posts/8003345,For Sale:  Custom 6.5 Creedmoor,"Havelock, Jacksonville, North Carolina","$ 2,800","Listed On: Tuesday, March 13, 2018",Rifles,Remington                                                                                ,6.5 Creedmoor                                                                                ,Bolt Action                                                                                ,Rifle,"Custom built 6.5 Creedmoor by northwest action works, Remington 700 blueprinted action sitting on a McMillan A5 stock spiral fluted bolt threaded muzzle 5/8 x 24 ha muzzle cap. Other notable specs are-Trued Remington 700 Action ( Standard Action Length / Standard Bolt ) -Pinned Heavy Recoil Lug-Badger Knob-Timney 510 Trigger-Krieger Stainless Barrel ( 24"" FL / Remington Varmint Contour / 1:8 Twist ) -Cerakote Barreled Action - Charcoal Black Color-McMillan Tactical Stock ( T5 Model ) - GAP CAMO Color-Pillar and Glass Bedding-PTG M5 Detachable Box Magazine SystemEdge Technology on McMillan StockSpiral Fluting of Rem 700 BoltM16 Style Extractor Installed on Rem 700Seekins 20 MOA RailMcMillan Adjustable Cheek - Clamp Bar StyleThe scope is a vortex cross fire 6-18 doesn’t have to go with rifle will separate. I have over 4000$ into this rifle so I am not going tonjust give it away I am open to reaoanable offers. I have only put about 20 rounds through this rifle and shooting Hornady 147gr at 200 yards was holding a .34 moa 5 shot group and the only reason I am considering selling it is due to an illness in the family. Thanks for looking. For my asking price or close to it I will also include a pelican case already cut for the rifle and a bipod. Scope is included also but can be separated. Call or text anytime of course texting is preferred between 9pm and 4am otherwise call. 630 528 6352, willing to trade for the right AR pistol 5.56 or 300 blk or AR-15 in 5.56 or .458 socom with cash added on your end depending. Glock 19’s gen 4. All you can do is ask. Thanks for your time."
347,http://www.armslist.com/posts/8003347,For Sale:  ...PRICE REDUCED G41...,"Sparks, Reno, Nevada",$ 580,"Listed On: Wednesday, February 21, 2018",Handguns,Glock                                                                                ,45 ACP                                                                                ,Striker Fire                                                                                ,Pistol,"Glock 41 Gen 4, .45acp, Brand New, UnfiredIncludes Professionally Installed XS Big Dot Tritium Sites, Have Original Sights also.Mags, Manual, Etc, and I have the Original Receipt, purchased on 11/29/2017Prefer Nv Id or CCW, No trades at this time.$580.00....Firm.... emails are 1st come 1st serve"
348,http://www.armslist.com/posts/8003348,"For Sale:  Crimson Trace Laer Grip Glock 19 Gen4, G19 slide","Waterford, Detroit, Michigan",$ 1,"Listed On: Wednesday, February 21, 2018",Optics,no type,no type,no type,no type,I sold my Glock 19 and no longer need the following items. Paypal freinds and family only. All payments must clear before shipping. All items ship priority mail.1 Crimson Trace Red Lasergrip for G19 Gen4 Glock. About 1 year old. Condition used/very good. $175 obo shipped.1 Glock 19 Gen4 Complete Slide Assembly. New never fired accept for factory test. Codition=new. $350
