,url,title,location,price,post date,category,manufacturer,caliber,action,firearm type,postcontent
274,http://www.armslist.com/posts/4102274,For Sale:   	 Complete Spikes FDE 223 Wylde AR15,"Dallas, Dallas, Texas",$ 925,"Listed On: Wednesday, March 4, 2015",Rifles,Spikes Tactical                                                                                ,223/5.56 NATO                                                                                ,Semi-automatic                                                                                ,Rifle,"Spikes upper with spikes bcg

16"" spiral fluted black 223 wylde barrel, has a Daniel Defense Flash Suppressor (not cheap A2)

12"" UTG free float hand guard with magpul enchanced rail covers and angled grip

lower is a Spikes punisher spikes lower parts kit

Magpul FDE stock and grip with enchanced trigger guard

FDE KNS anti-walk pins, FDE mag release button

 1 30rd fde magpul window mag with ranger plate

1 30rd fde steel magazine 

$925 OBO"
275,http://www.armslist.com/posts/4102275,For Sale:  GLOCK 26 GEN4 MAGAZINES,"NEW TAMPA, Tampa/St. Pete, Florida",$ 65,"Listed On: Wednesday, March 4, 2015",Magazines,Spikes Tactical                                                                                ,223/5.56 NATO                                                                                ,Semi-automatic                                                                                ,Rifle,I'D LIKE TO SELL MY ORIGINAL GLOCK 26 MAGAZINES WITH PINKY EXTENSIONS. BOTH MAGS ARE IN EXCELLENT CONDITION WITH NO SCRATCHES. EACH MAG HOLDS 10 ROUNDS OF 9MM. PREFER TO SELL BOTH TO ONE BUYER BUT CAN SEPARATE. ASKING 65$/OFFER
276,http://www.armslist.com/posts/4102276,Want To Buy:  steel frame Black powder revolver,"across from Taylor Falls/ Wis, Minnesota, United States",Offer,"Listed On: Wednesday, March 4, 2015",Muzzle,Spikes Tactical                                                                                ,223/5.56 NATO                                                                                ,Semi-automatic                                                                                ,Rifle,I am looking to trade my two rifles.Nice Yugo 8mm mauser and a Russian m44 Mosin Nagant.      Pics upon request.   For a nice steel frame Black powder revolver
277,http://www.armslist.com/posts/4102277,For Sale:  Mosin Nagant stock,"Plainfield, Indianapolis, Indiana",$ 40,"Listed On: Monday, March 9, 2015",Gun,Spikes Tactical                                                                                ,223/5.56 NATO                                                                                ,Semi-automatic                                                                                ,Rifle,Wooden stock for Mosin Nagant.  I have owned several Mosin Nagants and have no idea what year or manufacturer this stock is from.
278,http://www.armslist.com/posts/4102278,For Sale:  Used Mossberg 500 HS410 Shotgun,"Spring Branch 281N/46, San Antonio, Texas",$ 299,"Listed On: Tuesday, March 31, 2015",Shotguns,Mossberg                                                                                ,410                                                                                ,Pump Action                                                                                ,Shotgun,"Used Mossberg 500 HS410 in very good condition with approx 25 rounds through it. Please email with any questions. You can pick up in person or I can ship to your FFL. I accept cash, credit cards, and paypal. I will consider trades. If the ad is active then It is still available. *please note* Texas residents must pay state sales tax."
279,http://www.armslist.com/posts/4102279,For Sale:  Savage Mark II in stainless with Bucket O' Bullets,"Niagara County/ Buffalo, Buffalo, New York",$ 452,"Listed On: Wednesday, March 4, 2015",Rifles,Savage Arms                                                                                ,22 Long Rifle                                                                                ,Bolt Action                                                                                ,Rifle,"Up for grabs is a Savage Mark II with a BSA Sweet .22 scope with sunshade. I will include a unopened bucket of bullets to get you going! Ammo is not available as a stand alone option Please text questions of ""Logical"" offers to (716)867-3one2one"
280,http://www.armslist.com/posts/4102280,For Sale:  12 g Double Barrel Shotgun with Rabbit Ear Hammers,"Martinsburg, Martinsburg, West Virginia",$ 275,"Listed On: Wednesday, March 4, 2015",Shotguns,Savage Arms                                                                                ,12 Gauge                                                                                ,Side by Side                                                                                ,Shotgun,"12 g Double Barrel stagecoach style with rabbit ears shotgun with 18 1/2 in. barrels.This gun is in very good condition and has only been shot a few times,  will chamber 2 3/4 and 3 inch magnum. I would rather like do a local face to face deal, but I will ship to your local ffl dealer at your cost."
281,http://www.armslist.com/posts/4102281,For Sale:  Colt M4A1 LE6920MP,"Lacey, Tacoma, Washington","$ 1,000","Listed On: Wednesday, March 4, 2015",Rifles,Colt                                                                                ,223/5.56 NATO                                                                                ,Semi-automatic                                                                                ,Rifle,"I need to sell this gun because I am returning to California.  I also have...

- 49 YUGO SKS w/ original stock and ATI stock and some rounds. $300,  although...the stock spring is messed up and needs to be replaced, so at the moment the trigger assembly can not be attached but it is a VERY EASY fix.  I should have fixed it but I hardly take it to the range so i never made it a priority.

- FNH FNS .40 S&W, $500, great condition, practically new w/ the 3 mags and the case it came in. I've also only put 250 rounds through it.  Break in is at 500 rounds. 

Please email me for my phone number, more information and pictures."
282,http://www.armslist.com/posts/4102282,For Sale/Trade:  winchester 9422m 22magnum,"20miles north of bend in terrebonne, Bend, Oregon","$ 1,050","Listed On: Monday, March 16, 2015",Rifles,Winchester                                                                                ,22 Magnum                                                                                ,Lever Action                                                                                ,Rifle,excellent condition
283,http://www.armslist.com/posts/4102283,For Sale:  21 round Glock .40 Magazine,"Sultan Monroe Woodinville, Everett, Washington",$ 40,"Listed On: Thursday, April 9, 2015",Magazines,Winchester                                                                                ,22 Magnum                                                                                ,Lever Action                                                                                ,Rifle,"21 round Glock .40 Magazine. Text, email or call me anytime. 425780911zero"
284,http://www.armslist.com/posts/4102284,For Sale/Trade:  Trijicon Acog,"South, Oklahoma City, Oklahoma",$ 875,"Listed On: Wednesday, March 4, 2015",Optics,Winchester                                                                                ,22 Magnum                                                                                ,Lever Action                                                                                ,Rifle,"TA504 3x24 Compact Acog LNIB comes with a American Defense Quick Detach mount. Original box paper work lense pen etc. amber reticle. 
Acog $952 plus shipping
mount $150+ 
Over $1100 invested

Asking $875"
285,http://www.armslist.com/posts/4102285,For Sale:  Taurus  Pt111 G2 9mm,"Memphis, Memphis, Tennessee",$ 300,"Listed On: Wednesday, March 4, 2015",Handguns,Taurus                                                                                ,9mm Luger (9x19)                                                                                ,Double Action                                                                                ,Pistol,Taurus  Pt111 G2 9mm come with 2 12+1 mags and cleaning rod. Everything in pictures  included. New call or text REDACTED anytime 300 firm
286,http://www.armslist.com/posts/4102286,For Sale:  .22 lr ammo - prices,"EVERYWHERE, Detroit, Michigan",FREE,"Listed On: Wednesday, March 4, 2015",Ammo,Taurus                                                                                ,9mm Luger (9x19)                                                                                ,Double Action                                                                                ,Pistol,"Please think when you post asking for .22 lr ammo at fair market price.  I am not directing this post at any one person nor am I someone who sells ammo for stupid high prices (I don't sell ammo at all, I shoot it).  

But please think.... why would anyone sell their .22lr ammo for market price when it cannot be found anywhere for market price.  people who have that much know how hard it is to get so why would they give it away for that?  Yes EVERYONE wants .22lr ammo for market price.  you don't need to post looking for it."
287,http://www.armslist.com/posts/4102287,For Sale:  50 BMG 50 CAL Ammunition,"Simpsonville, Greenville, South Carolina",$ 3,"Listed On: Sunday, April 5, 2015",Ammo,Taurus                                                                                ,9mm Luger (9x19)                                                                                ,Double Action                                                                                ,Pistol,Lake City 50 BMG Armor Piercing Incendiary (API) and Armor Piercing Incendiary Tracer (APIT) for sale or trade.  $3.50/rnd.   I have 150 of each for a total of 300.  If you want all 300 I will take $3.25/rnd.  I can accept a credit card via Square if buyer pays 3.25% fee
288,http://www.armslist.com/posts/4102288,For Sale:  Uncle Mike's Law Enforcement  Dual Retention Tactical Duty Holster,"Louisville, Alcoa, Marryville, Knoxville, Tennessee",$ 65,"Listed On: Wednesday, March 4, 2015",Holsters,Taurus                                                                                ,9mm Luger (9x19)                                                                                ,Double Action                                                                                ,Pistol,"Size 21 : Glock® 17, 19, 22, 23, 31, 32, 36 / Smith & Wesson M&P.

Price : 65.00"
289,http://www.armslist.com/posts/4102289,For Sale/Trade:  Saiga 12,"hampton roads, Hampton Roads, Virginia",$ 0,"Listed On: Wednesday, March 4, 2015",Shotguns,Saiga,9mm Luger (9x19)                                                                                ,Double Action                                                                                ,Pistol,"For trade or sale Saiga 12 $900 OBO

Comes with one 20 round drum and one 5 round mag

Looking for 

AR platform rifles
mossberg 590a1 or rem 870 tactical plus cash
handguns
tactical bolt action rifles maybe

FTF Hampton Roads only"
292,http://www.armslist.com/posts/4102292,For Sale:  Czech vz24 Mauser,"Lincoln, Lincoln, Nebraska",$ 550,"Listed On: Wednesday, March 4, 2015",Rifles,Mauser                                                                                ,8mm Mauser                                                                                ,Bolt Action                                                                                ,Rifle,"This is a 1931 Czech vz.24 Mauser still in its original chambering of 8MM Mauser (7.92). All numbers matching and with an original sling. The wood is in pretty good shape for its age. The metal is in good shape, and the bore is in good shape as well. This comes with 140rds of Turkish surplus ammo, and 20 rounds new mfg. PPU ammo. This appears to be a bring back as it has NO IMPORT MARKS!"
293,http://www.armslist.com/posts/4102293,For Sale/Trade:  sks gun parts package,"Boyceville     ., Eau Claire, Wisconsin",$ 50,"Listed On: Friday, April 17, 2015",Gun,Mauser                                                                                ,8mm Mauser                                                                                ,Bolt Action                                                                                ,Rifle,"stock,, scope/ scope mount. (the mag was sold)  make offer
may meet but won't ship
text seven one five 556-1520"
295,http://www.armslist.com/posts/4102295,For Trade:  Marlin 308,"Mobile, Mobile, Alabama",Offer,"Listed On: Wednesday, March 4, 2015",Rifles,Marlin                                                                                ,308/7.62 NATO                                                                                ,no type,Rifle,Marlin xs7 308 with fluted bolt and adjustable trigger comes with leupold scope mount and rings no scope 300firm or trade for other fire arms
296,http://www.armslist.com/posts/4102296,For Sale/Trade:  22 mag henry lever action,"20miles north of bend in terrebonne, Bend, Oregon",$ 475,"Listed On: Monday, March 16, 2015",Rifles,Henry Repeating Arms                                                                                ,22 Magnum                                                                                ,Lever Action                                                                                ,Rifle,like new
297,http://www.armslist.com/posts/4102297,For Sale:  Glock 19 Gen 4,"Somers, Montana, United States",$ 500,"Listed On: Wednesday, March 4, 2015",Handguns,Glock                                                                                ,9mm Luger (9x19)                                                                                ,Striker Fire                                                                                ,Pistol,"Pristine, 9mm, bought new, 3 mags, easy loader, lock, extra grip straps, and hard box. All paper work. Less than 1 mag through barrel. Grip too big for my hand."
298,http://www.armslist.com/posts/4102298,For Sale:  AK47- WASR-10,"Edmond, Oklahoma City, Oklahoma",$ 650,"Listed On: Wednesday, March 4, 2015",Rifles,Century International Arms                                                                                ,7.62x39                                                                                ,Semi-automatic                                                                                ,Rifle,"I have a WASR 10 AK47. It has around 100-200 rounds through it. I love the gun but I need some money for some other things. I have had no problems at all with the gun. The gun will come with a gun case, 180 rounds of ammo. 160 steel 20 brass. Also comes with the bayonet and two magazines. I am asking $650. I will entertain offers but please no low ball offers. Shoot me an email if interested."
299,http://www.armslist.com/posts/4102299,For Sale/Trade:  Remington 870  12 Gauge pump shotgun,"Pickens, Greenville, South Carolina",$ 375,"Listed On: Wednesday, March 4, 2015",Shotguns,Remington                                                                                ,12 Gauge                                                                                ,Pump Action                                                                                ,Shotgun,I have a Remington express super magnum 12 ga up for sale or trade. Shoots 3 1/2 inch magnum. It is in like new condition and has a undertaker super full screw in choke. Let me know what you have or offer.
300,http://www.armslist.com/posts/4102300,For Sale:  GSG 5/522/ MP5 retractable stock,"Collinsvile, Tulsa, Oklahoma",$ 35,"Listed On: Wednesday, March 4, 2015",Gun,Remington                                                                                ,12 Gauge                                                                                ,Pump Action                                                                                ,Shotgun,Fits all mp5 models and replicas. 5 position retractable stock
301,http://www.armslist.com/posts/4102301,For Sale:  made in Russia IZHMASH AK-47 7.62,"Morley, Grand Rapids, Michigan","$ 1,150","Listed On: Wednesday, March 4, 2015",Rifles,Saiga                                                                                ,7.62x39                                                                                ,Semi-automatic                                                                                ,Rifle,"I have an actual Russian made IZHMASH ak-47, very good shooting gun! Comes with 850-900 rounds, and 3, 30 round mags and a 10round. I've shot less than 50 rounds through it. Saiga 7.62. If interested text me REDACTED. Or email REDACTED asking 1150 o.b.o. , possible trade"
302,http://www.armslist.com/posts/4102302,"For Sale:  *NEW* DS Arms AR15, EOTECH, AMMO, ETC.","st charles, St. Louis, Missouri","$ 1,000","Listed On: Wednesday, March 4, 2015",Rifles,DS Arms                                                                                ,223/5.56 NATO                                                                                ,Semi-automatic                                                                                ,Rifle,DS Arms AR15 (ZM4) with less than 100 rounds fired.  EOTECH XPS 2 with 4 extra batteries. 350 Rounds of Wolf .223 Ammo with ammo can. AR15 soft case.
303,http://www.armslist.com/posts/4102303,For Sale:  Hand Forged Damascus Steel Knife  Box Elder Burl,"Denton, Dallas, Texas",$ 150,"Listed On: Wednesday, April 1, 2015",Knives,DS Arms                                                                                ,223/5.56 NATO                                                                                ,Semi-automatic                                                                                ,Rifle,"Beautiful and rugged looking deep etched damascus steel knife hand forged by James Ivy from Kousins Kustoms.  Extremely highly patterned stabilized Box Elder Burl handle with yellow handle spacer and hand made mosaic pins.  Never used and no rust.  3"" blade, 6.75"" overall

No Trades"
304,http://www.armslist.com/posts/4102304,For Sale:  1 EA BOX HORNADY .357 MAG 125 GRAIN JHP/XTP 23 SILVER HOLLOW POINTS,"Medford, Medford, Oregon",$ 20,"Listed On: Wednesday, March 4, 2015",Ammo,DS Arms                                                                                ,223/5.56 NATO                                                                                ,Semi-automatic                                                                                ,Rifle,"1 EA BOX HORNADY .357 MAG 125 GRAIN JHP/XTP 23 ROUNDS SILVER HOLLOW POINTS


FACTORY NEW AMMO, NO RELOADS

NO MINORS

EMAIL ONLY

CASH ONLY, NOT INTERESTED IN TRADES"
305,http://www.armslist.com/posts/4102305,For Sale:  ISO: Body armor kevlar and carrier NOT MOLLE OR PLATES,"Topeka area, Topeka, Kansas",$ 500,"Listed On: Monday, April 20, 2015",Tactical,DS Arms                                                                                ,223/5.56 NATO                                                                                ,Semi-automatic                                                                                ,Rifle,Im looking for soft shell body armor shoot me an offer and ill see if im intrested no real cap on cash
306,http://www.armslist.com/posts/4102306,For Sale:  WASR-10GP,"Loveland, Fort Collins, Colorado",$ 500,"Listed On: Sunday, March 29, 2015",Rifles,Century International Arms                                                                                ,7.62x39                                                                                ,Semi-automatic                                                                                ,Rifle,I have a WASR-10GP for sale. Its a couple years old. It has had a lot of work done to it. The trigger was redone. The stock is adjustable. Comes with the red dot scope. It also has a bipod and sling. The rifle also comes with 5 mags and a canister with 100 rounds of ammo. The rifle is in good condition. I don't use it anymore and would rather use the money else where. Text or email with any questions. REDACTED. I'm asking 500$
307,http://www.armslist.com/posts/4102307,For Sale:  Oehler 35 Chronograph,"rtp, Raleigh / Durham / CH, North Carolina",$ 220,"Listed On: Wednesday, March 4, 2015",Targets,Century International Arms                                                                                ,7.62x39                                                                                ,Semi-automatic                                                                                ,Rifle,Has proof channel.  Some of the sky screens are nicked but it works. No printer. $220 including shipping to CONUS.
311,http://www.armslist.com/posts/4102311,For Sale:  Used Ruger stainless SR9 9mm,"Spring Branch 281N/46, San Antonio, Texas",$ 329,"Listed On: Wednesday, March 4, 2015",Handguns,Ruger                                                                                ,9mm Luger (9x19)                                                                                ,Striker Fire                                                                                ,Pistol,"Slightly used Ruger SR9 in perfect condition. It comes with 3 17 round magazines and hard case. Please email with any questions. You can pick up in person or I can ship to your FFL. I accept cash, credit cards, and paypal. I will consider trades. If the ad is active then It is still available. *please note* Texas residents must pay state sales tax.



Slide Material:
Stainless Steel
Slide Finish:
Brushed Stainless


Grip Frame:
Black, High Performance, Glass-Filled Nylon
Sights:
Adjustable 3-Dot


Barrel Length:
4.14""
Overall Length:
7.50""


Height:
5.52""
Width:
1.27""


Weight:
26.50 oz.
Capacity:
17+1


Twist:
1:10"" RH
Grooves:
6"
312,http://www.armslist.com/posts/4102312,Want To Buy:  Looking for a Remington 700 223,"Louisville, Louisville, Kentucky",Offer,"Listed On: Wednesday, March 4, 2015",Rifles,Ruger                                                                                ,9mm Luger (9x19)                                                                                ,Striker Fire                                                                                ,Pistol,Looking for a Remington 700 in 223. Really just need a barreled action but will buy the whole thing if I need to. Have guns to trade. Ar-15 and some others.
313,http://www.armslist.com/posts/4102313,For Sale/Trade:  beretta   P.Beretta A391 3.5 extrema 12 guage,"20miles north of bend in terrebonne, Bend, Oregon",$ 800,"Listed On: Monday, March 16, 2015",Shotguns,Beretta USA                                                                                ,12 Gauge                                                                                ,Semi-automatic                                                                                ,Shotgun,like new
315,http://www.armslist.com/posts/4102315,For Sale:  Ruger 77/44 stainless camo,"East, Columbus, Ohio",$ 750,"Listed On: Wednesday, March 4, 2015",Rifles,Ruger                                                                                ,44 Magnum                                                                                ,no type,Rifle,I have a ruger 77/44 stainless with camo stock. 44 rem mag with Burris 2x7 scope and around 50 rounds of ammo $750 obo
316,http://www.armslist.com/posts/4102316,For Sale:  Panther Arms DPMS 223/5.56 AR15,"Trinity, Greensboro, North Carolina",$ 600,"Listed On: Wednesday, March 4, 2015",Rifles,DPMS                                                                                ,223/5.56 NATO                                                                                ,Semi-automatic                                                                                ,Rifle,Panther Arms DPMS 223/5.56 AR15. Less than one year old. It has a cheap scope on it that it will come with. It has only had 20 rounds through it.
317,http://www.armslist.com/posts/4102317,For Trade:  Springfeild Armory Champion operator 1911,"North springs, Colorado Springs, Colorado",Offer,"Listed On: Monday, March 16, 2015",Handguns,Springfield                                                                                ,45 ACP                                                                                ,Single Action                                                                                ,Pistol,"I have a quality 1911 I'd like to trade for something diffrent. It has trijicon night sights, vz grips, original case/holster/mag carrier, couple hundred rounds of ammo and some mags."
318,http://www.armslist.com/posts/4102318,For Sale:  springfield XDS,"aiken, South Carolina, United States",$ 450,"Listed On: Saturday, March 28, 2015",Handguns,Springfield                                                                                ,45 ACP                                                                                ,Double Action                                                                                ,Pistol,springfield XDS
