,url,title,location,price,post date,category,manufacturer,caliber,action,firearm type,postcontent
501,http://www.armslist.com/posts/4102501,For Sale:  like new Sig Sauer ultra compact 2-Tone rosewood,"Norman, Oklahoma City, Oklahoma",$ 795,"Listed On: Wednesday, March 4, 2015",Handguns,Sig Sauer                                                                                ,45 ACP                                                                                ,Single Action                                                                                ,Pistol,"fired less than 100 rounds
(2)  7 round magazines
perfect condition
Daughter getting married"
502,http://www.armslist.com/posts/4102502,For Sale:  c,"A, Guam, United States",$ 1,"Listed On: Wednesday, March 4, 2015",Ammo,Sig Sauer                                                                                ,45 ACP                                                                                ,Single Action                                                                                ,Pistol,c
504,http://www.armslist.com/posts/4102504,For Sale:  Collectible ammo and boxes,"north side, Bloomington, Indiana",$ 25,"Listed On: Wednesday, March 4, 2015",Ammo,no type,no type,no type,no type,"I have several different calibers that are very collectible. 30 Newton, 250 Savage, 257 Roberts, 32-20 Win, 38-55, Rem. 25-20, Rem 22 Jet, and several others along with several boxes of old primers. Most have original boxes. Prices vary per caliber."
505,http://www.armslist.com/posts/4102505,For Sale/Trade:  Taurus TCP738 SS .380,"Cleveland, Cleveland, Ohio",$ 275,"Listed On: Wednesday, March 11, 2015",Handguns,Taurus                                                                                ,380 ACP                                                                                ,no type,Pistol,"Taurus TCP738 stainless with 2 mags, 2 holsters, full box of Hydrashok personal defense rounds and a box Lawman."
506,http://www.armslist.com/posts/4102506,For Sale/Trade:  GLOCK 30 gen 4 and GLOCK 42 obo,"NORTH HAMPTON, Dayton, Ohio",$ 920,"Listed On: Wednesday, March 4, 2015",Handguns,Glock,380 ACP                                                                                ,no type,Pistol,lnib email phone number will send pics and info will split up
507,http://www.armslist.com/posts/4102507,For Trade:  Mosin nagant,"Grand junction, Western Slope, Colorado",Offer,"Listed On: Thursday, March 5, 2015",Rifles,Glock,7.62x54R                                                                                ,Bolt Action                                                                                ,Rifle,Mosin nagant. 530 rounds of ammo. Make offer on  cash price.
508,http://www.armslist.com/posts/4102508,For Sale:  Free Magpul Buis w purchase m&p Crimson trace,"Cordova TN, Tennessee, United States",$ 150,"Listed On: Wednesday, March 4, 2015",Handguns,Glock,7.62x54R                                                                                ,Bolt Action                                                                                ,Rifle,I have a new set of crimson trace lazer grips for a full size m&p 9-40. I paid 299$ plus tax for it and never really used it. I'm selling for 150$ firm and if purchased within the next day I'll throw in your choice of a freebie such as free streamlight EDC light Or brand new set of black Magpul backup rifle sights or a brand new set of Leatherman OHT which are 80-100 alone and come with a molle adaptive pouch. This is a deal you don't want to let pass up at an outstanding price and not to mention an awesome freebie. I will also ship at your expense if needed. Email if interested or text REDACTED
509,http://www.armslist.com/posts/4102509,For Sale/Trade:  Desantis N38 Nemesis Pocket Holster,"Waukesha, Milwaukee, Wisconsin",$ 10,"Listed On: Wednesday, March 4, 2015",Holsters,Glock,7.62x54R                                                                                ,Bolt Action                                                                                ,Rifle,For Glock 26/27/33
511,http://www.armslist.com/posts/4102511,Want To Buy:  Walther pp in 380,"st louis, St. Louis, Missouri",Offer,"Listed On: Wednesday, March 4, 2015",Handguns,Walther                                                                                ,380 ACP                                                                                ,no type,Pistol,"looking for a walther pp in 380 
top price would be 500"
512,http://www.armslist.com/posts/4102512,For Sale:  Ruger LC9 New,"Fairfield, Cincinnati, Ohio",$ 330,"Listed On: Wednesday, March 4, 2015",Handguns,Ruger                                                                                ,9mm Luger (9x19)                                                                                ,Double / Single Action                                                                                ,Pistol,For sale is a new in box Ruger LC9. Pistol will come with everything it came with from the factory including two magazines. Price is $330 without the Laserlyte or $390 with the Laserlyte.
513,http://www.armslist.com/posts/4102513,For Trade:  Sccy cpx-2 9mm Flat dark earth & black,"Roanoke Salem Vinton Bedford, Roanoke, Virginia",Offer,"Listed On: Wednesday, March 4, 2015",Handguns,Ruger                                                                                ,9mm Luger (9x19)                                                                                ,Double / Single Action                                                                                ,Pistol,"I have a sccy cpx-2 9mm
Comes with 2 mags box trigger lock & key
Also have some rounds included 

Looking to trade for a. 40 or. 45 caliber subcompact or full-size 
Let me know what you have 

Feel free to text me at REDACTED"
515,http://www.armslist.com/posts/4102515,For Sale:  Civil War pistols,"Lenoir City, Knoxville, Tennessee","$ 3,000","Listed On: Monday, May 11, 2015",Antique,no type,no type,no type,no type,I have two Starr pistol's for sale one single action and one double action both are 50 cal. great shape for there age. The price is 3000.00 for the pair or 1750.00 each. price is firm and do not want to trade for anything. call REDACTED
516,http://www.armslist.com/posts/4102516,For Sale:  Ruger sp101,"Pittsburgh, Pittsburgh, Pennsylvania",$ 450,"Listed On: Wednesday, March 4, 2015",Handguns,Ruger                                                                                ,357 Magnum                                                                                ,Single Action                                                                                ,Revolver,"Ruger sp101 2.25"" barrel. This firearm was a gift from the wife and has never been fired. This Ruger sp101 come with Jim Badger Rosewood grips. For more info please text or call REDACTED - Wil

Buyer pays FFL Transfer."
517,http://www.armslist.com/posts/4102517,For Sale:  Smith Wesson 40ve,"frankfort, Lexington, Kentucky",$ 325,"Listed On: Wednesday, March 4, 2015",Handguns,Smith & Wesson                                                                                ,357 Magnum                                                                                ,Single Action                                                                                ,Revolver,With 3 mags no box
518,http://www.armslist.com/posts/4102518,For Sale:  Ruger Ranch rifle $625.00 or best offer (OBO),"Helena, Helena, Montana",$ 625,"Listed On: Monday, May 11, 2015",Rifles,Ruger                                                                                ,223/5.56 NATO                                                                                ,Semi-automatic                                                                                ,Rifle,"New Pricing!

For Sale: Ruger Ranch rifle $625.00 or best offer (OBO)

This is a very fun rifle to shoot! 

Nothing wrong with the rifle, just moving on to an AR platform.

Comes with:
•	Redfield Revolution 2-7x33 Scope
•	Sling
•	Soft Case
•	(2) 30-round magazines
•	(1) 10-round magazine
•	Wood Stock
•	Polymer folding stock

•	Action: semi-automatic
•	Caliber: .223 Remington/5.56 NATO
•	Barrel length: 18.00"" 
•	Metal finish: blued

Weight range: 7.00 lbs to 7.99 lbs"
519,http://www.armslist.com/posts/4102519,Want To Buy:  7.62x51 Nato .308 winchester spam can,"Concord NC, Charlotte, North Carolina",$ 1,"Listed On: Wednesday, March 4, 2015",Ammo,Ruger                                                                                ,223/5.56 NATO                                                                                ,Semi-automatic                                                                                ,Rifle,"Ready to buy vintage ammo, military spam can, I pay shipping, x39 or x54 in specialty round will be considered.  Primarily interested in x51.  let me know and name your price.  thanks and look forward to hearing from you.  REDACTED, Picture required"
520,http://www.armslist.com/posts/4102520,For Sale:  FN FNX 45 TACTICAL FDE,"Hilliard, Columbus, Ohio","$ 1,200","Listed On: Friday, March 13, 2015",Handguns,FN Herstal S.A.                                                                                ,45 ACP                                                                                ,Double / Single Action                                                                                ,Pistol,"Excellent shape FN FNX 45. Few hundred rnds fired through it.
 Includes:
Pistol,  case, back straps, optics mounts, four 15rnd mags, 850 rnds of ammo, and kydex double mag pouch

price is OBO. No trades

REDACTED"
522,http://www.armslist.com/posts/4102522,For Sale:  S&W model 39-2 nickel,"Coeur d Alene, Coeur D' Alene, Idaho",$ 500,"Listed On: Wednesday, March 4, 2015",Handguns,Smith & Wesson                                                                                ,9mm Luger (9x19)                                                                                ,Double Action                                                                                ,Pistol,"S&W 39-2 nickel beautiful craftsmanship!
Comes with one mag and leather holster. 
$500 firm 
Cash only no trades no stupid questions please!"
523,http://www.armslist.com/posts/4102523,For Sale/Trade:  Ruger Blackhawk 357  3 screw  early model,"SE Denver, Aurora, Denver, Colorado",$ 350,"Listed On: Sunday, March 15, 2015",Handguns,Ruger                                                                                ,357 Magnum                                                                                ,Single Action                                                                                ,Revolver,"1964 model Ruger 357 Blackhawk. Serial number 55xxx.  Not modified.  All original parts.  Shows holster wear.  Carried a lot.  Shot very little.  Still locks up very tight and has clean bright barrel.  4 1/2 inch barrel, wood grips.  Adjustable rear sight. ....
 Great candidate for refinish. 

 Price is $350  cash,      Trade for Ruger SP101 or Glock 19 only.   
C&R over 50 yrs.  NO FFL required..."
524,http://www.armslist.com/posts/4102524,Want To Buy:  AKs,"Cookeville, Cookeville, Tennessee",Offer,"Listed On: Wednesday, March 4, 2015",Rifles,Ruger                                                                                ,357 Magnum                                                                                ,Single Action                                                                                ,Revolver,I'm looking for a few AKs. Specifically an Arsenal SLR 107 or 104 UR and a SLR 107 or 104 CR. I have plenty of trades and might do cash also. I'm also looking for a CR type gas block. If you have any of these items please email or text me and we can work out a deal. REDACTED
525,http://www.armslist.com/posts/4102525,For Sale:  Turkisk ANK ARA 1938-1939'S  AS FA (AS FA)  French revolver and others.,"West of I-25, Central, Colorado Springs, Colorado",FREE,"Listed On: Friday, April 10, 2015",Antique,Ruger                                                                                ,357 Magnum                                                                                ,Single Action                                                                                ,Revolver,"Hello All, 
I just registered and I am not sure I am doing any of this correctly. If I'm not Please feel free to let me know, Thanks! 
 I just saw a post from a guy looking for a stock for his short Turkish rifle. Maybe y'all can help me out and I can help him out as well. I just purchased six of the models that I listed in the ""subject line"" of this post. I also purchased one barrel only, no stock/wood. 
 Here's what I have: these rifles have been rendered inoperable, a bead has been welded on part of the bolt so that none of them function. They are in nice shape, and I say this only based on many pictures that I have viewed on the internet, wood is very solid and the sights are all nice and function well. 
 I own several guns yet none of them are old with any history like these Turkish rifles. I am wondering if these rifles might help someone that collects, restores, shoots, or otherwise has interest in them. I bought these from a guy clearing out a storage facility. They have been on display in a Famous bar here in Colorado Springs for many many years. Meadow Muffins was the name of the bar in what used to be called Old Colorado City. 
 As I tried to learn about them I found your site, read many of the posts about these and similar Turkish/Mauser style rifles and decided this was the place to ask for help and maybe help someone looking for parts. Y'all sound very knowledgeable. 
 I will try to post pictures, hopefully I can make that work! I'd sure like for y'all to see these so that maybe they might help someone out. They would make cool fireplace mantle hangers, man cave decorations yet I don't want to start cleaning them up until I try to find folks that could use them. 
 I also ended up with a French 44 cal/8mm revolver and another bolt action MAS? If these would help anyone let me know. Be glad to send additional photos. Just let me know what you'd like to see. I'm not trying to get people to bid against each other with my email to the people that contacted me. I just do not know what I have, make an offer and I will take the first and best offer, that's all. I want someone to make good use of these.
 Thanks to all of you in advance and if you have any questions, comments, or suggestions Please feel free to let me know! 
 Todd C."
527,http://www.armslist.com/posts/4102527,For Sale:  Smith & Wesson SD40VE,"Cherry Creek, Denver, Colorado",$ 300,"Listed On: Wednesday, March 4, 2015",Handguns,Smith & Wesson                                                                                ,40 S&W,no type,no type,"Good condition Smith and Wesson SD40VE.  Probably have only shot about 50 rounds through it.  Comes with ammo and case too!

Features and Benefits

    - Semiautomatic double action with 14-round capacity
    - Polymer frame with a stainless-steel slide and barrel
    - Plastic grip
    - Self-defense trigger
    - White-dot dovetail front and rear sights
    - Picatinny rail
    - 14 round magazine"
530,http://www.armslist.com/posts/4102530,For Sale:  Mossberg model 930 semi-automatic home defense gun,"Aurora Indiana 47001, Indianapolis, Indiana",$ 650,"Listed On: Wednesday, March 4, 2015",Shotguns,Mossberg                                                                                ,12 Gauge                                                                                ,Semi-automatic                                                                                ,Shotgun,"Mossberg Model 930 12ga 3""magnum defense gun. Holds 8 shells, raised ring sights.
The gun is brand new condition less than one box of shells shot through it.
Steve REDACTED"
532,http://www.armslist.com/posts/4102532,For Sale:  RCBS Benchtop Swager,"South side, Grand Rapids, Michigan",$ 70,"Listed On: Sunday, March 15, 2015",Reloading,no type,no type,no type,no type,"I have a lightly used rcbs bench top swager for sale.  Come with everything that was in the box, but no box.  $70 obo.  No trades."
533,http://www.armslist.com/posts/4102533,For Trade:  Glock 22 RTF,"Allentown, Allentown, Pennsylvania",Offer,"Listed On: Wednesday, March 4, 2015",Handguns,Glock                                                                                ,40 S&W                                                                                ,Double Action                                                                                ,Revolver,all questions please ask.
534,http://www.armslist.com/posts/4102534,For Trade:   GREEN  TIP 2 cans of Federal 420 rounds on stripper clips M855,"Canton, Georgia, United States",Offer,"Listed On: Wednesday, March 4, 2015",Ammo,Glock                                                                                ,40 S&W                                                                                ,Double Action                                                                                ,Revolver,2 cans of 420 rounds of Federal xm855 green tip up for trade
535,http://www.armslist.com/posts/4102535,For Sale:  Surplus 7.62 ammo,"Rockfield, Bowling Green, Kentucky",$ 115,"Listed On: Wednesday, April 1, 2015",Ammo,Glock                                                                                ,40 S&W                                                                                ,Double Action                                                                                ,Revolver,"I have 340 rounds of what I believe to be indian surplus 7.62 ammo. 300 rounds are wrapped in brown paper and tied with string, the other 40 have been repackaged into cardboard boxes. Headstamp is ""KF 77 7.62a"" - $115 FTF in Bowling Green. If shipping add $25
Text REDACTED

Interested in trades for hunting gear, gun safe, optics, AR15 parts, etc.

Key: .308 308 762 7.62 NATO 7.62x51 m1a m14 Indian surplus ammo brass bullet fmj cheap"
537,http://www.armslist.com/posts/4102537,"For Sale:  FOR SALE ONLY Colt python 357 mag.  4 "" barrel.",". all Florida, Florida, United States","$ 2,300","Listed On: Tuesday, March 10, 2015",Handguns,Colt                                                                                ,357 Magnum                                                                                ,Double Action                                                                                ,Revolver,"Offering a Like New Colt Python 357 mag.
This weapon looks and operates like new.
Blueing and wood grips are perfect.
any marks in photos are smudges
Finish is PERFECT.
Additional photos on request.
Own a piece of Colt History."
538,http://www.armslist.com/posts/4102538,For Sale:  LMT sopmod buttstock and grip,"lakewood, Tacoma, Washington",$ 150,"Listed On: Wednesday, March 4, 2015",Gun,Colt                                                                                ,357 Magnum                                                                                ,Double Action                                                                                ,Revolver,Brand new never used LMT(Lewis Machine & Tool company) rifle SOPMOD buttstock with quick disconnect and rifle grip. Both are in black. $150obo
540,http://www.armslist.com/posts/4102540,For Sale:  26.5mm to 45 long colt /410 ammo flare gun insert all metal new !,"Pennsylvania, North Central, PA, Pennsylvania",$ 144,"Listed On: Wednesday, March 4, 2015",Gun,no type,no type,no type,no type,"26.5 mm to 45 Long Colt / .410 Ammo (Metal) Sub-Caliber Flare Gun Insert

Don't be caught defenseless.
The 26.5mm to 45 Long Colt / .410 2.5"" Shot Shell ammo (Metal - Aluminum) Sub-Caliber Flare Gun Insert is perfect for boaters, campers or hikers. The insert simply slides into your 26.5mm flare gun to allow you to fire 45 Long Colt or .410 2.5"" Shot Shell  ammunition. Drop into the tackle box or backpack and use for self defense or to take small game in an emergency survival situation. The rifled steel barrel is in encased in a solid aluminum corrosion resistant adaptor adding minimal additional weight while being very heavy duty. The barrel is positioned to make for a perfect shot every time. To top it off, the insert slides right into your 26.5mm flare gun and is ready to shoot, making installation foolproof.
Do Not Dry fire 

Dimensions:
Length: 4""

Fits in all 26.5mm Flare Guns (Geco, H&K, etc.)

Purchase or ownership of this product in and of itself is not Federally restricted. No FFL required. Ships direct.
Please be aware that because this product converts a flare gun into a firearm when inserted that use or ownership of the product in conjunction with a flare gun is subject to any and all applicable state, local and Federal laws, rules and regulations. 

( know your states unconstitutional laws ) 

Note: Listing is for the sub-caliber insert only ! NO Flare Gun, Ammunition, or flares are included. 
(We DO NOT SELL the Flare Gun and it is NOT Included)

BATF Approval Letter Included


Please allow 5 to 10 business days to process and ship all orders , orders may arrive sooner but due to conditions out of our control we ask you please allow 5 to 10 business days excluding holidays and weekends. 

We accept paypal or usps money order , 

Please contact for details or purchase ! 

Other 26.5 mm flare gun drop in sub caliber inserts we carry are as follows 

26.5mm to 22lr metal insert , price per unit $119.00 : In stock 
26.5mm to 38 special metal insert ,price per unit $124.00 : in stock 
26.5mm to 22lr ABS insert ,price per unit $109.00 , in stock 

Free shipping to lower 48 ! Email with questions or for discount on multiple orders ."
541,http://www.armslist.com/posts/4102541,For Sale/Trade:  44 Mag,"Medford, Medford, Oregon",$ 200,"Listed On: Wednesday, March 4, 2015",Reloading,no type,no type,no type,no type,"I have 500 or so brass, a couple of thousand CCI Lg Pistol magnum primers, hundreds of 200 to 240 gr jacketed to lead bullets and a set of RCBS Carbide dies to sell or trade. Will set a price because that's what everyone wants BUT it can go up or down depending on the amount or the trade. Will only deal locally, GP, Medford, Klamath because it makes no sense to ship 40 pounds of stuff. This is all reloading stuff, that's why its listed under reloading, there are no loaded bullets here. Thanks"
544,http://www.armslist.com/posts/4102544,For Sale:  Ruger 454 Super Red hawk,"I'm in Zanesville oh, Columbus, Ohio",$ 800,"Listed On: Wednesday, March 4, 2015",Handguns,Ruger                                                                                ,454 Casull                                                                                ,Double / Single Action                                                                                ,Revolver,454 casell super red hawk. With costume made leather holster with belt and bullet loops. In good condition. Its a double action and shoots both 454 casell and 45 long colt.
545,http://www.armslist.com/posts/4102545,For Sale:  remington 700,"sw iowa, Des Moines, Iowa",$ 630,"Listed On: Thursday, March 12, 2015",Rifles,Remington                                                                                ,22-250 Remington                                                                                ,Bolt Action                                                                                ,Rifle,"Remington 700 adl 22-250 with scope  and sling. older model 1973  with 190 plus rds 
asking 630$ very clean gun"
546,http://www.armslist.com/posts/4102546,For Trade:  M&P 9mm / Glock 22 gen4,"Woodland wa, Southwest Washington, Washington",Offer,"Listed On: Wednesday, March 4, 2015",Handguns,Remington                                                                                ,9mm Luger (9x19)                                                                                ,Striker Fire                                                                                ,Pistol,"Both like new

M&P 9mm with all factory stuff
Case
Backstraps
3 17rd mags
And new Crimson trace grips

Gen 4 glock 22
Under 100 rounds through it
Backstraps
Case
3 15rd mags



Looking for
Higher end 1911. Kimber, etc....
Arsenal ak
Sigs
Or?  
Can also add ammo for the right deal
Just ask"
547,http://www.armslist.com/posts/4102547,For Sale:  Browning Safari 270 Like New,"Andover, Wichita, Kansas",$ 925,"Listed On: Tuesday, April 14, 2015",Rifles,Browning                                                                                ,270 Winchester                                                                                ,Semi-automatic                                                                                ,Rifle,"This gun has been fired 4 times and been in a safe and cleaned all its life.  It is a beautiful gun. 

No trades"
549,http://www.armslist.com/posts/4102549,For Sale:  Beretta 12g,"frankfort, Lexington, Kentucky",$ 650,"Listed On: Wednesday, March 4, 2015",Shotguns,Beretta USA                                                                                ,12 Gauge                                                                                ,Semi-automatic                                                                                ,Shotgun,"Model 1201fp
with box"
