,url,title,location,price,post date,category,manufacturer,caliber,action,firearm type,postcontent
482,http://www.armslist.com/posts/4138482,For Sale/Trade:  M77 Ruger M77/22 Hornet Walnut Stock .22 hornet 22 ! Reduced !,"Springfield, Springfield, Missouri",$ 755,"Listed On: Sunday, May 10, 2015",Rifles,Ruger                                                                                ,22 Hornet                                                                                ,Bolt Action                                                                                ,Rifle,I have a Older Ruger M77/22 Hornet Walnut Stock & Rings.
483,http://www.armslist.com/posts/4138483,For Sale:  Wicked Ridge Crossbow (as New),"Canon City, Colorado Springs, Colorado",$ 450,"Listed On: Saturday, March 14, 2015",Archery,Ruger                                                                                ,22 Hornet                                                                                ,Bolt Action                                                                                ,Rifle,"Extremely accurate right out of the box ; New condition, ( fired less than a dozen practice shots), original box and accessories; arrows, practice-tip & hunting-tip , mechanical broadheads, cocking-cord ; 
well over over 500.00 invested, and just didn't use it ; asking 450.00 ""or"" see what you have for trade ; call for details : REDACTED"
484,http://www.armslist.com/posts/4138484,For Sale/Trade:  Grendel P-12 .380,"RedBank, Columbia, South Carolina",$ 200,"Listed On: Thursday, March 19, 2015",Handguns,Kel-Tec                                                                                ,380 ACP                                                                                ,Double Action                                                                                ,Pistol,"Grendel P-12 good shooting, nice clusters comes with 10 round mag, not the best reputation but I fire 300 rounds of decent ammo with no FTF or FTE problems after I cleaned it up and did some minor 4000 grit sanding, this is a double action which is the best thing about this low priced under appreciated weapon"
485,http://www.armslist.com/posts/4138485,For Sale:  cheek pad,"covington, Washington, United States",$ 28,"Listed On: Sunday, June 14, 2015",Gun,Kel-Tec                                                                                ,380 ACP                                                                                ,Double Action                                                                                ,Pistol,Tac ops cheek pad. Made in USA. 28 obo
486,http://www.armslist.com/posts/4138486,For Sale:  Glock 19 Gen 4,"Bellevue, Seattle, Washington",$ 450,"Listed On: Saturday, March 14, 2015",Handguns,Glock                                                                                ,9mm Luger (9x19)                                                                                ,Striker Fire                                                                                ,Pistol,"In pretty good condition, very minor holster wear. Comes with original box, all original goodies, and a Tagua holster. <500 round count. 

We are doing this by the book, split the transfer fee."
487,http://www.armslist.com/posts/4138487,For Sale/Trade:  AR PISTOL-5.56,"the gut, Rutland, Vermont",$ 875,"Listed On: Thursday, March 19, 2015",Handguns,Glock                                                                                ,223/5.56 NATO                                                                                ,Striker Fire                                                                                ,Pistol,"Ar pistol. Very accurate, factory upper.
Some options, ammo, mags available.
 More Pics on request.
$875 or trade."
488,http://www.armslist.com/posts/4138488,For Sale/Trade:  30-06 rifle trade for shotgun or sell for $300.00,"citrus county, Ocala, Florida",$ 300,"Listed On: Saturday, March 14, 2015",Rifles,Mossberg                                                                                ,30-06 Springfield                                                                                ,Break Open                                                                                ,Rifle,mossberg ssi-one 30-06 with 3-9x50mm scope (tasco) case and one box of ammo will trade for nice shotgun or sell for $300.00 i an in citrus county
490,http://www.armslist.com/posts/4138490,For Sale/Trade:  New Eotech 512  / New  AR-15mags Sell or Trade,"Ada, Oklahoma City, Oklahoma",$ 0,"Listed On: Thursday, March 19, 2015",Optics,no type,no type,no type,no type,"I have a brand new Eotech model 512, with case, all paperwork $400.

 (13)30rd steel magazines for AR-15, brand new still in the package $120.  

Would trade for rifle or pistol, so let me know what you have to offer. Worst I can say is no thanks.

Call or text for any questions,  REDACTED  James."
492,http://www.armslist.com/posts/4138492,For Sale/Trade:  Ruger LCP + Extras,"Hoover, Birmingham, Alabama",$ 350,"Listed On: Saturday, March 14, 2015",Handguns,Ruger                                                                                ,380 ACP                                                                                ,Double / Single Action                                                                                ,Pistol,"Used Ruger LCP for sale/trade.
Includes two magazines with pinky extensions and factory floor plates. Factory Springs and Wolff Springs for more positive ejection. Extra Firing Pin.  Original box and soft case included.
Cash only or trade for Glock 42.  
Buyer must show CCP at purchase"
493,http://www.armslist.com/posts/4138493,For Sale/Trade:  mossberg,"south, Indianapolis, Indiana",$ 200,"Listed On: Monday, March 23, 2015",Shotguns,Mossberg                                                                                ,12 Gauge                                                                                ,Pump Action                                                                                ,Shotgun,Mossberg Maverick 88 24 in rifled barrel with rifle sights  and side saddle with a few rounds of slugs and a few buckshot 200 firm located in Indianapolis you can text REDACTED
495,http://www.armslist.com/posts/4138495,For Sale:  High Standard Citation II Stailess Target in box,"Angola, Fort Wayne, Indiana",$ 350,"Listed On: Friday, May 8, 2015",Handguns,High Standard                                                                                ,22 Long Rifle                                                                                ,Single Action                                                                                ,Pistol,"5 1/2"" bull stainless with adjustable trigger & sear. Box and all paperwork with 2 factory mags & holster."
497,http://www.armslist.com/posts/4138497,For Sale/Trade:  Smith & Wesson 642-2 revolver with Crimson Trace laser grips,"Greensboro / Triad, Greensboro, North Carolina",$ 580,"Listed On: Thursday, March 26, 2015",Handguns,Smith & Wesson                                                                                ,38 S&W Special                                                                                ,Double Action                                                                                ,Revolver,"Smith & Wesson 642-2 revolver with Crimson Trace laser grips . 38 SPECIAL + P , 5 shot , J frame air-weight . Total of 50 rounds fired . Comes with box , manual . 

If ad is up, it is still available - please do not waste an email asking if I still have it - I will close the ad when it is sold / traded.

You must have a CCW or an original permit to purchase ( not a copy), and you must have a valid NCDL and sign a bill of sale 

You can offer other trades , just no shotguns, hunting rifles , Taurus's , Keltec's , 40 S&W , or  revolvers"
498,http://www.armslist.com/posts/4138498,For Sale:  Springfield Milspec 1911 w/ Wilson Parts and VZ Grips,"Fayetville/ Hope Mills, Fayetteville, North Carolina",$ 750,"Listed On: Saturday, March 14, 2015",Handguns,Springfield                                                                                ,45 ACP                                                                                ,Single Action                                                                                ,Pistol,"I have for sale a Parkerized Milspec 1911 from Springfield w/ Wilson Combat parts. It comes with the following:

Wilson Flat Checkered MSH
Wilson Commander Style Hammer
Wilson Matchgrade Solid Pad Trigger
Wilson Drop in Grip Safety
Wilson Blued Pin Set
(I have all of the original Wilson packaging to account for part numbers)

VZ Grips Operator 2 in Black Desert Sand 
VZ Grips Slex Screws

2 Kimber KimPro Tac 8 round mags w/ baseplates

Comes with original GI parts and packaging

I am asking $750 and I will not take a Penny less!!!
No trades!!! At all!!!!

REDACTED"
500,http://www.armslist.com/posts/4138500,For Sale:  Beretta 92FS with 13 15 round magazines,"Hartland, Milwaukee, Wisconsin",$ 400,"Listed On: Saturday, March 14, 2015",Handguns,Beretta USA                                                                                ,9mm Luger (9x19)                                                                                ,Double / Single Action                                                                                ,Pistol,"Used beretta 92FS, it shoots great, was told by the guy I got it from that it was a police officers sidearm, it shows holster wear. Accurate and fun to shoot.

This gun does not look like it just came out of the box, it shows wear.

comes with a generic plastic pistol case and 13 magazines. Some of them unused.

I will need to see a Wisconsin CCW from you to sell this.

The price is firm, I will put pictures up in a little bit

e-mail me through armslist or text me at REDACTED"
503,http://www.armslist.com/posts/4138503,For Sale:  Mosin Nagant 7.62x54R Russian,"Littleton, Denver, Colorado",$ 156,"Listed On: Saturday, March 14, 2015",Rifles,no type,7.62x54R                                                                                ,Bolt Action                                                                                ,Rifle,"FS Mosin Nagant 1943 Russian  7.62 x 54R. This rifle has markings from the Izhevsk factory in Russia. The rifle comes with the bayonet, ammo pouches and 45 rounds of ammo.

Asking $156  for everything

PM if you are interested"
504,http://www.armslist.com/posts/4138504,For Sale:  Ammo Boxes w/ Plastic Dividers,"Fairhope/Mobile, Mobile, Alabama",FREE,"Listed On: Friday, March 20, 2015",Ammo,no type,7.62x54R                                                                                ,Bolt Action                                                                                ,Rifle,"I have a bunch of ammo boxes with 50-round plastic dividers for sale.  I know they fit 9mm and it appears that they will fit .40 also.

I have 131 of the boxes and 156 dividers.  Whoever buys the last of the boxes will also get all of the remaining dividers.

Price breakdown as follows:

1-20 boxes w/ dividers:  $.75 each
21-50 boxes w/ dividers:  $.50 each
If you buy everything:  $50 ($.38 each)"
505,http://www.armslist.com/posts/4138505,For Sale:  Mossberg Silver Reserve 2,"Ripon, Appleton, Wisconsin",$ 550,"Listed On: Saturday, March 14, 2015",Shotguns,Mossberg                                                                                ,12 Gauge                                                                                ,Over and Under                                                                                ,Shotgun,"Field grade over under  
2 3/4 and 3 inch chamber
Brand new in the box, never shot. 
Price is firm 

No scams to contact me please call REDACTED."
506,http://www.armslist.com/posts/4138506,For Sale/Trade:  Marlin 3030 model336,"Simpsonville, Greenville, South Carolina",$ 0,"Listed On: Saturday, March 14, 2015",Rifles,Marlin                                                                                ,30-30 Winchester                                                                                ,Lever Action                                                                                ,Rifle,I have a very nice condition marlin 3030. It has a gold trigger and I believe it was manufactured in 1975. The gun has a low mounted bushnell bannor scope. Text trades to REDACTED
507,http://www.armslist.com/posts/4138507,For Sale:  remington scope base,"covington, Washington, United States",$ 50,"Listed On: Sunday, June 14, 2015",Gun,Marlin                                                                                ,30-30 Winchester                                                                                ,Lever Action                                                                                ,Rifle,Tps 20 moa steel scope base. Remington short action 6-48. 50 obo
508,http://www.armslist.com/posts/4138508,For Sale/Trade:  Beretta PX4 Storm 9mm Full Size,"Margate/Coral Springs, Broward, South Florida",$ 400,"Listed On: Saturday, March 14, 2015",Handguns,Beretta USA                                                                                ,9mm Luger (9x19)                                                                                ,Double / Single Action                                                                                ,Pistol,"Up for trade is a Beretta PX4 Storm 9mm Full Size pistol. It is the type""F"" model with the safety/decocker lever. it comes with the box and four 17 round magazines. No extra backstraps or paperwork is included. Only one of the magazines has been used. Gun is in great condition with about 500-750 rounds through it. Very clean gun, no nicks or scratches on it. I prefer striker-fired guns to DA/SA. This is the only reason why I am putting up for trade. Located in north Broward. 21 and over please with a CWP or valid FDL for ID purposes. Prefer a trade but will sell for $400.00 firm!!!!!"
511,http://www.armslist.com/posts/4138511,For Sale:   SIG SAUER P238,"st pete, Tampa/St. Pete, Florida",$ 550,"Listed On: Saturday, March 14, 2015",Handguns,Sig Sauer,no type,no type,no type,"box manual
2 mags
a box of ammo
 in like new condition
 holster"
512,http://www.armslist.com/posts/4138512,For Sale:  S&W Model 638 Brand New in Box,"Norfolk, Hampton Roads, Virginia",$ 385,"Listed On: Saturday, March 14, 2015",Handguns,Smith & Wesson                                                                                ,38 S&W Special                                                                                ,Double / Single Action                                                                                ,Revolver,"As the title states, this is for a brand new, unfired, and never carried S&W Model 638 .38 cal SPL."
513,http://www.armslist.com/posts/4138513,For Sale:  HENERY GOLDEN BOY,"RTP, Raleigh / Durham / CH, North Carolina",$ 400,"Listed On: Saturday, March 14, 2015",Rifles,Henry Repeating Arms                                                                                ,22 Long Rifle                                                                                ,Lever Action                                                                                ,Rifle,"Shot 10 time 
Comes with box and paperwork"
514,http://www.armslist.com/posts/4138514,For Sale/Trade:  M17 II gen Bushmaster,"Clarksville, Clarksville, Tennessee","$ 1,100","Listed On: Saturday, March 14, 2015",Rifles,Bushmaster                                                                                ,223/5.56 NATO                                                                                ,Semi-automatic                                                                                ,Rifle,"I have a bushmaster m17s that shoots 223/556. Comes with some mags. Upper rail modification with UTI 3X optic scope. Still have the original handle for it. Looking to trade for some handguns such as GLOCK, SIG, S&W, RUGER, XD, etc. $1100 text me offers at REDACTED"
515,http://www.armslist.com/posts/4138515,For Sale:  11 SKS Magazines All Together,"Springfield, Springfield, Missouri",$ 160,"Listed On: Sunday, March 29, 2015",Magazines,Bushmaster                                                                                ,223/5.56 NATO                                                                                ,Semi-automatic                                                                                ,Rifle,"11 SKS Magazines All Together  I have 7 Tapco 20 Round Mags, 1 Metal 20 Round Mag, 2 Metal 30 Round Mags, & 1 Plastic 30 Round Mag. All for one Money $160 or trade for a Gun."
516,http://www.armslist.com/posts/4138516,For Sale/Trade:  rock river ar15 w eotech  and case,"Perryville, Cape Girardeau, Missouri","$ 1,400","Listed On: Saturday, March 14, 2015",Rifles,Rock River Arms                                                                                ,223/5.56 NATO                                                                                ,Semi-automatic                                                                                ,Rifle,"RRA ar15. Magpul furniture  eotech  ext . charging handle, pins and mag release  anti rotation pins. 556/223. Nice carrying case included.
$1400 or ?  Prefer 1911,dessert eagle. or handguns."
517,http://www.armslist.com/posts/4138517,For Sale/Trade:  M17S Bushmaster with 3X optic scope,"Clarksville, Nashville, Tennessee","$ 1,100","Listed On: Saturday, March 14, 2015",Rifles,Bushmaster                                                                                ,223/5.56 NATO                                                                                ,Semi-automatic                                                                                ,Rifle,"I have a bushmaster m17s that shoots 223/556. Comes with some mags. Upper rail modification with UTI 3X optic scope. Still have the original handle for it. Looking to trade for some handguns such as GLOCK, SIG, S&W, RUGER, XD, etc. $1100 text me offers at REDACTED"
518,http://www.armslist.com/posts/4138518,For Sale:  Glock 19 Gen 4,"Wilmington, Wilmington, North Carolina",$ 575,"Listed On: Monday, March 30, 2015",Handguns,Glock                                                                                ,9mm Luger (9x19)                                                                                ,Semi-automatic                                                                                ,Pistol,"Up for sale is a Glock 19 Gen 4 with tru glo tritium night sights.

You will get the glock, case, paperwork, and three magazines.

I have kept my glock cleaned with frog lube since i've owned it.  

I have additional magazines if you would like to buy them as well.

You must have a pistol purchase permit or a valid CCW."
519,http://www.armslist.com/posts/4138519,For Sale:  Set of kevlar panels  $60 for both,"Waukesha/Milwaukee, Milwaukee, Wisconsin",$ 60,"Listed On: Saturday, March 14, 2015",Tactical,Glock                                                                                ,9mm Luger (9x19)                                                                                ,Semi-automatic                                                                                ,Pistol,"Used panels but work great for any plate carrier or vest stops anything from .380 to 44 mag
Text or call two6two 3five2-5nine8five"
520,http://www.armslist.com/posts/4138520,For Sale/Trade:  Rossi 357 R-46301,"Lexington-RedBank, Columbia, South Carolina",$ 350,"Listed On: Wednesday, March 25, 2015",Handguns,Rossi-Braztech                                                                                ,357 Magnum                                                                                ,Double / Single Action                                                                                ,Revolver,"Good shooting well maintained revolver, very little wear 3 inch barrel, what you see is what you get here, it was made by Taurus. I saw this weapon for $ 459.00 last week new But I am not selling new. This is a nice revolver very reliable with good grouping, The finish is very good no damage I have found."
521,http://www.armslist.com/posts/4138521,For Sale/Trade:  bushmaster ar-15,"seattle/greenwood, Seattle, Washington",$ 800,"Listed On: Thursday, March 19, 2015",Rifles,Bushmaster                                                                                ,223/5.56 NATO                                                                                ,Semi-automatic                                                                                ,Rifle,"bushmaster ar-15 has front and rear flip down sights yhm  magpul rear stock hogue grip
utg front rail and covers 100 rounds down range call REDACTED"
523,http://www.armslist.com/posts/4138523,For Sale:  Springfield Stainless Loaded 1911-A1 9MM Single Stack,"Holland, Grand Rapids, Michigan","$ 1,000","Listed On: Saturday, March 28, 2015",Handguns,Springfield                                                                                ,9mm Luger (9x19)                                                                                ,Single Action                                                                                ,Pistol,"I have a very good condition Springfield 1911-A1 9MM single stack pistol for sale. I’m a professional armorer and certified by Colt Defense on the 1911 platform. I can assure you this pistol has well maintained and is in perfect working condition. I originally purchased it for my wife when she was actively shooting, but since having had our first child her recreational shooting habits (read time) have decreased significantly.

A significant number of parts have been upgraded on this pistol to further increase it’s shooting performance, including the:
Hammer (Wilson Combat)
Sear (Wilson Combat)
Extractor (Wilson Combat) Original Included
Firing Pin (Wilson Combat)
Magazine release (Wilson Combat, extended and drop free)
Mainspring Housing (Wilson Combat to support the magwell)
Magwell (Wilson Combat)
Disconnector (Wilson Combat)
Firing Pin Stop (Wilson Combat) Original Included
Rubber Grips (Hogue Grip) Original Wood Grips Included
The trigger was tuned to break at a crisp 3.75 lb’s, with zero overtravel and a precise/minimal reset.
We’ve had the gun for awhile, could have missed something, but to the best of my knowledge that’s it.

The gun also includes:
A very nice safariland quick-draw leather paddle holster
Bore brush cleaner
Hard sided carrying case
The above mentioned extra parts
11 magazines! (2 were included with the gun, 9 additional)

From Springfield’s Website
http://www.springfield-armory.com/products/1911-loaded-9mm/
The Loaded 9mm Stainless Steel is built on a full-size frame and slide. The pistol is made from stainless steel, which has a polished finish on the flat surfaces and bead-blasted matte finish on the rounded areas. The 5 inch barrel is match grade and made from stainless steel. The slide features slanted serrations on the front and rear. The mainspring housing is flat and includes the Springfield Armory® I.L.S.™ The pistol has a Lightweight Delta™ hammer and a beavertail grip safety, which features a raised memory pad for positive engagement. The extended ambidextrous thumb safety and long aluminum match-grade trigger are upgraded features that are standard to the Loaded Series. The rear target sight is fully adjustable for windage and elevation. The ejection port is lowered and flared, and the pistol is fitted with a two piece full length guide rod. Every Loaded model comes with a beautiful pair of cross-cannon emblazoned cocobolo grips that are held in place with Torx™ grip screws."
