,url,title,location,price,post date,category,manufacturer,caliber,action,firearm type,postcontent
0,http://www.armslist.com/posts/4138000,"For Sale:  Smith and Wesson 686-4 6""","Dalla/Fort Worth, Dallas, Texas",$ 800,"Listed On: Sunday, September 13, 2015",Handguns,Smith & Wesson                                                                                ,357 Magnum                                                                                ,Double / Single Action                                                                                ,Revolver,"$800 obo
6 inch barrel 6 shot revolver 
357 mag/ 38 spl/ 38+P
Great revolver I just don't shoot it so it's time to get rid of it.
This being a -4 it doesn't  have MIM parts or the mandatory integrated lock that new revolvers come with.  Just the revolver no box.

Trades are SW .45 plus cash
Other SW Revolvers or maybe a .308 rifle."
1,http://www.armslist.com/posts/4138001,For Sale:  Walther PPQ M2 Navy SD 9MM Suppressor Ready!,"Hueytown, Birmingham, Alabama",$ 500,"Listed On: Saturday, March 14, 2015",Handguns,Walther                                                                                ,9mm Luger (9x19)                                                                                ,Striker Fire                                                                                ,Pistol,"Walther PPQ M2 Navy SD 9MM. Suppressor ready! 4 inch threaded barrel. Comes with one 17 round extended magazine and one flush fit 15 round magazine. Adjustable 3 dot sights.
This pistol has what is regarded as the very best trigger of all the polymer pistols on the market today. Trigger pull and reset are fantastic. Very, Very Accurate.  It has only had 10 rounds fired through it and is like new. NO TRADES! CASH ONLY!

E-mail or text 2zero5four1seven5six7zero"
2,http://www.armslist.com/posts/4138002,For Sale:  Cleaning out Closet,"brighton, Denver, Colorado",$ 1,"Listed On: Thursday, March 19, 2015",Rifles,Walther                                                                                ,9mm Luger (9x19)                                                                                ,Striker Fire                                                                                ,Pistol,"For Sale:
BNIB: Scar 17 FDE $2800.00
BNIB: Daniel Defense DDM4 V1 Heavy Barrel  $1400.00
BNIB: Springfield Socom 16 Black $1550.00
BNIB: H&K P30-V3 DA/SA 9mm 2- magazines $1000.00
BNIB: Glock 19 Gen 3 with 2 magazines $550.00

All above guns are brand new in box never fired. Still have all the factory box's and paperwork. Can email pictures if requested.Some what flexible on price."
3,http://www.armslist.com/posts/4138003,For Sale:  Winchester 3030 Pre Safety Mint Condition!,"Muscle Shoals, Muscle Shoals Area, Alabama",$ 425,"Listed On: Wednesday, April 1, 2015",Rifles,Winchester                                                                                ,30-30 Winchester                                                                                ,Lever Action                                                                                ,Rifle,I have for sale a Winchester 3030 pre safety in mint condition. If ever fired it was not more than a few shells. Asking $425. Call REDACTED. Thanks!
4,http://www.armslist.com/posts/4138004,"For Sale:  Various Rifle Parts, AR & Sig 556. Prices in Ad Text","Fridley & Burnsville, Minneapolis / St. Paul, Minnesota",FREE,"Listed On: Thursday, March 26, 2015",Gun,Winchester                                                                                ,30-30 Winchester                                                                                ,Lever Action                                                                                ,Rifle,"KS01-1: Sig Sauer 556 Buttstock, Take off.  $125.00
KS01-2: M4 Type Buttstock, Take off  $20.00
KS01-3: MagPul MOE Handguards, Like new, no package.  Have a couple sets.  Carbine length  $20.00ea
KS01-4: Manticore Arms POST 556 Charging handle, used.  $45
KS01-5: AR-15A2 Pistol Grip, Take off.  $5.00
KS01-6: Midwest Industries Folding Front Sight, Gas Block Height, Used.  $60.00
KS01-7: Troy Industries Folding Front Sight, Rail Height, HK Type.  $70.00
KS01-8: AR-Carbine Handguard set, takeoff.  Have a few sets.  $10.00 ea
KS01-9: AR-Midlength handguard set, takeoff.  $10.00

*************************************

Questions? Shoot me a message.  Cash/Trade FTF in Fridley or Burnsville.

Be sure to check my other listings as I am clearing out a bunch of interesting things lately.  I can ship at additional cost, so please feel free to send me a message should you be interested and we'll work out the details. 

I will need to see your MN ID and PTC/PTP regardless of firearm type and I have no issue with providing a written bill of sale should one be requested. 

Armslist is a unique marketplace that I find useful to buy, sell, and trade items from my years of collecting, shooting, and hunting.  If you find my item or price or listing not to your tastes, I respectfully ask you to kindly disregard it.  Life is far too short to sweat the small stuff.

Cheers,
K03"
6,http://www.armslist.com/posts/4138006,For Sale:  Glock 31 (357sig),"Murfreesboro, Nashville, Tennessee",$ 600,"Listed On: Saturday, March 14, 2015",Handguns,Glock                                                                                ,357 SIG                                                                                ,Striker Fire                                                                                ,Pistol,"Custom framework on this glock, makes for a nice comfortable and stable grip. 
Has fully stippled frame, removed finger grooves, trigger undercut with an index finger cut, also has magwell cut to get some grip on the mag in case of any malfunctions. Gun is a gen 4 with less than 200 rounds fired through. 
Will come with 3 mags loaded with hollow points and a kydex holster designed for the gun with a tlr1 light but will hold the gun without the light as well. May include light for another 80. 
Price is firm. 
Text preferred 6one5-nine95-one582"
7,http://www.armslist.com/posts/4138007,For Sale/Trade:  HK USP Expert 40sw 4x 16rd mags Seattle,"Seattle, Tri-Cities, Washington","$ 1,100","Listed On: Monday, April 20, 2015",Handguns,Heckler & Koch                                                                                ,40 S&W                                                                                ,Double / Single Action                                                                                ,Pistol,"Used HK USP Expert in .40sw
    Includes: jet funnel kit, 4x 16rd mags, hk case, manual, lock, sight adjust tool, 2 extra O-rings, original grip insert and 2x13rd, 1x 10rd mags (if you want to remove the jet funnel). Has light scratches to the finish on right side of frame. Function and bore are excellent. $1100obo I Will be in Seattle Area this Friday-Sun 4/24-4/26
          Message me if you would like more pics.
                                                   Thanks for looking"
9,http://www.armslist.com/posts/4138009,For Sale:  Intertec Tec9 mm,"Straw Plains, Knoxville, Tennessee",$ 600,"Listed On: Saturday, March 14, 2015",Handguns,Intratec,no type,no type,no type,Intertec Tec9 mm excellent condition. Comes with case and 3 60 round clips. Also has threaded barrel. $600
10,http://www.armslist.com/posts/4138010,For Sale:  S&W AR-15 w/extras,"Latrobe, Pittsburgh, Pennsylvania",$ 700,"Listed On: Monday, April 13, 2015",Rifles,Smith & Wesson                                                                                ,223/5.56 NATO                                                                                ,Semi-automatic                                                                                ,Rifle,"Like new only 200 rounds through it. New gas block with rail on top, 3-9 scope, sling adapter, magpul forend with rails, vertical grip, one magpul mag, and 100 rounds of XM193

Also throwing in a softcase

I need this gone so make me an offer 7two46one00eighteight3"
11,http://www.armslist.com/posts/4138011,For Sale:  1955-1960s Savage model 99 300 savage,"Worcester county, Massachusetts, United States","$ 1,200","Listed On: Saturday, March 14, 2015",Antique,Smith & Wesson                                                                                ,223/5.56 NATO                                                                                ,Semi-automatic                                                                                ,Rifle,I have a Savage model 99 chambered for 300 Savage. The gun is in very nice working condition with one small wear area on the bottom of the butt stock. will send pictures upon request. email with phone number if interested. 1200 obro.
12,http://www.armslist.com/posts/4138012,For Sale:  Lorcin 380,"Greenville, Greenville, North Carolina",$ 180,"Listed On: Saturday, March 14, 2015",Handguns,Smith & Wesson                                                                                ,380 ACP                                                                                ,Semi-automatic                                                                                ,Pistol,Nice 380 semi auto box all paper work holster lock 2 mags lorcin is the brand shoots good  in good shape REDACTED
14,http://www.armslist.com/posts/4138014,For Sale:  sig emporer scorpion,"hamilton, Dayton, Ohio",$ 900,"Listed On: Saturday, March 14, 2015",Handguns,Sig Sauer                                                                                ,45 ACP                                                                                ,Single Action                                                                                ,Pistol,New sig emperor scorpion 1911 900
15,http://www.armslist.com/posts/4138015,For Sale/Trade:  100 year anniversary kahr 1911 45,"Aurora, Cleveland, Ohio",$ 650,"Listed On: Saturday, March 14, 2015",Handguns,Kahr                                                                                ,45 ACP                                                                                ,Single Action                                                                                ,Pistol,For sale or trade to Ohio residents 21 and over is a nice hard to find auto ordnance by kahr arms 100 anniversary 1911-2011. Gun was never fired and in mint condition
17,http://www.armslist.com/posts/4138017,For Sale/Trade:  Savage 308,"Toms River, New Jersey, United States",$ 675,"Listed On: Saturday, March 14, 2015",Rifles,Savage Arms                                                                                ,308/7.62 NATO                                                                                ,Bolt Action                                                                                ,Rifle,Like new Savage 11 FCXP 308 22 inch barrel with a Accurate-Mag bottom metal kit with a 10 round mag  & UTG bibod & 3x9x40 scope . With 50 rounds fired through it
18,http://www.armslist.com/posts/4138018,Want To Buy:  Chinese t53 or mosin nagant,"Medford, Medford, Oregon",Offer,"Listed On: Friday, March 20, 2015",Rifles,Savage Arms                                                                                ,7.62x54R                                                                                ,Bolt Action,Rifle,"Hi, I'm looking for a Chinese t53 carbine (type 44 clone)or any type of mosin nagant. Text me a photo of what you have and how much you want for it. Thanks REDACTED"
20,http://www.armslist.com/posts/4138020,"For Sale:  1,000 rounds of 22LR (Remington Thunderbolt)","Viena, Northern Virginia, Virginia",$ 90,"Listed On: Monday, April 6, 2015",Ammo,no type,no type,no type,no type,"1,000 rounds of 22LR. Remington Thunderbolt. Lubricated round nose bullets. Great ammo for bolt actions and semi-autos."
22,http://www.armslist.com/posts/4138022,For Sale:  Turkish 8MM Mauser 98 Bolt Action Rifle #02849,"Waterford, Detroit, Michigan",$ 240,"Listed On: Tuesday, July 5, 2016",Rifles,no type,8mm Mauser                                                                                ,Bolt Action                                                                                ,Rifle,"Up for sale we have this Turkish 8MM Mauser 98 bolt action rifle. The rifle is in used condition with some scratches, dings and a few cracks. The cracks I have shown in the photos. The bore is pretty dark but the rifling is in good shape."
23,http://www.armslist.com/posts/4138023,"For Sale:  FNX Two tone Stainless Best Offer w premium ammo, holster & more like new from FN","Northeast, Columbus, Ohio",$ 499,"Listed On: Saturday, March 14, 2015",Handguns,FN Herstal S.A.                                                                                ,40 S&W                                                                                ,Double / Single Action                                                                                ,Pistol,"FNX Two tone Stainless Best Offer w premium ammo, holster & more like new from FN

FNX, Bought local shop new 2 years ago. Bi-tone Stainless .40 S&W 3 14 capacity magazines, all factory accessories including interchangeable back straps, case and owners manual, Like new flawless cosmetically, fired proximately 150 rounds. Comes with quality leather holster, 1 box of federal ball target and a 50/50 mixed box of HST and Zombie max cartridges. This is a fantastic all around handgun and would work great as a range, CCW and Home defense firearm. No trades, cash. Local shop has it new for $698 for just the pistol, please feel free to make any serious offer."
24,http://www.armslist.com/posts/4138024,For Sale:  Brand new ammo 9mm brass case & pmc .223 brass case ammo,"Olympia, Washington, United States",$ 110,"Listed On: Saturday, March 14, 2015",Ammo,FN Herstal S.A.                                                                                ,40 S&W                                                                                ,Double / Single Action                                                                                ,Pistol,Brand new 500 rounds of 9mm brass cased ammo for $110 & I also have 340 rounds of pmc .223 brass case ammo for $120 or I'll sell you all the ammo for $210 that is a great deal for you!!!! Thanks for looking
25,http://www.armslist.com/posts/4138025,For Trade:  Savage 220F 20 Gauge,"Brier Creek, Raleigh / Durham / CH, North Carolina",Offer,"Listed On: Saturday, March 14, 2015",Shotguns,Savage Arms                                                                                ,20 Gauge                                                                                ,Bolt Action                                                                                ,Shotgun,"20 Gauge Rifled Barrel Slug Shotgun (Never fired)
Bushnell scope
4 boxes of ammo
Sling
Rifle case
REDACTED"
27,http://www.armslist.com/posts/4138027,For Sale:  $2500.00,"North of Tulsa 20 miles, Tulsa, Oklahoma","$ 2,500","Listed On: Saturday, March 14, 2015",Handguns,Ruger                                                                                ,44 Magnum                                                                                ,Double Action                                                                                ,Revolver,"Have a NIB Ruger Blackhawk 44 Mag.  This is a beautiful gun with gold plating and beautiful engraving done by Legacy Firearms.  This is No. 23 of only 100 made in this series which is a tribute to Charleston, WV.  Engraving on barrel, both sides, as well as cylinder with beautiful grips.  On one side a tribute to Daniel Boone & the otherside a tribute to the WV coal mines. This gun is fully operable if one wished to shoot it.  Asking $2500.00 cash or would be interested in trade for high end semi-auto pistol and cash.  Can be reached at: REDACTED or by E-Mail.  No text please."
28,http://www.armslist.com/posts/4138028,For Sale:  baby desert eagle 2 .40 semi compact polymer,"kansas city south, Kansas City, Missouri",$ 500,"Listed On: Sunday, March 15, 2015",Handguns,Israel Weapon Industries                                                                                ,40 S&W                                                                                ,Double Action                                                                                ,Pistol,Iwi baby desert eagle 2 .40 caliber polymer semi compact pistol. Fired one mag thru it. Excellent condition. Made in Israel h2 on frame. Paid $550 plus tax. Asking $500 firm or may trade. Let me know what u have. Email or txt REDACTED
29,http://www.armslist.com/posts/4138029,For Sale:  London Bridge Trading Tactical Bags,"Oviedo, Orlando, Florida",$ 200,"Listed On: Saturday, March 14, 2015",Tactical,Israel Weapon Industries                                                                                ,40 S&W                                                                                ,Double Action                                                                                ,Pistol,"Two different bags from London Bridge Trading.  Will sell as a set or separately.  Bags are brand new, never been used.   Excellent packs from a very high quality company.  Please check online sources to see that this is a great deal for these bags.

Must meet in Oviedo.

Three Day Assault Pack, LBT-1476A, Multi-Cam, $90
Medium Three Wheeled Load-Out Bag, LBT-2466D, Multi-Cam, $200


Details for the Assault Pack:
Mid-sized patrol pack, capable of carrying three plus days worth of gear, MRE’s, cleaning utilities etc.
Adjustable padded shoulder straps
Front accessory pocket
Back padding provided by 3/8” closed cell inner core
Removable waist strap, used for equalizing the load across the combatants hips
Interior pocket for hydration pouch or internal frame for structural rigidity (frame and pouch not included)
Modular attachment points on the front of pack, compatible with all U.S. Military MOLLE components
Heavy duty reinforced carry handle
Two adjustable cinch straps on each side pack
Overall dimensions approx: 14” L x 8” W x 20” H
Weight: 2.5 lbs

Details for the Medium Three Wheeled Load-Out Bag
Overall dimensions: 30L x 20W x 13H
Volume: 7,920 cubic inches
Wheels at base of bag facilitate transport
Reinforced kydex bottom offers additional strength and durability
Internal compression straps secure contents
Document window on face of bag measures 12 x 9
Additional document windows on each end measure 8.5 x 5
Interior features 6 mesh pockets
External pocket extends the length of bag; measurements: 28L x 2W x 12H
Two smaller external pockets on opposite side; measurements: 13L x 2W x 12H
Weight: 13 lbs
1000 denier Dupont Cordura
MIL-SPEC nylon webbing
Type E Thread (VT 295 nylon, bonded), double stitched and bar-tacked at stress points"
32,http://www.armslist.com/posts/4138032,For Sale:  1911 Springfield .45,"burien, Seattle, Washington",$ 850,"Listed On: Saturday, March 14, 2015",Handguns,no type,45 ACP                                                                                ,Single Action                                                                                ,Pistol,"Hello, I have a spring field .45 1911 for sale. Only put 50 rounds in it. Paid $1,300 at champion arms in kent,WA.

Asking $850 firm. NO TRADES AND WILL NOT SHIP

Please have ID and permit when meeting.

Please contact Ray for any questions.

REDACTED"
33,http://www.armslist.com/posts/4138033,For Sale/Trade:  6.5 x 55 SWEDISH Mauser 140gr AMMO. All NEW Factory Ammo.,"Spokane Area, Spokane, Washington",$ 19,"Listed On: Saturday, March 14, 2015",Ammo,no type,45 ACP                                                                                ,Single Action                                                                                ,Pistol,I have several boxes of 6.5 x 55 SWEDISH ammo for sale or trade. Make me a decent cash or trade offer? It is all factory / name brand 139gr. & 140gr.
34,http://www.armslist.com/posts/4138034,For Sale/Trade:  ruger sr 1911,"vb, Hampton Roads, Virginia",$ 700,"Listed On: Monday, March 30, 2015",Handguns,Ruger                                                                                ,45 ACP                                                                                ,Single Action                                                                                ,Pistol,don't need to get rid of just seeing what is out there it has a soft case and 2 mags
35,http://www.armslist.com/posts/4138035,For Sale:  o,"okolona/hillview, Louisville, Kentucky",$ 25,"Listed On: Saturday, March 14, 2015",Rifles,Ruger                                                                                ,45 ACP                                                                                ,Single Action                                                                                ,Pistol,O
36,http://www.armslist.com/posts/4138036,For Trade:  Stevens 320 - 12 GA Shotgun / Walters PK 380,"Downtown, Indianapolis, Indiana",Offer,"Listed On: Friday, March 20, 2015",Shotguns,Savage Arms                                                                                ,12 Gauge                                                                                ,Pump Action                                                                                ,Shotgun,"I have a almost new Stevens model 320 - 6 Shot shotgun 2 3/4 & 3"" shells , shell holder and case and a good condition S &W Walthers pk 380 8 round capacity , trigger guard has been repaired performance is not effected at all. Never would know if I didn't tell you.  Text REDACTED"
37,http://www.armslist.com/posts/4138037,For Sale/Trade:  S&W M&P .40 VTac,"Lorain County / 44035, Cleveland, Ohio",$ 0,"Listed On: Saturday, March 14, 2015",Handguns,Smith & Wesson                                                                                ,40 S&W                                                                                ,Striker Fire                                                                                ,Pistol,"FS/FT: M&P .40 VTAC FDE
Comes with 2 mags, case, paperwork & HIRes Fiber optic fr&rr sites.
$590 OBO, no long guns, shotguns or revolvers.

All Federal & Local laws apply, 21+ with valid OH DL/CCW preferred.
text or call REDACTED / meet locally."
38,http://www.armslist.com/posts/4138038,For Sale:   MAGPUL PMAG 25rd GEN 3 Window LR SR M3 7.62x51 308 Magazine MAG292-BLK,"Lincoln, Lincoln, Nebraska",$ 19,"Listed On: Sunday, January 17, 2016",Magazines,Smith & Wesson                                                                                ,40 S&W                                                                                ,Striker Fire                                                                                ,Pistol,"Optimized for use with SAAMI specifications 7.62x51 .308 Winchester ammunitionCommercial rifle compatibility includes the new Armalite AR-10A, Bushmaster .308 ORC, Colt LE901-16S, CORE Rifle Systems CORE30, DPMS, LR308, JP Enterprises LRP-07, KAC SR25, LaRue OBR, Les Baer .308, LMT .308 MWS, LWRCI REPR, Mega Arms MATEN, POF P-308, Remington R-25, Ruger SR-762, S&W M&P10, SIG716, and others NOTE: NOT compatible with Armalite AR-10B, Noveske N6, Springfield Armory M1A, Rock River Arms LAR8, FN SCAR 17S, PTR-91, HK417 or any other rifles that utilize M14, FN FAL, or HK 91/G3 patterned magazinesNext-generation impact and crush resistant polymer constructionConstant-curve internal geometry for smooth feedingAnti-tilt, self-lubricating follower for increased reliabilityHigh-quality stainless steel spring, black-oxide coated MIL-DTL-13924DAnti-glare translucent Mag Level windows on both sides of the body along with a painted indicator on the spring allows for easy determination of rounds remaining from 1 to 25Ribbed gripping surface and new aggressive front and rear texture for positive magazine handlingPaint pen dot matrix panels on the bottom of the body to allow for identification markingFlared floor plate aids magazine handling and disassemble yet is slim enough for use with many pouchesMulti use Impact Dust Cover minimizes debris intrusion and protects cartridges from potential damage during storage and transitLink to the 25rd 308 window pmag at deguns.net"
39,http://www.armslist.com/posts/4138039,For Sale:  Kimber Ultra Carry TLE II  45ACP Night Sights and Crimson Trace Laser Grips,"Canton, Akron, Ohio","$ 1,150","Listed On: Saturday, March 14, 2015",Handguns,Kimber                                                                                ,45 ACP                                                                                ,Striker Fire                                                                                ,Pistol,"Practically new, only fired one magazine through it. Was too much for the wife so we are now selling. Will include a used once galco leather holster ($120 Value). 

Here is a link to the gun on Kimber's site: MSRP $1518
http://www.kimberamerica.com/1911/ultra-carry-ii/stainless-ultra-tle-ii-lg"
