,url,title,location,price,post date,category,manufacturer,caliber,action,firearm type,postcontent
727,http://www.armslist.com/posts/4102727,For Sale:  Remington Model 1100 12 Gauge,"Eureka or Perryville, St. Louis, Missouri",$ 475,"Listed On: Thursday, March 12, 2015",Shotguns,Remington                                                                                ,12 Gauge                                                                                ,Semi-automatic                                                                                ,Shotgun,"This gun is in excellent shape.  It has a 30 inch full choke, vent ribbed barrel.  It shoots  2 3/4 inch shells only.  The wood is in great shape as is the blueing.  More pictures are available upon request.  Local sales are preferred.  No trades please.  Email, text or call REDACTED."
728,http://www.armslist.com/posts/4102728,For Sale:  REMINGTON 700 SPS AAC .308 TACTICAL FIRED 2/3 TIMES LIKE NEW**,"Jacksonville, Jacksonville, Florida",$ 600,"Listed On: Wednesday, March 4, 2015",Rifles,Remington                                                                                ,308/7.62 NATO                                                                                ,Bolt Action                                                                                ,Rifle,"I purchased this gun a little over a year ago. Work has got me very busy I have only fired it 2 or 3 rounds... bought a burris fullfield 2 (350+) for it and never had time to shoot it... Text me for more pics. Scope not included. Will sell with a very nice 20 MOA rail. 

There is pretty much no wear visible on this gun... it is brand new... This gun is top notch, very hard to beat and solid.

Selling for a lot less than it should in the shape its in. (perfect)

KEY FEATURES:

308 Win 20"" Heavy Competition barrel with Threaded Muzzle
Shipped with Thread Protector Installed
Accepts AAC® and other 5/8-24 Threaded Flash Hiders, Muzzle Brake and Suppressors
1 in 10” Rate of Twist for increased bullet stability 
Hogue® Overmolded Ghillie Green™ Pillar Bedded Stock
X-Mark Pro® Externally Adjustable Trigger factory set 3 ½ Pounds

REDACTED"
729,http://www.armslist.com/posts/4102729,For Sale:  Glock 30sf,"North of dayton, Dayton, Ohio",$ 450,"Listed On: Wednesday, March 4, 2015",Handguns,Glock                                                                                ,45 ACP                                                                                ,Striker Fire                                                                                ,Pistol,Used but well cared for Glock 30sf. 45acp. Two magazines and original case. standard sights. Ohio chl preferred and Bill of sale. $450
730,http://www.armslist.com/posts/4102730,For Sale/Trade:  Remington 870 Wingmaster Magnum 12g LC,"Huntersville, Charlotte, North Carolina",$ 450,"Listed On: Monday, March 16, 2015",Shotguns,Remington                                                                                ,12 Gauge                                                                                ,Pump Action                                                                                ,Shotgun,"I am the original owner of this gun...it has been in my possession for over 20 years.  Very clean, no rust, bluing is as new with only a few minor handling marks on the furniture.  It has a 26"" barrel with all supplied factory chokes and wrench.  Also, this is the light contour model which has a slimmer receiver and different barrel than the standard Wingmaster.  Finally, I installed a different bead sight one hunting season many years ago.  I kept the original factory bead, but I was unsuccessful in my attempt to remove the aftermarket one.  Maybe you'll have better luck than me.

They don't make them like this anymore."
731,http://www.armslist.com/posts/4102731,For Sale/Trade:  600.00,"Jefferson and 44, St. Louis, Missouri",$ 600,"Listed On: Wednesday, March 4, 2015",Handguns,Kel-Tec                                                                                ,22 WMR                                                                                ,Single Action                                                                                ,Pistol,"Like new (only 90 rounds put through it) Kel-Tec PMR-30 in tungsten finish. Comes with two 30 round magazines, owners manual, break down tool, hard case, and 60 rounds of .22 WMR. (50 Spear golddot personal defense hollow points, 10 CCI Maxi-Mag hollow points).

Highlights include: light weight polymer construction, ambidextrous safety and mag release, fiber optic sights (front and back), adjustable front sight, and 30 round flush with handle ammo capacity. there is no other pistol that can put as much lead down range right out of the box. Thin profile, and low recoil makes for a good conceal/carry for recoil sensitive."
732,http://www.armslist.com/posts/4102732,For Sale/Trade:  22 LR ammo,"LaPine, Bend, Oregon",$ 5,"Listed On: Friday, March 13, 2015",Ammo,Kel-Tec                                                                                ,22 WMR                                                                                ,Single Action                                                                                ,Pistol,"About 2000 rounds left of .22 lr ammo price is $5 per 50 
Federal spitfire
Remington thunderbolt
Remington Mohawk
Remington hi-speed
Winchester wildcats"
733,http://www.armslist.com/posts/4102733,For Sale:  Springfield XD9 Tactical 5 Inch 9mm,"Harrisburg/UNCC, Charlotte, North Carolina",$ 425,"Listed On: Wednesday, March 4, 2015",Handguns,Springfield                                                                                ,9mm Luger (9x19)                                                                                ,Striker Fire                                                                                ,Pistol,"Springfield XD9 Tactical 5 Inch 9mm for sale.  Three 16 round Magazines, case, XD gear package, paddle holster.  Night sights still bright around 75%.  Additional pictures on request.  

Price is OBO
No trades or shipping please.
Please have a permit."
734,http://www.armslist.com/posts/4102734,"For Sale/Trade:  warren tactical sights for glock 34, 35, 17L","Blaine or Saint Louis Park, Minneapolis / St. Paul, Minnesota",$ 75,"Listed On: Wednesday, March 4, 2015",Gun,Springfield                                                                                ,9mm Luger (9x19)                                                                                ,Striker Fire                                                                                ,Pistol,I bought these for my competition glock 34 and they just arent for me. I installed them shot a couple hundred rounds and pulled them back off.
735,http://www.armslist.com/posts/4102735,For Sale:  Meopta Meopro 4-12x50 rifle scope with #4 reticle - Excellent,"Tampa Stadium, Tampa/St. Pete, Florida",$ 550,"Listed On: Wednesday, March 4, 2015",Optics,Springfield                                                                                ,9mm Luger (9x19)                                                                                ,Striker Fire                                                                                ,Pistol,"Meopta Meopro 4-12x50 rifle scope with #4 reticle. Excellent rifle scope with box, paperwork, and lens covers. $550"
737,http://www.armslist.com/posts/4102737,For Sale:  Remington 700 30-06,"Santa Fe, Albuquerque, New Mexico",$ 550,"Listed On: Wednesday, March 4, 2015",Rifles,Remington                                                                                ,30-06 Springfield                                                                                ,Bolt Action                                                                                ,Rifle,"Remington 700 in 30-06 lightly used and well taken care of. This was my hunting rifle but I've upgraded my caliber so I no longer need this rifle. I'm asking $550.00 and it comes with bases, rings, BSA scope, hunting rounds, and some FMJ rounds but I'm not to sure how many, maybe 100 or so.

Call or text with questions 505-699-o276

Jesse"
738,http://www.armslist.com/posts/4102738,For Sale:  Sig Saur P238 Like New,"Scenic Hwy, Pensacola, Florida",$ 650,"Listed On: Wednesday, March 4, 2015",Handguns,Sig Sauer                                                                                ,380 ACP                                                                                ,Bolt Action                                                                                ,Pistol,For Sale- Sig Saur P238 Like new 100 rounds thru.  Regular clip and two xtended pinky magazines.  Also about 300 target rounds.  Gun just a bit to much for the wife.  Text REDACTED
739,http://www.armslist.com/posts/4102739,"For Sale:  CZ75 KADET II 22LR CONVERSION KIT  ""NEW""","Pennsylvania, North Central, PA, Pennsylvania",$ 490,"Listed On: Wednesday, March 4, 2015",Gun,Sig Sauer                                                                                ,380 ACP                                                                                ,Bolt Action                                                                                ,Pistol,"BRAND NEW CZ75 KADET II CONVERSION KIT 

Drop on cz conversion kit , comes with two ten shot  magazines ! 

We ship nation wide! 

Free shipping to lower 48 

We accept PayPal or usps money orders , please allow 5 to 10 business days excluding weekends and holidays or conditions out of out control ( weather) for processing and shipping , order usually arrive earlier that stated on our shipping policy but order could take between 5 to 10 business days to arrive. 

Email with questions 

We carry many 22lr conversion kits for various type / models of handguns incuding glock pistols !"
740,http://www.armslist.com/posts/4102740,For Trade:  Ruger stainless SR1911 commander,"Cincinnati, Cincinnati, Ohio",Offer,"Listed On: Wednesday, March 4, 2015",Handguns,Ruger                                                                                ,45 ACP                                                                                ,Single Action                                                                                ,Pistol,LNIB Stainless Steel SR1911 Commander. Everything from Ruger factory plus a Wilson magazine.
741,http://www.armslist.com/posts/4102741,For Sale:  Double Star M-AR15 HB SS Rifle,"Goodlettsville,Nashville, Nashville, Tennessee","$ 1,000","Listed On: Tuesday, April 21, 2015",Rifles,Doublestar                                                                                ,223/5.56 NATO                                                                                ,Semi-automatic                                                                                ,Rifle,"Double Star  M-AR15 Heavy Flued Stainless Steel 24"" barrel with Tasco 4-16x40 stain finish scope with 2 mags."
742,http://www.armslist.com/posts/4102742,For Trade:  Fox Fur coat for Revolver!!,"northeast, San Antonio, Texas",Offer,"Listed On: Wednesday, March 4, 2015",Handguns,Uberti                                                                                ,357 Magnum                                                                                ,Single Action                                                                                ,Revolver,"I'm looking to trade a Lady's Large Feller's Fox fur coat for a Revolver!!! Looking for 357/44 mag either S&W or Taurus with an 8""barrel. text 210-4two5-5one66"
743,http://www.armslist.com/posts/4102743,For Trade:  Custom Ruger GP100 with scope,"Cape Coral, South West Florida, Florida",Offer,"Listed On: Wednesday, March 4, 2015",Handguns,Ruger                                                                                ,357 Magnum                                                                                ,Double / Single Action                                                                                ,Revolver,"This is a truly one of a kind gun that is an absolute blast to shoot. Highly Customized! Long range handgun shooting. Coolest look out there. .357 Mag
Comes with a box and a half of bullets.

~ Never shoot a large caliber man with a small caliber bullet!"
744,http://www.armslist.com/posts/4102744,For Sale:  RCBS Carbide Die Set (45 ACP),"Central, Springfield, Missouri",$ 50,"Listed On: Thursday, March 19, 2015",Reloading,Ruger                                                                                ,357 Magnum                                                                                ,Double / Single Action                                                                                ,Revolver,"I have a brand new in box Carbie die set for 45 ACP
$50"
746,http://www.armslist.com/posts/4102746,For Sale:  M&P Shield 9mm,"Central, Tucson, Arizona",$ 375,"Listed On: Wednesday, March 4, 2015",Handguns,Smith & Wesson                                                                                ,9mm Luger (9x19)                                                                                ,Striker Fire                                                                                ,Pistol,NIB. Comes with everything you would expect if buying a Shield 9mm. Thumb safety version. Bring drivers license to sign bill of sale.
747,http://www.armslist.com/posts/4102747,For Sale:  Sub 200 in 40 cal with Glock Mags,"North Suburbs, Chicago, Illinois",$ 550,"Listed On: Wednesday, March 4, 2015",Rifles,Kel-Tec                                                                                ,9mm Luger (9x19)                                                                                ,Semi-automatic,Pistol,"I have for sale a Sub 2000 in 40 Caliber with Glock mags.
Have 1 10 round mag
        1 15 round Mag
        2 29 round mags
This it the Silver and black. Shoots great."
748,http://www.armslist.com/posts/4102748,"For Sale/Trade:  Walther PPQ 9MM M2 5""","Denver, Brighton, Denver, Colorado",$ 525,"Listed On: Wednesday, March 4, 2015",Handguns,Walther                                                                                ,9mm Luger (9x19)                                                                                ,Striker Fire                                                                                ,Pistol,"For sale is my Walther PPQ M2 5"" in 9mm
I swapped the upper 5"" slide and ran it on my paddle M1 lower in some USPSA matches last season. Ran like a champ. Going to be moving to Limited this season, so no need for the 5"".

Has approx 1,200 rounds down range and has a little ware on the front of the slide from holstering it in the competition holster.  I added a red fiber optic front sight.  
The M2 lower has never been used, as neither of the 2 15round magazines.
If you would like to see other pictures, just ask away.
Shipping will be at the cost of the buyer.
I can take Cash, Personal Check (will wait till funds clear) or discreet PayPal.
Either PP gift or buyer covers the 4% fee. 

From Walther website:
The PPQ M2 is a true breakthrough in ergonomics for self-defense handguns. The sculpted grip meshes smoothly into the hand. The trigger is the finest ever on a polymer, striker-fired handgun. The styling is elegant and trim. What’s more, PPQ M2 has been updated for 2013 with a new traditional reversible mag release button. The leading edge just took another step forward."
749,http://www.armslist.com/posts/4102749,For Sale:  Federal XM855 factory packed green tip,"Henderson, Las Vegas, Nevada",FREE,"Listed On: Wednesday, March 4, 2015",Ammo,Walther                                                                                ,9mm Luger (9x19)                                                                                ,Striker Fire                                                                                ,Pistol,"I have this ammo in 3 different packages.

I have 3 boxes of 150 rds each.  Each box is $110
I have 1 ammo can that contains 420rds all on stripper clips.  $310
I have 9 cases that each contain 4 of the 150rd boxes.  $420/case

If you only want 1 box then you will have to come to me.  Larger orders we will find a mutual place to meet that works for both of us."
751,http://www.armslist.com/posts/4102751,For Sale/Trade:   kahr p380......,"bloomington/spencer/terrehaute, Bloomington, Indiana",$ 450,"Listed On: Wednesday, March 4, 2015",Handguns,Kahr                                                                                ,380 ACP                                                                                ,no type,Pistol,"kahr p380 original box w paperwork.....$450
cash trade let me know be in bloomington within this week
321 four four three 280 four"
752,http://www.armslist.com/posts/4102752,Want To Buy:  looking for a Glock 22 gen 3 or 4 .40 cal.,"Clayton, Raleigh / Durham / CH, North Carolina",Offer,"Listed On: Wednesday, March 4, 2015",Handguns,Glock                                                                                ,380 ACP                                                                                ,no type,Pistol,Im looking for a Glock 22 gen 3 or 4. 40 cal. I have permit in hand i can pay 450.00 in cash. Must have 1 clip at least.
753,http://www.armslist.com/posts/4102753,"For Sale/Trade:  20"" AR","Oak Harbor, Mount Vernon, Washington",$ 8,"Listed On: Sunday, March 15, 2015",Rifles,Charles Daly                                                                                ,223/5.56 NATO                                                                                ,Semi-automatic                                                                                ,Rifle,"Charles Daly DR-15 Target Rifle Upper. 5.56/.223, 1-9 twist, 20"" Heavy barrel AR upper with rifle length OD green magpul handguard as well magpul fixed rifle stock. Lower is a Anderson MFG lower, with dpms parts kit. Less then 500rds shot. 

This is a very nice, clean and accurate 20"" AR. I have all stock A2 parts with it also (stock with lead competition weight and hand guard) 

Asking $800.

Located in oak harbor. Willing to travel to Mount Vernon."
754,http://www.armslist.com/posts/4102754,For Sale/Trade:  beretta px4 storm 40cal,"adams county, Cincinnati, Ohio",$ 400,"Listed On: Wednesday, March 4, 2015",Handguns,Beretta USA                                                                                ,223/5.56 NATO                                                                                ,Double Action                                                                                ,Revolver,"Beretta px4 storm 2 magazines, itac paddle holster, nights sights and double action only. No safety on this gun it's a law enforcement edition I've been using on duty for the past few years. Would like to sell or trade for a px4 9mm or m&p 9mm or glock 9mm. For the right gun I can give boot."
755,http://www.armslist.com/posts/4102755,"For Sale:  Ruger 10/22 Takedown Heavy Barrel, Timney Trigger, and more!","Tampa, Tampa/St. Pete, Florida",$ 450,"Listed On: Wednesday, March 4, 2015",Rifles,Ruger                                                                                ,22 Long Rifle                                                                                ,Semi-automatic                                                                                ,Rifle,"Ruger 10/22 Take Down

**Scope not included**

Heavy Stainless Green Mountain Barrel
Straight Flute, Threaded 1/2 x 28 with 0.50 length threads (for supressor)
Hogue Stock
Timney Trigger
Kidd Charging Handle and Rod
Midwest Industries Rail

**Scope not included**

Included:
Rifle
Original Ruger Bag
one BX-25 mag
one BX-10 mag

Shot CCI mini mags, CCI Standard, and Subsonic Loads with no issues. Cleaned after every use. About 200 rounds through rifle.

Selling to fund my 300Blackout project.

Pick up in Tampa only!
Cash or PayPal if you cover the fees."
756,http://www.armslist.com/posts/4102756,For Sale/Trade:  Springfield XDS 4.0,"lakewood, Washington, United States",$ 480,"Listed On: Tuesday, March 17, 2015",Handguns,Springfield                                                                                ,9mm Luger (9x19)                                                                                ,Striker Fire                                                                                ,Pistol,"I have a LNIB XDS 4.0 in 9mm. Only about 100 rnds fired through it. 

Comes with all factory gear, 3 magazine (7, 8, and 9 rounder) as well as a blade tech holster that can be worn IWB or OWB all you have to do is swap out the belt attachments. 

Feel free to email with any questions."
758,http://www.armslist.com/posts/4102758,For Sale/Trade:  Remington 700 bdl custom deluxe and 700 adl,"richmond, Richmond, Virginia",$ 0,"Listed On: Wednesday, March 4, 2015",Rifles,Remington                                                                                ,223/5.56 NATO                                                                                ,Bolt Action                                                                                ,Rifle,"two rifles NIB with hangtags etc. Both unfired. Just floating these out there to see what may come up. 700 BDL Custom is in 30-06. ADL synthetic is in .223. i like CZ rifles and handguns, rimfire pistols and rifles and colt firearms. Thanks!"
759,http://www.armslist.com/posts/4102759,Want To Buy:  Springfield Compact / Sub-Compact .45,"Bartlett, Memphis, Tennessee",$ 500,"Listed On: Wednesday, March 4, 2015",Handguns,Springfield                                                                                ,45 ACP                                                                                ,Striker Fire                                                                                ,Pistol,Interested in Springfield Compact or Sub-Compact in .45.
760,http://www.armslist.com/posts/4102760,For Sale:  Sightmark Ultra Shot Sight QD Digital Switch Red Dot Reflex Sight,"Reston, Northern Virginia, Virginia",$ 40,"Listed On: Wednesday, March 4, 2015",Optics,Springfield                                                                                ,45 ACP                                                                                ,Striker Fire                                                                                ,Pistol,"Works great, like new, batteries good, very little use. Comes with all accessories and original box and packaging."
761,http://www.armslist.com/posts/4102761,"For Sale/Trade:  JM Pro 22"" Mossberg 930 with Upgrades...","South metro, Colorado, United States",$ 800,"Listed On: Friday, March 13, 2015",Shotguns,Mossberg                                                                                ,12 Gauge                                                                                ,Semi-automatic                                                                                ,Shotgun,"This shotgun is in great shape and has all original components along with upgrades. The gun runs a rail with a bushel TRs-25 red dot. It further has a Mesa Tactical 8 shot metal sidesaddle. It also has a extra ""muzzle brake"" type choke as well. Also has the Mesa Tactical Urbino pistol grip stick with the limb saver recoil pad."
763,http://www.armslist.com/posts/4102763,For Sale:  1000+ rounds of .223 PMC 55grs FMJ-Bt,"East Wichita, Wichita, Kansas",$ 250,"Listed On: Tuesday, March 10, 2015",Ammo,no type,no type,no type,no type,"I have multiple unopened cases of PMC .223 55grs FMJ for sale.  Free delivery to Wichita and No Tax!  My loss is your gain!

1000 round case unopened - $475
500 rounds - $250

Email me at REDACTED if interested."
764,http://www.armslist.com/posts/4102764,For Sale/Trade:  black powder rev/ muzz rifle.....nib,"bloomington/spencer/terrehaute, Bloomington, Indiana",$ 650,"Listed On: Tuesday, March 10, 2015",Muzzle,Traditions Inc                                                                                ,44 Black Powder                                                                                ,no type,Muzzle Loader,"both brand new in box tags ect
traditions firearms 44cal 1851 model black powder rev.....
cva wolf stainless/black two tone 50 cal muz.....
cash offer or trade offer let me kknow
be over that way within this week
321 four four three 280four"
765,http://www.armslist.com/posts/4102765,"For Sale/Trade:  SBR Noveske 10.5""","N.Valley, Albuquerque, New Mexico",$ 400,"Listed On: Saturday, May 9, 2015",Gun,Traditions Inc                                                                                ,44 Black Powder                                                                                ,no type,Muzzle Loader,"Gently used noveske 10.5"" 1/7 twist  SS barrel, Anchor Harvey upper. 
9"" free float 
No bcg"
766,http://www.armslist.com/posts/4102766,For Sale:  Ruger LCP 380,"newark, Delaware, United States",$ 200,"Listed On: Wednesday, March 4, 2015",Handguns,Ruger                                                                                ,380 ACP                                                                                ,Double Action                                                                                ,Pistol,"Selling my ruger LCP. Pistol is in excellent condition with very little rounds through it. 

Asking $200 buyer pays transfer"
