,url,title,location,price,post date,category,manufacturer,caliber,action,firearm type,postcontent
250,http://www.armslist.com/posts/4138250,For Sale:  Rock river lar-15,"Okarche, Oklahoma City, Oklahoma","$ 1,200","Listed On: Saturday, March 14, 2015",Rifles,Rock River Arms                                                                                ,5.56×45mm NATO                                                                                ,Semi-automatic                                                                                ,Rifle,"Rock River lar-15 with 3 30rd mags,100rd drum, magpul bad lever,magpul FDE stock grip and forend ( forend is not on gun), 45 degree mount with FDE light ,fake suppressor, true glow red dot sight, Harris slm bipod and an Allen tactical case.  $1200.00 located in okarche"
251,http://www.armslist.com/posts/4138251,For Sale:  KEL-TEC  KSG 12GA.,"936 CENTRAL AVE. HORTON KS, Kansas, United States",$ 850,"Listed On: Thursday, May 21, 2015",Shotguns,Kel-Tec                                                                                ,12 Gauge                                                                                ,Pump Action                                                                                ,Shotgun,"New with minor scuff on top from showing customer. There is a picture of the scuff. 
REDACTED Will ship to your local ffl, buyer pays actual shipping costs."
252,http://www.armslist.com/posts/4138252,For Sale:  Ruger 10/22 50th Anniversary Edition for sale,"York, PA, Pennsylvania, United States",$ 250,"Listed On: Saturday, March 14, 2015",Rifles,Ruger                                                                                ,22 Long Rifle                                                                                ,Semi-automatic                                                                                ,Rifle,Ruger 10/22 50th anniversary edition for sale.  Still in box.  Never used.  Black synthetic with blued barrel.  Will throw in a box of Winchester .22 LR - 333 rounds
253,http://www.armslist.com/posts/4138253,For Sale:  Glocks  17  and  23,"justice, Raleigh / Durham / CH, North Carolina",$ 350,"Listed On: Saturday, March 14, 2015",Handguns,Glock                                                                                ,9mm Luger (9x19)                                                                                ,Double / Single Action                                                                                ,Pistol,for sale  a shipment of used glocks   17  generation 3   4 pistols are olive drab and one is black  all are 9 mm   i have one that is a long slide    and 7  23's  in 40 s&w  6 are black and one is camo     no trades    $350  each     i will not hold    30 day lay-a-way available
254,http://www.armslist.com/posts/4138254,Want To Buy:  Ruger LC9,"Pell City, Birmingham, Alabama",Offer,"Listed On: Friday, March 20, 2015",Handguns,Ruger                                                                                ,9mm Luger (9x19),Double / Single Action                                                                                ,Pistol,Looking for a Ruger LC9 with Lasermax laser.
255,http://www.armslist.com/posts/4138255,For Sale:  HK USP 45 Pistol,"Southeast, Fort Collins, Colorado",$ 699,"Listed On: Sunday, April 26, 2015",Handguns,Heckler & Koch                                                                                ,45 ACP                                                                                ,Double / Single Action                                                                                ,Pistol,"ANIB, unfired."
257,http://www.armslist.com/posts/4138257,For Trade:  Weatherby tactical 12 gauge PA 459,"Hinesville, Savannah, Georgia",Offer,"Listed On: Saturday, March 14, 2015",Shotguns,Weatherby                                                                                ,12 Gauge                                                                                ,Pump Action                                                                                ,Shotgun,Weatherby PA 12 gauge comes with red dot its nothing fancy. In good condition great home defense shotgun looking to trade it for a handgun mainly looking for anything FNH
258,http://www.armslist.com/posts/4138258,For Sale/Trade:  **40 High point**,"Indianapolis/Anderson, Indianapolis, Indiana",$ 225,"Listed On: Thursday, May 28, 2015",Handguns,Hi Point                                                                                ,40 cal                                                                                ,Single Action                                                                                ,Pistol,40 Hi point shoots well comes with  mag text me at 317702191zero NO EMAIL
259,http://www.armslist.com/posts/4138259,For Sale:  Custom 338 Lapua,"Harrisonburg, Harrisonburg, Virginia","$ 4,250","Listed On: Wednesday, March 25, 2015",Rifles,Remington                                                                                ,338 Lapua                                                                                ,Bolt Action,Pistol,"I have a new never fired 338 lapua built by Jack Keister at accurate arms. The gun is built off a new trued and blue printed Remington 700 magnum action. Below is info on gun.

700 Magnum Trued blueprinted action-lugs lapped
Pacific tool and guage billet bolt 
Sako style extractor
tactical bolt knob
Hawk hill Custom 28 inch barrel fluted
Proof research carbon lightweight tactical stock
Threaded barrel with kahntrol solutions muzzle brake(side ported)
Cerakoted desert tan and barrel flutes olive drab 
Accurate-Mag bottom metal and magazine
20 Moa rail
Gun has been Kevlar and fiberglass bedded
11 degree sniper crown

Can email or text more pictures. 

Price of build with parts was over $5600

Sell for $4250 obo. Trades considered"
260,http://www.armslist.com/posts/4138260,For Sale:  AR-15 for sale!!!! $700,"connersville, Indianapolis, Indiana",$ 700,"Listed On: Saturday, March 14, 2015",Rifles,Remington                                                                                ,338 Lapua                                                                                ,Bolt Action,Pistol,"AR-15 for sale!! Has laser light, light, flex sight. 2 thirty round cartridges and 1 fourty round cartridge. Has rail grip. Comes with over 130 rounds. Uses NATO rounds. I am open to all offers. Text or call REDACTED name is Jason."
261,http://www.armslist.com/posts/4138261,For Sale:  New Rock Island Armory (RIA)  M1911-A1 FS Tactical II,"Upper Arlington, Columbus, Ohio",$ 595,"Listed On: Saturday, March 14, 2015",Handguns,Rock Island Armory                                                                                ,9mm Luger (9x19)                                                                                ,Single Action                                                                                ,Pistol,"This is a new, in the original case Rock Island Armory 9mm, second generation. I got it from a dealer / FFL in Columbus (OH). It has never been fired.

Model: 51623

MSRP is $729 + tax. Selling for $595. 

More details are available by following this link:
http://galleryofguns.com/genie/Default.aspx?item=51623&mfg=Armscor&mdlno=Rock+Island+Armory+M1911-A1+FS+Tactical+II

Comes with all original manufacturers paperwork."
262,http://www.armslist.com/posts/4138262,For Sale:  Zeiss Conquest HD5 5-25x50 Z800 Reticle,"Southeast, Fort Collins, Colorado",$ 799,"Listed On: Saturday, May 23, 2015",Optics,Rock Island Armory                                                                                ,9mm Luger (9x19)                                                                                ,Single Action                                                                                ,Pistol,"Brand new in box, never mounted."
263,http://www.armslist.com/posts/4138263,For Trade:  Savage 110 30-06 trade for 380,"Florissant, St. Louis, Missouri",Offer,"Listed On: Saturday, March 14, 2015",Rifles,Savage Arms                                                                                ,30-06 Springfield                                                                                ,Bolt Action                                                                                ,Rifle,"Nice gun, about 30 rounds through it. Stock savage sights. One screw missing on front scope mount from recoil."
264,http://www.armslist.com/posts/4138264,For Sale:  40s&w ammo,"Point loma, San Diego, California",$ 8,"Listed On: Saturday, March 21, 2015",Ammo,Savage Arms                                                                                ,30-06 Springfield                                                                                ,Bolt Action                                                                                ,Rifle,"30 rounds total. 23 mixed 155gr hollow points and 7 155gr fmjs 
Eight dollars takes it."
265,http://www.armslist.com/posts/4138265,For Sale:  Yugo M59/66 (NEVER ISSUED) rifle.,"Triad, Greensboro, North Carolina",$ 575,"Listed On: Saturday, March 14, 2015",Rifles,Zastava                                                                                ,7.62x39                                                                                ,Semi-automatic                                                                                ,Rifle,"I have here a yugo sks that was a virgin rifle straight out of the crate, has been altered to meet 922r compliance. Tapco stock set, tapco 20 rd mag, tapco muzzle break, tapco gas piston. Was a VIRGIN rifle meaning never fired until about a month ago. Has 3 20 rd mags through it for a total of 60 rds. Can include ammo.

Price firm, but will trade for AK74."
267,http://www.armslist.com/posts/4138267,For Sale:  AR-15 Carbine w/Magpul FDE Furniture,"West, Knoxville, Tennessee",$ 775,"Listed On: Thursday, April 9, 2015",Rifles,no type,223/5.56 NATO                                                                                ,Semi-automatic                                                                                ,Rifle,"The upper is a mil-spec, 7075 T6 forged aluminum with T-marks. The barrel is a M4 profile, chrome lined, 16"" 4140 chrome-moly steel and 1:7 twist chambered in 5.56mm NATO. The front sight is a forged tower with bayonet lug. The rear sight is a Flat Dark Earth, Magpul MBUS. The handguard is a carbine length Magpul MOE, also FDE in color. 

Anderson forged lower with a Palmetto State Armory, Magpul MOE build kit. The 6-position stock, the grip and the enhanced trigger guard are all FDE, Magpul MOE.

Everything on this rifle is brand new and high quality. The rifle has never been fired.   Two brand new, FDE color Magpul Gen 2, 30-round magazines are included. These magazines do have the sight windows. 

I am not interested in trades at this time. The buyer must be legal to own a firearm in Tennessee and must be willing to sign a bill of sale."
268,http://www.armslist.com/posts/4138268,For Sale:  Benelli  Sport  2,"Ashville, Gadsden, Alabama","$ 1,500","Listed On: Saturday, March 14, 2015",Shotguns,Benelli                                                                                ,12 Gauge                                                                                ,Semi-automatic                                                                                ,Shotgun,"Like new in case, 12 gauge  with  30 inch  barrel . Call  or  text  REDACTED"
269,http://www.armslist.com/posts/4138269,Want To Buy:  WTB: a Winchester 94/22 or 94/22 Magnum,"Trinity, Greensboro, North Carolina",Offer,"Listed On: Saturday, April 4, 2015",Rifles,Winchester                                                                                ,22 Long Rifle                                                                                ,Lever Action                                                                                ,Rifle,"I am looking for a nice Winchester 94/22 or a .22 magnum please call or text REDACTED preferably in very nice condition, but am interested in all. Thank you."
270,http://www.armslist.com/posts/4138270,For Sale:  LNIB Kahr CW .380 comes with over 150 rounds & holster,"Independence, Kansas City, Missouri",$ 325,"Listed On: Saturday, March 14, 2015",Handguns,Kahr                                                                                ,380 ACP                                                                                ,Lever Action                                                                                ,Pistol,"I am selling a LNIB Kahr .380 with over 150 rounds & a holster that can be carried in your front or back pocket.  This set up is PERFECT for concealment.  You can EASILY carry this weapon any place.  This gun is amazing for the EDC, the car, tackle box, night stand, or whatever.  I also have a pinky extension that gives you a great grip for firing, comfort, and control.  No trades and $325 firm(any emails with trade offers or offer below $325 will not be returned)"
271,http://www.armslist.com/posts/4138271,For Sale/Trade:  Ruger Super Blackhawk(new model) 44 mag,"New Castle, Muncie, Indiana",$ 650,"Listed On: Wednesday, May 27, 2015",Handguns,Ruger                                                                                ,44 Magnum                                                                                ,Lever Action                                                                                ,Revolver,"I am looking to sell or trade my new model Ruger Super Blackhawk chambered in .44 magnum. This gun is equipped with a Hogue grip and a $200 ultra dot red dot scope. I also have a drop leg holster, all the original stuff from the factory including grips, sites, plus 125 rounds of ammo and extra brass. I also have the box for the scope and the scope rail. text REDACTED."
272,http://www.armslist.com/posts/4138272,For Sale:  Ruger 1911 SR1911 .45 ACP,"Troy, Dayton, Ohio",$ 625,"Listed On: Friday, March 27, 2015",Handguns,Ruger                                                                                ,45 ACP                                                                                ,Single Action                                                                                ,Pistol,"What you see in the pictures is what comes with the gun.  2 magazines,1 7 rnd, 1 8 rnd. 
Email text or call. REDACTED $625 obo. Not interested in trades."
273,http://www.armslist.com/posts/4138273,For Sale/Trade:  300 rnds 5.56 ss109,"Wilmington/leland, Wilmington, North Carolina",$ 120,"Listed On: Saturday, March 14, 2015",Ammo,Ruger                                                                                ,45 ACP                                                                                ,Single Action                                                                                ,Pistol,I have 300 rounds of 5.56 62gr ss109 ZQ1 ammunition for sale or trade.
274,http://www.armslist.com/posts/4138274,For Sale:  1992 NORINCO NHM-91 AK-47 7.62X39,"LEESBURG FLORIDA, Orlando, Florida",$ 900,"Listed On: Saturday, March 14, 2015",Rifles,Norinco                                                                                ,7.62x39                                                                                ,Semi-automatic                                                                                ,Rifle,"SMART BUYER GOT HIMSELF A 'REAL"" AK THANKS
////////////SOLD/////////////SOLD///////////////SOLD///////////SOLD////////
///////////SOLD/////////////SOLD///////////////SOLD/////////////////SOLD

FOR SALE: CUSTOMIZED 1992 NORINCO NHM-91 AK-47 7.62X39. 20 INCH CHROME LINED HEAVY MATCH BARREL. GREAT CONDITION, INCLUDES 1 30 AND 1 5 ROUND STEEL HUNTING MAG. RIFLE HAS BEEN MODIFIED TO ACCEPT ANY STANDARD AK MAGS. STAMPED RECEIVER WITH STAINLESS BOLT AND DOUBLE HOOK TRIGGER GROUP. HEAVY DUTY 1.5"" RECEIVER.

PHOENIX TECHNOLOGIES STOCK WITH STORAGE, NATO LENGTH

OD GREEN SINGLE POINT SLING

MAGPUL PISTOL GRIP WITH STORAGE COMPARTMENT

ATI FOREND WITH QUAD RAIL, TASCO PRO DOT RED DOT MOUNTED

DUE TO IMPORT REQUIREMENTS IT DOES NOT HAVE A THREADED BARREL

ORIGINAL IRON SIGHTS FRONT AND REAR

NOT INTERESTED IN TRADES, CASH SALE ONLY, MUST BE FL RESIDENT WITH VALID DL AND WILLING TO SIGN FIREARMS BILL OF SALE. MUST PICKUP IN LEESBURG FL AREA.  I HAVE OWNED THIS RIFLE FOR OVER 10 YEARS AND AM SELLING TO FUND MY VEPR PROJECT. DON'T SPEND $700.00 ON A CENTURY WHEN YOU CAN OWN A REAL AK MADE IN A CHINESE ARMS PLANT. ALL STAMPINGS ARE CORRECT."
276,http://www.armslist.com/posts/4138276,For Trade:  Glock 27 gen 3,"Cincinnati, Cincinnati, Ohio",Offer,"Listed On: Wednesday, March 25, 2015",Handguns,Extar Mfg.                                                                                ,40 S&W                                                                                ,Striker Fire                                                                                ,Pistol,"I have a glock 27 gen 3 with extras for trade looking for a glock 19 or 23. It has trijicon night sights, 5 mags (3 27 and 2 23). Thanks!"
277,http://www.armslist.com/posts/4138277,For Sale:  Remington 11-87 special purpose,"beaver dam, Madison, Wisconsin",$ 500,"Listed On: Friday, April 3, 2015",Shotguns,Remington                                                                                ,12 Gauge                                                                                ,Semi-automatic                                                                                ,Shotgun,Remington 11-87 12ga. Comes with 1 chokev$500 beaver dam.  REDACTED
278,http://www.armslist.com/posts/4138278,For Sale:  FS: 5.56/.223 AR Pistol Kit - Optic Ready,"Findlay, Lima, Ohio",$ 750,"Listed On: Thursday, March 19, 2015",Handguns,Remington                                                                                ,5.56×45mm NATO,Semi-automatic                                                                                ,Shotgun,"5.56/.223 AR pistol kit 

Comes with everything pictured:
1 30 round PMAG, Tactical Single Point sling, 120 rounds of AE

Details:
Anderson lower
7.5"" 1\7 Twist Barrel 
7"" 6061 T6 Aluminum Free float Key Mod Hand Guard
BCG is Chromed Lined
The muzzle break is not a suppressor 

$750 Cash obo
Must be 21 or older and willing to sign a bill of sale. 
CCW holders preferred."
279,http://www.armslist.com/posts/4138279,For Sale:  Sig Sauer P938..  Like new in box,"Indy north, Indianapolis, Indiana",$ 625,"Listed On: Saturday, March 14, 2015",Handguns,Sig Sauer,5.56×45mm NATO,Semi-automatic                                                                                ,Shotgun,"Shot very little still like new. In Sig box with all factory Sig  gear..
$625

REDACTED txt"
280,http://www.armslist.com/posts/4138280,For Sale:  MAL SHI PUPPIES FOR SALE- PRICE REDUCED- 8 WEEKS OLD 3/6/15,"Downriver/ Taylor, Detroit, Michigan",$ 250,"Listed On: Saturday, March 14, 2015",Miscellaneous,Sig Sauer,5.56×45mm NATO,Semi-automatic                                                                                ,Shotgun,"These are Maltese Shih Tzu mix pups that grow to about 10"" tall and 10 to 12 pounds. We have an adult male so you can see what they look like grown. Google the name and you will see what awesome little low shedding, hypoallergenic dogs these are. We have 3 males left. 1 is mostly white, 1 is mostly brown/ tan and the third is a mix of both. I want these guys to go to loving folks as family members and companions. They are in Taylor (48180) and I can send pix of any or all of them. Please PM or e-mail me at hesvdme@comcast.net Thanx & God Bless, Ed"
282,http://www.armslist.com/posts/4138282,For Sale:  Springfield XDS 3.3 9mm,"Rochester, Rochester, New York",$ 500,"Listed On: Saturday, March 14, 2015",Handguns,Springfield                                                                                ,9mm Luger (9x19)                                                                                ,Striker Fire                                                                                ,Pistol,"Used XDS 3.3 9mm all black with two 7rd mags
Comes with original case and content 
SHTF Gear Holster and 200rds of 9mm
Selling all together $500"
283,http://www.armslist.com/posts/4138283,For Sale:  7.62×51 also can be used with any standard 308 caliber rifle,"Portland, Portland, Oregon",$ 80,"Listed On: Saturday, March 14, 2015",Ammo,Springfield                                                                                ,9mm Luger (9x19)                                                                                ,Striker Fire                                                                                ,Pistol,I have 80 rounds of 7.62×51 that can also be used in any standard 308 caliber rifle
285,http://www.armslist.com/posts/4138285,For Sale/Trade:  Tanfoglio GT380 Magazine,"Near Airport, Columbia, South Carolina",$ 35,"Listed On: Saturday, March 14, 2015",Magazines,no type,no type,no type,no type,"Tanfoglio GT380 Magazine I acquired in trading. I do not have the pistol to test. It has a little surface rust which can be easily sanded off. Otherwise is good condition.
Willing to ship. Buyers pays shipping USPS Priority Flat Rate Box and will pay with USPS Money Order."
286,http://www.armslist.com/posts/4138286,For Sale:  Browning A-Bolt Medallion Grade,"Monroe, Michigan, United States",$ 550,"Listed On: Saturday, April 11, 2015",Rifles,Browning                                                                                ,30-06 Springfield                                                                                ,Bolt Action                                                                                ,Rifle,"This is a beautiful Browning A-Bolt Medallion Grade with very little wear. Has great wood grain on the one side. This is a great gun and of high quality, which is what you expect from a Browning. I have more pictures upon request. I also have a Nikon Prostate 3x9 and some ammo for the right price. 
Asking $550/OBO for the rifle.
Let me know if you are interested in anything else."
287,http://www.armslist.com/posts/4138287,For Trade:  kel tec ksg,"dayton, Dayton, Ohio",Offer,"Listed On: Saturday, March 14, 2015",Shotguns,Kel-Tec,30-06 Springfield                                                                                ,Bolt Action                                                                                ,Rifle,"I have up for trades a gen II, kel tec ksg. In great condition, zero malfunctions with target loads, slugs etc. Very fun gun to shoot. Comes with a vortex sparc II. Looking for hk's, fnx tac 45, maybe certain Ak's, just let me know what you have. Please no revolvers thanks"
288,http://www.armslist.com/posts/4138288,For Sale:  !000 Rounds New sealed case PMC X-TAC 5.56 55gr FMJ Ammo,"Peoria 75th ave  & Cactus, Phoenix, Arizona",$ 300,"Listed On: Wednesday, April 15, 2015",Ammo,Kel-Tec,30-06 Springfield                                                                                ,Bolt Action                                                                                ,Rifle,"3 Sold.      I have 1 case left as of today 4/17. 
Brass Cases
5.56
55gr
Boat tail
3270 FPS

300. each. firm, I'm pricing these to  sell!
You wont find a better price for these anywhere!
Im taking a loss.  
These are all New stock.
I just bought too much that I don't need (yet).

Call or text Nick 623-64O-6479"
289,http://www.armslist.com/posts/4138289,For Sale:  Ruger Super Blackhawk 44 Magnum-Redfield Scope,"Arden, Asheville, North Carolina",$ 550,"Listed On: Friday, April 10, 2015",Handguns,Ruger                                                                                ,30-06 Springfield                                                                                ,Single Action                                                                                ,Pistol,"Ruger Super Blackhawk 44 Magnum  blued finish, black scope. 10.5""inch barrel. Redfield 2.5 X 7 EER Variable Power Scope w-Extended Eye Relief, Comes with a scabbard style holster. I shot pistol with 44 mag and 44 special. shoots great, very accurate. Please text REDACTED."
290,http://www.armslist.com/posts/4138290,For Sale/Trade:  sig P220st,"west suburb, Cleveland, Ohio",$ 720,"Listed On: Tuesday, March 24, 2015",Handguns,Sig Sauer                                                                                ,45 ACP                                                                                ,Double / Single Action,Pistol,"Great condition gun insanely accurate. Comes with hard case, 2 8 round mags,night sights,and 50 rounds of hollowpoint hst+p"
