,url,title,location,price,post date,category,manufacturer,caliber,action,firearm type,postcontent
0,http://www.armslist.com/posts/4102000,For Sale/Trade:  Ruger accusport target 10/22 limited edtion,"metro, St. Louis, Missouri",$ 450,"Listed On: Tuesday, March 10, 2015",Rifles,Ruger                                                                                ,22 Long Rifle                                                                                ,Semi-automatic,Pistol,"ruger accusport target limited edition 10/22.stainless bull barrel,full size stock hand checkered,sling studs ,target trigger. like new less than 50 shots fired simmons 3x9x40 scope Im in IL if you live in MO gun MUST be transfered thru MO dealer at your expense ."
2,http://www.armslist.com/posts/4102002,For Sale:  Pro Mag,"tulsa, Tulsa, Oklahoma",$ 25,"Listed On: Wednesday, March 4, 2015",Magazines,no type,no type,no type,no type,"Promag hi - point 409 STS .40 S&W.
BLUE STEEL HIP -A5.
CLIP is brand new in package. 

Will ship!"
3,http://www.armslist.com/posts/4102003,For Sale:  sellier & beller small pistol priner,"Puyallup, Washington, United States",$ 25,"Listed On: Sunday, March 15, 2015",Reloading,no type,no type,no type,no type,sellier & beller small pistol priner 1000ct box for $25 a box please no trades just green backs at this time
4,http://www.armslist.com/posts/4102004,For Sale:  Smith and Wesson 357 magnum revolver,"Asheboro, Greensboro, North Carolina",$ 750,"Listed On: Monday, March 9, 2015",Handguns,Smith & Wesson                                                                                ,357 Magnum                                                                                ,Double / Single Action                                                                                ,Revolver,"Smith and Wesson Model 620 4"" stainless revolver.  no longer produced. New in box $750  Call or text REDACTED Thanks"
5,http://www.armslist.com/posts/4102005,Want To Buy:   DIE SET FOR 45 LONG COLT,"Battle Ground, Southwest Washington, Washington",Offer,"Listed On: Wednesday, March 4, 2015",Reloading,Smith & Wesson                                                                                ,357 Magnum                                                                                ,Double / Single Action                                                                                ,Revolver,WANT  DIE SET IN 45 LONG COLT IN GOOD WORKING ORDER.  LET ME KNOW HOW MUCH YOU WANT FOR IT.
6,http://www.armslist.com/posts/4102006,For Sale:  1980's Italian Made Over/Under 12GA,"Aurora, Denver, Colorado",$ 300,"Listed On: Thursday, March 12, 2015",Shotguns,Smith & Wesson                                                                                ,12 Gauge                                                                                ,Over and Under                                                                                ,Shotgun,"Hello I have a beautiful A.V. Marocciui 12 GA. Over Under, 76mm 3"" Magnum chambered shotgun.  It was imported by Armsport through Miami in the mid to late 80's.  I have fired it and it operates flawlessly.  I have put on an Airtech recoil pad that really nicely buffers the recoil and looks pretty good.  Stock is in great condition and has had Linseed Oil applied, nice looker.  Hurry won't last long at this price."
7,http://www.armslist.com/posts/4102007,For Sale/Trade:  Benelli Nova,"Indianapolis, Indianapolis, Indiana",$ 350,"Listed On: Wednesday, March 4, 2015",Shotguns,Benelli                                                                                ,12 Gauge                                                                                ,Pump Action                                                                                ,Shotgun,"I for sale a lightly used 12 gauge Benelli Nova shotgun. It is a pump action, 26"" barrell, will come with all factory acce. chokes paperwork etc... I purchased this last year and have put very few rounds through it. My interests have changed and I'm looking for something a little different. I can be flexible with meeting for serious buyers. I can meet anywhere between Terre Haute and Indy. I am mainly interested in cash. I will consider some handgun trades. Asking $350 OBO."
8,http://www.armslist.com/posts/4102008,"For Sale:  Remington Model 700 VSSF, .223 Caliber","South, Lincoln, Nebraska",$ 950,"Listed On: Monday, March 16, 2015",Rifles,Remington                                                                                ,223/5.56 NATO                                                                                ,Bolt Action                                                                                ,Rifle,"Varmint, Stainless, Synthetic Stock, with 26” Fluted Barrel. This rifle is in very good to excellent condition. I have owned it since new. Instruction manual and factory box included. The scope is not included. The VSSF is known for the sub-MOA accuracy. Please let me know of any questions you may have."
9,http://www.armslist.com/posts/4102009,For Sale/Trade:  Anderson Arms AR-15 556/223,"Leeds, Birmingham, Alabama",$ 675,"Listed On: Wednesday, March 4, 2015",Rifles,Remington                                                                                ,223/5.56 NATO                                                                                ,Semi-automatic                                                                                ,Rifle,"Anderson arms ar-15, 16"" barrel 1-8 twist, 7075 T6 forged upper receiver, A2 hand gaurd, A2 flash hider, pica tinny gas block, M-16 BCG, adjustable stock, 1  30 rd Pmag. New never fired. Also have a quad rail I can throw in for $700"
10,http://www.armslist.com/posts/4102010,For Sale:  AR S&W M&P 15 Sport,"Florence, Northern Kentucky, Kentucky",$ 650,"Listed On: Friday, March 27, 2015",Rifles,Smith & Wesson                                                                                ,223/5.56 NATO                                                                                ,Semi-automatic                                                                                ,Rifle,"For sale one like new not even 100 rounds fired S&W M&P 15 Sport.  Has all paperwork and box comes with one 10 rd and one 30 rd mag. 

Not looking for trades, sorry."
11,http://www.armslist.com/posts/4102011,For Sale:  5.56 penetrator,"Canal fulton, Akron, Ohio",$ 80,"Listed On: Wednesday, March 4, 2015",Ammo,Smith & Wesson                                                                                ,223/5.56 NATO                                                                                ,Semi-automatic                                                                                ,Rifle,Federal lake city 5.56 green tip light armor piercing . 2 - 150 round packs 80.00 each
12,http://www.armslist.com/posts/4102012,For Sale:  Smith and Wessom M&P15T,"Jacksonville, Springfield, Illinois",$ 900,"Listed On: Wednesday, March 4, 2015",Rifles,Smith & Wesson                                                                                ,223/5.56 NATO                                                                                ,Semi-automatic                                                                                ,Rifle,"***FOR SALE*** Smith and Wesson M&P15T. I bought the rifle new a little over 1 year ago and have yet to have a single issue. At least 1,000 rnds through it, but i do not know the exact round count. I have added a Magpul ASAP sling adapter w/ MidwayUSA single point sling, and a AIM NiB bolt carrier group. I'll include (5) 30rnd magazine with the sale.. Gun is/was $1100 at Gander Mtn without the BCG and Sling & adapter. Not looking for trades, just cash, $900 takes it away. Located in Jacksonville, il"
13,http://www.armslist.com/posts/4102013,For Sale/Trade:  Ruger American 308 bolt with bipod and sling like new,"Newcastle, Oklahoma City, Oklahoma",$ 400,"Listed On: Wednesday, March 4, 2015",Rifles,Ruger                                                                                ,308/7.62 NATO                                                                                ,Bolt Action                                                                                ,Rifle,"Bought new 2 -1/2 months ago and finished out deer season with it. Only shot about 30 rounds through it. These are great guns. Comes with a box of deer thugs ammo. Shoots 1"" groups with cheap ammo. Adjustable trigger. Very lightweight. Everything was purchased new a couple months ago and stored inside in a carrier lightly oiled. Just finished an AR10 build and no longer have a need for this one. 
The scope does not come with the gun but can be included for an extra 150.00   Nikon pro staff 
Mike  405-414-448three call or text
Price is $400.00"
14,http://www.armslist.com/posts/4102014,For Sale:  New! Smith & Wesson 1911 Perf Center NoCCFees $8.99 Shipping,"Galion, Columbus, Ohio","$ 1,225","Listed On: Wednesday, March 4, 2015",Handguns,Smith & Wesson                                                                                ,45 ACP                                                                                ,Single Action                                                                                ,Pistol,"KEELY ENTERPRISES
 
Smith & Wesson
1911
Performance Center
Bobtail
 
 
Brand New!! NO credit card fees!!
 
Item #: 170344-S&W
Manufacturer: Smith & Wesson|Smith & Wesson Performance Ctr
Model #: Model 1911 Custom Round Butt Performance Center
Type: Semi-Automatic Pistol
Finish: Black Scandium Frame|Stainless Steel Slide
Stock: G10 Custom Wood
Sights: Front: Black Post Rear: Fixed
Barrel Length: 4.25""
Overall Length: 7.95""
Weight: 29.6 oz
Caliber: 45AP
Capacity: 8+1
Action: Single Action
# of Mags: 2
Receiver: Scandium Alloy, Bobtail
Features: PC Action Job, Slide Ported Lighting-Cuts
Throated BBL, Polished Feed Ramp, 30-LPI Checkering"
15,http://www.armslist.com/posts/4102015,For Sale:  Browning Blr 81LT .300wsm,"Idaho Springs, Denver, Colorado",$ 650,"Listed On: Sunday, December 13, 2015",Rifles,Browning                                                                                ,300 Winchester Short Magnum                                                                                ,Lever Action                                                                                ,Rifle,"Browning.300wsm BLR 81 LT with scope rings 1"" low rounds though it.
REDACTED  If it is posted it is still for sale I remove my adds ffl transfer required."
17,http://www.armslist.com/posts/4102017,For Sale:  Star SS .380,"Madison, Nashville, Tennessee",$ 300,"Listed On: Wednesday, March 4, 2015",Handguns,Star Firearms                                                                                ,380 ACP                                                                                ,no type,Pistol,I'm ordering a new handle for it  but other than that it's good gun just text me I didn't put a email in here but text me your offer REDACTED I will ship to you.
20,http://www.armslist.com/posts/4102020,For Sale/Trade:  500 rounds Winchester .40 S&W for your Winchester 9mm,"Kingwood / Humble /The Woodlands, Houston, Texas",$ 150,"Listed On: Wednesday, March 4, 2015",Ammo,no type,no type,no type,no type,"I have 500 rounds of Winchester .40 S&W I want to trade straight across for 500 rounds of Winchester or Remington 9mm FMJ 115 gr brass cased - the standard WalMart WWB or Remington green box stuff.

The .40 is 100 rounds JHP, 400 rounds FMJ.

Or $150 for the lost.

Located in Kingwood-Humble."
21,http://www.armslist.com/posts/4102021,For Sale:  Assorted gun parts and a Galco Holster,"Greensboro or surrounding area, Greensboro, North Carolina",$ 1,"Listed On: Wednesday, March 4, 2015",Gun,no type,no type,no type,no type,"I have a couple of .22LR mags for sale and also have an remington 870 stock set, an extra high comb, a Galco Holster for a glock with crimson trace option, all parts and the holster are brand new never been used. Make offer on all items together or make an offer for them separately. I have pictures that i can send if needed."
22,http://www.armslist.com/posts/4102022,For Sale:  Llama max-1 1911 45acp,"Sparta, Cookeville, Tennessee",$ 475,"Listed On: Wednesday, March 4, 2015",Handguns,Llama                                                                                ,45 ACP                                                                                ,Single Action                                                                                ,Pistol,"Llama max-1 1911 45acp, comes with box paperwork and (2) mags. Gun is black upper and do green lower. $475 must be 21 and a TN resident

931-two one two-4116"
23,http://www.armslist.com/posts/4102023,For Sale:  norinco SKS with 3 extra mags and ammo,"byers, Denver, Colorado",$ 250,"Listed On: Wednesday, March 4, 2015",Rifles,Norinco                                                                                ,7.62x39                                                                                ,Semi-automatic                                                                                ,Rifle,"Norinco SKS with black skeleton stock, original 10 round mag and 3 extended mags, and 160 rounds of rem 7.62x39 ammo. $250. Priced this way because I removed the trigger set to change the magazine out and can't get it to lock back in. Its all there, just don't have time to fool with it anymore or take it to the gun shop. Moving soon. Call or text REDACTED"
24,http://www.armslist.com/posts/4102024,For Sale:  Glock 20 Gen 3 10 mm,"Gloucester, Hampton Roads, Virginia",$ 500,"Listed On: Wednesday, March 4, 2015",Handguns,Glock                                                                                ,10mm,Semi-automatic                                                                                ,Rifle,"Glock 20 gen 3 10mm less than 50 rounds fired. Comes in box with 2 mags, speed loader and lock.
Ben REDACTED $500"
25,http://www.armslist.com/posts/4102025,For Sale/Trade:  500 rds Federal Lake City PREMIUM 5.56 Fmj,"Oakland and Macomb counties, Detroit, Michigan",$ 0,"Listed On: Tuesday, May 19, 2015",Ammo,Glock                                                                                ,10mm,Semi-automatic                                                                                ,Rifle,"Very premium ammo made by: Lake City who is also a Military supplier for their ammo

these are NOT RELOADS. And are Full Metal Jackets

Selling them at a great price call or text REDACTED

$200 for 500 rounds firm or trade for something. can add more ammo or cash"
26,http://www.armslist.com/posts/4102026,For Sale:  Dan Wesson ECO **Like New**,"Montgomery, Montgomery, Alabama","$ 1,350","Listed On: Wednesday, March 4, 2015",Handguns,Dan Wesson                                                                                ,45 ACP                                                                                ,Single Action                                                                                ,Pistol,"Selling a like new Dan Wesson ECO in 45 ACP. Comes with original box, paperwork, and two magazines. I purchased it this month and put 150 rounds through it. Fantastic firearm just decided its not what I'm looking for right now."
27,http://www.armslist.com/posts/4102027,For Sale:  Glock 19 gen 3 package,"just north of cincinnati, Cincinnati, Ohio",FREE,"Listed On: Wednesday, March 4, 2015",Handguns,Glock                                                                                ,9mm Luger (9x19)                                                                                ,Striker Fire                                                                                ,Pistol,"I have a great condition glock 19 gen 3, glock box, 6 glock factory mags 4 15 rounders, 2 17 rounders, a crimson trace laser grip, and 1000 rounds of various brands of 9mm fmj ammo. All of this together would cost over a close to $1100 or more new depending where you shop. Gun has right about 300 rounds through it. pics can be sent by text if your interested. i would also take cash for gun, laser, and mags and trade the ammo to you for .40 ammo if you  had some to trade. Ohio resident only. ccw holders come first. Thanks for looking! Make an offer low balls will be ignored."
28,http://www.armslist.com/posts/4102028,For Sale:  Ruger 22/45 22 Semi auto,"Southwest, Wichita, Kansas",$ 325,"Listed On: Thursday, March 19, 2015",Handguns,Ruger                                                                                ,22 Long Rifle                                                                                ,Striker Fire                                                                                ,Pistol,"Ruger Model 22/45 Blued model with bull barrel. Comes with 2 mags, case. 
Has a NC Star 1x20 Red Dot on it.
Like new condition, great shooter.
With factory hardcase.
Would like to sell ASAP.
No trades."
30,http://www.armslist.com/posts/4102030,For Trade:  you got an extra scope kicking around?,"north, Nashua, New Hampshire",Offer,"Listed On: Wednesday, March 4, 2015",Gun,no type,no type,no type,no type,"sold the .40 I had, have a bunch of ammo left over.. looking to trade it for a scope for a .22 plinker dovetail mounts or convert to pictanny, have enough to make a good deal thanks. not expecting a leupold - its just a .22 looking to get 3xx9x30"
31,http://www.armslist.com/posts/4102031,"For Sale/Trade:  HP Desktop Computer for sale/trade for firearms, accessories, etc...","Too close to liberal haven on IU, Bloomington, Indiana",$ 230,"Listed On: Wednesday, March 4, 2015",Handguns,no type,no type,no type,no type,"For sale or trade is a gently used HP Pavilion Slimline s3720y PC. Includes tower, flat screen monitor, keyboard, and mouse. All cords necessary for use included. Windows Vista operating system. 4GB system memory. CD drive needs repair. Hard drive not included. 

Also for sale: LIKE NEW! Webcam (HP Premium Autofocus) in original packaging. Speakers (Boston Acoustics, BA265 powered two-piece speaker system).

I will sell all items together for $230 OR BEST OFFER.

All items sold in ""as is"" condition. No refunds or returns. Will ship at buyer's expense. Willing to meet face to face in the Bloomington area."
32,http://www.armslist.com/posts/4102032,For Sale:  Glock 23 .40 S&W Night Sights Case / Papers,"Kingwood / Humble /The Woodlands, Houston, Texas",$ 475,"Listed On: Wednesday, March 4, 2015",Handguns,Glock                                                                                ,no type,Striker Fire                                                                                ,Revolver,"I have a nice Gen 4 Glock 23 .40 S&W with all the papers, fired casing, brush, mag loader, case, three mags. TruDot Night sights with plenty of energy left.

You must be 21 or older, produce a CHL or TDL, be a legal owner, non-felon, and sign a Bill of Sale that I will provide.

Price is firm. If I receive no ‘I want it’ responses, then clearly I will need to lower the price if I want to sell it. I will do so if necessary. And if you see this listing, the gun is still available.

Folks, if you don't have the money and or need to ask your spouse, for the love of all that is holy, be adult enough to repress the urge to say ""I'll take it""; you'll save us both a lot of time as you dance out of your commitment for the next week.

I am really easy to deal with if you honor your commitment. But over the last month, far too many of you guys have said ""I want it - please hold it for me until Saturday""...and I've done that, only to be told Saturday that a) your wife is unhappy, b) your daughter is in the Emergency room, c) your car engine blew up, d) well ""something came up"".

So here's the deal: If you commit, then call me Saturday morning with some weasley excuse because you don't want to drive from Katy, then I'm going to add your phone number, email and name to the top of this listing.

Do we understand?"
33,http://www.armslist.com/posts/4102033,For Sale:  fn-fal,"grosse pointe, Detroit, Michigan",$ 750,"Listed On: Friday, March 20, 2015",Rifles,FN Herstal S.A.                                                                                ,308/7.62 NATO                                                                                ,Semi-automatic                                                                                ,Rifle,"fn-fal 308 nato 1964 Belgium military, numbers match, enterprise receiver, all metric, 5 mags., bayonet, 3-9 scope, extra stock, d&s arms safety ,  spring kit, great rifle. May consider some firearm trades, really only interested in broken, parts missing, or in need of repair items, the kind that no one else wants, thanks"
34,http://www.armslist.com/posts/4102034,For Sale/Trade:  RG model 66,"Carney, Oklahoma, United States",$ 1,"Listed On: Wednesday, March 4, 2015",Handguns,Röhm (RG)                                                                                ,22 Long Rifle                                                                                ,Single Action                                                                                ,Revolver,I have a 6 shot single action revolver. Works fine just not pretty. Email with any questions. Make me an offer.
36,http://www.armslist.com/posts/4102036,For Sale:  MIDWAY MODEL 1292,"North side, Racine, Wisconsin",$ 25,"Listed On: Wednesday, March 4, 2015",Reloading,no type,no type,no type,no type,I have this tumbler for sale with the sifter
37,http://www.armslist.com/posts/4102037,For Trade:  1000.00,"Port huron, Port Huron, Michigan",Offer,"Listed On: Wednesday, March 4, 2015",Rifles,no type,30 Carbine                                                                                ,Semi-automatic                                                                                ,Rifle,National postal meter m1 carbine late w w2 Koren conflict?  Numbers matching including stock. .
38,http://www.armslist.com/posts/4102038,For Sale/Trade:  9MM RUGER LC9 LNIB,"PLEASANT PLAIN, Cincinnati, Ohio",$ 325,"Listed On: Saturday, March 14, 2015",Handguns,Ruger                                                                                ,9mm Luger (9x19)                                                                                ,Double Action                                                                                ,Pistol,"UP FOR SALE OR POSSIBLE TRADE
RUGER LC9 9MM PISTOL IN LNIB CONDITION WITH FACTORY ACCESSORIES
FOR A ADDITIONAL 25.00 I WILL INCLUDE A STONER F.B.I. BLACK LEATHER SLIDE HOLSTER.(A 50.00 DOLLAR VALUE)"
39,http://www.armslist.com/posts/4102039,For Sale:  Glock 22 RTF2 Gills night sights Rare,"rockford, Rockford, Illinois",$ 650,"Listed On: Wednesday, March 4, 2015",Handguns,Glock,9mm Luger (9x19)                                                                                ,Double Action                                                                                ,Pistol,"Glock 22 RTF2 Gills night sights Rare. This is a Blue Label Police model. No wear anywhere! Hardly shot. Comes with 2 mags, manual and speed loader."
40,http://www.armslist.com/posts/4102040,For Sale:  Sig Sauer Sigarms SP2009 Sig Pro 9mm,"Portsmouth, New Hampshire, United States",$ 425,"Listed On: Friday, March 20, 2015",Handguns,Sig Sauer                                                                                ,9mm Luger (9x19)                                                                                ,Double / Single Action                                                                                ,Pistol,"late 90's/early 00's Sig SP2009 9mm handgun.  Frame is made in Swiss.  Includes case, manual, 4 mags.  2 of the mags have the base plates sanded down for better concealment.  Normal contrast sights, firearm is in great shape. Internals look brand new.  Very smooth DA/SA trigger setup.  Though it only comes with one grip sleeve, you can buy larger ones online.  No trades unless you have a Walther P99C or G26.  Must be New Hampshire resident with valid conceal permit."
41,http://www.armslist.com/posts/4102041,For Sale:  ruger sr40c,"frankfort, Lexington, Kentucky",$ 400,"Listed On: Thursday, March 26, 2015",Handguns,Ruger                                                                                ,9mm Luger (9x19)                                                                                ,Double / Single Action                                                                                ,Revolver,"In box with 3mags 
And ammo"
42,http://www.armslist.com/posts/4102042,For Sale:  223 Ammo - 500Rds,"Broomfield, Denver, Colorado",$ 250,"Listed On: Wednesday, March 4, 2015",Ammo,Ruger                                                                                ,9mm Luger (9x19)                                                                                ,Double / Single Action                                                                                ,Revolver,Ballastic Tip-VMAX 55gr. Defense Ammo.
43,http://www.armslist.com/posts/4102043,For Sale:  Browning Bar Safari Grade,"Inglis, Ocala, Florida","$ 1,200","Listed On: Wednesday, March 4, 2015",Rifles,Browning                                                                                ,7mm Remington Magnum                                                                                ,Semi-automatic                                                                                ,Rifle,"7MM Mag with BOSS system and leupold 3x9 scope, 1200.00"
