,url,title,location,price,post date,category,manufacturer,caliber,action,firearm type,postcontent
698,http://www.armslist.com/posts/867698,For Sale:  Sig  P226,"midland, Texas, United States",$ 1,"Listed On: Saturday, January 26, 2013",Magazines,Stag Arms                                                                                ,223/5.56 NATO                                                                                ,Semi-automatic                                                                                ,Rifle,"P226  .357 / .40  - 12 round.. used But in great shape, no dings, 
make offer,, will trade,,what ya got,,intrested in all big boy toys
I need hi cap. SR9 mag
TXT 432-553-5 two one 0"
699,http://www.armslist.com/posts/867699,For Sale:  9mm Luger 115GR HP-FMJ,"Southern Oregon, Medford, Oregon",$ 35,"Listed On: Thursday, January 17, 2013",Ammo,Stag Arms                                                                                ,223/5.56 NATO                                                                                ,Semi-automatic                                                                                ,Rifle,"9MM Luger 115GR HP-FMJ. 
I was told I need to get rid of some.
So to make her happy here they are.

MADE IN USA
50 count boxes.
Factory new nickel brass, Nosler 115gr HP bullets.
CCI primers, Reloadable brass.
$35 per box of 50 cartridges."
700,http://www.armslist.com/posts/867700,For Sale/Trade:  Stag,"Topeka, Topeka, Kansas","$ 2,300","Listed On: Thursday, January 17, 2013",Rifles,Stag Arms                                                                                ,223/5.56 NATO                                                                                ,Semi-automatic                                                                                ,Rifle,"Stag AR-15, comes with 5 p-mags, case, scope, iron peep sights, Yankee Hill floating quad rail, carbine front stock as well, delta spring rings, 500 round of hollow points, and 500 rounds of armor piercing green tips."
701,http://www.armslist.com/posts/867701,For Sale:  Marlin 270,"All, San Antonio, Texas",$ 325,"Listed On: Thursday, January 17, 2013",Rifles,Marlin                                                                                ,270 Winchester                                                                                ,Bolt Action                                                                                ,Rifle,I have a marlin 270 for sale. Model is an xl7. Rifle comes with scope rings. Great shooting gun. Asking 325.00 or best offer. Email me for pic or just search marlin xl7
702,http://www.armslist.com/posts/867702,For Sale:  30 Round PMAG Magazines for AR-15,"Wisconsin Rapids, Wausau, Wisconsin",$ 60,"Listed On: Thursday, January 17, 2013",Magazines,Marlin                                                                                ,270 Winchester                                                                                ,Bolt Action                                                                                ,Rifle,"(2) Brand new, still in the package Black 30 round Pmags.   $60 each.  Pick up in Wisconsin Rapids or I can ship at the buyer's expense.  Buy them while you still can!"
703,http://www.armslist.com/posts/867703,For Sale:  Rock river AR 15 a lot included!,"Trussville, Birmingham, Alabama","$ 3,000","Listed On: Thursday, January 17, 2013",Rifles,Rock River Arms                                                                                ,223/5.56 NATO                                                                                ,Semi-automatic                                                                                ,Rifle,"Brand new rock river operator 2
Decked out with bipod handle 
RRA scope mount 
With Nikon scope
Only 40 rounds put through it (to sight in scope)
Led strobe laser light
COMES WITH about 400rds of 223's
Also 5 30 rd magazines 

Still have all the paperwork, original hard sights and original case

I'm asking $3,000 but taking serious offers
I would like to trade for 4x4's (z71, Tahoe)
Just let me know REDACTED

This is a great deal to get just in time before Obama stops selling,

MY PICTURES ONLY UPLOADED UPSIDE DOWN
I can't get them to do right, forgive me"
704,http://www.armslist.com/posts/867704,For Sale:  7.62X39 AMMO  140 ROUNDS,"Tulsa, Tulsa, Oklahoma",$ 80,"Listed On: Thursday, January 17, 2013",Ammo,Rock River Arms                                                                                ,223/5.56 NATO                                                                                ,Semi-automatic                                                                                ,Rifle,"100 Rounds Wolf 124 grain HP 
40 ROUNDS Federal Power Shok 123 grain JSP [Brass Cartridges] This is quality hunting ammo for pigs-whitetails-ect. Cash Only. Meet at Tulsa area QT for transaction."
705,http://www.armslist.com/posts/867705,For Sale:  Ruger 10/22,"any, Portland, Oregon",$ 310,"Listed On: Thursday, January 17, 2013",Rifles,Ruger                                                                                ,22 Long Rifle                                                                                ,Semi-automatic,Rifle,Stainless synthetic stock.  New in box
707,http://www.armslist.com/posts/867707,"For Sale/Trade:  20"" Colt Sporter with Flat top - Upper","Roseburg, Oregon, United States",$ 550,"Listed On: Wednesday, January 23, 2013",Gun,no type,no type,no type,no type,"This at one time was a complete Colt A2 Sporter. Previous owner put on a flat top and cut down the front sight. Standard front sight put back. The lower is (not for sale or trade), the barrel is marked ""C MP 5.56 NATO 1/7"" Unknown round count. Front/bottom grip took some trimming to fit, that's why it looks rough. Flash hider needs a new crush washer to index properly, only on hand tight. Unknown maker of upper reciever, it is marked with the Anchor Harvey forge marks. Standard front pivot. 

Would really like to trade for a 16"" Upper. 

Will sale upper $550 shipped without BCG/CH OBO. PP accepted as gift + 4% 
If buying this then BCG/CH can be had at $275, otherwise will not seperate"
708,http://www.armslist.com/posts/867708,Want To Buy:  SKS Magazines,"Topeka, Kansas, United States",Offer,"Listed On: Thursday, January 17, 2013",Magazines,no type,no type,no type,no type,"I cannot find magazines for my SKS. Its a norinco but has been converted....I am looking for 30 rd 40 rd and up,  and 75 rd drums.  Looking to buy immediately."
710,http://www.armslist.com/posts/867710,For Sale:  Ruger Mini-14 Target Model,"Fox Valley, Wisconsin, United States","$ 1,400","Listed On: Wednesday, January 23, 2013",Rifles,Ruger                                                                                ,223/5.56 NATO                                                                                ,Semi-automatic                                                                                ,Rifle,"5.56/223 Target model bull barrel with factory damper, 7 30 round mags and 1 20 round mag.  ruger.com product model number 5828.  Check out the specs."
712,http://www.armslist.com/posts/867712,"For Sale/Trade:  1 AR Mag, USGI 30 rounds, new in the package, Tan Follower","Outside of town, Morgantown, West Virginia",$ 38,"Listed On: Thursday, January 17, 2013",Magazines,no type,no type,no type,no type,"One brand new in the package USGI 30 round mag, with the enhanced tan follower.  I will ship this mag to all places where they are legal.  Just shoot me an email

I accept Money Order, Paypal, a decent meal :)  and price is shipped to your door in lower 48"
713,http://www.armslist.com/posts/867713,For Sale:  Norinco UCNx12 (Ithaca 37 clone),"South Suburbs, Chicago, Illinois",$ 225,"Listed On: Thursday, January 17, 2013",Shotguns,Interstate Arms                                                                                ,12 Gauge                                                                                ,Pump Action                                                                                ,Shotgun,"I have a UCNx12 Norinco 12g Shotgun for sale. It holds 5+1 and is a bottom eject and has black synthetick furniture. It also has ghost ring sights, heatshield, and comes with sling mounts and a pistol grip. you can call or text me at REDACTED"
714,http://www.armslist.com/posts/867714,For Sale/Trade:  5- 30rd Pmags,"Mille Lacs Lake, Minnesota, United States",$ 1,"Listed On: Thursday, January 17, 2013",Magazines,Interstate Arms                                                                                ,12 Gauge                                                                                ,Pump Action                                                                                ,Shotgun,"I have 5- like new 30r pmags, has dust covers. I bought and had them in the safe. I know what they are going for, and magpul released that they will not take anymore orders at this time. If you got a low ball offer dont reply, if you want 1 or 5 please text me at six-one-two-597-0516, will meet or pick up only, Text for pictures."
715,http://www.armslist.com/posts/867715,For Sale:  Federal LC once-fired 308 Win Brass,"Huntsville, Huntsville, Alabama",$ 20,"Listed On: Thursday, January 17, 2013",Ammo,Interstate Arms                                                                                ,12 Gauge                                                                                ,Pump Action                                                                                ,Shotgun,For sale are 90 count packs of cleaned and polished once-fired 308 Win Brass. Vast majority are LC or LC Match.  $20 per pack.  FTF or ship on your dime.
716,http://www.armslist.com/posts/867716,For Sale:  Taurus hammerless,"West Iredell County, Hickory / Lenoir, North Carolina",$ 325,"Listed On: Thursday, January 17, 2013",Handguns,Taurus                                                                                ,38 S&W Special                                                                                ,Double Action                                                                                ,Revolver,"Comes with holster.

Call/text John at REDACTED"
717,http://www.armslist.com/posts/867717,"For Sale:  Springfield XD 40,","Lee County, Phenix City, Alabama",$ 400,"Listed On: Thursday, January 17, 2013",Handguns,Springfield                                                                                ,40 S&W                                                                                ,Striker Fire                                                                                ,Pistol,"like new even though I have owned it for a few years ,  has not been fired since it left the factory comes with all the goodies it came with new plus extra mag 3 total , full size , price is $400.00 . I have plenty of extra mags that I will sell for $35.00 each."
718,http://www.armslist.com/posts/867718,For Sale:  TC Contender with two barrels,"Hot Springs, Little Rock, Arkansas",$ 630,"Listed On: Thursday, January 17, 2013",Handguns,Springfield                                                                                ,40 S&W                                                                                ,Striker Fire                                                                                ,Pistol,"TC orignail stainless contender with  2 barrels,  stainless 223 with tc vairable scope and arrestor.  Blued 35 remington with burris variable scope and arrestor. Holster and carrying case."
719,http://www.armslist.com/posts/867719,For Sale/Trade:  ATI OMNI AR-15 stripped lower,"SE WI, Kenosha, Wisconsin",$ 200,"Listed On: Thursday, January 17, 2013",Rifles,American Tactical Imports                                                                                ,223/5.56 NATO                                                                                ,Semi-automatic                                                                                ,Rifle,"New in box, 2 available this weekend. $200 firm each. 
Must not be a fellon with ID and sign bill of sale.
These are poly stripped lowers."
720,http://www.armslist.com/posts/867720,"For Sale:  Magpul PMAG 5.56, black, new","Greenville, NC, Greenville, North Carolina",$ 45,"Listed On: Thursday, January 17, 2013",Magazines,American Tactical Imports                                                                                ,223/5.56 NATO                                                                                ,Semi-automatic                                                                                ,Rifle,"Magpul PMAG 5.56, GEN 2, black, new, $45,  I accept paypal.  Will ship for $6 extra, 2 available.  If you don't want to buy them don't wast my time."
721,http://www.armslist.com/posts/867721,For Trade:  RUGER LC9 NEW IN BOX,"nashville, Indiana, United States",Offer,"Listed On: Thursday, January 17, 2013",Handguns,Ruger                                                                                ,223/5.56 NATO                                                                                ,Striker Fire,Rifle,"hello have a new ruger lc9 that has only been handled never fired, has everything from bought new, great ccw that is sold out at buds and about everywhere else, looking to trade for a xd9sc, sr9c, glock 19, or similair striker fired weopons, please no low ball offers please contact REDACTED for pics and offers FTF NEAR NASHVILLE"
722,http://www.armslist.com/posts/867722,For Sale:  1943 IBM M1 Cabine .30,"Lexington, Lexington, Kentucky","$ 1,750","Listed On: Thursday, January 17, 2013",Rifles,Ruger                                                                                ,30 Carbine                                                                                ,Semi-automatic                                                                                ,Rifle,I have a very rare 1943 IBM M1 Carbine for sale. My name is Chad text me at REDACTED i can send you pic. Thank you for your time..
725,http://www.armslist.com/posts/867725,For Trade:  Taurus 38 Special,"Sanford, Raleigh / Durham / CH, North Carolina",Offer,"Listed On: Thursday, January 17, 2013",Handguns,Taurus                                                                                ,38 S&W Special                                                                                ,Double / Single Action                                                                                ,Revolver,"Older Taurus 38 Special.  5 shot revolver.  Bought in the late 80's used then.  Minimal Rounds...probably 50 at most.  Looking to trade for RUGER 380 in good condition or $325 cash since so many people want to ""buy"" it.  For those that want to steal it (Larry) please don't reply.  Really...$190.  I will buy all you have for $190.  This is in excellent condition and sat in the safe.  CCW or Permit, DL and bill of sale"
726,http://www.armslist.com/posts/867726,For Sale:  SKS -Yugoslavian 59/66 -UNFIRED -  numbers matching,"Cleveland, Cleveland, Ohio",$ 500,"Listed On: Thursday, January 17, 2013",Rifles,Zastava                                                                                ,7.62x39                                                                                ,Semi-automatic                                                                                ,Rifle,Yugoslav SKS.  Numbers match. Unfired condition.  Comes with accessories.  $500 obo
727,http://www.armslist.com/posts/867727,For Sale:  CZ550 .308,"Spring, Houston, Texas","$ 1,600","Listed On: Thursday, January 17, 2013",Rifles,CZ USA                                                                                ,308/7.62 NATO                                                                                ,Bolt Action                                                                                ,Rifle,"Cz550 varmint .308. Has very nice walnut stock, 25 inch heavy barrel. Very accurate out to 500 yards. Probably longer in the hands of a better shooter. Nikon coyote scope, bipod, scope rings and hard case included. 
Looking to trade for long range fun or cash. My rifle is in excellent condition, no junk please."
728,http://www.armslist.com/posts/867728,For Sale:  DPMS ar 15,"lakewood, Denver, Colorado","$ 1,600","Listed On: Thursday, January 17, 2013",Rifles,DPMS                                                                                ,223/5.56 NATO                                                                                ,Semi-automatic                                                                                ,Rifle,"I have a DPMS ar15 that has ncstar scope quad rail utg handguards and handle, Has had maybe 40 rounds threw it . The lower had been painted OD  green if interested feel free to text me at REDACTED"
729,http://www.armslist.com/posts/867729,For Sale:  HK-91 Mags & Pouch,"Pell City, NEAR, Birmingham, Alabama",$ 35,"Listed On: Saturday, March 16, 2013",Magazines,DPMS                                                                                ,223/5.56 NATO                                                                                ,Semi-automatic                                                                                ,Rifle,"Three Magazines & One pouch for the HK-91, PTR-91, or other copies of the HK-91 rifle. Used but very nice condition. Guaranteed to function. A total of 3 mags, but one pouch.

*** Check my other ammo & related ads ***"
730,http://www.armslist.com/posts/867730,For Sale:  SKS and Tapco magazines,"belleview, Florida, United States",$ 400,"Listed On: Thursday, January 24, 2013",Rifles,Norinco                                                                                ,7.62x39                                                                                ,Semi-automatic                                                                                ,Rifle,"1 sks in fair condition for 400 and 2   20 round magazines for 25 a piece.

in good firing order
does not have cleaning rod
it is the one without the bayonet"
731,http://www.armslist.com/posts/867731,"For Sale:  NEW MAPUL PMAG MAGAZINES, 30-ROUND, BLACK","Tulsa, Tulsa, Oklahoma",$ 75,"Listed On: Thursday, January 17, 2013",Magazines,Norinco                                                                                ,7.62x39                                                                                ,Semi-automatic                                                                                ,Rifle,Not many left.  Give Obama the big middle finger and stock up now !  $75 each.  Can meet pretty much whenever in Tulsa.
732,http://www.armslist.com/posts/867732,For Sale:  Remington Model 740 Woodsmaster .30-06,"Superior, Denver, Colorado",$ 325,"Listed On: Thursday, January 17, 2013",Rifles,Remington                                                                                ,30-06 Springfield                                                                                ,Semi-automatic                                                                                ,Rifle,Remington Model 740 Woodsmaster .30-06.  Excellent condition $325.00
733,http://www.armslist.com/posts/867733,For Sale:  Mossberg MVP predator,"Aurora, Springfield, Missouri",$ 800,"Listed On: Thursday, January 17, 2013",Rifles,Mossberg                                                                                ,223/5.56 NATO                                                                                ,Bolt Action                                                                                ,Rifle,"I want to sell or trade  my MVP . Like new in box with new 6x18 Simmons scope. Gun has 20 inch barrel, gray laminated stock, compact size, uses ar-15 magazines so 5 or 10 rd mags can be used to hunt or comply with any new federal law or use 30 rd mags for self defense if needed. Has been shot to be sighted in (20 rds?) that's it ,shoots moa groups  gun is in new condition, will give 10 and 30 rd magazine with purchase.  Call or textREDACTED8 for questions"
734,http://www.armslist.com/posts/867734,For Sale/Trade:  9MM Glock 33 round Magazines,"West Chester, Cincinnati, Ohio",$ 1,"Listed On: Thursday, January 17, 2013",Magazines,Mossberg                                                                                ,223/5.56 NATO                                                                                ,Bolt Action                                                                                ,Rifle,"I have 2 aftermarket Glock 9MM 33 Round Magazines. 

Looking to trade towards a pistol for my wife CCW. 

Text 513-5four9-27eight5 if you have a cash offer or a trade I might be interested in."
736,http://www.armslist.com/posts/867736,For Sale:  **Brand New Sig Sauer M400 Enhanced 5.56 OD/Magpul plus extras**,"Pryor,OK, Oklahoma, United States","$ 2,500","Listed On: Thursday, January 17, 2013",Rifles,Sig Sauer                                                                                ,223/5.56 NATO                                                                                ,Semi-automatic                                                                                ,Rifle,"This gun is brand new, never been fired. The gun comes with 4-black Magpul 30 rnd clips and 1-OD Magpul 30rnd clip, OD Magpul foregrip, QD sling mount for 2 in 1 mounting, BDS tactical enhanced padded 2 in 1 black sling, Sig Sauer tactical bag, factory lock and paperwork."
737,http://www.armslist.com/posts/867737,"For Sale:  Tapco mag, 5.56, new/unused","Greenville, NC, Greenville, North Carolina",$ 35,"Listed On: Thursday, January 17, 2013",Magazines,Sig Sauer                                                                                ,223/5.56 NATO                                                                                ,Semi-automatic                                                                                ,Rifle,"Tapco mag, 5.56, new/unused, black , $35 each, I accept paypal, will ship for $6 extra.  2 available. If you don't want to buy them don't waste my time."
738,http://www.armslist.com/posts/867738,"For Sale:  Twinkies included in Ultimate Colt6920LE Magpul edition with Beta drum mag and Smith & Wesson bayonet,500 rds amo.must see!","washington,mo, St. Louis, Illinois","$ 3,699","Listed On: Wednesday, January 23, 2013",Rifles,Colt                                                                                ,223/5.56 NATO                                                                                ,Semi-automatic                                                                                ,Rifle,"I have constructed for the most discriminating Zombie destructor what has to be probably the ultimate package I have seen on here. I started with a law enforcement carbine Colt LE6920 with Factory Magpul equipment all over the gun,grips,stock,fore grip and post,flip up sight etc. I then have added to that a brand new, GENUINE USA MADE,  100 round Beta C mag, along with 500 rounds of FMJ ammo for your zombie duties. I added a functional and menacing,brand new Special Ops series Smith & Wesson knife/bayonet combo to the loud end of the weapon. And for the final ,perfect touch I have added what is probably the rarest and most unique finishing touch ever with these weapons,and the one thing you may want at the end of the day, a package of Genuine Hostess Twinkies. This Twinkie thing aint over!!!, and it doesnt have to be with this package.:) You can buy all this great package together today and only at one place, right here! You can email me or call me at REDACTED, joe"
739,http://www.armslist.com/posts/867739,For Sale:  Ruger P90 .45,"Central, Colorado Springs, Colorado",$ 300,"Listed On: Thursday, January 17, 2013",Handguns,Ruger                                                                                ,45 ACP                                                                                ,Double / Single Action                                                                                ,Pistol,For sale Ruger 45 cal semi auto $300 REDACTED. Comes with plastic galco holster.
740,http://www.armslist.com/posts/867740,For Sale:  Two Ruger SP101 Speed Loaders,"vail, Tucson, Arizona",$ 25,"Listed On: Thursday, January 17, 2013",Magazines,Ruger                                                                                ,45 ACP                                                                                ,Double / Single Action                                                                                ,Pistol,"Two HKS speed loaders for Ruger SP101. Both for one price  Must take both.
  Can meet you in Tucson."
741,http://www.armslist.com/posts/867741,For Sale:  Lee Pro 1000,"Muncie, Indiana, United States",$ 400,"Listed On: Thursday, January 17, 2013",Ammo,Ruger                                                                                ,45 ACP                                                                                ,Double / Single Action                                                                                ,Pistol,"i have 3 lee pro 1000 reloading presses with case feeder, bullet feeder, auto disk powder dispenser with adjustable powder bar,  and multiple die plates.  asking $400 for everything.

call or text REDACTED"
