,url,title,location,price,post date,category,manufacturer,caliber,action,firearm type,postcontent
0,http://www.armslist.com/posts/867000,For Sale:  Colt  Model 1903  .32 ACP Pocket pistol,"Creedmoor,, Raleigh / Durham / CH, North Carolina",$ 725,"Listed On: Thursday, January 17, 2013",Handguns,Colt                                                                                ,32 ACP                                                                                ,Semi-automatic,Pistol,"I am offering some of my personal collection up for sale. This pistol was built in 1922.  It has some wear and light scratches like they all do but is overall in excellent condition, no  pitting or rust seen. The action moves very smooth, the spring is strong. Although I have never fired it, it should be a sweet shooter.  It has been safe kept while in my possession. 

Price is for local cash sale, with buyer meeting NC handgun purchase requirements.

Non local sale, must be paid with US Post Office Money Order with shipping to FFL of your choice added. Arrangements to your FFL must be included with payment."
3,http://www.armslist.com/posts/867003,Want To Buy:  Ruger LCR 22 Magnum,"Yukon, Oklahoma, Oklahoma City, Oklahoma",$ 1,"Listed On: Tuesday, January 22, 2013",Handguns,Ruger                                                                                ,22 Magnum                                                                                ,Single Action                                                                                ,Pistol,Looking for a Ruger LCR 22 Magnum in great condition.
4,http://www.armslist.com/posts/867004,For Trade:  WTT mossberg 500 pistol grip.,"Denver metro, Denver, Colorado",Offer,"Listed On: Thursday, January 17, 2013",Shotguns,Ruger                                                                                ,22 Magnum                                                                                ,Single Action                                                                                ,Pistol,"Like new, unfired, mossberg 500 with pistol grip for trade. F2F, must meet all legal requirements."
5,http://www.armslist.com/posts/867005,For Sale:  WTB Walther PPS,"Denver, Colorado, United States",$ 600,"Listed On: Wednesday, January 23, 2013",Handguns,Walther,22 Magnum                                                                                ,Single Action                                                                                ,Pistol,"Looking for a PPS, Kahr P9 or Sig  in 9 mm.     I have P-mags to trade. REDACTED"
6,http://www.armslist.com/posts/867006,For Sale:  ( ͡° ͜ʖ ͡°)Lorcin or Hawes .25 ACP,"Beach, Jacksonville, Florida",$ 125,"Listed On: Thursday, January 17, 2013",Handguns,Walther,25 ACP                                                                                ,Double Action                                                                                ,Pistol,"Lorcin LT-25 .25 ACP - All Black. Great pocket pistol

Location : Neptune Beach
Hawes Firearms - Germany .25 ACP - Even smaller than the lorcin

Choice at $125.00,  No Tax, No fees, No papers, I will abide by florida and federal law so be 21+ and have your Florida DL to prove it.

Sorry, I don't have the original box and papers. Guns are in good fireable shape. They have been in the safe for many years only to be pulled and cleaned and inspected.

Sales Order:

If the ad is up and I do not list it as ""sale pending"" then it is still for sale. Do not message me with ""do you still have it"" or ""is it still available"". I will assume you are a spam bot trying to get my email address and I will ignore you. ""I am interested"" is a close second that is being used also. I myself answer an ad with where I am located and when I would be available. That always gets a persons attention. I try to sell to the first person who contacts me first. After that I contact the second response and so on. This had always worked for me in the past, but as time changed and more people flaked on me or wanted me to wait beyond an agreed upon time/day, I have changed my method to a ""first with the cash gets the prize"". As in everything communication is king, I can't read your mind. I am not interested in Shipping a gun anywhere. If I was, I would be advertising it to a national audience auction site and asking more. Like all things, If I get enough ridiculous offers and somebody just has to have this because it reminds them of the one dear old dad used to have and has more dollars than the local's sense, I will ship to your local FFL if he will accept a direct ship gun from a private owner. Postal Money order to be cleared first. I will not sell to a low baller, I will sell through afore mentioned Auction site or just keep the item.

Disclaimers and Information:

I am not a gun shop, there is no sales tax or background fees. I do not take credit cards. I also will not accept a cashier's check, personal check, money order or anything other than CASH. If you email me a low-ball offer and say that you will pay in CASH, like it is something special, I will assume you are a fucking retard who shouldn't own a gun to begin with. Contact me and I will email the best pictures I can manage. No, I am not a professional photographer. I do not look at my phone all day hoping I have email. I check it when I get home from work and occasionally on the week ends. Please don't get discouraged and think I am ignoring you if I don't return an email in 5 minutes. I am not willing to drive across the state to meet you so that you can inspect the gun and make me an offer. Driving halfway across town is a different matter all together, but I hope you will have made your offer ahead of time. If not, I may take my toys and go home. Yes, I know what the asking price on Gunbroker is, I also know what they sell for along with shipping and transfer fee and credit card fee. I do not dignify ridiculous offers with a reasonable response, they will get a ridiculous response, if any response at all. I do not NEED to sell anything, I would just LIKE to. Reasonable offers are considered, not necessarily accepted, but considered. Please do not drag the moral character of my relatives into any disagreement, I can't help it, they are like that. Mom in particular. All firearms should be considered loaded at all times, they may not be, but it is safer to consider them that way. Spammers and scammers beware, I have a loaded LOIC (low orbit ion cannon) and I know how to use it.

P.S.

I am sorry this is sooo long but every day somebody fails to see reason and acts outside the bounds of my endurance. Check back often as the list continues to grow, ha."
7,http://www.armslist.com/posts/867007,For Sale:  Colt LE6920 AR-15,"5 Points, Denver, Colorado","$ 1,750","Listed On: Monday, March 18, 2013",Rifles,Colt                                                                                ,223/5.56 NATO                                                                                ,Semi-automatic                                                                                ,Rifle,Only fired twice.  Colt LE 6920 rifle with two 20 round mags.  Get it while you can!
8,http://www.armslist.com/posts/867008,For Sale/Trade:  Daisy bolt action 22,"Sparks, Reno, Nevada",$ 150,"Listed On: Friday, February 8, 2013",Rifles,Colt                                                                                ,22 Long Rifle                                                                                ,Bolt Action                                                                                ,Rifle,"I have a daisy bolt action 22 rifle would like to get $150 the stock is loose not sure how to fix it. Also have two 10 rnd clips, clip holster, back straps, speed loader, and the lock for a berretta px4 storm subcompact .40 would like to sell all for $60. Also I will take offers on individual items. Please email or text REDACTED9"
9,http://www.armslist.com/posts/867009,For Sale:  Norinco MAK 90 AK-47,"Bradenton, Florida, United States","$ 1,100","Listed On: Thursday, January 17, 2013",Rifles,Norinco                                                                                ,7.62x39                                                                                ,Semi-automatic                                                                                ,Rifle,"For Sale - Norinco MAK-90 AK-47, matching serial numbers, chrome lined barrel, tactical collapsing stock, military style sling, very few rounds through barrel, gun has been hydroprinted in ATACS camo pattern and comes with one 30 round eastern European steel mag (matching camo). This gun functions flawlessly; never a FTF or jam.  I prefer a face-to-face transaction but would consider shipping. $1,100 obo."
10,http://www.armslist.com/posts/867010,For Sale:  500 rounds new Winchester 380. Ammo,"SAFETY HARBOR, Tampa/St. Pete, Florida",$ 40,"Listed On: Thursday, January 17, 2013",Rifles,Norinco                                                                                ,7.62x39                                                                                ,Semi-automatic                                                                                ,Rifle,"500 rounds new Winchester 380. Ammo 
95 grain FMJ
$40.00 for a box of 100
Dave REDACTED
buyat326 @yahoo.com"
11,http://www.armslist.com/posts/867011,"Want To Buy:  glock, xd, sig ect","muncie, Indiana, United States",$ 500,"Listed On: Thursday, January 17, 2013",Handguns,Glock                                                                                ,7.62x39                                                                                ,Double Action                                                                                ,Pistol,"WTB a glock, sig or XD. Looking for something reliable and in good shape. Either 9mm, 40 or 45acp. Open to most makes and models except Taurus. Willing to pay up to $500 depending on what you have. Prefer to meet around Muncie area willing to travel depending on what you have and if price is right. Feel free to drop me an email. Thanks!"
12,http://www.armslist.com/posts/867012,For Sale:  magpul pmags 30 round high capacity windowed black,"southside indy, Indiana, United States",$ 70,"Listed On: Thursday, January 17, 2013",Magazines,Glock                                                                                ,7.62x39                                                                                ,Double Action                                                                                ,Pistol,"I am selling two magpul black windowed pmags. 30 round high capacity magazines. price is per magazine. If they don't sell, I will take them to the 1500, where they will definitely sell. Thanks!"
13,http://www.armslist.com/posts/867013,For Sale/Trade:  .45 acp/.45 auto,"so. tulsa/bixby, Tulsa, Oklahoma",$ 30,"Listed On: Thursday, January 17, 2013",Ammo,Glock                                                                                ,7.62x39                                                                                ,Double Action                                                                                ,Pistol,"80rds non reloadable, steel poly jacket silver cci and green wolf ammo fmj. good for plunking. buy all your ammo now before laws change. nine18nine022583 jeff."
14,http://www.armslist.com/posts/867014,For Trade:  ruger 10/22 mag pro 50rd drum and mag loader Brand New,"flint area, Flint, Michigan",$ 200,"Listed On: Thursday, January 17, 2013",Magazines,Glock                                                                                ,7.62x39                                                                                ,Double Action                                                                                ,Pistol,Brand new ruger 10/22 high cap drum with mag loader. Text me 810-394-one398 tim
15,http://www.armslist.com/posts/867015,Want To Buy:  Ruger SR9C,"Milwaukee, Milwaukee, Wisconsin",Offer,"Listed On: Thursday, January 17, 2013",Handguns,Ruger                                                                                ,9mm Luger (9x19),Double Action                                                                                ,Pistol,"wanting ruger sr9c, have cash or trade.  Let me know"
16,http://www.armslist.com/posts/867016,For Sale:  BUSHMASTER MODULAR CARBINE AR15,"RUTHERFORD/CLEVELAND, Charlotte, North Carolina","$ 2,300","Listed On: Thursday, January 17, 2013",Rifles,Bushmaster                                                                                ,223/5.56 NATO                                                                                ,Semi-automatic                                                                                ,Rifle,"THIS IS A BUSHMASTER MODULAR CARBINE THIS RIFLE IS TRICKED OUT STRAIGHT FROM BUSHMASTER THIS RIFLE COMES WITH YANKEE HILL FLIP SITES,YANKEE HILL FREE FLOATING FOREND WITH REMOVABLE PADS,AND A FLUTED H BAR BARREL IT DOES HAVE THE 6 POSITION ADJUSTABLE STOCK I ADDED A HOGUE GRIP,AND MAGPUL SINGLE POINT SLING ADAPTER AND HAD THE RIFLE DIGITAL CAMOED WITH DURACOATED FIREARMS PAINT BECAUSE I WAS GOING TO USE IT FOR COYOTE HUNTING BUT NEVER KILLED THE FIRST ONE WITH THIS GUN HAHA BUT IT DOES SHOOT AND GROUP AWESOME.I DO HAVE THE BOX AND BUSHMASTER BOOK AND WILL THROW IN A BLACKHAWK SLING,SCOPE RISER RAIL AND A COUPLE OF EXTRA MAGS BESIDES THE FACTORY 10 RD THAT I CAMOED. PLEASE REALIZE THIS IS NOT A BASE MODEL BUSHMASTER THIS WAS THE HIGHEST PRICED ONE THEY SOLD IN A AR STYLE THIS GUN SOLD FOR AROUND $1800.BEFORE ALL THIS CRAZINESS STARTED IM NOT DOING LIKE MOST OF THESE PEOPLE ASKING DOUBLE THE PRICE OF WHAT THE GUN IS TRULY WORTH.IM NOT REALLY INTERESTED IN TRADES BECAUSE I AM BUYING ANOTHER GUN WHEN THIS ONE SELLS.I WOULD APPRECIATE IF YOU PROVIDE ME EITHER A COPY OF YOUR CONCEALED CARRY PERMIT OR PROVIDE ME A PISTOL PERMIT SO I KNOW YOU ARE A LEGAL FIREARMS PURCHASER. PLEASE FEEL FREE TO EMAIL ME IF YOU WOULD LIKE ME TO EMAIL YOU MORE PICTURES OR HAVE ANY QUESTIONS AT ALL THANKS DARREN    


Features popular Bushmaster Modular Accessories such as:
• B.M.A.S. Four Rail Tubular Forend which free-floats the Barrel
from the Barrel Nut forward to avoid any possibility of barrel
deflection or accuracy degradation.
• Molded Rubber Sure-Grip Rail Covers snap over the Rail
Sections on the Handguard to add ergonomic comfort and rail
protection.
• The rear sight is a detachable Dual Aperture B.M.A.S. Rear Flipup
unit with windage calibrated to ½ M.o.A.
• The front sight is our B.M.A.S. Clamp-on designed to fit directly
over the Milled Front Gas Block. It folds down with the touch
of a button to allow scope use, and incorporates an elevation
adjustable M16A2 front sight post.
• The Ergonomic Pistol Grip is an ambidextrous design, molded
of urethane with a stipple finish to provide a solid non-slip grip
and firm control.
• The 5.56 mm/.223 Rem. Chrome-lined 16"" ChromeMoly
Vanadium Steel Barrel is Fluted for lighter weight and
enhanced cooling capabilities, and includes the A2 “Birdcage”
Flash Suppressor.
• The Modular Carbine is available with either a lightweight
Skeleton Stock or a 6 Position Telestock"
18,http://www.armslist.com/posts/867018,For Sale:  Tufloc MultiGun Storage Rack,"South of Columbus, Columbus, Ohio",$ 100,"Listed On: Thursday, January 17, 2013",Gun,no type,no type,no type,no type,"I have a Tufloc 4 pistol storage rack. This rack is extremley heavy duty and can be lag bolted to whatever you need it. It is made of heavy steel and has one key. Lock functions as should.  Besides a couple of scratches it is fully functional. These retail for over $250. I will sell $100

http://www.chiefsupply.com/5153-Tufloc-Multi-Gun-Storage-Pistol-Quadrack-Up-To-4-Guns.aspx?sku=72-200&source=Google+Base_CHIEF+Supply&gclid=COjb-MHN77QCFQVgMgod9FcAqA"
19,http://www.armslist.com/posts/867019,For Sale:  .300 SAVAGE MODEL 99 W/WEAVER SCOPE,"MARIETTA PA LANCASTER, Southeastern, PA, Pennsylvania",$ 475,"Listed On: Thursday, January 17, 2013",Rifles,Savage Arms                                                                                ,no type,Lever Action                                                                                ,Rifle,".300 SAVAGE MODEL 99 W/WEAVER SCOPE
REDACTED"
21,http://www.armslist.com/posts/867021,Want To Buy:  DPMS Flat-Top Upper Assembly 308 Winchester,"Rose Hill, Wichita, Kansas",$ 800,"Listed On: Thursday, January 17, 2013",Gun,no type,no type,no type,no type,"Looking for DPMS complete upper assembly in 308 with BCG.

Let me know what you got."
22,http://www.armslist.com/posts/867022,For Sale:  SAIGA 12 GAUGE SHOTGUN MAGAZINE 12 RD MAG SGM SUREFIRE MADE IN USA,"Warner Robins, Macon, Georgia",$ 200,"Listed On: Thursday, January 17, 2013",Magazines,no type,no type,no type,no type,"I have new Saiga 12 magazines made by SGM Tactical in the USA. These mags hold 12 rounds of 12 gauge 2 3/4"" shotgun shells and designed for the Saiga 12. Please email me with any questions you may have. Price is $200 each. Thank you."
23,http://www.armslist.com/posts/867023,For Sale:  200 rounds 9mm ammo,"Springfield, Oregon, United States",$ 75,"Listed On: Thursday, January 17, 2013",Ammo,no type,no type,no type,no type,"250 rounds of 9mm ammo.  Mixed lot includes some reloads.  Mostly 115gr and 124gr FMJ.

Local cash sale or will ship for $25 UPS with tracking."
25,http://www.armslist.com/posts/867025,For Sale/Trade:  Custom AR 5.56 w/ 5mags,"Hilliard, Columbus, Ohio","$ 1,350","Listed On: Thursday, January 17, 2013",Rifles,no type,223/5.56 NATO                                                                                ,no type,Rifle,"Custom AR 5.56 built pistol
RockRiverArms upper,FA lower,Wilson chrome freefloating barrel
5-30rd mags & 60rds ammo
Classified as other so you can put a rifle upper on
Get it before Obama trys 2 ban 'Assault Weapons' & high capacity mags
Powerful as AR rifle just more compact & easier 2 move with.."
26,http://www.armslist.com/posts/867026,For Sale:  S&W M&P 40 Magazines,"Lee County, Alabama, United States",$ 50,"Listed On: Thursday, January 31, 2013",Magazines,no type,223/5.56 NATO                                                                                ,no type,Rifle,"$50.00 each shipped  14 round 
REDACTED"
27,http://www.armslist.com/posts/867027,For Sale:  Professional Ordnance (Bushmaster) Carbon 15 Pistol,"Newark, OH, Columbus, Ohio",$ 989,"Listed On: Wednesday, February 13, 2013",Handguns,Bushmaster                                                                                ,223/5.56 NATO                                                                                ,Single Action                                                                                ,Pistol,"**CALLS ONLY PLEASE! EMAILS WILL NOT BE RESPONDED TO AT THIS TIME. THANK YOU FOR YOUR PATIENCE!**
I have one 5.56/.223 Carbon 15 Pistol made by Professional Ordnance in stock.  This pistol is in excellent condition.  It comes with one polymer 30 round magazine.  Professional Ordnance was purchased by Bushmaster who them kept making the Carbon-15.  These are fun little guns and are a real ""blast"" to shoot.
This pistol is priced at $989.99.
Located at:
Axis Arms
610 Oakwood Ave
Newark, OH 43055
REDACTED
Hours: 10A-6P Tuesday-Thursday
CLOSED (BY APPOINTMENT) Friday-Monday"
28,http://www.armslist.com/posts/867028,For Sale:  Sig P220 / German Made / Collectable / 45 cal,"St Lucie County, Palm Beach, South Florida",$ 775,"Listed On: Thursday, January 17, 2013",Handguns,Sig Sauer                                                                                ,45 ACP                                                                                ,Double / Single Action                                                                                ,Pistol,"Sig P220 / German Made / Collectable / 45 cal
Shoots 1/2"" groups at 25 yards!  

***** Please READ the Entire Ad *****

***** Gun is Available….don’t ask *****

* More Guns @ ""SELLER'S OTHER LISTINGS"" *

*** Private Sale …... CA$H and Carry ***

 ******** Full Description ********

This German made Sig Sauer P220 pistol is in excellent condition. Included is the original box with all serial numbers matching, including original factory stickers on the Sig Sauer box. I bought it used and shot two clips through it. This Sig is a very soft shooting pistol…. and will shoot 1/2"" groups at 25 yards. 

Total Rounds Fired: Less than 30 rounds
Model: P220 
Caliber: .45 
Type of Action: Double/Single
Capacity: 12 rounds
Barrel Length: 5.3” 
Condition: This gun is 99%
Extras: Two magazines  
Asking: $775 (No Trades)

Transaction: Face to face with a current Florida resident, and Bill of Sale. A Concealed Weapons Permit is Preferred to keep away Felons, Crazies, and Zombies ;0)

Contact Information: Please call or text me anytime at (772) 200 - 7300. My email address is cossack1957@ yahoo.com. I live in Port St. Lucie and travel to Boca Raton twice a week. Therefore I could meet you somewhere near I-95.


Disregard: Glock, Kimber, 1911, Les Baer, Wilson, Smith & Wesson, Ed Brown, Sig Sauer, Ruger, STI"
29,http://www.armslist.com/posts/867029,"For Sale:  Mega Arms forged receiver, Troy Battle Mags, Rainier Arms Trigger Guard","Warr Acres, Oklahoma City, Oklahoma",$ 550,"Listed On: Thursday, January 17, 2013",Rifles,Sig Sauer                                                                                ,45 ACP                                                                                ,Semi-automatic                                                                                ,Rifle,"Brand new Mega Arms multi-cal, forged Gator model AR lower receiver for sale, has a Rainier Arms Enhanced Tigger Guard installed. Includes THREE Troy Industries Battle Mags, 5.56 - 30 round, black, new in packaging.

**THE LOWER PARTS KIT IN PHOTO IS NOT INCLUDED**

Must be eligible to legally purchase/possess a firearm. Must bring valid Oklahoma Driver License. FTF locally--will not ship; CASH only, price is firm. We will do a transfer through FFL dealer--you pay cost of transfer.

**IF THE AD IS STILL ACTIVE, I STILL HAVE THE ITEM**"
30,http://www.armslist.com/posts/867030,For Sale:  Green Laser Viridian WP22 and paddle holster,"milwaukee, Milwaukee, Wisconsin",$ 150,"Listed On: Thursday, January 17, 2013",Optics,Sig Sauer                                                                                ,45 ACP                                                                                ,Semi-automatic                                                                                ,Rifle,like new viridian green laser for walther p22.  May fit others.  Model is viridian wp22.  I will also include my fobus paddle holster for the walther
31,http://www.armslist.com/posts/867031,For Trade:  DPMS AR15 with adj stock and 16.5 bbl 20 rounds thru it,"Russell Springs, Kentucky, United States",Offer,"Listed On: Thursday, January 17, 2013",Rifles,DPMS                                                                                ,223/5.56 NATO                                                                                ,Semi-automatic                                                                                ,Rifle,"LN AR-15 from DPMS, collapsible stock and short rifle barrel with carry handle.  Ready for you to customize the way you want or it's perfect as it is for limited spaces and smaller shooters.  Has been called the perfect girlfriend gun because it is light, small and maneuverable.
Looking to trade this for multiple guns, no-not 3 POS 22 rifles or 2 SKSs or 2 Hi-Points so please let's not waste time, in fact time is VERY LIMITED to get one of these if you or your kids ever want it!  I'm not into collector-grade SW, Colt etc so not interested in two model 20-whatever 38s or Python."
32,http://www.armslist.com/posts/867032,For Sale:  .223 55Gr,"North West, Knoxville, Tennessee",$ 400,"Listed On: Thursday, January 17, 2013",Ammo,DPMS                                                                                ,223/5.56 NATO                                                                                ,Semi-automatic                                                                                ,Rifle,"Complete Combat Load for M-16. 

6 Never opened 30 round magazines.
180 rounds .223 ammo, all on stripper clips and in a bandolier. Comes with 2 speed loaders for the stripper clips.
2 Ammo pouches.
All in a .50Cal ammo can.
$400   Alcoa or Knoxville  TN    406-3887"
33,http://www.armslist.com/posts/867033,For Sale:  Mosin Nagant 91/30 Stock w/ Sling,"South of Columbus, Columbus, Ohio",$ 30,"Listed On: Thursday, January 17, 2013",Gun,DPMS                                                                                ,223/5.56 NATO                                                                                ,Semi-automatic                                                                                ,Rifle,"Very nice Mosin Nagant stock in good condtion. COmes with sling, but plate, upper handguard , and clamps.
$30.00

This sell is for the stock and associated parts only. no firearm is included."
