,url,title,location,price,post date,category,manufacturer,caliber,action,firearm type,postcontent
277,http://www.armslist.com/posts/468277,"For Sale:  Collector quality Stevens ""Favorite"" 22lr","Indy's westside, Indiana, United States",$ 275,"Listed On: Thursday, July 12, 2012",Rifles,Stevens Arms                                                                                ,22 Long Rifle                                                                                ,Single Shot                                                                                ,Rifle,Great original condition. Bore is nice and so it the rifling. This is a model 1915.
278,http://www.armslist.com/posts/468278,For Sale:  Hanover Arms CO. Double barrel shotgun,"stevensville, Maryland, United States",$ 100,"Listed On: Thursday, July 12, 2012",Shotguns,no type,12 Gauge                                                                                ,Side by Side                                                                                ,Shotgun,I bought this Shotgun from an estate auction years ago with another matching double barrel. Email if your interested.
279,http://www.armslist.com/posts/468279,For Sale/Trade:  Colt Python Elite .357,"Campbellsville, Kentucky, United States","$ 2,500","Listed On: Thursday, July 12, 2012",Handguns,Colt                                                                                ,357 Magnum                                                                                ,Double / Single Action                                                                                ,Revolver,"For Sale i have a Beautiful Royal Blue Colt Python Elite. It has a 4"" Barrel and is a .357 and was manufactured in Colt's Custom Shop Only. Gun is absolutely in Mint Condition and is by far the best looking Python i have seen or ever owned. It includes two sets of grips, one being the Factory wood Elite grips and the other set being a set of Colt Rubber grips. It does include the Box and Python Manual as well. If you have any questions, feel free to call or ask. Thanks and have a Great Day!"
280,http://www.armslist.com/posts/468280,For Sale:  Custom Precision Rifle,"Westminster, Denver, Colorado","$ 1,500","Listed On: Thursday, July 12, 2012",Rifles,no type,308/7.62 NATO                                                                                ,Bolt Action                                                                                ,Rifle,"Up for sale is a custom built precision rifle.  It is built off of a Howa 1500 action that has been blue printed and trued, McMillan A5 Tactical stock and the action has been bedded to the stock, Shilen match barrel with a 1/10 twist, tactical bolt handle.  Most of the work has been done by Phoenix custom rifle's. 

I am asking $1,500 OBO.  Will consider partial trades plus cash."
281,http://www.armslist.com/posts/468281,For Sale/Trade:  Kimber Pro Carry 2 with Crimson Trace,"Near Wooster, Ohio, United States",$ 1,"Listed On: Thursday, July 26, 2012",Handguns,Kimber                                                                                ,45 ACP                                                                                ,no type,Pistol,"Kimber Pro Carry 2, very well taken care of and hardly shot at all. It is dead on accurate and the trigger is amazing. Has the crimson trace laser grips."
282,http://www.armslist.com/posts/468282,For Sale:  Ruger Vaquero 44 Mag SS,"East side, Colorado Springs, Colorado",$ 600,"Listed On: Thursday, July 12, 2012",Handguns,Ruger                                                                                ,44 Magnum                                                                                ,Single Action                                                                                ,Revolver,"Ruger Vaquero 44 Mag Stainless Steel 5.5 in barrel 95% condition upgraded Ruger rosewood grips, in the box $600 OBO. Ruger dose not make this gun anymore."
284,http://www.armslist.com/posts/468284,For Sale:  800,"Florida, Florida, United States",$ 800,"Listed On: Thursday, July 12, 2012",Handguns,Colt                                                                                ,10mm                                                                                ,Single Action                                                                                ,Pistol,"This auction is for a Colt DELTA ELITE 10mm semi-auto pistol with the “Ultimate” brite Stainless Steel finish. This pistol is in excellent condition, having fired less than 200 rounds. The Delta Elite features a 5” barrel, black neoprene grip and high profile 3-dot sights. It is in the original blue molded factory case with owner manual. Two 8 round magazines are included. Weight is 38 oz. This model was made from 1989 to 1993."
285,http://www.armslist.com/posts/468285,"For Sale:  Armalite AR-10 w/ 16"" barrel","Fairfield, Ohio, Cincinnati, Ohio","$ 2,500","Listed On: Thursday, July 12, 2012",Rifles,Armalite                                                                                ,308/7.62 NATO                                                                                ,Semi-automatic                                                                                ,Rifle,"I have an Armalite AR-10 w/ 16"" barrel. It has a two stage national match trigger, a Nikon Monarch  4-16 x 42 mil-dot scope w/ Tenebrex killflash, Magpul buttstock, Magpul mid-length forend, and Magpul vertical grip (all in FDE), a Harris bi-pod, and 4 magazines. I have the hardcase it came in. I bought it at Shooters in Independence, Ky. about 2 years ago. It has less than 200 rounds through it. Amazing trigger and factory guaranteed accuracy.


Trades: Looking for a nice built Long distance Sniper Rifle Setup, Or Maybe a Scar 17 FDE. Any high end long distance rifle set up, make offers doesn't hurt to ask. Looking for a spotters scope in the trade deal also."
286,http://www.armslist.com/posts/468286,For Sale:  NIB Kimber 22 conversion kit,"Near Wooster, Ohio, United States",$ 275,"Listed On: Thursday, July 26, 2012",Handguns,no type,no type,no type,no type,Kimber .22 conversion kit that will fit on most 1911s.
287,http://www.armslist.com/posts/468287,For Sale/Trade:  Savage model 10 .308,"greensboro, Greensboro, North Carolina","$ 1,200","Listed On: Sunday, August 5, 2012",Rifles,Savage Arms                                                                                ,308/7.62 NATO                                                                                ,Bolt Action                                                                                ,Rifle,"Tactical stock, been glass bedded, SWFA Super Sniper 16X42 riflescope, sliding rail w bipod adapter, bipod included. Ken Farrell 15MOA scope base with LEupold Quick Detach 30mm rings. Bolt Lift kit, eagle stock pack with storage pocket and shell loops. Comes with 100 rounds of handloaded ammo. $1,200 OBO Or trade for lower end ar 10 or can add cash with trade for nicer Ar 10."
288,http://www.armslist.com/posts/468288,For Sale/Trade:  Kimber Pro Carry 2 with 22 conversion kit,"near Wooster, Ohio, United States",$ 1,"Listed On: Tuesday, July 31, 2012",Handguns,Kimber                                                                                ,45 ACP                                                                                ,no type,Pistol,"Have a Kimber Pro Carry 2 with crimson trace laser grips, the kimber is in great shape and is very accurate and was hardly shot. It also comes with the NIB kimber 1911 conversion kit."
289,http://www.armslist.com/posts/468289,For Trade:  New Glock 22 3rd generation for ???,"OKC, Oklahoma City, Oklahoma",Offer,"Listed On: Thursday, July 12, 2012",Handguns,Glock                                                                                ,no type,Striker Fire,no type,"I have a new 3rd generation model Glock 22, it has zero wear of any kind. It comes with everything factory. I just don't need this and the Glock 23 I already have. 

I am looking to trade for another handgun, open on offers. 
would like a smith m&p, ect. Just let me know. Thanks!

Please text me at REDACTED or e=mail. No calls..."
290,http://www.armslist.com/posts/468290,"For Sale:  Stevens ""Favorite"" 1915 .22 rifle","Far westside of Indy, Indiana, United States",$ 275,"Listed On: Thursday, July 12, 2012",Antique,no type,no type,no type,no type,Clean collector grade rifle with good bore and rifling. No alterations ever.
291,http://www.armslist.com/posts/468291,For Sale:  Japanese Arisaka rifle,"Bassett, Roanoke, Virginia",$ 350,"Listed On: Thursday, July 12, 2012",Rifles,no type,no type,Bolt Action                                                                                ,Rifle,"Japanese Arisaka rifle of the Imperial guard, This is a Japanese Arisaka Type 99. The rifle is chambered in the 7.7 Japanese cartridge. . The rifle has what it's original front sight and flip-up rear sight . Great piece of history open to trades or cash Make me an offer. 2768061746 martialway@yahoo.com"
292,http://www.armslist.com/posts/468292,For Sale:  12 Gauge pump action S&W shot gun,"Charleston, Charleston, South Carolina",$ 325,"Listed On: Thursday, July 12, 2012",Shotguns,Smith & Wesson                                                                                ,12 Gauge                                                                                ,Pump Action                                                                                ,Shotgun,Gun is in really nice shape and questions or more pictures on this gun please contact me please only serious buys will meet at the local gun range to shoot and transfer name price is at 325 obo
293,http://www.armslist.com/posts/468293,For Sale/Trade:  KAHR PM40,"okc, Oklahoma City, Oklahoma",$ 500,"Listed On: Thursday, July 12, 2012",Handguns,Kahr                                                                                ,40 S&W                                                                                ,Double Action                                                                                ,Pistol,"perfect cc pistol. like new. comes with everything, as shipped. might do some trading for a full size pistol."
294,http://www.armslist.com/posts/468294,"For Sale:  Remington 32 Rim Fire Octogon BBL. Ilion,N.Y.","Frazeysburg, Columbus, Ohio",$ 300,"Listed On: Thursday, July 12, 2012",Antique,no type,no type,no type,no type,"Great shape, Good Riflings


Call--- REDACTED  Or REDACTED"
295,http://www.armslist.com/posts/468295,For Sale:  Japanese Arisaka rifle,"bassett, Roanoke, Virginia",$ 350,"Listed On: Thursday, July 12, 2012",Antique,no type,no type,no type,no type,"Japanese Arisaka rifle of the Imperial guard, This is a Japanese Arisaka Type 99. The rifle is chambered in the 7.7 Japanese cartridge. . The rifle has what it's original front sight and flip-up rear sight . Great piece of history open to trades or cash Make me an offer. REDACTED REDACTED"
296,http://www.armslist.com/posts/468296,For Sale/Trade:  Walther PK 380 with Walther laser,"Auburn, Alabama, United States",$ 450,"Listed On: Thursday, July 12, 2012",Handguns,Walther                                                                                ,380 ACP                                                                                ,no type,Pistol,"Walther PK380 with Walther laser made for the gun so fit is flush, sleek, and tight. Where the red dot is is where the bullet goes. Mag, papers, takedown tool, and hard case.
Everything looks brand new because it sits in its case. More looked at and admired than shot.

Great gun, looking for something a little smaller for pocket carry, preferably a ruger LCP with laser and ammo and holsters or a Bodyguard .38 with the same rig., or Mossberg 500 or Remington 870 I dont mind trading down a little. I can meet."
297,http://www.armslist.com/posts/468297,"For Sale:  U.S. WWI Colt Model 1911 -- .45 ACP Semi Auto Pistol, Mf'd 1914 - C&R OK","new York, New York, United States","$ 1,000","Listed On: Thursday, July 12, 2012",Handguns,Colt                                                                                ,45 ACP                                                                                ,Single Action                                                                                ,Pistol,"LSB#: 120507SE01

Make: Colt

Model: 1911

Serial Number: 93700

Year of Manufacture: 1914

Caliber: .45 ACP

Action Type: Semi Auto, Magazine Fed

Markings: The left side of the slide is marked “Patented Apr. 20. 1897.Sept.9.1902 / Dec.19.1905.Feb.14.1911.Aug.1913”, and “Colt’s PT.F.A. Mfgt. Co. / Hartford, CT. U.S.A.”. and a rampant Colt no circle. The right side of the slide is marked “Model of 1911 U.S.Army”. The back of the slide is marked “H”, for Frank Hosmer. The left side of the frame is marked “United States Property”. Behind the trigger is the stamp for Walter G. Penfield (Jan 21911-Sept. 30, 1914) . The top of the receiver is marked “H” for Frank Hosmer, and “b”, for Jas Malloy. The markings on the frame and slide are correct. The barrel has markings “Colt 45 Auto”, and “P” on the lug. These barrel markings are for pistols from serial number 710,000- 1945.

Barrel Length: 5”

Sights / Optics: This pistol is mounted with standard military sights. A blade front sight and a notch in a dovetail rear sight.

Stock Configuration & Condition: The grips are correct diamond pattern checkered wood. The checkering has become smooth. There are compression marks and wear on both panels and some smoothing/rounding at the bottoms but there are no chips cracks or losses. The grips rate in about Good overall condition.

Type of Finish: Blue

Finish Originality: The finish is likely an old re-blue. There is some pitting under the blue on the top of the slide.

Bore Condition: The bore is a little gray and the rifling is sharp and deep. There is mild erosion in the flats. The bore is very shootable.

Overall Condition: This pistol retains about 40% of its metal finish. The entire surface has become mottled with mixed patches of blue and wear down to the brown colored metal. There are a few patches of surface rust, on both sides of the frame above and around the trigger guard, and on the right side at the hammer. There is a small amount of surface rust on the left front of the slide and above the ejection port. The barrel shows wear and finish loss on the top surface at the lugs extending to the back of the barrel. The magazine shows its correct two tone finish with some pinprick erosion on the sides. There are some dings along the backstrap. The Screw heads are sharp and not disfigured. The markings are clear. Overall, this gun rates in about Good condition especially for its age.

Mechanics: The action functions correctly. We have had this pistol apart several times and it is functionally correct. We did not fire this pistol.

Box, Paperwork & Accessories: One correct two tone magazine with lanyard ring is provided.

Our Assessment: This is a correct 1914 U.S. marked Colt 1911 except for the barrel. The grips, frame, inspector marks, magazine, all correctly check out, only the barrel is not original manufacture. However, the barrel is correct Colt from serial number 710,000 all the way to 1945. So this is still be an all “U.S.” pistol."
298,http://www.armslist.com/posts/468298,For Sale:  SKS With Accessories,"Winston-Salem/North Davidson, Winston Salem, North Carolina",$ 400,"Listed On: Thursday, July 12, 2012",Rifles,no type,7.62x39                                                                                ,Semi-automatic                                                                                ,Rifle,"I have a Yugo SKS with the Tapco T-6 Adjustable AR style Stock, Tapco 922R Compliance kit, Buffer Technologies recoil reducing bolt buffer and NC Star Long Eye Releif Scope. It comes with the pop up grenade site, and barrel fitted grenade launcher. AK47 Style Iron sights with Folding blade bayonet. I have 3 - 30 Round polymer promag magazines and 1-20 Round polymer tapco magazine. This weapon is in great shape and i keep it very clean. Its a great shooter and very accurate. Hate to get rid of it and i have about 475.00 invested just in the weapon and magazines. No scope mounted and 20 round mag in pic. If the picture is too small to see hit the refresh button on your browser. Asking 400.00     CALL TEXT OR EMAIL REDACTED"
299,http://www.armslist.com/posts/468299,Want To Buy:  will trade for or buy 577 snider,"Council Bluffs Ia...Omaha metro area, Iowa, United States",Offer,"Listed On: Thursday, July 12, 2012",Antique,no type,no type,no type,no type,I am looking to buy or trade for a 577 snider rifle in good condition..I have a IAB 1863 Sharps replica (54 caliber) in excellent condition for trade.
300,http://www.armslist.com/posts/468300,For Sale:  Trijicon Tri-Power with Larue mount,"Westminster, Denver, Colorado",$ 650,"Listed On: Thursday, July 12, 2012",Tactical,no type,no type,no type,no type,"For sale is a Trijicon Tri-Power with Larue LT129 mount.  The optic and mount have been painted OD green.  I am asking $650 if you bought these separately this package would run you $900.

The optics are clear and in great condition.  If you have any questions please feel free to ask"
301,http://www.armslist.com/posts/468301,For Sale/Trade:  Ruger Security Six 357 magnum,"Del City, Oklahoma City, Oklahoma",$ 375,"Listed On: Thursday, July 12, 2012",Handguns,Ruger                                                                                ,357 Magnum                                                                                ,Double / Single Action                                                                                ,Revolver,"Real nice gun, I give it a 10, 4 inch all blue all orignal, made in 1974.
I also have 60 rounds of assorted hp ammo to go with it."
302,http://www.armslist.com/posts/468302,For Sale:  Glock 23 Gen4,"Greenville, Dayton, Ohio",$ 550,"Listed On: Thursday, July 12, 2012",Handguns,Glock                                                                                ,40 S&W                                                                                ,Striker Fire                                                                                ,Pistol,Glock 23 Gen4. comes with 3-13rd factory mags and 1 15-rd factory mag. 100 rds of Tula 250 Federal FMJ 50rds American Eagle FMJ 20 rds Hornady zombie max 26 rds of Winchester White box hollow points. Also included will be a Blackhawk level 2 with paddle and belt accessory. Comes in original Glock box with the original Reciept of sale. Txt @ REDACTED for pics and offers. Must be 21 with a valid Ohio DL CCW holders preferred but not necessary. Have over 700 in this so please no low ball offers. Only 2 mags have been shot through it.
303,http://www.armslist.com/posts/468303,For Sale:  Savage Model 29-A 22 Pump,"Frazeysburg, Columbus, Ohio",$ 300,"Listed On: Thursday, July 12, 2012",Antique,no type,no type,no type,no type,"Good Shape and Good riflings

Call REDACTED  or REDACTED"
304,http://www.armslist.com/posts/468304,For Trade:  Romanian Wasr-3 AK-47,"Southwest Houston,Bellaire/Boone, Houston, Texas",Offer,"Listed On: Thursday, July 12, 2012",Rifles,Century International Arms                                                                                ,223/5.56 NATO                                                                                ,Semi-automatic                                                                                ,Rifle,"Hello,
I want to trade my romanian wasr 3 ak 47 shoot in .223 for a Romanian Wasr 10/63 Ak47 shoot in 7.62.

If interested text me at REDACTED

Also text me for picture.(reply with your email so i can send you the picture)"
305,http://www.armslist.com/posts/468305,For Sale/Trade:  Beretta 92fs,"Tampa/ Brandon, Tampa/St. Pete, Florida",$ 540,"Listed On: Thursday, July 12, 2012",Handguns,Beretta USA                                                                                ,9mm Luger (9x19)                                                                                ,Double / Single Action                                                                                ,Pistol,"I have a lightly used Beretta 92fs(M9), It is in like new condition and would come with the box and 2 mags. I would rather trade up or down but might sell. Texting is best but you can call or email too, 813-4zero5-697zero."
307,http://www.armslist.com/posts/468307,For Sale:  WTT AR,"South, Columbus, Ohio",$ 900,"Listed On: Thursday, July 12, 2012",Rifles,no type,223/5.56 NATO                                                                                ,Semi-automatic                                                                                ,Rifle,"Wanting to trade AR-15 for nice Ak-47 or 1911.  Gun is in 5.56 with 1 in 9 twist, carbine gas system.  RRA lower parts kit, magpul furniture and gun is coated with tactical flat dark earth dura coat.  Contact through email is fastest response.  Would prefer no WASR 's please."
308,http://www.armslist.com/posts/468308,For Sale/Trade:  MPA Protector (.380) NIB,"Morrow, Cincinnati, Ohio",$ 265,"Listed On: Thursday, July 12, 2012",Handguns,MasterPiece Arms                                                                                ,380 ACP                                                                                ,Double Action                                                                                ,Pistol,"I have a new never fired Master Piece Arms (MPA) Protector. This is the smallest .380 on the market. It is chambered in .380ACP and holds 5+1. Weighs only 11.8oz! Comes with original box and manual. 

I am open to just about anything for trade. I prefer to sell to CCW permit holders and can provide a bill of sale."
309,http://www.armslist.com/posts/468309,For Sale:  kimber Ultra Carry 2 with Night Sights,"Littleton, Denver, Colorado",$ 850,"Listed On: Monday, August 13, 2012",Handguns,Kimber                                                                                ,45 ACP                                                                                ,Single Action                                                                                ,Pistol,"I have a very nice Kimber Ultra Carry 2 with Night Sights and rosewood grips. It has very low round count (about 150)and is a .45 acp. Finish is nearly flawless. 

Kimber makes very nice guns and this gun in particular is a great CCW. 

$850
maybe interested in a nice AR15
no felons must be 21+

Call or Text Steve at REDACTED"
310,http://www.armslist.com/posts/468310,For Sale:  Taurus PT140 Pro,"Tulsa, Tulsa, Oklahoma",$ 380,"Listed On: Thursday, July 12, 2012",Handguns,Taurus                                                                                ,40 S&W                                                                                ,Single Action                                                                                ,Pistol,"i have a Taurus pt140 pro series .40 Calibur pistol for sale. Comes with case, 2 clips, holster, and box of 50 rounds of ammo. If interested you may text me at 918-two77-six687, thanks."
312,http://www.armslist.com/posts/468312,For Sale:  Faxton double barrel shotgun,"stevensville, Maryland, United States",$ 100,"Listed On: Thursday, July 12, 2012",Shotguns,no type,12 Gauge                                                                                ,Side by Side                                                                                ,Shotgun,"Faxton double barrel shotgun, old gun bought at an auction used as a wall hanger. Email if your interested."
313,http://www.armslist.com/posts/468313,For Sale:  SpringField Armory XD 45 w/ extras.,"sharonville/loveland/cincinnati, Cincinnati, Ohio",$ 400,"Listed On: Tuesday, July 17, 2012",Handguns,Springfield                                                                                ,45 ACP                                                                                ,no type,Pistol,"Springfield Armory XD .45 cal. - 4""

Great Condition - Nice as New.

I will also include :

-- (2) ""Extended"" Round Magazines to go along with the orginal(12 rounds)
-- (1) Galco ""Small Of Back"" Leather Holster. (model sob444)
-- (1) Gun Cleaning Kit.

Email or feel free to forward a phone number for further info.

for sale .... no trades please."
314,http://www.armslist.com/posts/468314,For Sale:  savage,"belton, Greenville, South Carolina",$ 300,"Listed On: Thursday, July 12, 2012",Rifles,Savage Arms                                                                                ,22 Magnum                                                                                ,Bolt Action                                                                                ,Rifle,"savage target model target scope and mounts
 excellent condition 
fluted bull barrel
bolt action 
target trigger 
can send pics"
315,http://www.armslist.com/posts/468315,"For Sale:  BULLDOG NYLON Shotgun Case 35"" BLK","West Albuquerque, Albuquerque, New Mexico",$ 20,"Listed On: Thursday, July 12, 2012",Tactical,no type,no type,no type,no type,"Product Specifications

    UPC Code: REDACTED22
    Manufacturer: Bulldog Cases
    Model: Tactical
    Type: Single Shotgun

    Finish/Color: Black
    Frame/Material: Soft
    Size: 35""
    Manufacturer Part #: BD492"
