,url,title,location,price,post date,category,manufacturer,caliber,action,firearm type,postcontent
0,http://www.armslist.com/posts/468000,For Sale:  2003 V-ROD,"Blanchard, Oklahoma City, Oklahoma","$ 8,500","Listed On: Friday, July 20, 2012",Vehicles,no type,no type,no type,no type,"100th Anniversary V-ROD with 25K+ miles, well maintaned with cored out factory exhaust and a Power Commander 3 running a stage 1 map for a little sound. The seat is a sundowner with matching pillion and back rest.  I have a the original exhaust unmodified, a set of the HD 03' saddle bags, and original seat. All service manuals & HD tool kit as well."
1,http://www.armslist.com/posts/468001,For Sale:  American Western Arms Longhorn in .357,"Farragut / Hardin Valley, Knoxville, Tennessee",$ 285,"Listed On: Wednesday, July 11, 2012",Handguns,no type,357 Magnum                                                                                ,Single Action                                                                                ,Revolver,"This is an American Western Arms Longhorn revolver in .357 caliber, with a 5.5"" barrel. It has a blued finish and walnut grips. The gun is a replica of a Colt Single Action Army, and it is reported that the internals are Colt-compatible if you need replacement parts. The gun is in great condition. All bluing is intact and there are no scratches or wear marks that I can find. Although I bought it used, I don't think it saw very much use at all. I have put a few hundred rounds through it with no malfunctions. This style of gun sometimes has problems with light primer strikes. That doesn't seem to be an issue with this one, as I have had zero malfunctions in the time I've had it."
2,http://www.armslist.com/posts/468002,For Sale:  marlin 917v .17hmr,"Phenix city, Columbus, GA, Georgia",$ 1,"Listed On: Wednesday, July 11, 2012",Rifles,Marlin                                                                                ,17 HMR                                                                                ,Bolt Action                                                                                ,Rifle,Marlin 917v .17hmr bolt action with simmons 44 mag scope. Looking to trade for other guns. Mainly handguns.
3,http://www.armslist.com/posts/468003,For Sale:  2880 rounds Wolf 124 gr. JHP and FMJ,"Farragut / Hardin Valley, Knoxville, Tennessee",$ 500,"Listed On: Wednesday, July 11, 2012",Ammo,no type,no type,no type,no type,"Wolf 124 grain 7.62x39mm. Steel case. 1380 rounds are in 20-round packs. The rest (approximately 1500 rounds) is loose. Loose ammo was counted by weight, and rounded down to the nearest 100 to make sure you're getting a fair deal. Loose ammo is 99% FMJ, but there are a few JHP mixed in from boxes that I opened accidentally. 20-round packs are mixed JHP and FMJ--I have not taken them all out to count how many of each there are. Polymer dry-boxes are included at no additional charge.

This ammo sells for between $0.23 and $0.25 per round, plus shipping, in bulk quantity online. My price works out to $0.17 per round, and zero shipping. This ammo is as fresh as the day it was made, but since it's a private party sale, I'm well aware nobody is going to pay new-in-box prices. This will be a real steal to somebody who shoots a lot of 7.62x39.

I would prefer to sell this locally, to avoid you having to pay shipping on it, but I am willing to ship it wherever you like, as long as you're willing to pay the shipping :-)"
4,http://www.armslist.com/posts/468004,For Sale/Trade:  .327 Fed Mag,"Jenks, Tulsa, Oklahoma",$ 250,"Listed On: Saturday, September 29, 2012",Ammo,no type,no type,no type,no type,"***SOLD ***

500 rounds American Eagle, JSP, 100 gr"
6,http://www.armslist.com/posts/468006,For Sale:  rock island .22 tcm,"manchester,tn, Nashville, Tennessee",$ 500,"Listed On: Wednesday, July 11, 2012",Handguns,Rock Island Armory                                                                                ,9mm Luger (9x19)                                                                                ,no type,Pistol,this is a new round recently released by Armscor and R.I.A it is a bottled necked .223 round inside a 9mm casing. it has a 1 17 round clip and also has a 9mm barrel and extractor. so it's two guns in one!! also it is a A2 frame 1911. very neat gun to have in your collection.
7,http://www.armslist.com/posts/468007,For Sale:  12 guage reduced tonight only,"Franklin, Indiana, United States",$ 2,"Listed On: Thursday, June 27, 2013",Shotguns,no type,no type,no type,Shotgun,"single shot Iver Johnson 1905 champion 12
good condition for the age. No cracks in the stock.
Would make a Great Wall hanger. 

$150 

Reduced to $100 tonight only 

txt REDACTED"
8,http://www.armslist.com/posts/468008,For Trade:  Looking to trade out some of my mosin collection for a shotgun,"SW Fort Wayne, Fort Wayne, Indiana",$ 1,"Listed On: Wednesday, July 11, 2012",Shotguns,no type,12 Gauge                                                                                ,Pump Action                                                                                ,Shotgun,"I have a small mosin nagant collection that i was considering selling or trading off.  Im really interested in shotguns at the moment so i would get much more use out of that than one of my mosins.  Im only interested in pump or semi auto shotguns though.  I also have allot of 7.62 x 54 ammo that i can trade to make the right deal.  My mosin collection consists of two 91/30s, an M39, and a chinese type 53.  They are all in really good condition.  I can provide a pic or specific details if needed.  Thanks,  Mike"
9,http://www.armslist.com/posts/468009,For Sale:  custom piston ar-15 upper,"st.charles, St. Louis, Missouri",$ 700,"Listed On: Wednesday, July 11, 2012",Rifles,no type,223/5.56 NATO                                                                                ,Semi-automatic,no type,"THIS IS JUST FOR THE UPPER NOT A COMPLETE RIFLE, LOWER NOT FOR SALE!!!
Stag upper
Stag 16in barrel chrome lined 1/9 twist 
Samson Star free float rail
Adam Arms Carbine Piston Kit
Troy rail covers
brand new LMT bolt,firing pin,cam pin, 
upper has +/- 600 rounds through it, adams arms kit has about 200 rounds on it and the bolt is brand new 0 rounds 
$700 obo 

the items with the red on them are obviously marked out for a reason and that is because they are not included with the upper."
10,http://www.armslist.com/posts/468010,For Sale/Trade:  Sig Sauer P250 .40cal,"Glendale, Phoenix, Arizona",$ 400,"Listed On: Wednesday, July 11, 2012",Handguns,Sig Sauer                                                                                ,40 S&W                                                                                ,Double Action                                                                                ,Pistol,"I am selling a full-size Sig Sauer P250 in .40cal. Like new condition, only 150 rounds down the barrel.

Includes:
P250 .40
Tactical holster
Original case, lock, cleaning kit, and paperwork
Two 14-round magazines
I will include the NcSTAR green laser sight for $50 more

$400 ($450 with laser); I am also open to trades, just ask.

Text me at REDACTED or reply to this ad. Valid AZ drivers license required. Must be 21+"
11,http://www.armslist.com/posts/468011,For Sale:  Ruger American Rifle .308,"North Springfield, Springfield, Missouri",$ 375,"Listed On: Monday, August 27, 2012",Rifles,Ruger                                                                                ,308/7.62 NATO                                                                                ,Bolt Action                                                                                ,Rifle,"New in box, never fired Ruger American Rifle in .308 looking for a good home.

Check out www.ruger.com/products/americanRifle/index.html for more specs and info about this rifle."
12,http://www.armslist.com/posts/468012,For Sale/Trade:  14.5 Inch Colt Upper,"Perrysberg, Toledo, Ohio",$ 1,"Listed On: Wednesday, July 11, 2012",Rifles,Colt                                                                                ,223/5.56 NATO,no type,no type,"Hello. I got an AR in a trade and it came with a Colt 14.5"" upper with a 1.5"" flash suppressor. It has a tan Midwest Industries rail on it and no carrying handle. The flash suppressor is pinned to make it legal. I am looking to sell this so I can get a new upper so I can take the suppressor on and off to use a golf ball launcher. I am looking to sell it for best offer or trade it for a 16 inch upper and would like the upper to have a rail."
13,http://www.armslist.com/posts/468013,For Sale:  < LNIB > CZ75 SP-O1 Phantom 9mm  W/night sights,"NE oklahoma, Oklahoma, United States",$ 645,"Listed On: Wednesday, July 11, 2012",Handguns,CZ USA                                                                                ,9mm Luger (9x19)                                                                                ,Double / Single Action                                                                                ,Pistol,"LNIB CZ75 SP-01 Phantom 9mm with night sights for sale
fired 175rds through this gun and it is very sweet!!
Pristine condition and prretty hard to find
has 2 - 18rd mags , case and maual and cleaning brush
asking 645..........
call or text for pics or questions
479-236-468zero.....thanks"
14,http://www.armslist.com/posts/468014,For Sale:  Glock 23,"Vail, Tucson, Arizona",$ 500,"Listed On: Wednesday, July 11, 2012",Handguns,Glock                                                                                ,40 S&W                                                                                ,Striker Fire                                                                                ,Pistol,"Glock 23 for sale or trade. I will include two magazines and a holster.

I am open to many firearm trades. No trades for non firearm items."
16,http://www.armslist.com/posts/468016,For Sale:  Magpul MS3 Multi-Mission Sling,"North Charleston, Charleston, South Carolina",$ 35,"Listed On: Wednesday, July 11, 2012",Tactical,no type,no type,no type,no type,"Unopened, new in package.  Third-generation Magpul weapon sling with one- or two-point functionality, sturdy webbing strap and solid metal buckles.  Usually retails for at least $50.00 or more."
17,http://www.armslist.com/posts/468017,For Sale:  NAA .22lr Mini revolver  NIB,"Tuscaloosa, Tuscaloosa, Alabama",$ 175,"Listed On: Wednesday, July 11, 2012",Handguns,North American Arms                                                                                ,22 Long Rifle                                                                                ,Single Action                                                                                ,Revolver,"NAA .22lr mini 5 shot revolver. only carried a couple times but never fired. $175 CASH ONLY, Call Or Text REDACTED."
18,http://www.armslist.com/posts/468018,"For Sale:  Colt Trooper MKV 4""","Surprise, Phoenix, Arizona",$ 550,"Listed On: Wednesday, July 11, 2012",Handguns,Colt                                                                                ,357 Magnum                                                                                ,Double / Single Action                                                                                ,Revolver,"Great condition Colt Trooper Mk V .357 Magnum with 4"" barrel. This is a nickel plated revolver without the original box and paperwork. Grips are Great and nickel finish shows very light wear. This gun has not been fired much in the last 25 years. Pictures do not do this gun justice. Original nickel finish never polished so all markings remain nice and crisp. 

Will ship to FFL 

Reply or Text REDACTED"
19,http://www.armslist.com/posts/468019,"For Sale/Trade:  Dan Wesson 357 6""","Blue River, Eugene, Oregon",$ 375,"Listed On: Wednesday, July 11, 2012",Handguns,Dan Wesson                                                                                ,357 Magnum                                                                                ,Double / Single Action                                                                                ,Revolver,"Very clean Dan Wesson 357 mag.  6"" barrel. Very clean small blue wear on the tip and a little grip wear but very clean otherwise, the rifling in the bore is very crisp. Will come with 200 rounds of ammo with a full price offer. $375 or $350 if you come pick it up! you can even shoot it if you drive out to me."
20,http://www.armslist.com/posts/468020,For Trade:  M&P SHIELD 9MM,"elkhart, South Bend, Indiana",Offer,"Listed On: Wednesday, July 11, 2012",Handguns,Smith & Wesson                                                                                ,9mm Luger (9x19)                                                                                ,Striker Fire                                                                                ,Pistol,"this is a like new m&p shield 9mm,i bought it thinking it would be a good cc gun. i prefer something a little bigger. it will come with both mags and everything that came from the factory less then 50 rounds down range with out a single issue. what i am looking for is an m&p 9c or fullsize or a glock 26 or 19 any generation"
21,http://www.armslist.com/posts/468021,Want To Buy:  Revolver Or Semi-Auto Handgun,"Glendale, Phoenix, Arizona",$ 350,"Listed On: Wednesday, July 11, 2012",Handguns,Taurus                                                                                ,357 Magnum                                                                                ,Double / Single Action                                                                                ,Revolver,"Looking to buy a new handgun. I would prefer a revolver chambered in .357 but am open to offers on .38 Special and Semi Auto handguns (no .22s or 380s please). As for revolvers, not looking for any snub noses, and would like a 4"" or longer barrel. As for Semi Autos, not looking for any compacts. Just shoot me an email with a picture of the gun and about how much you are seeking for it and we can talk from there. 
Thanks in advance and happy hunting!"
23,http://www.armslist.com/posts/468023,For Trade:  Speakers - Definitive Technology Mythos One Towers,"Cincinnati, Cincinnati, Ohio",Offer,"Listed On: Wednesday, July 11, 2012",Rifles,no type,no type,Semi-automatic,no type,"I would like to trade my definitive technology mythos one towers that retail for $999.99 each. I have 2 of them and they have never been used.  They are brand new. I would like to trade for ar 15, ak 47 or 1911s. If interested email me at REDACTED. Thanks

Heres the website on the speakers
http://www.definitivetech.com/products/products.aspx?path=Speakers_By_Series|Mythos_Series&productid=Mythos_One"
24,http://www.armslist.com/posts/468024,"For Sale:  Mossberg 835 ""Ulti-mag"" with 19"" barrel","Tuscaloosa, Tuscaloosa, Alabama",$ 250,"Listed On: Wednesday, July 11, 2012",Shotguns,Mossberg                                                                                ,12 Gauge                                                                                ,Pump Action                                                                                ,Shotgun,"Mossberg 835 ""ulti-mag"" (3.5' chamber) that has had the original vented rib barrel profesionally cut down to 19"" to make it a home defense shotgun. This thing is AWESOME, i really hate to sell it, but i need the money now.. will take $250 CASH ONLY. Call or Text REDACTED."
25,http://www.armslist.com/posts/468025,For Sale:  Ruger new model Blackhawk .45,"Orting, Seattle, Washington",$ 600,"Listed On: Wednesday, July 11, 2012",Handguns,Ruger                                                                                ,45 ACP                                                                                ,Single Action                                                                                ,Revolver,"stainless steel 7 1/2 inch barrel. Shoots  .45acp and .45 long cult. 
has black hogue grips and also has original grips In brand new condition. 
Kept in perfect condition. Comes with shoulder holster.
Adjustable sights"
26,http://www.armslist.com/posts/468026,For Sale:  Bushmaster w/ Scope & 3 megs,"Steubenville, Ohio, United States",$ 850,"Listed On: Wednesday, July 11, 2012",Rifles,Bushmaster                                                                                ,223/5.56 NATO                                                                                ,Semi-automatic                                                                                ,Rifle,"Got the new a year ago, but have not shot it more than 100 rounds.

Open to any and all trade offers.  Looking for anything glock, .223, or 9mm

see more pics here: https://picasaweb.google.com/natenerd/AR15?authuser=0&authkey=Gv1sRgCKWwuIvxteHBSg&feat=directlink"
27,http://www.armslist.com/posts/468027,Want To Buy:  Mosin -Nagant,"Gig harbor, Seattle, Washington",$ 120,"Listed On: Wednesday, July 11, 2012",Rifles,no type,7.62x54R                                                                                ,Bolt Action                                                                                ,Rifle,"Hello, I am looking for a Mosin-Nagant, any model will be considered. I will spend $120, although I am willing to haggle. I would prefer to have all the regular accessories (Bayonet, Cleaning kit, Tool) included. Thank you."
28,http://www.armslist.com/posts/468028,For Sale:  like new xd 40 compact with gear and ammo-$500 CASH TODAY TAKES IT,"whiteland,in, Indianapolis, Indiana",$ 500,"Listed On: Wednesday, July 11, 2012",Handguns,Springfield                                                                                ,40 S&W                                                                                ,Striker Fire                                                                                ,Pistol,"gun is like new comes with case and paper work all xd gear,3 xd clips,2 12rd with sleeve and one 10 rd ,100 rds of target ammo and ,40 rds of personel protection ammo,call REDACTED not lookin for trades ,cash only ,if u dont like the price go buy a new one then. not tryin to be an ass just getting tired of hearing people COMPLAIN. if u want it buy it if not move on.thanks for your time. if u r a seriuos buyer call me .gun is very clean.ONLY REASON FOR SELLING IS TO GET MY YOUNGEST DAUGTER A DIRTBIKE
NO EMAILS AT ALL THEY WILL BE MARKED AS SPAM"
29,http://www.armslist.com/posts/468029,For Sale/Trade:  WESTERN FIELD ( MOSSBERG) WWII 22 CAL TRAINING RIFLE,"COLFAX WASHINGTON, Washington, United States",$ 350,"Listed On: Wednesday, July 11, 2012",Rifles,Mossberg                                                                                ,22 Long Rifle                                                                                ,Bolt Action                                                                                ,Rifle,"WESTERN FIELD ( MOSSBERG) WWII 22 CAL TRAINING RIFLE. BOLT ACTION ""  TUBE FEED""!  STANDARD , AS ISSUE, SPECIAL FRONT AND REAR SIGHTS. BARREL BAND, MONTY CARLO STOCK, MILITARY SLING, ORIGINAL SLING SWIVELS. ACTION DUST COVER.FRONT SIGHT IS ALSO HOODED. ORIGINAL BLUEING EXCELLANT CONDITION. WOOD STOCK IS BEAUTIFUL, DARK, ORIGINAL FINISH. THIS IS A VERY COLLECTABLE RIFLE. CONSIDER A NEW RUGER 10/22 WILL COST YOU ALMOST $300."
30,http://www.armslist.com/posts/468030,For Sale:  300 AAC Blackout brass and bullets  reloading components,"Decatur, Huntsville, Alabama",$ 50,"Listed On: Wednesday, July 11, 2012",Ammo,no type,no type,no type,no type,"- 60 rounds of once fired factory brass
-100 rounds that I formed from 223 cases that require some trimming down of the neck. 
- Hornady VMAX 308 110 gn (37 bullets)
- Hornady Interlock 308 150 gn (70 bullets)

will ship but buyer must add $10 for shipping, paypal required if shipping."
31,http://www.armslist.com/posts/468031,For Sale/Trade:  J C HIGGINS MODEL 25 22 SEMI AUTO RIFLE,"COLFAX WASHINGTON, Washington, United States",$ 250,"Listed On: Wednesday, July 11, 2012",Rifles,High Standard                                                                                ,22 Long Rifle                                                                                ,Semi-automatic                                                                                ,Rifle,J C HIGGINS MODEL 25 22 SEMI AUTO RIFLE. ORIGINAL J C HIGGINS 4X SCOPE AND MOUNTS. 100% ORIGINAL. EXCELLENT BLUEING AND WOOD FINISH. VERY GOOD EXAMPLE OF THIS MODEL.
32,http://www.armslist.com/posts/468032,Want To Buy:  Ar-15 Mags,"Panama, Florida, United States",$ 1,"Listed On: Wednesday, July 11, 2012",Tactical,no type,no type,no type,no type,I'm wanting to buy some bulk AR 15 223/ 556 mags.
34,http://www.armslist.com/posts/468034,For Sale:  Second Gen Glock 17,"East, Wichita, Kansas",$ 400,"Listed On: Wednesday, July 11, 2012",Handguns,Glock                                                                                ,9mm Luger (9x19)                                                                                ,Striker Fire                                                                                ,Pistol,"I have a second gen Glock 17 9mm that is in very good condition without any wear or scratches on the slide.  It does have the regular fixed sights, hogue slip on grip, two mags (17 and 33 round).  I am negotiable on prices, but please no trades.  I'm selling as I have another Glock and this one just sits around rarely used. Call or text REDACTED.  Thank you and I will send pictures upon request."
35,http://www.armslist.com/posts/468035,Want To Buy:  looking for a 5 mm rimfire,"henrietta, Rochester, New York",$ 1,"Listed On: Wednesday, July 11, 2012",Rifles,no type,no type,no type,no type,looking to see if anyone has a 5 mm rimfire they dont shoot anymore.
36,http://www.armslist.com/posts/468036,For Sale:  pea shooter,"bronx, Wisconsin, United States",$ 999,"Listed On: Wednesday, July 11, 2012",Handguns,Llama                                                                                ,475 Linebaugh                                                                                ,Double / Single Action                                                                                ,Derringer,Gun
37,http://www.armslist.com/posts/468037,For Sale/Trade:  National Match M1A competition kit,"Southside Oklahoma city, Oklahoma, United States","$ 2,250","Listed On: Wednesday, July 11, 2012",Rifles,Springfield                                                                                ,308/7.62 NATO                                                                                ,Semi-automatic                                                                                ,Rifle,"I have a National Match M1A (that with all national match parts from the factory) with a wooden stock. I have only fired 100 rds through the rifle.
This includes original case and paperwork. Also includes leather cheek piece, sling,4 mags (2-20,1-10,1-5), scope mount and scope, and cleaning kit. These are all G.I. Or Springfield OEM.
Also included is 1164 rds of belgian and British Radway 7.62 with stripper clips.  I also can throw in 460 rounds of rare lake city match/sniper 7.62 for $380
I can get pictures for the seriously interested.
This would be a good buy to start out in M1A shooting with.
I'm not in a hurry, or really hurting to sell this, but it would be nice if I could.
I do work for a living ( not retailing guns as some ""private"" people on here seem to do) so this means a few things:
I do work for my money, so I do know what it's worth, aka don't lowball me and that I do take of my hard earned possessions.Also note that I will answer you, but it can take a little while."
38,http://www.armslist.com/posts/468038,Want To Buy:  looking for varmint rifles,"southern monroe, Rochester, New York",Offer,"Listed On: Wednesday, July 11, 2012",Rifles,no type,no type,no type,no type,looking for new or used varmint rifles. any caliber will work.
39,http://www.armslist.com/posts/468039,"For Sale:  MAGNUM RESEARCH, JERICHO 941 BABY DESERT EAGLE II(SEMI-COMPACT)","Seattle, Seattle, Washington",$ 550,"Listed On: Wednesday, July 11, 2012",Handguns,Magnum Research                                                                                ,9mm Luger (9x19)                                                                                ,Double / Single Action                                                                                ,Pistol,"Gun is in excellent condition, it only has about 50 rounds down the barrel.  

MAGNUM RESEARCH, JERICHO 941 BABY DESERT EAGLE II(SEMI-COMPACT)


9MM Caliber
3.93"" Barrel
DA/SA
2-15RD Magazines
3 Dot Fixed Sights
Lower Picatinny Rail
Hammer Drop Safety w/ Trigger Disconnect
Instruction Manual
Spent Shell Casing Documentation
Cleaning Rod & Bore Brushes
Cable Lock & Factory Hard Case"
40,http://www.armslist.com/posts/468040,Want To Buy:  complete upper ar15 reciver,"fayeteville and surronding areas, Fayetteville, North Carolina",Offer,"Listed On: Wednesday, July 11, 2012",Rifles,no type,223/5.56 NATO                                                                                ,Semi-automatic                                                                                ,Rifle,if you have a complete upper reciver for an ar15 for sale or trade email me. im looking to finish building mine soon.
