,url,title,location,price,post date,category,manufacturer,caliber,action,firearm type,postcontent
482,http://www.armslist.com/posts/4569482,For Sale/Trade:  H&K USP and ATI 1911,"Ft. Benning, Columbus, GA, Georgia",$ 450,"Listed On: Saturday, August 1, 2015",Handguns,Heckler & Koch                                                                                ,40 cal                                                                                ,Double / Single Action                                                                                ,Pistol,"Hi, I've got three nice pistols for sale or trade. 
1) ATI m1911GI-E FX commander sized 1911. 45acp. Very low rd ct. Very nice and tight. Comes with original magazine, ammo, uncle mikes polymer paddle holster, ammo, generic case. $450 obo

2) H&K USP V1 full size .40s&w pistol with night sights, three mags, owb tagua holster, 200rds ball ammo. Nice used pistol. $700 obo

SOLD!!!  H&K USP Compact .45acp with brand new threaded barrel, non-threaded barrel, night sights, three high end holsters, two magazines, ammo, box and docs. SOLD!!!!!

Located on FT. Benning

No shotguns, .22lr weapons, bows, .17hmr, .380 weapons, hunting rifles"
483,http://www.armslist.com/posts/4569483,"For Sale:  S&W Performance Center 627 (5"")","Akron, Cleveland, Ohio",$ 800,"Listed On: Wednesday, August 12, 2015",Handguns,Smith & Wesson                                                                                ,357 Magnum                                                                                ,Double / Single Action                                                                                ,Revolver,"Excellent condition, just 40 rounds down range. Original box, docs and lock. Absolute tack driver!

Model: 627
Caliber: .357 Magnum / .38 S&W Special +P
Capacity: 8 Rounds
Barrel Length: 5""
Front Sight: Gold Bead Front (Interchangeable)
Rear Sight: Adjustable
Grip: Wood w/2nd Synthetic Included
Action: Single/Double Action
Trigger: .312 Chrome with Overtravel Stop
Hammer: Chrome Tear Drop with Pinned Sear
Frame Size: Large - Exposed Hammer
Finish: Matte Silver
Overall Length: 9.5""
Material: Stainless Steel Frame
Stainless Steel Cylinder
Weight Empty: 44 oz
Purpose: Competitive / Recreational / Home Protection
MSRP: $1289.00

Performance Center guns originate from standard designs or are created from the ground up. From hand-cutting and fitting to fine tuning for precision, these firearms are top performers. Products from the Performance Center are the ultimate expression of old-world craftsmanship blended with modern technology."
486,http://www.armslist.com/posts/4569486,"For Sale/Trade:  Ithaca Model 37 Featherlight 12 Ga. 20""","Plano, Dallas, Texas",$ 225,"Listed On: Wednesday, August 12, 2015",Shotguns,Ithaca                                                                                ,12 Gauge                                                                                ,Pump Action                                                                                ,Shotgun,"Used: 
Ithaca Model 37 Featherlight 12 ga. 
Has been cut to 20"" with no front bead. 
Comes with elastic 5 shot shell carrier for buttstock. 
Has been a great birdgun with sentimental value but needs to be sold.

$225 CASH OBO. 



FTF in PLANO AREA, MUST PRESENT VALID TX ID."
487,http://www.armslist.com/posts/4569487,For Sale/Trade:  Glock 22 gen 4 with extras,"Fond Du Lac, Wisconsin, United States",$ 600,"Listed On: Saturday, August 1, 2015",Handguns,Glock                                                                                ,40 S&W                                                                                ,Striker Fire                                                                                ,Pistol,"Glock 22 gen 4 excellent condition, minimal wear 200 rounds down range
Glock case, backstraps, 3 mags, loader

SarfariLand duty holster with spot for light
Pro tec elite light with strobe feature
50 box of Winchester 180gr

if you don't want the light make offer"
488,http://www.armslist.com/posts/4569488,For Sale/Trade:  B-West AK47s,"St. Louis, St. Louis, Missouri",$ 750,"Listed On: Saturday, August 1, 2015",Rifles,Norinco                                                                                ,7.62x39                                                                                ,Semi-automatic                                                                                ,Rifle,"This is an American made receiver made by B-West.  All matching numbers with beautiful matching wood furniture.  Included in this sale is gun with one steel magazine.  I am open to trades as well.  Asking price is $750 OR BEST OFFER

REDACTED"
489,http://www.armslist.com/posts/4569489,"For Sale:  FNH USA SCAR 17S New, Unfired W/4 20 Rd Magaines","Lubbock, Lubbock, Texas","$ 2,400","Listed On: Saturday, August 1, 2015",Rifles,FN Herstal S.A.                                                                                ,223/5.56 NATO                                                                                ,Semi-automatic                                                                                ,Rifle,"FNH USA SCAR 17S. This rifle is new, never fired. It is listed as ""used"" because I purchased it initially from a firearms dealer, but never fired it, or used it in any other manner. Email me best for more details   mitchellskillman498@yahoo.com

This rifle comes with four, 20 round magazines. It is .308 caliber. It also comes with FNH USA iron sites, and a new rifle bag. It does not come with FNH box or SCAR booklet."
490,http://www.armslist.com/posts/4569490,For Sale:  12 gauge new in box,"Pinellas, Tampa/St. Pete, Florida",FREE,"Listed On: Saturday, August 1, 2015",Shotguns,Remington                                                                                ,12 Gauge                                                                                ,Pump Action,no type,"I have anew iac 12 gauge 18.5 inches in length , 5+1 round capacity , modeled after the Remington 870 these are very solid shotguns Great affordable home defense 

150.00"
491,http://www.armslist.com/posts/4569491,For Sale:  S,"S, Dayton, Ohio",$ 1,"Listed On: Saturday, August 8, 2015",Rifles,no type,no type,no type,no type,1
493,http://www.armslist.com/posts/4569493,For Sale:  MARLIN MODEL 120 MAGNUM PUMP ACTION 12 GAUGE,"Cary, Raleigh / Durham / CH, North Carolina",$ 300,"Listed On: Saturday, August 1, 2015",Shotguns,Marlin                                                                                ,12 Gauge                                                                                ,Pump Action                                                                                ,Shotgun,"I have a Marlin Model 120 Magnum Pump Action 12 Gauge Shotgun for sale.  Pump action, fixed full choke, 30"" barrel, manufactured in 1971 per serial number & 3"" chamber.  Functions as it should. Asking $300 OBO.

Contact Russell at REDACTED if interested.  *MUST HAVE VALID NC ID*"
494,http://www.armslist.com/posts/4569494,For Sale:  Smith Wesson Model 36,"North Valley, Reno, Nevada",$ 450,"Listed On: Saturday, August 1, 2015",Handguns,Smith & Wesson                                                                                ,38 S&W Special                                                                                ,Double / Single Action                                                                                ,Revolver,"Smith Wesson Model 36 No Dash 38 Special. 3"" barrel, Nickel, Round Butt, Wood Grips. Excellent condition. Trigger work done locally. Double/single action very smooth. Unknown round count, very slight flame cutting which would indicate a low round count. Unfortunately I can't post photos but can send via email. Must be 21 with valid NV ID. Serious inquiries only, no tire kickers. No lowballers. $450 OBO"
495,http://www.armslist.com/posts/4569495,For Sale:  Springfield m1a socom 16,"South phx, Phoenix, Arizona","$ 1,500","Listed On: Saturday, August 1, 2015",Rifles,Springfield                                                                                ,308/7.62 NATO                                                                                ,Semi-automatic                                                                                ,Rifle,"I have a Springfield m1a socom 16 for sale comes with 3 20 Springfield mags,1 25, 1 10 and 1 5 rnd mag and 4 box of ammo"
496,http://www.armslist.com/posts/4569496,For Sale:  S&W Mod 10 PPC Revolver,"Rankin County, Jackson, Mississippi",$ 495,"Listed On: Saturday, August 1, 2015",Handguns,Smith & Wesson                                                                                ,38 S&W                                                                                ,Double / Single Action                                                                                ,Revolver,"S&W Mod 10 PPC Revolver,
6"" Bull Barrel,
Bo-Mar Sights,
Pachmayr Presentation Grips,
This is a older build, but the revolver will hit the target.
$495 Price is firm

Send a message here and we can make arrangements to meet
FTF in Pearl, MS"
497,http://www.armslist.com/posts/4569497,For Sale:  PMC X-TAC 5.56 55gr 800rds,"East of the metro, Kansas City, Missouri",$ 300,"Listed On: Saturday, August 1, 2015",Ammo,no type,no type,no type,no type,Selling 800 rounds of PMC xtac 55gr still packaged in the boxes of 20. Any questions just let me know. Thanks!
498,http://www.armslist.com/posts/4569498,For Sale:  PTR 91 .308 with Rail REDUCED!,"North, Springfield, Missouri",$ 850,"Listed On: Tuesday, November 10, 2015",Rifles,PTR Industries                                                                                ,308/7.62 NATO                                                                                ,Semi-automatic                                                                                ,Rifle,"This is a PTR 91 .308 semi-auto rifle.  Copy of the H&K 91.  It has about 40 rounds through it and is like new.   

It comes with a high quality rail that can be removed, but I am selling them together.  

It comes with the original hard case and magazine as well as over 20 surplus 20 round mags.  

Cash only.  PRICE REDUCED!"
499,http://www.armslist.com/posts/4569499,For Sale:  Remington 742 in 30/06 with scope,"East okc, Oklahoma City, Oklahoma",$ 400,"Listed On: Saturday, August 8, 2015",Rifles,Remington                                                                                ,30-06 Springfield                                                                                ,Semi-automatic                                                                                ,Rifle,Good old Remington 742 has pine ridge scope with weaver mounts and rings. Not perfect but a good shooter. Call or text. No email REDACTED
500,http://www.armslist.com/posts/4569500,For Sale:  MPA10SST Masterpiece Arms .45 cal Like New $450.00,"maquoketa, Davenport, Iowa",$ 450,"Listed On: Saturday, August 1, 2015",Handguns,MasterPiece Arms                                                                                ,45 ACP                                                                                ,Striker Fire                                                                                ,Pistol,"Like new in case with all original paperwork.  Less than 50 rounds shot through it.  Side cocker.  Call REDACTED.  NO TEXTS!  Must have valid permit to buy pistols and valid IA Drivers License.  Might consider trades, depends on what you have."
501,http://www.armslist.com/posts/4569501,For Sale:  4 pmags,"burlington, Burlington, Vermont",$ 30,"Listed On: Saturday, August 1, 2015",Magazines,no type,no type,no type,no type,"I have 4 pmags, 3 black and one tan. All basically brand new, found out only metal mags work with my gun"
502,http://www.armslist.com/posts/4569502,For Sale:  1-30rd East German Bakelite 5.45x39mm magazine AK74,"PLANO, Dallas, Texas",$ 50,"Listed On: Saturday, August 1, 2015",Magazines,no type,no type,no type,no type,"1 Bakelite East German AK74 mag in 5.45x39. (NOT MARKED .223/5.56) 

Never shot and never placed in mag well. 

$50 CASH"
503,http://www.armslist.com/posts/4569503,For Trade:  Glock 19 Gen 2,"Franklin County, St. Louis, Missouri",Offer,"Listed On: Saturday, August 1, 2015",Handguns,Glock                                                                                ,9mm Luger (9x19)                                                                                ,Striker Fire                                                                                ,Pistol,"Relisting due to a trade falling through Up for trade is my Glock 19 Gen 2 9mm pistol has that classic glock reliability and is in great shape with the original tupperware case and 2 15 round magazines looking to trade mainly for a bigger caliber Looking for either a 1911, a Glock 21 or 30, or a Magnum Revolver 357 or greater"
505,http://www.armslist.com/posts/4569505,"For Sale/Trade:  Rainier arms/ Adams arms 7.5"" pistol upper + arm brace/tube","Spanaway, Tacoma, Washington",$ 650,"Listed On: Saturday, August 1, 2015",Gun,no type,no type,no type,no type,"The upper is a Rainer arms non forward assist upper, with an Adams arms lightweight bolt carrier + piston kit with a 4"" extended Samson rail. Right at 100 rounds fired, and runs great! 
(ACOG NOT included)

I also have for trade a kak industries pistol buffer/sig brace, and I prefer to trade/sell the package

I just got into reloading, so I'm looking to go for a wildcat caliber or 300blk/6.8 spc"
506,http://www.armslist.com/posts/4569506,For Sale:  New AK-47 M92PV Pistol,"Toney, Huntsville, Alabama",$ 800,"Listed On: Saturday, August 1, 2015",Rifles,Century International Arms                                                                                ,7.62x39                                                                                ,Semi-automatic,no type,"New AK-47 M92PV Pistol. Everything pictured comes with the item. Straight Site Posts, New Hogue Grip, SB-47 pistol brace and 5 magazines. Huntsville, Al area for pickup. 800 or best offer (worst  I can say is no)"
507,http://www.armslist.com/posts/4569507,"For Sale:  6.5 Creedmoor ammunition, Hornady 129 SST, 40 rounds.","SW, Bend, Oregon",$ 50,"Listed On: Saturday, August 1, 2015",Ammo,no type,no type,no type,no type,2 boxes (40 rounds total) of 6.5 Creedmoor 129 grain Hornady SST Superformance ammunition. Absolutely brand new. The Superformance line produces faster velocities than standard ammunition.
508,http://www.armslist.com/posts/4569508,Want To Buy:  Want to buy your guns and ammo.,"Canfield ohio, Youngstown, Ohio","$ 1,500","Listed On: Thursday, September 17, 2015",Rifles,no type,no type,no type,no type,I'm looking to buy any guns or ammo. Let me know what you have. Thanks
512,http://www.armslist.com/posts/4569512,For Sale/Trade:  Mossberg Bantam 100 ATR .243,"Muskogee/Tulsa, Tulsa, Oklahoma",$ 300,"Listed On: Friday, August 14, 2015",Rifles,Mossberg                                                                                ,243 Winchester                                                                                ,Bolt Action                                                                                ,Rifle,for sale is a mossberg bantam 100 atr chambered in .243. it has a 3-9x40 scope mounted on it. This is the model with removable stock sections to convert to youth model. 95% condition. 300 OBO. send email with number and i will text pictures.
513,http://www.armslist.com/posts/4569513,For Sale:  Howa 1500 .308,"Jackson Metro Area, Jackson, Mississippi",$ 300,"Listed On: Tuesday, September 8, 2015",Rifles,Howa                                                                                ,308/7.62 NATO                                                                                ,Bolt Action                                                                                ,Rifle,"Howa 1500 bolt action, .308, 22"" barrel. Good condition, bluing is 99%, some scratches on stock, perfect bore. Scope mounts, beavertail forend, sling studs. The Howa 1500 is the same as the Weatherby Vanguard.  Cash only. No trades. Face to face in the Jackson area. Buyer must be 18 or older and must show proof they are a MS resident."
515,http://www.armslist.com/posts/4569515,For Sale:  Smith & Wesson 38 special with crimson trace grips,"coburg rd, Eugene, Oregon",$ 650,"Listed On: Saturday, August 1, 2015",Handguns,Smith & Wesson                                                                                ,38 S&W Special                                                                                ,no type,Revolver,"model 36. Gun is in excellent condition, it's only been fired a few times"
517,http://www.armslist.com/posts/4569517,For Sale:  EoTech OPMOD XPS2-0,"Homewood, Birmingham, Alabama",$ 450,"Listed On: Saturday, August 1, 2015",Optics,no type,no type,no type,no type,Like new condition. Taken to the range twice and has been kept in my safe. Comes with original case.
519,http://www.armslist.com/posts/4569519,For Sale/Trade:  PARA EXPERT 1911 w/extras,"Salem, Salem, Oregon",$ 1,"Listed On: Saturday, August 1, 2015",Handguns,Para Ordnance                                                                                ,45 ACP                                                                                ,Single Action                                                                                ,Pistol,"1911 Para Expert with 4 magazines and a blackhawk holster in great/almost new condition
will add 50 rounds of federal ammo with it."
521,http://www.armslist.com/posts/4569521,For Sale:  Remington 700 BDL left handed with scope in 7mm mag,"Weatherford, Dallas, Texas",$ 700,"Listed On: Saturday, October 10, 2015",Rifles,Remington                                                                                ,7mm Remington Magnum                                                                                ,Bolt Action                                                                                ,Rifle,Remington 700 7mm mag left handed comes with Redfield 6X scope and 2 boxes of cartridges would consider trades for Winchester 94 in30/30 and smith and Wesson mod 10 not interested in any other trades
522,http://www.armslist.com/posts/4569522,For Sale:  LNIB glock 35,"Hendersonville, Nashville, Tennessee",$ 700,"Listed On: Saturday, August 1, 2015",Handguns,Glock                                                                                ,40 S&W,no type,no type,Bi-tone glock35 with 3 magazine's. Gun is in perfect condition only fired a few times.
523,http://www.armslist.com/posts/4569523,"For Sale:  Hi-Point carbine 45ACP, New in box. 2 magazines 17.5"" target model front grip","Tulsa / Broken Arrow, Tulsa, Oklahoma",$ 288,"Listed On: Saturday, August 1, 2015",Rifles,Hi Point                                                                                ,45 ACP                                                                                ,Semi-automatic                                                                                ,Rifle,"Hi-Point carbine semi-auto, 45ACP, New in box. 2 9 round magazines 17.5"" target model front grip,. $288 plus tax.
if interested text or call REDACTED"
524,http://www.armslist.com/posts/4569524,For Sale:  45 acp ammo,"east {baytown}, Houston, Texas",$ 250,"Listed On: Monday, August 10, 2015",Ammo,no type,no type,no type,no type,"520 rounds of 45 acp ammo factory fresh,,there is one box of 20 Winchester silver tips, a box of Winchester jacketed hollow points and some Remington and Winchester FMJ,,250 or best real offer,,,thanks"
525,http://www.armslist.com/posts/4569525,For Sale:  Complete AR-15 Lower,"South side, Grand Rapids, Michigan",$ 230,"Listed On: Saturday, August 1, 2015",Gun,no type,no type,no type,no type,Complete Spikes AR lower for sale.  Has Magpul moe grip and 6 pos. collapible stock.  Has had 10 rounds through it.  Price is $230 firm.  No trades and local pick up only.
526,http://www.armslist.com/posts/4569526,For Sale:  S&W M&P AR-15,"Dunedin, Tampa/St. Pete, Florida",$ 675,"Listed On: Saturday, August 1, 2015",Rifles,Smith & Wesson                                                                                ,223/5.56 NATO                                                                                ,Semi-automatic                                                                                ,Rifle,"Smith and Wesson M&P15 5.56mm rifle. Civilian AR15 similar to the military issue M16 or M4. You can fire .223 through it as well, but I don't know why you would want to.

Like new in original box with cable gun lock.

I bought this rifle new a year ago and have only taken it to the range once to sight it in, fired less than 50 rounds and it was meticulously cleaned after.

-Chrome-lined gas key 
-Chrome-lined bolt carrier
-6-position adjustable stock
-Magpul folding pop-up rear site
-30 round magazine

Please bring driver license for proof of age.

Sorry no trades, I need the cash since I am saving for an engagement ring. Can also take credit cards (I have a square card reader).

$675, Texts preferred REDACTED

I have two additional 30rnd magazines and about 300rnds of federal M855/SS109 green tip (steel penetrator) 5.56 ammo that I can include for another $125, $800 total (ammo/mags are no for sale unless rifle sells too)."
527,http://www.armslist.com/posts/4569527,For Sale:  Ruger American ranch rifle 223/5.56 camo,"ripley, Cincinnati, Ohio",$ 400,"Listed On: Saturday, August 1, 2015",Rifles,Ruger                                                                                ,223/5.56 NATO                                                                                ,Bolt Action                                                                                ,Rifle,Lightly used Ruger American rifle chambered in 223/5.56 and threaded barrel asking 400 for just the rifle or 550 for the rifle and scope. The scope is a Nikon P-223 3-9x40 with Leupold rings NO TRADES call or text REDACTED
528,http://www.armslist.com/posts/4569528,For Sale:  Converted saiga .308,"Arlington, Northern Virginia, Virginia","$ 1,500","Listed On: Tuesday, August 25, 2015",Rifles,Saiga                                                                                ,308/7.62 NATO                                                                                ,Semi-automatic                                                                                ,Rifle,Like the title says I have a converted saiga .308 for sale this is the 20inch barreled model. I am the second owner of the rifle so rounds count is unknown but it does not appear to be high given it is in excellent condition. It will come with 3 original saiga 8 round mags 1 SGM tactical 8 round mag and 1 20 round mag. Also the Russian posp 3-9x 1000 meter illuminated scope will be include asking 1500 no trades please need to find other projects.
529,http://www.armslist.com/posts/4569529,For Sale/Trade:  Gen 3 windowed PMags STEAL,"40/42, Raleigh / Durham / CH, North Carolina",$ 50,"Listed On: Saturday, August 1, 2015",Magazines,no type,no type,no type,no type,"Gen 3 windowed PMags black. 3 New In Wrap, 1 slightly used, tested 3 mags full, runs perfect. 1 FDE gen 2 windowed, slightly used, runs perfect also. 
 All 30 rounders. 4 Gen3 black windowed PMags + 1 FDE Gen2"
530,http://www.armslist.com/posts/4569530,For Sale/Trade:  Saiga 12,"Big Spring, Abilene, Texas","$ 1,300","Listed On: Saturday, August 1, 2015",Shotguns,Saiga                                                                                ,12 Gauge                                                                                ,Semi-automatic                                                                                ,Shotgun,Converted Saiga 12. $1300 or trade for 1911 in 10 mm.
531,http://www.armslist.com/posts/4569531,For Sale:  Savage  270win model 111,"coburg rd, Eugene, Oregon",$ 550,"Listed On: Friday, January 15, 2016",Rifles,Savage Arms                                                                                ,270 Winchester                                                                                ,Bolt Action                                                                                ,Rifle,This rifle is in excellent condition. Includes Redfield revolution 3- 9by40 scope
532,http://www.armslist.com/posts/4569532,For Sale:  IWI Tavor SAR-B18 With Extras,"Midland, Michigan, United States","$ 1,500","Listed On: Saturday, August 1, 2015",Rifles,Israel Weapon Industries                                                                                ,223/5.56 NATO                                                                                ,Semi-automatic                                                                                ,Rifle,"Like Brand new (18 rounds down the pipe) IWI Tavor .556/.223 Cold Hammer Forged Barrel this is the 18 inch barrel version. Upgraded Tavor Curved Buttpad by Manticore )70$). Also has the Manticore forearm rail and foregrip. Quick Detach sling swivels. Also has original box all original materials. This thing is almost brand new.  Location Midland, No trades except a scar, No low ballers."
