,url,title,location,price,post date,category,manufacturer,caliber,action,firearm type,postcontent
0,http://www.armslist.com/posts/4569000,For Sale:  For Sale:  5.56 / .223 ammo.  100 rounds Nosler Varmint Ballistic Tip Spitzer Boat Tail 55gr,"Beaverton, Portland, Oregon",$ 40,"Listed On: Saturday, August 1, 2015",Ammo,no type,no type,no type,no type,Title says it all.  100 rounds.
1,http://www.armslist.com/posts/4569001,"For Trade:  LNIB, FNH FNX-45 Tactical FDE","Yukon, Oklahoma City, Oklahoma",Offer,"Listed On: Saturday, August 1, 2015",Handguns,FN Herstal S.A.                                                                                ,45 ACP                                                                                ,Double / Single Action                                                                                ,Pistol,"Hi, up for trade is an LNIB, FNH FNX-45 Tactical that comes with 3, 15 round mags, FN marked carry bag, papers ect.. Everything from the factory. Has only had 75 rounds fired and is in LNIB condition. This is the FDE variant."
2,http://www.armslist.com/posts/4569002,Want To Buy:  im looking for a low reciver for a ar or any ar15 parts,"rogersville, Tri-cities, Tennessee",$ 1,"Listed On: Saturday, August 1, 2015",Rifles,American Tactical Imports                                                                                ,223/5.56 NATO                                                                                ,Semi-automatic,no type,want to buy ar 15 parts a lower most of all the lower....call or text REDACTED
5,http://www.armslist.com/posts/4569005,For Sale:  Mossberg 835,"Franklin, Milwaukee, Wisconsin",$ 250,"Listed On: Saturday, August 1, 2015",Shotguns,Mossberg                                                                                ,12 Gauge                                                                                ,Pump Action                                                                                ,Shotgun,"Mossberg 835 with forest camo, adjustable M4 style stock, and sling. 4 shot, 3in magnum chamber, side saddle shell holder, easily insertable choke (and tool)"
7,http://www.armslist.com/posts/4569007,For Sale:  (J) - Ruger 22/45 MK III pistol - new - two magazines - adj. sights,"Hoquiam Aberdeen, Olympia, Washington",$ 330,"Listed On: Monday, September 14, 2015",Handguns,Ruger                                                                                ,22 Long Rifle                                                                                ,Single Action                                                                                ,Pistol,"Hi! This is Keith at Hoquiam handguns with another quality firearm. Email me at REDACTED or give me a call at REDACTED and lets get a gun in your hands! Transfers are only $20! Come see me for all of your new and used gun needs! I try to keep normal hours 9-5, but give me a call before you come visit just to be on the safe side. I'm located at: 1216 Broadway Ave Hoquiam WA 98550 REDACTED --------------------------------------------------------------------------------------------------- Come check it out!. -------------------------------------------------------------------------------------------------- All firearms listed on Armslist are also available in our store. All listings are subject to prior sale."
8,http://www.armslist.com/posts/4569008,For Sale/Trade:  XDS 45 7 mags!!,"Aurora, Denver, Colorado",$ 560,"Listed On: Saturday, August 1, 2015",Handguns,Smith & Wesson                                                                                ,45 ACP                                                                                ,Striker Fire                                                                                ,Pistol,"This is not the essential kit xds 45. So it comes with the large locking case, hip holster, mag holster, three 7 round and 5 round magizines, and one 6 round.  Less then 100 rounds fired.
I will pay the Background check at Damage Factory
Perfect for conceal carry.
not your
glock 
smith and wesson"
9,http://www.armslist.com/posts/4569009,For Sale:  Hi Point 40,"Milford, Nashua, New Hampshire",$ 180,"Listed On: Saturday, August 1, 2015",Handguns,Hi Point                                                                                ,40 cal                                                                                ,Double Action                                                                                ,Pistol,"I have a brand new Hi Point 40 caliber, it's in a box and has never been fired,"
11,http://www.armslist.com/posts/4569011,"For Sale/Trade:  Springfield Armory XDs 3.3"" 9mm","West side, Great Falls, Montana",$ 450,"Listed On: Monday, August 17, 2015",Handguns,Springfield                                                                                ,45 ACP                                                                                ,Striker Fire                                                                                ,Pistol,"Lightly used and we'll cared for pistol. Apx 500 rds through it and no malfunctions. Included is original hard case, original holster, lock, cleaning brush, replacement fiber optic sights, 2 5 rd mags with Pierce grip extensions, original base plates, 3 7 rd mags with grip sleeves, Crossbreed premium cowhide appendix holster, 2 leather belt mag carriers, 20 rds of Hornady Critical Duty ammo and all the original manuals and paper work. Has small bacstrap on it. I recently moved and can't find the large back strap or double mag carrier. Only selling this to transition to 9mm due to arthritis in hands and I can no longer get in much practice time. Will consider trade for Glock 26 Gen 4. Absolutely no shipping. F2F to MT residents only. Cal or txt Four06-7 eight8-1five4six for more info or pics."
12,http://www.armslist.com/posts/4569012,For Sale:  Glock 17 gen 3 w/ 50 rds of 9mm ammo,"Edmond, Stillwater, Oklahoma City, Oklahoma",$ 500,"Listed On: Saturday, August 1, 2015",Handguns,Glock                                                                                ,9mm Luger (9x19)                                                                                ,Double / Single Action                                                                                ,Pistol,"Selling my Glock 17 Gen 3 with Cerakote slide

Comes with 50 rds of 9mm ammo

Includes gun and ammo holsters

Text me @ REDACTED


For $500 firm. 

Not taking trades or any offers"
13,http://www.armslist.com/posts/4569013,For Sale:  Remington 572 PUMP .22 cal rifle,"SALINA, Kansas, United States",$ 245,"Listed On: Saturday, October 17, 2015",Rifles,Remington                                                                                ,22 Long Rifle                                                                                ,Pump Action                                                                                ,Rifle,"Remington Model 572 pump action .22 caliber rifle, shoots Shorts, Longs, or Long Rifle.  Stock has been refinished as has the metal.  The receiver on these is aluminum, what it really needs is a high gloss paint or cerakote.  Rifle functions and shoots great (hits a little to the right for me...).
Located in Salina.  Email or call/text REDACTED
As for round count, hellifino...probably around 3.5 million or so.  :-)"
15,http://www.armslist.com/posts/4569015,For Trade:  FDE M&P9c with extras trade for Glock 27 or?,"Colerain Twp, Cincinnati, Ohio",Offer,"Listed On: Sunday, August 30, 2015",Handguns,Smith & Wesson                                                                                ,9mm Luger (9x19)                                                                                ,Striker Fire                                                                                ,Pistol,"I have a Excellent condition M&P9c in FDE with no thumb safety and no magazine safety  . Received this as a gift and have put 100rds of winchester white box down it. Comes with 4 mags 3 have pinky extensions and everything from the factory aswell as the original purchase receipt so u can get the warrenty as I've never filled out the card. Also I have a safariland Quick Release holster in FDE and 86rds Whichester Elite L.E.O. BHP that can be included for a good fair deal .
F2F local trade only trade value around 500$"
16,http://www.armslist.com/posts/4569016,For Trade:  Glock 23 trade for a glock 27,"North vernon, Indiana, United States",Offer,"Listed On: Saturday, August 1, 2015",Handguns,Glock                                                                                ,40 S&W                                                                                ,Striker Fire                                                                                ,Pistol,Gen 4 glock 23 I want to trade for a gen 4 glock 27 this is not for sale and only interested in the gun listed email or text REDACTED
17,http://www.armslist.com/posts/4569017,For Sale:  Ruger New Model BlackHawk Flattop .44 Special - Blued,"Beavercreek, Dayton, Ohio",$ 450,"Listed On: Saturday, August 1, 2015",Handguns,Ruger                                                                                ,44 Special                                                                                ,Single Action                                                                                ,Revolver,"Ruger New Model BlackHawk Flattop .44 Special - Blued
Brand New - Only been fired by manufacturer. Have documentation."
18,http://www.armslist.com/posts/4569018,For Sale:  German Luger 9mm,"Phoenix, Phoenix, Arizona",$ 850,"Listed On: Wednesday, September 9, 2015",Handguns,Steyr                                                                                ,9mm Luger (9x19)                                                                                ,Single Action                                                                                ,Pistol,"This German Luger is in very good condition only one part is not matching on it, it has some nice pearl grips. This is a great piece of history for anyone to have and functions great too.Please Call us at REDACTED or email us at REDACTED or you can come into our shop at 3217 E. Shea Blvd suite #3 Tuesday-Saturday 10am-7pm"
19,http://www.armslist.com/posts/4569019,For Sale:  Ruger 22/45 10rd .22lr Magazine,"Westminster, Denver, Colorado",$ 23,"Listed On: Thursday, January 28, 2016",Magazines,no type,no type,no type,no type,New in package
21,http://www.armslist.com/posts/4569021,For Sale:  NEED BRASS? GOT BRASS!,"Missouri, Missouri, United States",$ 1,"Listed On: Saturday, August 1, 2015",Reloading,no type,no type,no type,no type,"I have a large estate sale find that has many diverse calibers. Some common, some not.

Available: 270 ,25-06 ,243,30-30, 45-70, 7-08   A little off beat: 257R+P, 308MrlExp, 35Rem, 35Whelen, 8x57JRS, 6,5Creedmore,  6.5Grendel, 300H&H. 

 Big pistol: 50AE, 454 Cassul ,460S&W, 44Mag

EMAIL ME YOUR NEEDS AND HOW MANY YOU ARE LOOKING FOR
EMAIL FOR FULL DETAILS THANKS"
22,http://www.armslist.com/posts/4569022,"For Sale:  10rds of Hornady Zombie Max 12 Gauge 00 Buck 2-3/4""","Sacramento, Sacramento, California",$ 15,"Listed On: Monday, December 21, 2015",Ammo,no type,no type,no type,no type,"12 Gauge 8 pellets of 00 Buckshot 2-3/4"" shell 1600 fps new manufactured"
23,http://www.armslist.com/posts/4569023,For Sale/Trade:  m4 a3 flattop upper and AH marked removable carry handle,"pine plains, Hudson Valley, New York",$ 110,"Listed On: Saturday, August 1, 2015",Gun,no type,no type,no type,no type,i have a m4 a3 flattop upper and detach carry handle for sale i would like to see $110 but any resonable offer is accepted...
24,http://www.armslist.com/posts/4569024,For Sale:  (J) S&W model 422 pistol - two magazines - nice shape,"Hoquiam, Olympia, Washington",$ 320,"Listed On: Monday, September 14, 2015",Handguns,Smith & Wesson                                                                                ,22 Long Rifle                                                                                ,Single Action                                                                                ,Pistol,"Hi! This is Keith at Hoquiam handguns with another quality firearm. Email me at REDACTED or give me a call at REDACTED and lets get a gun in your hands! Transfers are only $20! Come see me for all of your new and used gun needs! I try to keep normal hours 9-5, but give me a call before you come visit just to be on the safe side. I'm located at: 1216 Broadway Ave Hoquiam WA 98550 REDACTED --------------------------------------------------------------------------------------------------- Come check it out!. -------------------------------------------------------------------------------------------------- All firearms listed on Armslist are also available in our store. All listings are subject to prior sale."
25,http://www.armslist.com/posts/4569025,"For Sale:  Like new 30-06 Ruger American Rifle w/ Scope, Ammo, Case, Bench Rest!","Lookout Valley, Chattanooga, Tennessee",$ 550,"Listed On: Saturday, August 1, 2015",Rifles,Ruger                                                                                ,30-06 Springfield                                                                                ,Bolt Action                                                                                ,Rifle,"I'm selling my Ruger American Rifle, 30-06.  I was going to pick up hunting as a hobby, but I really don't have the time with work and fishing.  I've shot 25 or so rounds through it to get it sighted in.

It comes with a like new Nikon Prostaff BDC scope, MTM Front Rifle Rest, Plano rifle case, and around 50 rounds of ammo.

Gun=$390, Case=$20, Rifle Rest=$25, Ammo=$40, Scope=$150.  Total purchase price was about $625.  I will sell everything for $550."
27,http://www.armslist.com/posts/4569027,"Want To Buy:  VZ58 / VZ 2008 buffer tube adapter, or Recoil Reducing Buffer Tube","live by Mankato so anything in between, Minneapolis / St. Paul, Minnesota",Offer,"Listed On: Saturday, January 30, 2016",Gun,no type,no type,no type,no type,Would consider regular non-folding stock with hardware
30,http://www.armslist.com/posts/4569030,For Sale:  Century RAS-47 AKM 7.62x39 Rifle,"Westminster, Denver, Colorado",$ 650,"Listed On: Sunday, December 6, 2015",Rifles,Century International Arms                                                                                ,7.62x39                                                                                ,Semi-automatic                                                                                ,Rifle,"New in box, Comes with two 30rd mags.  Stamped receiver version of the Centurion 39V2."
33,http://www.armslist.com/posts/4569033,For Sale:  Smith and Wesson Model 60 No Dash With Laser  S P M !!!,"N. E. GA  Gainesville, Atlanta, Georgia",$ 550,"Listed On: Sunday, January 10, 2016",Handguns,Smith & Wesson                                                                                ,38 S&W Special                                                                                ,Double / Single Action                                                                                ,Revolver,WOW! Smith and Wesson model 60 No Dash comes with a Laser Max Laser. Awesome condition! Comes with factory standard wood grips. Real Keeper! Classic CCW! Only $525.00 AWESOME CARRY / REDUCED PRICE !!!    S P M !!!
34,http://www.armslist.com/posts/4569034,For Sale/Trade:  Ready to Shoot AR *offer*,"Jacksonville, Jacksonville, North Carolina",$ 10,"Listed On: Saturday, August 1, 2015",Rifles,no type,223/5.56 NATO                                                                                ,Semi-automatic                                                                                ,Rifle,"Brand new eotech 512
Diamond Eye BUIS
Stag model 8 Gas Piston less than 300 rounds
Magpul stock, bolt lever, pistol grip
New Hennessy trigger assembly
3pmags
250rounds
REDACTED"
35,http://www.armslist.com/posts/4569035,For Sale:  Ruger SR22,"Deep Creek Chesapeake, Hampton Roads, Virginia",$ 325,"Listed On: Saturday, August 1, 2015",Handguns,Ruger                                                                                ,22 Long Rifle                                                                                ,Double Action                                                                                ,Pistol,"Ruger SR22 with threaded Barrel option, two mags, original case, and mag extender option. Both original grip options and owners manual. Gun has only had about 20 rounds through it.
It is in perfect condition.
Asking 325.00 OBO
Call or text Tony - seven 5 seven - 2 five 1 - eight 3 seven 2"
36,http://www.armslist.com/posts/4569036,For Sale/Trade:  Glock 22 Generation 3,"Russellville, Conway, Little Rock, Arkansas",$ 700,"Listed On: Tuesday, October 6, 2015",Handguns,Glock                                                                                ,40 S&W                                                                                ,Double Action                                                                                ,Pistol,Up for sale or trade is a Glock 22 gen 3. The Glock comes with 4 magazines and 500 rds of .40 cal ammo. Will sell the whole package for $700. Will not sell just the pistol because I won't need the ammo after its gone. Price is firm and reasonable. Gun is in excellent shape and has been cleaned and oiled after every use.
37,http://www.armslist.com/posts/4569037,Want To Buy:  wtb keltec pf9,"south, Springfield, Missouri",Offer,"Listed On: Saturday, August 1, 2015",Handguns,Kel-Tec,no type,no type,no type,Wtb keltec pf9. If you have one you'd like to sell call text or email me. REDACTED
38,http://www.armslist.com/posts/4569038,"For Sale:  S&W m&p 15-22 with vortex strike fire, 5.11 vtac bag and 750 rounds","Stuart, Palm Beach, South Florida",$ 650,"Listed On: Saturday, August 1, 2015",Rifles,Smith & Wesson                                                                                ,22 Long Rifle                                                                                ,Semi-automatic                                                                                ,Rifle,"I'm looking to sell this complete rifle set up. It is a great gun to train with, without spending hundreds of dollars in 5.56 ammo. The controls mimic the ar15.
m&p 15-22. Retails for around $450
Vortex strikefire with mount. About $200
5.11 Vtac rifle case retails for around $150
750 rounds of federal ammunition- about $50 

To get this exact same setup it would cost around $850. I am willing to let it go for $650. The fastest way to reach me is to call or text me at REDACTED"
39,http://www.armslist.com/posts/4569039,For Sale:  Colt M1911 45,"southeast, Colorado Springs, Colorado",FREE,"Listed On: Saturday, August 1, 2015",Handguns,Colt                                                                                ,45 ACP                                                                                ,Single Action                                                                                ,Pistol,Colt M1911 45 cal.serial number shows manufactured in 1918. gun has been plated by previous owner who was a Naval Officer during WWII . Make Offer
40,http://www.armslist.com/posts/4569040,"For Sale:  New, never fired 9mm","Brandon/Valrico, Tampa/St. Pete, Florida",$ 230,"Listed On: Friday, August 7, 2015",Handguns,Century International Arms                                                                                ,9mm Luger (9x19)                                                                                ,Double / Single Action                                                                                ,Pistol,Century International Arms 9mm. New in the original box with paperwork.  Comes with 2 clips and a box of ammo. Transaction to be in or near Brandon with proper ID and willing to sign a bill of sale. Call or text REDACTED if interested. 1st 230.00.
41,http://www.armslist.com/posts/4569041,For Sale:  Colt A1 Upper,"Cleveland, Chattanooga, Tennessee",$ 200,"Listed On: Monday, August 10, 2015",Gun,no type,no type,no type,no type,for sale is a colt a1 upper with teardrop forward assist.also comes with a carry handle scope mount.
42,http://www.armslist.com/posts/4569042,"For Sale:  Mathews Z7 ""obo""","Midwest City, Oklahoma City, Oklahoma",$ 700,"Listed On: Saturday, August 1, 2015",Archery,no type,no type,no type,no type,Have a Mathews Z7 65# DW 28.5 DL have Rival FX 5 pin and True Glo quiver and True Glo stabilizer. Nice hard case and arrows with muzzy 3 blade broad heads. Package Deal ready to hunt. Want $700 obo. Hit me up on here or text/call located in Midwest City REDACTED. Have an extra 3 pin sight I'll throw in. Oh yeah lighted nocks on arrows red color.
43,http://www.armslist.com/posts/4569043,"For Sale:  Sig Sauer SP2022, 9mm LNIB","Winter Park, Orlando, Florida",$ 390,"Listed On: Saturday, September 5, 2015",Handguns,Sig Sauer                                                                                ,9mm Luger (9x19)                                                                                ,Double / Single Action                                                                                ,Pistol,"** PRICE DROP **

Up for sale is a LNIB Sig Sauer SP2022 chambered in 9mm. Offered in bi-tone, this gun is every bit as sweet shooting as my P227.  It was primarily a safe queen, and spent some time as a car gun, so it's blemish free. Less than 200 rounds down range. I just don't shoot it enough to keep right now. Not really interested in trades at the moment. Comes with one mag, two changeable back straps, hard case, and the factory Sig accessory rail laser (unopened). Try to find a Sig of this quality under $400, you can't. Must be a CCW permit holder and be willing to sign a bill of sale. Will meet anywhere in the greater Orlando area. Need to move this one quickly. $390"
44,http://www.armslist.com/posts/4569044,For Sale:  MM ROMANIAN M10 Ak47,"elk city, Oklahoma, United States","$ 1,100","Listed On: Saturday, August 1, 2015",Rifles,no type,7.62x39                                                                                ,Semi-automatic,no type,Ak47 with all these extras for sale. I don't want to part with any of this but I have to have a surgery and need cash. I'm the original owner. I've ran 500 rounds through it and cleaned it after every time I've shot it. It all goes together or not at all. Price isn't negotiable. Call or text 5eight08two1zero7five6
45,http://www.armslist.com/posts/4569045,For Sale/Trade:  Remington vtr,"North Weat, Colorado Springs, Colorado",$ 650,"Listed On: Saturday, August 1, 2015",Rifles,Remington                                                                                ,308/7.62 NATO                                                                                ,Bolt Action                                                                                ,Rifle,"Putting up my VTR in 308 up for sale or trade. Would prefer to sell but open to trades. I have put 40 rounds thru it. It is in perfect condition it comes with everything pictured minus the scope. Also have 100 rounds of 308 I can add to the deal or sell for extra. If interested call or text REDACTED

Not interested in anything Taurus, no smith and Wesson handguns, no old junk shotguns, no growing equipment, would be interested in a nice 357 or other revolvers, AK or AR, possibly another bolt action. Let me know what you have"
47,http://www.armslist.com/posts/4569047,For Sale:  Like New Firearms,"Waynesville, Dayton, Ohio",$ 300,"Listed On: Saturday, August 1, 2015",Handguns,Ruger                                                                                ,380 ACP                                                                                ,Double Action                                                                                ,Pistol,"Unused Ruger LCP380 $325.00
Unused Hi-Point .45 ACP Carbine with Red-Dot Scope $295.00
Lightly Used Llama .45 ACP 1911 $350.00"
48,http://www.armslist.com/posts/4569048,For Trade:  glock 17 gen3,"Edmond, Oklahoma City, Oklahoma",Offer,"Listed On: Friday, August 7, 2015",Handguns,Glock,no type,no type,no type,"Nicely modified g17 gen 3 with extended everything Warren tactical sights fiber optic front. polished internals and barrel. Stippled. zev trigger springs 3.5lb connector punisher back plate. 2 19 round mags and box. 
Message for more info or pics."
49,http://www.armslist.com/posts/4569049,Want To Buy:  Harrington & Richardson 22,"Carriere,  MS, Gulfport / Biloxi, Mississippi",$ 150,"Listed On: Saturday, August 1, 2015",Handguns,H&R                                                                                ,22 Long Rifle                                                                                ,Double Action                                                                                ,Revolver,"Would like to purchase an H&R 22 premier top break that would handle smokeless powder rounds.  Should be marked "" 22 rimfire "" on left side of barrel."
